366.16 ,Senile nuclear sclerosis,Diseases of the nervous system,9421,123,1.9,0.000000000149667,1.57,2.27
848.9 ,Unspecified site of sprain and...,Injury and poisoning,94525,1135,1.89,1.830936e-72,1.77,2.01
478.4 ,Polyp of vocal cord or larynx,Diseases of the respiratory system,4532,59,1.89,0.0000095225407,1.43,2.44
465.9 ,Acute upper respiratory infections...,Diseases of the respiratory system,676105,5404,1.88,8.863687e-91,1.76,2.01
727.43 ,"Ganglion, unspecified",Diseases of the musculoskeletal...,4079,53,1.88,0.0000279391,1.41,2.47
698.9 ,Unspecified pruritic disorder,Diseases of the skin and subcutaneous...,36702,460,1.87,3.242255e-32,1.69,2.06
883.0 ,"Open wound of finger(s), without...",Injury and poisoning,20318,259,1.87,2.40615e-19,1.65,2.12
525.9 ,Unspecified disorder of the teeth...,Diseases of the digestive system,1395,18,1.86,0.014182687,1.1,2.96
722.10 ,Displacement of lumbar intervertebral...,Diseases of the musculoskeletal...,22599,285,1.86,1.325499e-20,1.64,2.09
300.89 ,Other somatoform disorders,Mental disorders,6801,87,1.86,0.00000016518718,1.48,2.3
719.44 ,"Pain in joint, hand",Diseases of the musculoskeletal...,4945,63,1.85,0.000010113,1.41,2.37
372.8 ,Other disorders of conjunctiva,Diseases of the nervous system,2518,32,1.84,0.0016034695,1.25,2.6
385.32 ,Cholesteatoma of middle ear,Diseases of the nervous system,3060,39,1.84,0.0004444732,1.31,2.53
715.91 ,"Osteoarthrosis, unspecified whether...",Diseases of the musculoskeletal...,1490,19,1.84,0.0120754313,1.1,2.89
719.9 ,Unspecified disorder of joint,Diseases of the musculoskeletal...,2441,31,1.84,0.00203634,1.24,2.61
597.80 ,"Urethritis, unspecified",Diseases of the genitourinary...,19083,240,1.84,2.446079e-17,1.61,2.1
726.73 ,Calcaneal spur,Diseases of the musculoskeletal...,2754,35,1.84,0.0011457565,1.28,2.56
727.00 ,"Synovitis and tenosynovitis, unspecified",Diseases of the musculoskeletal...,106822,1243,1.84,2.268543e-72,1.72,1.95
575.0 ,Acute cholecystitis,Diseases of the digestive system,2766,35,1.83,0.0011759373,1.27,2.55
473.8 ,Other chronic sinusitis,Diseases of the respiratory system,2528,32,1.83,0.0016569436,1.25,2.59
712 ,Crystal arthropathies,Diseases of the musculoskeletal...,1509,19,1.82,0.0182834535,1.09,2.85
847 ,Sprains and strains of other and...,Injury and poisoning,1667,21,1.82,0.0111030561,1.12,2.79
487.0 ,Influenza with pneumonia,Diseases of the respiratory system,3726,47,1.82,0.0001559773,1.34,2.43
491.21 ,Obstructive chronic bronchitis...,Diseases of the respiratory system,4602,58,1.82,0.0000366171,1.38,2.37
698.8 ,Other specified pruritic conditions,Diseases of the skin and subcutaneous...,8161,102,1.81,0.000000048290843,1.48,2.21
788.0 ,Renal colic,"Comorbidities, signs, and ill-defined...",8424,105,1.81,0.000000036582226,1.48,2.2
703.0 ,Ingrowing nail,Diseases of the skin and subcutaneous...,1673,21,1.81,0.0113194239,1.12,2.78
813 ,Fracture of radius and ulna,Injury and poisoning,2080,26,1.81,0.0051292043,1.18,2.66
715.98 ,"Osteoarthrosis, unspecified whether...",Diseases of the musculoskeletal...,5200,65,1.81,0.000012012,1.39,2.31
726.5 ,Enthesopathy of hip region,Diseases of the musculoskeletal...,2000,25,1.81,0.0064297723,1.16,2.68
729.4 ,"Fasciitis, unspecified",Diseases of the musculoskeletal...,86951,1018,1.81,3.397004e-59,1.69,1.94
995.3 ,"Allergy, unspecified, not elsewhere...",Injury and poisoning,11079,138,1.81,0.0000000002741003,1.52,2.15
110.2 ,Dermatophytosis of hand,Infectious and parasitic diseases,2318,29,1.81,0.0035933145,1.21,2.61
693.0 ,Dermatitis due to drugs and medicines...,Diseases of the skin and subcutaneous...,4996,62,1.8,0.0000251025,1.37,2.31
840.4 ,Rotator cuff (capsule) sprain,Injury and poisoning,3300,41,1.8,0.0006979297,1.29,2.44
574.5 ,Calculus of bile duct without...,Diseases of the digestive system,1604,20,1.8,0.0148033626,1.1,2.79
719.4 ,Pain in joint,Diseases of the musculoskeletal...,19927,245,1.8,1.22801e-16,1.58,2.05
721.91 ,"Spondylosis of unspecified site,...",Diseases of the musculoskeletal...,1850,23,1.8,0.0106701033,1.13,2.7
723.1 ,Cervicalgia,Diseases of the musculoskeletal...,36096,438,1.8,8.717211e-28,1.63,1.99
959.9 ,Unspecified site injury,Injury and poisoning,1527,19,1.8,0.0190256026,1.08,2.82
038 ,Septicemia,Infectious and parasitic diseases,1929,24,1.8,0.0083383577,1.15,2.68
296.20 ,"Major depressive affective disorder,...",Mental disorders,3712,46,1.79,0.0003230751,1.31,2.4
722 ,Intervertebral disc disorders,Diseases of the musculoskeletal...,4606,57,1.79,0.00005615,1.35,2.33
729.1 ,"Myalgia and myositis, unspecified",Diseases of the musculoskeletal...,164029,1788,1.79,2.25975e-87,1.69,1.89
709.8 ,Other specified disorders of skin,Diseases of the skin and subcutaneous...,9951,122,1.78,0.0000000068175915,1.48,2.13
535.01 ,"Acute gastritis, with hemorrhage",Diseases of the digestive system,2997,37,1.78,0.0012649271,1.25,2.47
847.1 ,Sprain of thoracic,Injury and poisoning,3650,45,1.78,0.000423149,1.3,2.39
719.43 ,"Pain in joint, forearm",Diseases of the musculoskeletal...,1700,21,1.78,0.0124486148,1.1,2.74
595.89 ,Other specified types of cystitis,Diseases of the genitourinary...,1540,19,1.78,0.0196718917,1.07,2.79
724.02 ,"Spinal stenosis, lumbar region,...",Diseases of the musculoskeletal...,19326,235,1.78,0.000000000000001688131,1.56,2.03
724.5 ,"Backache, unspecified",Diseases of the musculoskeletal...,152050,1666,1.78,7.777064e-82,1.68,1.88
782.1 ,Rash and other nonspecific skin...,"Comorbidities, signs, and ill-defined...",8164,100,1.78,0.00000015601905,1.44,2.17
528.0 ,Stomatitis,Diseases of the digestive system,19434,235,1.77,0.000000000000003947494,1.55,2.02
789.9 ,Other symptoms involving abdomen...,"Comorbidities, signs, and ill-defined...",2535,31,1.77,0.0037067325,1.2,2.52
535.1 ,Atrophic gastritis,Diseases of the digestive system,1471,18,1.77,0.0258154994,1.04,2.8
842.19 ,Other sprains and strains of hand,Injury and poisoning,1465,18,1.77,0.0254598506,1.05,2.81
569.3 ,Hemorrhage of rectum and anus,Diseases of the digestive system,3025,37,1.77,0.0013649131,1.24,2.44
577.0 ,Acute pancreatitis,Diseases of the digestive system,2849,35,1.77,0.0020779115,1.23,2.48
358.9 ,"Myoneural disorders, unspecified",Diseases of the nervous system,3422,42,1.77,0.0006137761,1.27,2.41
728.9 ,"Unspecified disorder of muscle,...",Diseases of the musculoskeletal...,28140,338,1.77,6.501025e-21,1.58,1.98
692.8 ,"Contact dermatitis and other eczema,...",Diseases of the skin and subcutaneous...,3535,43,1.76,0.0007354892,1.27,2.38
716.90 ,"Arthropathy, unspecified, site...",Diseases of the musculoskeletal...,65711,761,1.76,8.899664e-42,1.63,1.9
724.0 ,"Spinal stenosis, other than cervical",Diseases of the musculoskeletal...,2793,34,1.76,0.0027542458,1.21,2.47
726.6 ,Enthesopathy of knee,Diseases of the musculoskeletal...,5336,65,1.76,0.0000314638,1.36,2.25
216.7 ,Benign neoplasm of skin of lower...,Neoplasms,1810,22,1.75,0.0148672814,1.1,2.67
590.10 ,Acute pyelonephritis without lesion...,Diseases of the genitourinary...,9385,113,1.75,0.000000065969933,1.44,2.11
680.9 ,Carbuncle and furuncle of unspecified...,Diseases of the skin and subcutaneous...,17459,209,1.75,0.0000000000002802993,1.52,2.01
733.1 ,Pathological fracture,Diseases of the musculoskeletal...,2231,27,1.75,0.0069083263,1.15,2.55
110.8 ,Dermatophytosis of other specified...,Infectious and parasitic diseases,1493,18,1.74,0.0273355423,1.03,2.76
372.20 ,"Blepharoconjunctivitis, unspecified",Diseases of the nervous system,11898,142,1.74,0.0000000023194216,1.46,2.05
707.9 ,Chronic ulcer of unspecified site,Diseases of the skin and subcutaneous...,1908,23,1.74,0.0124290131,1.1,2.62
713.5 ,Arthropathy associated with neurological...,Diseases of the musculoskeletal...,1904,23,1.74,0.012273874,1.1,2.63
714.0 ,Rheumatoid arthritis,Diseases of the musculoskeletal...,26778,317,1.74,8.387168e-19,1.55,1.95
722.71 ,Intervertebral disc disorder with...,Diseases of the musculoskeletal...,2571,31,1.74,0.0040630997,1.18,2.48
337.9 ,Unspecified disorder of autonomic...,Diseases of the nervous system,2242,27,1.74,0.0071375261,1.14,2.54
464.10 ,Acute tracheitis without mention...,Diseases of the respiratory system,102521,1146,1.74,3.151856e-57,1.63,1.86
370.4 ,Other and unsppecified keratoconjunctivitis,Diseases of the nervous system,1494,18,1.74,0.0274127498,1.03,2.76
511.9 ,Unspecified pleural effusion,Diseases of the respiratory system,1655,20,1.74,0.0176046967,1.06,2.7
784.0 ,Headache,"Comorbidities, signs, and ill-defined...",236740,2407,1.74,1.316659e-95,1.65,1.83
372.41 ,"Peripheral pterygium, stationary",Diseases of the nervous system,2085,25,1.73,0.0112991153,1.12,2.56
214.9 ,"Lipoma, unspecified site",Neoplasms,3089,37,1.73,0.0021904107,1.21,2.39
593.9 ,Unspecified disorder of kidney...,Diseases of the genitourinary...,2917,35,1.73,0.0024428113,1.2,2.42
511.0 ,Pleurisy without mention of effusion...,Diseases of the respiratory system,1501,18,1.73,0.0279730944,1.02,2.75
131.00 ,"Urogenital trichomoniasis, unspecified",Infectious and parasitic diseases,2682,32,1.72,0.004817803,1.17,2.44
715.16 ,"Osteoarthrosis, localized, primary,...",Diseases of the musculoskeletal...,35504,412,1.72,9.793257e-23,1.55,1.9
350.1 ,Trigeminal neuralgia,Diseases of the nervous system,3189,38,1.72,0.0018485949,1.21,2.37
729.0 ,"Rheumatism, unspecified and fibrositis",Diseases of the musculoskeletal...,11508,136,1.72,0.0000000098629946,1.44,2.04
729.5 ,Pain in limb,Diseases of the musculoskeletal...,19095,225,1.72,0.0000000000001543875,1.5,1.97
738.4 ,Acquired spondylolisthesis,Diseases of the musculoskeletal...,12595,149,1.72,0.0000000016950928,1.45,2.03
786.2 ,Cough,"Comorbidities, signs, and ill-defined...",87022,970,1.71,3.623919e-47,1.6,1.83
788.2 ,Retention of urine,"Comorbidities, signs, and ill-defined...",2443,29,1.71,0.0068696566,1.14,2.47
844 ,Sprains and strains of knee and...,Injury and poisoning,1851,22,1.71,0.0166308854,1.07,2.61
595.9 ,"Cystitis, unspecified",Diseases of the genitourinary...,50638,578,1.71,5.159369e-30,1.56,1.86
726.4 ,Enthesopathy of wrist and carpus,Diseases of the musculoskeletal...,2790,33,1.71,0.0041039793,1.17,2.41
070 ,Viral hepatitis,Infectious and parasitic diseases,2707,32,1.71,0.005066498,1.16,2.42
529.0 ,Glossitis,Diseases of the digestive system,2722,32,1.7,0.0052505004,1.16,2.4
715.17 ,"Osteoarthrosis, localized, primary,...",Diseases of the musculoskeletal...,2297,27,1.7,0.0111411201,1.11,2.48
276.5 ,Volume depletion,"Endocrine, nutritional and metabolic...",5950,70,1.7,0.0000426289,1.32,2.16
427.89 ,Other specified cardiac dysrhythmias,Diseases of the circulatory system,8190,96,1.7,0.0000018914715,1.37,2.08
726.9 ,Unspecified enthesopathy,Diseases of the musculoskeletal...,8699,102,1.7,0.0000010112495,1.38,2.07
682 ,Other cellulitis and abscess,Diseases of the skin and subcutaneous...,4690,55,1.7,0.0002853358,1.27,2.21
784.1 ,Throat pain,"Comorbidities, signs, and ill-defined...",13897,162,1.7,0.000000001060473,1.44,1.99
883.1 ,"Open wound of finger(s), complicated",Injury and poisoning,3848,45,1.69,0.0012318594,1.23,2.27
611.7 ,Signs and symptoms in breast,Diseases of the genitourinary...,2655,31,1.69,0.0067349837,1.14,2.4
349.9 ,Unspecified disorders of nervous...,Diseases of the nervous system,20172,233,1.69,0.0000000000004803189,1.47,1.93
681.11 ,Onychia and paronychia of toe,Diseases of the skin and subcutaneous...,7013,82,1.69,0.0000133919,1.34,2.11
682.0 ,Cellulitis and abscess of face,Diseases of the skin and subcutaneous...,2908,34,1.69,0.0048453978,1.17,2.37
708.9 ,"Urticaria, unspecified",Diseases of the skin and subcutaneous...,81017,894,1.68,1.331628e-41,1.57,1.81
590.1 ,Acute pyelonephritis,Diseases of the genitourinary...,2321,27,1.68,0.0117261349,1.1,2.45
428.0 ,"Congestive heart failure, unspecified",Diseases of the circulatory system,12912,149,1.68,0.0000000074429942,1.42,1.98
722.90 ,"Other and unspecified disc disorder,...",Diseases of the musculoskeletal...,3691,43,1.68,0.0014332184,1.21,2.27
723.8 ,Other syndromes affecting cervical...,Diseases of the musculoskeletal...,2839,33,1.68,0.0061950837,1.15,2.36
349.89 ,Other specified disorders of nervous...,Diseases of the nervous system,5176,60,1.68,0.0002098209,1.28,2.16
726.64 ,Patellar tendinitis,Diseases of the musculoskeletal...,1456,17,1.68,0.0389949977,0.98,2.71
354.9 ,"Mononeuritis of upper limb, unspecified",Diseases of the nervous system,2839,33,1.68,0.0061950837,1.15,2.36
756.12 ,Spondylolisthesis,Congenital anomalies,8885,103,1.68,0.0000013395663,1.37,2.04
492.8 ,Other emphysema,Diseases of the respiratory system,2751,32,1.68,0.0056828362,1.15,2.38
117.9 ,Other and unspecified mycoses,Infectious and parasitic diseases,4077,47,1.67,0.0012299941,1.22,2.22
216.4 ,Benign neoplasm of scalp and skin...,Neoplasms,1551,18,1.67,0.0442437406,0.99,2.66
845 ,Sprains and strains of ankle and...,Injury and poisoning,2071,24,1.67,0.016705377,1.07,2.5
728.89 ,"Other disorders of muscle, ligament,...",Diseases of the musculoskeletal...,13306,153,1.67,0.0000000064116988,1.41,1.96
998.5 ,Postoperative infection,Injury and poisoning,4244,49,1.67,0.0008267053,1.23,2.21
842.01 ,Sprain of carpal (joint) of wrist,Injury and poisoning,1820,21,1.66,0.032355553,1.03,2.55
716.68 ,"Unspecified monoarthritis, other...",Diseases of the musculoskeletal...,2689,31,1.66,0.0073504627,1.13,2.37
723.2 ,Cervicocranial syndrome,Diseases of the musculoskeletal...,3399,39,1.66,0.0035483996,1.17,2.27
614.5 ,"Acute or unspecified pelvic peritonitis,...",Diseases of the genitourinary...,7421,85,1.66,0.0000172691,1.32,2.06
728.71 ,Plantar fascial fibromatosis,Diseases of the musculoskeletal...,4527,52,1.66,0.0008442136,1.24,2.18
492 ,Emphysema,Diseases of the respiratory system,2255,26,1.66,0.0151047645,1.08,2.45
523.0 ,Acute gingivitis,Diseases of the digestive system,6848,78,1.65,0.0000545525,1.3,2.06
411.1 ,Intermediate coronary syndrome,Diseases of the circulatory system,2879,33,1.65,0.0067049646,1.14,2.33
413.9 ,Other and unspecified angina pectoris,Diseases of the circulatory system,36209,405,1.65,1.216786e-19,1.49,1.83
300.81 ,Somatization disorder,Mental disorders,1487,17,1.65,0.0579385411,0.96,2.65
787.3 ,"Flatulence, eructation, and gas...","Comorbidities, signs, and ill-defined...",38516,427,1.64,4.520459e-20,1.48,1.81
558.9 ,Other and unspecified noninfectious...,Diseases of the digestive system,236066,2313,1.64,1.599576e-75,1.55,1.72
715.89 ,"Osteoarthrosis involving, or with...",Diseases of the musculoskeletal...,1759,20,1.64,0.0422315446,1,2.54
274.0 ,"Gouty arthropathy, unspecified","Endocrine, nutritional and metabolic...",36281,404,1.64,2.47315e-19,1.48,1.82
721.3 ,Lumbosacral spondylosis without...,Diseases of the musculoskeletal...,92408,990,1.64,2.627169e-41,1.53,1.76
706.8 ,Other specified diseases of sebaceous...,Diseases of the skin and subcutaneous...,2394,27,1.63,0.0183505219,1.07,2.37
215.0 ,Other benign neoplasm of connective...,Neoplasms,2560,29,1.63,0.0120765461,1.09,2.35
241.0 ,Nontoxic uninodular goiter,"Endocrine, nutritional and metabolic...",2393,27,1.63,0.0183197828,1.07,2.38
715.90 ,"Osteoarthrosis, unspecified whether...",Diseases of the musculoskeletal...,92155,981,1.63,8.376512e-40,1.52,1.74
274.89 ,Gout with other specified manifestations,"Endocrine, nutritional and metabolic...",1411,16,1.63,0.0541101665,0.93,2.67
884 ,Multiple and unspecified open...,Injury and poisoning,1768,20,1.63,0.0427556098,0.99,2.53
296.30 ,"Major depressive affective disorder,...",Mental disorders,2919,33,1.63,0.0097447863,1.12,2.3
686.8 ,Other specified local infections...,Diseases of the skin and subcutaneous...,26851,299,1.63,0.00000000000001745269,1.45,1.83
131.01 ,Trichomonal vulvovaginitis,Infectious and parasitic diseases,3473,39,1.62,0.0054285252,1.15,2.22
786.59 ,Other chest pain,"Comorbidities, signs, and ill-defined...",18078,201,1.62,0.0000000003906707,1.4,1.87
715.31 ,"Osteoarthrosis, localized, not...",Diseases of the musculoskeletal...,4367,49,1.62,0.0017993691,1.2,2.15
848 ,Other and ill-defined sprains...,Injury and poisoning,2848,32,1.62,0.0093002723,1.11,2.3
597.8 ,Other urethritis,Diseases of the genitourinary...,2135,24,1.62,0.025557018,1.04,2.42
357.2 ,Polyneuropathy in diabetes,Diseases of the nervous system,5091,57,1.62,0.0006907459,1.22,2.1
977.9 ,Poisoning by unspecified drug...,Injury and poisoning,1606,18,1.62,0.049473787,0.95,2.56
785.0 ,"Tachycardia, unspecified","Comorbidities, signs, and ill-defined...",3313,37,1.61,0.0062531999,1.13,2.23
696.1 ,Other psoriasis,Diseases of the skin and subcutaneous...,3586,40,1.61,0.0046454798,1.15,2.2
714 ,Rheumatoid arthritis and other...,Diseases of the musculoskeletal...,2143,24,1.61,0.0259769104,1.03,2.41
719.42 ,"Pain in joint, upper arm",Diseases of the musculoskeletal...,1704,19,1.61,0.0553590572,0.96,2.52
599.8 ,Other specified disorders of urethra...,Diseases of the genitourinary...,1521,17,1.61,0.0613707466,0.94,2.59
438 ,Late effects of cerebrovascular...,Diseases of the circulatory system,9998,111,1.61,0.0000039052327,1.32,1.94
461.8 ,Other acute sinusitis,Diseases of the respiratory system,10557,117,1.61,0.0000022567105,1.33,1.93
353 ,Nerve root and plexus disorders,Diseases of the nervous system,3139,35,1.61,0.0093299012,1.12,2.24
681.9 ,Cellulitis and abscess of unspecified...,Diseases of the skin and subcutaneous...,8894,99,1.61,0.0000119831,1.31,1.97
780.4 ,Dizziness and giddiness,"Comorbidities, signs, and ill-defined...",254072,2444,1.61,7.442324e-74,1.53,1.7
715.15 ,"Osteoarthrosis, localized, primary,...",Diseases of the musculoskeletal...,3340,37,1.6,0.0086861512,1.12,2.21
574.0 ,Calculus of gallbladder with acute...,Diseases of the digestive system,2428,27,1.6,0.0196003496,1.05,2.34
582.9 ,Chronic glomerulonephritis with...,Diseases of the genitourinary...,14102,155,1.6,0.000000098479989,1.35,1.87
614.4 ,Chronic or unspecified parametritis...,Diseases of the genitourinary...,2432,27,1.6,0.019773777,1.05,2.34
459.9 ,Unspecified circulatory system...,Diseases of the circulatory system,4509,50,1.6,0.0021321653,1.19,2.12
727.42 ,Ganglion of tendon sheath,Diseases of the musculoskeletal...,1712,19,1.6,0.0559715622,0.96,2.51
110.3 ,Dermatophytosis of groin and perianal...,Infectious and parasitic diseases,8411,93,1.6,0.0000304403,1.29,1.97
524.62 ,"Temporomandibular joint disorders,...",Diseases of the digestive system,1628,18,1.59,0.0523649946,0.94,2.53
570 ,Acute and subacute necrosis of...,Diseases of the digestive system,1902,21,1.59,0.0382385865,0.98,2.44
402.00 ,Malignant hypertensive heart disease...,Diseases of the circulatory system,5626,62,1.59,0.0006851176,1.22,2.05
723.4 ,"Brachial neuritis or radiculitis,...",Diseases of the musculoskeletal...,8742,96,1.59,0.000024944,1.28,1.95
307.42 ,Persistent disorder of initiating...,Mental disorders,7620,84,1.59,0.0000746637,1.27,1.98
788.6 ,Other abnormality of urination,"Comorbidities, signs, and ill-defined...",1911,21,1.58,0.0516256055,0.98,2.43
789.0 ,Abdominal pain,"Comorbidities, signs, and ill-defined...",245770,2344,1.58,2.067563e-66,1.5,1.66
726.0 ,Adhesive capsulitis of shoulder,Diseases of the musculoskeletal...,39298,421,1.58,2.644191e-17,1.43,1.74
464.2 ,Acute larygotracheitis,Diseases of the respiratory system,5768,63,1.58,0.0007985137,1.21,2.02
464.21 ,Acute laryngotracheitis with obstruction,Diseases of the respiratory system,3195,35,1.58,0.0102434403,1.1,2.2
728.85 ,Spasm of muscle,Diseases of the musculoskeletal...,7706,84,1.58,0.0001092498,1.25,1.96
366.17 ,Total or mature cataract,Diseases of the nervous system,1459,16,1.58,0.0799932229,0.9,2.58
493.2 ,Chronic obstructive asthma with...,Diseases of the respiratory system,2276,25,1.58,0.0305666051,1.02,2.35
533.70 ,Chronic peptic ulcer of unspecified...,Diseases of the digestive system,17271,186,1.57,0.000000020266637,1.35,1.81
810.00 ,"Closed fracture of clavicle, unspecified...",Injury and poisoning,2299,25,1.57,0.0318179889,1.01,2.32
719.88 ,"Other specified disorders of joint,...",Diseases of the musculoskeletal...,2565,28,1.57,0.0230130657,1.04,2.28
289.3 ,"Lymphadenitis, unspecified, except...",Diseases of the blood and blood-forming...,2302,25,1.57,0.0320011118,1.01,2.32
595.1 ,Chronic interstitial cystitis,Diseases of the genitourinary...,1648,18,1.57,0.0721825264,0.93,2.5
535.10 ,"Atrophic gastritis, without mention...",Diseases of the digestive system,2963,32,1.56,0.0192979132,1.06,2.21
380.2 ,Other otitis externa,Diseases of the nervous system,3326,36,1.56,0.0117247783,1.09,2.17
560.39 ,Other impaction of intestine,Diseases of the digestive system,1665,18,1.56,0.0739522681,0.92,2.47
300.00 ,"Anxiety state, unspecified",Mental disorders,94595,971,1.56,1.240658e-33,1.46,1.67
596.9 ,Unspecified disorder of bladder,Diseases of the genitourinary...,1752,19,1.56,0.059976036,0.94,2.45
005.9 ,"Food poisoning, unspecified",Infectious and parasitic diseases,1382,15,1.56,0.1014958071,0.87,2.59
737.30 ,"Scoliosis [and kyphoscoliosis],...",Diseases of the musculoskeletal...,2038,22,1.56,0.0446864117,0.97,2.36
786.50 ,"Chest pain, unspecified","Comorbidities, signs, and ill-defined...",51410,538,1.55,4.877587e-20,1.42,1.7
710.4 ,Polymyositis,Diseases of the musculoskeletal...,1677,18,1.55,0.0754054139,0.91,2.45
715.30 ,"Osteoarthrosis, localized, not...",Diseases of the musculoskeletal...,6894,74,1.55,0.0004565789,1.21,1.95
564.8 ,Other specified function disorder...,Diseases of the digestive system,22047,235,1.55,0.0000000005378514,1.36,1.77
847.2 ,Sprain of lumbar,Injury and poisoning,33160,350,1.55,0.00000000000009085897,1.39,1.73
576.1 ,Cholangitis,Diseases of the digestive system,2410,26,1.55,0.0355886313,1.01,2.29
727.05 ,Other tenosynovitis of hand and...,Diseases of the musculoskeletal...,6544,70,1.55,0.0007452503,1.2,1.96
728 ,"Disorders of muscle, ligament,...",Diseases of the musculoskeletal...,14288,153,1.55,0.00000047433396,1.31,1.83
528 ,"Disease of the oral soft tissues,...",Diseases of the digestive system,1776,19,1.54,0.0631286871,0.93,2.42
531.90 ,"Gastric ulcer, unspecified as...",Diseases of the digestive system,26437,278,1.54,0.00000000005795329,1.36,1.73
535 ,Gastritis and duodenitis,Diseases of the digestive system,26691,281,1.54,0.00000000004285718,1.36,1.73
427.0 ,Paroxysmal supraventricular tachycardia,Diseases of the circulatory system,4317,46,1.54,0.0057649025,1.12,2.06
721.90 ,"Spondylosis of unspecified site,...",Diseases of the musculoskeletal...,29408,309,1.54,0.000000000005246057,1.37,1.72
009.1 ,"Colitis, enteritis, and gastroenteritis...",Infectious and parasitic diseases,14117,150,1.54,0.00000090881703,1.3,1.81
733.09 ,Other osteoporosis,Diseases of the musculoskeletal...,4958,53,1.54,0.0034288762,1.15,2.02
493 ,Asthma,Diseases of the respiratory system,13505,143,1.54,0.0000019640052,1.29,1.81
692.3 ,Contact dermatitis and other eczema...,Diseases of the skin and subcutaneous...,7049,75,1.54,0.0005291903,1.21,1.93
785.1 ,Palpitations,"Comorbidities, signs, and ill-defined...",45701,474,1.53,4.907664e-17,1.39,1.68
786.0 ,Dyspnea and respiratory abnormalities,"Comorbidities, signs, and ill-defined...",5176,55,1.53,0.003197712,1.15,2
786.9 ,Other symptoms involving respiratory...,"Comorbidities, signs, and ill-defined...",2442,26,1.53,0.0372135644,1,2.26
715.1 ,"Osteoarthrosis, localized, primary",Diseases of the musculoskeletal...,4721,50,1.53,0.0048069145,1.13,2.02
848.0 ,Sprain of septal cartilage of...,Injury and poisoning,2359,25,1.53,0.0457139887,0.99,2.26
721.1 ,Cervical spondylosis with myelopathy,Diseases of the musculoskeletal...,13748,145,1.53,0.0000023813444,1.29,1.8
622.8 ,Other specified noninflammatory...,Diseases of the genitourinary...,2256,24,1.53,0.0420756063,0.98,2.29
182.0 ,"Malignant neoplasm of corpus uteri,...",Neoplasms,1803,19,1.52,0.0860756607,0.91,2.38
373.13 ,Abscess of eyelid,Diseases of the nervous system,2470,26,1.52,0.0390846342,0.99,2.23
805.2 ,Closed fracture of dorsal [thoracic]...,Injury and poisoning,1421,15,1.52,0.1085176686,0.85,2.52
535.00 ,"Acute gastritis, without mention...",Diseases of the digestive system,137382,1350,1.52,2.875545e-39,1.43,1.62
535.40 ,"Other specified gastritis, without...",Diseases of the digestive system,25984,270,1.52,0.0000000003063279,1.34,1.71
535.50 ,"Unspecified gastritis and gastroduodenitis,...",Diseases of the digestive system,127767,1261,1.52,3.907808e-37,1.43,1.62
250.7 ,Diabetes with peripheral circulatory...,"Endocrine, nutritional and metabolic...",1895,20,1.52,0.0704342031,0.93,2.36
274.9 ,"Gout, unspecified","Endocrine, nutritional and metabolic...",48615,501,1.52,1.726644e-17,1.39,1.67
300.09 ,Other anxiety states,Mental disorders,11349,119,1.52,0.0000247177,1.25,1.82
437.8 ,Other ill-defined cerebrovascular...,Diseases of the circulatory system,2089,22,1.52,0.0631637833,0.95,2.31
614.3 ,Acute parametritis and pelvic...,Diseases of the genitourinary...,5400,57,1.52,0.0029973356,1.15,1.98
625.6 ,"Stress incontinence, female",Diseases of the genitourinary...,11792,124,1.52,0.0000130417,1.26,1.82
786.09 ,Other respiratory abnormalities,"Comorbidities, signs, and ill-defined...",10737,112,1.51,0.0000531366,1.24,1.82
786.5 ,Chest pain,"Comorbidities, signs, and ill-defined...",27255,281,1.51,0.0000000002965093,1.33,1.7
531.70 ,Chronic gastric ulcer without...,Diseases of the digestive system,8998,94,1.51,0.0002087151,1.22,1.85
402.1 ,"Hypertensive heart disease, benign",Diseases of the circulatory system,3912,41,1.51,0.0119503854,1.08,2.06
583.9 ,"Nephritis and nephropathy, not...",Diseases of the genitourinary...,8894,93,1.51,0.0001936972,1.22,1.86
596.8 ,"Bladder disorder, NEC",Diseases of the genitourinary...,1808,19,1.51,0.0865923616,0.91,2.37
307.4 ,Specific disorders of sleep of...,Mental disorders,4475,47,1.51,0.0067459571,1.11,2.02
