710.9 ,Unspecified diffuse connective...,Diseases of the musculoskeletal...,2487,6,1.07,0.8298831431,0.39,2.34
240.0 ,"Goiter, specified as simple","Endocrine, nutritional and metabolic...",3311,8,1.07,0.7144161453,0.46,2.12
386.12 ,Vestibular neuronitis,Diseases of the nervous system,13274,32,1.07,0.6447364829,0.73,1.52
474.0 ,Chronic tonsillitis,Diseases of the respiratory system,5042,12,1.06,0.7653866009,0.55,1.85
627.1 ,Postmenopausal bleeding,Diseases of the genitourinary...,18077,43,1.06,0.6915256439,0.76,1.43
478.5 ,Other diseases of vocal cords,Diseases of the respiratory system,26815,64,1.06,0.6009868599,0.81,1.36
523.9 ,Unspecified gingival and periodontal...,Diseases of the digestive system,7152,17,1.06,0.801291302,0.61,1.7
250.50 ,"Diabetes with ophthalmic manifestations,...","Endocrine, nutritional and metabolic...",4596,11,1.06,0.7546076649,0.53,1.91
716.99 ,"Arthropathy, unspecified, multiple...",Diseases of the musculoskeletal...,4616,11,1.06,0.7555258166,0.53,1.9
574.20 ,Calculus of gallbladder without...,Diseases of the digestive system,18474,44,1.06,0.6945044186,0.77,1.43
850.9 ,"Concussion, unspecified",Injury and poisoning,6728,16,1.06,0.7953268558,0.6,1.72
437.8 ,Other ill-defined cerebrovascular...,Diseases of the circulatory system,2089,5,1.06,0.81479478,0.34,2.49
723.2 ,Cervicocranial syndrome,Diseases of the musculoskeletal...,3399,8,1.05,0.8547948956,0.45,2.07
616.8 ,Other specified inflammatory diseases...,Diseases of the genitourinary...,6801,16,1.05,0.7969259173,0.6,1.7
627.9 ,Unspecified menopausal and postmenopausal...,Diseases of the genitourinary...,102637,242,1.05,0.4422792652,0.92,1.21
693.9 ,Dermatitis due to unspecified...,Diseases of the skin and subcutaneous...,9285,22,1.05,0.7413882424,0.66,1.6
528.0 ,Stomatitis,Diseases of the digestive system,19434,46,1.05,0.7018646187,0.77,1.41
372.20 ,"Blepharoconjunctivitis, unspecified",Diseases of the nervous system,11898,28,1.05,0.7699444711,0.69,1.52
789.9 ,Other symptoms involving abdomen...,"Comorbidities, signs, and ill-defined...",2535,6,1.05,0.8319991622,0.39,2.3
300.89 ,Other somatoform disorders,Mental disorders,6801,16,1.05,0.7969259173,0.6,1.7
914.0 ,Abrasion or friction burn of hand(s)...,Injury and poisoning,2544,6,1.05,0.8324269285,0.38,2.29
727.42 ,Ganglion of tendon sheath,Diseases of the musculoskeletal...,1712,4,1.04,0.7974829731,0.28,2.67
491.20 ,Obstructive chronic bronchitis...,Diseases of the respiratory system,6431,15,1.04,0.7922896324,0.58,1.72
780.50 ,"Sleep disturbance, unspecified","Comorbidities, signs, and ill-defined...",35557,83,1.04,0.7318612248,0.82,1.29
372.14 ,Other chronic allergic conjunctivitis,Diseases of the nervous system,70015,164,1.04,0.5897160708,0.88,1.23
785.1 ,Palpitations,"Comorbidities, signs, and ill-defined...",45701,107,1.04,0.6487926388,0.85,1.27
380.10 ,"Infective otitis externa, unspecified",Diseases of the nervous system,52198,122,1.04,0.6685937895,0.86,1.25
455.5 ,External hemorrhoids with other...,Diseases of the circulatory system,1715,4,1.04,0.7977877619,0.28,2.66
722.71 ,Intervertebral disc disorder with...,Diseases of the musculoskeletal...,2571,6,1.04,0.8337661327,0.38,2.26
524.6 ,Temporomandibular joint disorders,Diseases of the digestive system,1733,4,1.03,0.7996454264,0.28,2.64
695.3 ,Rosacea,Diseases of the skin and subcutaneous...,1720,4,1.03,0.7982988502,0.28,2.66
375.56 ,"Stenosis of nasolacrimal duct,...",Diseases of the nervous system,4323,10,1.03,0.8714947876,0.49,1.9
787.9 ,Other symptoms involving digestive...,"Comorbidities, signs, and ill-defined...",8633,20,1.03,0.8196816218,0.63,1.6
380.22 ,Other acute otitis externa,Diseases of the nervous system,13812,32,1.03,0.8561000696,0.7,1.46
241.9 ,Unspecified nontoxic nodular goiter,"Endocrine, nutritional and metabolic...",7359,17,1.03,0.9012553693,0.6,1.65
414.8 ,Other specified forms of chronic...,Diseases of the circulatory system,7764,18,1.03,0.8103705954,0.61,1.63
626.6 ,Metrorrhagia,Diseases of the genitourinary...,12696,29,1.02,0.9246810357,0.68,1.46
370.49 ,Other keratoconjunctivitis,Diseases of the nervous system,4344,10,1.02,0.8719661631,0.49,1.89
372.00 ,"Acute conjunctivitis, unspecified",Diseases of the nervous system,104789,241,1.02,0.7035538528,0.89,1.17
788.4 ,Frequency of urination and polyuria,"Comorbidities, signs, and ill-defined...",24921,57,1.02,0.8920798516,0.77,1.32
573.9 ,Unspecified disorder of liver,Diseases of the digestive system,11736,27,1.02,0.8446626121,0.67,1.49
272.1 ,Pure hyperglyceridemia,"Endocrine, nutritional and metabolic...",13929,32,1.02,0.8569783061,0.7,1.45
280 ,Iron deficiency anemias,Diseases of the blood and blood-forming...,3039,7,1.02,0.8474502484,0.41,2.12
595.9 ,"Cystitis, unspecified",Diseases of the genitourinary...,50638,116,1.02,0.8469616516,0.84,1.23
614.5 ,"Acute or unspecified pelvic peritonitis,...",Diseases of the genitourinary...,7421,17,1.02,0.90178249,0.59,1.64
365.00 ,"Preglaucoma, unspecified",Diseases of the nervous system,2632,6,1.01,0.8370822914,0.37,2.21
372.12 ,Chronic follicular conjunctivitis,Diseases of the nervous system,3942,9,1.01,0.8661002693,0.46,1.93
531.00 ,"Acute gastric ulcer with hemorrhage,...",Diseases of the digestive system,2652,6,1.01,0.8382511505,0.37,2.19
535.4 ,Other specified gastritis,Diseases of the digestive system,7927,18,1.01,0.9051595526,0.6,1.6
241.1 ,Nontoxic multinodular goiter,"Endocrine, nutritional and metabolic...",4381,10,1.01,0.8728578552,0.49,1.87
386.00 ,"Minihre's disease, unspecified",Diseases of the nervous system,28145,64,1.01,0.8983524784,0.78,1.3
596.9 ,Unspecified disorder of bladder,Diseases of the genitourinary...,1752,4,1.01,0.8016576637,0.28,2.61
308.0 ,Predominant disturbance of emotions,Mental disorders,4421,10,1.01,0.8739065531,0.48,1.85
918.1 ,Superficial injury of cornea,Injury and poisoning,16256,37,1.01,0.9333295027,0.71,1.4
461.8 ,Other acute sinusitis,Diseases of the respiratory system,10557,24,1.01,0.9175919531,0.65,1.51
464.20 ,Acute laryngotracheitis without...,Diseases of the respiratory system,45453,102,1,1,0.81,1.22
487.1 ,Influenza with other respiratory...,Diseases of the respiratory system,125827,283,1,1,0.88,1.13
367.53 ,Spasm of accommodation,Diseases of the nervous system,6648,15,1,0.8968770102,0.56,1.66
780.2 ,Syncope and collapse,"Comorbidities, signs, and ill-defined...",10622,24,1,0.9180173567,0.64,1.5
112.9 ,Candidiasis of unspecified site,Infectious and parasitic diseases,5338,12,1,1,0.51,1.75
781.9 ,Other symptoms involving nervous...,"Comorbidities, signs, and ill-defined...",8876,20,1,0.9105766506,0.61,1.55
532.70 ,Chronic duodenal ulcer without...,Diseases of the digestive system,9768,22,1,0.9147020151,0.63,1.52
373.11 ,Hordeolum externum,Diseases of the nervous system,15968,36,1,0.932926678,0.7,1.39
229.8 ,Benign neoplasm of other specified...,Neoplasms,4447,10,1,1,0.48,1.84
009.0 ,"Infectious colitis, enteritis,...",Infectious and parasitic diseases,39299,88,0.99,1,0.79,1.23
493.90 ,"Asthma, unspecified type, unspecified",Diseases of the respiratory system,49064,109,0.99,0.9609400887,0.81,1.2
733.09 ,Other osteoporosis,Diseases of the musculoskeletal...,4958,11,0.99,1,0.49,1.77
155.0 ,"Malignant neoplasm of liver, primary",Neoplasms,4043,9,0.99,1,0.45,1.88
182.0 ,"Malignant neoplasm of corpus uteri,...",Neoplasms,1803,4,0.99,1,0.27,2.53
706.1 ,Other acne,Diseases of the skin and subcutaneous...,15737,35,0.99,1,0.69,1.38
380.15 ,Chronic mycotic otitis externa,Diseases of the nervous system,7605,17,0.99,1,0.58,1.6
569.9 ,Unspecified disorder of intestine,Diseases of the digestive system,4938,11,0.99,1,0.49,1.78
389.9 ,Unspecified hearing loss,Diseases of the nervous system,9911,22,0.99,1,0.62,1.5
440.9 ,Generalized and unspecified atherosclerosis,Diseases of the circulatory system,7214,16,0.99,1,0.56,1.61
722.1 ,Displacement of thoracic or lumbar...,Diseases of the musculoskeletal...,3146,7,0.99,1,0.4,2.04
465.0 ,Acute laryngopharyngitis,Diseases of the respiratory system,169199,375,0.98,0.7767001919,0.88,1.1
626.0 ,Absence of menstruation,Diseases of the genitourinary...,9086,20,0.98,1,0.6,1.52
487.8 ,Influenza with other manifestations,Diseases of the respiratory system,20359,45,0.98,1,0.71,1.32
180.9 ,"Malignant neoplasm of cervix uteri,...",Neoplasms,6365,14,0.98,1,0.53,1.64
373.33 ,Xeroderma of eyelid,Diseases of the nervous system,3165,7,0.98,1,0.39,2.03
380.23 ,Other chronic otitis externa,Diseases of the nervous system,4536,10,0.98,1,0.47,1.81
427.31 ,Atrial fibrillation,Diseases of the circulatory system,3158,7,0.98,1,0.4,2.04
625.3 ,Dysmenorrhea,Diseases of the genitourinary...,4567,10,0.97,1,0.47,1.79
372.54 ,Conjunctival concretions,Diseases of the nervous system,19290,42,0.97,0.9387002335,0.69,1.31
532.90 ,"Duodenal ulcer, unspecified as...",Diseases of the digestive system,20691,45,0.97,0.8820763508,0.7,1.3
374.05 ,Trichiasis of eyelid without entropion,Diseases of the nervous system,24716,54,0.97,0.8917551931,0.73,1.27
381.3 ,Other and unspecified chronic...,Diseases of the nervous system,1373,3,0.97,1,0.2,2.85
381.60 ,"Obstruction of Eustachian tube,...",Diseases of the nervous system,1378,3,0.97,1,0.2,2.84
005.9 ,"Food poisoning, unspecified",Infectious and parasitic diseases,1382,3,0.96,1,0.2,2.83
682.7 ,"Cellulitis and abscess of foot,...",Diseases of the skin and subcutaneous...,2781,6,0.96,1,0.35,2.09
386.50 ,"Labyrinthine dysfunction, unspecified",Diseases of the nervous system,2316,5,0.96,1,0.31,2.25
575.0 ,Acute cholecystitis,Diseases of the digestive system,2766,6,0.96,1,0.35,2.1
845.10 ,"Sprain of foot, unspecified site",Injury and poisoning,3233,7,0.96,1,0.39,1.99
455.0 ,Internal hemorrhoids without mention...,Diseases of the circulatory system,5082,11,0.96,1,0.48,1.73
722.90 ,"Other and unspecified disc disorder,...",Diseases of the musculoskeletal...,3691,8,0.96,1,0.41,1.9
626.9 ,Unspecified disorders of menstruation...,Diseases of the genitourinary...,24756,53,0.95,0.7855408407,0.71,1.25
233.1 ,Carcinoma in situ of cervix uteri,Neoplasms,5122,11,0.95,1,0.48,1.71
381.81 ,Dysfunction of Eustachian tube,Diseases of the nervous system,10719,23,0.95,0.9183135869,0.6,1.43
242.90 ,Thyrotoxicosis without mention...,"Endocrine, nutritional and metabolic...",13561,29,0.95,0.8552870389,0.63,1.37
388.30 ,"Tinnitus, unspecified",Diseases of the nervous system,26750,57,0.95,0.7432575862,0.71,1.23
388.70 ,"Otalgia, unspecified",Diseases of the nervous system,2331,5,0.95,1,0.31,2.23
402.00 ,Malignant hypertensive heart disease...,Diseases of the circulatory system,5626,12,0.95,1,0.49,1.66
847.9 ,Sprain of unspecified site of...,Injury and poisoning,6995,15,0.95,1,0.53,1.58
597.80 ,"Urethritis, unspecified",Diseases of the genitourinary...,19083,41,0.95,0.8771111661,0.68,1.3
464.30 ,Acute epiglottitis without mention...,Diseases of the respiratory system,2837,6,0.94,1,0.34,2.05
009.3 ,Diarrhea of presumed infectious...,Infectious and parasitic diseases,8000,17,0.94,0.9058919226,0.55,1.52
785.0 ,"Tachycardia, unspecified","Comorbidities, signs, and ill-defined...",3313,7,0.94,1,0.38,1.94
577.0 ,Acute pancreatitis,Diseases of the digestive system,2849,6,0.94,1,0.34,2.04
411.81 ,Acute coronary occlusion without...,Diseases of the circulatory system,1895,4,0.94,1,0.25,2.41
458.9 ,"Hypotension, unspecified",Diseases of the circulatory system,1411,3,0.94,1,0.19,2.77
344.61 ,Cauda equina syndrome with neurogenic...,Diseases of the nervous system,1422,3,0.94,1,0.19,2.75
053.19 ,Herpes zoster with other nervous...,Infectious and parasitic diseases,1901,4,0.93,1,0.25,2.4
077.1 ,Epidemic keratoconjunctivitis,Infectious and parasitic diseases,12872,27,0.93,0.8510194036,0.61,1.36
372.53 ,Conjunctival xerosis,Diseases of the nervous system,4784,10,0.93,1,0.44,1.71
532.30 ,Acute duodenal ulcer without mention...,Diseases of the digestive system,3822,8,0.93,1,0.4,1.84
555.9 ,Regional enteritis of unspecified...,Diseases of the digestive system,9511,20,0.93,0.9130917121,0.57,1.45
241.0 ,Nontoxic uninodular goiter,"Endocrine, nutritional and metabolic...",2393,5,0.93,1,0.3,2.17
307.81 ,Tension headache,Mental disorders,33704,71,0.93,0.6392077812,0.73,1.18
917.0 ,Abrasion or friction burn of foot...,Injury and poisoning,3824,8,0.93,1,0.4,1.84
519.8 ,Other diseases of respiratory...,Diseases of the respiratory system,1447,3,0.92,1,0.19,2.7
706.3 ,Seborrhea,Diseases of the skin and subcutaneous...,5308,11,0.92,1,0.46,1.65
381.4 ,"Nonsuppurative otitis media, not...",Diseases of the nervous system,2907,6,0.92,1,0.34,2
382.3 ,Unspecified chronic suppurative...,Diseases of the nervous system,5800,12,0.92,0.8896052747,0.47,1.61
388.8 ,Other disorders of ear,Diseases of the nervous system,2888,6,0.92,1,0.34,2.01
455.3 ,External hemorrhoids without mention...,Diseases of the circulatory system,1937,4,0.92,1,0.25,2.36
366.17 ,Total or mature cataract,Diseases of the nervous system,1459,3,0.91,1,0.19,2.68
555.1 ,Regional enteritis of large intestine,Diseases of the digestive system,2936,6,0.91,1,0.33,1.98
389.10 ,"Sensorineural hearing loss, unspecified",Diseases of the nervous system,5830,12,0.91,0.8896553656,0.47,1.6
614.4 ,Chronic or unspecified parametritis...,Diseases of the genitourinary...,2432,5,0.91,1,0.3,2.14
622.7 ,Mucous polyp of cervix,Diseases of the genitourinary...,9410,19,0.9,0.7424951684,0.54,1.4
626.2 ,Excessive or frequent menstruation,Diseases of the genitourinary...,11399,23,0.9,0.6904335837,0.57,1.35
366.50 ,"After-cataract, unspecified",Diseases of the nervous system,2945,6,0.9,1,0.33,1.98
373.13 ,Abscess of eyelid,Diseases of the nervous system,2470,5,0.9,1,0.29,2.1
533.91 ,"Peptic ulcer of unspecified site,...",Diseases of the digestive system,2462,5,0.9,1,0.29,2.11
560.81 ,Intestinal or peritoneal adhesions...,Diseases of the digestive system,1487,3,0.9,1,0.18,2.63
590.10 ,Acute pyelonephritis without lesion...,Diseases of the genitourinary...,9385,19,0.9,0.7423843247,0.54,1.41
346.1 ,Common migraine,Diseases of the nervous system,5454,11,0.9,0.8855320758,0.45,1.61
625.9 ,Unspecified symptom associated...,Diseases of the genitourinary...,2999,6,0.89,1,0.33,1.94
511.0 ,Pleurisy without mention of effusion...,Diseases of the respiratory system,1501,3,0.89,1,0.18,2.6
370.4 ,Other and unsppecified keratoconjunctivitis,Diseases of the nervous system,1494,3,0.89,1,0.18,2.62
783.0 ,Anorexia,"Comorbidities, signs, and ill-defined...",1994,4,0.89,1,0.24,2.29
786.1 ,Stridor,"Comorbidities, signs, and ill-defined...",3495,7,0.89,1,0.36,1.84
216.1 ,"Benign neoplasm of eyelid, including...",Neoplasms,1501,3,0.89,1,0.18,2.6
788.5 ,Oliguria and anuria,"Comorbidities, signs, and ill-defined...",1493,3,0.89,1,0.18,2.62
219.9 ,"Benign neoplasm of uterus, part...",Neoplasms,11933,24,0.89,0.6965643187,0.57,1.33
556 ,Idiopathic proctocolitis,Diseases of the digestive system,2504,5,0.89,1,0.29,2.08
382.00 ,Acute suppurative otitis media...,Diseases of the nervous system,3985,8,0.89,1,0.38,1.76
386.11 ,Benign paroxysmal positional vertigo,Diseases of the nervous system,9998,20,0.89,0.6716294224,0.54,1.38
388.2 ,"Sudden hearing loss, unspecified",Diseases of the nervous system,1992,4,0.89,1,0.24,2.29
459.9 ,Unspecified circulatory system...,Diseases of the circulatory system,4509,9,0.89,0.8745862953,0.4,1.69
473.8 ,Other chronic sinusitis,Diseases of the respiratory system,2528,5,0.88,1,0.28,2.06
626.8 ,Other disorders of menstruation...,Diseases of the genitourinary...,26123,52,0.88,0.4261865277,0.66,1.16
478.4 ,Polyp of vocal cord or larynx,Diseases of the respiratory system,4532,9,0.88,0.874698107,0.4,1.68
372.02 ,Acute follicular conjunctivitis,Diseases of the nervous system,4054,8,0.88,0.8679246035,0.38,1.73
346.9 ,"Migraine, unspecified",Diseases of the nervous system,23042,46,0.88,0.4808068759,0.65,1.18
478 ,Other diseases of upper respiratory...,Diseases of the respiratory system,3067,6,0.87,1,0.32,1.9
627.8 ,Other specified menopausal and...,Diseases of the genitourinary...,17404,34,0.87,0.4667674783,0.6,1.21
385.32 ,Cholesteatoma of middle ear,Diseases of the nervous system,3060,6,0.87,1,0.32,1.9
435.1 ,Vertebral artery syndrome,Diseases of the circulatory system,3075,6,0.87,1,0.32,1.89
910.0 ,"Abrasion or friction burn of face,...",Injury and poisoning,4072,8,0.87,0.868009693,0.38,1.72
622.1 ,Dysplasia of cervix (uteri),Diseases of the genitourinary...,7707,15,0.86,0.7161377818,0.48,1.43
933.0 ,Foreign body in pharynx,Injury and poisoning,10877,21,0.86,0.5417539786,0.53,1.31
366.12 ,Incipient senile cataract,Diseases of the nervous system,3615,7,0.86,0.8601502224,0.34,1.78
370.23 ,Filamentary keratitis,Diseases of the nervous system,3085,6,0.86,1,0.32,1.88
786.59 ,Other chest pain,"Comorbidities, signs, and ill-defined...",18078,35,0.86,0.4273060961,0.6,1.2
615.0 ,Acute inflammatory diseases of...,Diseases of the genitourinary...,4121,8,0.86,0.8683585568,0.37,1.7
349.89 ,Other specified disorders of nervous...,Diseases of the nervous system,5176,10,0.86,0.7681553792,0.41,1.58
681.9 ,Cellulitis and abscess of unspecified...,Diseases of the skin and subcutaneous...,8894,17,0.85,0.5741681643,0.49,1.36
786.00 ,"Respiratory abnormality, unspecified","Comorbidities, signs, and ill-defined...",3662,7,0.85,0.8604935259,0.34,1.75
374.0 ,Entropion and trichiasis of eyelid,Diseases of the nervous system,3674,7,0.85,0.8606108489,0.34,1.75
256.9 ,Unspecified ovarian dysfunction,"Endocrine, nutritional and metabolic...",3118,6,0.85,0.8505827712,0.31,1.86
574.10 ,Calculus of gallbladder with other...,Diseases of the digestive system,5194,10,0.85,0.7682983817,0.41,1.58
296.90 ,Unspecified episodic mood disorder,Mental disorders,3657,7,0.85,0.8604481671,0.34,1.76
919.4 ,"Insect bite, nonvenomous, of other,...",Injury and poisoning,10393,20,0.85,0.6014967321,0.52,1.32
921.3 ,Contusion of eyeball,Injury and poisoning,1569,3,0.85,1,0.17,2.49
930.0 ,Corneal foreign body,Injury and poisoning,22019,42,0.84,0.3131461378,0.61,1.15
680.0 ,Carbuncle and furuncle of face,Diseases of the skin and subcutaneous...,3706,7,0.84,0.8609813838,0.34,1.73
370.21 ,Punctate keratitis,Diseases of the nervous system,20445,39,0.84,0.3316164145,0.6,1.16
110.3 ,Dermatophytosis of groin and perianal...,Infectious and parasitic diseases,8411,16,0.84,0.6424099145,0.48,1.37
295 ,Schizophrenic disorders,Mental disorders,2112,4,0.84,1,0.23,2.16
464.1 ,Acute tracheitis,Diseases of the respiratory system,12830,24,0.83,0.3991444562,0.53,1.24
464.21 ,Acute laryngotracheitis with obstruction,Diseases of the respiratory system,3195,6,0.83,0.8509641643,0.31,1.82
535.00 ,"Acute gastritis, without mention...",Diseases of the digestive system,137382,264,0.83,0.0049933561,0.73,0.95
540.9 ,Acute appendicitis without mention...,Diseases of the digestive system,2673,5,0.83,0.8389686103,0.27,1.94
041.9 ,"Bacterial infection, unspecified,...",Infectious and parasitic diseases,8667,16,0.82,0.4944356953,0.47,1.33
070.9 ,Unspecified viral hepatitis without...,Infectious and parasitic diseases,8623,16,0.82,0.5664523181,0.47,1.34
524.62 ,"Temporomandibular joint disorders,...",Diseases of the digestive system,1628,3,0.82,1,0.17,2.4
424.90 ,"Endocarditis, valve unspecified,...",Diseases of the circulatory system,1628,3,0.82,1,0.17,2.4
627.0 ,Premenopausal menorrhagia,Diseases of the genitourinary...,2750,5,0.81,0.8394399426,0.26,1.89
492.8 ,Other emphysema,Diseases of the respiratory system,2751,5,0.81,0.8394511406,0.26,1.89
372.39 ,Other conjunctivitis,Diseases of the nervous system,4383,8,0.81,0.7474738287,0.35,1.6
719.45 ,"Pain in joint, pelvic region and...",Diseases of the musculoskeletal...,4403,8,0.81,0.7479246874,0.35,1.59
914.6 ,Superficial foreign body (splinter)...,Injury and poisoning,3288,6,0.81,0.852228682,0.3,1.77
618.1 ,Uterine prolapse without mention...,Diseases of the genitourinary...,2214,4,0.8,1,0.22,2.06
493.11 ,Intrinsic asthma with status asthmaticus,Diseases of the respiratory system,1659,3,0.8,1,0.17,2.35
574.50 ,Calculus of bile duct without...,Diseases of the digestive system,2791,5,0.8,0.840002001,0.26,1.86
362.10 ,"Background retinopathy, unspecified",Diseases of the nervous system,3947,7,0.79,0.7341627901,0.32,1.63
370.00 ,"Corneal ulcer, unspecified",Diseases of the nervous system,2822,5,0.79,0.8405637955,0.25,1.84
692.79 ,Other dermatitis due to solar...,Diseases of the skin and subcutaneous...,4466,8,0.79,0.6349514384,0.34,1.57
719.99 ,"Unspecified disorder of joint,...",Diseases of the musculoskeletal...,3946,7,0.79,0.7341366568,0.32,1.63
337.9 ,Unspecified disorder of autonomic...,Diseases of the nervous system,2242,4,0.79,0.8241628082,0.22,2.03
524.60 ,"Temporomandibular joint disorders,...",Diseases of the digestive system,2853,5,0.78,0.84123919,0.25,1.82
698.4 ,Dermatitis factitia [artefacta],Diseases of the skin and subcutaneous...,5150,9,0.78,0.5545291655,0.35,1.48
346.0 ,Classical migraine,Diseases of the nervous system,2828,5,0.78,0.840685772,0.25,1.84
715.98 ,"Osteoarthrosis, unspecified whether...",Diseases of the musculoskeletal...,5200,9,0.77,0.5553090151,0.35,1.46
367.1 ,Myopia,Diseases of the nervous system,7609,13,0.76,0.3935664637,0.4,1.3
367.89 ,Other disorders of refraction...,Diseases of the nervous system,7002,12,0.76,0.445304217,0.39,1.33
370.33 ,"Keratoconjunctivitis sicca, not...",Diseases of the nervous system,5295,9,0.75,0.4684593396,0.34,1.43
362.6 ,Peripheral retinal degeneration,Diseases of the nervous system,2396,4,0.74,0.8267012344,0.2,1.9
696.1 ,Other psoriasis,Diseases of the skin and subcutaneous...,3586,6,0.74,0.5958814618,0.27,1.62
216.6 ,Benign neoplasm of skin of upper...,Neoplasms,2408,4,0.74,0.827054501,0.2,1.89
216.7 ,Benign neoplasm of skin of lower...,Neoplasms,1810,3,0.74,0.804360117,0.15,2.16
402.11 ,Benign hypertensive heart disease...,Diseases of the circulatory system,4826,8,0.74,0.5393043043,0.32,1.45
306.0 ,Musculoskeletal malfunction arising...,Mental disorders,1808,3,0.74,0.8043444567,0.15,2.16
795.0 ,Nonspecific abnormal papanicolaou...,"Comorbidities, signs, and ill-defined...",1816,3,0.73,0.8044128342,0.15,2.15
532.00 ,"Acute duodenal ulcer with hemorrhage,...",Diseases of the digestive system,1855,3,0.72,0.8049611231,0.15,2.1
610.2 ,Fibroadenosis of breast,Diseases of the genitourinary...,6133,10,0.72,0.4143676915,0.35,1.33
306.4 ,Gastrointestinal malfunction arising...,Mental disorders,3115,5,0.71,0.5705656113,0.23,1.67
723.9 ,Unspecified musculoskeletal disorders...,Diseases of the musculoskeletal...,3175,5,0.7,0.5715068561,0.23,1.63
365.2 ,Primary angle-closure glaucoma,Diseases of the nervous system,1898,3,0.7,0.8059629328,0.14,2.06
218 ,Uterine leiomyoma,Neoplasms,6318,10,0.7,0.3482462014,0.34,1.29
788.6 ,Other abnormality of urination,"Comorbidities, signs, and ill-defined...",1911,3,0.7,0.8063442164,0.14,2.04
719.88 ,"Other specified disorders of joint,...",Diseases of the musculoskeletal...,2565,4,0.69,0.6731351531,0.19,1.78
943.00 ,Burn of unspecified degree of...,Injury and poisoning,1964,3,0.68,0.8082549814,0.14,1.99
373.12 ,Hordeolum internum,Diseases of the nervous system,16143,25,0.68,0.0644002018,0.44,1.01
403.90 ,"Hypertensive chronic kidney disease,...",Diseases of the circulatory system,2627,4,0.68,0.6758642564,0.18,1.73
722.73 ,Intervertebral disc disorder with...,Diseases of the musculoskeletal...,5969,9,0.67,0.2719185549,0.3,1.27
008.5 ,"Bacterial enteritis, unspecified",Infectious and parasitic diseases,4093,6,0.65,0.4046478753,0.24,1.42
242.00 ,Toxic diffuse goiter without mention...,"Endocrine, nutritional and metabolic...",5455,8,0.65,0.3121115506,0.28,1.28
574.00 ,Calculus of gallbladder with acute...,Diseases of the digestive system,3401,5,0.65,0.4652131945,0.21,1.53
626.1 ,Scanty or infrequent menstruation,Diseases of the genitourinary...,1389,2,0.64,0.7761325962,0.08,2.32
372.05 ,Acute atopic conjunctivitis,Diseases of the nervous system,2067,3,0.64,0.6398017741,0.13,1.89
274.89 ,Gout with other specified manifestations,"Endocrine, nutritional and metabolic...",1411,2,0.63,0.7766671958,0.08,2.28
935.1 ,Foreign body in esophagus,Injury and poisoning,1433,2,0.62,0.7773634615,0.07,2.24
478.8 ,Upper respiratory tract hypersensitivity...,Diseases of the respiratory system,2843,4,0.62,0.4305212067,0.17,1.6
702.0 ,Actinic keratosis,Diseases of the skin and subcutaneous...,2158,3,0.62,0.6439359641,0.13,1.81
296.9 ,Other and unspecified affective...,Mental disorders,1462,2,0.61,0.7785173514,0.07,2.2
627.4 ,Symptomatic states associated...,Diseases of the genitourinary...,2204,3,0.6,0.5016811981,0.12,1.77
259.9 ,Unspecified endocrine disorder,"Endocrine, nutritional and metabolic...",2201,3,0.6,0.5016664287,0.12,1.77
372.15 ,Parasitic conjunctivitis,Diseases of the nervous system,2251,3,0.59,0.5024250272,0.12,1.73
373.2 ,Chalazion,Diseases of the nervous system,5257,7,0.59,0.1877830171,0.24,1.22
272.8 ,Other disorders of lipoid metabolism,"Endocrine, nutritional and metabolic...",1524,2,0.58,0.7818200245,0.07,2.11
282.4 ,Thalassemias,Diseases of the blood and blood-forming...,1541,2,0.58,0.5945994584,0.07,2.09
289.3 ,"Lymphadenitis, unspecified, except...",Diseases of the blood and blood-forming...,2302,3,0.58,0.5042875774,0.12,1.69
008.6 ,"Virus Enteritis, specified",Infectious and parasitic diseases,1564,2,0.57,0.5947705416,0.07,2.06
560.9 ,Unspecified intestinal obstruction,Diseases of the digestive system,3861,5,0.57,0.3023325486,0.19,1.34
277.9 ,Unspecified disorder of metabolism,"Endocrine, nutritional and metabolic...",1576,2,0.56,0.5949725838,0.07,2.04
692.5 ,Contact dermatitis and other eczema...,Diseases of the skin and subcutaneous...,3196,4,0.55,0.3443759363,0.15,1.42
285.8 ,Other specified anemias,Diseases of the blood and blood-forming...,2425,3,0.55,0.3907110472,0.11,1.61
