disease_2,disease_name,category,count,co_occurrence,odds_ratio,p_value,95_ci_lower,95_ci_upper
722.2 ,Displacement of intervertebral...,Diseases of the musculoskeletal...,9624,424,11.73,2.74366e-279,10.59,12.97
843.9 ,Sprains and strains of unspecified...,Injury and poisoning,3399,136,10.22,1.033001e-84,8.53,12.16
840.9 ,Sprains and strains of unspecified...,Injury and poisoning,8277,310,9.75,1.07657e-183,8.66,10.96
841.9 ,Sprains and strains of unspecified...,Injury and poisoning,3032,116,9.73,2.074409e-70,8,11.74
625.9 ,Unspecified symptom associated...,Diseases of the genitourinary...,13252,474,9.49,5.28065e-273,8.62,10.44
842.10 ,"Sprain of hand, unspecified site",Injury and poisoning,2088,73,8.81,2.551503e-42,6.87,11.15
616.50 ,"Ulceration of vulva, unspecified",Diseases of the genitourinary...,6938,223,8.23,6.87982e-119,7.15,9.42
842.00 ,"Sprain of wrist, unspecified site",Injury and poisoning,5642,174,7.84,3.1243e-90,6.69,9.13
737.9 ,Unspecified curvature of spine,Diseases of the musculoskeletal...,1923,57,7.42,9.112939e-30,5.59,9.66
737.30 ,"Scoliosis [and kyphoscoliosis],...",Diseases of the musculoskeletal...,8060,231,7.31,5.8007e-113,6.38,8.36
847.0 ,Sprain of neck,Injury and poisoning,19387,531,7.24,2.09195e-251,6.61,7.92
722.93 ,"Other and unspecified disc disorder,...",Diseases of the musculoskeletal...,5270,144,6.89,2.771699e-68,5.79,8.15
844.9 ,Sprains and strains of unspecified...,Injury and poisoning,9716,245,6.42,5.51935e-108,5.62,7.3
726.71 ,Achilles bursitis or tendinitis,Diseases of the musculoskeletal...,2179,55,6.28,1.869386e-25,4.71,8.22
722.1 ,Displacement of thoracic or lumbar...,Diseases of the musculoskeletal...,2345,58,6.16,2.560044e-26,4.65,8
724.79 ,Other disorders of coccyx,Diseases of the musculoskeletal...,3832,94,6.13,2.399083e-41,4.93,7.53
720.0 ,Ankylosing spondylitis,Diseases of the musculoskeletal...,3835,91,5.92,5.704749e-39,4.75,7.3
724.4 ,Thoracic or lumbosacral neuritis...,Diseases of the musculoskeletal...,3579,85,5.92,1.550121e-36,4.71,7.35
724.3 ,Sciatica,Diseases of the musculoskeletal...,27625,600,5.74,4.26717e-233,5.27,6.25
726.32 ,Lateral epicondylitis,Diseases of the musculoskeletal...,5240,120,5.73,2.522437e-49,4.73,6.88
648.93 ,Other current conditions classifiable...,"Complications of pregnancy, childbirth,...",9417,210,5.63,3.029038e-83,4.88,6.47
845.00 ,"Sprain of ankle, unspecified site",Injury and poisoning,14237,304,5.45,1.94488e-115,4.83,6.12
845.19 ,Other sprain of foot,Injury and poisoning,2683,58,5.36,1.769804e-23,4.06,6.96
721.3 ,Lumbosacral spondylosis without...,Diseases of the musculoskeletal...,15128,315,5.31,8.82725e-117,4.73,5.96
847.2 ,Sprain of lumbar,Injury and poisoning,26292,515,5.11,1.7415e-180,4.65,5.59
722.10 ,Displacement of lumbar intervertebral...,Diseases of the musculoskeletal...,16252,323,5.07,2.02335e-114,4.52,5.67
844.2 ,Sprain of cruciate ligament of...,Injury and poisoning,2231,44,4.88,9.02214e-17,3.53,6.57
724.02 ,"Spinal stenosis, lumbar region,...",Diseases of the musculoskeletal...,2330,45,4.77,8.704391e-17,3.47,6.41
842.09 ,Other sprains and strains of wrist,Injury and poisoning,4372,84,4.77,8.937819e-30,3.79,5.92
847.1 ,Sprain of thoracic,Injury and poisoning,2413,44,4.5,0.000000000000001417151,3.26,6.07
723.4 ,"Brachial neuritis or radiculitis,...",Diseases of the musculoskeletal...,2541,46,4.47,4.264283e-16,3.26,5.98
717.7 ,Chondromalacia of patella,Diseases of the musculoskeletal...,7041,125,4.42,3.945513e-40,3.66,5.28
722.0 ,Displacement of cervical intervertebral...,Diseases of the musculoskeletal...,5783,103,4.42,1.841848e-33,3.6,5.38
922.8 ,Contusion of multiple sites of...,Injury and poisoning,4977,85,4.23,1.079024e-26,3.37,5.25
721.1 ,Cervical spondylosis with myelopathy,Diseases of the musculoskeletal...,2685,46,4.22,0.000000000000003091092,3.08,5.66
723.0 ,Spinal stenosis in cervical region,Diseases of the musculoskeletal...,2287,39,4.2,0.0000000000004260054,2.98,5.77
726.0 ,Adhesive capsulitis of shoulder,Diseases of the musculoskeletal...,3069,52,4.18,8.024065e-17,3.11,5.5
847 ,Sprains and strains of other and...,Injury and poisoning,1892,32,4.16,0.00000000006174192,2.84,5.9
737.3 ,Kyphoscoliosis and scoliosis,Diseases of the musculoskeletal...,2322,39,4.14,0.0000000000006732424,2.93,5.68
722 ,Intervertebral disc disorders,Diseases of the musculoskeletal...,3071,51,4.09,3.458635e-16,3.04,5.4
721.0 ,Cervical spondylosis without myelopathy,Diseases of the musculoskeletal...,7849,127,4.02,8.284966e-37,3.34,4.8
353.4 ,"Lumbosacral root lesions, not...",Diseases of the nervous system,2271,37,4.01,0.000000000006094234,2.81,5.55
727.04 ,Radial styloid tenosynovitis,Diseases of the musculoskeletal...,4261,69,4,9.371862e-21,3.1,5.08
726.10 ,Disorders of bursae and tendons...,Diseases of the musculoskeletal...,4201,66,3.87,2.876931e-19,2.99,4.95
845.0 ,Sprains and strains of ankle,Injury and poisoning,4206,66,3.87,3.051698e-19,2.98,4.94
737.43 ,Scoliosis associated with other...,Diseases of the musculoskeletal...,2067,32,3.8,0.000000000535262,2.59,5.39
717.9 ,Unspecified internal derangement...,Diseases of the musculoskeletal...,3315,51,3.79,0.000000000000006614578,2.81,5
721.90 ,"Spondylosis of unspecified site,...",Diseases of the musculoskeletal...,4964,75,3.73,1.003915e-20,2.92,4.69
729.1 ,"Myalgia and myositis, unspecified",Diseases of the musculoskeletal...,115933,1491,3.69,< 0.0001,3.48,3.9
722.91 ,"Other and unspecified disc disorder,...",Diseases of the musculoskeletal...,2007,30,3.67,0.0000000039847108,2.47,5.26
666.14 ,"Other immediate postpartum hemorrhage,...","Complications of pregnancy, childbirth,...",5519,82,3.67,4.563444e-22,2.91,4.57
724.2 ,Lumbago,Diseases of the musculoskeletal...,136079,1669,3.58,< 0.0001,3.39,3.78
922.3 ,Contusion of back,Injury and poisoning,19285,272,3.54,2.772023e-65,3.13,4
715.00 ,"Osteoarthrosis, generalized, site...",Diseases of the musculoskeletal...,2437,34,3.42,0.0000000021463923,2.36,4.8
726.90 ,Enthesopathy of unspecified site,Diseases of the musculoskeletal...,35297,470,3.41,2.46162e-104,3.1,3.75
728.85 ,Spasm of muscle,Diseases of the musculoskeletal...,9062,125,3.41,7.152614e-30,2.83,4.08
353.2 ,"Cervical root lesions, not elsewhere...",Diseases of the nervous system,3760,52,3.4,0.0000000000002093722,2.53,4.47
724.5 ,"Backache, unspecified",Diseases of the musculoskeletal...,87984,1074,3.32,6.47253e-217,3.11,3.54
723.1 ,Cervicalgia,Diseases of the musculoskeletal...,16569,219,3.3,2.286062e-48,2.87,3.78
722.73 ,Intervertebral disc disorder with...,Diseases of the musculoskeletal...,2858,38,3.26,0.0000000009415034,2.3,4.49
300.89 ,Other somatoform disorders,Mental disorders,2740,36,3.22,0.0000000034532837,2.25,4.48
788.0 ,Renal colic,"Comorbidities, signs, and ill-defined...",6034,78,3.18,1.074593e-17,2.51,3.98
719.49 ,"Pain in joint, multiple sites",Diseases of the musculoskeletal...,4574,59,3.17,0.00000000000009776233,2.41,4.1
674.34 ,Other complications of obstetrical...,"Complications of pregnancy, childbirth,...",17297,219,3.16,1.593481e-45,2.74,3.61
724.7 ,Disorders of coccyx,Diseases of the musculoskeletal...,2038,26,3.12,0.00000081371275,2.03,4.59
727.03 ,Trigger finger (acquired),Diseases of the musculoskeletal...,2590,33,3.12,0.000000030637774,2.14,4.4
354.0 ,Carpal tunnel syndrome,Diseases of the nervous system,7599,96,3.11,9.560175e-21,2.52,3.81
716.10 ,"Traumatic arthropathy, site unspecified",Diseases of the musculoskeletal...,2604,33,3.1,0.000000034669864,2.13,4.38
729.9 ,Other and unspecified disorders...,Diseases of the musculoskeletal...,5767,72,3.07,0.000000000000001043012,2.4,3.88
805.6 ,Closed fracture of sacrum and...,Injury and poisoning,3113,39,3.07,0.0000000028899181,2.18,4.21
008.8 ,Intestinal infection due to other...,Infectious and parasitic diseases,3150,39,3.03,0.0000000039659253,2.15,4.16
729.4 ,"Fasciitis, unspecified",Diseases of the musculoskeletal...,56583,649,2.97,6.08717e-116,2.74,3.22
634.00 ,"Spontaneous abortion, complicated...","Complications of pregnancy, childbirth,...",2894,35,2.96,0.000000041925374,2.06,4.13
718.40 ,"Contracture of joint, site unspecified",Diseases of the musculoskeletal...,2077,25,2.94,0.0000035725195,1.9,4.36
726.19 ,Other specified disorders of bursae...,Diseases of the musculoskeletal...,2276,27,2.9,0.0000019521784,1.91,4.24
716.90 ,"Arthropathy, unspecified, site...",Diseases of the musculoskeletal...,17065,198,2.88,3.142532e-36,2.49,3.32
848.9 ,Unspecified site of sprain and...,Injury and poisoning,65057,716,2.87,7.64706e-120,2.65,3.1
728.8 ,"Other disorders of muscle, ligament...",Diseases of the musculoskeletal...,2579,30,2.85,0.00000081161311,1.91,4.08
087.9 ,"Relapsing fever, unspecified",Infectious and parasitic diseases,1903,22,2.83,0.0000241648,1.77,4.29
728.9 ,"Unspecified disorder of muscle,...",Diseases of the musculoskeletal...,20313,230,2.82,2.813027e-40,2.46,3.22
848.8 ,Other specified sites of sprains...,Injury and poisoning,6522,75,2.82,0.00000000000001672344,2.22,3.55
854.09 ,Intracranial injury of other and...,Injury and poisoning,3653,42,2.82,0.0000000083429606,2.02,3.82
296.30 ,"Major depressive affective disorder,...",Mental disorders,2802,32,2.79,0.0000005280844,1.91,3.96
922.2 ,Contusion of abdominal wall,Injury and poisoning,4833,55,2.79,0.00000000006815772,2.1,3.64
573.8 ,Other specified disorders of liver,Diseases of the digestive system,2119,24,2.77,0.0000147461,1.77,4.13
356.9 ,Unspecified hereditary and idiopathic...,Diseases of the nervous system,4011,45,2.75,0.0000000051860087,2,3.69
669.93 ,Unspecified complication of labor...,"Complications of pregnancy, childbirth,...",4740,53,2.74,0.0000000002733718,2.05,3.59
848 ,Other and ill-defined sprains...,Injury and poisoning,1894,21,2.71,0.0000653523,1.67,4.16
727.05 ,Other tenosynovitis of hand and...,Diseases of the musculoskeletal...,5451,60,2.7,0.00000000003525115,2.05,3.48
733.00 ,"Osteoporosis, unspecified",Diseases of the musculoskeletal...,2724,30,2.69,0.0000023899244,1.81,3.86
845.09 ,Other sprains and strains of ankle,Injury and poisoning,9303,100,2.64,8.085587e-17,2.15,3.22
714.0 ,Rheumatoid arthritis,Diseases of the musculoskeletal...,8083,86,2.61,0.000000000000018253,2.08,3.23
307.41 ,Transient disorder of initiating...,Mental disorders,3085,33,2.61,0.0000014395694,1.8,3.68
715.16 ,"Osteoarthrosis, localized, primary,...",Diseases of the musculoskeletal...,2163,23,2.6,0.0000565037,1.64,3.91
307.4 ,Specific disorders of sleep of...,Mental disorders,2362,25,2.59,0.0000298056,1.67,3.83
729.5 ,Pain in limb,Diseases of the musculoskeletal...,8773,92,2.58,0.000000000000004596586,2.07,3.17
726.8 ,Other peripheral enthesopathies,Diseases of the musculoskeletal...,2279,24,2.57,0.0000458549,1.64,3.84
727.00 ,"Synovitis and tenosynovitis, unspecified",Diseases of the musculoskeletal...,60190,604,2.57,4.929351e-85,2.36,2.8
455.9 ,Residual hemorrhoidal skin tags,Diseases of the circulatory system,3248,34,2.56,0.0000016059762,1.77,3.59
729.0 ,"Rheumatism, unspecified and fibrositis",Diseases of the musculoskeletal...,4979,52,2.56,0.000000004900857,1.9,3.36
308.0 ,Predominant disturbance of emotions,Mental disorders,2581,27,2.56,0.0000179916,1.68,3.73
728.89 ,"Other disorders of muscle, ligament,...",Diseases of the musculoskeletal...,9338,97,2.55,0.000000000000002046247,2.06,3.12
724 ,Other and unspecified disorders...,Diseases of the musculoskeletal...,2785,29,2.54,0.0000098314818,1.7,3.66
727.0 ,Synovitis and tenosynovitis,Diseases of the musculoskeletal...,9106,94,2.54,0.000000000000007161867,2.04,3.11
715.36 ,"Osteoarthrosis, localized, not...",Diseases of the musculoskeletal...,4751,49,2.52,0.000000018149016,1.86,3.34
715.90 ,"Osteoarthrosis, unspecified whether...",Diseases of the musculoskeletal...,14385,146,2.5,1.406205e-21,2.11,2.95
729.2 ,"Neuralgia, neuritis, and radiculitis,...",Diseases of the musculoskeletal...,33305,333,2.5,1.69397e-46,2.24,2.8
719.47 ,"Pain in joint, ankle and foot",Diseases of the musculoskeletal...,2681,27,2.46,0.0000492331,1.62,3.59
727.9 ,"Unspecified disorder of synovium,...",Diseases of the musculoskeletal...,3627,36,2.42,0.000002943132,1.69,3.37
727.89 ,"Other disorders of synovium, tendon,...",Diseases of the musculoskeletal...,2433,24,2.41,0.000164281,1.54,3.59
581.9 ,Nephrotic syndrome with unspecified...,Diseases of the genitourinary...,2434,24,2.41,0.0001648463,1.54,3.59
716.98 ,"Arthropathy, unspecified, other...",Diseases of the musculoskeletal...,1949,19,2.38,0.000984746,1.43,3.73
727.09 ,Other synovitis and tenosynovitis,Diseases of the musculoskeletal...,3706,36,2.37,0.0000044360846,1.66,3.29
728 ,"Disorders of muscle, ligament,...",Diseases of the musculoskeletal...,8914,86,2.37,0.000000000003368204,1.89,2.93
353.9 ,Unspecified nerve root and plexus...,Diseases of the nervous system,2071,20,2.36,0.0007425389,1.43,3.65
839.8 ,"Closed dislocation, multiple and...",Injury and poisoning,5067,49,2.36,0.00000012032413,1.74,3.13
998.3 ,Disruption of operation wound,Injury and poisoning,2428,23,2.31,0.0003361555,1.46,3.48
616.0 ,Cervicitis and endocervicitis,Diseases of the genitourinary...,97685,865,2.31,1.20621e-95,2.15,2.48
719.45 ,"Pain in joint, pelvic region and...",Diseases of the musculoskeletal...,1902,18,2.31,0.001647217,1.36,3.66
533.30 ,Acute peptic ulcer of unspecified...,Diseases of the digestive system,6889,65,2.31,0.0000000026992332,1.78,2.95
402.90 ,Unspecified hypertensive heart...,Diseases of the circulatory system,2435,23,2.3,0.0003467385,1.46,3.47
652.23 ,Breech presentation without mention...,"Complications of pregnancy, childbirth,...",2334,22,2.3,0.0004812067,1.44,3.49
719.4 ,Pain in joint,Diseases of the musculoskeletal...,7171,67,2.29,0.00000000272615,1.77,2.91
727.06 ,Tenosynovitis of foot and ankle,Diseases of the musculoskeletal...,2561,24,2.29,0.0002810286,1.46,3.41
574 ,Cholelithiasis,Diseases of the digestive system,2132,20,2.29,0.0009323393,1.39,3.54
617.8 ,Endometriosis of other specified...,Diseases of the genitourinary...,2350,22,2.28,0.000516208,1.43,3.47
214.9 ,"Lipoma, unspecified site",Neoplasms,2137,20,2.28,0.0009515988,1.39,3.54
682.7 ,"Cellulitis and abscess of foot,...",Diseases of the skin and subcutaneous...,2680,25,2.28,0.000222126,1.47,3.37
611.7 ,Signs and symptoms in breast,Diseases of the genitourinary...,2904,27,2.27,0.0002032941,1.49,3.31
850.1 ,Concussion with brief loss of...,Injury and poisoning,1932,18,2.27,0.0018362212,1.34,3.6
786.00 ,"Respiratory abnormality, unspecified","Comorbidities, signs, and ill-defined...",3555,33,2.27,0.0000313016,1.56,3.19
723.3 ,Cervicobrachial syndrome (diffuse),Diseases of the musculoskeletal...,3019,28,2.26,0.0001492746,1.5,3.28
850.9 ,"Concussion, unspecified",Injury and poisoning,13725,126,2.26,0.000000000000001523212,1.87,2.69
307.40 ,"Nonorganic sleep disorder, unspecified",Mental disorders,3346,31,2.26,0.0000587933,1.53,3.22
829.0 ,"Fracture of unspecified bone,...",Injury and poisoning,2806,26,2.26,0.0001826588,1.47,3.32
372.13 ,Vernal conjunctivitis,Diseases of the nervous system,6936,64,2.26,0.0000000090026423,1.73,2.89
715 ,Osteoarthrosis and allied disorders,Diseases of the musculoskeletal...,5675,52,2.24,0.00000023846404,1.67,2.94
482.9 ,"Bacterial pneumonia, unspecified",Diseases of the respiratory system,4356,40,2.24,0.0000074728574,1.6,3.06
782.2 ,"Localized superficial swelling,...","Comorbidities, signs, and ill-defined...",2175,20,2.24,0.0011183504,1.37,3.47
611.8 ,Other specified disorders of breast,Diseases of the genitourinary...,2838,26,2.23,0.0003068065,1.46,3.28
448.1 ,"Nevus, non-neoplastic",Diseases of the circulatory system,2535,23,2.21,0.0008437221,1.4,3.33
923.8 ,Contusion of multiple sites of...,Injury and poisoning,3753,34,2.21,0.000033572,1.53,3.1
715.9 ,"Osteoarthrosis, unspecified whether...",Diseases of the musculoskeletal...,4430,40,2.2,0.0000090890684,1.57,3.01
296.90 ,Unspecified episodic mood disorder,Mental disorders,2773,25,2.2,0.000468901,1.42,3.25
306.8 ,Other specified psychophysiological...,Mental disorders,4333,39,2.2,0.0000126762,1.56,3.01
719.48 ,"Pain in joint, other specified...",Diseases of the musculoskeletal...,1999,18,2.19,0.002410053,1.3,3.48
724.9 ,Other unspecified back disorders,Diseases of the musculoskeletal...,8826,79,2.19,0.0000000006475569,1.73,2.74
927.3 ,Crushing injury of finger(s),Injury and poisoning,3351,30,2.18,0.0001195608,1.47,3.13
705.89 ,Other specified disorders of sweat...,Diseases of the skin and subcutaneous...,2679,24,2.18,0.0006653933,1.4,3.26
719.41 ,"Pain in joint, shoulder region",Diseases of the musculoskeletal...,4022,36,2.18,0.0000325472,1.53,3.03
592.1 ,Calculus of ureter,Diseases of the genitourinary...,7790,69,2.17,0.000000013140704,1.68,2.75
780.52 ,"Insomnia, unspecified","Comorbidities, signs, and ill-defined...",50709,438,2.17,5.901661e-45,1.97,2.39
923.00 ,Contusion of shoulder region,Injury and poisoning,9012,80,2.17,0.0000000009056963,1.72,2.71
300.02 ,Generalized anxiety disorder,Mental disorders,8501,75,2.16,0.0000000043372651,1.69,2.71
306.9 ,Unspecified psychophysiological...,Mental disorders,13855,121,2.14,0.0000000000001115098,1.77,2.57
569.9 ,Unspecified disorder of intestine,Diseases of the digestive system,7900,69,2.14,0.000000018988931,1.66,2.71
786.1 ,Stridor,"Comorbidities, signs, and ill-defined...",2289,20,2.13,0.002601708,1.3,3.3
349.89 ,Other specified disorders of nervous...,Diseases of the nervous system,2054,18,2.13,0.0030617139,1.26,3.39
695.89 ,Other specified erythematous conditions,Diseases of the skin and subcutaneous...,3108,27,2.12,0.0003927764,1.39,3.09
922.9 ,Contusion of unspecified part...,Injury and poisoning,10286,89,2.12,0.0000000003531893,1.7,2.61
298.9 ,Unspecified psychosis,Mental disorders,2780,24,2.1,0.0009205283,1.34,3.14
910 ,"Superficial injury of face, neck,...",Injury and poisoning,2556,22,2.1,0.0016196799,1.31,3.18
370.33 ,"Keratoconjunctivitis sicca, not...",Diseases of the nervous system,2665,23,2.1,0.0012059427,1.33,3.16
923.21 ,Contusion of wrist,Injury and poisoning,3829,33,2.1,0.0001183093,1.44,2.96
300.09 ,Other anxiety states,Mental disorders,5735,49,2.09,0.0000039771703,1.54,2.76
311 ,"Depressive disorder, not elsewhere...",Mental disorders,6319,54,2.09,0.0000015877499,1.56,2.73
054.2 ,Herpetic gingivostomatitis,Infectious and parasitic diseases,4466,38,2.08,0.0000526606,1.47,2.86
389.9 ,Unspecified hearing loss,Diseases of the nervous system,5168,44,2.08,0.0000160649,1.51,2.8
716.9 ,"Arthropathy, unspecified",Diseases of the musculoskeletal...,9782,83,2.08,0.0000000029042455,1.65,2.58
780.50 ,"Sleep disturbance, unspecified","Comorbidities, signs, and ill-defined...",16071,136,2.08,0.00000000000003501635,1.74,2.46
496 ,"Chronic airway obstruction, not...",Diseases of the respiratory system,3636,31,2.08,0.0002279419,1.41,2.96
617.0 ,Endometriosis of uterus,Diseases of the genitourinary...,11344,96,2.07,0.0000000002298239,1.67,2.54
674.90 ,"Unspecified complications of puerperium,...","Complications of pregnancy, childbirth,...",3414,29,2.07,0.000401388,1.38,2.98
588.9 ,Unspecified disorder resulting...,Diseases of the genitourinary...,2368,20,2.06,0.0032282272,1.25,3.19
429.9 ,"Heart disease, unspecified",Diseases of the circulatory system,4856,41,2.06,0.0000405178,1.47,2.8
726.9 ,Unspecified enthesopathy,Diseases of the musculoskeletal...,5814,49,2.06,0.0000075360488,1.52,2.73
842.01 ,Sprain of carpal (joint) of wrist,Injury and poisoning,2128,18,2.06,0.0055641877,1.22,3.27
919 ,"Superficial injury of other, multiple,...",Injury and poisoning,2837,24,2.06,0.0016897903,1.32,3.08
914.6 ,Superficial foreign body (splinter)...,Injury and poisoning,2618,22,2.05,0.0020075781,1.28,3.11
924.9 ,Contusion of unspecified site,Injury and poisoning,25193,208,2.04,1.121559e-19,1.77,2.34
702.8 ,Other specified dermatoses,Diseases of the skin and subcutaneous...,7168,60,2.04,0.00000068647284,1.56,2.64
570 ,Acute and subacute necrosis of...,Diseases of the digestive system,2149,18,2.04,0.0058768208,1.21,3.23
386.9 ,Unspecified vertiginous syndromes...,Diseases of the nervous system,14389,119,2.03,0.000000000006067276,1.68,2.43
727.01 ,Synovitis and tenosynovitis in...,Diseases of the musculoskeletal...,2037,17,2.03,0.0079231313,1.18,3.26
923.9 ,Contusion of unspecified part...,Injury and poisoning,9138,76,2.03,0.000000028613482,1.6,2.55
786.3 ,Hemoptysis,"Comorbidities, signs, and ill-defined...",3976,33,2.02,0.0002590623,1.39,2.85
592.0 ,Calculus of kidney,Diseases of the genitourinary...,12056,99,2.01,0.0000000005278499,1.63,2.45
785.0 ,"Tachycardia, unspecified","Comorbidities, signs, and ill-defined...",2426,20,2.01,0.0039105528,1.22,3.11
531.90 ,"Gastric ulcer, unspecified as...",Diseases of the digestive system,15515,127,2.01,0.000000000002443175,1.67,2.39
892.1 ,Open wound of foot except toe(s)...,Injury and poisoning,2913,24,2.01,0.0019662507,1.28,2.99
300.01 ,Panic disorder without agoraphobia,Mental disorders,2820,23,1.99,0.0027469335,1.26,2.99
346.9 ,"Migraine, unspecified",Diseases of the nervous system,25782,208,1.99,1.211947e-18,1.72,2.29
845.10 ,"Sprain of foot, unspecified site",Injury and poisoning,2817,23,1.99,0.0027274496,1.26,2.99
454.9 ,Asymptomatic varicose veins,Diseases of the circulatory system,1963,16,1.98,0.011760092,1.13,3.23
924.01 ,Contusion of hip,Injury and poisoning,6289,51,1.98,0.000011067,1.47,2.61
881.00 ,"Open wound of forearm, without...",Injury and poisoning,9197,74,1.97,0.0000001942893,1.54,2.47
357.4 ,Polyneuropathy in other diseases...,Diseases of the nervous system,2097,17,1.97,0.009334027,1.15,3.17
536.8 ,Dyspepsia and other specified...,Diseases of the digestive system,123064,937,1.97,3.205327e-71,1.84,2.12
616.2 ,Cyst of Bartholin's gland,Diseases of the genitourinary...,5221,42,1.96,0.0000789276,1.41,2.66
413.9 ,Other and unspecified angina pectoris,Diseases of the circulatory system,4225,34,1.96,0.0004003124,1.36,2.75
300.0 ,Anxiety states,Mental disorders,23444,187,1.96,1.74532e-16,1.69,2.27
850.0 ,Concussion with no loss of consciousness,Injury and poisoning,13374,107,1.96,0.0000000004541428,1.6,2.37
038.9 ,Unspecified septicemia,Infectious and parasitic diseases,3501,28,1.95,0.0012978198,1.29,2.82
641.93 ,"Unspecified antepartum hemorrhage,...","Complications of pregnancy, childbirth,...",28387,224,1.95,7.299846e-19,1.7,2.23
300.4 ,Dysthymic disorder,Mental disorders,30179,238,1.95,5.490795e-20,1.7,2.22
372.56 ,Conjunctival deposits,Diseases of the nervous system,2386,19,1.94,0.0091337231,1.16,3.04
719.46 ,"Pain in joint, lower leg",Diseases of the musculoskeletal...,5014,40,1.94,0.0001420384,1.39,2.65
137.0 ,Late effects of respiratory or...,Infectious and parasitic diseases,2379,19,1.94,0.0090305273,1.17,3.04
783.0 ,Anorexia,"Comorbidities, signs, and ill-defined...",2140,17,1.93,0.0106558396,1.12,3.1
307.42 ,Persistent disorder of initiating...,Mental disorders,4787,38,1.93,0.0002467034,1.37,2.66
922.1 ,Contusion of chest wall,Injury and poisoning,19591,154,1.93,0.0000000000002740379,1.63,2.27
692.71 ,Sunburn,Diseases of the skin and subcutaneous...,1892,15,1.93,0.0175832825,1.08,3.19
373.33 ,Xeroderma of eyelid,Diseases of the nervous system,2414,19,1.92,0.0096068165,1.15,3
640.01 ,"Threatened abortion, delivered,...","Complications of pregnancy, childbirth,...",3417,27,1.92,0.0018310642,1.27,2.81
532.30 ,Acute duodenal ulcer without mention...,Diseases of the digestive system,2287,18,1.92,0.0125626986,1.13,3.04
826.0 ,Closed fracture of one or more...,Injury and poisoning,2031,16,1.92,0.0142492622,1.09,3.12
531.70 ,Chronic gastric ulcer without...,Diseases of the digestive system,4963,39,1.91,0.0002133182,1.36,2.62
556 ,Idiopathic proctocolitis,Diseases of the digestive system,3961,31,1.91,0.0010654684,1.29,2.71
924.4 ,Contusion of multiple sites of...,Injury and poisoning,5266,41,1.9,0.0002079639,1.36,2.58
945.24 ,"Blisters, epidermal loss [second...",Injury and poisoning,2309,18,1.9,0.0130392417,1.12,3.01
386.1 ,Other and unspecified peripheral...,Diseases of the nervous system,5412,42,1.89,0.0001686142,1.36,2.56
780.4 ,Dizziness and giddiness,"Comorbidities, signs, and ill-defined...",193042,1371,1.89,1.715019e-87,1.78,2.01
386.11 ,Benign paroxysmal positional vertigo,Diseases of the nervous system,4526,35,1.88,0.0006453125,1.31,2.63
253.9 ,Unspecified disorder of the pituitary...,"Endocrine, nutritional and metabolic...",1943,15,1.88,0.0203022188,1.05,3.11
274.0 ,"Gouty arthropathy, unspecified","Endocrine, nutritional and metabolic...",7140,55,1.88,0.0000253868,1.41,2.45
780.3 ,Convulsions,"Comorbidities, signs, and ill-defined...",2723,21,1.88,0.0067476652,1.16,2.88
816.00 ,Closed fracture of phalanx or...,Injury and poisoning,2334,18,1.88,0.0136771204,1.11,2.97
574.2 ,Calculus of gallbladder without...,Diseases of the digestive system,2716,21,1.88,0.0066136636,1.16,2.88
590.9 ,"Infection of kidney, unspecified",Diseases of the genitourinary...,5604,43,1.87,0.0002175395,1.35,2.52
597 ,"Urethritis, not sexually transmitted,...",Diseases of the genitourinary...,2733,21,1.87,0.0099031065,1.15,2.87
726 ,Peripheral enthesopathies and...,Diseases of the musculoskeletal...,2868,22,1.87,0.0076560901,1.17,2.83
239.3 ,Neoplasm of unspecified nature...,Neoplasms,6908,53,1.87,0.0000302176,1.4,2.45
780.5 ,Sleep disturbance,"Comorbidities, signs, and ill-defined...",15167,116,1.87,0.0000000010618781,1.54,2.25
533.40 ,Chronic or unspecified peptic...,Diseases of the digestive system,5200,40,1.87,0.0002954887,1.34,2.56
794.8 ,Nonspecific abnormal results of...,"Comorbidities, signs, and ill-defined...",7299,56,1.87,0.0000208237,1.41,2.44
959.7 ,"Knee, leg, ankle, and foot injury",Injury and poisoning,5516,42,1.86,0.0002943699,1.33,2.51
379.90 ,"Disorder of eye, unspecified",Diseases of the nervous system,4970,38,1.86,0.0005030819,1.32,2.56
