disease_2,disease_name,category,count,co_occurrence,odds_ratio,p_value,95_ci_lower,95_ci_upper
842.00 ,"Sprain of wrist, unspecified site",Injury and poisoning,6867,254,22.71,3.19513e-235,19.85,25.88
841.9 ,Sprains and strains of unspecified...,Injury and poisoning,5428,155,16.83,1.42277e-126,14.2,19.83
727.03 ,Trigger finger (acquired),Diseases of the musculoskeletal...,5617,115,11.81,1.623097e-78,9.7,14.27
842.01 ,Sprain of carpal (joint) of wrist,Injury and poisoning,2785,57,11.61,1.237903e-39,8.75,15.13
845.10 ,"Sprain of foot, unspecified site",Injury and poisoning,2934,54,10.41,2.422336e-35,7.78,13.65
847.9 ,Sprain of unspecified site of...,Injury and poisoning,10271,171,9.72,2.65486e-102,8.27,11.36
840.9 ,Sprains and strains of unspecified...,Injury and poisoning,14369,233,9.64,4.56478e-137,8.39,11.02
844.9 ,Sprains and strains of unspecified...,Injury and poisoning,11532,186,9.45,6.04902e-109,8.1,10.97
842.19 ,Other sprains and strains of hand,Injury and poisoning,1940,31,8.95,3.106343e-19,6.06,12.78
843.9 ,Sprains and strains of unspecified...,Injury and poisoning,4774,74,8.79,7.135058e-43,6.87,11.09
923.20 ,Contusion of hand(s),Injury and poisoning,6031,85,8,6.571661e-46,6.36,9.94
923.3 ,Contusion of finger,Injury and poisoning,3684,52,7.94,1.043734e-28,5.9,10.46
845.00 ,"Sprain of ankle, unspecified site",Injury and poisoning,13111,177,7.86,1.662305e-91,6.71,9.16
727.04 ,Radial styloid tenosynovitis,Diseases of the musculoskeletal...,4736,65,7.74,8.460933e-35,5.95,9.92
723.0 ,Spinal stenosis in cervical region,Diseases of the musculoskeletal...,4447,61,7.73,9.6998e-33,5.89,9.98
842.09 ,Other sprains and strains of wrist,Injury and poisoning,5364,70,7.37,5.113076e-36,5.72,9.35
727.05 ,Other tenosynovitis of hand and...,Diseases of the musculoskeletal...,7745,100,7.35,1.973545e-50,5.95,8.98
816.00 ,Closed fracture of phalanx or...,Injury and poisoning,2595,34,7.33,2.389766e-18,5.05,10.29
726.64 ,Patellar tendinitis,Diseases of the musculoskeletal...,2034,26,7.13,0.00000000000003770108,4.64,10.5
840.8 ,Sprains and strains of other specified...,Injury and poisoning,3214,39,6.79,1.08691e-19,4.81,9.32
726.4 ,Enthesopathy of wrist and carpus,Diseases of the musculoskeletal...,3502,41,6.55,4.507583e-20,4.68,8.92
719.44 ,"Pain in joint, hand",Diseases of the musculoskeletal...,3721,43,6.46,9.100356e-21,4.66,8.74
726.32 ,Lateral epicondylitis,Diseases of the musculoskeletal...,15394,167,6.27,1.115133e-72,5.33,7.33
844.8 ,Sprains and strains of other specified...,Injury and poisoning,2044,23,6.26,0.00000000001354473,3.95,9.44
718.40 ,"Contracture of joint, site unspecified",Diseases of the musculoskeletal...,2432,27,6.18,0.0000000000003249032,4.06,9.03
726.71 ,Achilles bursitis or tendinitis,Diseases of the musculoskeletal...,2855,30,5.85,0.00000000000006570813,3.93,8.39
847.1 ,Sprain of thoracic,Injury and poisoning,3296,34,5.75,0.000000000000002491027,3.97,8.07
923.8 ,Contusion of multiple sites of...,Injury and poisoning,3265,33,5.63,0.00000000000001111027,3.86,7.94
726.10 ,Disorders of bursae and tendons...,Diseases of the musculoskeletal...,7927,76,5.4,2.360598e-30,4.24,6.78
847.0 ,Sprain of neck,Injury and poisoning,31527,283,5.33,5.28756e-104,4.7,6.03
723.2 ,Cervicocranial syndrome,Diseases of the musculoskeletal...,3378,32,5.27,0.0000000000001541875,3.59,7.47
846.0 ,Sprain of lumbosacral (joint)...,Injury and poisoning,2431,22,5.02,0.0000000020244406,3.14,7.63
923.9 ,Contusion of unspecified part...,Injury and poisoning,7841,69,4.94,1.306909e-25,3.83,6.27
728.71 ,Plantar fascial fibromatosis,Diseases of the musculoskeletal...,2029,18,4.92,0.000000076023372,2.9,7.8
845.19 ,Other sprain of foot,Injury and poisoning,2966,26,4.87,0.0000000001429212,3.17,7.16
923.11 ,Contusion of elbow,Injury and poisoning,5217,45,4.81,6.298064e-17,3.5,6.46
914.0 ,Abrasion or friction burn of hand(s)...,Injury and poisoning,4120,34,4.59,0.000000000001203308,3.17,6.43
915.0 ,"Abrasion or friction burn of finger(s),...",Injury and poisoning,2431,19,4.33,0.00000022924663,2.6,6.78
847.2 ,Sprain of lumbar,Injury and poisoning,38380,280,4.3,7.43581e-83,3.79,4.87
927.3 ,Crushing injury of finger(s),Injury and poisoning,3795,29,4.24,0.0000000002999459,2.83,6.11
840.4 ,Rotator cuff (capsule) sprain,Injury and poisoning,2507,19,4.19,0.00000036220524,2.52,6.57
726.11 ,Calcifying tendinitis of shoulder,Diseases of the musculoskeletal...,2527,19,4.16,0.00000040733039,2.5,6.52
723.3 ,Cervicobrachial syndrome (diffuse),Diseases of the musculoskeletal...,5493,41,4.15,0.0000000000001541492,2.97,5.65
923.21 ,Contusion of wrist,Injury and poisoning,3783,28,4.1,0.0000000011990612,2.72,5.95
724.02 ,"Spinal stenosis, lumbar region,...",Diseases of the musculoskeletal...,5220,37,3.94,0.000000000009836392,2.76,5.45
727.9 ,"Unspecified disorder of synovium,...",Diseases of the musculoskeletal...,5375,38,3.93,0.000000000005613825,2.77,5.41
788.9 ,Other symptoms involving urinary...,"Comorbidities, signs, and ill-defined...",1968,14,3.93,0.0000236647,2.14,6.62
729.81 ,Swelling of limb,Diseases of the musculoskeletal...,2114,15,3.92,0.00001268,2.19,6.49
519.8 ,Other diseases of respiratory...,Diseases of the respiratory system,3593,25,3.85,0.000000029196235,2.49,5.71
840.0 ,Acromioclavicular (joint) (ligament)...,Injury and poisoning,1889,13,3.8,0.0000634147,2.02,6.52
923.00 ,Contusion of shoulder region,Injury and poisoning,8681,58,3.73,2.079175e-16,2.82,4.83
727.09 ,Other synovitis and tenosynovitis,Diseases of the musculoskeletal...,6282,42,3.72,0.000000000002580199,2.67,5.04
922.9 ,Contusion of unspecified part...,Injury and poisoning,8896,59,3.7,1.588384e-16,2.81,4.79
922.8 ,Contusion of multiple sites of...,Injury and poisoning,4202,28,3.69,0.000000011090244,2.45,5.35
723.9 ,Unspecified musculoskeletal disorders...,Diseases of the musculoskeletal...,2393,16,3.69,0.0000136209,2.11,6.02
924.20 ,Contusion of foot,Injury and poisoning,8408,55,3.65,0.000000000000002880233,2.74,4.76
726.8 ,Other peripheral enthesopathies,Diseases of the musculoskeletal...,3184,21,3.65,0.00000083300975,2.25,5.59
714.0 ,Rheumatoid arthritis,Diseases of the musculoskeletal...,16513,106,3.62,2.115565e-27,2.95,4.39
388.70 ,"Otalgia, unspecified",Diseases of the nervous system,3998,26,3.6,0.000000057977401,2.34,5.29
354.0 ,Carpal tunnel syndrome,Diseases of the nervous system,23269,145,3.54,1.159442e-35,2.98,4.19
726.60 ,"Enthesopathy of knee, unspecified",Diseases of the musculoskeletal...,2030,13,3.53,0.0001283604,1.88,6.07
923.2 ,"Contusion of wrist and hand(s),...",Injury and poisoning,1900,12,3.48,0.0002596314,1.8,6.11
715.16 ,"Osteoarthrosis, localized, primary,...",Diseases of the musculoskeletal...,6414,40,3.46,0.00000000006457397,2.47,4.73
727.42 ,Ganglion of tendon sheath,Diseases of the musculoskeletal...,2602,16,3.39,0.000036741,1.94,5.53
722.90 ,"Other and unspecified disc disorder,...",Diseases of the musculoskeletal...,2788,17,3.37,0.0000236746,1.96,5.41
714.9 ,Unspecified inflammatory polyarthropathy,Diseases of the musculoskeletal...,2626,16,3.36,0.0000408906,1.92,5.48
882.1 ,Open wound of hand except finger(s)...,Injury and poisoning,1978,12,3.35,0.0003706853,1.72,5.87
844.2 ,Sprain of cruciate ligament of...,Injury and poisoning,2150,13,3.34,0.0002225508,1.77,5.72
844.1 ,Sprain of medial collateral ligament...,Injury and poisoning,2154,13,3.33,0.0002265072,1.77,5.71
716.10 ,"Traumatic arthropathy, site unspecified",Diseases of the musculoskeletal...,2993,18,3.32,0.0000165724,1.96,5.27
307.4 ,Specific disorders of sleep of...,Mental disorders,3675,22,3.31,0.0000021931749,2.07,5.02
943.00 ,Burn of unspecified degree of...,Injury and poisoning,2501,15,3.31,0.000083208,1.85,5.48
727.00 ,"Synovitis and tenosynovitis, unspecified",Diseases of the musculoskeletal...,97731,518,3.28,2.16067e-103,2.98,3.6
715.96 ,"Osteoarthrosis, unspecified whether...",Diseases of the musculoskeletal...,4051,24,3.28,0.00000093017132,2.09,4.89
891.1 ,"Open wound of knee, leg [except...",Injury and poisoning,4937,29,3.25,0.000000087177916,2.17,4.68
922.2 ,Contusion of abdominal wall,Injury and poisoning,3435,20,3.22,0.0000092195216,1.96,4.98
617.8 ,Endometriosis of other specified...,Diseases of the genitourinary...,2400,14,3.22,0.0001870381,1.75,5.42
845.09 ,Other sprains and strains of ankle,Injury and poisoning,7962,46,3.21,0.00000000003060231,2.34,4.29
924.11 ,Contusion of knee,Injury and poisoning,15791,90,3.2,3.570915e-20,2.56,3.94
717.9 ,Unspecified internal derangement...,Diseases of the musculoskeletal...,3625,21,3.2,0.0000060245984,1.98,4.91
354.9 ,"Mononeuritis of upper limb, unspecified",Diseases of the nervous system,1902,11,3.19,0.0009374504,1.59,5.72
724.79 ,Other disorders of coccyx,Diseases of the musculoskeletal...,3999,23,3.18,0.0000025125783,2.01,4.78
719.48 ,"Pain in joint, other specified...",Diseases of the musculoskeletal...,3509,20,3.15,0.0000124641,1.92,4.88
873.42 ,"Open wound of forehead, without...",Injury and poisoning,1928,11,3.14,0.0010438462,1.57,5.65
880.03 ,"Open wound of upper arm, without...",Injury and poisoning,2285,13,3.14,0.0003939006,1.67,5.38
726.90 ,Enthesopathy of unspecified site,Diseases of the musculoskeletal...,50088,269,3.13,1.840405e-53,2.75,3.55
437.9 ,Unspecified cerebrovascular disease,Diseases of the circulatory system,3183,18,3.12,0.0000365003,1.84,4.95
727.43 ,"Ganglion, unspecified",Diseases of the musculoskeletal...,5705,32,3.1,0.00000005452063,2.12,4.4
367.53 ,Spasm of accommodation,Diseases of the nervous system,6664,37,3.08,0.0000000068133599,2.16,4.25
924.5 ,Contusion of unspecified part...,Injury and poisoning,7855,43,3.04,0.0000000006542199,2.19,4.1
728.89 ,"Other disorders of muscle, ligament,...",Diseases of the musculoskeletal...,13867,75,3.02,6.85361e-16,2.37,3.8
738.4 ,Acquired spondylolisthesis,Diseases of the musculoskeletal...,2199,12,3.01,0.0009230447,1.55,5.27
924.10 ,Contusion of lower leg,Injury and poisoning,6458,35,3,0.000000030562407,2.08,4.19
716.99 ,"Arthropathy, unspecified, multiple...",Diseases of the musculoskeletal...,2408,13,2.98,0.0006369759,1.58,5.11
722.10 ,Displacement of lumbar intervertebral...,Diseases of the musculoskeletal...,25062,132,2.98,7.355994e-26,2.48,3.54
728.8 ,"Other disorders of muscle, ligament...",Diseases of the musculoskeletal...,3528,19,2.97,0.0000429549,1.78,4.66
306 ,Physiological malfunction arising...,Mental disorders,2598,14,2.97,0.0004097539,1.62,5
924.01 ,Contusion of hip,Injury and poisoning,4467,24,2.97,0.0000047857355,1.9,4.43
722.91 ,"Other and unspecified disc disorder,...",Diseases of the musculoskeletal...,4273,23,2.97,0.0000072441088,1.88,4.47
723.4 ,"Brachial neuritis or radiculitis,...",Diseases of the musculoskeletal...,6338,34,2.97,0.000000060399445,2.05,4.16
945.00 ,Burn of unspecified degree of...,Injury and poisoning,3351,18,2.96,0.0000695347,1.75,4.7
597.89 ,Other urethritis,Diseases of the genitourinary...,6193,33,2.95,0.00000010875474,2.02,4.15
854.01 ,Intracranial injury of other and...,Injury and poisoning,5287,28,2.93,0.0000010732997,1.94,4.24
919.1 ,"Abrasion or friction burn of other,...",Injury and poisoning,2073,11,2.92,0.0018356115,1.46,5.25
919.9 ,Other and unspecified superficial...,Injury and poisoning,1888,10,2.92,0.0029332246,1.4,5.38
727.01 ,Synovitis and tenosynovitis in...,Diseases of the musculoskeletal...,2858,15,2.89,0.0003412441,1.62,4.79
367.4 ,Presbyopia,Diseases of the nervous system,5969,31,2.87,0.00000044273698,1.95,4.09
912.0 ,Abrasion or friction burn of shoulder...,Injury and poisoning,2144,11,2.83,0.0023720895,1.41,5.07
924.21 ,Contusion of ankle,Injury and poisoning,5668,29,2.83,0.0000013634279,1.89,4.07
726.19 ,Other specified disorders of bursae...,Diseases of the musculoskeletal...,4883,25,2.83,0.0000069333951,1.83,4.19
881.02 ,"Open wound of wrist, without mention...",Injury and poisoning,2340,12,2.82,0.0015483623,1.46,4.95
825.25 ,Closed fracture of metatarsal...,Injury and poisoning,2558,13,2.8,0.0010938781,1.49,4.8
722.2 ,Displacement of intervertebral...,Diseases of the musculoskeletal...,15353,77,2.8,0.00000000000001341803,2.2,3.51
715.90 ,"Osteoarthrosis, unspecified whether...",Diseases of the musculoskeletal...,28810,142,2.79,4.924378e-25,2.34,3.3
892.1 ,Open wound of foot except toe(s)...,Injury and poisoning,2376,12,2.78,0.0017543834,1.43,4.87
726.12 ,Bicipital tenosynovitis,Diseases of the musculoskeletal...,2577,13,2.78,0.0011675919,1.48,4.77
722.0 ,Displacement of cervical intervertebral...,Diseases of the musculoskeletal...,10946,54,2.74,0.0000000001941707,2.05,3.59
845.0 ,Sprains and strains of ankle,Injury and poisoning,3625,18,2.74,0.0001809242,1.62,4.34
790.6 ,Other abnormal blood chemistry,"Comorbidities, signs, and ill-defined...",3842,19,2.73,0.0001281109,1.64,4.27
682.6 ,"Cellulitis and abscess of leg,...",Diseases of the skin and subcutaneous...,5070,25,2.72,0.000012899,1.76,4.03
854.09 ,Intracranial injury of other and...,Injury and poisoning,2641,13,2.71,0.0014470294,1.44,4.65
724.8 ,Other symptoms referable to back,Diseases of the musculoskeletal...,2260,11,2.68,0.0035157957,1.33,4.81
300.5 ,Neurasthenia,Mental disorders,2274,11,2.66,0.0036794196,1.33,4.78
681.02 ,Onychia and paronychia of finger,Diseases of the skin and subcutaneous...,6433,31,2.66,0.0000020294089,1.8,3.79
717.7 ,Chondromalacia of patella,Diseases of the musculoskeletal...,10011,48,2.66,0.0000000045910026,1.95,3.54
719.46 ,"Pain in joint, lower leg",Diseases of the musculoskeletal...,8378,40,2.64,0.000000093664846,1.88,3.61
523.0 ,Acute gingivitis,Diseases of the digestive system,5669,27,2.63,0.0000109309,1.73,3.84
634.00 ,"Spontaneous abortion, complicated...","Complications of pregnancy, childbirth,...",2522,12,2.62,0.002833653,1.35,4.59
920 ,"Contusion of face, scalp, and...",Injury and poisoning,25495,119,2.62,2.154312e-19,2.17,3.15
922.3 ,Contusion of back,Injury and poisoning,17463,82,2.62,0.00000000000007135115,2.08,3.26
560.1 ,Paralytic ileus,Diseases of the digestive system,3579,17,2.62,0.0004420835,1.52,4.2
719.4 ,Pain in joint,Diseases of the musculoskeletal...,11654,55,2.62,0.0000000006285287,1.97,3.42
727.0 ,Synovitis and tenosynovitis,Diseases of the musculoskeletal...,14491,68,2.61,0.00000000001102126,2.02,3.32
555.1 ,Regional enteritis of large intestine,Diseases of the digestive system,4012,19,2.61,0.0002192847,1.57,4.09
848 ,Other and ill-defined sprains...,Injury and poisoning,2750,13,2.6,0.002049755,1.38,4.47
883.1 ,"Open wound of finger(s), complicated",Injury and poisoning,5731,27,2.6,0.0000131877,1.71,3.8
715.30 ,"Osteoarthrosis, localized, not...",Diseases of the musculoskeletal...,2568,12,2.57,0.0032679049,1.33,4.51
110.2 ,Dermatophytosis of hand,Infectious and parasitic diseases,2802,13,2.55,0.0024027428,1.36,4.38
682.7 ,"Cellulitis and abscess of foot,...",Diseases of the skin and subcutaneous...,2387,11,2.54,0.0052343722,1.26,4.55
214.1 ,Lipoma of other skin and subcutaneous...,Neoplasms,2170,10,2.54,0.0075425691,1.21,4.68
840 ,Sprains and strains of shoulder...,Injury and poisoning,2389,11,2.53,0.0052659382,1.26,4.55
216.6 ,Benign neoplasm of skin of upper...,Neoplasms,3483,16,2.53,0.0009047015,1.44,4.12
724.1 ,Pain in thoracic spine,Diseases of the musculoskeletal...,2179,10,2.53,0.0077500599,1.21,4.66
274.0 ,"Gouty arthropathy, unspecified","Endocrine, nutritional and metabolic...",16315,74,2.53,0.000000000004894977,1.98,3.18
882.0 ,Open wound of hand except finger(s)...,Injury and poisoning,15215,69,2.52,0.0000000000256599,1.96,3.2
300.01 ,Panic disorder without agoraphobia,Mental disorders,5247,24,2.52,0.0000604454,1.61,3.77
715.9 ,"Osteoarthrosis, unspecified whether...",Diseases of the musculoskeletal...,8784,40,2.52,0.00000041014545,1.8,3.44
721.0 ,Cervical spondylosis without myelopathy,Diseases of the musculoskeletal...,22237,100,2.52,0.00000000000000164159,2.04,3.07
427.2 ,"Paroxysmal tachycardia, unspecified",Diseases of the circulatory system,2415,11,2.51,0.0056901279,1.25,4.5
723.8 ,Other syndromes affecting cervical...,Diseases of the musculoskeletal...,2848,13,2.51,0.0027551486,1.33,4.31
646.01 ,"Papyraceous fetus, delivered,...","Complications of pregnancy, childbirth,...",2222,10,2.48,0.008802719,1.18,4.57
737.30 ,"Scoliosis [and kyphoscoliosis],...",Diseases of the musculoskeletal...,4917,22,2.47,0.0001620098,1.54,3.75
995.2 ,Unspecified adverse effect od...,Injury and poisoning,2455,11,2.47,0.0063947398,1.23,4.43
229.9 ,Benign neoplasm of unspecified...,Neoplasms,2673,12,2.47,0.0044618485,1.27,4.33
913.0 ,"Abrasion or friction burn of elbow,...",Injury and poisoning,8321,37,2.46,0.0000016736612,1.73,3.4
923.10 ,Contusion of forearm,Injury and poisoning,2905,13,2.46,0.003249242,1.31,4.23
787.7 ,Abnormal feces,"Comorbidities, signs, and ill-defined...",5154,23,2.46,0.0001211559,1.56,3.7
716.90 ,"Arthropathy, unspecified, site...",Diseases of the musculoskeletal...,32787,143,2.46,2.141312e-20,2.06,2.91
533.00 ,Acute peptic ulcer of unspecified...,Diseases of the digestive system,7443,33,2.45,0.0000066436602,1.68,3.45
715.09 ,"Osteoarthrosis, generalized, multiple...",Diseases of the musculoskeletal...,2249,10,2.45,0.0095175322,1.17,4.51
719.41 ,"Pain in joint, shoulder region",Diseases of the musculoskeletal...,8355,37,2.45,0.0000017973633,1.72,3.39
296.90 ,Unspecified episodic mood disorder,Mental disorders,4292,19,2.44,0.0004942406,1.47,3.82
883.0 ,"Open wound of finger(s), without...",Injury and poisoning,32307,140,2.44,8.603419e-20,2.05,2.89
346.1 ,Common migraine,Diseases of the nervous system,7025,31,2.44,0.0000138271,1.65,3.47
729.4 ,"Fasciitis, unspecified",Diseases of the musculoskeletal...,87523,362,2.43,6.754127e-46,2.17,2.71
910.0 ,"Abrasion or friction burn of face,...",Injury and poisoning,6809,30,2.43,0.0000197032,1.64,3.48
916.0 ,"Abrasion or friction burn of hip,...",Injury and poisoning,19007,83,2.43,0.000000000002127952,1.93,3.03
704.01 ,Alopecia areata,Diseases of the skin and subcutaneous...,4310,19,2.43,0.0005192603,1.46,3.8
256.8 ,Other ovarian dysfunction,"Endocrine, nutritional and metabolic...",5219,23,2.43,0.0002158869,1.54,3.66
724.5 ,"Backache, unspecified",Diseases of the musculoskeletal...,143311,565,2.41,1.807293e-66,2.2,2.64
211.3 ,Benign neoplasm of colon,Neoplasms,2293,10,2.4,0.0107762375,1.15,4.43
716.98 ,"Arthropathy, unspecified, other...",Diseases of the musculoskeletal...,2981,13,2.4,0.0040176696,1.28,4.12
850.9 ,"Concussion, unspecified",Injury and poisoning,9724,42,2.39,0.00000095620697,1.72,3.24
923.03 ,Contusion of upper arm,Injury and poisoning,2073,9,2.39,0.0154699274,1.09,4.55
680.8 ,Carbuncle and furuncle of other...,Diseases of the skin and subcutaneous...,3038,13,2.36,0.0046852537,1.25,4.04
829.0 ,"Fracture of unspecified bone,...",Injury and poisoning,2800,12,2.36,0.006346652,1.22,4.13
573.8 ,Other specified disorders of liver,Diseases of the digestive system,3276,14,2.35,0.0034660115,1.28,3.96
614.1 ,Chronic salpingitis and oophoritis,Diseases of the genitourinary...,3047,13,2.35,0.004798363,1.25,4.03
296.20 ,"Major depressive affective disorder,...",Mental disorders,5187,22,2.34,0.0004082497,1.46,3.55
786.1 ,Stridor,"Comorbidities, signs, and ill-defined...",3067,13,2.33,0.0050575719,1.24,4
924.00 ,Contusion of thigh,Injury and poisoning,4021,17,2.33,0.0021741321,1.35,3.74
443.9 ,"Peripheral vascular disease, unspecified",Diseases of the circulatory system,4733,20,2.33,0.000804667,1.42,3.61
977.9 ,Poisoning by unspecified drug...,Injury and poisoning,4513,19,2.32,0.001145755,1.39,3.63
723.1 ,Cervicalgia,Diseases of the musculoskeletal...,32460,134,2.32,2.855635e-17,1.94,2.76
726.0 ,Adhesive capsulitis of shoulder,Diseases of the musculoskeletal...,9527,40,2.32,0.0000026681219,1.65,3.17
306.2 ,Cardiovascular malfunction arising...,Mental disorders,3573,15,2.31,0.0044433417,1.29,3.82
355.0 ,Lesion of sciatic nerve,Diseases of the nervous system,2377,10,2.31,0.0135248192,1.11,4.27
924.9 ,Contusion of unspecified site,Injury and poisoning,19788,82,2.31,0.00000000004193126,1.83,2.88
215 ,Other benign neoplasm of connective...,Neoplasms,2144,9,2.31,0.0187527257,1.05,4.4
719.40 ,"Pain in joint, site unspecified",Diseases of the musculoskeletal...,40910,167,2.31,9.925378e-21,1.96,2.7
225.0 ,Benign neoplasm of brain,Neoplasms,2616,11,2.31,0.0099461613,1.15,4.15
722.1 ,Displacement of thoracic or lumbar...,Diseases of the musculoskeletal...,3341,14,2.31,0.0063219371,1.26,3.88
882 ,Open wound of hand except finger(s)...,Injury and poisoning,2626,11,2.3,0.0102084529,1.15,4.14
892.0 ,Open wound of foot except toe(s)...,Injury and poisoning,14214,59,2.3,0.00000001668915,1.75,2.98
345.90 ,"Epilepsy, unspecified, without...",Diseases of the nervous system,3594,15,2.3,0.0045528806,1.28,3.8
599.9 ,Unspecified disorder of urethra...,Diseases of the genitourinary...,7914,33,2.3,0.0000261927,1.58,3.24
719.45 ,"Pain in joint, pelvic region and...",Diseases of the musculoskeletal...,2872,12,2.3,0.0076656332,1.19,4.03
300.89 ,Other somatoform disorders,Mental disorders,4561,19,2.29,0.0012377331,1.38,3.59
722.71 ,Intervertebral disc disorder with...,Diseases of the musculoskeletal...,2160,9,2.29,0.0195572474,1.05,4.36
386.19 ,Other peripheral vertigo,Diseases of the nervous system,3868,16,2.28,0.0034078282,1.3,3.71
721.3 ,Lumbosacral spondylosis without...,Diseases of the musculoskeletal...,36287,147,2.28,3.705386e-18,1.92,2.69
782.2 ,"Localized superficial swelling,...","Comorbidities, signs, and ill-defined...",2184,9,2.27,0.0208103632,1.03,4.31
716.50 ,Unspecified polyarthropathy or...,Diseases of the musculoskeletal...,1934,8,2.27,0.027750048,0.98,4.5
720.0 ,Ankylosing spondylitis,Diseases of the musculoskeletal...,5584,23,2.27,0.0004059699,1.44,3.42
881.01 ,"Open wound of elbow, without mention...",Injury and poisoning,2434,10,2.26,0.0156684358,1.08,4.17
854.00 ,Intracranial injury of other and...,Injury and poisoning,10056,41,2.25,0.0000051946654,1.61,3.07
571.8 ,Other chronic nonalcoholic liver...,Diseases of the digestive system,6130,25,2.25,0.0002580315,1.45,3.33
724.3 ,Sciatica,Diseases of the musculoskeletal...,49489,196,2.25,1.152987e-22,1.94,2.6
881.00 ,"Open wound of forearm, without...",Injury and poisoning,6891,28,2.24,0.0001602075,1.49,3.25
372.56 ,Conjunctival deposits,Diseases of the nervous system,3435,14,2.24,0.0070590872,1.22,3.77
054.2 ,Herpetic gingivostomatitis,Infectious and parasitic diseases,4920,20,2.24,0.0011246224,1.36,3.47
848.9 ,Unspecified site of sprain and...,Injury and poisoning,100895,383,2.23,2.390727e-40,2,2.48
709.2 ,Scar conditions and fibrosis of...,Diseases of the skin and subcutaneous...,7161,29,2.23,0.0001215096,1.49,3.22
715.00 ,"Osteoarthrosis, generalized, site...",Diseases of the musculoskeletal...,4697,19,2.23,0.0015779409,1.34,3.49
215.9 ,Other benign neoplasm of connective...,Neoplasms,5939,24,2.23,0.0005914075,1.42,3.32
721.1 ,Cervical spondylosis with myelopathy,Diseases of the musculoskeletal...,7185,29,2.23,0.0001257139,1.49,3.21
555.0 ,Regional enteritis of small intestine,Diseases of the digestive system,3725,15,2.22,0.0054551359,1.24,3.67
726.1 ,"Rotator cuff syndrome of shoulder,...",Diseases of the musculoskeletal...,1984,8,2.22,0.0315287664,0.95,4.38
786.01 ,Hyperventilation,"Comorbidities, signs, and ill-defined...",6499,26,2.21,0.0003368399,1.44,3.24
372.51 ,Pinguecula,Diseases of the nervous system,1993,8,2.21,0.032244417,0.95,4.36
724.2 ,Lumbago,Diseases of the musculoskeletal...,207616,732,2.21,4.003513e-68,2.03,2.4
274.9 ,"Gout, unspecified","Endocrine, nutritional and metabolic...",20637,82,2.21,0.0000000002269968,1.75,2.76
349.89 ,Other specified disorders of nervous...,Diseases of the nervous system,3508,14,2.2,0.0078212175,1.2,3.69
372.40 ,"Pterygium, unspecified",Diseases of the nervous system,4755,19,2.2,0.0017627752,1.32,3.45
131.0 ,Urogenital trichomoniasis,Infectious and parasitic diseases,1997,8,2.2,0.0325660082,0.95,4.35
300.3 ,Obsessive-compulsive disorders,Mental disorders,2024,8,2.17,0.0347939609,0.94,4.29
578.1 ,Blood in stool,Diseases of the digestive system,2028,8,2.17,0.035132565,0.93,4.29
701.2 ,Acquired acanthosis nigricans,Diseases of the skin and subcutaneous...,2788,11,2.17,0.0213435444,1.08,3.89
721.42 ,"Spondylosis with myelopathy, lumbar...",Diseases of the musculoskeletal...,3554,14,2.17,0.0083914245,1.18,3.65
727.06 ,Tenosynovitis of foot and ankle,Diseases of the musculoskeletal...,3307,13,2.16,0.0114922373,1.15,3.71
729.1 ,"Myalgia and myositis, unspecified",Diseases of the musculoskeletal...,169659,602,2.16,1.384871e-55,1.98,2.37
634.91 ,"Spontaneous abortion, without...","Complications of pregnancy, childbirth,...",4118,16,2.14,0.0051586542,1.22,3.48
692.79 ,Other dermatitis due to solar...,Diseases of the skin and subcutaneous...,9803,38,2.14,0.0000246747,1.51,2.95
389.10 ,"Sensorineural hearing loss, unspecified",Diseases of the nervous system,3603,14,2.14,0.0090788735,1.17,3.6
854 ,Intracranial injury of other and...,Injury and poisoning,2326,9,2.13,0.0436433997,0.97,4.05
570 ,Acute and subacute necrosis of...,Diseases of the digestive system,2325,9,2.13,0.0436012349,0.97,4.05
722.93 ,"Other and unspecified disc disorder,...",Diseases of the musculoskeletal...,8823,34,2.13,0.0000779848,1.47,2.98
524.62 ,"Temporomandibular joint disorders,...",Diseases of the digestive system,3377,13,2.12,0.0127844711,1.12,3.63
958.3 ,Posttraumatic wound infection...,Injury and poisoning,12777,49,2.12,0.0000031108886,1.57,2.81
873.0 ,"Open wound of scalp, without mention...",Injury and poisoning,9936,38,2.11,0.0000437903,1.49,2.91
722 ,Intervertebral disc disorders,Diseases of the musculoskeletal...,5471,21,2.11,0.0020165922,1.31,3.24
728.9 ,"Unspecified disorder of muscle,...",Diseases of the musculoskeletal...,27670,104,2.1,0.00000000002173291,1.71,2.55
