386.2 ,Vertigo of central origin,Diseases of the nervous system,4720,36,1.86,0.0005930236,1.3,2.58
639.8 ,Other specified complications...,"Complications of pregnancy, childbirth,...",2095,16,1.86,0.023875251,1.06,3.03
296.3 ,"Major depressive disorder, recurrent...",Mental disorders,2614,20,1.86,0.0089324162,1.13,2.88
854.00 ,Intracranial injury of other and...,Injury and poisoning,14071,107,1.86,0.0000000066528954,1.52,2.25
310.2 ,Postconcussion syndrome,Mental disorders,4583,35,1.86,0.0007256986,1.29,2.59
719.40 ,"Pain in joint, site unspecified",Diseases of the musculoskeletal...,20780,157,1.85,0.000000000003092201,1.57,2.17
465.9 ,Acute upper respiratory infections...,Diseases of the respiratory system,1408969,6431,1.85,6.432774e-78,1.72,1.98
493.90 ,"Asthma, unspecified type, unspecified",Diseases of the respiratory system,36997,277,1.85,4.529269e-20,1.64,2.09
372.12 ,Chronic follicular conjunctivitis,Diseases of the nervous system,5662,43,1.85,0.0002362365,1.34,2.5
790.6 ,Other abnormal blood chemistry,"Comorbidities, signs, and ill-defined...",2242,17,1.84,0.0189700481,1.07,2.96
375.15 ,"Tear film insufficiency, unspecified",Diseases of the nervous system,22598,168,1.83,0.000000000001787083,1.56,2.13
614 ,"Inflammatory disease of ovary,...",Diseases of the genitourinary...,6670,50,1.83,0.0001089515,1.35,2.41
881.01 ,"Open wound of elbow, without mention...",Injury and poisoning,3867,29,1.83,0.0034398106,1.22,2.63
372.71 ,Hyperemia of conjunctiva,Diseases of the nervous system,4403,33,1.82,0.0013567636,1.25,2.57
427.89 ,Other specified cardiac dysrhythmias,Diseases of the circulatory system,3617,27,1.82,0.0039173068,1.19,2.65
620.2 ,Other and unspecified ovarian...,Diseases of the genitourinary...,48302,354,1.82,9.387024e-24,1.63,2.03
474.0 ,Chronic tonsillitis,Diseases of the respiratory system,9381,70,1.82,0.0000050041794,1.42,2.31
491.8 ,Other chronic bronchitis,Diseases of the respiratory system,2808,21,1.82,0.0110735395,1.12,2.79
786.5 ,Chest pain,"Comorbidities, signs, and ill-defined...",22685,168,1.82,0.000000000002742079,1.55,2.12
362.10 ,"Background retinopathy, unspecified",Diseases of the nervous system,2402,18,1.82,0.0159486521,1.08,2.89
599.0 ,"Urinary tract infection, site...",Diseases of the genitourinary...,214263,1458,1.81,3.368701e-81,1.71,1.92
622.7 ,Mucous polyp of cervix,Diseases of the genitourinary...,4856,36,1.81,0.0010420008,1.26,2.5
784.0 ,Headache,"Comorbidities, signs, and ill-defined...",295966,1944,1.81,3.28536e-100,1.72,1.9
786.01 ,Hyperventilation,"Comorbidities, signs, and ill-defined...",7809,58,1.81,0.0000394247,1.37,2.35
786.59 ,Other chest pain,"Comorbidities, signs, and ill-defined...",11585,86,1.81,0.00000060344864,1.45,2.24
881.0 ,"Open wound of elbow, forearm,...",Injury and poisoning,2280,17,1.81,0.0205565207,1.05,2.91
845 ,Sprains and strains of ankle and...,Injury and poisoning,3365,25,1.81,0.0063740621,1.17,2.68
916.1 ,"Abrasion or friction burn of hip,...",Injury and poisoning,4045,30,1.81,0.002867661,1.22,2.58
696.5 ,Other and unspecified pityriasis,Diseases of the skin and subcutaneous...,5005,37,1.8,0.0012028263,1.26,2.49
596.5 ,Other functional disorders of...,Diseases of the genitourinary...,5942,44,1.8,0.0003378067,1.31,2.43
008.6 ,"Virus Enteritis, specified",Infectious and parasitic diseases,3784,28,1.8,0.0046722815,1.19,2.61
611.79 ,Other signs and symptoms in breast,Diseases of the genitourinary...,2839,21,1.8,0.0117514513,1.11,2.76
625.8 ,Other specified symptoms associated...,Diseases of the genitourinary...,2970,22,1.8,0.0093420146,1.13,2.74
473.0 ,Chronic maxillary sinusitis,Diseases of the respiratory system,3249,24,1.8,0.008328453,1.15,2.68
370.23 ,Filamentary keratitis,Diseases of the nervous system,2573,19,1.8,0.0190440051,1.08,2.81
922 ,Contusion of trunk,Injury and poisoning,4879,36,1.8,0.0010939727,1.26,2.49
693.0 ,Dermatitis due to drugs and medicines...,Diseases of the skin and subcutaneous...,9486,70,1.8,0.0000082527686,1.4,2.28
379.99 ,Other ill-defined disorders of...,Diseases of the nervous system,4070,30,1.79,0.002999337,1.21,2.57
427.9 ,"Cardiac dysrhythmia, unspecified",Diseases of the circulatory system,21946,160,1.79,0.00000000002567747,1.52,2.09
624.9 ,Unspecified noninflammatory disorder...,Diseases of the genitourinary...,2988,22,1.79,0.0097434816,1.12,2.72
493.91 ,"Asthma, unspecified type, with...",Diseases of the respiratory system,3665,27,1.79,0.0061010799,1.18,2.61
306.1 ,Respiratory malfunction arising...,Mental disorders,2172,16,1.79,0.0274325662,1.02,2.92
070.9 ,Unspecified viral hepatitis without...,Infectious and parasitic diseases,6575,48,1.78,0.0002267748,1.31,2.36
427.0 ,Paroxysmal supraventricular tachycardia,Diseases of the circulatory system,2870,21,1.78,0.012547638,1.1,2.73
873.8 ,Other and unspecified open wound...,Injury and poisoning,4504,33,1.78,0.0022168814,1.23,2.51
883 ,Open wound of finger(s),Injury and poisoning,5066,37,1.78,0.0012966452,1.25,2.46
681.11 ,Onychia and paronychia of toe,Diseases of the skin and subcutaneous...,12610,92,1.78,0.00000042408239,1.43,2.19
571.5 ,Cirrhosis of liver without mention...,Diseases of the digestive system,2049,15,1.78,0.0356128766,0.99,2.94
583.9 ,"Nephritis and nephropathy, not...",Diseases of the genitourinary...,4522,33,1.78,0.0022819805,1.22,2.5
620.1 ,Corpus luteum cyst or hematoma,Diseases of the genitourinary...,5361,39,1.77,0.0008850218,1.26,2.43
239.8 ,"Neoplasms of unspecified nature,...",Neoplasms,2204,16,1.77,0.0294046721,1.01,2.87
780.59 ,Other sleep disturbances,"Comorbidities, signs, and ill-defined...",3716,27,1.77,0.0064642468,1.16,2.58
531.30 ,Acute gastric ulcer without mention...,Diseases of the digestive system,4390,32,1.77,0.0028767612,1.21,2.51
786.50 ,"Chest pain, unspecified","Comorbidities, signs, and ill-defined...",41375,297,1.77,7.174888e-19,1.57,1.99
590.10 ,Acute pyelonephritis without lesion...,Diseases of the genitourinary...,14855,107,1.76,0.00000010853509,1.44,2.13
386.0 ,Meniere's disease,Diseases of the nervous system,2213,16,1.76,0.0300126521,1,2.86
626.7 ,Postcoital bleeding,Diseases of the genitourinary...,3313,24,1.76,0.0092707076,1.13,2.63
523.0 ,Acute gingivitis,Diseases of the digestive system,5679,41,1.76,0.0008242253,1.26,2.39
890.0 ,"Open wound of hip and thigh, without...",Injury and poisoning,4711,34,1.76,0.0027812964,1.21,2.46
923.11 ,Contusion of elbow,Injury and poisoning,6363,46,1.76,0.0003826906,1.29,2.35
583 ,"Nephritis and nephropathy, not...",Diseases of the genitourinary...,1930,14,1.76,0.0468297428,0.96,2.97
005.9 ,"Food poisoning, unspecified",Infectious and parasitic diseases,2356,17,1.75,0.0337401622,1.02,2.82
034.0 ,Streptococcal sore throat,Infectious and parasitic diseases,6122,44,1.75,0.0006141294,1.27,2.36
923 ,Contusion of upper limb,Injury and poisoning,4301,31,1.75,0.003863775,1.19,2.5
710.9 ,Unspecified diffuse connective...,Diseases of the musculoskeletal...,2516,18,1.74,0.0273107598,1.03,2.76
719.44 ,"Pain in joint, hand",Diseases of the musculoskeletal...,2100,15,1.74,0.0393936929,0.97,2.87
300.3 ,Obsessive-compulsive disorders,Mental disorders,1951,14,1.74,0.0484909551,0.95,2.94
558.1 ,Gastroenteritis and colitis due...,Diseases of the digestive system,2653,19,1.74,0.0217724427,1.05,2.73
472.2 ,Chronic nasopharyngitis,Diseases of the respiratory system,34653,243,1.73,0.0000000000000126886,1.51,1.96
850 ,Concussion,Injury and poisoning,7190,51,1.73,0.0002962059,1.28,2.28
300.00 ,"Anxiety state, unspecified",Mental disorders,53554,374,1.73,1.402276e-21,1.56,1.92
787.9 ,Other symptoms involving digestive...,"Comorbidities, signs, and ill-defined...",10734,76,1.73,0.000014366,1.36,2.17
569.3 ,Hemorrhage of rectum and anus,Diseases of the digestive system,4644,33,1.73,0.0037861121,1.19,2.43
924.8 ,"Contusion of multiple sites, not...",Injury and poisoning,2969,21,1.72,0.0203175812,1.06,2.64
614.1 ,Chronic salpingitis and oophoritis,Diseases of the genitourinary...,2408,17,1.72,0.0361177016,1,2.76
530.1 ,Esophagitis,Diseases of the digestive system,23411,164,1.72,0.0000000002937834,1.46,2.01
307.81 ,Tension headache,Mental disorders,28448,199,1.72,0.000000000003848781,1.48,1.98
541 ,"Appendicitis, unqualified",Diseases of the digestive system,2126,15,1.72,0.0416847915,0.96,2.84
437.9 ,Unspecified cerebrovascular disease,Diseases of the circulatory system,1995,14,1.71,0.0526186513,0.93,2.87
726.4 ,Enthesopathy of wrist and carpus,Diseases of the musculoskeletal...,3124,22,1.71,0.0167267095,1.07,2.6
788.3 ,Incontinence of urine,"Comorbidities, signs, and ill-defined...",3558,25,1.71,0.0120281017,1.1,2.53
571.41 ,Chronic persistent hepatitis,Diseases of the digestive system,4280,30,1.71,0.0058013258,1.15,2.44
933.0 ,Foreign body in pharynx,Injury and poisoning,11601,81,1.7,0.0000112699,1.35,2.12
300.9 ,Unspecified nonpsychotic mental...,Mental disorders,30740,213,1.7,0.000000000001859481,1.48,1.95
532.90 ,"Duodenal ulcer, unspecified as...",Diseases of the digestive system,11470,80,1.7,0.0000140759,1.35,2.12
535.01 ,"Acute gastritis, with hemorrhage",Diseases of the digestive system,4002,28,1.7,0.0088322573,1.13,2.47
924.5 ,Contusion of unspecified part...,Injury and poisoning,10272,71,1.69,0.0000529137,1.31,2.13
592.9 ,"Urinary calculus, unspecified",Diseases of the genitourinary...,14275,99,1.69,0.0000014715982,1.37,2.07
133.0 ,Scabies,Infectious and parasitic diseases,9099,63,1.69,0.0001448406,1.29,2.16
785.6 ,Enlargement of lymph nodes,"Comorbidities, signs, and ill-defined...",9244,64,1.69,0.0001175284,1.3,2.16
564.1 ,Irritable bowel syndrome,Diseases of the digestive system,67940,462,1.69,3.033289e-24,1.54,1.86
464.11 ,Acute tracheitis with obstruction,Diseases of the respiratory system,12608,87,1.68,0.0000072564417,1.35,2.08
523.9 ,Unspecified gingival and periodontal...,Diseases of the digestive system,4937,34,1.68,0.0050639603,1.16,2.35
300 ,Neurotic disorders,Mental disorders,16845,116,1.68,0.00000024839775,1.39,2.02
616 ,"Inflammatory disease of cervix,...",Diseases of the genitourinary...,54276,366,1.67,8.366065e-19,1.5,1.86
478.4 ,Polyp of vocal cord or larynx,Diseases of the respiratory system,6721,46,1.67,0.0015207965,1.22,2.23
786.09 ,Other respiratory abnormalities,"Comorbidities, signs, and ill-defined...",9923,68,1.67,0.0001066519,1.29,2.12
532.9 ,"Duodenal ulcer, unspecified as...",Diseases of the digestive system,3485,24,1.67,0.016519893,1.07,2.5
788.4 ,Frequency of urination and polyuria,"Comorbidities, signs, and ill-defined...",25273,172,1.67,0.00000000097425,1.42,1.94
923.10 ,Contusion of forearm,Injury and poisoning,3063,21,1.67,0.0323449237,1.03,2.55
574.20 ,Calculus of gallbladder without...,Diseases of the digestive system,6709,46,1.67,0.0011253708,1.22,2.23
924.1 ,Contusion of knee and lower leg,Injury and poisoning,3375,23,1.66,0.0213480275,1.05,2.49
276.5 ,Volume depletion,"Endocrine, nutritional and metabolic...",11434,78,1.66,0.0000369382,1.31,2.08
296.2 ,"Major depressive disorder, single...",Mental disorders,4239,29,1.66,0.0109716862,1.11,2.4
535.0 ,Acute gastritis,Diseases of the digestive system,59049,396,1.66,5.520745e-20,1.5,1.84
911.4 ,"Insect bite, nonvenomous of trunk,...",Injury and poisoning,2485,17,1.66,0.0411849843,0.97,2.67
697.9 ,"Lichen, unspecified",Diseases of the skin and subcutaneous...,1912,13,1.65,0.0731614999,0.88,2.83
706.2 ,Sebaceous cyst,Diseases of the skin and subcutaneous...,19140,129,1.65,0.00000021251728,1.37,1.96
388.70 ,"Otalgia, unspecified",Diseases of the nervous system,3528,24,1.65,0.023945969,1.06,2.47
278.0 ,Obesity,"Endocrine, nutritional and metabolic...",11523,78,1.65,0.0000407263,1.3,2.06
780.7 ,Malaise and fatigue,"Comorbidities, signs, and ill-defined...",50560,338,1.65,5.221515e-17,1.48,1.84
528 ,"Disease of the oral soft tissues,...",Diseases of the digestive system,2062,14,1.65,0.0810344759,0.9,2.78
652.93 ,"Unspecified malposition or malpresentation,...","Complications of pregnancy, childbirth,...",2652,18,1.65,0.0460652484,0.98,2.61
361.30 ,"Retinal defect, unspecified",Diseases of the nervous system,2945,20,1.65,0.0303379533,1.01,2.56
924.21 ,Contusion of ankle,Injury and poisoning,7564,51,1.64,0.0011165498,1.22,2.16
626.8 ,Other disorders of menstruation...,Diseases of the genitourinary...,239962,1491,1.64,1.87308e-58,1.55,1.73
634.10 ,"Spontaneous abortion, complicated...","Complications of pregnancy, childbirth,...",2068,14,1.64,0.0815201561,0.9,2.77
272.4 ,Other and unspecified hyperlipidemia,"Endocrine, nutritional and metabolic...",15349,103,1.64,0.0000035399171,1.33,1.99
782.3 ,Edema,"Comorbidities, signs, and ill-defined...",13822,93,1.64,0.0000098948629,1.32,2.02
349 ,Other and unspecified disorders...,Diseases of the nervous system,2229,15,1.64,0.0661541298,0.91,2.7
791.0 ,Proteinuria,"Comorbidities, signs, and ill-defined...",4306,29,1.64,0.0119040892,1.09,2.36
910.0 ,"Abrasion or friction burn of face,...",Injury and poisoning,8145,55,1.64,0.0006672338,1.24,2.15
625.4 ,Premenstrual tension syndromes,Diseases of the genitourinary...,5688,38,1.63,0.0048939267,1.15,2.24
246.9 ,Unspecified disorder of thyroid,"Endocrine, nutritional and metabolic...",19195,128,1.63,0.00000040725509,1.36,1.94
780.8 ,Generalized hyperhidrosis,"Comorbidities, signs, and ill-defined...",8355,56,1.63,0.0005934562,1.23,2.12
854.01 ,Intracranial injury of other and...,Injury and poisoning,7038,47,1.63,0.0019632444,1.19,2.17
316 ,Psychic factors associated with...,Mental disorders,2086,14,1.63,0.0831031521,0.89,2.74
535.00 ,"Acute gastritis, without mention...",Diseases of the digestive system,214336,1338,1.63,9.16274e-53,1.53,1.73
681.02 ,Onychia and paronychia of finger,Diseases of the skin and subcutaneous...,4932,33,1.63,0.0098769396,1.12,2.29
920 ,"Contusion of face, scalp, and...",Injury and poisoning,31239,208,1.63,0.00000000008738945,1.42,1.88
372.15 ,Parasitic conjunctivitis,Diseases of the nervous system,2688,18,1.63,0.0481435525,0.96,2.58
933.1 ,Foreign body in larynx,Injury and poisoning,8868,59,1.62,0.0006104009,1.23,2.09
388.3 ,Tinitus,Diseases of the nervous system,5568,37,1.62,0.0061339129,1.14,2.23
616.10 ,"Vaginitis and vulvovaginitis,...",Diseases of the genitourinary...,380942,2249,1.62,7.143599e-76,1.54,1.71
447.6 ,"Arteritis, unspecified",Diseases of the circulatory system,3292,22,1.62,0.0286596966,1.02,2.47
112.9 ,Candidiasis of unspecified site,Infectious and parasitic diseases,7354,49,1.62,0.0018021547,1.2,2.15
626.2 ,Excessive or frequent menstruation,Diseases of the genitourinary...,77688,506,1.62,1.082111e-22,1.48,1.78
781.9 ,Other symptoms involving nervous...,"Comorbidities, signs, and ill-defined...",3603,24,1.62,0.0256953489,1.04,2.42
573.9 ,Unspecified disorder of liver,Diseases of the digestive system,6912,46,1.62,0.0024464032,1.18,2.16
381.81 ,Dysfunction of Eustachian tube,Diseases of the nervous system,22014,145,1.61,0.0000001413781,1.36,1.9
455.5 ,External hemorrhoids with other...,Diseases of the circulatory system,2562,17,1.61,0.0612625285,0.94,2.59
627.2 ,Symptomatic menopausal or female...,Diseases of the genitourinary...,3930,26,1.61,0.0236353437,1.05,2.36
644.0 ,Threatened premature labor,"Complications of pregnancy, childbirth,...",11185,74,1.61,0.0001471226,1.26,2.03
870.0 ,Laceration of skin of eyelid and...,Injury and poisoning,2257,15,1.61,0.0690019777,0.9,2.67
533.90 ,"Peptic ulcer of unspecified site,...",Diseases of the digestive system,76708,497,1.61,6.086504e-22,1.47,1.77
789.9 ,Other symptoms involving abdomen...,"Comorbidities, signs, and ill-defined...",9503,63,1.61,0.0003883496,1.24,2.07
370.0 ,Corneal ulcer,Diseases of the nervous system,2717,18,1.61,0.0501295842,0.95,2.55
372.9 ,Unspecified disorder of conjunctiva,Diseases of the nervous system,4853,32,1.6,0.0128794825,1.09,2.27
374.89 ,Other disorders of eyelid,Diseases of the nervous system,2127,14,1.6,0.0874070707,0.87,2.69
382.4 ,Unspecified suppurative otitis...,Diseases of the nervous system,2582,17,1.6,0.062715547,0.93,2.57
424.0 ,Mitral valve disorders,Diseases of the circulatory system,22432,147,1.6,0.0000001390864,1.35,1.89
621.5 ,Intrauterine synechiae,Diseases of the genitourinary...,2726,18,1.6,0.0508025452,0.95,2.54
250.00 ,Diabetes mellitus without mention...,"Endocrine, nutritional and metabolic...",15584,102,1.6,0.0000134257,1.3,1.94
883.0 ,"Open wound of finger(s), without...",Injury and poisoning,28109,183,1.6,0.0000000068284122,1.37,1.85
536.9 ,Unspecified functional disorder...,Diseases of the digestive system,254539,1543,1.6,1.678957e-54,1.51,1.69
362.60 ,"Peripheral retinal degeneration,...",Diseases of the nervous system,6830,45,1.6,0.003165255,1.17,2.15
473.9 ,Unspecified sinusitis (chronic),Diseases of the respiratory system,33525,217,1.59,0.0000000003786564,1.38,1.82
250.0 ,Diabetes Mellitus w/m of complication,"Endocrine, nutritional and metabolic...",4286,28,1.59,0.0222532118,1.05,2.3
493 ,Asthma,Diseases of the respiratory system,8748,57,1.59,0.0010629865,1.2,2.06
494 ,Bronchiectasis,Diseases of the respiratory system,2907,19,1.59,0.0571191818,0.95,2.49
873.42 ,"Open wound of forehead, without...",Injury and poisoning,1988,13,1.59,0.1103021936,0.84,2.72
362.9 ,Unspecified retinal disorder,Diseases of the nervous system,2756,18,1.59,0.0712331011,0.94,2.51
595 ,Cystitis,Diseases of the genitourinary...,20279,131,1.58,0.00000146997,1.32,1.88
780.9 ,Other general symptoms,"Comorbidities, signs, and ill-defined...",18708,121,1.58,0.0000031145053,1.31,1.89
785.1 ,Palpitations,"Comorbidities, signs, and ill-defined...",28149,182,1.58,0.00000001226828,1.36,1.84
787.3 ,"Flatulence, eructation, and gas...","Comorbidities, signs, and ill-defined...",52612,337,1.58,0.0000000000000184824,1.41,1.76
535.50 ,"Unspecified gastritis and gastroduodenitis,...",Diseases of the digestive system,175562,1083,1.58,9.982613e-40,1.48,1.69
680.0 ,Carbuncle and furuncle of face,Diseases of the skin and subcutaneous...,8006,52,1.58,0.0020934856,1.18,2.08
692.9 ,"Contact dermatitis and other eczema,...",Diseases of the skin and subcutaneous...,460660,2614,1.58,3.228029e-75,1.51,1.66
380.23 ,Other chronic otitis externa,Diseases of the nervous system,3563,23,1.57,0.0358880765,0.99,2.36
386.00 ,"Minihre's disease, unspecified",Diseases of the nervous system,11168,72,1.57,0.0003549919,1.23,1.98
218.9 ,"Leiomyoma of uterus, unspecified",Neoplasms,23248,149,1.57,0.00000040203041,1.32,1.84
530.2 ,Ulcer of esophagus,Diseases of the digestive system,3104,20,1.57,0.0493815922,0.95,2.42
530.9 ,Unspecified disorder of esophagus,Diseases of the digestive system,3402,22,1.57,0.0429804869,0.98,2.38
571.9 ,Unspecified chronic liver disease...,Diseases of the digestive system,9592,62,1.57,0.000769884,1.2,2.02
595.89 ,Other specified types of cystitis,Diseases of the genitourinary...,2022,13,1.56,0.1146531747,0.83,2.68
705.1 ,Prickly heat,Diseases of the skin and subcutaneous...,6539,42,1.56,0.0065039095,1.12,2.12
078.1 ,Viral warts,Infectious and parasitic diseases,69408,436,1.56,4.560251e-17,1.41,1.72
242.00 ,Toxic diffuse goiter without mention...,"Endocrine, nutritional and metabolic...",10765,69,1.56,0.0005029544,1.21,1.98
640.83 ,Other specified hemorrhage in...,"Complications of pregnancy, childbirth,...",4523,29,1.56,0.0261401904,1.04,2.24
281.9 ,Unspecified deficiency anemia,Diseases of the blood and blood-forming...,4681,30,1.56,0.0215236178,1.05,2.23
537.9 ,Unspecified disorder of stomach...,Diseases of the digestive system,4049,26,1.56,0.0353815365,1.02,2.29
911.0 ,"Abrasion or friction burn of trunk,...",Injury and poisoning,4201,27,1.56,0.0288204768,1.03,2.28
367.53 ,Spasm of accommodation,Diseases of the nervous system,4819,31,1.56,0.0175706893,1.06,2.22
367.89 ,Other disorders of refraction...,Diseases of the nervous system,6864,44,1.56,0.0059088149,1.13,2.1
564.0 ,Constipation,Diseases of the digestive system,153791,945,1.56,8.879677e-34,1.46,1.67
931 ,Foreign body in ear,Injury and poisoning,6452,41,1.55,0.0083085597,1.11,2.1
599.9 ,Unspecified disorder of urethra...,Diseases of the genitourinary...,6592,42,1.55,0.0068741759,1.11,2.1
614.4 ,Chronic or unspecified parametritis...,Diseases of the genitourinary...,8299,53,1.55,0.0025443459,1.16,2.04
617 ,Endometriosis,Diseases of the genitourinary...,3292,21,1.55,0.0547821971,0.96,2.37
640.9 ,Unspecified hemorrhage in early...,"Complications of pregnancy, childbirth,...",11653,74,1.55,0.0004711556,1.21,1.95
296 ,Disorganized type,Mental disorders,3606,23,1.55,0.0490597251,0.98,2.33
533.9 ,"Peptic ulcer, site unspecified,...",Diseases of the digestive system,30731,195,1.55,0.000000013617139,1.34,1.79
923.3 ,Contusion of finger,Injury and poisoning,3447,22,1.55,0.0452765993,0.97,2.35
698.8 ,Other specified pruritic conditions,Diseases of the skin and subcutaneous...,16788,106,1.54,0.0000361521,1.26,1.87
009.2 ,Infectious diarrhea,Infectious and parasitic diseases,33523,210,1.54,0.000000009435568,1.33,1.76
720.1 ,Spinal enthesopathy,Diseases of the musculoskeletal...,1890,12,1.54,0.1457156586,0.79,2.7
625.2 ,Mittelschmerz,Diseases of the genitourinary...,4893,31,1.54,0.024464471,1.04,2.19
226 ,Benign neoplasm of thyroid glands,Neoplasms,3619,23,1.54,0.0495271686,0.98,2.32
478.9 ,Other and unspecified diseases...,Diseases of the respiratory system,19942,126,1.54,0.0000062557829,1.28,1.84
643.91 ,"Unspecified vomiting of pregnancy,...","Complications of pregnancy, childbirth,...",2528,16,1.54,0.0868763043,0.88,2.5
530.8 ,Other specified disorders of esophagus,Diseases of the digestive system,2048,13,1.54,0.1185076558,0.82,2.64
891.0 ,"Open wound of knee, leg [except...",Injury and poisoning,34225,215,1.54,0.0000000048416862,1.34,1.77
913.0 ,"Abrasion or friction burn of elbow,...",Injury and poisoning,14232,90,1.54,0.0001311923,1.24,1.9
367.9 ,Unspecified disorder of refraction...,Diseases of the nervous system,29421,185,1.54,0.000000056191951,1.32,1.78
924.10 ,Contusion of lower leg,Injury and poisoning,8730,55,1.53,0.0032299353,1.15,2
614.6 ,"Pelvic peritoneal adhesions, female...",Diseases of the genitourinary...,6986,44,1.53,0.0084405603,1.11,2.06
386.10 ,"Peripheral vertigo, unspecified",Diseases of the nervous system,8287,52,1.53,0.0043773035,1.14,2.01
414.9 ,"Chronic ischemic heart disease,...",Diseases of the circulatory system,5726,36,1.53,0.0168451078,1.07,2.12
625.6 ,"Stress incontinence, female",Diseases of the genitourinary...,2544,16,1.53,0.0887964014,0.87,2.49
727.42 ,Ganglion of tendon sheath,Diseases of the musculoskeletal...,3011,19,1.53,0.0847539633,0.92,2.4
253.1 ,Other and unspecified anterior...,"Endocrine, nutritional and metabolic...",11786,74,1.53,0.0006637993,1.2,1.92
854 ,Intracranial injury of other and...,Injury and poisoning,3338,21,1.53,0.0575334295,0.94,2.34
646.90 ,"Unspecified complication of pregnancy,...","Complications of pregnancy, childbirth,...",14483,91,1.53,0.000150225,1.23,1.88
655.93 ,"Unspecified suspected fetal abnormality,...","Complications of pregnancy, childbirth,...",2534,16,1.53,0.0875822643,0.87,2.5
690 ,Erythematosquamous dermatosis,Diseases of the skin and subcutaneous...,32907,206,1.53,0.000000014846498,1.33,1.76
372.54 ,Conjunctival concretions,Diseases of the nervous system,21290,133,1.53,0.0000057976363,1.27,1.81
700 ,Corns and callosities,Diseases of the skin and subcutaneous...,10387,65,1.52,0.0015637403,1.17,1.95
614.7 ,"Other chronic pelvic peritonitis,...",Diseases of the genitourinary...,4642,29,1.52,0.0291212468,1.01,2.19
219.9 ,"Benign neoplasm of uterus, part...",Neoplasms,9109,57,1.52,0.0030273264,1.15,1.98
244.9 ,Unspecified acquired hypothyroidism,"Endocrine, nutritional and metabolic...",7349,46,1.52,0.0078296819,1.11,2.03
643.9 ,Unspecified vomiting of pregnancy,"Complications of pregnancy, childbirth,...",5116,32,1.52,0.02787753,1.04,2.15
784.7 ,Epistaxis,"Comorbidities, signs, and ill-defined...",18623,116,1.52,0.000025657,1.25,1.83
646.93 ,"Unspecified complication of pregnancy,...","Complications of pregnancy, childbirth,...",12659,79,1.52,0.000479608,1.2,1.9
879.8 ,Open wound(s) (multiple) of unspecified...,Injury and poisoning,18504,115,1.52,0.0000311238,1.25,1.82
789.0 ,Abdominal pain,"Comorbidities, signs, and ill-defined...",718383,3720,1.52,1.321588e-70,1.45,1.59
894.0 ,Multiple and unspecified open...,Injury and poisoning,44552,276,1.52,0.0000000001345623,1.34,1.72
558 ,Other and unspecified noninfectious...,Diseases of the digestive system,26111,162,1.52,0.0000008303976,1.29,1.77
683 ,Acute lymphadenitis,Diseases of the skin and subcutaneous...,8022,50,1.52,0.0051010782,1.12,2
684 ,Impetigo,Diseases of the skin and subcutaneous...,4786,30,1.52,0.0307174456,1.03,2.18
702.1 ,Seborrheic keratosis,Diseases of the skin and subcutaneous...,3055,19,1.51,0.0871444999,0.91,2.36
599.7 ,Hematuria,Diseases of the genitourinary...,22652,140,1.51,0.0000053529655,1.27,1.79
977.9 ,Poisoning by unspecified drug...,Injury and poisoning,5649,35,1.51,0.0214778149,1.05,2.1
708.1 ,Idiopathic urticaria,Diseases of the skin and subcutaneous...,12269,76,1.51,0.0008500653,1.19,1.89
625.3 ,Dysmenorrhea,Diseases of the genitourinary...,114657,693,1.51,9.297859e-23,1.4,1.64
240.9 ,"Goiter, unspecified","Endocrine, nutritional and metabolic...",21677,134,1.51,0.0000090142286,1.26,1.79
787.7 ,Abnormal feces,"Comorbidities, signs, and ill-defined...",4681,29,1.51,0.0385015122,1.01,2.17
656.30 ,"Fetal distress, affecting management...","Complications of pregnancy, childbirth,...",1931,12,1.51,0.1522519274,0.78,2.64
535.40 ,"Other specified gastritis, without...",Diseases of the digestive system,31323,193,1.51,0.00000011169315,1.3,1.74
825.25 ,Closed fracture of metatarsal...,Injury and poisoning,2249,14,1.51,0.134287525,0.82,2.54
360.21 ,Progressive high (degenerative)...,Diseases of the nervous system,6117,38,1.51,0.0159442338,1.07,2.08
