disease_2,disease_name,category,count,co_occurrence,odds_ratio,p_value,95_ci_lower,95_ci_upper
813 ,Fracture of radius and ulna,Injury and poisoning,2080,151,37.33,5.20025e-171,31.22,44.4
718.40 ,"Contracture of joint, site unspecified",Diseases of the musculoskeletal...,3588,222,32.59,1.24572e-236,28.11,37.61
728.2 ,"Muscular wasting and disuse atrophy,...",Diseases of the musculoskeletal...,1545,100,32.17,2.24857e-108,25.88,39.59
823 ,Fracture of tibia and fibula,Injury and poisoning,1402,84,29.4,2.184745e-88,23.19,36.82
174.0 ,Malignant neoplasm of nipple and...,Neoplasms,1443,81,27.39,5.387974e-83,21.53,34.51
813.41 ,Closed Colles' fracture,Injury and poisoning,3155,129,20.08,2.87148e-114,16.61,24.09
812.20 ,Closed fracture of unspecified...,Injury and poisoning,1860,65,16.54,7.868708e-54,12.66,21.28
813.83 ,Closed fracture of unspecified...,Injury and poisoning,1432,45,14.68,9.607875e-36,10.62,19.82
174 ,Malignant female breast neoplasm,Neoplasms,3655,105,13.75,9.530929e-78,11.16,16.79
813.42 ,Other closed fractures of distal...,Injury and poisoning,1984,56,13.2,1.177323e-41,9.9,17.29
726.1 ,"Rotator cuff syndrome of shoulder,...",Diseases of the musculoskeletal...,4494,117,12.49,7.312241e-82,10.25,15.1
822.0 ,Closed fracture of patella,Injury and poisoning,1962,52,12.35,1.862416e-37,9.16,16.32
813.81 ,Closed fracture of unspecified...,Injury and poisoning,3720,96,12.26,5.546616e-67,9.86,15.1
823.80 ,Closed fracture of unspecified...,Injury and poisoning,1778,44,11.47,1.042014e-30,8.28,15.52
823.00 ,Closed fracture of upper end of...,Injury and poisoning,1713,42,11.35,3.169795e-29,8.13,15.46
927.3 ,Crushing injury of finger(s),Injury and poisoning,1858,37,9.15,7.095768e-23,6.4,12.7
810.00 ,"Closed fracture of clavicle, unspecified...",Injury and poisoning,2299,42,8.4,2.375518e-24,6.02,11.43
840 ,Sprains and strains of shoulder...,Injury and poisoning,2632,45,7.86,7.823849e-25,5.7,10.59
354.2 ,Lesion of ulnar nerve,Diseases of the nervous system,1538,25,7.4,0.00000000000005476133,4.76,11
611 ,Other disorders of breast,Diseases of the genitourinary...,5205,81,7.25,1.200702e-40,5.72,9.07
353 ,Nerve root and plexus disorders,Diseases of the nervous system,3139,47,6.87,1.664333e-23,5.02,9.19
829.0 ,"Fracture of unspecified bone,...",Injury and poisoning,3047,43,6.46,1.10286e-20,4.65,8.75
824.8 ,"Unspecified fracture of ankle,...",Injury and poisoning,1575,22,6.34,0.00000000003110875,3.95,9.66
354 ,Mononeuritis of upper limb and...,Diseases of the nervous system,1816,25,6.25,0.000000000001987238,4.03,9.29
816.00 ,Closed fracture of phalanx or...,Injury and poisoning,2336,32,6.24,0.000000000000001985291,4.25,8.86
726.11 ,Calcifying tendinitis of shoulder,Diseases of the musculoskeletal...,3917,53,6.21,2.547141e-24,4.63,8.18
729.8 ,Other musculoskeletal symptoms...,Diseases of the musculoskeletal...,1954,26,6.04,0.000000000001538261,3.93,8.91
882 ,Open wound of hand except finger(s)...,Injury and poisoning,1479,19,5.81,0.0000000025786271,3.48,9.14
716.10 ,"Traumatic arthropathy, site unspecified",Diseases of the musculoskeletal...,3611,45,5.7,1.592103e-19,4.13,7.66
726 ,Peripheral enthesopathies and...,Diseases of the musculoskeletal...,4246,52,5.61,5.312868e-22,4.17,7.4
715.1 ,"Osteoarthrosis, localized, primary",Diseases of the musculoskeletal...,4721,57,5.54,1.10744e-23,4.18,7.22
715.3 ,"Osteoarthrosis, localized, not...",Diseases of the musculoskeletal...,8373,99,5.52,2.159709e-39,4.46,6.76
714 ,Rheumatoid arthritis and other...,Diseases of the musculoskeletal...,2143,26,5.5,0.00000000001150779,3.58,8.11
709.2 ,Scar conditions and fibrosis of...,Diseases of the skin and subcutaneous...,2732,33,5.49,0.00000000000002380075,3.76,7.76
844.1 ,Sprain of medial collateral ligament...,Injury and poisoning,2763,33,5.43,0.0000000000000323865,3.72,7.67
844.2 ,Sprain of cruciate ligament of...,Injury and poisoning,2956,35,5.39,0.000000000000007066106,3.73,7.53
884 ,Multiple and unspecified open...,Injury and poisoning,1768,21,5.37,0.0000000015176453,3.31,8.26
715.9 ,"Osteoarthrosis, unspecified whether...",Diseases of the musculoskeletal...,26378,280,5.34,7.77278e-101,4.69,6.06
845 ,Sprains and strains of ankle and...,Injury and poisoning,2071,24,5.25,0.0000000001734958,3.35,7.85
924.1 ,Contusion of knee and lower leg,Injury and poisoning,1712,19,5.01,0.000000025858957,3,7.87
174.9 ,"Malignant neoplasm of breast (female),...",Neoplasms,10628,113,4.98,1.445248e-40,4.08,6.03
726.0 ,Adhesive capsulitis of shoulder,Diseases of the musculoskeletal...,39298,373,4.95,1.60062e-121,4.41,5.55
726.2 ,"Other affections of shoulder region,...",Diseases of the musculoskeletal...,3397,37,4.95,0.00000000000001515085,3.47,6.86
726.9 ,Unspecified enthesopathy,Diseases of the musculoskeletal...,8699,92,4.91,4.60972e-33,3.94,6.06
894 ,Multiple and unspecified open...,Injury and poisoning,2446,26,4.81,0.000000000191497,3.13,7.09
830 ,Dislocation of jaw,Injury and poisoning,2316,24,4.68,0.0000000015307296,2.99,7.01
854.0 ,Intracranial injury of other and...,Injury and poisoning,1852,19,4.63,0.000000086454251,2.77,7.27
434 ,Occlusion of cerebral arteries,Diseases of the circulatory system,2957,30,4.6,0.0000000000245224,3.09,6.6
728.8 ,"Other disorders of muscle, ligament...",Diseases of the musculoskeletal...,3385,34,4.56,0.000000000001565536,3.14,6.4
721 ,Spondylosis and allied disorders,Diseases of the musculoskeletal...,10813,104,4.48,7.981096e-34,3.64,5.46
733.1 ,Pathological fracture,Diseases of the musculoskeletal...,2231,22,4.45,0.000000017195111,2.78,6.78
842.09 ,Other sprains and strains of wrist,Injury and poisoning,3463,34,4.45,0.000000000002884266,3.07,6.25
923 ,Contusion of upper limb,Injury and poisoning,2056,20,4.39,0.000000093200165,2.67,6.81
431 ,Intracerebral hemorrhage,Diseases of the circulatory system,4358,41,4.27,0.00000000000006871631,3.05,5.83
716.80 ,"Other specified arthropathy, site...",Diseases of the musculoskeletal...,2331,22,4.26,0.000000036686497,2.66,6.48
715.91 ,"Osteoarthrosis, unspecified whether...",Diseases of the musculoskeletal...,1490,14,4.23,0.0000109903,2.3,7.13
716.16 ,"Traumatic arthropathy, lower leg",Diseases of the musculoskeletal...,1705,16,4.22,0.0000027146438,2.4,6.9
715 ,Osteoarthrosis and allied disorders,Diseases of the musculoskeletal...,23072,198,4.13,2.53057e-56,3.55,4.79
728 ,"Disorders of muscle, ligament,...",Diseases of the musculoskeletal...,14288,124,4.06,7.218848e-36,3.36,4.88
715.34 ,"Osteoarthrosis, localized, not...",Diseases of the musculoskeletal...,2442,22,4.06,0.000000081120195,2.54,6.18
922 ,Contusion of trunk,Injury and poisoning,2849,25,3.96,0.000000018192365,2.55,5.87
715.31 ,"Osteoarthrosis, localized, not...",Diseases of the musculoskeletal...,4367,37,3.84,0.00000000002142292,2.69,5.32
716.65 ,"Unspecified monoarthritis, pelvic...",Diseases of the musculoskeletal...,1403,12,3.84,0.0001095434,1.98,6.74
727.3 ,Other bursitis,Diseases of the musculoskeletal...,1888,16,3.81,0.0000095560613,2.17,6.22
717.9 ,Unspecified internal derangement...,Diseases of the musculoskeletal...,4284,36,3.81,0.00000000004952498,2.65,5.29
924 ,Contusion of lower limb and of...,Injury and poisoning,3404,28,3.71,0.000000010279818,2.46,5.39
840.8 ,Sprains and strains of other specified...,Injury and poisoning,3471,28,3.64,0.000000015416405,2.41,5.29
434.1 ,Cerebral embolism,Diseases of the circulatory system,2104,17,3.63,0.0000094010288,2.11,5.84
843 ,Sprains and strains of hip and...,Injury and poisoning,1370,11,3.6,0.0003540464,1.79,6.48
883 ,Open wound of finger(s),Injury and poisoning,3136,25,3.59,0.00000011010644,2.32,5.33
726.6 ,Enthesopathy of knee,Diseases of the musculoskeletal...,5336,42,3.57,0.000000000009719767,2.56,4.85
564 ,"Functional digestive disorders,...",Diseases of the digestive system,26716,199,3.57,1.644867e-47,3.07,4.14
241 ,Nontoxic nodular goiter,"Endocrine, nutritional and metabolic...",1523,12,3.54,0.0002308635,1.82,6.21
891 ,"Open wound of knee, leg (except...",Injury and poisoning,2943,23,3.52,0.000000486729,2.22,5.31
691 ,Atopic dermatitis and related...,Diseases of the skin and subcutaneous...,1803,14,3.49,0.0000843164,1.9,5.88
366.14 ,Posterior subcapsular polar senile...,Diseases of the nervous system,2729,21,3.46,0.0000018997055,2.14,5.32
716.66 ,"Unspecified monoarthritis, lower...",Diseases of the musculoskeletal...,3947,30,3.43,0.000000017783038,2.31,4.92
721.4 ,Thoracic or lumbar spondylosis...,Diseases of the musculoskeletal...,2775,21,3.4,0.0000024530649,2.1,5.23
923.9 ,Contusion of unspecified part...,Injury and poisoning,5410,40,3.35,0.0000000001821877,2.38,4.58
246 ,Other disorders of thyroid,"Endocrine, nutritional and metabolic...",3374,25,3.34,0.00000041686408,2.15,4.95
716.5 ,Unspecified polyarthropathy or...,Diseases of the musculoskeletal...,1487,11,3.32,0.0006918647,1.65,5.96
447.6 ,"Arteritis, unspecified",Diseases of the circulatory system,6437,47,3.31,0.00000000000742555,2.42,4.43
353.8 ,Other nerve root and plexus disorders,Diseases of the nervous system,2194,16,3.27,0.0000566167,1.86,5.34
840.4 ,Rotator cuff (capsule) sprain,Injury and poisoning,3300,24,3.27,0.00000096801843,2.09,4.89
881.00 ,"Open wound of forearm, without...",Injury and poisoning,3609,26,3.25,0.00000041668581,2.11,4.78
438 ,Late effects of cerebrovascular...,Diseases of the circulatory system,9998,71,3.25,1.472372e-16,2.52,4.12
841.9 ,Sprains and strains of unspecified...,Injury and poisoning,5309,38,3.24,0.0000000012280064,2.28,4.46
357.9 ,Unspecified inflammatory and toxic...,Diseases of the nervous system,1807,13,3.23,0.0003073252,1.71,5.54
715.15 ,"Osteoarthrosis, localized, primary,...",Diseases of the musculoskeletal...,3340,24,3.23,0.0000011890377,2.06,4.83
715.30 ,"Osteoarthrosis, localized, not...",Diseases of the musculoskeletal...,6894,49,3.23,0.000000000006805772,2.38,4.29
361.30 ,"Retinal defect, unspecified",Diseases of the nervous system,1675,12,3.21,0.0005339156,1.65,5.64
716.9 ,"Arthropathy, unspecified",Diseases of the musculoskeletal...,33650,224,3.21,8.502372e-46,2.78,3.69
873 ,Other open wound of head,Injury and poisoning,2109,15,3.19,0.0001246316,1.78,5.29
726.19 ,Other specified disorders of bursae...,Diseases of the musculoskeletal...,9611,67,3.18,0.000000000000002486662,2.45,4.06
354.1 ,Other lesion of median nerve,Diseases of the nervous system,1854,13,3.14,0.0003904652,1.67,5.4
727 ,"Other disorders of synovium tendon,...",Diseases of the musculoskeletal...,9495,65,3.12,0.00000000000001460647,2.4,4
354.5 ,Mononeuritis multiplex,Diseases of the nervous system,1736,12,3.1,0.0007262313,1.6,5.44
729.81 ,Swelling of limb,Diseases of the musculoskeletal...,2465,17,3.1,0.0000662388,1.8,4.98
715.37 ,"Osteoarthrosis, localized, not...",Diseases of the musculoskeletal...,3061,21,3.08,0.0000106333,1.9,4.74
356.9 ,Unspecified hereditary and idiopathic...,Diseases of the nervous system,14823,98,3.05,3.06142e-20,2.46,3.74
873.4 ,"Facial laceration, without mention...",Injury and poisoning,3248,22,3.05,0.00000807378,1.9,4.63
629 ,Other disorders of female genital...,Diseases of the genitourinary...,7303,48,2.98,0.0000000001472887,2.19,3.97
070 ,Viral hepatitis,Infectious and parasitic diseases,2707,18,2.98,0.0000648807,1.76,4.74
436 ,"Acute, but ill-defined, cerebrovascular...",Diseases of the circulatory system,8835,58,2.98,0.000000000001973548,2.26,3.88
726.10 ,Disorders of bursae and tendons...,Diseases of the musculoskeletal...,12553,81,2.96,2.194465e-16,2.33,3.69
726.5 ,Enthesopathy of hip region,Diseases of the musculoskeletal...,2000,13,2.91,0.000780353,1.55,5
726.4 ,Enthesopathy of wrist and carpus,Diseases of the musculoskeletal...,2790,18,2.9,0.0000942111,1.71,4.6
715.10 ,"Osteoarthrosis, localized, primary,...",Diseases of the musculoskeletal...,6872,44,2.9,0.0000000018250288,2.1,3.91
844 ,Sprains and strains of knee and...,Injury and poisoning,1851,12,2.9,0.0012469389,1.5,5.1
296.2 ,"Major depressive disorder, single...",Mental disorders,3258,21,2.9,0.0000261832,1.79,4.45
332.1 ,Secondary parkinsonism,Diseases of the nervous system,1553,10,2.88,0.0032118462,1.38,5.33
373.32 ,Contact and allergic dermatitis...,Diseases of the nervous system,1420,9,2.84,0.0055655602,1.29,5.41
219.1 ,Benign neoplasm of corpus uteri,Neoplasms,1421,9,2.83,0.0055901317,1.29,5.41
805.8 ,Closed fracture of unspecified...,Injury and poisoning,1581,10,2.83,0.0036357438,1.35,5.23
310.2 ,Postconcussion syndrome,Mental disorders,2854,18,2.83,0.0001242431,1.67,4.49
531 ,Gastric ulcer,Diseases of the digestive system,10031,62,2.81,0.000000000004139148,2.15,3.62
715.96 ,"Osteoarthrosis, unspecified whether...",Diseases of the musculoskeletal...,24759,149,2.81,3.629752e-26,2.36,3.33
629.8 ,Other specified disorders of female...,Diseases of the genitourinary...,4818,30,2.8,0.0000011248598,1.88,4.02
715.36 ,"Osteoarthrosis, localized, not...",Diseases of the musculoskeletal...,57168,323,2.8,2.461326e-51,2.48,3.15
883.1 ,"Open wound of finger(s), complicated",Injury and poisoning,3848,24,2.8,0.0000123082,1.79,4.19
411 ,Other acute and subacute forms...,Diseases of the circulatory system,1602,10,2.79,0.0039818257,1.33,5.16
916 ,"Superficial injury of hip, thigh,...",Injury and poisoning,1604,10,2.79,0.0040160969,1.33,5.15
923.21 ,Contusion of wrist,Injury and poisoning,3388,21,2.78,0.0000454739,1.72,4.27
715.0 ,"Osteoarthrosis, generalized",Diseases of the musculoskeletal...,5353,33,2.78,0.00000041887623,1.91,3.92
719.00 ,"Effusion of joint, site unspecified",Diseases of the musculoskeletal...,2255,14,2.78,0.0007755288,1.52,4.69
111.8 ,Other specified dermatomycoses,Infectious and parasitic diseases,1452,9,2.77,0.0063942721,1.26,5.29
892 ,Open wound of foot except toe(s)...,Injury and poisoning,1615,10,2.77,0.0042087736,1.32,5.12
719.9 ,Unspecified disorder of joint,Diseases of the musculoskeletal...,2441,15,2.75,0.0005693007,1.54,4.56
923.8 ,Contusion of multiple sites of...,Injury and poisoning,1634,10,2.74,0.0045586788,1.31,5.06
721.3 ,Lumbosacral spondylosis without...,Diseases of the musculoskeletal...,92408,484,2.74,2.748279e-69,2.47,3.03
848.8 ,Other specified sites of sprains...,Injury and poisoning,7447,45,2.73,0.0000000066573538,1.99,3.67
845.09 ,Other sprains and strains of ankle,Injury and poisoning,5658,34,2.71,0.00000049755019,1.87,3.8
380.1 ,Infective otitis externa,Diseases of the nervous system,3161,19,2.7,0.0001503357,1.62,4.23
715.16 ,"Osteoarthrosis, localized, primary,...",Diseases of the musculoskeletal...,35504,201,2.69,1.198425e-31,2.31,3.11
715.26 ,"Osteoarthrosis, localized, secondary,...",Diseases of the musculoskeletal...,7422,44,2.68,0.00000001674175,1.94,3.61
316 ,Psychic factors associated with...,Mental disorders,4194,25,2.68,0.0000172612,1.73,3.97
716.56 ,Unspecified polyarthropathy or...,Diseases of the musculoskeletal...,1676,10,2.67,0.0054132966,1.28,4.93
616.2 ,Cyst of Bartholin's gland,Diseases of the genitourinary...,1848,11,2.66,0.0037040174,1.33,4.79
362.5 ,Degeneration of macula and posterior...,Diseases of the nervous system,2880,17,2.65,0.0003989447,1.54,4.25
959.7 ,"Knee, leg, ankle, and foot injury",Injury and poisoning,2199,13,2.65,0.0017972917,1.4,4.55
682.4 ,"Cellulitis and abscess of hand,...",Diseases of the skin and subcutaneous...,1860,11,2.65,0.0038844054,1.32,4.76
719.90 ,"Unspecified disorder of joint,...",Diseases of the musculoskeletal...,3893,23,2.65,0.0000418755,1.68,4
737.30 ,"Scoliosis [and kyphoscoliosis],...",Diseases of the musculoskeletal...,2038,12,2.64,0.0027280391,1.36,4.62
923.10 ,Contusion of forearm,Injury and poisoning,1366,8,2.62,0.0134118177,1.13,5.18
355.8 ,"Mononeuritis of lower limb, unspecified",Diseases of the nervous system,1370,8,2.61,0.0136254544,1.12,5.17
215.2 ,Other benign neoplasm of connective...,Neoplasms,1544,9,2.61,0.0093090054,1.19,4.97
727.0 ,Synovitis and tenosynovitis,Diseases of the musculoskeletal...,17644,100,2.6,4.402363e-16,2.11,3.19
681.00 ,"Cellulitis and abscess of finger,...",Diseases of the skin and subcutaneous...,2236,13,2.6,0.0020732811,1.38,4.47
714.8 ,Other specified inflammatory polyarthropathies,Diseases of the musculoskeletal...,1378,8,2.6,0.014060156,1.12,5.14
682 ,Other cellulitis and abscess,Diseases of the skin and subcutaneous...,4690,27,2.59,0.0000148871,1.7,3.78
715.35 ,"Osteoarthrosis, localized, not...",Diseases of the musculoskeletal...,5221,30,2.59,0.0000053558276,1.74,3.71
716 ,Other and unspecified arthropathies,Diseases of the musculoskeletal...,8746,50,2.59,0.000000008320635,1.91,3.43
728.9 ,"Unspecified disorder of muscle,...",Diseases of the musculoskeletal...,28140,155,2.57,2.590276e-23,2.17,3.03
854.09 ,Intracranial injury of other and...,Injury and poisoning,1914,11,2.57,0.004784717,1.28,4.62
924.4 ,Contusion of multiple sites of...,Injury and poisoning,2276,13,2.56,0.0024099391,1.36,4.39
353.1 ,Lumbosacral plexus lesions,Diseases of the nervous system,2810,16,2.55,0.0008455123,1.45,4.16
825.25 ,Closed fracture of metatarsal...,Injury and poisoning,3168,18,2.55,0.0004267684,1.5,4.04
723.4 ,"Brachial neuritis or radiculitis,...",Diseases of the musculoskeletal...,8742,49,2.54,0.000000017508252,1.87,3.37
440 ,Atherosclerosis,Diseases of the circulatory system,1947,11,2.53,0.0054114714,1.26,4.54
300.5 ,Neurasthenia,Mental disorders,3375,19,2.52,0.0003358561,1.51,3.96
891.1 ,"Open wound of knee, leg [except...",Injury and poisoning,4100,23,2.52,0.0000895866,1.59,3.79
147.9 ,"Malignant neoplasm of nasopharynx,...",Neoplasms,1964,11,2.51,0.0057586756,1.25,4.5
574.5 ,Calculus of bile duct without...,Diseases of the digestive system,1604,9,2.51,0.0116890165,1.14,4.78
924.21 ,Contusion of ankle,Injury and poisoning,3761,21,2.5,0.000188183,1.55,3.84
721.0 ,Cervical spondylosis without myelopathy,Diseases of the musculoskeletal...,43106,226,2.5,7.811695e-31,2.17,2.87
850 ,Concussion,Injury and poisoning,3418,19,2.49,0.0003910016,1.5,3.91
533.7 ,"Peptic ulcer, site unspecified,...",Diseases of the digestive system,1441,8,2.48,0.017842909,1.07,4.91
386 ,Vertiginous syndromes and other...,Diseases of the nervous system,14520,79,2.48,0.000000000002973142,1.95,3.11
844.0 ,Sprain of lateral collateral ligament...,Injury and poisoning,2169,12,2.48,0.0044418533,1.27,4.34
845.0 ,Sprains and strains of ankle,Injury and poisoning,2344,13,2.48,0.0030843719,1.32,4.26
434.9 ,"Cerebral artery occlusion, unspecified",Diseases of the circulatory system,10593,58,2.48,0.0000000026618831,1.88,3.22
110 ,Dermatophytosis,Infectious and parasitic diseases,3083,17,2.47,0.0008386881,1.43,3.97
345.90 ,"Epilepsy, unspecified, without...",Diseases of the nervous system,2532,14,2.47,0.0022474938,1.35,4.17
733.0 ,Osteoporosis,Diseases of the musculoskeletal...,61512,310,2.46,1.407004e-39,2.17,2.78
709 ,Other disorders of skin and subcutaneous...,Diseases of the skin and subcutaneous...,2729,15,2.46,0.0016925381,1.37,4.08
729.5 ,Pain in limb,Diseases of the musculoskeletal...,19095,102,2.45,0.000000000000007774672,1.99,2.99
250.4 ,Diabetes with renal manifestations,"Endocrine, nutritional and metabolic...",3848,21,2.45,0.0002540442,1.51,3.76
255.4 ,Corticoadrenal insufficiency,"Endocrine, nutritional and metabolic...",1649,9,2.44,0.0137521201,1.11,4.65
710.0 ,Systemic lupus erythematosus,Diseases of the musculoskeletal...,4059,22,2.43,0.0003063951,1.52,3.7
805.4 ,Closed fracture of lumbar vertebra...,Injury and poisoning,5568,30,2.42,0.0000212027,1.63,3.47
729 ,Other disorders of soft tissues,Diseases of the musculoskeletal...,2409,13,2.41,0.0038654702,1.28,4.15
041.8 ,Other specified bacterial infections,Infectious and parasitic diseases,1861,10,2.4,0.0107581295,1.15,4.44
715.14 ,"Osteoarthrosis, localized, primary,...",Diseases of the musculoskeletal...,2047,11,2.4,0.0077128993,1.2,4.32
430 ,Subarachnoid hemorrhage,Diseases of the circulatory system,1491,8,2.4,0.0213256241,1.03,4.74
686 ,Other local infections of skin...,Diseases of the skin and subcutaneous...,6977,37,2.39,0.0000030079307,1.68,3.31
413.0 ,Angina decubitus,Diseases of the circulatory system,2054,11,2.39,0.0078987146,1.19,4.3
692 ,Contact dermatitis and other eczema,Diseases of the skin and subcutaneous...,21364,110,2.37,0.000000000000007262917,1.93,2.87
580 ,Acute glomerulonephritis,Diseases of the genitourinary...,2071,11,2.37,0.0083644612,1.18,4.27
719.43 ,"Pain in joint, forearm",Diseases of the musculoskeletal...,1700,9,2.37,0.0164027147,1.08,4.51
727.03 ,Trigger finger (acquired),Diseases of the musculoskeletal...,17055,88,2.36,0.000000000004164291,1.88,2.92
719.42 ,"Pain in joint, upper arm",Diseases of the musculoskeletal...,1704,9,2.36,0.0166253298,1.08,4.5
616.4 ,Other abscess of vulva,Diseases of the genitourinary...,1523,8,2.35,0.0237918392,1.01,4.64
493.21 ,Chronic obstructive asthma with...,Diseases of the respiratory system,2665,14,2.35,0.0035226689,1.28,3.96
780.5 ,Sleep disturbance,"Comorbidities, signs, and ill-defined...",36249,181,2.34,1.622351e-22,2,2.73
239.2 ,Neoplasm of unspecified nature...,Neoplasms,3060,16,2.34,0.002991575,1.33,3.82
266.9 ,Unspecified vitamin B deficiency,"Endocrine, nutritional and metabolic...",1529,8,2.34,0.0242755786,1.01,4.62
923.11 ,Contusion of elbow,Injury and poisoning,3262,17,2.33,0.0021541395,1.36,3.75
842.10 ,"Sprain of hand, unspecified site",Injury and poisoning,2685,14,2.33,0.0037574205,1.27,3.93
353.2 ,"Cervical root lesions, not elsewhere...",Diseases of the nervous system,12124,62,2.32,0.0000000064138166,1.77,2.99
843.9 ,Sprains and strains of unspecified...,Injury and poisoning,6602,34,2.32,0.0000180781,1.6,3.25
721.9 ,Spondylosis of unspecified site,Diseases of the musculoskeletal...,3856,20,2.32,0.0008209627,1.42,3.6
365 ,Glaucoma,Diseases of the nervous system,3300,17,2.31,0.0022945667,1.34,3.71
845.19 ,Other sprain of foot,Injury and poisoning,2909,15,2.31,0.0044767746,1.29,3.82
922.8 ,Contusion of multiple sites of...,Injury and poisoning,2723,14,2.3,0.0063852863,1.25,3.87
787.7 ,Abnormal feces,"Comorbidities, signs, and ill-defined...",3504,18,2.3,0.0016830242,1.36,3.65
719.4 ,Pain in joint,Diseases of the musculoskeletal...,19927,100,2.3,0.0000000000004535212,1.86,2.81
715.89 ,"Osteoarthrosis involving, or with...",Diseases of the musculoskeletal...,1759,9,2.29,0.0199143802,1.04,4.36
300 ,Neurotic disorders,Mental disorders,32078,158,2.29,4.047691e-19,1.94,2.7
349 ,Other and unspecified disorders...,Diseases of the nervous system,4109,21,2.29,0.0006808674,1.41,3.52
726.90 ,Enthesopathy of unspecified site,Diseases of the musculoskeletal...,53298,253,2.27,2.828806e-28,1.98,2.59
434.0 ,Cerebral thrombosis,Diseases of the circulatory system,4535,23,2.27,0.0004042432,1.44,3.43
053 ,Herpes zoster,Infectious and parasitic diseases,1778,9,2.26,0.0211526894,1.03,4.31
714.0 ,Rheumatoid arthritis,Diseases of the musculoskeletal...,26778,131,2.26,7.000803e-16,1.88,2.7
239.9 ,"Neoplasm of unspecified nature,...",Neoplasms,1590,8,2.25,0.0295892406,0.97,4.45
882.1 ,Open wound of hand except finger(s)...,Injury and poisoning,1388,7,2.25,0.0398222851,0.9,4.66
922.2 ,Contusion of abdominal wall,Injury and poisoning,2384,12,2.25,0.0136384677,1.16,3.95
923.3 ,Contusion of finger,Injury and poisoning,2190,11,2.24,0.0194029007,1.12,4.03
844.9 ,Sprains and strains of unspecified...,Injury and poisoning,14377,71,2.24,0.0000000023612557,1.74,2.84
300.0 ,Anxiety states,Mental disorders,42611,203,2.24,6.900464e-23,1.93,2.59
721.8 ,Other allied disorders of spine,Diseases of the musculoskeletal...,1595,8,2.24,0.0300574814,0.96,4.43
622.0 ,Erosion and ectropion of cervix,Diseases of the genitourinary...,26462,128,2.23,0.000000000000004207134,1.85,2.67
840.0 ,Acromioclavicular (joint) (ligament)...,Injury and poisoning,2005,10,2.23,0.0171430579,1.07,4.11
892.1 ,Open wound of foot except toe(s)...,Injury and poisoning,2209,11,2.23,0.0198313983,1.11,4
332.0 ,Paralysis agitans,Diseases of the nervous system,2207,11,2.23,0.0197841773,1.11,4
354.0 ,Carpal tunnel syndrome,Diseases of the nervous system,33045,158,2.22,4.537345e-18,1.88,2.62
365.20 ,"Primary angle-closure glaucoma,...",Diseases of the nervous system,2213,11,2.22,0.019927338,1.11,3.99
784 ,Symptoms involving head and neck,"Comorbidities, signs, and ill-defined...",4043,20,2.22,0.0012578083,1.35,3.44
707.1 ,"Ulcer of lower limbs, except decubitus",Diseases of the skin and subcutaneous...,2415,12,2.22,0.0142132777,1.14,3.9
780.0 ,Alteration of consciousness,"Comorbidities, signs, and ill-defined...",1820,9,2.21,0.0240846292,1.01,4.21
357.2 ,Polyneuropathy in diabetes,Diseases of the nervous system,5091,25,2.2,0.0004639102,1.42,3.26
155.2 ,"Malignant neoplasm of liver, not...",Neoplasms,1823,9,2.2,0.0243045508,1.01,4.2
593.2 ,"Cyst of kidney, acquired",Diseases of the genitourinary...,1831,9,2.2,0.0248979784,1,4.18
944.00 ,Burn of unspecified degree of...,Injury and poisoning,1425,7,2.19,0.0447130647,0.88,4.54
492 ,Emphysema,Diseases of the respiratory system,2255,11,2.18,0.0210560198,1.08,3.92
372.2 ,Blepharoconjunctivitis,Diseases of the nervous system,4322,21,2.18,0.001716337,1.34,3.34
854 ,Intracranial injury of other and...,Injury and poisoning,1440,7,2.17,0.0468008329,0.87,4.49
353.4 ,"Lumbosacral root lesions, not...",Diseases of the nervous system,8561,41,2.16,0.0000151754,1.54,2.94
715.11 ,"Osteoarthrosis, localized, primary,...",Diseases of the musculoskeletal...,3323,16,2.15,0.0049190279,1.23,3.51
882.0 ,Open wound of hand except finger(s)...,Injury and poisoning,10053,48,2.15,0.0000022078815,1.58,2.87
891.0 ,"Open wound of knee, leg [except...",Injury and poisoning,19081,90,2.15,0.0000000001976439,1.72,2.66
733.01 ,Senile osteoporosis,Diseases of the musculoskeletal...,33128,153,2.14,3.340898e-16,1.8,2.53
702.8 ,Other specified dermatoses,Diseases of the skin and subcutaneous...,4597,22,2.14,0.0013763348,1.34,3.26
