692.81 ,Dermatitis due to cosmetics,Diseases of the skin and subcutaneous...,2285,5,1.97,0.1149204708,0.64,4.61
214.9 ,"Lipoma, unspecified site",Neoplasms,4570,10,1.97,0.0411323964,0.94,3.64
569.9 ,Unspecified disorder of intestine,Diseases of the digestive system,6876,15,1.97,0.0160356225,1.1,3.26
719.88 ,"Other specified disorders of joint,...",Diseases of the musculoskeletal...,3215,7,1.96,0.0992357421,0.79,4.05
428 ,Heart failure,Diseases of the circulatory system,1839,4,1.96,0.1517680653,0.53,5.02
362.60 ,"Peripheral retinal degeneration,...",Diseases of the nervous system,4626,10,1.95,0.0432462805,0.93,3.59
682 ,Other cellulitis and abscess,Diseases of the skin and subcutaneous...,6015,13,1.95,0.0290636547,1.03,3.34
381.60 ,"Obstruction of Eustachian tube,...",Diseases of the nervous system,2304,5,1.95,0.1178455282,0.63,4.57
726.31 ,Medial epicondylitis,Diseases of the musculoskeletal...,3694,8,1.95,0.0742888492,0.84,3.85
355.0 ,Lesion of sciatic nerve,Diseases of the nervous system,4642,10,1.94,0.0438761543,0.93,3.58
931 ,Foreign body in ear,Injury and poisoning,6025,13,1.94,0.0292072782,1.03,3.34
701.4 ,Keloid scar,Diseases of the skin and subcutaneous...,9798,21,1.94,0.0054383242,1.19,2.97
715.17 ,"Osteoarthrosis, localized, primary,...",Diseases of the musculoskeletal...,1856,4,1.94,0.1552867768,0.53,4.98
726.10 ,Disorders of bursae and tendons...,Diseases of the musculoskeletal...,15884,34,1.94,0.0004433418,1.34,2.72
726.12 ,Bicipital tenosynovitis,Diseases of the musculoskeletal...,5563,12,1.94,0.0391698439,1,3.41
350.1 ,Trigeminal neuralgia,Diseases of the nervous system,3735,8,1.93,0.0765669067,0.83,3.81
354.2 ,Lesion of ulnar nerve,Diseases of the nervous system,2333,5,1.93,0.1223772041,0.62,4.51
728.9 ,"Unspecified disorder of muscle,...",Diseases of the musculoskeletal...,38107,80,1.93,0.00000014833163,1.52,2.41
585 ,Chronic renal failure,Diseases of the genitourinary...,13600,29,1.93,0.0011249536,1.29,2.78
726.0 ,Adhesive capsulitis of shoulder,Diseases of the musculoskeletal...,37077,78,1.93,0.0000002236314,1.52,2.42
917.0 ,Abrasion or friction burn of foot...,Injury and poisoning,6085,13,1.93,0.0301306749,1.02,3.3
307.40 ,"Nonorganic sleep disorder, unspecified",Mental disorders,7932,17,1.93,0.010661945,1.12,3.11
780 ,General symptoms,"Comorbidities, signs, and ill-defined...",4695,10,1.92,0.0460451948,0.92,3.54
707.1 ,"Ulcer of lower limbs, except decubitus",Diseases of the skin and subcutaneous...,1873,4,1.92,0.1588357455,0.52,4.93
250 ,Diabetes mellitus,"Endocrine, nutritional and metabolic...",22781,48,1.92,0.0000505878,1.41,2.55
923.11 ,Contusion of elbow,Injury and poisoning,6126,13,1.91,0.0308226645,1.02,3.28
367.20 ,"Astigmatism, unspecified",Diseases of the nervous system,3289,7,1.91,0.1039582877,0.77,3.96
995.2 ,Unspecified adverse effect od...,Injury and poisoning,2369,5,1.9,0.1991977176,0.61,4.44
692.2 ,Contact dermatitis and other eczema...,Diseases of the skin and subcutaneous...,1896,4,1.9,0.1636843222,0.52,4.87
784.49 ,Other voice and resonance disorders,"Comorbidities, signs, and ill-defined...",1892,4,1.9,0.1628372655,0.52,4.88
916 ,"Superficial injury of hip, thigh,...",Injury and poisoning,2846,6,1.9,0.1436899504,0.69,4.14
728.85 ,Spasm of muscle,Diseases of the musculoskeletal...,9554,20,1.89,0.0080910709,1.15,2.93
840.8 ,Sprains and strains of other specified...,Injury and poisoning,5245,11,1.89,0.0558685975,0.94,3.39
353.9 ,Unspecified nerve root and plexus...,Diseases of the nervous system,7193,15,1.88,0.0201921681,1.05,3.11
692.8 ,"Contact dermatitis and other eczema,...",Diseases of the skin and subcutaneous...,6715,14,1.88,0.0256353957,1.02,3.16
435.0 ,Basilar artery syndrome,Diseases of the circulatory system,1912,4,1.88,0.1670883865,0.51,4.83
910.0 ,"Abrasion or friction burn of face,...",Injury and poisoning,7197,15,1.88,0.0202562582,1.05,3.11
300.81 ,Somatization disorder,Mental disorders,1913,4,1.88,0.1673019742,0.51,4.83
913.0 ,"Abrasion or friction burn of elbow,...",Injury and poisoning,8174,17,1.88,0.017722337,1.09,3.01
698.0 ,Pruritus ani,Diseases of the skin and subcutaneous...,1918,4,1.87,0.1683713689,0.51,4.82
289.9 ,Unspecified diseases of blood...,Diseases of the blood and blood-forming...,1926,4,1.87,0.1700874181,0.51,4.8
726.71 ,Achilles bursitis or tendinitis,Diseases of the musculoskeletal...,4362,9,1.86,0.0667598553,0.85,3.54
532.90 ,"Duodenal ulcer, unspecified as...",Diseases of the digestive system,24957,51,1.86,0.0000733867,1.38,2.46
540.9 ,Acute appendicitis without mention...,Diseases of the digestive system,5331,11,1.86,0.0579839381,0.93,3.34
880.03 ,"Open wound of upper arm, without...",Injury and poisoning,2412,5,1.86,0.2028737531,0.6,4.36
372.40 ,"Pterygium, unspecified",Diseases of the nervous system,11249,23,1.85,0.0063712052,1.17,2.78
277.9 ,Unspecified disorder of metabolism,"Endocrine, nutritional and metabolic...",2427,5,1.85,0.2042326568,0.6,4.34
625 ,Pain and other symptoms associated...,Diseases of the genitourinary...,1958,4,1.84,0.1770121069,0.5,4.72
627.3 ,Postmenopausal atrophic vaginitis,Diseases of the genitourinary...,4882,10,1.84,0.0781309322,0.88,3.4
682.9 ,Cellulitis and abscess of unspecified...,Diseases of the skin and subcutaneous...,50374,100,1.83,0.000000064590788,1.48,2.24
782.3 ,Edema,"Comorbidities, signs, and ill-defined...",44045,88,1.83,0.00000031605317,1.46,2.27
719.49 ,"Pain in joint, multiple sites",Diseases of the musculoskeletal...,13325,27,1.83,0.0036996712,1.2,2.68
435.1 ,Vertebral artery syndrome,Diseases of the circulatory system,1968,4,1.83,0.1791954583,0.5,4.69
455.0 ,Internal hemorrhoids without mention...,Diseases of the circulatory system,8356,17,1.83,0.0194410929,1.07,2.95
724 ,Other and unspecified disorders...,Diseases of the musculoskeletal...,7885,16,1.83,0.0251627269,1.04,2.98
726.8 ,Other peripheral enthesopathies,Diseases of the musculoskeletal...,4958,10,1.82,0.0805425631,0.87,3.35
728.89 ,"Other disorders of muscle, ligament,...",Diseases of the musculoskeletal...,18446,37,1.82,0.0007950943,1.28,2.52
367.5 ,Disorders of accommodation,Diseases of the nervous system,2957,6,1.82,0.1531860276,0.67,3.98
570 ,Acute and subacute necrosis of...,Diseases of the digestive system,2471,5,1.82,0.2084402452,0.59,4.26
805.6 ,Closed fracture of sacrum and...,Injury and poisoning,2980,6,1.81,0.1553475916,0.66,3.95
225.0 ,Benign neoplasm of brain,Neoplasms,2987,6,1.81,0.1560182606,0.66,3.94
840.9 ,Sprains and strains of unspecified...,Injury and poisoning,24089,48,1.81,0.0001868386,1.33,2.41
596.5 ,Other functional disorders of...,Diseases of the genitourinary...,12507,25,1.81,0.0064143669,1.17,2.68
280.1 ,Iron deficiency anemia secondary...,Diseases of the blood and blood-forming...,1982,4,1.81,0.1822672433,0.49,4.66
914.0 ,Abrasion or friction burn of hand(s)...,Injury and poisoning,4485,9,1.81,0.1078513477,0.82,3.44
307.49 ,Other specific disorders of sleep...,Mental disorders,1999,4,1.8,0.2934731139,0.49,4.62
845 ,Sprains and strains of ankle and...,Injury and poisoning,3012,6,1.79,0.1584616652,0.66,3.91
596.8 ,"Bladder disorder, NEC",Diseases of the genitourinary...,2521,5,1.78,0.2136091642,0.58,4.17
379.21 ,Vitreous degeneration,Diseases of the nervous system,6600,13,1.77,0.0596101105,0.94,3.04
272.9 ,Unspecified disorder of lipoid...,"Endocrine, nutritional and metabolic...",8638,17,1.77,0.0231609222,1.03,2.85
295.30 ,"Paranoid type schizophrenia, unspecified",Mental disorders,2033,4,1.77,0.2970504269,0.48,4.54
922.3 ,Contusion of back,Injury and poisoning,18485,36,1.76,0.0017191061,1.23,2.45
923.2 ,"Contusion of wrist and hand(s),...",Injury and poisoning,2047,4,1.76,0.2985947114,0.48,4.51
353.2 ,"Cervical root lesions, not elsewhere...",Diseases of the nervous system,15911,31,1.76,0.0037508158,1.19,2.51
464.2 ,Acute larygotracheitis,Diseases of the respiratory system,10250,20,1.76,0.0166116314,1.07,2.73
349.9 ,Unspecified disorders of nervous...,Diseases of the nervous system,23865,46,1.75,0.0005517446,1.28,2.34
923.8 ,Contusion of multiple sites of...,Injury and poisoning,3078,6,1.75,0.165265648,0.64,3.83
923.9 ,Contusion of unspecified part...,Injury and poisoning,8741,17,1.75,0.0337758875,1.02,2.82
686.9 ,Unspecified local infection of...,Diseases of the skin and subcutaneous...,107317,199,1.75,0.000000000004750073,1.5,2.03
571 ,Chronic liver disease and cirrhosis,Diseases of the digestive system,9788,19,1.75,0.021221681,1.05,2.74
724.0 ,"Spinal stenosis, other than cervical",Diseases of the musculoskeletal...,2051,4,1.75,0.2990433987,0.48,4.5
250.0 ,Diabetes Mellitus w/m of complication,"Endocrine, nutritional and metabolic...",21948,42,1.74,0.0010101902,1.25,2.36
597.89 ,Other urethritis,Diseases of the genitourinary...,6733,13,1.74,0.0623653989,0.92,2.98
879.6 ,Open wound of other and unspecified...,Injury and poisoning,2067,4,1.74,0.3008708191,0.47,4.47
531.90 ,"Gastric ulcer, unspecified as...",Diseases of the digestive system,28994,55,1.73,0.0002393556,1.29,2.26
372.4 ,Pterygium,Diseases of the nervous system,2600,5,1.73,0.2225708802,0.56,4.05
211.3 ,Benign neoplasm of colon,Neoplasms,4164,8,1.73,0.1524038651,0.74,3.42
590.9 ,"Infection of kidney, unspecified",Diseases of the genitourinary...,6242,12,1.73,0.0813287909,0.89,3.03
892.0 ,Open wound of foot except toe(s)...,Injury and poisoning,16759,32,1.73,0.0047529077,1.18,2.45
616.8 ,Other specified inflammatory diseases...,Diseases of the genitourinary...,18854,36,1.73,0.0027444762,1.21,2.4
533.0 ,"Peptic ulcer, site unspecified...",Diseases of the digestive system,2614,5,1.72,0.2242558313,0.56,4.03
560.1 ,Paralytic ileus,Diseases of the digestive system,3668,7,1.72,0.1363852545,0.69,3.55
848.9 ,Unspecified site of sprain and...,Injury and poisoning,134372,243,1.72,0.0000000000002020128,1.5,1.97
298.9 ,Unspecified psychosis,Mental disorders,3655,7,1.72,0.135059189,0.69,3.56
354.0 ,Carpal tunnel syndrome,Diseases of the nervous system,42238,79,1.71,0.0000157172,1.35,2.14
786.00 ,"Respiratory abnormality, unspecified","Comorbidities, signs, and ill-defined...",5251,10,1.71,0.0932319319,0.82,3.16
374.00 ,"Entropion, unspecified",Diseases of the nervous system,2625,5,1.71,0.2255994456,0.55,4.01
883.0 ,"Open wound of finger(s), without...",Injury and poisoning,35787,67,1.71,0.0000761417,1.32,2.18
616.5 ,Ulceration of vulva,Diseases of the genitourinary...,4736,9,1.71,0.119184083,0.78,3.26
530.9 ,Unspecified disorder of esophagus,Diseases of the digestive system,5841,11,1.7,0.1093343963,0.84,3.04
847.9 ,Sprain of unspecified site of...,Injury and poisoning,11644,22,1.7,0.0171905074,1.07,2.59
721.3 ,Lumbosacral spondylosis without...,Diseases of the musculoskeletal...,82705,151,1.7,0.0000000061863557,1.43,2.01
306.8 ,Other specified psychophysiological...,Mental disorders,9031,17,1.7,0.0377368217,0.99,2.73
596.9 ,Unspecified disorder of bladder,Diseases of the genitourinary...,2121,4,1.69,0.3074116294,0.46,4.35
296 ,Disorganized type,Mental disorders,4787,9,1.69,0.1220855357,0.77,3.22
726.19 ,Other specified disorders of bursae...,Diseases of the musculoskeletal...,11227,21,1.69,0.022258089,1.04,2.59
470 ,Deviated nasal septum,Diseases of the respiratory system,10689,20,1.69,0.0274119943,1.03,2.62
727.06 ,Tenosynovitis of foot and ankle,Diseases of the musculoskeletal...,5372,10,1.68,0.0999935037,0.8,3.09
704.01 ,Alopecia areata,Diseases of the skin and subcutaneous...,3206,6,1.68,0.1798471463,0.62,3.67
174.0 ,Malignant neoplasm of nipple and...,Neoplasms,2140,4,1.68,0.3098444762,0.46,4.31
575.1 ,Other cholecystitis,Diseases of the digestive system,3220,6,1.68,0.1815472393,0.61,3.66
716.60 ,"Unspecified monoarthritis, site...",Diseases of the musculoskeletal...,2673,5,1.68,0.231660456,0.54,3.94
492 ,Emphysema,Diseases of the respiratory system,2149,4,1.67,0.3110198507,0.45,4.3
780.59 ,Other sleep disturbances,"Comorbidities, signs, and ill-defined...",9170,17,1.67,0.0403120789,0.97,2.68
721.90 ,"Spondylosis of unspecified site,...",Diseases of the musculoskeletal...,25520,47,1.67,0.0011940886,1.22,2.23
627 ,Menopausal and postmenopausal...,Diseases of the genitourinary...,15804,29,1.66,0.0111239938,1.11,2.39
719.48 ,"Pain in joint, other specified...",Diseases of the musculoskeletal...,5952,11,1.66,0.1127609719,0.83,2.99
726.30 ,"Enthesopathy of elbow, unspecified",Diseases of the musculoskeletal...,2715,5,1.66,0.2372186402,0.54,3.87
924.01 ,Contusion of hip,Injury and poisoning,4906,9,1.65,0.1296062776,0.75,3.14
523.0 ,Acute gingivitis,Diseases of the digestive system,7634,14,1.65,0.08084151,0.9,2.78
569.3 ,Hemorrhage of rectum and anus,Diseases of the digestive system,4915,9,1.65,0.1302169334,0.75,3.14
729.1 ,"Myalgia and myositis, unspecified",Diseases of the musculoskeletal...,226331,379,1.64,4.699537e-16,1.46,1.83
533.70 ,Chronic peptic ulcer of unspecified...,Diseases of the digestive system,19260,35,1.64,0.0061904862,1.14,2.3
382.4 ,Unspecified suppurative otitis...,Diseases of the nervous system,3290,6,1.64,0.1903418121,0.6,3.58
310.2 ,Postconcussion syndrome,Mental disorders,3855,7,1.63,0.2152415331,0.66,3.37
478.8 ,Upper respiratory tract hypersensitivity...,Diseases of the respiratory system,4407,8,1.63,0.1671756413,0.7,3.23
354.9 ,"Mononeuritis of upper limb, unspecified",Diseases of the nervous system,3313,6,1.63,0.1933353034,0.6,3.55
924.3 ,Contusion of toe,Injury and poisoning,2754,5,1.63,0.2425827921,0.53,3.82
680.0 ,Carbuncle and furuncle of face,Diseases of the skin and subcutaneous...,6070,11,1.63,0.1172534757,0.81,2.93
372.12 ,Chronic follicular conjunctivitis,Diseases of the nervous system,4409,8,1.63,0.1673199501,0.7,3.23
923.10 ,Contusion of forearm,Injury and poisoning,2775,5,1.62,0.2455490404,0.52,3.79
259.9 ,Unspecified endocrine disorder,"Endocrine, nutritional and metabolic...",6110,11,1.62,0.1189708046,0.81,2.91
622.9 ,Unspecified noninflammatory disorder...,Diseases of the genitourinary...,2772,5,1.62,0.2451220276,0.53,3.79
727.0 ,Synovitis and tenosynovitis,Diseases of the musculoskeletal...,23123,41,1.61,0.0051035317,1.15,2.19
727.05 ,Other tenosynovitis of hand and...,Diseases of the musculoskeletal...,9494,17,1.61,0.0611281714,0.94,2.59
681.9 ,Cellulitis and abscess of unspecified...,Diseases of the skin and subcutaneous...,12862,23,1.61,0.0319983775,1.02,2.43
250.00 ,Diabetes mellitus without mention...,"Endocrine, nutritional and metabolic...",83932,146,1.61,0.00000022283721,1.35,1.91
256.3 ,Other ovarian failure,"Endocrine, nutritional and metabolic...",3357,6,1.61,0.2876821777,0.59,3.51
722.0 ,Displacement of cervical intervertebral...,Diseases of the musculoskeletal...,15724,28,1.61,0.0160647044,1.07,2.33
473.8 ,Other chronic sinusitis,Diseases of the respiratory system,3372,6,1.6,0.2886404013,0.59,3.49
356.9 ,Unspecified hereditary and idiopathic...,Diseases of the nervous system,15266,27,1.6,0.0200637114,1.05,2.33
574 ,Cholelithiasis,Diseases of the digestive system,7292,13,1.6,0.108075321,0.85,2.75
724.4 ,Thoracic or lumbosacral neuritis...,Diseases of the musculoskeletal...,10703,19,1.6,0.0559804713,0.96,2.51
474.0 ,Chronic tonsillitis,Diseases of the respiratory system,7950,14,1.59,0.0896032101,0.86,2.67
727.00 ,"Synovitis and tenosynovitis, unspecified",Diseases of the musculoskeletal...,145788,245,1.59,0.0000000001969346,1.38,1.82
786.9 ,Other symptoms involving respiratory...,"Comorbidities, signs, and ill-defined...",3400,6,1.59,0.2905131824,0.58,3.46
272.1 ,Pure hyperglyceridemia,"Endocrine, nutritional and metabolic...",11905,21,1.59,0.0383422325,0.98,2.44
623.8 ,Other specified noninflammatory...,Diseases of the genitourinary...,2271,4,1.58,0.3283074037,0.43,4.06
386 ,Vertiginous syndromes and other...,Diseases of the nervous system,15400,27,1.58,0.0275489761,1.04,2.31
726.3 ,Enthesopathy of elbow region,Diseases of the musculoskeletal...,2281,4,1.58,0.3298285616,0.43,4.05
684 ,Impetigo,Diseases of the skin and subcutaneous...,4009,7,1.57,0.2269604469,0.63,3.24
381.01 ,Acute serous otitis media,Diseases of the nervous system,2288,4,1.57,0.3309020893,0.43,4.03
716.99 ,"Arthropathy, unspecified, multiple...",Diseases of the musculoskeletal...,4584,8,1.57,0.1812868286,0.68,3.1
372.3 ,Other and unspecified conjunctivitis,Diseases of the nervous system,12691,22,1.56,0.0438221163,0.98,2.38
558.2 ,Toxic gastroenteritis and colitis,Diseases of the digestive system,3446,6,1.56,0.2938222862,0.57,3.42
215.2 ,Other benign neoplasm of connective...,Neoplasms,2297,4,1.56,0.3322927392,0.43,4.02
386.19 ,Other peripheral vertigo,Diseases of the nervous system,5189,9,1.56,0.2027223675,0.71,2.97
893.0 ,"Open wound of toe(s), without...",Injury and poisoning,6908,12,1.56,0.1423042818,0.81,2.74
724.3 ,Sciatica,Diseases of the musculoskeletal...,85100,144,1.56,0.0000011068494,1.31,1.86
311 ,"Depressive disorder, not elsewhere...",Mental disorders,12230,21,1.55,0.0549613565,0.96,2.37
782.1 ,Rash and other nonspecific skin...,"Comorbidities, signs, and ill-defined...",13374,23,1.55,0.0488379675,0.98,2.34
386.00 ,"Minihre's disease, unspecified",Diseases of the nervous system,29768,51,1.55,0.003607058,1.15,2.05
729.2 ,"Neuralgia, neuritis, and radiculitis,...",Diseases of the musculoskeletal...,94552,157,1.54,0.0000010291305,1.3,1.81
681.00 ,"Cellulitis and abscess of finger,...",Diseases of the skin and subcutaneous...,2922,5,1.54,0.2677180724,0.5,3.6
364.00 ,"Acute and subacute iridocyclitis,...",Diseases of the nervous system,2917,5,1.54,0.2669263051,0.5,3.61
493.91 ,"Asthma, unspecified type, with...",Diseases of the respiratory system,5267,9,1.54,0.2068264485,0.7,2.93
009.3 ,Diarrhea of presumed infectious...,Infectious and parasitic diseases,12857,22,1.54,0.0463538388,0.96,2.34
070.3 ,Viral hepatitis B without mention...,Infectious and parasitic diseases,4073,7,1.54,0.2325690514,0.62,3.19
110 ,Dermatophytosis,Infectious and parasitic diseases,4661,8,1.54,0.1882342881,0.66,3.05
147.9 ,"Malignant neoplasm of nasopharynx,...",Neoplasms,2332,4,1.54,0.3378089654,0.42,3.96
401.9 ,Unspecified essential hypertension,Diseases of the circulatory system,160527,261,1.54,0.000000001123351,1.34,1.75
842.10 ,"Sprain of hand, unspecified site",Injury and poisoning,4098,7,1.54,0.2348712412,0.62,3.17
354.1 ,Other lesion of median nerve,Diseases of the nervous system,2351,4,1.53,0.3408730328,0.42,3.93
490 ,"Bronchitis, not specified as acute...",Diseases of the respiratory system,53756,90,1.53,0.0002173019,1.22,1.89
722.71 ,Intervertebral disc disorder with...,Diseases of the musculoskeletal...,3520,6,1.53,0.2997285842,0.56,3.34
296.20 ,"Major depressive affective disorder,...",Mental disorders,5304,9,1.53,0.2089543747,0.7,2.91
296.3 ,"Major depressive disorder, recurrent...",Mental disorders,2933,5,1.53,0.2694686768,0.5,3.59
307.81 ,Tension headache,Mental disorders,48753,82,1.53,0.0003238127,1.21,1.92
729.0 ,"Rheumatism, unspecified and fibrositis",Diseases of the musculoskeletal...,13625,23,1.52,0.0517948672,0.96,2.29
715.09 ,"Osteoarthrosis, generalized, multiple...",Diseases of the musculoskeletal...,5313,9,1.52,0.2094892662,0.7,2.9
592.0 ,Calculus of kidney,Diseases of the genitourinary...,32915,55,1.52,0.004335399,1.14,1.98
592.9 ,"Urinary calculus, unspecified",Diseases of the genitourinary...,31092,52,1.52,0.0045348,1.13,2
719.40 ,"Pain in joint, site unspecified",Diseases of the musculoskeletal...,70235,116,1.52,0.0000384029,1.24,1.83
300.09 ,Other anxiety states,Mental disorders,13673,23,1.52,0.052493847,0.96,2.28
307.4 ,Specific disorders of sleep of...,Mental disorders,5319,9,1.52,0.209849588,0.69,2.9
485 ,"Bronchopneumonia, organism unspecified",Diseases of the respiratory system,7735,13,1.51,0.1664085501,0.8,2.59
487.0 ,Influenza with pneumonia,Diseases of the respiratory system,5372,9,1.51,0.2131605405,0.69,2.87
780.6 ,Fever,"Comorbidities, signs, and ill-defined...",72430,119,1.51,0.0000387255,1.24,1.82
533.91 ,"Peptic ulcer of unspecified site,...",Diseases of the digestive system,2978,5,1.51,0.3966051533,0.49,3.53
799.9 ,Other unknown and unspecified...,"Comorbidities, signs, and ill-defined...",2970,5,1.51,0.3960470808,0.49,3.54
388.3 ,Tinitus,Diseases of the nervous system,11967,20,1.51,0.07265523,0.92,2.33
455.2 ,Internal hemorrhoids with other...,Diseases of the circulatory system,8319,14,1.51,0.1337199373,0.83,2.55
724.9 ,Other unspecified back disorders,Diseases of the musculoskeletal...,21572,36,1.51,0.0179334742,1.05,2.1
681.02 ,Onychia and paronychia of finger,Diseases of the skin and subcutaneous...,7808,13,1.5,0.1683515442,0.8,2.57
411.89 ,Other acute and subacute forms...,Diseases of the circulatory system,2393,4,1.5,0.3478105381,0.41,3.86
437.0 ,Cerebral atherosclerosis,Diseases of the circulatory system,4185,7,1.5,0.2433500242,0.6,3.11
296.90 ,Unspecified episodic mood disorder,Mental disorders,4790,8,1.5,0.2690799633,0.65,2.97
357.2 ,Polyneuropathy in diabetes,Diseases of the nervous system,2415,4,1.49,0.351530414,0.4,3.82
496 ,"Chronic airway obstruction, not...",Diseases of the respiratory system,14558,24,1.49,0.0599872665,0.95,2.22
780.0 ,Alteration of consciousness,"Comorbidities, signs, and ill-defined...",1807,3,1.49,0.4602847371,0.31,4.37
367.1 ,Myopia,Diseases of the nervous system,21151,35,1.49,0.0221866285,1.04,2.09
789.9 ,Other symptoms involving abdomen...,"Comorbidities, signs, and ill-defined...",5436,9,1.49,0.2174593416,0.68,2.83
713.5 ,Arthropathy associated with neurological...,Diseases of the musculoskeletal...,1814,3,1.49,0.4613622687,0.31,4.35
229.8 ,Benign neoplasm of other specified...,Neoplasms,7859,13,1.49,0.1698917071,0.79,2.55
716.9 ,"Arthropathy, unspecified",Diseases of the musculoskeletal...,34608,57,1.49,0.0042603958,1.13,1.95
845.00 ,"Sprain of ankle, unspecified site",Injury and poisoning,14495,24,1.49,0.0591169506,0.95,2.23
854.0 ,Intracranial injury of other and...,Injury and poisoning,3008,5,1.49,0.3987835699,0.48,3.5
883 ,Open wound of finger(s),Injury and poisoning,5436,9,1.49,0.2174593416,0.68,2.83
346.1 ,Common migraine,Diseases of the nervous system,8506,14,1.48,0.1403093918,0.81,2.49
728.8 ,"Other disorders of muscle, ligament...",Diseases of the musculoskeletal...,4861,8,1.48,0.2732444408,0.64,2.92
729.4 ,"Fasciitis, unspecified",Diseases of the musculoskeletal...,122494,195,1.48,0.00000089127733,1.27,1.72
692.89 ,Contact dermatitis and other eczema...,Diseases of the skin and subcutaneous...,34358,56,1.48,0.0067346075,1.11,1.93
372.20 ,"Blepharoconjunctivitis, unspecified",Diseases of the nervous system,11544,19,1.48,0.0914137175,0.89,2.32
537.9 ,Unspecified disorder of stomach...,Diseases of the digestive system,4865,8,1.48,0.2734935174,0.64,2.92
375.56 ,"Stenosis of nasolacrimal duct,...",Diseases of the nervous system,2431,4,1.48,0.3542711119,0.4,3.8
215.9 ,Other benign neoplasm of connective...,Neoplasms,6669,11,1.48,0.1928651796,0.74,2.66
716 ,Other and unspecified arthropathies,Diseases of the musculoskeletal...,8486,14,1.48,0.1395251402,0.81,2.5
272 ,Disorders of lipoid metabolism,"Endocrine, nutritional and metabolic...",14625,24,1.48,0.0609956826,0.95,2.21
434.0 ,Cerebral thrombosis,Diseases of the circulatory system,1824,3,1.48,0.4629152631,0.3,4.33
493.20 ,"Chronic obstructive asthma, unspecified",Diseases of the respiratory system,3054,5,1.47,0.402379243,0.48,3.44
722 ,Intervertebral disc disorders,Diseases of the musculoskeletal...,7329,12,1.47,0.1613129981,0.76,2.58
722.90 ,"Other and unspecified disc disorder,...",Diseases of the musculoskeletal...,4277,7,1.47,0.2530658019,0.59,3.04
621.3 ,Endometrial cystic hyperplasia,Diseases of the genitourinary...,19615,32,1.47,0.0395393773,1,2.09
307.42 ,Persistent disorder of initiating...,Mental disorders,9200,15,1.47,0.1541180087,0.82,2.43
528.2 ,Oral aphthae,Diseases of the digestive system,21090,34,1.46,0.036830045,1,2.04
573.3 ,"Hepatitis, unspecified",Diseases of the digestive system,24124,39,1.46,0.0246777321,1.04,2.01
402.90 ,Unspecified hypertensive heart...,Diseases of the circulatory system,50560,81,1.46,0.0014320788,1.15,1.82
845.0 ,Sprains and strains of ankle,Injury and poisoning,3700,6,1.46,0.3168549291,0.53,3.18
845.19 ,Other sprain of foot,Injury and poisoning,3689,6,1.46,0.3157040145,0.54,3.19
428.0 ,"Congestive heart failure, unspecified",Diseases of the circulatory system,7991,13,1.46,0.174560877,0.78,2.51
721.9 ,Spondylosis of unspecified site,Diseases of the musculoskeletal...,3702,6,1.46,0.317065563,0.53,3.18
723 ,Other disorders of cervical region,Diseases of the musculoskeletal...,1845,3,1.46,0.4662273742,0.3,4.28
726.9 ,Unspecified enthesopathy,Diseases of the musculoskeletal...,11808,19,1.45,0.1245658625,0.87,2.27
486 ,"Pneumonia, organism unspecified",Diseases of the respiratory system,23752,38,1.45,0.0304314487,1.02,1.99
780.52 ,"Insomnia, unspecified","Comorbidities, signs, and ill-defined...",128567,201,1.45,0.0000019254304,1.25,1.68
370.21 ,Punctate keratitis,Diseases of the nervous system,29272,47,1.45,0.0164754488,1.06,1.94
131.00 ,"Urogenital trichomoniasis, unspecified",Infectious and parasitic diseases,9329,15,1.45,0.1579808626,0.81,2.39
379.24 ,Other vitreous opacities,Diseases of the nervous system,17457,28,1.45,0.0662484129,0.96,2.1
686.8 ,Other specified local infections...,Diseases of the skin and subcutaneous...,43486,69,1.44,0.0043731111,1.12,1.83
786.5 ,Chest pain,"Comorbidities, signs, and ill-defined...",34714,55,1.44,0.0114176815,1.08,1.88
701.1 ,"Keratoderma, acquired",Diseases of the skin and subcutaneous...,12533,20,1.44,0.105980733,0.88,2.23
153.9 ,"Malignant neoplasm of colon, unspecified...",Neoplasms,4373,7,1.44,0.3545164128,0.58,2.97
586 ,"Renal failure, unspecified",Diseases of the genitourinary...,4987,8,1.44,0.2818031592,0.62,2.85
250.4 ,Diabetes with renal manifestations,"Endocrine, nutritional and metabolic...",1867,3,1.44,0.469768068,0.3,4.23
