367.21 ,Regular astigmatism,Diseases of the nervous system,4698,3,0.38,0.1029030329,0.08,1.12
241.9 ,Unspecified nontoxic nodular goiter,"Endocrine, nutritional and metabolic...",1807,1,0.33,0.3835951045,0.01,1.85
369.9 ,Unspecified visual loss,Diseases of the nervous system,1810,1,0.33,0.3837052464,0.01,1.84
639.9 ,Unspecified complication following...,"Complications of pregnancy, childbirth,...",1827,1,0.33,0.3844018169,0.01,1.83
530.9 ,Unspecified disorder of esophagus,Diseases of the digestive system,1998,1,0.3,0.2750643585,0.01,1.67
365.9 ,Unspecified glaucoma,Diseases of the nervous system,2181,1,0.27,0.2826864958,0.01,1.53
372.8 ,Other disorders of conjunctiva,Diseases of the nervous system,2298,1,0.26,0.1979943208,0.01,1.45
378.10 ,"Exotropia, unspecified",Diseases of the nervous system,2271,1,0.26,0.1975270996,0.01,1.47
429.9 ,"Heart disease, unspecified",Diseases of the circulatory system,2680,1,0.22,0.146294052,0.01,1.24
