disease_2,disease_name,category,count,co_occurrence,odds_ratio,p_value,95_ci_lower,95_ci_upper
923.9 ,Contusion of unspecified part...,Injury and poisoning,5410,845,30.15,< 0.0001,27.85,32.57
535.51 ,"Unspecified gastritis and gastroduodenitis,...",Diseases of the digestive system,1444,65,6.77,2.668599e-31,5.19,8.7
922.9 ,Contusion of unspecified part...,Injury and poisoning,7059,292,6.39,1.86602e-126,5.65,7.2
923.8 ,Contusion of multiple sites of...,Injury and poisoning,1634,62,5.66,5.41002e-26,4.31,7.3
916.0 ,"Abrasion or friction burn of hip,...",Injury and poisoning,11950,408,5.3,2.36042e-148,4.78,5.87
923.00 ,Contusion of shoulder region,Injury and poisoning,7341,253,5.25,9.645202e-93,4.6,5.96
719.8 ,Other specified disorders of joint,Diseases of the musculoskeletal...,1502,52,5.14,2.416985e-20,3.82,6.78
719.89 ,"Other specified disorders of joint,...",Diseases of the musculoskeletal...,1438,49,5.05,5.509012e-19,3.72,6.73
894.0 ,Multiple and unspecified open...,Injury and poisoning,26076,792,4.94,5.27146e-260,4.58,5.33
922.2 ,Contusion of abdominal wall,Injury and poisoning,2384,79,4.93,7.725907e-29,3.88,6.18
824.8 ,"Unspecified fracture of ankle,...",Injury and poisoning,1575,52,4.89,1.810772e-19,3.63,6.46
844.9 ,Sprains and strains of unspecified...,Injury and poisoning,14377,450,4.87,5.41567e-150,4.41,5.37
719.00 ,"Effusion of joint, site unspecified",Diseases of the musculoskeletal...,2255,72,4.74,1.724198e-25,3.69,6
826.0 ,Closed fracture of one or more...,Injury and poisoning,3187,101,4.72,7.629224e-35,3.82,5.76
823.80 ,Closed fracture of unspecified...,Injury and poisoning,1778,56,4.66,6.416048e-20,3.5,6.09
844.2 ,Sprain of cruciate ligament of...,Injury and poisoning,2956,91,4.57,1.225206e-30,3.66,5.64
533.10 ,Acute peptic ulcer of unspecified...,Diseases of the digestive system,1507,46,4.51,3.7778e-16,3.28,6.05
924.11 ,Contusion of knee,Injury and poisoning,13934,400,4.42,3.33378e-121,3.98,4.9
822.0 ,Closed fracture of patella,Injury and poisoning,1962,58,4.37,2.621712e-19,3.3,5.68
845.09 ,Other sprains and strains of ankle,Injury and poisoning,5658,161,4.25,1.038222e-48,3.6,4.98
922.8 ,Contusion of multiple sites of...,Injury and poisoning,2723,78,4.24,1.414902e-24,3.33,5.32
924.10 ,Contusion of lower leg,Injury and poisoning,4369,124,4.22,9.571731e-38,3.5,5.06
823.00 ,Closed fracture of upper end of...,Injury and poisoning,1713,48,4.13,0.000000000000002190595,3.03,5.51
924.1 ,Contusion of knee and lower leg,Injury and poisoning,1712,48,4.13,0.000000000000002143688,3.03,5.51
707.1 ,"Ulcer of lower limbs, except decubitus",Diseases of the skin and subcutaneous...,2415,66,4.03,5.265747e-20,3.1,5.16
354.5 ,Mononeuritis multiplex,Diseases of the nervous system,1736,47,3.98,0.00000000000001469243,2.91,5.33
825.25 ,Closed fracture of metatarsal...,Injury and poisoning,3168,85,3.96,8.797462e-25,3.15,4.93
891.0 ,"Open wound of knee, leg [except...",Injury and poisoning,19081,484,3.92,4.86503e-127,3.57,4.31
845.19 ,Other sprain of foot,Injury and poisoning,2909,77,3.91,2.940625e-22,3.07,4.9
917.0 ,Abrasion or friction burn of foot...,Injury and poisoning,3824,101,3.91,1.268235e-28,3.17,4.77
959.7 ,"Knee, leg, ankle, and foot injury",Injury and poisoning,2199,58,3.88,4.280964e-17,2.93,5.05
924.00 ,Contusion of thigh,Injury and poisoning,2582,67,3.82,3.848324e-19,2.95,4.88
891.1 ,"Open wound of knee, leg [except...",Injury and poisoning,4100,105,3.79,1.225558e-28,3.08,4.6
892.0 ,Open wound of foot except toe(s)...,Injury and poisoning,12157,300,3.73,8.12366e-76,3.3,4.19
916.1 ,"Abrasion or friction burn of hip,...",Injury and poisoning,1955,49,3.68,0.00000000000007089374,2.71,4.89
924.4 ,Contusion of multiple sites of...,Injury and poisoning,2276,57,3.68,7.221716e-16,2.78,4.79
923.10 ,Contusion of forearm,Injury and poisoning,1366,34,3.65,0.0000000005014797,2.51,5.13
922.1 ,Contusion of chest wall,Injury and poisoning,28025,648,3.63,5.18154e-152,3.34,3.94
924.9 ,Contusion of unspecified site,Injury and poisoning,14269,339,3.6,1.527572e-81,3.21,4.02
914.0 ,Abrasion or friction burn of hand(s)...,Injury and poisoning,2544,62,3.58,1.403839e-16,2.73,4.61
845.00 ,"Sprain of ankle, unspecified site",Injury and poisoning,9854,235,3.57,5.513711e-57,3.12,4.08
823 ,Fracture of tibia and fibula,Injury and poisoning,1402,34,3.55,0.0000000009642128,2.45,4.99
919.8 ,Other and unspecified superficial...,Injury and poisoning,1484,36,3.55,0.0000000003141251,2.48,4.95
958.3 ,Posttraumatic wound infection...,Injury and poisoning,9993,236,3.54,1.697756e-56,3.09,4.03
923.11 ,Contusion of elbow,Injury and poisoning,3262,78,3.52,5.661663e-20,2.77,4.41
726.61 ,Pes anserinus tendinitis or bursitis,Diseases of the musculoskeletal...,1625,39,3.52,0.00000000008047998,2.49,4.83
924.20 ,Contusion of foot,Injury and poisoning,6662,156,3.47,2.347266e-37,2.94,4.08
920 ,"Contusion of face, scalp, and...",Injury and poisoning,14550,331,3.44,4.128974e-75,3.07,3.85
816.00 ,Closed fracture of phalanx or...,Injury and poisoning,2336,54,3.39,0.00000000000009573577,2.54,4.44
913.0 ,"Abrasion or friction burn of elbow,...",Injury and poisoning,4254,98,3.39,1.532572e-23,2.74,4.15
911.0 ,"Abrasion or friction burn of trunk,...",Injury and poisoning,2090,48,3.36,0.000000000002698316,2.47,4.48
854.0 ,Intracranial injury of other and...,Injury and poisoning,1852,42,3.32,0.00000000008683442,2.38,4.51
923.20 ,Contusion of hand(s),Injury and poisoning,3790,85,3.3,6.318413e-20,2.62,4.09
723.9 ,Unspecified musculoskeletal disorders...,Diseases of the musculoskeletal...,3175,71,3.28,7.631785e-17,2.55,4.16
716.16 ,"Traumatic arthropathy, lower leg",Diseases of the musculoskeletal...,1705,38,3.26,0.0000000010571249,2.3,4.5
922.3 ,Contusion of back,Injury and poisoning,12182,265,3.26,1.372789e-56,2.87,3.69
844.0 ,Sprain of lateral collateral ligament...,Injury and poisoning,2169,48,3.24,0.000000000009574255,2.38,4.31
782.2 ,"Localized superficial swelling,...","Comorbidities, signs, and ill-defined...",1632,36,3.22,0.0000000037057181,2.25,4.49
692.1 ,Contact dermatitis and other eczema...,Diseases of the skin and subcutaneous...,2045,45,3.22,0.00000000004967956,2.34,4.33
729.81 ,Swelling of limb,Diseases of the musculoskeletal...,2465,54,3.21,0.0000000000007514067,2.4,4.2
850.9 ,"Concussion, unspecified",Injury and poisoning,6728,145,3.18,3.970791e-31,2.68,3.76
881.00 ,"Open wound of forearm, without...",Injury and poisoning,3609,78,3.17,1.545721e-17,2.5,3.97
924.21 ,Contusion of ankle,Injury and poisoning,3761,81,3.16,4.591033e-18,2.5,3.94
682.6 ,"Cellulitis and abscess of leg,...",Diseases of the skin and subcutaneous...,5590,120,3.16,6.99706e-26,2.61,3.8
854.00 ,Intracranial injury of other and...,Injury and poisoning,6697,143,3.15,2.549474e-30,2.65,3.73
807.00 ,"Closed fracture of rib(s), unspecified",Injury and poisoning,2721,58,3.12,0.0000000000003315751,2.36,4.05
919.0 ,"Abrasion or friction burn of other,...",Injury and poisoning,11269,233,3.08,2.557044e-46,2.69,3.52
945.00 ,Burn of unspecified degree of...,Injury and poisoning,2237,47,3.07,0.00000000008557151,2.25,4.1
716.10 ,"Traumatic arthropathy, site unspecified",Diseases of the musculoskeletal...,3611,75,3.04,4.954239e-16,2.38,3.83
844.1 ,Sprain of medial collateral ligament...,Injury and poisoning,2763,57,3.02,0.000000000001893729,2.28,3.93
847.9 ,Sprain of unspecified site of...,Injury and poisoning,6995,143,3.02,1.800572e-28,2.53,3.57
879.6 ,Open wound of other and unspecified...,Injury and poisoning,1449,30,3.02,0.00000026437601,2.03,4.33
845.0 ,Sprains and strains of ankle,Injury and poisoning,2344,48,2.99,0.0000000001264391,2.2,3.98
891 ,"Open wound of knee, leg (except...",Injury and poisoning,2943,60,2.98,0.0000000000008203371,2.27,3.85
537.89 ,Other specified disorders of stomach...,Diseases of the digestive system,2128,43,2.95,0.0000000016489879,2.13,3.99
035 ,Erysipelas,Infectious and parasitic diseases,1381,28,2.95,0.0000009679287,1.95,4.29
924 ,Contusion of lower limb and of...,Injury and poisoning,3404,68,2.92,0.00000000000006618195,2.26,3.72
717.9 ,Unspecified internal derangement...,Diseases of the musculoskeletal...,4284,85,2.91,8.09485e-17,2.31,3.61
910.0 ,"Abrasion or friction burn of face,...",Injury and poisoning,4072,81,2.91,3.673414e-16,2.31,3.64
924.3 ,Contusion of toe,Injury and poisoning,1752,35,2.91,0.000000066457905,2.02,4.07
812.20 ,Closed fracture of unspecified...,Injury and poisoning,1860,37,2.9,0.000000031807616,2.03,4.02
715.3 ,"Osteoarthrosis, localized, not...",Diseases of the musculoskeletal...,8373,164,2.89,2.13886e-30,2.46,3.38
890.0 ,"Open wound of hip and thigh, without...",Injury and poisoning,2272,45,2.89,0.0000000012863126,2.1,3.89
854.09 ,Intracranial injury of other and...,Injury and poisoning,1914,37,2.82,0.000000064510519,1.98,3.9
873.40 ,"Open wound of face, unspecified...",Injury and poisoning,8303,159,2.82,1.726894e-28,2.39,3.31
879.8 ,Open wound(s) (multiple) of unspecified...,Injury and poisoning,10030,191,2.82,1.230474e-33,2.42,3.26
843.9 ,Sprains and strains of unspecified...,Injury and poisoning,6602,126,2.81,9.060264e-23,2.33,3.35
727.06 ,Tenosynovitis of foot and ankle,Diseases of the musculoskeletal...,4528,87,2.81,2.248409e-16,2.25,3.48
715.96 ,"Osteoarthrosis, unspecified whether...",Diseases of the musculoskeletal...,24759,456,2.8,5.005423e-75,2.54,3.08
719.46 ,"Pain in joint, lower leg",Diseases of the musculoskeletal...,18419,343,2.8,1.873398e-57,2.5,3.12
924.01 ,Contusion of hip,Injury and poisoning,3355,64,2.79,0.000000000002478473,2.14,3.57
829.0 ,"Fracture of unspecified bone,...",Injury and poisoning,3047,58,2.78,0.00000000002748291,2.1,3.61
850 ,Concussion,Injury and poisoning,3418,65,2.78,0.000000000001919258,2.14,3.55
724.4 ,Thoracic or lumbosacral neuritis...,Diseases of the musculoskeletal...,9669,182,2.78,1.610577e-31,2.38,3.23
411.81 ,Acute coronary occlusion without...,Diseases of the circulatory system,1895,36,2.77,0.00000014553965,1.93,3.85
944.00 ,Burn of unspecified degree of...,Injury and poisoning,1425,27,2.76,0.0000051061273,1.81,4.03
850.0 ,Concussion with no loss of consciousness,Injury and poisoning,6243,117,2.75,1.180528e-20,2.27,3.31
854 ,Intracranial injury of other and...,Injury and poisoning,1440,27,2.73,0.000006150625,1.79,3.99
842.09 ,Other sprains and strains of wrist,Injury and poisoning,3463,64,2.7,0.000000000009215353,2.07,3.46
854.01 ,Intracranial injury of other and...,Injury and poisoning,3517,64,2.66,0.00000000001734892,2.04,3.4
453.8 ,"Venous thrombosis, NEC",Diseases of the circulatory system,1528,28,2.66,0.0000063722593,1.76,3.87
727.89 ,"Other disorders of synovium, tendon,...",Diseases of the musculoskeletal...,3142,57,2.65,0.0000000002366966,2,3.44
892.1 ,Open wound of foot except toe(s)...,Injury and poisoning,2209,40,2.64,0.00000010670931,1.88,3.6
782.3 ,Edema,"Comorbidities, signs, and ill-defined...",39826,678,2.64,9.522016e-98,2.43,2.86
788.5 ,Oliguria and anuria,"Comorbidities, signs, and ill-defined...",1493,27,2.63,0.0000115984,1.73,3.84
813.81 ,Closed fracture of unspecified...,Injury and poisoning,3720,67,2.63,0.00000000001387898,2.03,3.35
923.21 ,Contusion of wrist,Injury and poisoning,3388,61,2.63,0.0000000000764665,2,3.39
840.9 ,Sprains and strains of unspecified...,Injury and poisoning,16604,291,2.61,6.805185e-44,2.31,2.94
715.35 ,"Osteoarthrosis, localized, not...",Diseases of the musculoskeletal...,5221,93,2.61,0.000000000000002073919,2.1,3.2
884.0 ,Multiple and unspecified open...,Injury and poisoning,18777,328,2.61,4.420887e-49,2.33,2.92
841.9 ,Sprains and strains of unspecified...,Injury and poisoning,5309,94,2.59,0.000000000000002038163,2.09,3.18
716.60 ,"Unspecified monoarthritis, site...",Diseases of the musculoskeletal...,2757,49,2.59,0.00000001176595,1.91,3.44
523.9 ,Unspecified gingival and periodontal...,Diseases of the digestive system,7152,126,2.58,6.335595e-20,2.15,3.09
728.2 ,"Muscular wasting and disuse atrophy,...",Diseases of the musculoskeletal...,1545,27,2.54,0.0000209017,1.67,3.71
493.11 ,Intrinsic asthma with status asthmaticus,Diseases of the respiratory system,1659,29,2.54,0.0000105574,1.69,3.67
842.00 ,"Sprain of wrist, unspecified site",Injury and poisoning,4209,73,2.53,0.000000000006424132,1.98,3.19
722.2 ,Displacement of intervertebral...,Diseases of the musculoskeletal...,12720,216,2.51,4.927847e-31,2.18,2.88
310.2 ,Postconcussion syndrome,Mental disorders,2854,49,2.5,0.000000024208515,1.84,3.32
702.8 ,Other specified dermatoses,Diseases of the skin and subcutaneous...,4597,78,2.48,0.000000000003813456,1.95,3.1
616.4 ,Other abscess of vulva,Diseases of the genitourinary...,1523,26,2.48,0.0000662634,1.61,3.65
923 ,Contusion of upper limb,Injury and poisoning,2056,35,2.47,0.0000030337543,1.72,3.46
724.79 ,Other disorders of coccyx,Diseases of the musculoskeletal...,2003,34,2.47,0.0000044320119,1.7,3.46
873.4 ,"Facial laceration, without mention...",Injury and poisoning,3248,55,2.46,0.00000000817808,1.85,3.22
882.0 ,Open wound of hand except finger(s)...,Injury and poisoning,10053,168,2.46,1.184395e-23,2.09,2.87
493.21 ,Chronic obstructive asthma with...,Diseases of the respiratory system,2665,45,2.46,0.00000013531821,1.78,3.3
724.1 ,Pain in thoracic spine,Diseases of the musculoskeletal...,2431,41,2.45,0.00000050058242,1.75,3.34
716.5 ,Unspecified polyarthropathy or...,Diseases of the musculoskeletal...,1487,25,2.44,0.0001054867,1.57,3.62
719.47 ,"Pain in joint, ankle and foot",Diseases of the musculoskeletal...,6710,112,2.44,3.129113e-16,2,2.95
482.9 ,"Bacterial pneumonia, unspecified",Diseases of the respiratory system,3217,54,2.44,0.000000013094077,1.83,3.2
892 ,Open wound of foot except toe(s)...,Injury and poisoning,1615,27,2.43,0.0000562147,1.59,3.55
893.0 ,"Open wound of toe(s), without...",Injury and poisoning,4687,78,2.43,0.00000000001170857,1.91,3.04
715.36 ,"Osteoarthrosis, localized, not...",Diseases of the musculoskeletal...,57168,878,2.41,2.07046e-104,2.24,2.59
728.8 ,"Other disorders of muscle, ligament...",Diseases of the musculoskeletal...,3385,56,2.41,0.0000000094242353,1.81,3.14
111.8 ,Other specified dermatomycoses,Infectious and parasitic diseases,1452,24,2.4,0.0001716741,1.53,3.59
054.2 ,Herpetic gingivostomatitis,Infectious and parasitic diseases,2121,35,2.4,0.0000051723557,1.66,3.35
724.9 ,Other unspecified back disorders,Diseases of the musculoskeletal...,16049,259,2.39,2.008414e-33,2.1,2.71
842.10 ,"Sprain of hand, unspecified site",Injury and poisoning,2685,44,2.38,0.00000052049675,1.72,3.21
715.10 ,"Osteoarthrosis, localized, primary,...",Diseases of the musculoskeletal...,6872,111,2.36,0.000000000000003191124,1.94,2.85
715.26 ,"Osteoarthrosis, localized, secondary,...",Diseases of the musculoskeletal...,7422,120,2.36,2.929153e-16,1.95,2.84
719.45 ,"Pain in joint, pelvic region and...",Diseases of the musculoskeletal...,4403,71,2.35,0.0000000002910573,1.83,2.97
922 ,Contusion of trunk,Injury and poisoning,2849,46,2.35,0.00000036622727,1.71,3.14
709.2 ,Scar conditions and fibrosis of...,Diseases of the skin and subcutaneous...,2732,44,2.34,0.00000070684374,1.69,3.15
354 ,Mononeuritis of upper limb and...,Diseases of the nervous system,1816,29,2.32,0.0000555338,1.55,3.34
459.89 ,Other specified disorders of circulatory...,Diseases of the circulatory system,1823,29,2.31,0.0000589872,1.54,3.33
726.2 ,"Other affections of shoulder region,...",Diseases of the musculoskeletal...,3397,54,2.31,0.000000067499976,1.73,3.03
805.4 ,Closed fracture of lumbar vertebra...,Injury and poisoning,5568,88,2.3,0.000000000007301613,1.84,2.85
805.6 ,Closed fracture of sacrum and...,Injury and poisoning,1388,22,2.3,0.0004923134,1.43,3.5
715.09 ,"Osteoarthrosis, generalized, multiple...",Diseases of the musculoskeletal...,7008,110,2.29,0.00000000000003372954,1.88,2.77
250.80 ,Diabetes with other specified...,"Endocrine, nutritional and metabolic...",3693,58,2.28,0.000000028619357,1.73,2.96
724.8 ,Other symptoms referable to back,Diseases of the musculoskeletal...,2425,38,2.27,0.0000070014469,1.6,3.13
353.1 ,Lumbosacral plexus lesions,Diseases of the nervous system,2810,44,2.27,0.000001861541,1.65,3.06
355.0 ,Lesion of sciatic nerve,Diseases of the nervous system,4546,71,2.27,0.0000000010964745,1.77,2.88
683 ,Acute lymphadenitis,Diseases of the skin and subcutaneous...,2249,35,2.26,0.0000186457,1.57,3.15
386.50 ,"Labyrinthine dysfunction, unspecified",Diseases of the nervous system,2316,36,2.25,0.0000142791,1.57,3.13
726.60 ,"Enthesopathy of knee, unspecified",Diseases of the musculoskeletal...,3492,54,2.25,0.00000019139535,1.68,2.94
780.3 ,Convulsions,"Comorbidities, signs, and ill-defined...",2452,38,2.25,0.0000086025478,1.59,3.1
840.0 ,Acromioclavicular (joint) (ligament)...,Injury and poisoning,2005,31,2.24,0.0000654759,1.52,3.2
715.37 ,"Osteoarthrosis, localized, not...",Diseases of the musculoskeletal...,3061,47,2.23,0.000001073592,1.63,2.98
682.9 ,Cellulitis and abscess of unspecified...,Diseases of the skin and subcutaneous...,37074,545,2.23,1.204557e-57,2.04,2.43
581.9 ,Nephrotic syndrome with unspecified...,Diseases of the genitourinary...,5045,77,2.22,0.0000000007949635,1.75,2.79
921.3 ,Contusion of eyeball,Injury and poisoning,1569,24,2.22,0.0006072716,1.41,3.31
995.2 ,Unspecified adverse effect od...,Injury and poisoning,1434,22,2.22,0.0007038447,1.39,3.38
873.0 ,"Open wound of scalp, without mention...",Injury and poisoning,6991,106,2.21,0.0000000000006366403,1.81,2.68
722.52 ,Degeneration of lumbar or lumbosacral...,Diseases of the musculoskeletal...,2565,39,2.21,0.0000122036,1.56,3.03
686.9 ,Unspecified local infection of...,Diseases of the skin and subcutaneous...,65152,920,2.21,1.463211e-90,2.06,2.37
713.8 ,Arthropathy associated with other...,Diseases of the musculoskeletal...,2443,37,2.2,0.0000230008,1.54,3.04
845.10 ,"Sprain of foot, unspecified site",Injury and poisoning,3233,49,2.2,0.0000011371846,1.62,2.92
724.2 ,Lumbago,Diseases of the musculoskeletal...,212065,2547,2.2,1.48992e-194,2.09,2.32
724.3 ,Sciatica,Diseases of the musculoskeletal...,79437,1099,2.2,1.79154e-104,2.06,2.35
894 ,Multiple and unspecified open...,Injury and poisoning,2446,37,2.19,0.0000233289,1.54,3.04
915.0 ,"Abrasion or friction burn of finger(s),...",Injury and poisoning,1586,24,2.19,0.0006514966,1.4,3.28
620.0 ,Follicular cyst of ovary,Diseases of the genitourinary...,1718,26,2.19,0.000358118,1.43,3.23
682.7 ,"Cellulitis and abscess of foot,...",Diseases of the skin and subcutaneous...,2781,42,2.19,0.0000058624739,1.57,2.97
216.8 ,Benign neoplasm of other specified...,Neoplasms,2799,42,2.18,0.0000066300165,1.56,2.95
723.0 ,Spinal stenosis in cervical region,Diseases of the musculoskeletal...,6151,92,2.18,0.00000000004821385,1.75,2.68
493.20 ,"Chronic obstructive asthma, unspecified",Diseases of the respiratory system,4024,60,2.17,0.00000010747612,1.65,2.8
727.01 ,Synovitis and tenosynovitis in...,Diseases of the musculoskeletal...,3296,49,2.16,0.0000016017034,1.59,2.86
558.2 ,Toxic gastroenteritis and colitis,Diseases of the digestive system,2293,34,2.15,0.0000696941,1.48,3.01
715.38 ,"Osteoarthrosis, localized, not...",Diseases of the musculoskeletal...,4389,65,2.15,0.000000046531944,1.66,2.75
727.3 ,Other bursitis,Diseases of the musculoskeletal...,1888,28,2.15,0.0002577888,1.42,3.12
780.9 ,Other general symptoms,"Comorbidities, signs, and ill-defined...",11890,174,2.15,9.106833e-19,1.83,2.5
943.00 ,Burn of unspecified degree of...,Injury and poisoning,1964,29,2.14,0.0003117509,1.43,3.08
716.66 ,"Unspecified monoarthritis, lower...",Diseases of the musculoskeletal...,3947,58,2.13,0.00000026002641,1.62,2.77
719.40 ,"Pain in joint, site unspecified",Diseases of the musculoskeletal...,64468,881,2.13,1.328364e-79,1.98,2.28
813.83 ,Closed fracture of unspecified...,Injury and poisoning,1432,21,2.12,0.0019760433,1.31,3.26
873.8 ,Other and unspecified open wound...,Injury and poisoning,2866,42,2.12,0.0000133948,1.53,2.88
726.71 ,Achilles bursitis or tendinitis,Diseases of the musculoskeletal...,3623,53,2.12,0.0000010411092,1.59,2.79
729.82 ,Cramp of limb,Diseases of the musculoskeletal...,2182,32,2.12,0.0001378178,1.45,3.01
805.8 ,Closed fracture of unspecified...,Injury and poisoning,1581,23,2.11,0.0012053601,1.33,3.17
847.0 ,Sprain of neck,Injury and poisoning,20507,292,2.11,1.130378e-28,1.87,2.37
788.9 ,Other symptoms involving urinary...,"Comorbidities, signs, and ill-defined...",1998,29,2.1,0.0003524188,1.4,3.03
684 ,Impetigo,Diseases of the skin and subcutaneous...,2342,34,2.1,0.0000922068,1.45,2.95
715.0 ,"Osteoarthrosis, generalized",Diseases of the musculoskeletal...,5353,77,2.09,0.0000000081655175,1.65,2.62
715.00 ,"Osteoarthrosis, generalized, site...",Diseases of the musculoskeletal...,12538,179,2.09,3.01132e-18,1.79,2.43
721.42 ,"Spondylosis with myelopathy, lumbar...",Diseases of the musculoskeletal...,15133,215,2.09,2.262564e-21,1.81,2.39
533.40 ,Chronic or unspecified peptic...,Diseases of the digestive system,7323,104,2.07,0.00000000004704718,1.68,2.51
555.2 ,Regional enteritis of small intestine...,Diseases of the digestive system,3148,45,2.07,0.0000126488,1.51,2.78
722.1 ,Displacement of thoracic or lumbar...,Diseases of the musculoskeletal...,3146,45,2.07,0.0000125407,1.51,2.78
694.0 ,Dermatitis herpetiformis,Diseases of the skin and subcutaneous...,1757,25,2.06,0.0012667222,1.33,3.05
873 ,Other open wound of head,Injury and poisoning,2109,30,2.06,0.0003327607,1.38,2.95
346.0 ,Classical migraine,Diseases of the nervous system,2828,40,2.05,0.0000556795,1.46,2.8
813.42 ,Other closed fractures of distal...,Injury and poisoning,1984,28,2.04,0.0006031717,1.35,2.96
555.9 ,Regional enteritis of unspecified...,Diseases of the digestive system,9511,133,2.04,0.0000000000003222057,1.7,2.43
627.3 ,Postmenopausal atrophic vaginitis,Diseases of the genitourinary...,9860,137,2.03,0.0000000000002168734,1.7,2.4
682.8 ,Cellulitis and abscess of other...,Diseases of the skin and subcutaneous...,4084,57,2.02,0.0000017722451,1.53,2.63
718.4 ,Contracture of joint,Diseases of the musculoskeletal...,2094,29,2,0.0008182015,1.34,2.89
719.49 ,"Pain in joint, multiple sites",Diseases of the musculoskeletal...,12373,169,2,0.000000000000001422561,1.7,2.33
533.0 ,"Peptic ulcer, site unspecified...",Diseases of the digestive system,2616,36,1.99,0.0002088306,1.39,2.77
721.9 ,Spondylosis of unspecified site,Diseases of the musculoskeletal...,3856,53,1.99,0.0000061928425,1.49,2.61
487.1 ,Influenza with other respiratory...,Diseases of the respiratory system,125827,1536,1.99,5.7244e-108,1.88,2.11
701.4 ,Keloid scar,Diseases of the skin and subcutaneous...,3949,54,1.98,0.0000054157956,1.48,2.59
575.1 ,Other cholecystitis,Diseases of the digestive system,2996,41,1.98,0.0000928359,1.42,2.7
916 ,"Superficial injury of hip, thigh,...",Injury and poisoning,1604,22,1.98,0.0036266077,1.24,3.02
923.3 ,Contusion of finger,Injury and poisoning,2190,30,1.98,0.0006823498,1.33,2.84
053.19 ,Herpes zoster with other nervous...,Infectious and parasitic diseases,1901,26,1.98,0.0013694349,1.29,2.91
716.96 ,"Arthropathy, unspecified, lower...",Diseases of the musculoskeletal...,10122,136,1.96,0.000000000002772175,1.64,2.32
464.1 ,Acute tracheitis,Diseases of the respiratory system,12830,172,1.96,0.000000000000004615777,1.67,2.28
729.2 ,"Neuralgia, neuritis, and radiculitis,...",Diseases of the musculoskeletal...,79268,994,1.95,1.061986e-71,1.82,2.09
370.00 ,"Corneal ulcer, unspecified",Diseases of the nervous system,2822,38,1.95,0.0002334019,1.37,2.68
250.70 ,Diabetes with peripheral circulatory...,"Endocrine, nutritional and metabolic...",6130,82,1.94,0.00000007463293,1.54,2.42
455.5 ,External hemorrhoids with other...,Diseases of the circulatory system,1715,23,1.94,0.003325754,1.22,2.92
475 ,Peritonsillar abscess,Diseases of the respiratory system,5754,77,1.94,0.00000017045402,1.53,2.44
727.9 ,"Unspecified disorder of synovium,...",Diseases of the musculoskeletal...,5622,75,1.94,0.00000029327181,1.52,2.43
691.8 ,Other atopic dermatitis and related...,Diseases of the skin and subcutaneous...,24385,320,1.94,1.547113e-25,1.73,2.17
716.50 ,Unspecified polyarthropathy or...,Diseases of the musculoskeletal...,3894,52,1.93,0.0000171252,1.44,2.55
405.99 ,Other unspecified secondary hypertension,Diseases of the circulatory system,4433,59,1.93,0.0000048653096,1.46,2.5
719.90 ,"Unspecified disorder of joint,...",Diseases of the musculoskeletal...,3893,52,1.93,0.0000170612,1.44,2.55
296 ,Disorganized type,Mental disorders,3074,41,1.93,0.0001233628,1.38,2.63
571.41 ,Chronic persistent hepatitis,Diseases of the digestive system,8095,107,1.92,0.0000000015531436,1.57,2.33
726.11 ,Calcifying tendinitis of shoulder,Diseases of the musculoskeletal...,3917,52,1.92,0.0000187838,1.43,2.53
682.2 ,Cellulitis and abscess of trunk,Diseases of the skin and subcutaneous...,1429,19,1.92,0.0094882471,1.15,3.01
372.12 ,Chronic follicular conjunctivitis,Diseases of the nervous system,3942,52,1.91,0.0000296193,1.42,2.51
719.99 ,"Unspecified disorder of joint,...",Diseases of the musculoskeletal...,3946,52,1.91,0.0000298517,1.42,2.51
724 ,Other and unspecified disorders...,Diseases of the musculoskeletal...,7620,100,1.91,0.0000000066249469,1.55,2.33
726.90 ,Enthesopathy of unspecified site,Diseases of the musculoskeletal...,53298,671,1.91,1.02819e-47,1.76,2.07
949.0 ,"Burn of unspecified site, unspecified...",Injury and poisoning,7208,95,1.91,0.000000013636271,1.54,2.35
716.56 ,Unspecified polyarthropathy or...,Diseases of the musculoskeletal...,1676,22,1.9,0.0071866147,1.18,2.88
718.40 ,"Contracture of joint, site unspecified",Diseases of the musculoskeletal...,3588,47,1.9,0.0000719681,1.39,2.53
355.8 ,"Mononeuritis of lower limb, unspecified",Diseases of the nervous system,1370,18,1.9,0.0130179815,1.12,3.01
