719.47 ,"Pain in joint, ankle and foot",Diseases of the musculoskeletal...,2032,3,0.57,0.5066546717,0.12,1.66
933.0 ,Foreign body in pharynx,Injury and poisoning,6417,9,0.54,0.0636458209,0.25,1.03
737 ,Curvature of spine,Diseases of the musculoskeletal...,2207,3,0.52,0.395677315,0.11,1.53
491.0 ,Simple chronic bronchitis,Diseases of the respiratory system,3133,4,0.49,0.2128724743,0.13,1.26
786.9 ,Other symptoms involving respiratory...,"Comorbidities, signs, and ill-defined...",1990,2,0.39,0.2616053164,0.05,1.4
367.51 ,Paresis of accommodation,Diseases of the nervous system,4254,4,0.36,0.0324891551,0.1,0.93
074.3 ,"Hand, foot, and mouth disease",Infectious and parasitic diseases,2295,2,0.34,0.1440328306,0.04,1.21
372.71 ,Hyperemia of conjunctiva,Diseases of the nervous system,3488,3,0.33,0.0429997377,0.07,0.97
737.43 ,Scoliosis associated with other...,Diseases of the musculoskeletal...,2419,2,0.32,0.105094688,0.04,1.15
087.9 ,"Relapsing fever, unspecified",Infectious and parasitic diseases,1821,0,0.21,0.0180069661,,0.78
241.9 ,Unspecified nontoxic nodular goiter,"Endocrine, nutritional and metabolic...",1807,0,0.21,0.0178569625,,0.79
