437.9 ,Unspecified cerebrovascular disease,Diseases of the circulatory system,7501,21,2.12,0.0019564129,1.31,3.26
922.9 ,Contusion of unspecified part...,Injury and poisoning,9690,27,2.12,0.0003965121,1.39,3.09
924.10 ,Contusion of lower leg,Injury and poisoning,6803,19,2.12,0.0036099873,1.27,3.32
844 ,Sprains and strains of knee and...,Injury and poisoning,2146,6,2.11,0.0690208921,0.77,4.62
912.0 ,Abrasion or friction burn of shoulder...,Injury and poisoning,2152,6,2.11,0.0697418719,0.77,4.6
686 ,Other local infections of skin...,Diseases of the skin and subcutaneous...,11176,31,2.11,0.0001945715,1.43,3.01
530.2 ,Ulcer of esophagus,Diseases of the digestive system,4315,12,2.11,0.0176079939,1.09,3.69
250.9 ,Diabetes with unspecified complication,"Endocrine, nutritional and metabolic...",4687,13,2.1,0.013361431,1.12,3.6
276.5 ,Volume depletion,"Endocrine, nutritional and metabolic...",8300,23,2.1,0.0012058022,1.33,3.17
723.2 ,Cervicocranial syndrome,Diseases of the musculoskeletal...,4697,13,2.1,0.0135189866,1.11,3.6
780.2 ,Syncope and collapse,"Comorbidities, signs, and ill-defined...",12714,35,2.1,0.000111395,1.46,2.93
873.8 ,Other and unspecified open wound...,Injury and poisoning,4699,13,2.09,0.0135508123,1.11,3.59
727.09 ,Other synovitis and tenosynovitis,Diseases of the musculoskeletal...,10529,29,2.09,0.0003631254,1.4,3.02
478.9 ,Other and unspecified diseases...,Diseases of the respiratory system,14593,40,2.09,0.0000289964,1.49,2.86
916.0 ,"Abrasion or friction burn of hip,...",Injury and poisoning,19497,53,2.08,0.0000022173991,1.55,2.73
625.9 ,Unspecified symptom associated...,Diseases of the genitourinary...,9133,25,2.08,0.001206111,1.34,3.08
923.9 ,Contusion of unspecified part...,Injury and poisoning,8741,24,2.08,0.0010152928,1.33,3.11
009 ,Ill-defined intestinal infections,Infectious and parasitic diseases,5471,15,2.08,0.0083476522,1.16,3.44
783.0 ,Anorexia,"Comorbidities, signs, and ill-defined...",2540,7,2.08,0.0554373481,0.84,4.31
787.9 ,Other symptoms involving digestive...,"Comorbidities, signs, and ill-defined...",12117,33,2.07,0.0002148493,1.42,2.92
372.8 ,Other disorders of conjunctiva,Diseases of the nervous system,4021,11,2.07,0.0253939361,1.03,3.72
306 ,Physiological malfunction arising...,Mental disorders,4025,11,2.07,0.0254995574,1.03,3.71
680.8 ,Carbuncle and furuncle of other...,Diseases of the skin and subcutaneous...,2563,7,2.07,0.0907973093,0.83,4.27
427.2 ,"Paroxysmal tachycardia, unspecified",Diseases of the circulatory system,3671,10,2.06,0.0347217345,0.99,3.8
454.9 ,Asymptomatic varicose veins,Diseases of the circulatory system,8830,24,2.06,0.0016794216,1.32,3.08
726.9 ,Unspecified enthesopathy,Diseases of the musculoskeletal...,11808,32,2.06,0.0002965117,1.41,2.92
786.51 ,Precordial pain,"Comorbidities, signs, and ill-defined...",7404,20,2.05,0.0033306902,1.25,3.17
845.19 ,Other sprain of foot,Injury and poisoning,3689,10,2.05,0.0353234478,0.98,3.78
597.80 ,"Urethritis, unspecified",Diseases of the genitourinary...,31531,84,2.05,0.0000000048076269,1.63,2.55
729 ,Other disorders of soft tissues,Diseases of the musculoskeletal...,2587,7,2.05,0.0920576606,0.82,4.23
854.09 ,Intracranial injury of other and...,Injury and poisoning,2967,8,2.04,0.0665494464,0.88,4.03
229.8 ,Benign neoplasm of other specified...,Neoplasms,7859,21,2.03,0.0028208707,1.25,3.11
848 ,Other and ill-defined sprains...,Injury and poisoning,3731,10,2.03,0.0368059008,0.97,3.74
459.9 ,Unspecified circulatory system...,Diseases of the circulatory system,4482,12,2.03,0.0212644135,1.04,3.55
528.0 ,Stomatitis,Diseases of the digestive system,26882,71,2.03,0.00000010985566,1.58,2.57
372.53 ,Conjunctival xerosis,Diseases of the nervous system,5251,14,2.02,0.0195747471,1.1,3.4
216.1 ,"Benign neoplasm of eyelid, including...",Neoplasms,2241,6,2.02,0.0809446677,0.74,4.42
455.5 ,External hemorrhoids with other...,Diseases of the circulatory system,2999,8,2.02,0.0681810556,0.87,3.99
295.32 ,"Paranoid type schizophrenia, chronic",Mental disorders,1866,5,2.02,0.1053210004,0.66,4.74
296.9 ,Other and unspecified affective...,Mental disorders,1866,5,2.02,0.1053210004,0.66,4.74
924.9 ,Contusion of unspecified site,Injury and poisoning,21204,56,2.02,0.0000023980325,1.52,2.63
274.0 ,"Gouty arthropathy, unspecified","Endocrine, nutritional and metabolic...",32584,85,2.01,0.00000001262926,1.6,2.5
618.0 ,Prolapse of vaginal walls without...,Diseases of the genitourinary...,3388,9,2.01,0.0508160444,0.92,3.83
784.49 ,Other voice and resonance disorders,"Comorbidities, signs, and ill-defined...",1892,5,2,0.1099078678,0.65,4.68
715.11 ,"Osteoarthrosis, localized, primary,...",Diseases of the musculoskeletal...,3026,8,2,0.0696464048,0.86,3.95
715.3 ,"Osteoarthrosis, localized, not...",Diseases of the musculoskeletal...,5700,15,1.99,0.0151828849,1.11,3.3
720.9 ,Unspecified inflammatory spondylopathy,Diseases of the musculoskeletal...,2659,7,1.99,0.0963660133,0.8,4.11
447.6 ,"Arteritis, unspecified",Diseases of the circulatory system,6458,17,1.99,0.0087513209,1.16,3.2
724.4 ,Thoracic or lumbosacral neuritis...,Diseases of the musculoskeletal...,10703,28,1.99,0.0011320807,1.32,2.88
529.0 ,Glossitis,Diseases of the digestive system,3416,9,1.99,0.0521429178,0.91,3.79
564.8 ,Other specified function disorder...,Diseases of the digestive system,31067,80,1.98,0.000000058450836,1.56,2.48
300.89 ,Other somatoform disorders,Mental disorders,7285,19,1.98,0.0056395685,1.19,3.1
729.2 ,"Neuralgia, neuritis, and radiculitis,...",Diseases of the musculoskeletal...,94552,235,1.98,1.089458e-19,1.72,2.27
698.0 ,Pruritus ani,Diseases of the skin and subcutaneous...,1918,5,1.97,0.1145899784,0.64,4.61
580 ,Acute glomerulonephritis,Diseases of the genitourinary...,2687,7,1.97,0.0982512471,0.79,4.07
599 ,Other disorders of urethra and...,Diseases of the genitourinary...,9997,26,1.97,0.0013857823,1.29,2.9
300.81 ,Somatization disorder,Mental disorders,1913,5,1.97,0.1136822491,0.64,4.62
935.1 ,Foreign body in esophagus,Injury and poisoning,2688,7,1.97,0.0983207169,0.79,4.07
813.81 ,Closed fracture of unspecified...,Injury and poisoning,2312,6,1.96,0.1369169579,0.72,4.28
715.26 ,"Osteoarthrosis, localized, secondary,...",Diseases of the musculoskeletal...,4245,11,1.96,0.0324800459,0.98,3.52
388.70 ,"Otalgia, unspecified",Diseases of the nervous system,3854,10,1.96,0.0417843542,0.94,3.62
455 ,Hemorrhoids,Diseases of the circulatory system,11645,30,1.96,0.0007666434,1.32,2.8
788.9 ,Other symptoms involving urinary...,"Comorbidities, signs, and ill-defined...",2717,7,1.95,0.100398985,0.78,4.03
708.1 ,Idiopathic urticaria,Diseases of the skin and subcutaneous...,8955,23,1.95,0.0031713478,1.23,2.93
722.73 ,Intervertebral disc disorder with...,Diseases of the musculoskeletal...,7401,19,1.95,0.0089963645,1.17,3.05
726.30 ,"Enthesopathy of elbow, unspecified",Diseases of the musculoskeletal...,2715,7,1.95,0.1002517228,0.78,4.03
727.0 ,Synovitis and tenosynovitis,Diseases of the musculoskeletal...,23123,59,1.95,0.0000040385822,1.48,2.53
738.4 ,Acquired spondylolisthesis,Diseases of the musculoskeletal...,7783,20,1.95,0.0068045662,1.19,3.02
532.70 ,Chronic duodenal ulcer without...,Diseases of the digestive system,12935,33,1.94,0.0005651191,1.33,2.73
110.8 ,Dermatophytosis of other specified...,Infectious and parasitic diseases,2340,6,1.94,0.1391775104,0.71,4.23
595.2 ,Other chronic cystitis,Diseases of the genitourinary...,4288,11,1.94,0.0341198576,0.97,3.48
922.3 ,Contusion of back,Injury and poisoning,18485,47,1.94,0.0000390744,1.42,2.59
780.6 ,Fever,"Comorbidities, signs, and ill-defined...",72430,179,1.94,0.000000000000008311725,1.66,2.27
583.9 ,"Nephritis and nephropathy, not...",Diseases of the genitourinary...,9818,25,1.93,0.0029638245,1.25,2.86
250.60 ,"Diabetes with neurological manifestations,...","Endocrine, nutritional and metabolic...",7855,20,1.93,0.0071284369,1.18,2.99
625 ,Pain and other symptoms associated...,Diseases of the genitourinary...,1958,5,1.93,0.1219755123,0.63,4.52
476.0 ,Chronic laryngitis,Diseases of the respiratory system,5492,14,1.93,0.0227532435,1.05,3.25
345.90 ,"Epilepsy, unspecified, without...",Diseases of the nervous system,3522,9,1.93,0.0577541948,0.88,3.68
728.71 ,Plantar fascial fibromatosis,Diseases of the musculoskeletal...,4716,12,1.93,0.0400189787,0.99,3.37
780 ,General symptoms,"Comorbidities, signs, and ill-defined...",4695,12,1.93,0.0395988532,1,3.39
780.50 ,"Sleep disturbance, unspecified","Comorbidities, signs, and ill-defined...",42081,105,1.93,0.0000000023422224,1.57,2.35
041.8 ,Other specified bacterial infections,Infectious and parasitic diseases,2739,7,1.93,0.1020570277,0.78,3.99
413 ,Angina pectoris,Diseases of the circulatory system,4718,12,1.92,0.0400602443,0.99,3.37
692.3 ,Contact dermatitis and other eczema...,Diseases of the skin and subcutaneous...,13063,33,1.92,0.0006195117,1.32,2.71
533.90 ,"Peptic ulcer of unspecified site,...",Diseases of the digestive system,118037,280,1.91,1.272193e-20,1.68,2.16
581.9 ,Nephrotic syndrome with unspecified...,Diseases of the genitourinary...,5547,14,1.91,0.0237374404,1.04,3.22
597.89 ,Other urethritis,Diseases of the genitourinary...,6733,17,1.91,0.0166660238,1.11,3.07
455.2 ,Internal hemorrhoids with other...,Diseases of the circulatory system,8319,21,1.91,0.0058512539,1.18,2.94
726.1 ,"Rotator cuff syndrome of shoulder,...",Diseases of the musculoskeletal...,5163,13,1.91,0.0311934853,1.01,3.27
474.0 ,Chronic tonsillitis,Diseases of the respiratory system,7950,20,1.91,0.0076348847,1.16,2.95
727.9 ,"Unspecified disorder of synovium,...",Diseases of the musculoskeletal...,7958,20,1.91,0.0076817395,1.16,2.95
239 ,Neoplasms of unspecifed nature,Neoplasms,1984,5,1.9,0.1985850613,0.62,4.46
780.9 ,Other general symptoms,"Comorbidities, signs, and ill-defined...",16840,42,1.9,0.0001618757,1.36,2.58
781.9 ,Other symptoms involving nervous...,"Comorbidities, signs, and ill-defined...",9964,25,1.9,0.0032319314,1.23,2.82
536.8 ,Dyspepsia and other specified...,Diseases of the digestive system,120130,283,1.89,1.81787e-20,1.67,2.15
790.4 ,Nonspecific elevation of levels...,"Comorbidities, signs, and ill-defined...",2002,5,1.89,0.2003463948,0.61,4.42
715.10 ,"Osteoarthrosis, localized, primary,...",Diseases of the musculoskeletal...,4815,12,1.89,0.0423233961,0.97,3.3
455.8 ,Unspecified hemorrhoids with other...,Diseases of the circulatory system,13249,33,1.89,0.0007237463,1.3,2.67
300.09 ,Other anxiety states,Mental disorders,13673,34,1.89,0.0008046023,1.31,2.65
523.0 ,Acute gingivitis,Diseases of the digestive system,7634,19,1.89,0.0103976309,1.13,2.95
684 ,Impetigo,Diseases of the skin and subcutaneous...,4009,10,1.89,0.0494288406,0.9,3.48
945.24 ,"Blisters, epidermal loss [second...",Injury and poisoning,2011,5,1.88,0.2012579964,0.61,4.4
782.1 ,Rash and other nonspecific skin...,"Comorbidities, signs, and ill-defined...",13374,33,1.88,0.0010889937,1.29,2.64
686.9 ,Unspecified local infection of...,Diseases of the skin and subcutaneous...,107317,251,1.87,9.23007e-18,1.63,2.13
788.0 ,Renal colic,"Comorbidities, signs, and ill-defined...",12228,30,1.86,0.0016418925,1.25,2.67
137.0 ,Late effects of respiratory or...,Infectious and parasitic diseases,5708,14,1.86,0.0271903143,1.01,3.12
560.1 ,Paralytic ileus,Diseases of the digestive system,3668,9,1.86,0.066999614,0.85,3.53
844.2 ,Sprain of cruciate ligament of...,Injury and poisoning,3257,8,1.86,0.0854275521,0.8,3.67
388.31 ,Subjective tinnitus,Diseases of the nervous system,2436,6,1.86,0.1480701441,0.68,4.06
786.0 ,Dyspnea and respiratory abnormalities,"Comorbidities, signs, and ill-defined...",6949,17,1.85,0.0186065199,1.08,2.98
381.00 ,"Acute nonsuppurative otitis media,...",Diseases of the nervous system,3682,9,1.85,0.0679780052,0.84,3.52
296.20 ,"Major depressive affective disorder,...",Mental disorders,5304,13,1.85,0.0346455957,0.99,3.18
698.8 ,Other specified pruritic conditions,Diseases of the skin and subcutaneous...,14030,34,1.84,0.0010056091,1.27,2.58
535.0 ,Acute gastritis,Diseases of the digestive system,48449,115,1.84,0.0000000058810074,1.51,2.22
715.16 ,"Osteoarthrosis, localized, primary,...",Diseases of the musculoskeletal...,22022,53,1.84,0.0000531688,1.37,2.41
282.4 ,Thalassemias,Diseases of the blood and blood-forming...,4108,10,1.84,0.0783871931,0.88,3.4
357.4 ,Polyneuropathy in other diseases...,Diseases of the nervous system,6599,16,1.84,0.0248421788,1.05,2.99
692 ,Contact dermatitis and other eczema,Diseases of the skin and subcutaneous...,36700,88,1.84,0.00000029169764,1.47,2.28
719.41 ,"Pain in joint, shoulder region",Diseases of the musculoskeletal...,17090,41,1.83,0.0004247823,1.31,2.49
949.0 ,"Burn of unspecified site, unspecified...",Injury and poisoning,12007,29,1.83,0.0023680989,1.22,2.64
721.42 ,"Spondylosis with myelopathy, lumbar...",Diseases of the musculoskeletal...,10420,25,1.82,0.006157349,1.17,2.7
307.81 ,Tension headache,Mental disorders,48753,115,1.82,0.0000000095768489,1.5,2.2
780.59 ,Other sleep disturbances,"Comorbidities, signs, and ill-defined...",9170,22,1.82,0.0088141063,1.14,2.76
215.0 ,Other benign neoplasm of connective...,Neoplasms,4179,10,1.81,0.081132903,0.87,3.34
250.0 ,Diabetes Mellitus w/m of complication,"Endocrine, nutritional and metabolic...",21948,52,1.81,0.0001094238,1.34,2.38
620.1 ,Corpus luteum cyst or hematoma,Diseases of the genitourinary...,2089,5,1.81,0.2099905842,0.59,4.23
786.01 ,Hyperventilation,"Comorbidities, signs, and ill-defined...",5031,12,1.8,0.0492089786,0.93,3.16
216.7 ,Benign neoplasm of skin of lower...,Neoplasms,2931,7,1.8,0.1193963225,0.72,3.73
578.9 ,Hemorrhage of gastrointestinal...,Diseases of the digestive system,9339,22,1.79,0.0139968371,1.12,2.71
724.3 ,Sciatica,Diseases of the musculoskeletal...,85100,194,1.79,0.0000000000007610078,1.54,2.08
473.8 ,Other chronic sinusitis,Diseases of the respiratory system,3372,8,1.79,0.095382958,0.77,3.54
355.0 ,Lesion of sciatic nerve,Diseases of the nervous system,4642,11,1.79,0.064143731,0.89,3.22
533.70 ,Chronic peptic ulcer of unspecified...,Diseases of the digestive system,19260,45,1.78,0.0004283746,1.29,2.39
698.4 ,Dermatitis factitia [artefacta],Diseases of the skin and subcutaneous...,9782,23,1.78,0.0109799158,1.13,2.68
556 ,Idiopathic proctocolitis,Diseases of the digestive system,3815,9,1.78,0.1099693359,0.81,3.4
715.1 ,"Osteoarthrosis, localized, primary",Diseases of the musculoskeletal...,3400,8,1.78,0.0980107973,0.77,3.51
844.9 ,Sprains and strains of unspecified...,Injury and poisoning,17136,40,1.78,0.0009443257,1.26,2.43
401.0 ,Malignant essential hypertension,Diseases of the circulatory system,5527,13,1.78,0.0592843592,0.95,3.05
788.3 ,Incontinence of urine,"Comorbidities, signs, and ill-defined...",20216,47,1.77,0.0002966183,1.3,2.36
840.9 ,Sprains and strains of unspecified...,Injury and poisoning,24089,56,1.77,0.0001081298,1.34,2.31
719.49 ,"Pain in joint, multiple sites",Diseases of the musculoskeletal...,13325,31,1.77,0.0037057493,1.2,2.52
724.9 ,Other unspecified back disorders,Diseases of the musculoskeletal...,21572,50,1.77,0.0002156788,1.31,2.34
726.12 ,Bicipital tenosynovitis,Diseases of the musculoskeletal...,5563,13,1.77,0.0600533798,0.94,3.03
477.0 ,Allergic rhinitis due to pollen,Diseases of the respiratory system,2988,7,1.77,0.1254907184,0.71,3.66
493.90 ,"Asthma, unspecified type, unspecified",Diseases of the respiratory system,54151,124,1.77,0.000000012674168,1.47,2.13
110.2 ,Dermatophytosis of hand,Infectious and parasitic diseases,3437,8,1.76,0.1491161121,0.76,3.48
727.89 ,"Other disorders of synovium, tendon,...",Diseases of the musculoskeletal...,4728,11,1.76,0.0681201082,0.88,3.16
492 ,Emphysema,Diseases of the respiratory system,2149,5,1.76,0.2176694595,0.57,4.11
366.9 ,Unspecified cataract,Diseases of the nervous system,2999,7,1.76,0.1267144413,0.71,3.64
564.0 ,Constipation,Diseases of the digestive system,114528,253,1.75,0.000000000000004435144,1.53,2
414.9 ,"Chronic ischemic heart disease,...",Diseases of the circulatory system,41810,95,1.75,0.00000080428594,1.41,2.15
272.9 ,Unspecified disorder of lipoid...,"Endocrine, nutritional and metabolic...",8638,20,1.75,0.0169520266,1.07,2.72
478 ,Other diseases of upper respiratory...,Diseases of the respiratory system,4324,10,1.75,0.0881394992,0.84,3.23
573.3 ,"Hepatitis, unspecified",Diseases of the digestive system,24124,55,1.74,0.0001629977,1.31,2.27
296.90 ,Unspecified episodic mood disorder,Mental disorders,4790,11,1.74,0.0713029403,0.86,3.12
356.9 ,Unspecified hereditary and idiopathic...,Diseases of the nervous system,15266,35,1.74,0.0023425345,1.21,2.43
362.02 ,Proliferative diabetic retinopathy,Diseases of the nervous system,2600,6,1.74,0.1670651089,0.64,3.81
733.09 ,Other osteoporosis,Diseases of the musculoskeletal...,2610,6,1.74,0.1683675561,0.64,3.79
786.50 ,"Chest pain, unspecified","Comorbidities, signs, and ill-defined...",63356,141,1.73,0.0000000056166443,1.44,2.05
535.40 ,"Other specified gastritis, without...",Diseases of the digestive system,36307,82,1.73,0.0000073437211,1.37,2.16
379.91 ,Pain in or around eye,Diseases of the nervous system,4368,10,1.73,0.0906297847,0.83,3.19
611.7 ,Signs and symptoms in breast,Diseases of the genitourinary...,4810,11,1.73,0.072385828,0.86,3.1
280 ,Iron deficiency anemias,Diseases of the blood and blood-forming...,8734,20,1.73,0.0250139668,1.06,2.69
614.3 ,Acute parametritis and pelvic...,Diseases of the genitourinary...,18488,42,1.73,0.0010465431,1.24,2.35
306.0 ,Musculoskeletal malfunction arising...,Mental disorders,2626,6,1.73,0.1704841065,0.63,3.77
465.8 ,Acute upper respiratory infections...,Diseases of the respiratory system,143377,309,1.73,5.69871e-17,1.53,1.95
726.6 ,Enthesopathy of knee,Diseases of the musculoskeletal...,3924,9,1.73,0.1157835277,0.79,3.3
625.4 ,Premenstrual tension syndromes,Diseases of the genitourinary...,5686,13,1.73,0.0632580779,0.92,2.97
727.03 ,Trigger finger (acquired),Diseases of the musculoskeletal...,13132,30,1.73,0.0051642824,1.17,2.48
728.89 ,"Other disorders of muscle, ligament,...",Diseases of the musculoskeletal...,18446,42,1.73,0.0010250299,1.24,2.35
239.0 ,Neoplasm of unspecified nature...,Neoplasms,3507,8,1.72,0.1529403949,0.74,3.41
716.80 ,"Other specified arthropathy, site...",Diseases of the musculoskeletal...,2639,6,1.72,0.1722330367,0.63,3.75
464 ,Acute laryngitis and tracheitis,Diseases of the respiratory system,46430,104,1.72,0.00000052137862,1.4,2.1
478.4 ,Polyp of vocal cord or larynx,Diseases of the respiratory system,10122,23,1.72,0.0132255159,1.09,2.59
353.2 ,"Cervical root lesions, not elsewhere...",Diseases of the nervous system,15911,36,1.72,0.0028341139,1.2,2.39
216.3 ,Benign neoplasm of skin of other...,Neoplasms,7520,17,1.71,0.0365058677,0.99,2.75
715 ,Osteoarthrosis and allied disorders,Diseases of the musculoskeletal...,19099,43,1.71,0.0012377344,1.24,2.32
717.9 ,Unspecified internal derangement...,Diseases of the musculoskeletal...,5321,12,1.71,0.0837334299,0.88,2.99
428.0 ,"Congestive heart failure, unspecified",Diseases of the circulatory system,7991,18,1.71,0.0298494451,1.01,2.7
780.4 ,Dizziness and giddiness,"Comorbidities, signs, and ill-defined...",309915,618,1.71,5.34657e-27,1.55,1.87
696.1 ,Other psoriasis,Diseases of the skin and subcutaneous...,5339,12,1.7,0.0843473239,0.88,2.98
493.21 ,Chronic obstructive asthma with...,Diseases of the respiratory system,2225,5,1.7,0.2285003827,0.55,3.97
583 ,"Nephritis and nephropathy, not...",Diseases of the genitourinary...,4478,10,1.69,0.0975795619,0.81,3.11
625.6 ,"Stress incontinence, female",Diseases of the genitourinary...,15685,35,1.69,0.0038283882,1.18,2.37
727.06 ,Tenosynovitis of foot and ankle,Diseases of the musculoskeletal...,5372,12,1.69,0.0855339298,0.87,2.96
011.90 ,"Pulmonary tuberculosis, unspecified,...",Infectious and parasitic diseases,4471,10,1.69,0.0971068675,0.81,3.12
692.1 ,Contact dermatitis and other eczema...,Diseases of the skin and subcutaneous...,4032,9,1.69,0.1228346783,0.77,3.21
782.3 ,Edema,"Comorbidities, signs, and ill-defined...",44045,97,1.69,0.0000028922565,1.37,2.08
535 ,Gastritis and duodenitis,Diseases of the digestive system,37416,82,1.68,0.0000195819,1.33,2.09
845.09 ,Other sprains and strains of ankle,Injury and poisoning,8585,19,1.68,0.0350683912,1.01,2.62
241 ,Nontoxic nodular goiter,"Endocrine, nutritional and metabolic...",2243,5,1.68,0.2312353043,0.55,3.94
847.2 ,Sprain of lumbar,Injury and poisoning,48909,107,1.68,0.0000010140421,1.37,2.05
300.00 ,"Anxiety state, unspecified",Mental disorders,119772,254,1.68,0.0000000000003839856,1.47,1.92
726.11 ,Calcifying tendinitis of shoulder,Diseases of the musculoskeletal...,4936,11,1.68,0.1103587318,0.84,3.02
726.8 ,Other peripheral enthesopathies,Diseases of the musculoskeletal...,4958,11,1.68,0.1111533516,0.84,3.01
681.11 ,Onychia and paronychia of toe,Diseases of the skin and subcutaneous...,10346,23,1.68,0.0198093783,1.07,2.54
995.3 ,"Allergy, unspecified, not elsewhere...",Injury and poisoning,19472,43,1.68,0.0019562152,1.21,2.27
070.3 ,Viral hepatitis B without mention...,Infectious and parasitic diseases,4073,9,1.67,0.1258367028,0.76,3.18
372.05 ,Acute atopic conjunctivitis,Diseases of the nervous system,3171,7,1.67,0.2101946219,0.67,3.45
843.9 ,Sprains and strains of unspecified...,Injury and poisoning,8166,18,1.67,0.0446402789,0.99,2.65
616.2 ,Cyst of Bartholin's gland,Diseases of the genitourinary...,5875,13,1.67,0.0699038677,0.89,2.87
476.1 ,Chronic laryngotracheitis,Diseases of the respiratory system,2720,6,1.67,0.1837011203,0.61,3.64
780.0 ,Alteration of consciousness,"Comorbidities, signs, and ill-defined...",1807,4,1.67,0.311245555,0.45,4.29
531 ,Gastric ulcer,Diseases of the digestive system,11395,25,1.66,0.0187586027,1.07,2.46
785.1 ,Palpitations,"Comorbidities, signs, and ill-defined...",56390,121,1.66,0.00000048247348,1.37,1.99
372.51 ,Pinguecula,Diseases of the nervous system,1821,4,1.66,0.3134651898,0.45,4.26
372.71 ,Hyperemia of conjunctiva,Diseases of the nervous system,3186,7,1.66,0.2112502348,0.67,3.43
380.22 ,Other acute otitis externa,Diseases of the nervous system,22919,50,1.66,0.0009189229,1.23,2.2
844.0 ,Sprain of lateral collateral ligament...,Injury and poisoning,2729,6,1.66,0.1850341474,0.61,3.62
306.2 ,Cardiovascular malfunction arising...,Mental disorders,5471,12,1.66,0.0895639738,0.86,2.91
623.8 ,Other specified noninflammatory...,Diseases of the genitourinary...,2271,5,1.66,0.2356122366,0.54,3.89
729.8 ,Other musculoskeletal symptoms...,Diseases of the musculoskeletal...,2737,6,1.66,0.1862286229,0.61,3.61
532.90 ,"Duodenal ulcer, unspecified as...",Diseases of the digestive system,24957,54,1.65,0.0007931476,1.23,2.16
786.5 ,Chest pain,"Comorbidities, signs, and ill-defined...",34714,75,1.65,0.0000697642,1.29,2.08
373.00 ,"Blepharitis, unspecified",Diseases of the nervous system,21672,47,1.65,0.0013342319,1.21,2.2
573.8 ,Other specified disorders of liver,Diseases of the digestive system,5026,11,1.65,0.113884359,0.82,2.97
455.9 ,Residual hemorrhoidal skin tags,Diseases of the circulatory system,3209,7,1.65,0.2129424393,0.66,3.4
296.2 ,"Major depressive disorder, single...",Mental disorders,4568,10,1.65,0.1466716167,0.79,3.05
371.89 ,Other corneal disorders,Diseases of the nervous system,2756,6,1.64,0.1891011449,0.6,3.59
698.2 ,Prurigo,Diseases of the skin and subcutaneous...,76759,162,1.64,0.000000014365905,1.39,1.93
216.4 ,Benign neoplasm of scalp and skin...,Neoplasms,2761,6,1.64,0.1898653203,0.6,3.58
839.8 ,"Closed dislocation, multiple and...",Injury and poisoning,5538,12,1.64,0.0926864872,0.84,2.87
571.8 ,Other chronic nonalcoholic liver...,Diseases of the digestive system,12913,28,1.64,0.0142488955,1.09,2.38
250.40 ,"Diabetes with renal manifestations,...","Endocrine, nutritional and metabolic...",5995,13,1.64,0.0751913993,0.87,2.81
719.40 ,"Pain in joint, site unspecified",Diseases of the musculoskeletal...,70235,149,1.64,0.000000040874179,1.38,1.94
362.10 ,"Background retinopathy, unspecified",Diseases of the nervous system,2758,6,1.64,0.1894064055,0.6,3.59
367.2 ,Astigmatism,Diseases of the nervous system,1840,4,1.64,0.3165547534,0.45,4.22
386.10 ,"Peripheral vertigo, unspecified",Diseases of the nervous system,16798,36,1.63,0.0072232573,1.14,2.26
845.0 ,Sprains and strains of ankle,Injury and poisoning,3700,8,1.63,0.1669836983,0.7,3.23
847.0 ,Sprain of neck,Injury and poisoning,35619,76,1.63,0.0000870874,1.28,2.05
715.90 ,"Osteoarthrosis, unspecified whether...",Diseases of the musculoskeletal...,71478,150,1.63,0.000000071467305,1.37,1.92
455.0 ,Internal hemorrhoids without mention...,Diseases of the circulatory system,8356,18,1.63,0.0478272383,0.96,2.58
723.1 ,Cervicalgia,Diseases of the musculoskeletal...,50459,107,1.63,0.0000038134214,1.33,1.98
353.1 ,Lumbosacral plexus lesions,Diseases of the nervous system,3239,7,1.63,0.2152814046,0.66,3.37
486 ,"Pneumonia, organism unspecified",Diseases of the respiratory system,23752,51,1.63,0.0011381677,1.21,2.16
786.3 ,Hemoptysis,"Comorbidities, signs, and ill-defined...",6990,15,1.62,0.0677636572,0.91,2.69
536 ,Disorders of function of stomach,Diseases of the digestive system,28653,61,1.62,0.0005350986,1.24,2.09
211.5 ,Benign neoplasm of liver and biliary...,Neoplasms,5139,11,1.62,0.1193237038,0.81,2.9
379.93 ,Redness or discharge of eye,Diseases of the nervous system,1862,4,1.62,0.3202396603,0.44,4.17
571 ,Chronic liver disease and cirrhosis,Diseases of the digestive system,9788,21,1.62,0.0349324052,1,2.49
250.4 ,Diabetes with renal manifestations,"Endocrine, nutritional and metabolic...",1867,4,1.62,0.3210927921,0.44,4.15
614.1 ,Chronic salpingitis and oophoritis,Diseases of the genitourinary...,2329,5,1.62,0.245132234,0.53,3.79
