531.9 ,"Gastric ulcer, unspecified as...",Diseases of the digestive system,2406,7,1.94,0.1016608453,0.78,4
788.4 ,Frequency of urination and polyuria,"Comorbidities, signs, and ill-defined...",25273,73,1.94,0.00000031136938,1.52,2.45
610.0 ,Solitary cyst of breast,Diseases of the genitourinary...,3083,9,1.94,0.0566896303,0.89,3.7
737.43 ,Scoliosis associated with other...,Diseases of the musculoskeletal...,2067,6,1.93,0.1399021368,0.71,4.22
353.9 ,Unspecified nerve root and plexus...,Diseases of the nervous system,2071,6,1.93,0.1402910256,0.71,4.21
389.9 ,Unspecified hearing loss,Diseases of the nervous system,5168,15,1.93,0.0173597442,1.08,3.2
216.6 ,Benign neoplasm of skin of upper...,Neoplasms,3469,10,1.92,0.0459257653,0.92,3.54
628.2 ,"Infertility, female, of tubal...",Diseases of the genitourinary...,6940,20,1.92,0.0072999939,1.17,2.98
780.2 ,Syncope and collapse,"Comorbidities, signs, and ill-defined...",11843,34,1.92,0.0004943285,1.33,2.69
794.8 ,Nonspecific abnormal results of...,"Comorbidities, signs, and ill-defined...",7299,21,1.92,0.0057452599,1.18,2.94
805.6 ,Closed fracture of sacrum and...,Injury and poisoning,3113,9,1.92,0.0586375751,0.88,3.66
720.0 ,Ankylosing spondylitis,Diseases of the musculoskeletal...,3835,11,1.91,0.0547033098,0.95,3.43
244.9 ,Unspecified acquired hypothyroidism,"Endocrine, nutritional and metabolic...",7349,21,1.91,0.0060250706,1.18,2.92
727.89 ,"Other disorders of synovium, tendon,...",Diseases of the musculoskeletal...,2433,7,1.91,0.1040651404,0.77,3.95
596.5 ,Other functional disorders of...,Diseases of the genitourinary...,5942,17,1.91,0.0168223608,1.11,3.06
427.9 ,"Cardiac dysrhythmia, unspecified",Diseases of the circulatory system,21946,62,1.9,0.000006200777,1.45,2.44
723.1 ,Cervicalgia,Diseases of the musculoskeletal...,16569,47,1.9,0.0000703589,1.39,2.54
491.8 ,Other chronic bronchitis,Diseases of the respiratory system,2808,8,1.9,0.0803068576,0.82,3.75
531.90 ,"Gastric ulcer, unspecified as...",Diseases of the digestive system,15515,44,1.9,0.0001028911,1.38,2.56
911.0 ,"Abrasion or friction burn of trunk,...",Injury and poisoning,4201,12,1.9,0.0413161926,0.98,3.33
693.0 ,Dermatitis due to drugs and medicines...,Diseases of the skin and subcutaneous...,9486,27,1.9,0.0020440005,1.25,2.77
590.80 ,"Pyelonephritis, unspecified",Diseases of the genitourinary...,4211,12,1.9,0.0415889895,0.98,3.32
704.9 ,Unspecified disease of hair and...,Diseases of the skin and subcutaneous...,2814,8,1.89,0.0808111229,0.81,3.74
533.90 ,"Peptic ulcer of unspecified site,...",Diseases of the digestive system,76708,209,1.88,0.000000000000001026347,1.62,2.16
401.9 ,Unspecified essential hypertension,Diseases of the circulatory system,8149,23,1.88,0.0056962416,1.19,2.83
349.9 ,Unspecified disorders of nervous...,Diseases of the nervous system,9270,26,1.87,0.0029251057,1.22,2.75
722.73 ,Intervertebral disc disorder with...,Diseases of the musculoskeletal...,2858,8,1.86,0.0846592105,0.8,3.68
798.0 ,Sudden infant death syndrome,"Comorbidities, signs, and ill-defined...",3586,10,1.86,0.0772835705,0.89,3.42
931 ,Foreign body in ear,Injury and poisoning,6452,18,1.86,0.0143055362,1.1,2.95
474.0 ,Chronic tonsillitis,Diseases of the respiratory system,9381,26,1.85,0.0044523015,1.21,2.72
296 ,Disorganized type,Mental disorders,3606,10,1.85,0.0780427858,0.88,3.4
535.5 ,Unspecified gastritis & gastroduodenitis,Diseases of the digestive system,26480,73,1.85,0.0000019459687,1.45,2.34
582.9 ,Chronic glomerulonephritis with...,Diseases of the genitourinary...,5766,16,1.85,0.0242646174,1.05,3.01
692.4 ,Contact dermatitis and other eczema...,Diseases of the skin and subcutaneous...,36677,100,1.84,0.000000039357786,1.49,2.25
493.00 ,"Extrinsic asthma, unspecified",Diseases of the respiratory system,4744,13,1.82,0.0372033982,0.97,3.13
643.9 ,Unspecified vomiting of pregnancy,"Complications of pregnancy, childbirth,...",5116,14,1.82,0.0431378586,0.99,3.07
524.6 ,Temporomandibular joint disorders,Diseases of the digestive system,2202,6,1.81,0.1551554929,0.66,3.96
537.9 ,Unspecified disorder of stomach...,Diseases of the digestive system,4049,11,1.81,0.0624411856,0.9,3.24
686.0 ,Pyoderma,Diseases of the skin and subcutaneous...,20035,54,1.81,0.0000707525,1.35,2.37
300.00 ,"Anxiety state, unspecified",Mental disorders,53554,142,1.8,0.0000000003483824,1.51,2.14
532.90 ,"Duodenal ulcer, unspecified as...",Diseases of the digestive system,11470,31,1.8,0.0023080973,1.22,2.57
681.11 ,Onychia and paronychia of toe,Diseases of the skin and subcutaneous...,12610,34,1.8,0.0016497303,1.24,2.52
592.1 ,Calculus of ureter,Diseases of the genitourinary...,7790,21,1.8,0.0118463389,1.11,2.75
373.13 ,Abscess of eyelid,Diseases of the nervous system,16709,45,1.8,0.0002763916,1.31,2.42
989.5 ,Toxic effect of venom,Injury and poisoning,8509,23,1.8,0.0105517613,1.14,2.71
724.5 ,"Backache, unspecified",Diseases of the musculoskeletal...,87984,228,1.79,0.000000000000007837041,1.55,2.05
854 ,Intracranial injury of other and...,Injury and poisoning,3338,9,1.79,0.1089780975,0.82,3.41
307.40 ,"Nonorganic sleep disorder, unspecified",Mental disorders,3346,9,1.79,0.1093881769,0.82,3.41
564.1 ,Irritable bowel syndrome,Diseases of the digestive system,67940,178,1.79,0.000000000003453175,1.53,2.09
574.20 ,Calculus of gallbladder without...,Diseases of the digestive system,6709,18,1.79,0.0249043779,1.06,2.83
242.90 ,Thyrotoxicosis without mention...,"Endocrine, nutritional and metabolic...",24474,65,1.78,0.0000201046,1.37,2.28
528.2 ,Oral aphthae,Diseases of the digestive system,22206,59,1.78,0.0000529486,1.35,2.31
306.9 ,Unspecified psychophysiological...,Mental disorders,13855,37,1.78,0.0012624686,1.25,2.47
621.4 ,Hematometra,Diseases of the genitourinary...,3007,8,1.77,0.0996119523,0.76,3.5
259.9 ,Unspecified endocrine disorder,"Endocrine, nutritional and metabolic...",9813,26,1.77,0.0082098717,1.15,2.6
486 ,"Pneumonia, organism unspecified",Diseases of the respiratory system,22399,59,1.77,0.000059569,1.34,2.29
569.9 ,Unspecified disorder of intestine,Diseases of the digestive system,7900,21,1.77,0.0129198377,1.09,2.72
610 ,Benign mammary dysplasias,Diseases of the genitourinary...,4878,13,1.77,0.0596560296,0.94,3.04
533.10 ,Acute peptic ulcer of unspecified...,Diseases of the digestive system,1888,5,1.76,0.2171495058,0.57,4.12
353.4 ,"Lumbosacral root lesions, not...",Diseases of the nervous system,2271,6,1.76,0.1645489596,0.64,3.83
560.1 ,Paralytic ileus,Diseases of the digestive system,4160,11,1.76,0.0680847126,0.88,3.16
681.9 ,Cellulitis and abscess of unspecified...,Diseases of the skin and subcutaneous...,11726,31,1.76,0.0037264041,1.2,2.51
692.71 ,Sunburn,Diseases of the skin and subcutaneous...,1892,5,1.76,0.2177595344,0.57,4.11
709.2 ,Scar conditions and fibrosis of...,Diseases of the skin and subcutaneous...,10628,28,1.76,0.0053561015,1.17,2.55
070.30 ,Viral hepatitis B without mention...,Infectious and parasitic diseases,26001,68,1.76,0.0000239307,1.36,2.24
780 ,General symptoms,"Comorbidities, signs, and ill-defined...",4553,12,1.75,0.0551674543,0.9,3.07
848 ,Other and ill-defined sprains...,Injury and poisoning,1894,5,1.75,0.2180662141,0.57,4.11
681.02 ,Onychia and paronychia of finger,Diseases of the skin and subcutaneous...,4932,13,1.75,0.0610686132,0.93,3.01
370.33 ,"Keratoconjunctivitis sicca, not...",Diseases of the nervous system,2665,7,1.75,0.1300159728,0.7,3.61
373.02 ,Squamous blepharitis,Diseases of the nervous system,1894,5,1.75,0.2180662141,0.57,4.11
721.90 ,"Spondylosis of unspecified site,...",Diseases of the musculoskeletal...,4964,13,1.74,0.0620105171,0.93,2.99
300.4 ,Dysthymic disorder,Mental disorders,30179,78,1.74,0.0000085822853,1.37,2.18
531.70 ,Chronic gastric ulcer without...,Diseases of the digestive system,4963,13,1.74,0.0619799055,0.93,2.99
535.40 ,"Other specified gastritis, without...",Diseases of the digestive system,31323,81,1.74,0.0000061936039,1.38,2.17
923.10 ,Contusion of forearm,Injury and poisoning,3063,8,1.74,0.1514249582,0.75,3.43
923.3 ,Contusion of finger,Injury and poisoning,3447,9,1.74,0.1153734487,0.79,3.31
380.22 ,Other acute otitis externa,Diseases of the nervous system,25437,66,1.74,0.0000403357,1.34,2.22
722 ,Intervertebral disc disorders,Diseases of the musculoskeletal...,3071,8,1.73,0.1519380601,0.75,3.42
573.9 ,Unspecified disorder of liver,Diseases of the digestive system,6912,18,1.73,0.0276282687,1.03,2.75
933.0 ,Foreign body in pharynx,Injury and poisoning,11601,30,1.73,0.0053228192,1.16,2.47
117.9 ,Other and unspecified mycoses,Infectious and parasitic diseases,9673,25,1.72,0.0115282694,1.11,2.55
721.3 ,Lumbosacral spondylosis without...,Diseases of the musculoskeletal...,15128,39,1.72,0.0015082809,1.22,2.36
250.00 ,Diabetes mellitus without mention...,"Endocrine, nutritional and metabolic...",15584,40,1.72,0.0016835512,1.22,2.34
728 ,"Disorders of muscle, ligament,...",Diseases of the musculoskeletal...,8914,23,1.72,0.0133198705,1.09,2.59
491 ,Chronic bronchitis,Diseases of the respiratory system,5791,15,1.72,0.0406155235,0.96,2.85
530.1 ,Esophagitis,Diseases of the digestive system,23411,60,1.72,0.0001198022,1.31,2.22
850.1 ,Concussion with brief loss of...,Injury and poisoning,1932,5,1.72,0.2240998876,0.56,4.03
009.1 ,"Colitis, enteritis, and gastroenteritis...",Infectious and parasitic diseases,32499,83,1.72,0.0000066139913,1.36,2.14
614.6 ,"Pelvic peritoneal adhesions, female...",Diseases of the genitourinary...,6986,18,1.72,0.0289592569,1.01,2.72
477.8 ,Allergic rhinitis due to other...,Diseases of the respiratory system,12084,31,1.71,0.0062327503,1.16,2.44
786.01 ,Hyperventilation,"Comorbidities, signs, and ill-defined...",7809,20,1.71,0.0262896763,1.04,2.64
891 ,"Open wound of knee, leg (except...",Injury and poisoning,6618,17,1.71,0.0365517069,0.99,2.75
256.4 ,Polycystic ovaries,"Endocrine, nutritional and metabolic...",24490,62,1.7,0.0001227945,1.3,2.18
729.2 ,"Neuralgia, neuritis, and radiculitis,...",Diseases of the musculoskeletal...,33305,84,1.7,0.0000087424545,1.35,2.11
362.63 ,Lattice degeneration,Diseases of the nervous system,3907,10,1.7,0.0950400378,0.81,3.14
454.9 ,Asymptomatic varicose veins,Diseases of the circulatory system,1963,5,1.69,0.2293036005,0.55,3.96
623.8 ,Other specified noninflammatory...,Diseases of the genitourinary...,3540,9,1.69,0.1221717236,0.77,3.22
727 ,"Other disorders of synovium tendon,...",Diseases of the musculoskeletal...,5109,13,1.69,0.0672479783,0.9,2.9
256 ,Hyperestrogenism,"Endocrine, nutritional and metabolic...",1968,5,1.69,0.2301657753,0.55,3.95
478.6 ,Edema of larynx,Diseases of the respiratory system,3929,10,1.69,0.0966797911,0.81,3.12
493.90 ,"Asthma, unspecified type, unspecified",Diseases of the respiratory system,36997,93,1.69,0.0000035483008,1.36,2.08
306.8 ,Other specified psychophysiological...,Mental disorders,4333,11,1.69,0.1099738734,0.84,3.03
560.9 ,Unspecified intestinal obstruction,Diseases of the digestive system,4723,12,1.69,0.085378054,0.87,2.96
381.00 ,"Acute nonsuppurative otitis media,...",Diseases of the nervous system,5526,14,1.69,0.0550721074,0.92,2.84
617.1 ,Endometriosis of ovary,Diseases of the genitourinary...,9537,24,1.68,0.0163690297,1.07,2.5
137.0 ,Late effects of respiratory or...,Infectious and parasitic diseases,2379,6,1.68,0.1812166374,0.61,3.66
524.60 ,"Temporomandibular joint disorders,...",Diseases of the digestive system,4358,11,1.68,0.1109746824,0.84,3.01
371.89 ,Other corneal disorders,Diseases of the nervous system,3175,8,1.68,0.1596572737,0.72,3.31
573.3 ,"Hepatitis, unspecified",Diseases of the digestive system,14702,37,1.68,0.0036219741,1.18,2.32
692.81 ,Dermatitis due to cosmetics,Diseases of the skin and subcutaneous...,3963,10,1.68,0.0993168913,0.8,3.09
590.1 ,Acute pyelonephritis,Diseases of the genitourinary...,4748,12,1.68,0.0864505736,0.87,2.95
380.23 ,Other chronic otitis externa,Diseases of the nervous system,3563,9,1.68,0.1240373631,0.77,3.2
388.8 ,Other disorders of ear,Diseases of the nervous system,3172,8,1.68,0.1594079146,0.72,3.31
571.49 ,Other chronic hepatitis,Diseases of the digestive system,7165,18,1.67,0.0443874707,0.99,2.65
372.02 ,Acute follicular conjunctivitis,Diseases of the nervous system,10378,26,1.67,0.0148296785,1.09,2.45
578.9 ,Hemorrhage of gastrointestinal...,Diseases of the digestive system,8391,21,1.67,0.0323030587,1.03,2.56
455.2 ,Internal hemorrhoids with other...,Diseases of the circulatory system,6821,17,1.66,0.041561463,0.96,2.66
272.2 ,Mixed hyperlipidemia,"Endocrine, nutritional and metabolic...",7612,19,1.66,0.0360672281,1,2.6
300.9 ,Unspecified nonpsychotic mental...,Mental disorders,30740,76,1.66,0.00005509,1.3,2.09
786.50 ,"Chest pain, unspecified","Comorbidities, signs, and ill-defined...",41375,102,1.66,0.0000025427112,1.35,2.03
919.0 ,"Abrasion or friction burn of other,...",Injury and poisoning,23043,57,1.66,0.0004200293,1.25,2.15
592.0 ,Calculus of kidney,Diseases of the genitourinary...,12056,30,1.66,0.0090313756,1.12,2.38
226 ,Benign neoplasm of thyroid glands,Neoplasms,3619,9,1.65,0.1288774429,0.75,3.15
784.2 ,"Swelling, mass, or lump in head...","Comorbidities, signs, and ill-defined...",8477,21,1.65,0.0331609858,1.02,2.53
300.02 ,Generalized anxiety disorder,Mental disorders,8501,21,1.65,0.0334413007,1.02,2.52
373.33 ,Xeroderma of eyelid,Diseases of the nervous system,2414,6,1.65,0.1870964027,0.61,3.61
008.5 ,"Bacterial enteritis, unspecified",Infectious and parasitic diseases,6461,16,1.65,0.0521780818,0.94,2.68
240.0 ,"Goiter, specified as simple","Endocrine, nutritional and metabolic...",4862,12,1.64,0.0920723829,0.85,2.88
881.02 ,"Open wound of wrist, without mention...",Injury and poisoning,4065,10,1.64,0.1487565426,0.78,3.02
924.4 ,Contusion of multiple sites of...,Injury and poisoning,5266,13,1.64,0.0746887832,0.87,2.82
595.89 ,Other specified types of cystitis,Diseases of the genitourinary...,2022,5,1.64,0.239864519,0.53,3.85
386 ,Vertiginous syndromes and other...,Diseases of the nervous system,7300,18,1.64,0.0467338531,0.97,2.6
054.2 ,Herpetic gingivostomatitis,Infectious and parasitic diseases,4466,11,1.64,0.1161286734,0.82,2.94
402.90 ,Unspecified hypertensive heart...,Diseases of the circulatory system,2435,6,1.64,0.1907300557,0.6,3.57
625.2 ,Mittelschmerz,Diseases of the genitourinary...,4893,12,1.63,0.0938059107,0.84,2.86
625.3 ,Dysmenorrhea,Diseases of the genitourinary...,114657,271,1.63,0.000000000000614593,1.44,1.85
491.9 ,Unspecified chronic bronchitis,Diseases of the respiratory system,22636,55,1.63,0.0007389154,1.22,2.12
372.13 ,Vernal conjunctivitis,Diseases of the nervous system,6936,17,1.63,0.0593767316,0.95,2.62
427.0 ,Paroxysmal supraventricular tachycardia,Diseases of the circulatory system,2870,7,1.62,0.2171062302,0.65,3.35
253.4 ,Other anterior pituitary disorders,"Endocrine, nutritional and metabolic...",3689,9,1.62,0.1355068358,0.74,3.09
728.85 ,Spasm of muscle,Diseases of the musculoskeletal...,9062,22,1.62,0.0293076483,1.01,2.46
523.9 ,Unspecified gingival and periodontal...,Diseases of the digestive system,4937,12,1.62,0.0964145806,0.83,2.83
528.0 ,Stomatitis,Diseases of the digestive system,23529,57,1.62,0.0006709772,1.22,2.11
349.89 ,Other specified disorders of nervous...,Diseases of the nervous system,2054,5,1.62,0.2459313646,0.52,3.79
367.9 ,Unspecified disorder of refraction...,Diseases of the nervous system,29421,71,1.62,0.0001864617,1.26,2.05
373.00 ,"Blepharitis, unspecified",Diseases of the nervous system,29409,71,1.62,0.000185765,1.26,2.05
070.51 ,Acute hepatitis C without mention...,Infectious and parasitic diseases,3280,8,1.62,0.169340543,0.7,3.2
272.4 ,Other and unspecified hyperlipidemia,"Endocrine, nutritional and metabolic...",15349,37,1.61,0.0063161629,1.13,2.23
912.0 ,Abrasion or friction burn of shoulder...,Injury and poisoning,3308,8,1.61,0.1722272706,0.69,3.18
682 ,Other cellulitis and abscess,Diseases of the skin and subcutaneous...,5783,14,1.61,0.0856629285,0.88,2.71
690 ,Erythematosquamous dermatosis,Diseases of the skin and subcutaneous...,32907,79,1.61,0.0000974333,1.27,2.02
374.05 ,Trichiasis of eyelid without entropion,Diseases of the nervous system,12036,29,1.61,0.0173528177,1.07,2.31
379.91 ,Pain in or around eye,Diseases of the nervous system,3303,8,1.61,0.1717026522,0.69,3.18
610.1 ,Diffuse cystic mastopathy,Diseases of the genitourinary...,14492,35,1.61,0.0092720028,1.12,2.25
757.39 ,Other specified anomalies of skin,Congenital anomalies,5406,13,1.6,0.1087627907,0.85,2.74
648.8 ,Abnormal glucose tolerance of...,"Complications of pregnancy, childbirth,...",2498,6,1.6,0.2890848939,0.58,3.48
884.0 ,Multiple and unspecified open...,Injury and poisoning,36118,86,1.6,0.0000639705,1.28,1.98
379.24 ,Other vitreous opacities,Diseases of the nervous system,17087,41,1.6,0.005180014,1.15,2.18
465.9 ,Acute upper respiratory infections...,Diseases of the respiratory system,1408969,2302,1.59,8.669165e-19,1.43,1.78
353.2 ,"Cervical root lesions, not elsewhere...",Diseases of the nervous system,3760,9,1.59,0.1981883061,0.73,3.03
924.01 ,Contusion of hip,Injury and poisoning,6289,15,1.59,0.0990882498,0.89,2.62
927.3 ,Crushing injury of finger(s),Injury and poisoning,3351,8,1.59,0.1769001425,0.68,3.14
704.8 ,Other specified diseases of hair...,Diseases of the skin and subcutaneous...,48949,115,1.59,0.0000063746088,1.3,1.91
710.2 ,Sicca syndrome,Diseases of the musculoskeletal...,5007,12,1.59,0.1009189242,0.82,2.79
490 ,"Bronchitis, not specified as acute...",Diseases of the respiratory system,43827,103,1.58,0.000020263,1.29,1.93
367 ,"Infantile, juvenile, and presenile...",Diseases of the nervous system,4209,10,1.58,0.1571846995,0.76,2.91
569.3 ,Hemorrhage of rectum and anus,Diseases of the digestive system,4644,11,1.58,0.1274664012,0.78,2.83
585 ,Chronic renal failure,Diseases of the genitourinary...,2938,7,1.58,0.2240575287,0.64,3.27
379.21 ,Vitreous degeneration,Diseases of the nervous system,6335,15,1.58,0.1002597179,0.88,2.61
008.6 ,"Virus Enteritis, specified",Infectious and parasitic diseases,3784,9,1.58,0.199530665,0.72,3.01
475 ,Peritonsillar abscess,Diseases of the respiratory system,18718,44,1.57,0.0056819184,1.14,2.11
300.0 ,Anxiety states,Mental disorders,23444,55,1.57,0.0016573254,1.18,2.05
532.70 ,Chronic duodenal ulcer without...,Diseases of the digestive system,7655,18,1.57,0.0732005642,0.93,2.48
536.8 ,Dyspepsia and other specified...,Diseases of the digestive system,123064,280,1.57,0.0000000000166687,1.38,1.78
923.11 ,Contusion of elbow,Injury and poisoning,6363,15,1.57,0.1010537643,0.88,2.59
597.80 ,"Urethritis, unspecified",Diseases of the genitourinary...,24356,57,1.57,0.0015037405,1.18,2.04
706.8 ,Other specified diseases of sebaceous...,Diseases of the skin and subcutaneous...,4671,11,1.57,0.129484018,0.78,2.81
455.5 ,External hemorrhoids with other...,Diseases of the circulatory system,2562,6,1.56,0.2952884243,0.57,3.4
461.8 ,Other acute sinusitis,Diseases of the respiratory system,32652,76,1.56,0.0002998838,1.23,1.96
477.9 ,"Allergic rhinitis, cause unspecified",Diseases of the respiratory system,202709,448,1.56,2.736817e-16,1.41,1.73
269.2 ,Unspecified vitamin deficiency,"Endocrine, nutritional and metabolic...",2564,6,1.56,0.2954983635,0.57,3.39
873.4 ,"Facial laceration, without mention...",Injury and poisoning,8551,20,1.56,0.0664972535,0.95,2.41
574 ,Cholelithiasis,Diseases of the digestive system,2132,5,1.56,0.2616322409,0.51,3.65
923.03 ,Contusion of upper arm,Injury and poisoning,2132,5,1.56,0.2616322409,0.51,3.65
250.0 ,Diabetes Mellitus w/m of complication,"Endocrine, nutritional and metabolic...",4286,10,1.55,0.1628264112,0.74,2.86
780.4 ,Dizziness and giddiness,"Comorbidities, signs, and ill-defined...",193042,426,1.55,0.00000000000000230733,1.4,1.72
535.10 ,"Atrophic gastritis, without mention...",Diseases of the digestive system,2576,6,1.55,0.2967778888,0.57,3.38
367.89 ,Other disorders of refraction...,Diseases of the nervous system,6864,16,1.55,0.0843790743,0.88,2.53
920 ,"Contusion of face, scalp, and...",Injury and poisoning,31239,72,1.55,0.0006675697,1.2,1.95
611.72 ,Lump or mass in breast,Diseases of the genitourinary...,32545,75,1.55,0.0005020151,1.21,1.94
381.81 ,Dysfunction of Eustachian tube,Diseases of the nervous system,22014,51,1.55,0.0037029219,1.15,2.04
709 ,Other disorders of skin and subcutaneous...,Diseases of the skin and subcutaneous...,5579,13,1.55,0.1168134926,0.82,2.66
386.00 ,"Minihre's disease, unspecified",Diseases of the nervous system,11168,26,1.55,0.0358976156,1.01,2.28
386.2 ,Vertigo of central origin,Diseases of the nervous system,4720,11,1.55,0.133339653,0.77,2.78
455.0 ,Internal hemorrhoids without mention...,Diseases of the circulatory system,7328,17,1.54,0.0932213385,0.9,2.48
308.0 ,Predominant disturbance of emotions,Mental disorders,2581,6,1.54,0.2973210171,0.57,3.37
533.70 ,Chronic peptic ulcer of unspecified...,Diseases of the digestive system,11646,27,1.54,0.0301252046,1.02,2.25
700 ,Corns and callosities,Diseases of the skin and subcutaneous...,10387,24,1.54,0.0413554786,0.98,2.3
617.9 ,"Endometriosis, site unspecified",Diseases of the genitourinary...,19606,45,1.53,0.0069653134,1.11,2.06
464.11 ,Acute tracheitis with obstruction,Diseases of the respiratory system,12608,29,1.53,0.0277478718,1.02,2.21
246 ,Other disorders of thyroid,"Endocrine, nutritional and metabolic...",4775,11,1.53,0.1842873936,0.76,2.75
533.40 ,Chronic or unspecified peptic...,Diseases of the digestive system,5200,12,1.53,0.1470153356,0.79,2.69
346.9 ,"Migraine, unspecified",Diseases of the nervous system,25782,59,1.53,0.0020496393,1.16,1.98
536.9 ,Unspecified functional disorder...,Diseases of the digestive system,254539,544,1.53,3.736143e-17,1.39,1.68
372.3 ,Other and unspecified conjunctivitis,Diseases of the nervous system,13053,30,1.53,0.0301647141,1.03,2.19
599.7 ,Hematuria,Diseases of the genitourinary...,22652,52,1.53,0.0042214458,1.14,2.02
611 ,Other disorders of breast,Diseases of the genitourinary...,5646,13,1.53,0.1206530414,0.81,2.63
473.9 ,Unspecified sinusitis (chronic),Diseases of the respiratory system,33525,76,1.52,0.0006222646,1.19,1.91
564.8 ,Other specified function disorder...,Diseases of the digestive system,31207,71,1.52,0.0008826689,1.19,1.93
382.9 ,Unspecified otitis media,Diseases of the nervous system,40249,91,1.52,0.0002018545,1.22,1.87
424.0 ,Mitral valve disorders,Diseases of the circulatory system,22432,51,1.52,0.0053177008,1.13,2
110.4 ,Dermatophytosis of foot,Infectious and parasitic diseases,73647,164,1.51,0.0000014270378,1.28,1.77
473.8 ,Other chronic sinusitis,Diseases of the respiratory system,2205,5,1.51,0.3969065124,0.49,3.53
485 ,"Bronchopneumonia, organism unspecified",Diseases of the respiratory system,9712,22,1.51,0.064302512,0.94,2.29
571.40 ,"Chronic hepatitis, unspecified",Diseases of the digestive system,65432,146,1.51,0.0000045665895,1.27,1.78
388.30 ,"Tinnitus, unspecified",Diseases of the nervous system,16793,38,1.51,0.0159243704,1.07,2.08
414.9 ,"Chronic ischemic heart disease,...",Diseases of the circulatory system,5726,13,1.51,0.1668365958,0.8,2.59
493.9 ,"Asthma, unspecified",Diseases of the respiratory system,9310,21,1.5,0.0789129579,0.93,2.3
799.8 ,Other ill-defined conditions,"Comorbidities, signs, and ill-defined...",4873,11,1.5,0.1894024732,0.75,2.69
919.9 ,Other and unspecified superficial...,Injury and poisoning,3101,7,1.5,0.2442719612,0.6,3.1
701.1 ,"Keratoderma, acquired",Diseases of the skin and subcutaneous...,12901,29,1.5,0.0390058106,1,2.16
620.1 ,Corpus luteum cyst or hematoma,Diseases of the genitourinary...,5361,12,1.49,0.1571391658,0.77,2.61
218.1 ,Intramural leiomyoma of uterus,Neoplasms,2228,5,1.49,0.3991850345,0.48,3.49
253.8 ,Other disorders of the pituitary...,"Endocrine, nutritional and metabolic...",3113,7,1.49,0.2459432322,0.6,3.09
535.00 ,"Acute gastritis, without mention...",Diseases of the digestive system,214336,455,1.49,0.00000000000009603279,1.35,1.65
371.20 ,"Corneal edema, unspecified",Diseases of the nervous system,4014,9,1.49,0.2170282015,0.68,2.84
692.3 ,Contact dermatitis and other eczema...,Diseases of the skin and subcutaneous...,13387,30,1.49,0.0331708296,1.01,2.14
372.14 ,Other chronic allergic conjunctivitis,Diseases of the nervous system,190863,406,1.49,0.000000000002267483,1.33,1.65
380.1 ,Infective otitis externa,Diseases of the nervous system,4917,11,1.49,0.1920911916,0.74,2.67
478.4 ,Polyp of vocal cord or larynx,Diseases of the respiratory system,6721,15,1.48,0.1516897579,0.83,2.45
879.8 ,Open wound(s) (multiple) of unspecified...,Injury and poisoning,18504,41,1.48,0.0168325232,1.06,2.01
692.1 ,Contact dermatitis and other eczema...,Diseases of the skin and subcutaneous...,5399,12,1.48,0.1599139583,0.76,2.59
375.15 ,"Tear film insufficiency, unspecified",Diseases of the nervous system,22598,50,1.48,0.0092887204,1.09,1.96
381.60 ,"Obstruction of Eustachian tube,...",Diseases of the nervous system,2242,5,1.48,0.400641452,0.48,3.47
710.0 ,Systemic lupus erythematosus,Diseases of the musculoskeletal...,7171,16,1.48,0.1238044291,0.85,2.42
455.8 ,Unspecified hemorrhoids with other...,Diseases of the circulatory system,9987,22,1.47,0.0900095455,0.92,2.23
784.7 ,Epistaxis,"Comorbidities, signs, and ill-defined...",18623,41,1.47,0.0219392311,1.05,2
870.0 ,Laceration of skin of eyelid and...,Injury and poisoning,2257,5,1.47,0.4022588859,0.48,3.44
873.40 ,"Open wound of face, unspecified...",Injury and poisoning,17726,39,1.47,0.024403356,1.04,2.01
910.0 ,"Abrasion or friction burn of face,...",Injury and poisoning,8145,18,1.47,0.1123844035,0.87,2.33
372.10 ,"Chronic conjunctivitis, unspecified",Diseases of the nervous system,215740,453,1.47,0.0000000000005412314,1.33,1.63
379.99 ,Other ill-defined disorders of...,Diseases of the nervous system,4070,9,1.47,0.2224785007,0.67,2.8
