372.9 ,Unspecified disorder of conjunctiva,Diseases of the nervous system,4853,8,1.35,0.4041341101,0.58,2.66
610.2 ,Fibroadenosis of breast,Diseases of the genitourinary...,8502,14,1.35,0.2726929504,0.73,2.26
078.89 ,Other specified diseases due to...,Infectious and parasitic diseases,2425,4,1.35,0.5496032985,0.37,3.46
216.4 ,Benign neoplasm of scalp and skin...,Neoplasms,2415,4,1.35,0.5487242321,0.37,3.47
472.1 ,Chronic pharyngitis,Diseases of the respiratory system,29841,49,1.35,0.0447080529,0.99,1.79
487 ,Influenza,Diseases of the respiratory system,22030,36,1.34,0.0981538203,0.93,1.86
280.0 ,Iron deficiency anemia secondary...,Diseases of the blood and blood-forming...,6075,10,1.34,0.3526440079,0.64,2.48
280.9 ,"Iron deficiency anemia, unspecified",Diseases of the blood and blood-forming...,18365,30,1.34,0.111682264,0.9,1.92
656.50 ,"Poor fetal growth, affecting management...","Complications of pregnancy, childbirth,...",2428,4,1.34,0.5498700528,0.37,3.45
555.0 ,Regional enteritis of small intestine,Diseases of the digestive system,4258,7,1.34,0.3774385982,0.54,2.77
610 ,Benign mammary dysplasias,Diseases of the genitourinary...,4878,8,1.34,0.4055562772,0.58,2.65
709.0 ,Dyschromia,Diseases of the skin and subcutaneous...,26903,44,1.34,0.064271297,0.97,1.81
716.9 ,"Arthropathy, unspecified",Diseases of the musculoskeletal...,9782,16,1.34,0.2435082083,0.76,2.18
493.90 ,"Asthma, unspecified type, unspecified",Diseases of the respiratory system,36997,60,1.33,0.0350218621,1.01,1.72
705.81 ,Dyshidrosis,Diseases of the skin and subcutaneous...,62671,101,1.33,0.0073833952,1.08,1.62
382.9 ,Unspecified otitis media,Diseases of the nervous system,40249,65,1.33,0.0302339402,1.02,1.7
466 ,Acute bvronchitis and bronchiolitis,Diseases of the respiratory system,42773,69,1.33,0.024937142,1.03,1.69
680.9 ,Carbuncle and furuncle of unspecified...,Diseases of the skin and subcutaneous...,42894,69,1.32,0.0252852136,1.02,1.68
380.13 ,Other acute infections of external...,Diseases of the nervous system,2480,4,1.32,0.5547091498,0.36,3.38
628.0 ,"Infertility, female, associated...",Diseases of the genitourinary...,32353,52,1.32,0.0538324175,0.98,1.74
110.5 ,Dermatophytosis of the body,Infectious and parasitic diseases,16221,26,1.31,0.1744001084,0.85,1.93
111.9 ,"Dermatomycosis, unspecified",Infectious and parasitic diseases,6241,10,1.31,0.3617249162,0.63,2.41
242.90 ,Thyrotoxicosis without mention...,"Endocrine, nutritional and metabolic...",24474,39,1.31,0.0978217495,0.93,1.79
475 ,Peritonsillar abscess,Diseases of the respiratory system,18718,30,1.31,0.1406036594,0.88,1.88
353.2 ,"Cervical root lesions, not elsewhere...",Diseases of the nervous system,3760,6,1.3,0.4770406052,0.48,2.84
842.00 ,"Sprain of wrist, unspecified site",Injury and poisoning,5642,9,1.3,0.4400077146,0.59,2.48
380.10 ,"Infective otitis externa, unspecified",Diseases of the nervous system,93723,147,1.3,0.0029129283,1.09,1.54
616.10 ,"Vaginitis and vulvovaginitis,...",Diseases of the genitourinary...,380942,572,1.3,0.000000096035223,1.18,1.44
625.3 ,Dysmenorrhea,Diseases of the genitourinary...,114657,179,1.3,0.0012253174,1.11,1.51
646 ,"Papyraceous fetus, unspecified...","Complications of pregnancy, childbirth,...",3174,5,1.29,0.4495615374,0.42,3.01
680 ,Carbuncle and furuncle,Diseases of the skin and subcutaneous...,5072,8,1.29,0.4186977368,0.55,2.54
371.89 ,Other corneal disorders,Diseases of the nervous system,3175,5,1.29,0.4497039167,0.42,3.01
693.0 ,Dermatitis due to drugs and medicines...,Diseases of the skin and subcutaneous...,9486,15,1.29,0.3012104865,0.72,2.14
592.0 ,Calculus of kidney,Diseases of the genitourinary...,12056,19,1.29,0.2930972218,0.77,2.02
708.9 ,"Urticaria, unspecified",Diseases of the skin and subcutaneous...,178348,275,1.29,0.0000994039,1.14,1.47
110.4 ,Dermatophytosis of foot,Infectious and parasitic diseases,73647,115,1.29,0.0097731762,1.06,1.56
472 ,Chronic pharyngitis and nasopharyngitis,Diseases of the respiratory system,9533,15,1.29,0.3032329299,0.72,2.13
595.9 ,"Cystitis, unspecified",Diseases of the genitourinary...,64199,100,1.28,0.0183168985,1.04,1.57
704.8 ,Other specified diseases of hair...,Diseases of the skin and subcutaneous...,48949,76,1.28,0.0419708099,1,1.6
414.9 ,"Chronic ischemic heart disease,...",Diseases of the circulatory system,5726,9,1.28,0.4438839854,0.59,2.44
720.0 ,Ankylosing spondylitis,Diseases of the musculoskeletal...,3835,6,1.28,0.4835370382,0.47,2.79
930.0 ,Corneal foreign body,Injury and poisoning,26815,42,1.28,0.1128178706,0.92,1.74
307.81 ,Tension headache,Mental disorders,28448,44,1.27,0.1235189885,0.92,1.71
656.30 ,"Fetal distress, affecting management...","Complications of pregnancy, childbirth,...",1931,3,1.27,0.5154423483,0.26,3.72
370.23 ,Filamentary keratitis,Diseases of the nervous system,2573,4,1.27,0.5643036666,0.35,3.26
582.9 ,Chronic glomerulonephritis with...,Diseases of the genitourinary...,5766,9,1.27,0.4459457962,0.58,2.43
583 ,"Nephritis and nephropathy, not...",Diseases of the genitourinary...,1930,3,1.27,0.5152346965,0.26,3.72
590.10 ,Acute pyelonephritis without lesion...,Diseases of the genitourinary...,14855,23,1.27,0.2392390359,0.8,1.91
592 ,Calculus of kidney and ureter,Diseases of the genitourinary...,3213,5,1.27,0.6060181504,0.41,2.97
054.9 ,Herpes simplex without mention...,Infectious and parasitic diseases,39367,61,1.27,0.0682986811,0.97,1.64
276.9 ,Electrolyte and fluid disorders...,"Endocrine, nutritional and metabolic...",3232,5,1.26,0.6070772976,0.41,2.95
788.4 ,Frequency of urination and polyuria,"Comorbidities, signs, and ill-defined...",25273,39,1.26,0.1469365571,0.9,1.73
845.00 ,"Sprain of ankle, unspecified site",Injury and poisoning,14237,22,1.26,0.2769201303,0.79,1.92
592.1 ,Calculus of ureter,Diseases of the genitourinary...,7790,12,1.26,0.4134468337,0.65,2.2
380.22 ,Other acute otitis externa,Diseases of the nervous system,25437,39,1.26,0.1744734618,0.89,1.72
382.00 ,Acute suppurative otitis media...,Diseases of the nervous system,7103,11,1.26,0.3936784889,0.63,2.27
455.9 ,Residual hemorrhoidal skin tags,Diseases of the circulatory system,3248,5,1.26,0.6080012425,0.41,2.94
722.10 ,Displacement of lumbar intervertebral...,Diseases of the musculoskeletal...,16252,25,1.26,0.2581293534,0.81,1.86
727.03 ,Trigger finger (acquired),Diseases of the musculoskeletal...,2590,4,1.26,0.5661766581,0.34,3.24
728.85 ,Spasm of muscle,Diseases of the musculoskeletal...,9062,14,1.26,0.3639526436,0.69,2.12
300.3 ,Obsessive-compulsive disorders,Mental disorders,1951,3,1.25,0.5196116324,0.26,3.68
373.00 ,"Blepharitis, unspecified",Diseases of the nervous system,29409,45,1.25,0.130427621,0.91,1.68
698.9 ,Unspecified pruritic disorder,Diseases of the skin and subcutaneous...,57291,87,1.25,0.0451286641,1,1.55
455.6 ,Unspecified hemorrhoids without...,Diseases of the circulatory system,40718,62,1.25,0.0854532528,0.95,1.61
491.1 ,Mucopurulent chronic bronchitis,Diseases of the respiratory system,3293,5,1.24,0.6107522903,0.4,2.9
780.2 ,Syncope and collapse,"Comorbidities, signs, and ill-defined...",11843,18,1.24,0.3538719342,0.73,1.97
640.91 ,Unspecified hemorrhage in early...,"Complications of pregnancy, childbirth,...",3942,6,1.24,0.4938017669,0.46,2.71
289.3 ,"Lymphadenitis, unspecified, except...",Diseases of the blood and blood-forming...,8582,13,1.24,0.4359249358,0.66,2.12
564.1 ,Irritable bowel syndrome,Diseases of the digestive system,67940,102,1.24,0.0438826592,1,1.51
848.9 ,Unspecified site of sprain and...,Injury and poisoning,65057,98,1.24,0.0398908703,1,1.52
919.4 ,"Insect bite, nonvenomous, of other,...",Injury and poisoning,47011,71,1.24,0.0819417466,0.96,1.57
386.00 ,"Minihre's disease, unspecified",Diseases of the nervous system,11168,17,1.24,0.3413027368,0.72,2
256.4 ,Polycystic ovaries,"Endocrine, nutritional and metabolic...",24490,37,1.24,0.1973169792,0.87,1.71
487.8 ,Influenza with other manifestations,Diseases of the respiratory system,38762,58,1.23,0.1232719951,0.93,1.59
789.0 ,Abdominal pain,"Comorbidities, signs, and ill-defined...",718383,990,1.23,0.0000023782552,1.13,1.34
558.9 ,Other and unspecified noninfectious...,Diseases of the digestive system,545251,769,1.23,0.0000041628557,1.13,1.35
571.4 ,Chronic hepatitis,Diseases of the digestive system,33421,50,1.23,0.1550640806,0.91,1.62
078.1 ,Viral warts,Infectious and parasitic diseases,69408,104,1.23,0.0404737056,1,1.5
616.8 ,Other specified inflammatory diseases...,Diseases of the genitourinary...,25279,38,1.23,0.2042147119,0.87,1.69
472.0 ,Chronic rhinitis,Diseases of the respiratory system,86269,129,1.23,0.0246441346,1.02,1.47
727.00 ,"Synovitis and tenosynovitis, unspecified",Diseases of the musculoskeletal...,60190,90,1.23,0.0578472132,0.98,1.52
787.9 ,Other symptoms involving digestive...,"Comorbidities, signs, and ill-defined...",10734,16,1.22,0.4047621616,0.69,1.98
680.0 ,Carbuncle and furuncle of face,Diseases of the skin and subcutaneous...,8006,12,1.22,0.4236484095,0.63,2.14
681.00 ,"Cellulitis and abscess of finger,...",Diseases of the skin and subcutaneous...,2011,3,1.22,0.741570463,0.25,3.57
691.8 ,Other atopic dermatitis and related...,Diseases of the skin and subcutaneous...,51632,77,1.22,0.0845959579,0.96,1.54
693.9 ,Dermatitis due to unspecified...,Diseases of the skin and subcutaneous...,21419,32,1.22,0.2782401228,0.83,1.73
597.8 ,Other urethritis,Diseases of the genitourinary...,2010,3,1.22,0.7415104155,0.25,3.57
614.9 ,Unspecified inflammatory disease...,Diseases of the genitourinary...,226594,329,1.22,0.0013045427,1.08,1.37
719.48 ,"Pain in joint, other specified...",Diseases of the musculoskeletal...,1999,3,1.22,0.7408574825,0.25,3.59
721.1 ,Cervical spondylosis with myelopathy,Diseases of the musculoskeletal...,2685,4,1.22,0.5772438029,0.33,3.12
728.89 ,"Other disorders of muscle, ligament,...",Diseases of the musculoskeletal...,9338,14,1.22,0.455093598,0.67,2.06
266.9 ,Unspecified vitamin B deficiency,"Endocrine, nutritional and metabolic...",2020,3,1.21,0.7421159981,0.25,3.55
757.39 ,Other specified anomalies of skin,Congenital anomalies,5406,8,1.21,0.5551047915,0.52,2.39
845 ,Sprains and strains of ankle and...,Injury and poisoning,3365,5,1.21,0.6155986657,0.39,2.84
560.9 ,Unspecified intestinal obstruction,Diseases of the digestive system,4723,7,1.21,0.5304797829,0.49,2.5
692.0 ,Contact dermatitis and other eczema...,Diseases of the skin and subcutaneous...,61042,90,1.21,0.0773326208,0.97,1.5
692.1 ,Contact dermatitis and other eczema...,Diseases of the skin and subcutaneous...,5399,8,1.21,0.5547509564,0.52,2.39
386.2 ,Vertigo of central origin,Diseases of the nervous system,4720,7,1.21,0.5302538756,0.49,2.5
924.1 ,Contusion of knee and lower leg,Injury and poisoning,3375,5,1.21,0.6163129207,0.39,2.83
465.0 ,Acute laryngopharyngitis,Diseases of the respiratory system,449464,633,1.21,0.00007159,1.1,1.33
466.1 ,Acute bronchiolitis,Diseases of the respiratory system,99542,146,1.21,0.0283890445,1.02,1.43
524.62 ,"Temporomandibular joint disorders,...",Diseases of the digestive system,2716,4,1.2,0.5810565078,0.33,3.08
530.8 ,Other specified disorders of esophagus,Diseases of the digestive system,2048,3,1.2,0.743870624,0.25,3.5
533.91 ,"Peptic ulcer of unspecified site,...",Diseases of the digestive system,2041,3,1.2,0.7434239767,0.25,3.51
540.9 ,Acute appendicitis without mention...,Diseases of the digestive system,10183,15,1.2,0.4747051288,0.67,1.99
370.0 ,Corneal ulcer,Diseases of the nervous system,2717,4,1.2,0.5811810122,0.33,3.08
592.9 ,"Urinary calculus, unspecified",Diseases of the genitourinary...,14275,21,1.2,0.3984496009,0.74,1.84
381.01 ,Acute serous otitis media,Diseases of the nervous system,2730,4,1.2,0.5828079125,0.33,3.07
933.0 ,Foreign body in pharynx,Injury and poisoning,11601,17,1.2,0.4235181633,0.7,1.92
464 ,Acute laryngitis and tracheitis,Diseases of the respiratory system,58117,85,1.2,0.1033352054,0.95,1.49
465.9 ,Acute upper respiratory infections...,Diseases of the respiratory system,1408969,1790,1.2,0.0009776336,1.08,1.34
727.05 ,Other tenosynovitis of hand and...,Diseases of the musculoskeletal...,5451,8,1.2,0.5574677708,0.52,2.37
729.2 ,"Neuralgia, neuritis, and radiculitis,...",Diseases of the musculoskeletal...,33305,49,1.2,0.2050317988,0.89,1.6
639.9 ,Unspecified complication following...,"Complications of pregnancy, childbirth,...",7570,11,1.19,0.5092821131,0.59,2.13
640.01 ,"Threatened abortion, delivered,...","Complications of pregnancy, childbirth,...",3417,5,1.19,0.6194168658,0.39,2.79
643 ,Excessive vomiting in pregnancy,"Complications of pregnancy, childbirth,...",8202,12,1.19,0.5237853576,0.62,2.09
528.9 ,Other and unspecified diseases...,Diseases of the digestive system,50290,73,1.19,0.1543869379,0.93,1.5
367.53 ,Spasm of accommodation,Diseases of the nervous system,4819,7,1.19,0.5380804149,0.48,2.45
571.5 ,Cirrhosis of liver without mention...,Diseases of the digestive system,2049,3,1.19,0.7439348576,0.25,3.5
706.3 ,Seborrhea,Diseases of the skin and subcutaneous...,18533,27,1.19,0.3420128298,0.78,1.74
918.1 ,Superficial injury of cornea,Injury and poisoning,31541,46,1.19,0.2233929645,0.87,1.6
708.0 ,Allergic urticaria,Diseases of the skin and subcutaneous...,64995,94,1.19,0.1094700758,0.96,1.46
112.1 ,Candidiasis of vulva and vagina,Infectious and parasitic diseases,161684,232,1.19,0.0138515895,1.03,1.36
737.43 ,Scoliosis associated with other...,Diseases of the musculoskeletal...,2067,3,1.18,0.7451090014,0.24,3.47
296.90 ,Unspecified episodic mood disorder,Mental disorders,2773,4,1.18,0.5882952108,0.32,3.02
786.0 ,Dyspnea and respiratory abnormalities,"Comorbidities, signs, and ill-defined...",4852,7,1.18,0.6769352173,0.47,2.43
787.0 ,Nausea and vomiting,"Comorbidities, signs, and ill-defined...",83804,120,1.18,0.0853968188,0.97,1.42
353.9 ,Unspecified nerve root and plexus...,Diseases of the nervous system,2071,3,1.18,0.7453744689,0.24,3.46
840.9 ,Sprains and strains of unspecified...,Injury and poisoning,8277,12,1.18,0.5263424508,0.61,2.07
362.9 ,Unspecified retinal disorder,Diseases of the nervous system,2756,4,1.18,0.586106901,0.32,3.04
555.9 ,Regional enteritis of unspecified...,Diseases of the digestive system,16620,24,1.18,0.4337476177,0.75,1.76
564.9 ,Unspecified functional disorder...,Diseases of the digestive system,166184,237,1.18,0.0166640032,1.03,1.35
372.30 ,"Conjunctivitis, unspecified",Diseases of the nervous system,219742,311,1.18,0.0075916681,1.04,1.33
382.0 ,Acute suppurative otitis media,Diseases of the nervous system,2754,4,1.18,0.58585105,0.32,3.04
616.9 ,Unspecified inflammatory disease...,Diseases of the genitourinary...,372621,519,1.18,0.0013143133,1.07,1.3
429.9 ,"Heart disease, unspecified",Diseases of the circulatory system,4856,7,1.18,0.6770568042,0.47,2.43
455.3 ,External hemorrhoids without mention...,Diseases of the circulatory system,4164,6,1.18,0.6526397253,0.43,2.57
465 ,Acute upper respiratory infections...,Diseases of the respiratory system,139103,199,1.18,0.025410091,1.02,1.37
639.8 ,Other specified complications...,"Complications of pregnancy, childbirth,...",2095,3,1.17,0.7470009452,0.24,3.42
784 ,Symptoms involving head and neck,"Comorbidities, signs, and ill-defined...",3479,5,1.17,0.6242913431,0.38,2.74
316 ,Psychic factors associated with...,Mental disorders,2086,3,1.17,0.7463843386,0.24,3.44
367.9 ,Unspecified disorder of refraction...,Diseases of the nervous system,29421,42,1.17,0.3127381454,0.84,1.58
571.40 ,"Chronic hepatitis, unspecified",Diseases of the digestive system,65432,93,1.17,0.1543229546,0.94,1.44
372.72 ,Conjunctival hemorrhage,Diseases of the nervous system,17408,25,1.17,0.3846078075,0.76,1.74
110.9 ,Dermatophytosis of unspecified...,Infectious and parasitic diseases,36229,52,1.17,0.2544295707,0.87,1.55
617.9 ,"Endometriosis, site unspecified",Diseases of the genitourinary...,19606,28,1.17,0.4102881081,0.77,1.69
240.0 ,"Goiter, specified as simple","Endocrine, nutritional and metabolic...",4862,7,1.17,0.6772412612,0.47,2.43
250.90 ,"Diabetes with unspecified complication,...","Endocrine, nutritional and metabolic...",3500,5,1.17,0.6260170889,0.38,2.73
643.13 ,Hyperemesis gravidarum with metabolic...,"Complications of pregnancy, childbirth,...",74500,105,1.16,0.1484623969,0.94,1.41
998.5 ,Postoperative infection,Injury and poisoning,19750,28,1.16,0.4128641193,0.77,1.68
381.4 ,"Nonsuppurative otitis media, not...",Diseases of the nervous system,4220,6,1.16,0.6555800445,0.43,2.53
443.9 ,"Peripheral vascular disease, unspecified",Diseases of the circulatory system,2110,3,1.16,0.7480459621,0.24,3.4
217 ,Benign neoplasm of breast,Neoplasms,57391,81,1.16,0.2024672565,0.91,1.44
218.9 ,"Leiomyoma of uterus, unspecified",Neoplasms,23248,33,1.16,0.3946392031,0.8,1.63
372 ,Disorders of conjunctiva,Diseases of the nervous system,9203,13,1.15,0.5494252554,0.61,1.98
573.8 ,Other specified disorders of liver,Diseases of the digestive system,2119,3,1.15,0.7486831405,0.24,3.38
611.79 ,Other signs and symptoms in breast,Diseases of the genitourinary...,2839,4,1.15,0.7834119725,0.31,2.95
611.8 ,Other specified disorders of breast,Diseases of the genitourinary...,2838,4,1.15,0.7833751292,0.31,2.95
701.1 ,"Keratoderma, acquired",Diseases of the skin and subcutaneous...,12901,18,1.14,0.5276786382,0.67,1.81
077.1 ,Epidemic keratoconjunctivitis,Infectious and parasitic diseases,26460,37,1.14,0.424581334,0.8,1.58
464.2 ,Acute larygotracheitis,Diseases of the respiratory system,14316,20,1.14,0.5470926894,0.7,1.77
626.2 ,Excessive or frequent menstruation,Diseases of the genitourinary...,77688,108,1.14,0.1896488824,0.93,1.38
242.00 ,Toxic diffuse goiter without mention...,"Endocrine, nutritional and metabolic...",10765,15,1.14,0.5791121832,0.64,1.88
478.5 ,Other diseases of vocal cords,Diseases of the respiratory system,57485,80,1.14,0.249344478,0.9,1.43
256.9 ,Unspecified ovarian dysfunction,"Endocrine, nutritional and metabolic...",27166,38,1.14,0.3826168863,0.81,1.57
729.9 ,Other and unspecified disorders...,Diseases of the musculoskeletal...,5767,8,1.13,0.703071707,0.49,2.24
692 ,Contact dermatitis and other eczema,Diseases of the skin and subcutaneous...,41295,57,1.13,0.354700813,0.85,1.47
706.1 ,Other acne,Diseases of the skin and subcutaneous...,371329,501,1.13,0.0176622125,1.02,1.25
053.9 ,Herpes zoster without mention...,Infectious and parasitic diseases,12993,18,1.13,0.6129603541,0.67,1.79
615 ,"Inflammatory diseases of uterus,...",Diseases of the genitourinary...,9414,13,1.13,0.6555650764,0.6,1.93
616.0 ,Cervicitis and endocervicitis,Diseases of the genitourinary...,97685,134,1.13,0.1876744168,0.94,1.34
460 ,Acute nasopharyngitis [common...,Diseases of the respiratory system,722846,952,1.13,0.0045780252,1.04,1.23
226 ,Benign neoplasm of thyroid glands,Neoplasms,3619,5,1.13,0.6364447325,0.37,2.64
466.0 ,Acute bronchitis,Diseases of the respiratory system,621707,825,1.13,0.0053374478,1.04,1.24
240 ,Simple and unspecified goiter,"Endocrine, nutritional and metabolic...",2157,3,1.13,0.751453923,0.23,3.32
626.8 ,Other disorders of menstruation...,Diseases of the genitourinary...,239962,326,1.13,0.0482048382,1,1.27
474.0 ,Chronic tonsillitis,Diseases of the respiratory system,9381,13,1.13,0.6549282176,0.6,1.94
634.00 ,"Spontaneous abortion, complicated...","Complications of pregnancy, childbirth,...",2894,4,1.13,0.7855504702,0.31,2.89
496 ,"Chronic airway obstruction, not...",Diseases of the respiratory system,3636,5,1.12,0.6380174442,0.36,2.62
536 ,Disorders of function of stomach,Diseases of the digestive system,23344,32,1.12,0.5090440027,0.76,1.59
704.01 ,Alopecia areata,Diseases of the skin and subcutaneous...,5098,7,1.12,0.6863564582,0.45,2.31
388.30 ,"Tinnitus, unspecified",Diseases of the nervous system,16793,23,1.12,0.5783351929,0.71,1.68
427.9 ,"Cardiac dysrhythmia, unspecified",Diseases of the circulatory system,21946,30,1.12,0.5591863377,0.75,1.6
726.71 ,Achilles bursitis or tendinitis,Diseases of the musculoskeletal...,2179,3,1.12,0.7531146299,0.23,3.29
727 ,"Other disorders of synovium tendon,...",Diseases of the musculoskeletal...,5109,7,1.12,0.6868640067,0.45,2.31
737.30 ,"Scoliosis [and kyphoscoliosis],...",Diseases of the musculoskeletal...,8060,11,1.11,0.6324949473,0.55,2
524.6 ,Temporomandibular joint disorders,Diseases of the digestive system,2202,3,1.11,0.7548924945,0.23,3.26
368.13 ,Visual discomfort,Diseases of the nervous system,53802,73,1.11,0.3806778393,0.87,1.4
617.1 ,Endometriosis of ovary,Diseases of the genitourinary...,9537,13,1.11,0.6583114791,0.59,1.91
244.9 ,Unspecified acquired hypothyroidism,"Endocrine, nutritional and metabolic...",7349,10,1.11,0.7360451517,0.53,2.05
784.7 ,Epistaxis,"Comorbidities, signs, and ill-defined...",18623,25,1.1,0.5986553501,0.71,1.62
349 ,Other and unspecified disorders...,Diseases of the nervous system,2229,3,1.1,0.7570309468,0.23,3.22
830 ,Dislocation of jaw,Injury and poisoning,3711,5,1.1,0.8110576828,0.36,2.57
674.6 ,Other complications of obstetrical...,"Complications of pregnancy, childbirth,...",,3,1.1,0.7566308977,0.23,3.22
595.0 ,Acute cystitis,Diseases of the genitourinary...,134159,179,1.1,0.2393581273,0.94,1.28
708 ,Urticaria,Diseases of the skin and subcutaneous...,16262,22,1.1,0.65122123,0.69,1.68
620.2 ,Other and unspecified ovarian...,Diseases of the genitourinary...,48302,65,1.1,0.42889251,0.85,1.41
626.9 ,Unspecified disorders of menstruation...,Diseases of the genitourinary...,315274,418,1.1,0.0819637943,0.99,1.23
728 ,"Disorders of muscle, ligament,...",Diseases of the musculoskeletal...,8914,12,1.1,0.6498289137,0.57,1.92
873.8 ,Other and unspecified open wound...,Injury and poisoning,4504,6,1.09,0.8286964451,0.4,2.37
373.1 ,Hordeolum and other deep inflammation...,Diseases of the nervous system,31528,42,1.09,0.5693043584,0.78,1.48
373.2 ,Chalazion,Diseases of the nervous system,28550,38,1.09,0.608236459,0.77,1.5
380.4 ,Impacted cerumen,Diseases of the nervous system,32246,43,1.09,0.5733651852,0.79,1.47
643.03 ,"Mild hyperemesis gravidarum, antepartum...","Complications of pregnancy, childbirth,...",15856,21,1.08,0.6491106009,0.67,1.66
614.4 ,Chronic or unspecified parametritis...,Diseases of the genitourinary...,8299,11,1.08,0.7517135179,0.54,1.94
626.0 ,Absence of menstruation,Diseases of the genitourinary...,310216,404,1.08,0.1845875445,0.96,1.2
472.2 ,Chronic nasopharyngitis,Diseases of the respiratory system,34653,46,1.08,0.5867551586,0.79,1.45
782.1 ,Rash and other nonspecific skin...,"Comorbidities, signs, and ill-defined...",15225,20,1.07,0.726325243,0.65,1.66
532.90 ,"Duodenal ulcer, unspecified as...",Diseases of the digestive system,11470,15,1.07,0.7878040329,0.6,1.76
535.50 ,"Unspecified gastritis and gastroduodenitis,...",Diseases of the digestive system,175562,228,1.07,0.3691199756,0.93,1.22
578.9 ,Hemorrhage of gastrointestinal...,Diseases of the digestive system,8391,11,1.07,0.753710743,0.53,1.92
692.8 ,"Contact dermatitis and other eczema,...",Diseases of the skin and subcutaneous...,7652,10,1.07,0.7433604551,0.51,1.97
698.3 ,Lichenification and lichen simplex...,Diseases of the skin and subcutaneous...,33648,44,1.07,0.6368470094,0.77,1.44
704.00 ,"Alopecia, unspecified",Diseases of the skin and subcutaneous...,4591,6,1.07,0.8305845648,0.39,2.33
285.9 ,"Anemia, unspecified",Diseases of the blood and blood-forming...,49139,64,1.06,0.6009423102,0.82,1.36
611.9 ,Unspecified breast disorder,Diseases of the genitourinary...,39424,51,1.06,0.6624372115,0.78,1.39
463 ,Acute tonsillitis,Diseases of the respiratory system,713881,908,1.06,0.1556198356,0.98,1.16
626 ,Disorders of menstruation and...,Diseases of the genitourinary...,47652,62,1.06,0.6419290588,0.81,1.37
726.0 ,Adhesive capsulitis of shoulder,Diseases of the musculoskeletal...,3069,4,1.06,0.7936725807,0.29,2.73
626.6 ,Metrorrhagia,Diseases of the genitourinary...,104804,136,1.06,0.4948171336,0.89,1.26
370.49 ,Other keratoconjunctivitis,Diseases of the nervous system,8516,11,1.05,0.7568341675,0.52,1.89
695.89 ,Other specified erythematous conditions,Diseases of the skin and subcutaneous...,3108,4,1.05,0.7957212057,0.29,2.69
995.3 ,"Allergy, unspecified, not elsewhere...",Injury and poisoning,23333,30,1.05,0.7770723609,0.71,1.5
706.8 ,Other specified diseases of sebaceous...,Diseases of the skin and subcutaneous...,4671,6,1.05,0.8325692447,0.38,2.29
614.7 ,"Other chronic pelvic peritonitis,...",Diseases of the genitourinary...,4642,6,1.05,0.8318234403,0.39,2.3
616.1 ,Vaginitis and vulvovaginitis,Diseases of the genitourinary...,96717,124,1.05,0.603167992,0.87,1.26
218 ,Uterine leiomyoma,Neoplasms,3106,4,1.05,0.7956142683,0.29,2.7
465.8 ,Acute upper respiratory infections...,Diseases of the respiratory system,190515,245,1.05,0.4256457886,0.92,1.21
362.63 ,Lattice degeneration,Diseases of the nervous system,3907,5,1.04,0.8174886012,0.34,2.44
372.10 ,"Chronic conjunctivitis, unspecified",Diseases of the nervous system,215740,274,1.04,0.5329870312,0.91,1.18
692.3 ,Contact dermatitis and other eczema...,Diseases of the skin and subcutaneous...,13387,17,1.04,0.8043762669,0.6,1.66
005.9 ,"Food poisoning, unspecified",Infectious and parasitic diseases,2356,3,1.04,0.7677338123,0.21,3.04
611.71 ,Mastodynia,Diseases of the genitourinary...,25822,33,1.04,0.7877823425,0.72,1.47
616.11 ,Vaginitis and vulvovaginitis in...,Diseases of the genitourinary...,57109,73,1.04,0.7151397746,0.81,1.32
623.5 ,"Leukorrhea, not specified as infective",Diseases of the genitourinary...,87282,111,1.04,0.6914072763,0.85,1.26
464.20 ,Acute laryngotracheitis without...,Diseases of the respiratory system,104132,132,1.04,0.6812746447,0.86,1.24
477 ,Allergic rhinitis,Diseases of the respiratory system,30568,39,1.04,0.8042962425,0.74,1.43
