577.0 ,Acute pancreatitis,Diseases of the digestive system,2952,31,1.62,0.0113753911,1.1,2.3
386.0 ,Meniere's disease,Diseases of the nervous system,4002,42,1.62,0.0040859554,1.16,2.19
723.8 ,Other syndromes affecting cervical...,Diseases of the musculoskeletal...,2848,30,1.62,0.0136271206,1.09,2.32
627.9 ,Unspecified menopausal and postmenopausal...,Diseases of the genitourinary...,6179,65,1.62,0.0003382028,1.25,2.07
300.0 ,Anxiety states,Mental disorders,37161,385,1.61,1.059603e-17,1.45,1.79
529.0 ,Glossitis,Diseases of the digestive system,2866,30,1.61,0.0140323537,1.08,2.31
681.9 ,Cellulitis and abscess of unspecified...,Diseases of the skin and subcutaneous...,12203,127,1.61,0.00000081282835,1.34,1.92
367.9 ,Unspecified disorder of refraction...,Diseases of the nervous system,28897,299,1.61,0.0000000000000590864,1.43,1.8
930.1 ,Foreign body in conjunctival sac,Injury and poisoning,48063,496,1.61,4.261566e-22,1.47,1.77
581.9 ,Nephrotic syndrome with unspecified...,Diseases of the genitourinary...,3731,39,1.61,0.0056383884,1.14,2.21
873.0 ,"Open wound of scalp, without mention...",Injury and poisoning,9936,103,1.6,0.0000110043,1.3,1.94
533.9 ,"Peptic ulcer, site unspecified,...",Diseases of the digestive system,32940,340,1.6,0.000000000000001482671,1.44,1.79
592.1 ,Calculus of ureter,Diseases of the genitourinary...,14557,151,1.6,0.000000088826937,1.35,1.88
402 ,Hypertensive heart disease,Diseases of the circulatory system,3377,35,1.6,0.0097123752,1.11,2.22
414 ,Other forms of chronic ischemic...,Diseases of the circulatory system,2119,22,1.6,0.0408108967,1,2.43
616.4 ,Other abscess of vulva,Diseases of the genitourinary...,4802,50,1.6,0.0021311258,1.19,2.12
459.9 ,Unspecified circulatory system...,Diseases of the circulatory system,2409,25,1.6,0.0298018208,1.03,2.36
724 ,Other and unspecified disorders...,Diseases of the musculoskeletal...,4824,50,1.6,0.0021815681,1.18,2.11
250 ,Diabetes mellitus,"Endocrine, nutritional and metabolic...",9146,95,1.6,0.0000210505,1.29,1.96
253.8 ,Other disorders of the pituitary...,"Endocrine, nutritional and metabolic...",3562,37,1.6,0.0066310637,1.12,2.21
307.4 ,Specific disorders of sleep of...,Mental disorders,3675,38,1.59,0.007271644,1.12,2.19
533.00 ,Acute peptic ulcer of unspecified...,Diseases of the digestive system,7443,77,1.59,0.000161883,1.26,2
789.9 ,Other symptoms involving abdomen...,"Comorbidities, signs, and ill-defined...",7472,77,1.59,0.0001672049,1.25,1.99
569.3 ,Hemorrhage of rectum and anus,Diseases of the digestive system,4830,50,1.59,0.0021979152,1.18,2.11
372.13 ,Vernal conjunctivitis,Diseases of the nervous system,4734,49,1.59,0.0020611658,1.18,2.11
703.0 ,Ingrowing nail,Diseases of the skin and subcutaneous...,2617,27,1.59,0.0207387774,1.04,2.32
592.9 ,"Urinary calculus, unspecified",Diseases of the genitourinary...,23317,239,1.59,0.00000000004776841,1.39,1.81
595.9 ,"Cystitis, unspecified",Diseases of the genitourinary...,74048,748,1.59,2.389814e-30,1.47,1.71
616.50 ,"Ulceration of vulva, unspecified",Diseases of the genitourinary...,7654,79,1.59,0.0001155388,1.26,1.99
620.0 ,Follicular cyst of ovary,Diseases of the genitourinary...,6395,66,1.59,0.0004353875,1.23,2.03
625.3 ,Dysmenorrhea,Diseases of the genitourinary...,71287,719,1.59,5.046839e-29,1.47,1.71
780.5 ,Sleep disturbance,"Comorbidities, signs, and ill-defined...",25241,257,1.58,0.00000000001804714,1.39,1.79
784.1 ,Throat pain,"Comorbidities, signs, and ill-defined...",26288,268,1.58,0.000000000005350993,1.39,1.79
785.1 ,Palpitations,"Comorbidities, signs, and ill-defined...",40300,410,1.58,1.659901e-17,1.43,1.75
533 ,"Peptic ulcer, site unspecified",Diseases of the digestive system,22794,232,1.58,0.000000000157611,1.38,1.8
555.9 ,Regional enteritis of unspecified...,Diseases of the digestive system,15528,159,1.58,0.000000098057093,1.34,1.85
694.0 ,Dermatitis herpetiformis,Diseases of the skin and subcutaneous...,2147,22,1.58,0.0425072005,0.99,2.39
009.1 ,"Colitis, enteritis, and gastroenteritis...",Infectious and parasitic diseases,30992,315,1.58,0.0000000000001068269,1.41,1.77
698.1 ,Pruritus of genital organs,Diseases of the skin and subcutaneous...,71256,718,1.58,6.53926e-29,1.47,1.71
215.9 ,Other benign neoplasm of connective...,Neoplasms,5939,61,1.58,0.0008726753,1.21,2.04
285.8 ,Other specified anemias,Diseases of the blood and blood-forming...,4707,48,1.57,0.0035240557,1.15,2.09
524.60 ,"Temporomandibular joint disorders,...",Diseases of the digestive system,5384,55,1.57,0.0016260945,1.18,2.05
786.3 ,Hemoptysis,"Comorbidities, signs, and ill-defined...",4912,50,1.57,0.0032164269,1.16,2.07
364.00 ,"Acute and subacute iridocyclitis,...",Diseases of the nervous system,2547,26,1.57,0.0262900583,1.02,2.31
949.0 ,"Burn of unspecified site, unspecified...",Injury and poisoning,11219,114,1.57,0.0000093347401,1.29,1.89
695.3 ,Rosacea,Diseases of the skin and subcutaneous...,5696,58,1.57,0.0012579624,1.19,2.03
733.0 ,Osteoporosis,Diseases of the musculoskeletal...,5044,51,1.56,0.0028162684,1.16,2.05
528.0 ,Stomatitis,Diseases of the digestive system,26372,266,1.56,0.00000000002198649,1.38,1.77
528.5 ,Diseases of lips,Diseases of the digestive system,6216,63,1.56,0.0008836956,1.2,2
923.03 ,Contusion of upper arm,Injury and poisoning,2073,21,1.56,0.0538779946,0.96,2.39
680.0 ,Carbuncle and furuncle of face,Diseases of the skin and subcutaneous...,7287,74,1.56,0.0003314988,1.23,1.97
571.49 ,Other chronic hepatitis,Diseases of the digestive system,10050,102,1.56,0.0000288621,1.27,1.9
183.0 ,Malignant neoplasm of ovary,Neoplasms,1977,20,1.56,0.0665409388,0.95,2.41
614.5 ,"Acute or unspecified pelvic peritonitis,...",Diseases of the genitourinary...,33572,337,1.56,0.00000000000006988513,1.39,1.74
618.1 ,Uterine prolapse without mention...,Diseases of the genitourinary...,2070,21,1.56,0.0536491322,0.96,2.39
300.09 ,Other anxiety states,Mental disorders,10060,101,1.55,0.0000396,1.26,1.88
307.40 ,"Nonorganic sleep disorder, unspecified",Mental disorders,5153,52,1.55,0.0030504015,1.16,2.04
648.80 ,Abnormal glucose tolerance of...,"Complications of pregnancy, childbirth,...",1982,20,1.55,0.0668826485,0.95,2.4
930.0 ,Corneal foreign body,Injury and poisoning,35231,352,1.55,0.00000000000003442292,1.39,1.73
564.9 ,Unspecified functional disorder...,Diseases of the digestive system,151884,1465,1.55,1.067839e-49,1.47,1.64
701.1 ,"Keratoderma, acquired",Diseases of the skin and subcutaneous...,13405,135,1.55,0.0000019638657,1.3,1.84
374.05 ,Trichiasis of eyelid without entropion,Diseases of the nervous system,13181,132,1.55,0.0000035803404,1.29,1.84
110.5 ,Dermatophytosis of the body,Infectious and parasitic diseases,15480,155,1.55,0.00000048358911,1.31,1.81
381.00 ,"Acute nonsuppurative otitis media,...",Diseases of the nervous system,5549,56,1.55,0.0019191352,1.17,2.02
386.10 ,"Peripheral vertigo, unspecified",Diseases of the nervous system,12231,123,1.55,0.0000060054132,1.29,1.85
300 ,Neurotic disorders,Mental disorders,26480,263,1.54,0.0000000001156623,1.36,1.74
491.9 ,Unspecified chronic bronchitis,Diseases of the respiratory system,32030,317,1.54,0.000000000002086783,1.37,1.72
883 ,Open wound of finger(s),Injury and poisoning,5211,52,1.54,0.0033180994,1.14,2.02
306 ,Physiological malfunction arising...,Mental disorders,2598,26,1.54,0.0368220434,1,2.26
519.8 ,Other diseases of respiratory...,Diseases of the respiratory system,3593,36,1.54,0.0126762784,1.08,2.14
782.1 ,Rash and other nonspecific skin...,"Comorbidities, signs, and ill-defined...",13688,137,1.54,0.0000024906551,1.29,1.83
316 ,Psychic factors associated with...,Mental disorders,3190,32,1.54,0.0200603317,1.05,2.18
531.9 ,"Gastric ulcer, unspecified as...",Diseases of the digestive system,3606,36,1.54,0.0165284584,1.07,2.13
362.10 ,"Background retinopathy, unspecified",Diseases of the nervous system,2201,22,1.54,0.0613541185,0.96,2.33
680.9 ,Carbuncle and furuncle of unspecified...,Diseases of the skin and subcutaneous...,36245,359,1.54,0.00000000000006002143,1.38,1.71
372.10 ,"Chronic conjunctivitis, unspecified",Diseases of the nervous system,204187,1924,1.54,5.567091e-60,1.46,1.61
571.40 ,"Chronic hepatitis, unspecified",Diseases of the digestive system,90883,889,1.54,1.369417e-31,1.44,1.65
709.9 ,Unspecified disorder of skin and...,Diseases of the skin and subcutaneous...,94754,922,1.54,5.119259e-32,1.44,1.65
597.89 ,Other urethritis,Diseases of the genitourinary...,6193,62,1.54,0.0014808337,1.18,1.98
599.7 ,Hematuria,Diseases of the genitourinary...,27832,276,1.54,0.00000000004425168,1.36,1.73
610.2 ,Fibroadenosis of breast,Diseases of the genitourinary...,13827,138,1.54,0.0000022156626,1.29,1.82
193 ,Malignant neoplasm of thyroid...,Neoplasms,2498,25,1.54,0.0448473148,0.99,2.28
611.71 ,Mastodynia,Diseases of the genitourinary...,34301,341,1.54,0.0000000000001652693,1.38,1.72
239 ,Neoplasms of unspecifed nature,Neoplasms,1895,19,1.54,0.0630434219,0.93,2.42
491 ,Chronic bronchitis,Diseases of the respiratory system,8339,83,1.53,0.0002843423,1.22,1.9
786.5 ,Chest pain,"Comorbidities, signs, and ill-defined...",26857,266,1.53,0.0000000001208072,1.35,1.73
362.60 ,"Peripheral retinal degeneration,...",Diseases of the nervous system,5336,53,1.53,0.0036341366,1.14,2
535.50 ,"Unspecified gastritis and gastroduodenitis,...",Diseases of the digestive system,176784,1677,1.53,3.174486e-53,1.46,1.62
011.90 ,"Pulmonary tuberculosis, unspecified,...",Infectious and parasitic diseases,3910,39,1.53,0.0123688391,1.09,2.1
375.15 ,"Tear film insufficiency, unspecified",Diseases of the nervous system,29926,296,1.53,0.00000000001099331,1.36,1.72
110.1 ,Dermatophytosis of nail,Infectious and parasitic diseases,38317,377,1.53,0.00000000000003115738,1.38,1.7
112.9 ,Candidiasis of unspecified site,Infectious and parasitic diseases,7971,79,1.53,0.0004621922,1.21,1.91
218.1 ,Intramural leiomyoma of uterus,Neoplasms,9976,99,1.53,0.000080107,1.24,1.87
455.4 ,External thrombosed hemorrhoids,Diseases of the circulatory system,2013,20,1.53,0.0694935708,0.93,2.37
470 ,Deviated nasal septum,Diseases of the respiratory system,13845,137,1.53,0.0000037694148,1.28,1.81
285.9 ,"Anemia, unspecified",Diseases of the blood and blood-forming...,58245,568,1.52,4.07597e-20,1.4,1.66
493.90 ,"Asthma, unspecified type, unspecified",Diseases of the respiratory system,46167,452,1.52,1.909486e-16,1.38,1.68
523.9 ,Unspecified gingival and periodontal...,Diseases of the digestive system,5766,57,1.52,0.0030371487,1.15,1.98
349.9 ,Unspecified disorders of nervous...,Diseases of the nervous system,15175,149,1.52,0.0000023033446,1.28,1.78
786.59 ,Other chest pain,"Comorbidities, signs, and ill-defined...",15391,152,1.52,0.0000012831002,1.29,1.79
787.3 ,"Flatulence, eructation, and gas...","Comorbidities, signs, and ill-defined...",54442,530,1.52,1.199872e-18,1.39,1.66
362.9 ,Unspecified retinal disorder,Diseases of the nervous system,2433,24,1.52,0.0567335319,0.97,2.26
537.9 ,Unspecified disorder of stomach...,Diseases of the digestive system,4237,42,1.52,0.0095686735,1.1,2.07
555.2 ,Regional enteritis of small intestine...,Diseases of the digestive system,5563,55,1.52,0.0033706145,1.14,1.98
564 ,"Functional digestive disorders,...",Diseases of the digestive system,30886,303,1.52,0.00000000001759585,1.35,1.71
570 ,Acute and subacute necrosis of...,Diseases of the digestive system,2325,23,1.52,0.0519396415,0.96,2.29
701.4 ,Keloid scar,Diseases of the skin and subcutaneous...,13896,137,1.52,0.0000049807504,1.27,1.8
583 ,"Nephritis and nephropathy, not...",Diseases of the genitourinary...,2831,28,1.52,0.034383137,1.01,2.2
379.24 ,Other vitreous opacities,Diseases of the nervous system,16337,161,1.52,0.00000075031619,1.29,1.78
216.5 ,"Benign neoplasm of skin of trunk,...",Neoplasms,3437,34,1.52,0.0191880066,1.05,2.13
427.0 ,Paroxysmal supraventricular tachycardia,Diseases of the circulatory system,3737,37,1.52,0.0143484116,1.07,2.1
473.8 ,Other chronic sinusitis,Diseases of the respiratory system,3344,33,1.52,0.023154709,1.04,2.14
626.7 ,Postcoital bleeding,Diseases of the genitourinary...,3957,39,1.52,0.0131432549,1.08,2.08
360.89 ,Other disorders of globe,Diseases of the nervous system,3060,30,1.51,0.0318178319,1.01,2.16
686 ,Other local infections of skin...,Diseases of the skin and subcutaneous...,11656,114,1.51,0.0000396686,1.24,1.81
945.00 ,Burn of unspecified degree of...,Injury and poisoning,3351,33,1.51,0.0233638898,1.04,2.13
386 ,Vertiginous syndromes and other...,Diseases of the nervous system,10099,99,1.51,0.0001163826,1.23,1.84
388.30 ,"Tinnitus, unspecified",Diseases of the nervous system,25380,247,1.51,0.0000000027092425,1.32,1.71
616.11 ,Vaginitis and vulvovaginitis in...,Diseases of the genitourinary...,61759,596,1.51,4.131052e-20,1.39,1.64
241.9 ,Unspecified nontoxic nodular goiter,"Endocrine, nutritional and metabolic...",7952,78,1.51,0.0006018533,1.19,1.89
625.4 ,Premenstrual tension syndromes,Diseases of the genitourinary...,6523,64,1.51,0.0019679663,1.16,1.93
892 ,Open wound of foot except toe(s)...,Injury and poisoning,2054,20,1.5,0.0742379513,0.91,2.32
784 ,Symptoms involving head and neck,"Comorbidities, signs, and ill-defined...",4196,41,1.5,0.0123762262,1.08,2.04
571.9 ,Unspecified chronic liver disease...,Diseases of the digestive system,12758,124,1.5,0.0000257602,1.24,1.79
695.89 ,Other specified erythematous conditions,Diseases of the skin and subcutaneous...,3703,36,1.5,0.0237438193,1.04,2.07
388.70 ,"Otalgia, unspecified",Diseases of the nervous system,3998,39,1.5,0.0176071402,1.06,2.06
424.0 ,Mitral valve disorders,Diseases of the circulatory system,27354,265,1.5,0.0000000009857614,1.32,1.7
244.9 ,Unspecified acquired hypothyroidism,"Endocrine, nutritional and metabolic...",10408,101,1.5,0.0001466098,1.22,1.82
625.2 ,Mittelschmerz,Diseases of the genitourinary...,3897,38,1.5,0.0165346155,1.06,2.06
280.9 ,"Iron deficiency anemia, unspecified",Diseases of the blood and blood-forming...,25094,243,1.5,0.0000000046482506,1.31,1.7
281.9 ,Unspecified deficiency anemia,Diseases of the blood and blood-forming...,5428,53,1.5,0.0051441314,1.12,1.97
535.10 ,"Atrophic gastritis, without mention...",Diseases of the digestive system,3000,29,1.49,0.0401448157,0.99,2.14
794.8 ,Nonspecific abnormal results of...,"Comorbidities, signs, and ill-defined...",10859,105,1.49,0.0001244165,1.22,1.81
008.5 ,"Bacterial enteritis, unspecified",Infectious and parasitic diseases,5885,57,1.49,0.0043872814,1.13,1.94
696.1 ,Other psoriasis,Diseases of the skin and subcutaneous...,5374,52,1.49,0.0064412073,1.11,1.96
070.30 ,Viral hepatitis B without mention...,Infectious and parasitic diseases,26765,257,1.49,0.0000000035135898,1.31,1.68
078.1 ,Viral warts,Infectious and parasitic diseases,57952,553,1.49,7.977031e-18,1.36,1.62
381.01 ,Acute serous otitis media,Diseases of the nervous system,2887,28,1.49,0.047666289,0.99,2.16
137 ,Late effects of TB,Infectious and parasitic diseases,2371,23,1.49,0.071688093,0.94,2.24
614.0 ,Acute salpingitis and oophoritis,Diseases of the genitourinary...,23798,230,1.49,0.000000015904134,1.31,1.7
447.6 ,"Arteritis, unspecified",Diseases of the circulatory system,4125,40,1.49,0.0152570998,1.06,2.04
625.8 ,Other specified symptoms associated...,Diseases of the genitourinary...,2057,20,1.49,0.0746423673,0.91,2.32
625.9 ,Unspecified symptom associated...,Diseases of the genitourinary...,13567,131,1.49,0.0000220511,1.24,1.77
528.9 ,Other and unspecified diseases...,Diseases of the digestive system,55903,531,1.48,8.605707e-17,1.35,1.62
787.9 ,Other symptoms involving digestive...,"Comorbidities, signs, and ill-defined...",11157,107,1.48,0.0001524256,1.21,1.79
788.9 ,Other symptoms involving urinary...,"Comorbidities, signs, and ill-defined...",1968,19,1.48,0.0911786936,0.89,2.32
367 ,"Infantile, juvenile, and presenile...",Diseases of the nervous system,3634,35,1.48,0.0293613991,1.03,2.06
536.9 ,Unspecified functional disorder...,Diseases of the digestive system,237463,2147,1.48,1.056672e-54,1.41,1.55
573.3 ,"Hepatitis, unspecified",Diseases of the digestive system,18557,178,1.48,0.0000010979814,1.27,1.72
585 ,Chronic renal failure,Diseases of the genitourinary...,6554,63,1.48,0.0033714843,1.13,1.9
586 ,"Renal failure, unspecified",Diseases of the genitourinary...,2291,22,1.48,0.0889325751,0.92,2.24
708.1 ,Idiopathic urticaria,Diseases of the skin and subcutaneous...,10426,100,1.48,0.0002416139,1.2,1.8
427 ,Cardiac dysrhythmias,Diseases of the circulatory system,6956,67,1.48,0.0021809425,1.15,1.89
226 ,Benign neoplasm of thyroid glands,Neoplasms,5595,54,1.48,0.0058838664,1.11,1.94
455.2 ,Internal hemorrhoids with other...,Diseases of the circulatory system,8452,81,1.48,0.0011033483,1.17,1.84
617.1 ,Endometriosis of ovary,Diseases of the genitourinary...,13447,129,1.48,0.0000328027,1.23,1.76
246.9 ,Unspecified disorder of thyroid,"Endocrine, nutritional and metabolic...",23001,220,1.48,0.000000062295748,1.29,1.69
280.0 ,Iron deficiency anemia secondary...,Diseases of the blood and blood-forming...,8109,78,1.48,0.0011116285,1.17,1.85
483 ,Pneumonia due to other specified...,Diseases of the respiratory system,2298,22,1.47,0.0893934911,0.92,2.23
307.41 ,Transient disorder of initiating...,Mental disorders,4932,47,1.47,0.0127902715,1.07,1.95
690 ,Erythematosquamous dermatosis,Diseases of the skin and subcutaneous...,28261,269,1.47,0.0000000036270315,1.3,1.66
372.15 ,Parasitic conjunctivitis,Diseases of the nervous system,2508,24,1.47,0.0624020828,0.94,2.19
698.9 ,Unspecified pruritic disorder,Diseases of the skin and subcutaneous...,54900,518,1.47,6.923941e-16,1.34,1.61
110.4 ,Dermatophytosis of foot,Infectious and parasitic diseases,92017,858,1.47,1.94169e-24,1.37,1.57
599.0 ,"Urinary tract infection, site...",Diseases of the genitourinary...,226763,2051,1.47,4.62663e-52,1.4,1.55
241.0 ,Nontoxic uninodular goiter,"Endocrine, nutritional and metabolic...",2826,27,1.47,0.0596411276,0.97,2.14
461.0 ,Acute maxillary sinusitis,Diseases of the respiratory system,26560,252,1.47,0.000000015153468,1.29,1.66
462 ,Acute pharyngitis,Diseases of the respiratory system,496333,4207,1.47,3.586819e-85,1.42,1.53
311 ,"Depressive disorder, not elsewhere...",Mental disorders,9310,88,1.46,0.0009579221,1.16,1.8
799.3 ,"Debility, unspecified","Comorbidities, signs, and ill-defined...",1900,18,1.46,0.1150893061,0.86,2.31
933.0 ,Foreign body in pharynx,Injury and poisoning,16724,158,1.46,0.0000086580488,1.24,1.71
582.9 ,Chronic glomerulonephritis with...,Diseases of the genitourinary...,9413,89,1.46,0.000818298,1.17,1.79
373.33 ,Xeroderma of eyelid,Diseases of the nervous system,2849,27,1.46,0.0609434547,0.96,2.12
379.21 ,Vitreous degeneration,Diseases of the nervous system,6219,59,1.46,0.005639974,1.11,1.89
614.1 ,Chronic salpingitis and oophoritis,Diseases of the genitourinary...,3047,29,1.46,0.0540267973,0.98,2.11
239.2 ,Neoplasm of unspecified nature...,Neoplasms,4844,46,1.46,0.0153563919,1.07,1.95
240.0 ,"Goiter, specified as simple","Endocrine, nutritional and metabolic...",5470,52,1.46,0.008935878,1.09,1.92
455.9 ,Residual hemorrhoidal skin tags,Diseases of the circulatory system,3486,33,1.46,0.044233374,1,2.05
246 ,Other disorders of thyroid,"Endocrine, nutritional and metabolic...",6011,57,1.46,0.0063044325,1.1,1.89
789.0 ,Abdominal pain,"Comorbidities, signs, and ill-defined...",640629,5207,1.45,1.423146e-85,1.4,1.5
558.9 ,Other and unspecified noninfectious...,Diseases of the digestive system,459525,3887,1.45,3.031382e-75,1.39,1.51
692.70 ,Unspecified dermatitis due to...,Diseases of the skin and subcutaneous...,5081,48,1.45,0.0141569238,1.07,1.93
372.14 ,Other chronic allergic conjunctivitis,Diseases of the nervous system,137313,1256,1.45,1.541408e-32,1.37,1.54
053.9 ,Herpes zoster without mention...,Infectious and parasitic diseases,13693,129,1.45,0.0000766616,1.21,1.73
704.8 ,Other specified diseases of hair...,Diseases of the skin and subcutaneous...,30663,288,1.45,0.0000000032856429,1.29,1.64
380.22 ,Other acute otitis externa,Diseases of the nervous system,26634,250,1.45,0.000000038832138,1.27,1.65
610.0 ,Solitary cyst of breast,Diseases of the genitourinary...,5933,56,1.45,0.0075780358,1.09,1.89
455.6 ,Unspecified hemorrhoids without...,Diseases of the circulatory system,43940,410,1.45,0.000000000003726003,1.31,1.6
242.90 ,Thyrotoxicosis without mention...,"Endocrine, nutritional and metabolic...",29088,272,1.45,0.000000014414365,1.28,1.63
626.5 ,Ovulation bleeding,Diseases of the genitourinary...,5180,49,1.45,0.0119890448,1.07,1.93
490 ,"Bronchitis, not specified as acute...",Diseases of the respiratory system,47391,438,1.44,0.000000000002324225,1.3,1.58
782.0 ,Disturbance of skin sensation,"Comorbidities, signs, and ill-defined...",2350,22,1.44,0.0941833614,0.9,2.18
786.09 ,Other respiratory abnormalities,"Comorbidities, signs, and ill-defined...",11436,107,1.44,0.0003660628,1.18,1.74
564.0 ,Constipation,Diseases of the digestive system,120468,1094,1.44,3.084517e-27,1.35,1.53
698.8 ,Other specified pruritic conditions,Diseases of the skin and subcutaneous...,15496,145,1.44,0.0000377959,1.22,1.7
706.2 ,Sebaceous cyst,Diseases of the skin and subcutaneous...,11737,110,1.44,0.0002807304,1.18,1.74
595.0 ,Acute cystitis,Diseases of the genitourinary...,157895,1429,1.44,3.457215e-35,1.37,1.53
708.9 ,"Urticaria, unspecified",Diseases of the skin and subcutaneous...,164663,1486,1.44,4.048802e-36,1.36,1.52
117.9 ,Other and unspecified mycoses,Infectious and parasitic diseases,10996,103,1.44,0.0004421966,1.18,1.75
611.0 ,Inflammatory disease of breast,Diseases of the genitourinary...,19608,183,1.44,0.0000041091996,1.24,1.67
388.8 ,Other disorders of ear,Diseases of the nervous system,3846,36,1.44,0.0347600477,1.01,2
217 ,Benign neoplasm of breast,Neoplasms,87301,803,1.44,2.413631e-21,1.34,1.55
615 ,"Inflammatory diseases of uterus,...",Diseases of the genitourinary...,9431,88,1.44,0.0013068578,1.15,1.77
229.9 ,Benign neoplasm of unspecified...,Neoplasms,2673,25,1.44,0.0714707794,0.93,2.13
466.0 ,Acute bronchitis,Diseases of the respiratory system,644097,5205,1.44,1.683949e-81,1.38,1.49
486 ,"Pneumonia, organism unspecified",Diseases of the respiratory system,25239,234,1.43,0.00000028838632,1.25,1.63
894 ,Multiple and unspecified open...,Injury and poisoning,3447,32,1.43,0.055376012,0.97,2.02
911.0 ,"Abrasion or friction burn of trunk,...",Injury and poisoning,3107,29,1.43,0.0574196767,0.96,2.07
787.0 ,Nausea and vomiting,"Comorbidities, signs, and ill-defined...",62111,570,1.43,0.000000000000003248743,1.31,1.56
788.6 ,Other abnormality of urination,"Comorbidities, signs, and ill-defined...",2156,20,1.43,0.1379833521,0.87,2.21
682 ,Other cellulitis and abscess,Diseases of the skin and subcutaneous...,5370,50,1.43,0.0170009009,1.06,1.89
571.8 ,Other chronic nonalcoholic liver...,Diseases of the digestive system,6130,57,1.43,0.0106984424,1.08,1.86
009.0 ,"Infectious colitis, enteritis,...",Infectious and parasitic diseases,80861,740,1.43,3.188195e-19,1.33,1.54
611.72 ,Lump or mass in breast,Diseases of the genitourinary...,54738,503,1.43,0.0000000000001316874,1.3,1.56
239.3 ,Neoplasm of unspecified nature...,Neoplasms,10855,101,1.43,0.0006345482,1.16,1.74
239.9 ,"Neoplasm of unspecified nature,...",Neoplasms,1936,18,1.43,0.1544023062,0.84,2.26
620.8 ,Other noninflammatory disorders...,Diseases of the genitourinary...,2358,22,1.43,0.0951316499,0.9,2.18
624.9 ,Unspecified noninflammatory disorder...,Diseases of the genitourinary...,2360,22,1.43,0.0953774387,0.9,2.17
472.2 ,Chronic nasopharyngitis,Diseases of the respiratory system,34350,318,1.43,0.0000000023814025,1.28,1.6
370.49 ,Other keratoconjunctivitis,Diseases of the nervous system,5854,54,1.42,0.0143963758,1.06,1.85
692.9 ,"Contact dermatitis and other eczema,...",Diseases of the skin and subcutaneous...,409607,3451,1.42,1.943993e-62,1.36,1.48
590.80 ,"Pyelonephritis, unspecified",Diseases of the genitourinary...,3885,36,1.42,0.044954752,1,1.98
428.0 ,"Congestive heart failure, unspecified",Diseases of the circulatory system,2704,25,1.42,0.0922779409,0.92,2.1
784.7 ,Epistaxis,"Comorbidities, signs, and ill-defined...",16615,152,1.41,0.0000691989,1.19,1.66
786.2 ,Cough,"Comorbidities, signs, and ill-defined...",111123,992,1.41,1.764638e-22,1.31,1.5
686.9 ,Unspecified local infection of...,Diseases of the skin and subcutaneous...,110293,990,1.41,4.69695e-23,1.32,1.51
564.8 ,Other specified function disorder...,Diseases of the digestive system,29320,267,1.41,0.00000016140883,1.24,1.59
373.00 ,"Blepharitis, unspecified",Diseases of the nervous system,24371,222,1.41,0.0000017915072,1.23,1.61
702.1 ,Seborrheic keratosis,Diseases of the skin and subcutaneous...,6881,63,1.41,0.0104867727,1.08,1.81
070.9 ,Unspecified viral hepatitis without...,Infectious and parasitic diseases,8537,78,1.41,0.0045321933,1.11,1.76
379.91 ,Pain in or around eye,Diseases of the nervous system,3385,31,1.41,0.0679648819,0.95,2
218.9 ,"Leiomyoma of uterus, unspecified",Neoplasms,81051,732,1.41,8.635039e-18,1.31,1.52
617.0 ,Endometriosis of uterus,Diseases of the genitourinary...,26370,241,1.41,0.00000051898031,1.24,1.61
464.1 ,Acute tracheitis,Diseases of the respiratory system,22263,204,1.41,0.0000031997711,1.22,1.63
472.1 ,Chronic pharyngitis,Diseases of the respiratory system,44681,406,1.41,0.0000000001198036,1.27,1.56
528 ,"Disease of the oral soft tissues,...",Diseases of the digestive system,2199,20,1.4,0.1426101347,0.85,2.16
533.30 ,Acute peptic ulcer of unspecified...,Diseases of the digestive system,7928,72,1.4,0.0077076038,1.09,1.76
535 ,Gastritis and duodenitis,Diseases of the digestive system,35276,319,1.4,0.000000019063954,1.25,1.56
790.6 ,Other abnormal blood chemistry,"Comorbidities, signs, and ill-defined...",3842,35,1.4,0.0556657138,0.97,1.95
