781.9 ,Other symptoms involving nervous...,"Comorbidities, signs, and ill-defined...",6420,86,2.07,0.0000000020722578,1.65,2.57
225.0 ,Benign neoplasm of brain,Neoplasms,2616,35,2.07,0.000124293,1.44,2.88
296.30 ,"Major depressive affective disorder,...",Mental disorders,3909,52,2.06,0.0000033480293,1.53,2.7
524.62 ,"Temporomandibular joint disorders,...",Diseases of the digestive system,3377,45,2.06,0.0000137606,1.5,2.76
919.0 ,"Abrasion or friction burn of other,...",Injury and poisoning,17258,227,2.05,1.015009e-21,1.79,2.34
825.25 ,Closed fracture of metatarsal...,Injury and poisoning,2558,34,2.05,0.0001737173,1.42,2.88
873.40 ,"Open wound of face, unspecified...",Injury and poisoning,14245,186,2.03,1.008653e-17,1.74,2.35
337.9 ,Unspecified disorder of autonomic...,Diseases of the nervous system,2439,32,2.03,0.0003348174,1.38,2.87
915.0 ,"Abrasion or friction burn of finger(s),...",Injury and poisoning,2431,32,2.03,0.0003258715,1.39,2.88
005.9 ,"Food poisoning, unspecified",Infectious and parasitic diseases,2128,28,2.03,0.0006372356,1.35,2.95
719.44 ,"Pain in joint, hand",Diseases of the musculoskeletal...,3721,49,2.03,0.0000084940046,1.5,2.7
345.90 ,"Epilepsy, unspecified, without...",Diseases of the nervous system,3594,47,2.02,0.0000156762,1.48,2.69
684 ,Impetigo,Diseases of the skin and subcutaneous...,4281,56,2.02,0.0000023015703,1.52,2.63
816.00 ,Closed fracture of phalanx or...,Injury and poisoning,2595,34,2.02,0.0002017341,1.4,2.84
719.99 ,"Unspecified disorder of joint,...",Diseases of the musculoskeletal...,2826,37,2.02,0.0001430152,1.42,2.79
847 ,Sprains and strains of other and...,Injury and poisoning,2365,31,2.02,0.0004426798,1.37,2.88
892.1 ,Open wound of foot except toe(s)...,Injury and poisoning,2376,31,2.01,0.0004586215,1.36,2.87
350.1 ,Trigeminal neuralgia,Diseases of the nervous system,2382,31,2.01,0.000468217,1.36,2.86
565.0 ,Anal fissure,Diseases of the digestive system,5624,73,2.01,0.00000011682837,1.57,2.53
287.2 ,Other nonthrombocytopenic purpuras,Diseases of the blood and blood-forming...,2079,27,2,0.0009377267,1.32,2.93
780.3 ,Convulsions,"Comorbidities, signs, and ill-defined...",2233,29,2,0.000817952,1.34,2.89
682.0 ,Cellulitis and abscess of face,Diseases of the skin and subcutaneous...,3821,49,1.98,0.000018149,1.46,2.63
367.4 ,Presbyopia,Diseases of the nervous system,5969,76,1.97,0.00000011547131,1.55,2.47
575.0 ,Acute cholecystitis,Diseases of the digestive system,1879,24,1.97,0.0022766054,1.26,2.94
519.9 ,Unspecified disease of respiratory...,Diseases of the respiratory system,6799,86,1.96,0.000000024425308,1.56,2.42
914.6 ,Superficial foreign body (splinter)...,Injury and poisoning,6166,78,1.96,0.00000011913709,1.54,2.45
893.0 ,"Open wound of toe(s), without...",Injury and poisoning,6653,84,1.95,0.000000041785571,1.55,2.42
307.42 ,Persistent disorder of initiating...,Mental disorders,7124,90,1.95,0.000000009984456,1.57,2.41
555.0 ,Regional enteritis of small intestine,Diseases of the digestive system,3725,47,1.95,0.000036364,1.43,2.6
614.6 ,"Pelvic peritoneal adhesions, female...",Diseases of the genitourinary...,10174,128,1.95,0.00000000001517788,1.62,2.32
414.0 ,Coronary atherosclerosis,Diseases of the circulatory system,4985,63,1.95,0.0000015403064,1.5,2.5
296.2 ,"Major depressive disorder, single...",Mental disorders,4606,58,1.94,0.0000053851558,1.47,2.52
782.3 ,Edema,"Comorbidities, signs, and ill-defined...",24520,305,1.94,5.457406e-25,1.73,2.18
709.2 ,Scar conditions and fibrosis of...,Diseases of the skin and subcutaneous...,7161,90,1.94,0.000000015474822,1.56,2.39
910.0 ,"Abrasion or friction burn of face,...",Injury and poisoning,6809,85,1.93,0.000000042599685,1.54,2.39
682.8 ,Cellulitis and abscess of other...,Diseases of the skin and subcutaneous...,5376,67,1.93,0.000001517856,1.49,2.45
780.50 ,"Sleep disturbance, unspecified","Comorbidities, signs, and ill-defined...",27661,340,1.92,8.31368e-27,1.72,2.14
786.50 ,"Chest pain, unspecified","Comorbidities, signs, and ill-defined...",49935,606,1.92,1.894044e-45,1.76,2.08
710.0 ,Systemic lupus erythematosus,Diseases of the musculoskeletal...,7797,97,1.92,0.0000000077005516,1.56,2.35
386.2 ,Vertigo of central origin,Diseases of the nervous system,7181,89,1.92,0.000000038877984,1.54,2.36
883.1 ,"Open wound of finger(s), complicated",Injury and poisoning,5731,71,1.91,0.00000093320098,1.49,2.42
532.90 ,"Duodenal ulcer, unspecified as...",Diseases of the digestive system,16841,207,1.91,6.950027e-17,1.65,2.19
788.1 ,Dysuria,"Comorbidities, signs, and ill-defined...",9578,118,1.91,0.0000000002932804,1.58,2.29
593.9 ,Unspecified disorder of kidney...,Diseases of the genitourinary...,2342,29,1.91,0.0017560752,1.28,2.75
621.2 ,Hypertrophy of uterus,Diseases of the genitourinary...,2824,35,1.91,0.0005822137,1.33,2.67
727 ,"Other disorders of synovium tendon,...",Diseases of the musculoskeletal...,7678,95,1.91,0.000000013899481,1.54,2.34
300.3 ,Obsessive-compulsive disorders,Mental disorders,2024,25,1.9,0.0032268874,1.23,2.82
300.89 ,Other somatoform disorders,Mental disorders,4561,56,1.9,0.0000127912,1.43,2.47
920 ,"Contusion of face, scalp, and...",Injury and poisoning,25495,311,1.9,4.184423e-24,1.69,2.13
367.5 ,Disorders of accommodation,Diseases of the nervous system,2110,26,1.9,0.002580135,1.24,2.79
272.0 ,Pure hypercholesterolemia,"Endocrine, nutritional and metabolic...",8546,105,1.9,0.0000000031886587,1.55,2.31
578.9 ,Hemorrhage of gastrointestinal...,Diseases of the digestive system,7687,94,1.89,0.000000022928097,1.52,2.32
728 ,"Disorders of muscle, ligament,...",Diseases of the musculoskeletal...,13203,160,1.88,0.0000000000007240368,1.6,2.2
733.00 ,"Osteoporosis, unspecified",Diseases of the musculoskeletal...,10940,133,1.88,0.00000000005471486,1.57,2.24
070.51 ,Acute hepatitis C without mention...,Infectious and parasitic diseases,5494,67,1.88,0.0000030421302,1.46,2.4
386.1 ,Other and unspecified peripheral...,Diseases of the nervous system,7661,93,1.88,0.000000047374428,1.51,2.3
427.89 ,Other specified cardiac dysrhythmias,Diseases of the circulatory system,5681,69,1.88,0.0000020502735,1.46,2.38
279.4 ,Autoimmune disease not elsewhere...,"Endocrine, nutritional and metabolic...",2463,30,1.88,0.0015283929,1.26,2.69
923.2 ,"Contusion of wrist and hand(s),...",Injury and poisoning,1900,23,1.87,0.0059797523,1.18,2.81
839.8 ,"Closed dislocation, multiple and...",Injury and poisoning,4528,55,1.87,0.0000258359,1.41,2.45
692.1 ,Contact dermatitis and other eczema...,Diseases of the skin and subcutaneous...,4290,52,1.87,0.0000376671,1.39,2.46
401.1 ,Benign essential hypertension,Diseases of the circulatory system,8439,102,1.87,0.000000013341142,1.52,2.27
372.53 ,Conjunctival xerosis,Diseases of the nervous system,4311,52,1.86,0.0000407365,1.39,2.45
583.9 ,"Nephritis and nephropathy, not...",Diseases of the genitourinary...,6561,79,1.86,0.00000067921967,1.47,2.32
216.6 ,Benign neoplasm of skin of upper...,Neoplasms,3483,42,1.86,0.0002888852,1.34,2.52
617.8 ,Endometriosis of other specified...,Diseases of the genitourinary...,2400,29,1.86,0.0020590352,1.24,2.68
625 ,Pain and other symptoms associated...,Diseases of the genitourinary...,2575,31,1.86,0.0019162971,1.26,2.64
625.6 ,"Stress incontinence, female",Diseases of the genitourinary...,7569,91,1.86,0.000000089857404,1.49,2.29
300.9 ,Unspecified nonpsychotic mental...,Mental disorders,50495,592,1.85,3.836054e-40,1.7,2.01
367.89 ,Other disorders of refraction...,Diseases of the nervous system,7279,87,1.85,0.00000025142234,1.48,2.28
574 ,Cholelithiasis,Diseases of the digestive system,4426,53,1.85,0.0000484561,1.38,2.42
588.9 ,Unspecified disorder resulting...,Diseases of the genitourinary...,3498,42,1.85,0.0002976935,1.33,2.51
848 ,Other and ill-defined sprains...,Injury and poisoning,2750,33,1.85,0.0012003248,1.27,2.61
854.01 ,Intracranial injury of other and...,Injury and poisoning,5287,63,1.84,0.0000105949,1.41,2.36
531.90 ,"Gastric ulcer, unspecified as...",Diseases of the digestive system,20393,242,1.84,1.132058e-17,1.62,2.1
532.30 ,Acute duodenal ulcer without mention...,Diseases of the digestive system,3436,41,1.84,0.0003974352,1.32,2.5
682.2 ,Cellulitis and abscess of trunk,Diseases of the skin and subcutaneous...,2005,24,1.84,0.0051247793,1.18,2.75
933 ,Foreign body in pharynx and larynx,Injury and poisoning,2173,26,1.84,0.0045101328,1.2,2.71
573.9 ,Unspecified disorder of liver,Diseases of the digestive system,8911,106,1.84,0.000000015187422,1.5,2.23
884.0 ,Multiple and unspecified open...,Injury and poisoning,30520,358,1.83,1.00032e-24,1.64,2.04
524.6 ,Temporomandibular joint disorders,Diseases of the digestive system,2612,31,1.83,0.0020799466,1.24,2.6
680.8 ,Carbuncle and furuncle of other...,Diseases of the skin and subcutaneous...,3038,36,1.83,0.000937599,1.28,2.54
153.9 ,"Malignant neoplasm of colon, unspecified...",Neoplasms,2354,28,1.83,0.0029353071,1.21,2.66
353.2 ,"Cervical root lesions, not elsewhere...",Diseases of the nervous system,8513,100,1.82,0.000000054797169,1.47,2.21
533.90 ,"Peptic ulcer of unspecified site,...",Diseases of the digestive system,89865,1018,1.82,1.456604e-62,1.7,1.94
683 ,Acute lymphadenitis,Diseases of the skin and subcutaneous...,6182,73,1.82,0.0000035851907,1.43,2.3
454.9 ,Asymptomatic varicose veins,Diseases of the circulatory system,4825,57,1.82,0.0000329707,1.38,2.37
296 ,Disorganized type,Mental disorders,5030,59,1.81,0.0000318021,1.37,2.34
637.9 ,Legally unspecified abortion without...,"Complications of pregnancy, childbirth,...",2126,25,1.81,0.0062980062,1.17,2.68
367.20 ,"Astigmatism, unspecified",Diseases of the nervous system,3063,36,1.81,0.0010080516,1.27,2.52
250.0 ,Diabetes Mellitus w/m of complication,"Endocrine, nutritional and metabolic...",8603,101,1.81,0.000000060171718,1.47,2.21
879.8 ,Open wound(s) (multiple) of unspecified...,Injury and poisoning,15611,181,1.8,0.0000000000009126381,1.54,2.08
306.9 ,Unspecified psychophysiological...,Mental disorders,24488,284,1.8,2.827427e-19,1.6,2.03
346.1 ,Common migraine,Diseases of the nervous system,7025,82,1.8,0.0000011416931,1.43,2.24
346.9 ,"Migraine, unspecified",Diseases of the nervous system,30264,349,1.8,5.794599e-23,1.61,2
381.60 ,"Obstruction of Eustachian tube,...",Diseases of the nervous system,2570,30,1.8,0.002943822,1.21,2.58
599.9 ,Unspecified disorder of urethra...,Diseases of the genitourinary...,7914,92,1.8,0.00000037346764,1.44,2.21
386.9 ,Unspecified vertiginous syndromes...,Diseases of the nervous system,21003,243,1.8,1.544166e-16,1.58,2.04
402.90 ,Unspecified hypertensive heart...,Diseases of the circulatory system,11487,134,1.8,0.0000000005339446,1.51,2.14
413.9 ,Other and unspecified angina pectoris,Diseases of the circulatory system,9630,112,1.8,0.000000017839921,1.48,2.17
250.90 ,"Diabetes with unspecified complication,...","Endocrine, nutritional and metabolic...",7726,90,1.8,0.00000039685535,1.44,2.22
476.1 ,Chronic laryngotracheitis,Diseases of the respiratory system,2398,28,1.8,0.0046823115,1.19,2.61
353 ,Nerve root and plexus disorders,Diseases of the nervous system,1977,23,1.79,0.01074526,1.13,2.7
362.63 ,Lattice degeneration,Diseases of the nervous system,2753,32,1.79,0.0027274394,1.22,2.54
560.9 ,Unspecified intestinal obstruction,Diseases of the digestive system,4492,52,1.79,0.0001246442,1.33,2.35
427.2 ,"Paroxysmal tachycardia, unspecified",Diseases of the circulatory system,2415,28,1.79,0.00484919,1.18,2.59
455.5 ,External hemorrhoids with other...,Diseases of the circulatory system,3361,39,1.79,0.000799606,1.27,2.45
627.2 ,Symptomatic menopausal or female...,Diseases of the genitourinary...,21407,246,1.79,2.097798e-16,1.57,2.03
289.3 ,"Lymphadenitis, unspecified, except...",Diseases of the blood and blood-forming...,6589,76,1.78,0.0000050512798,1.4,2.23
798.0 ,Sudden infant death syndrome,"Comorbidities, signs, and ill-defined...",1909,22,1.78,0.014239019,1.11,2.7
038.9 ,Unspecified septicemia,Infectious and parasitic diseases,3455,40,1.78,0.000668765,1.27,2.44
574.20 ,Calculus of gallbladder without...,Diseases of the digestive system,13326,153,1.78,0.00000000009783656,1.5,2.09
402.10 ,Benign hypertensive heart disease...,Diseases of the circulatory system,3292,38,1.78,0.0010393192,1.26,2.45
854.0 ,Intracranial injury of other and...,Injury and poisoning,2968,34,1.77,0.0019636319,1.22,2.47
523.0 ,Acute gingivitis,Diseases of the digestive system,5669,65,1.77,0.0000308274,1.36,2.26
531.70 ,Chronic gastric ulcer without...,Diseases of the digestive system,6908,79,1.77,0.000004119251,1.39,2.2
788.3 ,Incontinence of urine,"Comorbidities, signs, and ill-defined...",9850,113,1.77,0.000000027180038,1.46,2.14
535.4 ,Other specified gastritis,Diseases of the digestive system,9775,112,1.77,0.000000034186835,1.46,2.14
692.5 ,Contact dermatitis and other eczema...,Diseases of the skin and subcutaneous...,5832,67,1.77,0.0000192448,1.37,2.26
989.5 ,Toxic effect of venom,Injury and poisoning,6030,69,1.77,0.0000184483,1.37,2.24
111.8 ,Other specified dermatomycoses,Infectious and parasitic diseases,2089,24,1.77,0.0090487065,1.13,2.64
414.9 ,"Chronic ischemic heart disease,...",Diseases of the circulatory system,13669,156,1.77,0.0000000001137279,1.5,2.07
727.43 ,"Ganglion, unspecified",Diseases of the musculoskeletal...,5705,65,1.76,0.0000327441,1.35,2.25
300.00 ,"Anxiety state, unspecified",Mental disorders,85280,942,1.76,3.010552e-53,1.65,1.88
780.59 ,Other sleep disturbances,"Comorbidities, signs, and ill-defined...",6395,73,1.76,0.0000111147,1.38,2.22
784.0 ,Headache,"Comorbidities, signs, and ill-defined...",314763,3176,1.76,7.94568e-147,1.69,1.83
357.4 ,Polyneuropathy in other diseases...,Diseases of the nervous system,3760,43,1.76,0.0007262401,1.27,2.38
692.3 ,Contact dermatitis and other eczema...,Diseases of the skin and subcutaneous...,12453,142,1.76,0.000000000856404,1.48,2.08
995.2 ,Unspecified adverse effect od...,Injury and poisoning,2455,28,1.76,0.0053781435,1.16,2.55
381.4 ,"Nonsuppurative otitis media, not...",Diseases of the nervous system,4567,52,1.76,0.0002035838,1.31,2.31
272.4 ,Other and unspecified hyperlipidemia,"Endocrine, nutritional and metabolic...",41143,462,1.76,1.343817e-27,1.6,1.93
729.8 ,Other musculoskeletal symptoms...,Diseases of the musculoskeletal...,2283,26,1.75,0.0084572529,1.14,2.58
300.02 ,Generalized anxiety disorder,Mental disorders,14763,167,1.75,0.00000000005173911,1.49,2.04
995.3 ,"Allergy, unspecified, not elsewhere...",Injury and poisoning,19222,217,1.75,0.00000000000007252047,1.52,2
401.9 ,Unspecified essential hypertension,Diseases of the circulatory system,39944,446,1.75,3.030171e-26,1.58,1.92
250.00 ,Diabetes mellitus without mention...,"Endocrine, nutritional and metabolic...",35767,401,1.75,4.698792e-24,1.58,1.94
574.10 ,Calculus of gallbladder with other...,Diseases of the digestive system,3459,39,1.74,0.0013890813,1.23,2.38
386.00 ,"Minihre's disease, unspecified",Diseases of the nervous system,18073,203,1.74,0.0000000000006325625,1.51,2
300.4 ,Dysthymic disorder,Mental disorders,41740,461,1.73,3.496621e-26,1.57,1.9
780.8 ,Generalized hyperhidrosis,"Comorbidities, signs, and ill-defined...",4176,47,1.73,0.0004821627,1.27,2.31
346.0 ,Classical migraine,Diseases of the nervous system,3746,42,1.73,0.0010473049,1.24,2.34
535.00 ,"Acute gastritis, without mention...",Diseases of the digestive system,213537,2210,1.73,2.55263e-105,1.65,1.81
791.0 ,Proteinuria,"Comorbidities, signs, and ill-defined...",4716,53,1.73,0.0002578488,1.29,2.27
558.1 ,Gastroenteritis and colitis due...,Diseases of the digestive system,2139,24,1.73,0.0143662507,1.1,2.58
706.8 ,Other specified diseases of sebaceous...,Diseases of the skin and subcutaneous...,4019,45,1.73,0.0007667129,1.26,2.31
883.0 ,"Open wound of finger(s), without...",Injury and poisoning,32307,357,1.72,1.449944e-20,1.54,1.91
610.1 ,Diffuse cystic mastopathy,Diseases of the genitourinary...,27498,304,1.72,9.527384e-18,1.53,1.93
611.6 ,Galactorrhea not associated with...,Diseases of the genitourinary...,2865,32,1.72,0.004858952,1.17,2.44
389.9 ,Unspecified hearing loss,Diseases of the nervous system,6982,78,1.72,0.0000097493437,1.36,2.16
401 ,Essential hypertension,Diseases of the circulatory system,5563,62,1.72,0.0000805963,1.31,2.21
881.02 ,"Open wound of wrist, without mention...",Injury and poisoning,2340,26,1.71,0.009728918,1.11,2.51
365.9 ,Unspecified glaucoma,Diseases of the nervous system,4331,48,1.71,0.0006083451,1.26,2.27
367.53 ,Spasm of accommodation,Diseases of the nervous system,6664,74,1.71,0.000023974,1.34,2.16
693.1 ,Dermatitis due to food taken internally,Diseases of the skin and subcutaneous...,3429,38,1.71,0.0019931825,1.21,2.35
211.5 ,Benign neoplasm of liver and biliary...,Neoplasms,3417,38,1.71,0.0019255149,1.21,2.36
465.9 ,Acute upper respiratory infections...,Diseases of the respiratory system,1349363,9767,1.71,1.25026e-107,1.63,1.8
850 ,Concussion,Injury and poisoning,5062,56,1.71,0.0002192563,1.29,2.22
780.52 ,"Insomnia, unspecified","Comorbidities, signs, and ill-defined...",85203,909,1.7,1.962707e-45,1.58,1.81
681.11 ,Onychia and paronychia of toe,Diseases of the skin and subcutaneous...,10656,117,1.7,0.00000017512782,1.4,2.04
575.1 ,Other cholecystitis,Diseases of the digestive system,1901,21,1.7,0.0213897477,1.05,2.61
070.3 ,Viral hepatitis B without mention...,Infectious and parasitic diseases,4178,46,1.7,0.0009722194,1.24,2.27
253.4 ,Other anterior pituitary disorders,"Endocrine, nutritional and metabolic...",3712,41,1.7,0.0014721062,1.22,2.31
724.9 ,Other unspecified back disorders,Diseases of the musculoskeletal...,14491,159,1.7,0.000000001074235,1.44,1.99
295.90 ,"Unspecified schizophrenia, unspecified",Mental disorders,3375,37,1.69,0.003550895,1.19,2.33
882.0 ,Open wound of hand except finger(s)...,Injury and poisoning,15215,166,1.69,0.0000000007455419,1.44,1.97
307.81 ,Tension headache,Mental disorders,39206,424,1.69,1.66382e-22,1.53,1.86
788.0 ,Renal colic,"Comorbidities, signs, and ill-defined...",9428,103,1.69,0.0000012881337,1.37,2.05
682.9 ,Cellulitis and abscess of unspecified...,Diseases of the skin and subcutaneous...,47757,515,1.69,8.203332e-27,1.54,1.85
564.1 ,Irritable bowel syndrome,Diseases of the digestive system,72913,780,1.69,2.200972e-39,1.57,1.82
569.9 ,Unspecified disorder of intestine,Diseases of the digestive system,7015,77,1.69,0.0000203407,1.33,2.12
110.8 ,Dermatophytosis of other specified...,Infectious and parasitic diseases,2002,22,1.69,0.0245855174,1.06,2.57
443.9 ,"Peripheral vascular disease, unspecified",Diseases of the circulatory system,4733,52,1.69,0.0004000233,1.26,2.23
478.4 ,Polyp of vocal cord or larynx,Diseases of the respiratory system,10575,115,1.68,0.00000031253058,1.38,2.02
634.91 ,"Spontaneous abortion, without...","Complications of pregnancy, childbirth,...",4118,45,1.68,0.0012652072,1.23,2.26
780.4 ,Dizziness and giddiness,"Comorbidities, signs, and ill-defined...",235670,2362,1.68,5.6222e-100,1.6,1.76
786.01 ,Hyperventilation,"Comorbidities, signs, and ill-defined...",6499,71,1.68,0.0000530849,1.31,2.13
535.40 ,"Other specified gastritis, without...",Diseases of the digestive system,31095,336,1.68,5.270709e-18,1.5,1.88
571.5 ,Cirrhosis of liver without mention...,Diseases of the digestive system,3948,43,1.68,0.0014737857,1.21,2.27
615.1 ,Chronic inflammatory diseases...,Diseases of the genitourinary...,2286,25,1.68,0.0131608046,1.09,2.49
256.8 ,Other ovarian dysfunction,"Endocrine, nutritional and metabolic...",5219,57,1.68,0.000272722,1.27,2.19
530.9 ,Unspecified disorder of esophagus,Diseases of the digestive system,4701,51,1.67,0.000720073,1.24,2.2
531.30 ,Acute gastric ulcer without mention...,Diseases of the digestive system,5735,62,1.67,0.0001989829,1.27,2.14
560.39 ,Other impaction of intestine,Diseases of the digestive system,2488,27,1.67,0.0120349359,1.1,2.44
959.9 ,Unspecified site injury,Injury and poisoning,2211,24,1.67,0.0167423134,1.07,2.49
578.1 ,Blood in stool,Diseases of the digestive system,2028,22,1.67,0.0255395042,1.04,2.54
702.8 ,Other specified dermatoses,Diseases of the skin and subcutaneous...,6753,73,1.67,0.0000541628,1.3,2.1
704.9 ,Unspecified disease of hair and...,Diseases of the skin and subcutaneous...,2125,23,1.67,0.0207919935,1.05,2.51
386.11 ,Benign paroxysmal positional vertigo,Diseases of the nervous system,7191,78,1.67,0.0000260928,1.32,2.09
427.9 ,"Cardiac dysrhythmia, unspecified",Diseases of the circulatory system,32960,354,1.67,1.576514e-18,1.5,1.86
448.1 ,"Nevus, non-neoplastic",Diseases of the circulatory system,1935,21,1.67,0.0235327777,1.03,2.56
780 ,General symptoms,"Comorbidities, signs, and ill-defined...",4279,46,1.66,0.0015718715,1.21,2.21
532 ,Duodenal ulcer,Diseases of the digestive system,6856,74,1.66,0.0000607744,1.3,2.09
532.9 ,"Duodenal ulcer, unspecified as...",Diseases of the digestive system,4356,47,1.66,0.0012506117,1.22,2.22
536.8 ,Dyspepsia and other specified...,Diseases of the digestive system,115013,1193,1.66,2.786571e-54,1.56,1.77
935.1 ,Foreign body in esophagus,Injury and poisoning,2312,25,1.66,0.0187088385,1.07,2.46
945.24 ,"Blisters, epidermal loss [second...",Injury and poisoning,1950,21,1.66,0.0327363712,1.02,2.54
592.0 ,Calculus of kidney,Diseases of the genitourinary...,22109,237,1.66,0.000000000000922051,1.45,1.89
596.5 ,Other functional disorders of...,Diseases of the genitourinary...,9276,100,1.66,0.0000028259466,1.35,2.03
597.80 ,"Urethritis, unspecified",Diseases of the genitourinary...,29804,318,1.66,2.281304e-16,1.48,1.86
133.0 ,Scabies,Infectious and parasitic diseases,7318,79,1.66,0.0000300029,1.32,2.08
256.3 ,Other ovarian failure,"Endocrine, nutritional and metabolic...",3807,41,1.66,0.00237872,1.19,2.26
272.2 ,Mixed hyperlipidemia,"Endocrine, nutritional and metabolic...",19739,211,1.66,0.00000000002039733,1.44,1.9
298.9 ,Unspecified psychosis,Mental disorders,3264,35,1.65,0.0060731163,1.15,2.3
785.6 ,Enlargement of lymph nodes,"Comorbidities, signs, and ill-defined...",6639,71,1.65,0.0000909313,1.28,2.08
681.02 ,Onychia and paronychia of finger,Diseases of the skin and subcutaneous...,6433,69,1.65,0.0001299963,1.28,2.1
555.1 ,Regional enteritis of large intestine,Diseases of the digestive system,4012,43,1.65,0.0021871653,1.19,2.23
556 ,Idiopathic proctocolitis,Diseases of the digestive system,3629,39,1.65,0.0035759362,1.17,2.27
574.2 ,Calculus of gallbladder without...,Diseases of the digestive system,4854,52,1.65,0.0008773143,1.23,2.17
386.12 ,Vestibular neuronitis,Diseases of the nervous system,9837,105,1.65,0.0000022362273,1.34,2
614.4 ,Chronic or unspecified parametritis...,Diseases of the genitourinary...,10688,114,1.65,0.00000092478175,1.36,1.98
493.91 ,"Asthma, unspecified type, with...",Diseases of the respiratory system,4331,46,1.64,0.001736317,1.19,2.19
496 ,"Chronic airway obstruction, not...",Diseases of the respiratory system,7312,78,1.64,0.0000562295,1.3,2.06
306.2 ,Cardiovascular malfunction arising...,Mental disorders,3573,38,1.64,0.0046593538,1.16,2.25
780.7 ,Malaise and fatigue,"Comorbidities, signs, and ill-defined...",63056,659,1.64,1.484676e-30,1.52,1.78
531 ,Gastric ulcer,Diseases of the digestive system,7707,82,1.64,0.0000352112,1.3,2.04
786.00 ,"Respiratory abnormality, unspecified","Comorbidities, signs, and ill-defined...",4226,45,1.64,0.0020515167,1.19,2.2
786.51 ,Precordial pain,"Comorbidities, signs, and ill-defined...",5810,62,1.64,0.0003001908,1.26,2.11
368.13 ,Visual discomfort,Diseases of the nervous system,63802,666,1.64,9.828019e-31,1.52,1.78
597 ,"Urethritis, not sexually transmitted,...",Diseases of the genitourinary...,2907,31,1.64,0.0104945029,1.11,2.34
455.8 ,Unspecified hemorrhoids with other...,Diseases of the circulatory system,12529,133,1.64,0.00000014473816,1.37,1.95
726 ,Peripheral enthesopathies and...,Diseases of the musculoskeletal...,3476,37,1.64,0.0057074843,1.15,2.26
854.09 ,Intracranial injury of other and...,Injury and poisoning,2641,28,1.63,0.0147728115,1.08,2.37
295.30 ,"Paranoid type schizophrenia, unspecified",Mental disorders,2457,26,1.63,0.0169969099,1.06,2.39
882.1 ,Open wound of hand except finger(s)...,Injury and poisoning,1978,21,1.63,0.0342333244,1.01,2.51
493.10 ,"Intrinsic asthma, unspecified",Diseases of the respiratory system,2355,25,1.63,0.0201919668,1.05,2.42
528.2 ,Oral aphthae,Diseases of the digestive system,23849,251,1.63,0.000000000001107562,1.43,1.85
346 ,Migraine,Diseases of the nervous system,6731,71,1.63,0.0001387376,1.27,2.06
530.1 ,Esophagitis,Diseases of the digestive system,32714,342,1.63,2.127911e-16,1.45,1.81
531.00 ,"Acute gastric ulcer with hemorrhage,...",Diseases of the digestive system,1982,21,1.63,0.0344845207,1.01,2.5
931 ,Foreign body in ear,Injury and poisoning,6321,67,1.63,0.0002140295,1.26,2.08
693.0 ,Dermatitis due to drugs and medicines...,Diseases of the skin and subcutaneous...,8221,87,1.63,0.0000252338,1.3,2.02
372.20 ,"Blepharoconjunctivitis, unspecified",Diseases of the nervous system,12040,127,1.63,0.00000038145078,1.36,1.94
710.2 ,Sicca syndrome,Diseases of the musculoskeletal...,7266,77,1.63,0.0000727894,1.29,2.05
784.2 ,"Swelling, mass, or lump in head...","Comorbidities, signs, and ill-defined...",7920,83,1.62,0.0000466308,1.28,2.01
349.89 ,Other specified disorders of nervous...,Diseases of the nervous system,3508,37,1.62,0.0059682946,1.14,2.24
933.1 ,Foreign body in larynx,Injury and poisoning,12656,133,1.62,0.00000029907125,1.36,1.93
558.2 ,Toxic gastroenteritis and colitis,Diseases of the digestive system,3810,40,1.62,0.0045221641,1.15,2.21
564.5 ,Functional diarrhea,Diseases of the digestive system,30260,315,1.62,0.000000000000005655361,1.44,1.81
372.40 ,"Pterygium, unspecified",Diseases of the nervous system,4755,50,1.62,0.0014925983,1.2,2.14
