840.0 ,Acromioclavicular (joint) (ligament)...,Injury and poisoning,2980,6,1.82,0.1534952085,0.67,3.98
842.00 ,"Sprain of wrist, unspecified site",Injury and poisoning,6975,14,1.82,0.0431722625,0.99,3.07
721.4 ,Thoracic or lumbar spondylosis...,Diseases of the musculoskeletal...,1985,4,1.82,0.1800504317,0.5,4.68
727.42 ,Ganglion of tendon sheath,Diseases of the musculoskeletal...,2502,5,1.81,0.2098964799,0.59,4.23
528.0 ,Stomatitis,Diseases of the digestive system,26882,53,1.81,0.0000886374,1.35,2.37
873 ,Other open wound of head,Injury and poisoning,3494,7,1.81,0.1178671423,0.73,3.75
719.45 ,"Pain in joint, pelvic region and...",Diseases of the musculoskeletal...,5001,10,1.81,0.0808858171,0.87,3.34
924.8 ,"Contusion of multiple sites, not...",Injury and poisoning,2011,4,1.8,0.2933445325,0.49,4.62
945.24 ,"Blisters, epidermal loss [second...",Injury and poisoning,2011,4,1.8,0.2933445325,0.49,4.62
847.2 ,Sprain of lumbar,Injury and poisoning,48909,95,1.8,0.00000026364578,1.45,2.21
722.71 ,Intervertebral disc disorder with...,Diseases of the musculoskeletal...,3520,7,1.8,0.1200962351,0.72,3.72
715.11 ,"Osteoarthrosis, localized, primary,...",Diseases of the musculoskeletal...,3026,6,1.79,0.1578713245,0.66,3.92
924 ,Contusion of lower limb and of...,Injury and poisoning,5104,10,1.78,0.0847764607,0.85,3.28
535.4 ,Other specified gastritis,Diseases of the digestive system,11258,22,1.78,0.0142149074,1.11,2.7
715.98 ,"Osteoarthrosis, unspecified whether...",Diseases of the musculoskeletal...,4076,8,1.78,0.0981767698,0.77,3.51
250.70 ,Diabetes with peripheral circulatory...,"Endocrine, nutritional and metabolic...",3053,6,1.78,0.1605564594,0.65,3.88
719.43 ,"Pain in joint, forearm",Diseases of the musculoskeletal...,2545,5,1.78,0.2143869926,0.58,4.16
427.89 ,Other specified cardiac dysrhythmias,Diseases of the circulatory system,8651,17,1.78,0.022490627,1.04,2.87
722.91 ,"Other and unspecified disc disorder,...",Diseases of the musculoskeletal...,7134,14,1.78,0.0455910551,0.97,3
353.9 ,Unspecified nerve root and plexus...,Diseases of the nervous system,7193,14,1.77,0.0466978983,0.96,2.97
719.42 ,"Pain in joint, upper arm",Diseases of the musculoskeletal...,2560,5,1.77,0.2160211834,0.57,4.14
355.0 ,Lesion of sciatic nerve,Diseases of the nervous system,4642,9,1.76,0.1129316781,0.8,3.34
571.0 ,Alcoholic fatty liver,Diseases of the digestive system,2574,5,1.76,0.2175773012,0.57,4.11
923.00 ,Contusion of shoulder region,Injury and poisoning,11433,22,1.75,0.0150877484,1.09,2.66
738.4 ,Acquired spondylolisthesis,Diseases of the musculoskeletal...,7783,15,1.75,0.0382758263,0.98,2.89
531.30 ,Acute gastric ulcer without mention...,Diseases of the digestive system,7793,15,1.75,0.0384873257,0.97,2.89
112.3 ,Candidiasis of skin and nails,Infectious and parasitic diseases,2063,4,1.75,0.298862256,0.48,4.51
719.4 ,Pain in joint,Diseases of the musculoskeletal...,20866,40,1.75,0.0010693109,1.24,2.39
616.4 ,Other abscess of vulva,Diseases of the genitourinary...,3646,7,1.74,0.1317513799,0.7,3.59
372.4 ,Pterygium,Diseases of the nervous system,2600,5,1.74,0.2205448888,0.56,4.07
706.0 ,Acne varioliformis,Diseases of the skin and subcutaneous...,14624,28,1.74,0.005747819,1.15,2.53
353.8 ,Other nerve root and plexus disorders,Diseases of the nervous system,2612,5,1.73,0.2219480034,0.56,4.06
943.21 ,"Blisters, epidermal loss [second...",Injury and poisoning,2091,4,1.73,0.3020631744,0.47,4.45
531.9 ,"Gastric ulcer, unspecified as...",Diseases of the digestive system,5235,10,1.73,0.0906648614,0.83,3.19
533.0 ,"Peptic ulcer, site unspecified...",Diseases of the digestive system,2614,5,1.73,0.2221838825,0.56,4.05
848.9 ,Unspecified site of sprain and...,Injury and poisoning,134372,243,1.73,0.0000000000000870402,1.51,1.99
716.96 ,"Arthropathy, unspecified, lower...",Diseases of the musculoskeletal...,6802,13,1.73,0.0629414183,0.92,2.97
593.9 ,Unspecified disorder of kidney...,Diseases of the genitourinary...,3132,6,1.73,0.1688908394,0.64,3.79
427.2 ,"Paroxysmal tachycardia, unspecified",Diseases of the circulatory system,3671,7,1.73,0.1342272869,0.69,3.57
531.70 ,Chronic gastric ulcer without...,Diseases of the digestive system,10018,19,1.72,0.0231674947,1.03,2.7
590.10 ,Acute pyelonephritis without lesion...,Diseases of the genitourinary...,13775,26,1.72,0.0095447673,1.12,2.52
274.0 ,"Gouty arthropathy, unspecified","Endocrine, nutritional and metabolic...",32584,61,1.72,0.0001344782,1.31,2.22
728.85 ,Spasm of muscle,Diseases of the musculoskeletal...,9554,18,1.71,0.0294863392,1.01,2.71
372.05 ,Acute atopic conjunctivitis,Diseases of the nervous system,3171,6,1.71,0.1732588515,0.63,3.74
845.0 ,Sprains and strains of ankle,Injury and poisoning,3700,7,1.71,0.1371651112,0.69,3.54
435.9 ,Unspecified transient cerebral...,Diseases of the circulatory system,3178,6,1.71,0.1740600507,0.63,3.73
721.9 ,Spondylosis of unspecified site,Diseases of the musculoskeletal...,3702,7,1.71,0.1373702988,0.69,3.54
296 ,Disorganized type,Mental disorders,4787,9,1.7,0.1202638249,0.78,3.24
782.1 ,Rash and other nonspecific skin...,"Comorbidities, signs, and ill-defined...",13374,25,1.7,0.0124385912,1.1,2.52
289.3 ,"Lymphadenitis, unspecified, except...",Diseases of the blood and blood-forming...,4804,9,1.7,0.1212276408,0.77,3.23
726.4 ,Enthesopathy of wrist and carpus,Diseases of the musculoskeletal...,3754,7,1.69,0.2076751565,0.68,3.49
727.00 ,"Synovitis and tenosynovitis, unspecified",Diseases of the musculoskeletal...,145788,257,1.69,0.0000000000002052034,1.48,1.93
532.9 ,"Duodenal ulcer, unspecified as...",Diseases of the digestive system,6439,12,1.69,0.0855546991,0.87,2.96
702.8 ,Other specified dermatoses,Diseases of the skin and subcutaneous...,7506,14,1.69,0.0544629412,0.92,2.85
174.0 ,Malignant neoplasm of nipple and...,Neoplasms,2140,4,1.69,0.3080302058,0.46,4.34
722.90 ,"Other and unspecified disc disorder,...",Diseases of the musculoskeletal...,4277,8,1.69,0.1569179072,0.73,3.35
935.1 ,Foreign body in esophagus,Injury and poisoning,2688,5,1.68,0.2313063374,0.55,3.94
008.6 ,"Virus Enteritis, specified",Infectious and parasitic diseases,2686,5,1.68,0.2310499328,0.55,3.94
535.01 ,"Acute gastritis, with hemorrhage",Diseases of the digestive system,4322,8,1.68,0.1595790966,0.72,3.31
535.5 ,Unspecified gastritis & gastroduodenitis,Diseases of the digestive system,26057,48,1.68,0.0009218954,1.24,2.24
710.9 ,Unspecified diffuse connective...,Diseases of the musculoskeletal...,3765,7,1.68,0.2082569242,0.68,3.48
719.00 ,"Effusion of joint, site unspecified",Diseases of the musculoskeletal...,2150,4,1.68,0.3093028662,0.46,4.32
625.2 ,Mittelschmerz,Diseases of the genitourinary...,2163,4,1.67,0.3109842189,0.45,4.3
729.0 ,"Rheumatism, unspecified and fibrositis",Diseases of the musculoskeletal...,13625,25,1.67,0.0185627251,1.08,2.47
394.9 ,Other and unspecified mitral valve...,Diseases of the circulatory system,2163,4,1.67,0.3109842189,0.45,4.3
723.5 ,"Torticollis, unspecified",Diseases of the musculoskeletal...,4918,9,1.66,0.1282387575,0.76,3.16
300.09 ,Other anxiety states,Mental disorders,13673,25,1.66,0.0187880142,1.07,2.46
038.9 ,Unspecified septicemia,Infectious and parasitic diseases,4370,8,1.66,0.1626252146,0.71,3.28
533.70 ,Chronic peptic ulcer of unspecified...,Diseases of the digestive system,19260,35,1.66,0.0059704498,1.15,2.31
840 ,Sprains and strains of shoulder...,Injury and poisoning,3826,7,1.66,0.2117466669,0.66,3.42
715.16 ,"Osteoarthrosis, localized, primary,...",Diseases of the musculoskeletal...,22022,40,1.66,0.0029135414,1.18,2.27
388.2 ,"Sudden hearing loss, unspecified",Diseases of the nervous system,2186,4,1.66,0.3140317783,0.45,4.25
729.8 ,Other musculoskeletal symptoms...,Diseases of the musculoskeletal...,2737,5,1.65,0.237751789,0.54,3.87
723.0 ,Spinal stenosis in cervical region,Diseases of the musculoskeletal...,7739,14,1.64,0.082036491,0.89,2.76
725 ,Polymyalgia rheumatica,Diseases of the musculoskeletal...,2760,5,1.64,0.240882648,0.53,3.84
917.0 ,Abrasion or friction burn of foot...,Injury and poisoning,6085,11,1.64,0.1162211332,0.82,2.94
349.9 ,Unspecified disorders of nervous...,Diseases of the nervous system,23865,43,1.64,0.0022728284,1.18,2.22
995.3 ,"Allergy, unspecified, not elsewhere...",Injury and poisoning,19472,35,1.64,0.0063588236,1.14,2.29
053.9 ,Herpes zoster without mention...,Infectious and parasitic diseases,22287,40,1.64,0.0041959006,1.16,2.24
493.21 ,Chronic obstructive asthma with...,Diseases of the respiratory system,2225,4,1.63,0.3194045439,0.44,4.18
455.2 ,Internal hemorrhoids with other...,Diseases of the circulatory system,8319,15,1.63,0.0661987054,0.91,2.71
686 ,Other local infections of skin...,Diseases of the skin and subcutaneous...,11176,20,1.62,0.0432498991,0.99,2.52
111.8 ,Other specified dermatomycoses,Infectious and parasitic diseases,2229,4,1.62,0.3199697207,0.44,4.17
726.0 ,Adhesive capsulitis of shoulder,Diseases of the musculoskeletal...,37077,65,1.61,0.0004690594,1.23,2.06
620.0 ,Follicular cyst of ovary,Diseases of the genitourinary...,5657,10,1.6,0.1536059198,0.77,2.95
686.9 ,Unspecified local infection of...,Diseases of the skin and subcutaneous...,107317,183,1.6,0.000000013505568,1.37,1.87
692.3 ,Contact dermatitis and other eczema...,Diseases of the skin and subcutaneous...,13063,23,1.6,0.0330285011,1.01,2.41
785.0 ,"Tachycardia, unspecified","Comorbidities, signs, and ill-defined...",3954,7,1.6,0.2204653938,0.64,3.31
794.8 ,Nonspecific abnormal results of...,"Comorbidities, signs, and ill-defined...",17026,30,1.6,0.0144221004,1.08,2.3
216.8 ,Benign neoplasm of other specified...,Neoplasms,5654,10,1.6,0.1534715486,0.77,2.95
715.1 ,"Osteoarthrosis, localized, primary",Diseases of the musculoskeletal...,3400,6,1.6,0.2890029249,0.58,3.49
575.0 ,Acute cholecystitis,Diseases of the digestive system,2820,5,1.6,0.2493516641,0.52,3.75
279.4 ,Autoimmune disease not elsewhere...,"Endocrine, nutritional and metabolic...",2260,4,1.6,0.3244356621,0.44,4.11
729.2 ,"Neuralgia, neuritis, and radiculitis,...",Diseases of the musculoskeletal...,94552,161,1.59,0.0000001086775,1.34,1.87
529.0 ,Glossitis,Diseases of the digestive system,3416,6,1.59,0.2900649956,0.58,3.47
785.6 ,Enlargement of lymph nodes,"Comorbidities, signs, and ill-defined...",5128,9,1.59,0.1984497641,0.72,3.03
726.32 ,Lateral epicondylitis,Diseases of the musculoskeletal...,33036,57,1.58,0.0014061299,1.19,2.05
070 ,Viral hepatitis,Infectious and parasitic diseases,3430,6,1.58,0.2910228951,0.58,3.46
110.2 ,Dermatophytosis of hand,Infectious and parasitic diseases,3437,6,1.58,0.291511756,0.58,3.45
386.53 ,"Hypoactive labyrinth, unilateral",Diseases of the nervous system,2292,4,1.58,0.3291997115,0.43,4.05
306 ,Physiological malfunction arising...,Mental disorders,4025,7,1.57,0.2260742632,0.63,3.25
945.00 ,Burn of unspecified degree of...,Injury and poisoning,3455,6,1.57,0.2927988621,0.58,3.43
692.1 ,Contact dermatitis and other eczema...,Diseases of the skin and subcutaneous...,4032,7,1.57,0.2266558014,0.63,3.25
533.3 ,"Peptic ulcer, site unspecified,...",Diseases of the digestive system,2297,4,1.57,0.3299577319,0.43,4.04
216.5 ,"Benign neoplasm of skin of trunk,...",Neoplasms,3459,6,1.57,0.2930907149,0.57,3.43
845.00 ,"Sprain of ankle, unspecified site",Injury and poisoning,14495,25,1.57,0.0318989822,1.01,2.32
592 ,Calculus of kidney and ureter,Diseases of the genitourinary...,8095,14,1.57,0.0929124212,0.85,2.64
922 ,Contusion of trunk,Injury and poisoning,4069,7,1.56,0.2298125946,0.62,3.22
355.9 ,Mononeuritis of unspecified site,Diseases of the nervous system,4068,7,1.56,0.2297254597,0.62,3.22
843.9 ,Sprains and strains of unspecified...,Injury and poisoning,8166,14,1.55,0.1284172579,0.85,2.62
614.6 ,"Pelvic peritoneal adhesions, female...",Diseases of the genitourinary...,7607,13,1.55,0.1171403494,0.82,2.66
723.2 ,Cervicocranial syndrome,Diseases of the musculoskeletal...,4697,8,1.54,0.1887009679,0.66,3.05
723.9 ,Unspecified musculoskeletal disorders...,Diseases of the musculoskeletal...,4121,7,1.54,0.2344797885,0.62,3.18
724.5 ,"Backache, unspecified",Diseases of the musculoskeletal...,202715,323,1.54,0.00000000002673812,1.36,1.73
727.0 ,Synovitis and tenosynovitis,Diseases of the musculoskeletal...,23123,39,1.54,0.0122246469,1.09,2.11
729.9 ,Other and unspecified disorders...,Diseases of the musculoskeletal...,10566,18,1.54,0.0756185708,0.91,2.45
780 ,General symptoms,"Comorbidities, signs, and ill-defined...",4695,8,1.54,0.1885150557,0.66,3.05
533.9 ,"Peptic ulcer, site unspecified,...",Diseases of the digestive system,41518,70,1.54,0.0007295542,1.2,1.96
873.8 ,Other and unspecified open wound...,Injury and poisoning,4699,8,1.54,0.1888871857,0.66,3.05
464.30 ,Acute epiglottitis without mention...,Diseases of the respiratory system,5313,9,1.53,0.207441407,0.7,2.92
726.19 ,Other specified disorders of bursae...,Diseases of the musculoskeletal...,11227,19,1.53,0.084389914,0.92,2.41
307.4 ,Specific disorders of sleep of...,Mental disorders,5319,9,1.53,0.2077819255,0.7,2.92
780.8 ,Generalized hyperhidrosis,"Comorbidities, signs, and ill-defined...",2366,4,1.53,0.3407738507,0.42,3.93
215 ,Other benign neoplasm of connective...,Neoplasms,2369,4,1.53,0.3412585206,0.42,3.92
401 ,Essential hypertension,Diseases of the circulatory system,25656,43,1.53,0.0101506904,1.1,2.07
724.9 ,Other unspecified back disorders,Diseases of the musculoskeletal...,21572,36,1.52,0.0172585686,1.06,2.11
346.9 ,"Migraine, unspecified",Diseases of the nervous system,36035,60,1.52,0.0022633167,1.16,1.97
780.50 ,"Sleep disturbance, unspecified","Comorbidities, signs, and ill-defined...",42081,70,1.52,0.001037324,1.18,1.94
780.6 ,Fever,"Comorbidities, signs, and ill-defined...",72430,119,1.52,0.0000284815,1.25,1.83
560.39 ,Other impaction of intestine,Diseases of the digestive system,2374,4,1.52,0.3420688558,0.41,3.91
724.02 ,"Spinal stenosis, lumbar region,...",Diseases of the musculoskeletal...,13207,22,1.51,0.0638226699,0.94,2.3
357.4 ,Polyneuropathy in other diseases...,Diseases of the nervous system,6599,11,1.51,0.1877859245,0.75,2.71
682 ,Other cellulitis and abscess,Diseases of the skin and subcutaneous...,6015,10,1.51,0.1741697873,0.72,2.78
372.13 ,Vernal conjunctivitis,Diseases of the nervous system,3605,6,1.51,0.3051302058,0.55,3.29
386.10 ,"Peripheral vertigo, unspecified",Diseases of the nervous system,16798,28,1.51,0.0349579471,1,2.2
723.3 ,Cervicobrachial syndrome (diffuse),Diseases of the musculoskeletal...,8430,14,1.5,0.1354918726,0.82,2.53
465 ,Acute upper respiratory infections...,Diseases of the respiratory system,102917,166,1.5,0.0000019268331,1.27,1.77
931 ,Foreign body in ear,Injury and poisoning,6025,10,1.5,0.1748672523,0.72,2.77
367.53 ,Spasm of accommodation,Diseases of the nervous system,9084,15,1.5,0.1136274043,0.84,2.48
250.60 ,"Diabetes with neurological manifestations,...","Endocrine, nutritional and metabolic...",7855,13,1.5,0.1682087905,0.8,2.57
719.49 ,"Pain in joint, multiple sites",Diseases of the musculoskeletal...,13325,22,1.5,0.065640618,0.94,2.28
300.89 ,Other somatoform disorders,Mental disorders,7285,12,1.49,0.1562990661,0.77,2.61
625.9 ,Unspecified symptom associated...,Diseases of the genitourinary...,9133,15,1.49,0.1510744179,0.83,2.46
356.9 ,Unspecified hereditary and idiopathic...,Diseases of the nervous system,15266,25,1.49,0.0645719077,0.96,2.2
493.00 ,"Extrinsic asthma, unspecified",Diseases of the respiratory system,7294,12,1.49,0.1567653814,0.77,2.61
524.60 ,"Temporomandibular joint disorders,...",Diseases of the digestive system,4862,8,1.49,0.2713589884,0.64,2.94
372.51 ,Pinguecula,Diseases of the nervous system,1821,3,1.49,0.4605897615,0.31,4.37
700 ,Corns and callosities,Diseases of the skin and subcutaneous...,12797,21,1.49,0.0804145052,0.92,2.28
713.8 ,Arthropathy associated with other...,Diseases of the musculoskeletal...,3041,5,1.49,0.3997631505,0.48,3.48
386.11 ,Benign paroxysmal positional vertigo,Diseases of the nervous system,10977,18,1.49,0.1097668751,0.88,2.36
493.20 ,"Chronic obstructive asthma, unspecified",Diseases of the respiratory system,3054,5,1.48,0.400766074,0.48,3.47
733.01 ,Senile osteoporosis,Diseases of the musculoskeletal...,14754,24,1.48,0.0614954621,0.94,2.2
533 ,"Peptic ulcer, site unspecified",Diseases of the digestive system,32041,52,1.48,0.0082217649,1.1,1.95
787.3 ,"Flatulence, eructation, and gas...","Comorbidities, signs, and ill-defined...",56965,92,1.48,0.000507035,1.19,1.83
788.3 ,Incontinence of urine,"Comorbidities, signs, and ill-defined...",20216,33,1.48,0.0322526025,1.02,2.09
714.0 ,Rheumatoid arthritis,Diseases of the musculoskeletal...,29540,48,1.48,0.010152862,1.09,1.97
854 ,Intracranial injury of other and...,Injury and poisoning,2448,4,1.48,0.3544172933,0.4,3.79
723.1 ,Cervicalgia,Diseases of the musculoskeletal...,50459,81,1.47,0.0013323043,1.16,1.84
615.0 ,Acute inflammatory diseases of...,Diseases of the genitourinary...,16684,27,1.47,0.0593781058,0.97,2.15
533.00 ,Acute peptic ulcer of unspecified...,Diseases of the digestive system,9861,16,1.47,0.1264590403,0.84,2.4
112.9 ,Candidiasis of unspecified site,Infectious and parasitic diseases,8644,14,1.47,0.1436704598,0.8,2.47
795.0 ,Nonspecific abnormal papanicolaou...,"Comorbidities, signs, and ill-defined...",4295,7,1.47,0.2519360671,0.59,3.05
569.3 ,Hemorrhage of rectum and anus,Diseases of the digestive system,4915,8,1.47,0.2746033114,0.63,2.91
381.00 ,"Acute nonsuppurative otitis media,...",Diseases of the nervous system,3682,6,1.47,0.3124998783,0.54,3.22
574.50 ,Calculus of bile duct without...,Diseases of the digestive system,2457,4,1.47,0.3559621937,0.4,3.78
597.80 ,"Urethritis, unspecified",Diseases of the genitourinary...,31531,51,1.47,0.0099340304,1.09,1.95
726.12 ,Bicipital tenosynovitis,Diseases of the musculoskeletal...,5563,9,1.46,0.2240621182,0.67,2.79
726.9 ,Unspecified enthesopathy,Diseases of the musculoskeletal...,11808,19,1.46,0.1232708461,0.88,2.29
924.1 ,Contusion of knee and lower leg,Injury and poisoning,2481,4,1.46,0.3601246063,0.4,3.74
780.5 ,Sleep disturbance,"Comorbidities, signs, and ill-defined...",41200,66,1.46,0.0041911904,1.13,1.87
691 ,Atopic dermatitis and related...,Diseases of the skin and subcutaneous...,2474,4,1.46,0.3589042635,0.4,3.75
131.00 ,"Urogenital trichomoniasis, unspecified",Infectious and parasitic diseases,9329,15,1.46,0.1560350139,0.81,2.41
379.93 ,Redness or discharge of eye,Diseases of the nervous system,1862,3,1.46,0.4669804191,0.3,4.27
709.0 ,Dyschromia,Diseases of the skin and subcutaneous...,42539,68,1.46,0.0038141469,1.13,1.86
564.1 ,Irritable bowel syndrome,Diseases of the digestive system,85642,135,1.46,0.000057425,1.21,1.74
380.23 ,Other chronic otitis externa,Diseases of the nervous system,5595,9,1.46,0.2265331024,0.66,2.77
382.9 ,Unspecified otitis media,Diseases of the nervous system,38255,61,1.46,0.0062456219,1.11,1.88
715.17 ,"Osteoarthrosis, localized, primary,...",Diseases of the musculoskeletal...,1856,3,1.46,0.4660292633,0.3,4.28
847.0 ,Sprain of neck,Injury and poisoning,35619,57,1.46,0.0075807314,1.1,1.9
296.9 ,Other and unspecified affective...,Mental disorders,1866,3,1.45,0.4676174536,0.3,4.26
726.71 ,Achilles bursitis or tendinitis,Diseases of the musculoskeletal...,4362,7,1.45,0.352306047,0.58,3
354.0 ,Carpal tunnel syndrome,Diseases of the nervous system,42238,67,1.45,0.0046780109,1.12,1.85
533.90 ,"Peptic ulcer of unspecified site,...",Diseases of the digestive system,118037,184,1.45,0.0000041816196,1.24,1.7
379.91 ,Pain in or around eye,Diseases of the nervous system,4368,7,1.45,0.3526258964,0.58,3
709 ,Other disorders of skin and subcutaneous...,Diseases of the skin and subcutaneous...,6253,10,1.45,0.2466429109,0.69,2.67
250.4 ,Diabetes with renal manifestations,"Endocrine, nutritional and metabolic...",1867,3,1.45,0.4677770754,0.3,4.26
719.46 ,"Pain in joint, lower leg",Diseases of the musculoskeletal...,16901,27,1.45,0.0616515926,0.95,2.12
597.8 ,Other urethritis,Diseases of the genitourinary...,3126,5,1.45,0.4067442821,0.47,3.39
272.1 ,Pure hyperglyceridemia,"Endocrine, nutritional and metabolic...",11905,19,1.45,0.1248944023,0.87,2.27
611.8 ,Other specified disorders of breast,Diseases of the genitourinary...,4373,7,1.45,0.3528954295,0.58,2.99
784.7 ,Epistaxis,"Comorbidities, signs, and ill-defined...",14457,23,1.44,0.0999430696,0.91,2.17
786.01 ,Hyperventilation,"Comorbidities, signs, and ill-defined...",5031,8,1.44,0.2826016694,0.62,2.84
533.40 ,Chronic or unspecified peptic...,Diseases of the digestive system,8785,14,1.44,0.1932300245,0.79,2.43
715.36 ,"Osteoarthrosis, localized, not...",Diseases of the musculoskeletal...,36632,58,1.44,0.0084776001,1.09,1.88
715.38 ,"Osteoarthrosis, localized, not...",Diseases of the musculoskeletal...,3760,6,1.44,0.3206211713,0.53,3.15
726.10 ,Disorders of bursae and tendons...,Diseases of the musculoskeletal...,15884,25,1.43,0.0910443336,0.92,2.12
930.0 ,Corneal foreign body,Injury and poisoning,39034,61,1.43,0.0086365238,1.09,1.84
933.1 ,Foreign body in larynx,Injury and poisoning,13978,22,1.43,0.096373237,0.89,2.17
949.0 ,"Burn of unspecified site, unspecified...",Injury and poisoning,12007,19,1.43,0.1269469319,0.86,2.25
496 ,"Chronic airway obstruction, not...",Diseases of the respiratory system,14558,23,1.43,0.1011658579,0.91,2.16
782.2 ,"Localized superficial swelling,...","Comorbidities, signs, and ill-defined...",2530,4,1.43,0.3688056037,0.39,3.67
805.4 ,Closed fracture of lumbar vertebra...,Injury and poisoning,3801,6,1.43,0.3251385839,0.52,3.12
840.9 ,Sprains and strains of unspecified...,Injury and poisoning,24089,38,1.43,0.0314816997,1.01,1.98
726.90 ,Enthesopathy of unspecified site,Diseases of the musculoskeletal...,75233,116,1.42,0.0004833412,1.17,1.72
680.9 ,Carbuncle and furuncle of unspecified...,Diseases of the skin and subcutaneous...,30104,47,1.42,0.0224034107,1.04,1.9
698.2 ,Prurigo,Diseases of the skin and subcutaneous...,76759,118,1.42,0.0004488707,1.16,1.71
535.0 ,Acute gastritis,Diseases of the digestive system,48449,75,1.42,0.0044004589,1.11,1.78
382.0 ,Acute suppurative otitis media,Diseases of the nervous system,2549,4,1.42,0.3722337293,0.39,3.64
573.9 ,Unspecified disorder of liver,Diseases of the digestive system,14668,23,1.42,0.1027933769,0.9,2.14
715.18 ,"Osteoarthrosis, localized, primary,...",Diseases of the musculoskeletal...,1905,3,1.42,0.4739467271,0.29,4.17
574.20 ,Calculus of gallbladder without...,Diseases of the digestive system,20473,32,1.42,0.0559598623,0.97,2.01
276.5 ,Volume depletion,"Endocrine, nutritional and metabolic...",8300,13,1.42,0.1862156736,0.75,2.43
722.10 ,Displacement of lumbar intervertebral...,Diseases of the musculoskeletal...,31425,49,1.42,0.0202463691,1.05,1.89
614.0 ,Acute salpingitis and oophoritis,Diseases of the genitourinary...,16593,26,1.42,0.0776854839,0.93,2.09
459.9 ,Unspecified circulatory system...,Diseases of the circulatory system,4482,7,1.41,0.359429528,0.57,2.92
729.1 ,"Myalgia and myositis, unspecified",Diseases of the musculoskeletal...,226331,335,1.41,0.000000032321037,1.25,1.59
680.8 ,Carbuncle and furuncle of other...,Diseases of the skin and subcutaneous...,2563,4,1.41,0.3747806534,0.38,3.62
780.52 ,"Insomnia, unspecified","Comorbidities, signs, and ill-defined...",128567,194,1.41,0.0000176532,1.21,1.63
531.90 ,"Gastric ulcer, unspecified as...",Diseases of the digestive system,28994,45,1.41,0.0256559573,1.03,1.9
533.30 ,Acute peptic ulcer of unspecified...,Diseases of the digestive system,10295,16,1.41,0.1775766023,0.8,2.29
555 ,Regional enteritis,Diseases of the digestive system,1930,3,1.41,0.4781106447,0.29,4.12
382.00 ,Acute suppurative otitis media...,Diseases of the nervous system,5763,9,1.41,0.3137856001,0.64,2.69
388.70 ,"Otalgia, unspecified",Diseases of the nervous system,3854,6,1.41,0.3312176238,0.52,3.07
592.0 ,Calculus of kidney,Diseases of the genitourinary...,32915,51,1.41,0.0187569643,1.05,1.86
599.8 ,Other specified disorders of urethra...,Diseases of the genitourinary...,1928,3,1.41,0.47777462,0.29,4.12
287.2 ,Other nonthrombocytopenic purpuras,Diseases of the blood and blood-forming...,2572,4,1.41,0.3764270624,0.38,3.61
464 ,Acute laryngitis and tracheitis,Diseases of the respiratory system,46430,71,1.4,0.0085797471,1.09,1.77
618.9 ,Unspecified genital prolapse,Diseases of the genitourinary...,1937,3,1.4,0.4792906104,0.29,4.1
485 ,"Bronchopneumonia, organism unspecified",Diseases of the respiratory system,7735,12,1.4,0.2272625487,0.72,2.46
079.9 ,Unspecified viral and chlamydial...,Infectious and parasitic diseases,5176,8,1.4,0.2942234665,0.6,2.76
789.0 ,Abdominal pain,"Comorbidities, signs, and ill-defined...",491155,680,1.4,0.00000000000785595,1.27,1.54
575.1 ,Other cholecystitis,Diseases of the digestive system,3220,5,1.4,0.4155629605,0.46,3.29
245.1 ,Subacute thyroiditis,"Endocrine, nutritional and metabolic...",1933,3,1.4,0.4786156086,0.29,4.11
428.9 ,"Heart failure, unspecified",Diseases of the circulatory system,4519,7,1.4,0.3619239869,0.56,2.9
296.2 ,"Major depressive disorder, single...",Mental disorders,4568,7,1.39,0.3654332913,0.56,2.86
300.0 ,Anxiety states,Mental disorders,54734,83,1.39,0.004854222,1.1,1.73
780.4 ,Dizziness and giddiness,"Comorbidities, signs, and ill-defined...",309915,445,1.39,0.0000000031671726,1.25,1.55
530.9 ,Unspecified disorder of esophagus,Diseases of the digestive system,5841,9,1.39,0.3176899234,0.64,2.65
698.4 ,Dermatitis factitia [artefacta],Diseases of the skin and subcutaneous...,9782,15,1.39,0.2182373134,0.78,2.3
555.9 ,Regional enteritis of unspecified...,Diseases of the digestive system,14384,22,1.39,0.1292194226,0.87,2.11
716 ,Other and unspecified arthropathies,Diseases of the musculoskeletal...,8486,13,1.39,0.2472080306,0.74,2.38
