692.1 ,Contact dermatitis and other eczema...,Diseases of the skin and subcutaneous...,4290,10,1.28,0.371639109,0.61,2.36
381.60 ,"Obstruction of Eustachian tube,...",Diseases of the nervous system,2570,6,1.28,0.4827529386,0.47,2.79
246 ,Other disorders of thyroid,"Endocrine, nutritional and metabolic...",6011,14,1.28,0.3600311535,0.7,2.15
477.8 ,Allergic rhinitis due to other...,Diseases of the respiratory system,12078,28,1.27,0.1983748223,0.84,1.84
493.91 ,"Asthma, unspecified type, with...",Diseases of the respiratory system,4331,10,1.27,0.4709396369,0.61,2.33
372.14 ,Other chronic allergic conjunctivitis,Diseases of the nervous system,137313,311,1.27,0.0001159229,1.12,1.42
574.10 ,Calculus of gallbladder with other...,Diseases of the digestive system,3459,8,1.27,0.4249873278,0.55,2.5
382.9 ,Unspecified otitis media,Diseases of the nervous system,43919,101,1.27,0.0233180515,1.03,1.55
784.7 ,Epistaxis,"Comorbidities, signs, and ill-defined...",16615,38,1.26,0.1695099373,0.89,1.73
785.1 ,Palpitations,"Comorbidities, signs, and ill-defined...",40300,92,1.26,0.0333868971,1.01,1.55
922 ,Contusion of trunk,Injury and poisoning,3923,9,1.26,0.4502264719,0.57,2.39
372.1 ,Chronic conjunctivitis,Diseases of the nervous system,58558,133,1.26,0.0119982681,1.05,1.49
461.9 ,"Acute sinusitis, unspecified",Diseases of the respiratory system,519845,1111,1.26,0.0000000007435829,1.17,1.36
491.0 ,Simple chronic bronchitis,Diseases of the respiratory system,8764,20,1.25,0.3132022934,0.76,1.94
493 ,Asthma,Diseases of the respiratory system,10948,25,1.25,0.2596035485,0.81,1.85
784.2 ,"Swelling, mass, or lump in head...","Comorbidities, signs, and ill-defined...",7920,18,1.25,0.3528677382,0.74,1.97
535.51 ,"Unspecified gastritis and gastroduodenitis,...",Diseases of the digestive system,2621,6,1.25,0.4898568658,0.46,2.74
367.20 ,"Astigmatism, unspecified",Diseases of the nervous system,3063,7,1.25,0.5193592995,0.5,2.59
571.9 ,Unspecified chronic liver disease...,Diseases of the digestive system,12758,29,1.25,0.2502628569,0.83,1.8
622.9 ,Unspecified noninflammatory disorder...,Diseases of the genitourinary...,2192,5,1.25,0.6089152276,0.41,2.93
893.0 ,"Open wound of toe(s), without...",Injury and poisoning,6653,15,1.24,0.3858492233,0.69,2.04
370.20 ,"Superficial keratitis, unspecified",Diseases of the nervous system,13305,30,1.24,0.2602640018,0.83,1.77
574 ,Cholelithiasis,Diseases of the digestive system,4426,10,1.24,0.476549037,0.59,2.28
110.9 ,Dermatophytosis of unspecified...,Infectious and parasitic diseases,36952,83,1.24,0.0641977695,0.98,1.54
180.9 ,"Malignant neoplasm of cervix uteri,...",Neoplasms,3544,8,1.24,0.5492347944,0.53,2.44
427.9 ,"Cardiac dysrhythmia, unspecified",Diseases of the circulatory system,32960,74,1.24,0.0781680395,0.97,1.56
455.6 ,Unspecified hemorrhoids without...,Diseases of the circulatory system,43940,99,1.24,0.0362035164,1.01,1.52
241.9 ,Unspecified nontoxic nodular goiter,"Endocrine, nutritional and metabolic...",7952,18,1.24,0.3541064916,0.73,1.97
461.8 ,Other acute sinusitis,Diseases of the respiratory system,31450,71,1.24,0.0718841386,0.97,1.57
621.3 ,Endometrial cystic hyperplasia,Diseases of the genitourinary...,11070,25,1.24,0.2639145432,0.8,1.83
622.7 ,Mucous polyp of cervix,Diseases of the genitourinary...,16378,37,1.24,0.1966897112,0.87,1.71
626.1 ,Scanty or infrequent menstruation,Diseases of the genitourinary...,23975,54,1.24,0.1268354233,0.93,1.62
530.1 ,Esophagitis,Diseases of the digestive system,32714,73,1.23,0.0887081931,0.96,1.55
616.0 ,Cervicitis and endocervicitis,Diseases of the genitourinary...,135052,298,1.23,0.0009017434,1.09,1.39
617.9 ,"Endometriosis, site unspecified",Diseases of the genitourinary...,25558,57,1.23,0.1390151319,0.93,1.59
242.90 ,Thyrotoxicosis without mention...,"Endocrine, nutritional and metabolic...",29088,65,1.23,0.1104623985,0.95,1.57
625.6 ,"Stress incontinence, female",Diseases of the genitourinary...,7569,17,1.23,0.3455644816,0.72,1.98
634.90 ,"Spontaneous abortion, without...","Complications of pregnancy, childbirth,...",7639,17,1.22,0.4173663859,0.71,1.96
300 ,Neurotic disorders,Mental disorders,26480,59,1.22,0.1271071682,0.93,1.58
531.9 ,"Gastric ulcer, unspecified as...",Diseases of the digestive system,3606,8,1.22,0.5533171122,0.52,2.4
686.0 ,Pyoderma,Diseases of the skin and subcutaneous...,17054,38,1.22,0.2067633218,0.86,1.68
998.5 ,Postoperative infection,Injury and poisoning,14343,32,1.22,0.2384733908,0.84,1.73
070.9 ,Unspecified viral hepatitis without...,Infectious and parasitic diseases,8537,19,1.22,0.371627088,0.73,1.91
592.0 ,Calculus of kidney,Diseases of the genitourinary...,22109,49,1.22,0.1768292632,0.9,1.61
216.4 ,Benign neoplasm of scalp and skin...,Neoplasms,2700,6,1.22,0.6462438648,0.45,2.66
428.0 ,"Congestive heart failure, unspecified",Diseases of the circulatory system,2704,6,1.22,0.6464734596,0.45,2.65
245.2 ,Chronic lymphocytic thyroiditis,"Endocrine, nutritional and metabolic...",4033,9,1.22,0.4609832926,0.56,2.33
656.3 ,Fetal distress affecting management...,"Complications of pregnancy, childbirth,...",2271,5,1.21,0.6167472181,0.39,2.82
370.9 ,Unspecified keratitis,Diseases of the nervous system,7253,16,1.21,0.4073547204,0.69,1.97
616.9 ,Unspecified inflammatory disease...,Diseases of the genitourinary...,388735,823,1.21,0.0000022888659,1.12,1.32
244.9 ,Unspecified acquired hypothyroidism,"Endocrine, nutritional and metabolic...",10408,23,1.21,0.3548682134,0.77,1.82
490 ,"Bronchitis, not specified as acute...",Diseases of the respiratory system,47391,103,1.2,0.0805207379,0.97,1.46
637.91 ,"Unspecified abortion, without...","Complications of pregnancy, childbirth,...",19598,43,1.2,0.2375451498,0.87,1.63
692.8 ,"Contact dermatitis and other eczema,...",Diseases of the skin and subcutaneous...,6867,15,1.2,0.4760179091,0.67,1.98
110 ,Dermatophytosis,Infectious and parasitic diseases,3669,8,1.2,0.55814764,0.52,2.36
708 ,Urticaria,Diseases of the skin and subcutaneous...,13755,30,1.2,0.3150298157,0.81,1.71
381.4 ,"Nonsuppurative otitis media, not...",Diseases of the nervous system,4567,10,1.2,0.4875215424,0.57,2.21
710.0 ,Systemic lupus erythematosus,Diseases of the musculoskeletal...,7797,17,1.2,0.4240702746,0.7,1.92
616.8 ,Other specified inflammatory diseases...,Diseases of the genitourinary...,25691,56,1.2,0.1843983661,0.9,1.56
465.0 ,Acute laryngopharyngitis,Diseases of the respiratory system,413630,865,1.2,0.0000068571818,1.11,1.3
285.9 ,"Anemia, unspecified",Diseases of the blood and blood-forming...,58245,126,1.19,0.054210407,0.99,1.43
873 ,Other open wound of head,Injury and poisoning,3211,7,1.19,0.5349816055,0.48,2.47
483 ,Pneumonia due to other specified...,Diseases of the respiratory system,2298,5,1.19,0.6197379496,0.39,2.79
300.02 ,Generalized anxiety disorder,Mental disorders,14763,32,1.19,0.3314681541,0.81,1.68
891 ,"Open wound of knee, leg (except...",Injury and poisoning,4158,9,1.19,0.5815185693,0.54,2.26
698 ,Pruritus and related conditions,Diseases of the skin and subcutaneous...,5995,13,1.19,0.5412157803,0.63,2.04
698.4 ,Dermatitis factitia [artefacta],Diseases of the skin and subcutaneous...,11041,24,1.19,0.3698846468,0.76,1.78
715 ,Osteoarthrosis and allied disorders,Diseases of the musculoskeletal...,9214,20,1.19,0.3920687379,0.73,1.84
388.3 ,Tinitus,Diseases of the nervous system,8786,19,1.19,0.450025762,0.71,1.86
616.1 ,Vaginitis and vulvovaginitis,Diseases of the genitourinary...,129835,279,1.19,0.0055863365,1.05,1.35
616.2 ,Cyst of Bartholin's gland,Diseases of the genitourinary...,7398,16,1.19,0.49233251,0.68,1.93
466 ,Acute bvronchitis and bronchiolitis,Diseases of the respiratory system,43864,95,1.19,0.1000387571,0.96,1.46
491 ,Chronic bronchitis,Diseases of the respiratory system,8339,18,1.18,0.439387238,0.7,1.88
298.9 ,Unspecified psychosis,Mental disorders,3264,7,1.18,0.6771976298,0.47,2.43
640.9 ,Unspecified hemorrhage in early...,"Complications of pregnancy, childbirth,...",6481,14,1.18,0.466161631,0.65,1.99
784 ,Symptoms involving head and neck,"Comorbidities, signs, and ill-defined...",4196,9,1.18,0.5838595424,0.54,2.24
535.5 ,Unspecified gastritis & gastroduodenitis,Diseases of the digestive system,24292,52,1.18,0.2553385803,0.88,1.55
070.3 ,Viral hepatitis B without mention...,Infectious and parasitic diseases,4178,9,1.18,0.5827248173,0.54,2.25
079.9 ,Unspecified viral and chlamydial...,Infectious and parasitic diseases,6969,15,1.18,0.4806911482,0.66,1.95
596.5 ,Other functional disorders of...,Diseases of the genitourinary...,9276,20,1.18,0.4620776774,0.72,1.83
611.72 ,Lump or mass in breast,Diseases of the genitourinary...,54738,117,1.18,0.0837288398,0.97,1.42
461.0 ,Acute maxillary sinusitis,Diseases of the respiratory system,26560,57,1.18,0.2176608775,0.89,1.53
464.1 ,Acute tracheitis,Diseases of the respiratory system,22263,48,1.18,0.2357704011,0.87,1.57
465 ,Acute upper respiratory infections...,Diseases of the respiratory system,125509,267,1.18,0.0110814555,1.04,1.34
626.0 ,Absence of menstruation,Diseases of the genitourinary...,193901,411,1.18,0.0015850362,1.07,1.31
475 ,Peritonsillar abscess,Diseases of the respiratory system,14890,32,1.18,0.3344994701,0.8,1.67
789 ,Other symptoms involving abdomen...,"Comorbidities, signs, and ill-defined...",12192,26,1.17,0.3941272066,0.76,1.72
372.11 ,Simple chronic conjunctivitis,Diseases of the nervous system,45091,96,1.17,0.1309886652,0.95,1.44
373.1 ,Hordeolum and other deep inflammation...,Diseases of the nervous system,19298,41,1.17,0.3088931184,0.83,1.59
582.9 ,Chronic glomerulonephritis with...,Diseases of the genitourinary...,9413,20,1.17,0.4663709756,0.71,1.8
110.3 ,Dermatophytosis of groin and perianal...,Infectious and parasitic diseases,10815,23,1.17,0.4284347512,0.74,1.75
593.9 ,Unspecified disorder of kidney...,Diseases of the genitourinary...,2342,5,1.17,0.6249231458,0.38,2.74
216.9 ,"Benign neoplasm of skin, site...",Neoplasms,41215,88,1.17,0.1439024456,0.94,1.45
242.00 ,Toxic diffuse goiter without mention...,"Endocrine, nutritional and metabolic...",12145,26,1.17,0.3925822014,0.77,1.72
640.0 ,Threatened abortion,"Complications of pregnancy, childbirth,...",25562,54,1.16,0.2681168044,0.87,1.52
669.91 ,Unspecified complication of labor...,"Complications of pregnancy, childbirth,...",1885,4,1.16,0.5926449996,0.32,2.99
361.30 ,"Retinal defect, unspecified",Diseases of the nervous system,2365,5,1.16,0.6277776992,0.38,2.71
805.6 ,Closed fracture of sacrum and...,Injury and poisoning,3316,7,1.16,0.6797829051,0.46,2.39
372.3 ,Other and unspecified conjunctivitis,Diseases of the nervous system,11826,25,1.16,0.4478867224,0.75,1.72
380.13 ,Other acute infections of external...,Diseases of the nervous system,2830,6,1.16,0.6552320225,0.43,2.53
464.30 ,Acute epiglottitis without mention...,Diseases of the respiratory system,6617,14,1.16,0.5614190645,0.63,1.95
626.4 ,Irregular menstrual cycle,Diseases of the genitourinary...,356269,730,1.16,0.0005618989,1.07,1.26
626.8 ,Other disorders of menstruation...,Diseases of the genitourinary...,198636,414,1.16,0.0048236909,1.05,1.29
643.0 ,Mild hyperemesis gravidarum,"Complications of pregnancy, childbirth,...",7129,15,1.15,0.5757537141,0.64,1.91
529.0 ,Glossitis,Diseases of the digestive system,2866,6,1.15,0.6582375887,0.42,2.5
575.1 ,Other cholecystitis,Diseases of the digestive system,1901,4,1.15,0.7830808833,0.31,2.96
110.4 ,Dermatophytosis of foot,Infectious and parasitic diseases,92017,191,1.15,0.0741200567,0.98,1.33
380.15 ,Chronic mycotic otitis externa,Diseases of the nervous system,10494,22,1.15,0.4900969205,0.72,1.74
220 ,Benign neoplasm of ovary,Neoplasms,81898,171,1.15,0.0781343889,0.98,1.34
464.11 ,Acute tracheitis with obstruction,Diseases of the respiratory system,13837,29,1.15,0.4235505942,0.77,1.66
250.0 ,Diabetes Mellitus w/m of complication,"Endocrine, nutritional and metabolic...",8603,18,1.15,0.5254957794,0.68,1.82
848.0 ,Sprain of septal cartilage of...,Injury and poisoning,1927,4,1.14,0.7845391754,0.31,2.92
280.9 ,"Iron deficiency anemia, unspecified",Diseases of the blood and blood-forming...,25094,52,1.14,0.33327743,0.85,1.5
873.4 ,"Facial laceration, without mention...",Injury and poisoning,6258,13,1.14,0.5541178717,0.61,1.95
531 ,Gastric ulcer,Diseases of the digestive system,7707,16,1.14,0.5906974378,0.65,1.85
367.2 ,Astigmatism,Diseases of the nervous system,1918,4,1.14,0.7840219521,0.31,2.93
371.89 ,Other corneal disorders,Diseases of the nervous system,2874,6,1.14,0.6589333634,0.42,2.5
995.3 ,"Allergy, unspecified, not elsewhere...",Injury and poisoning,19222,40,1.14,0.3947730575,0.81,1.56
379.24 ,Other vitreous opacities,Diseases of the nervous system,16337,34,1.14,0.4075490047,0.79,1.6
388.8 ,Other disorders of ear,Diseases of the nervous system,3846,8,1.14,0.7019583954,0.49,2.25
219.9 ,"Benign neoplasm of uterus, part...",Neoplasms,33278,69,1.14,0.2706456279,0.88,1.45
616.4 ,Other abscess of vulva,Diseases of the genitourinary...,4802,10,1.14,0.610076668,0.55,2.1
455.5 ,External hemorrhoids with other...,Diseases of the circulatory system,3361,7,1.14,0.682336369,0.46,2.36
455.8 ,Unspecified hemorrhoids with other...,Diseases of the circulatory system,12529,26,1.14,0.4627549279,0.74,1.67
724.7 ,Disorders of coccyx,Diseases of the musculoskeletal...,1922,4,1.14,0.7842502267,0.31,2.93
623.9 ,Unspecified noninflammatory disorder...,Diseases of the genitourinary...,1926,4,1.14,0.7844810668,0.31,2.92
478.0 ,Hypertrophy of nasal turbinates,Diseases of the respiratory system,16532,34,1.13,0.4633488723,0.78,1.58
493.00 ,"Extrinsic asthma, unspecified",Diseases of the respiratory system,6304,13,1.13,0.65517418,0.6,1.94
531.90 ,"Gastric ulcer, unspecified as...",Diseases of the digestive system,20393,42,1.13,0.4090822774,0.81,1.53
362.9 ,Unspecified retinal disorder,Diseases of the nervous system,2433,5,1.13,0.6367422853,0.37,2.63
372.0 ,Acute conjunctivitis,Diseases of the nervous system,25325,52,1.13,0.3735155446,0.84,1.48
693.0 ,Dermatitis due to drugs and medicines...,Diseases of the skin and subcutaneous...,8221,17,1.13,0.6024936794,0.66,1.82
379.8 ,Other specified disorders of eye...,Diseases of the nervous system,5796,12,1.13,0.6414060061,0.59,1.99
592.9 ,"Urinary calculus, unspecified",Diseases of the genitourinary...,23317,48,1.13,0.3949208661,0.83,1.5
214.9 ,"Lipoma, unspecified site",Neoplasms,3396,7,1.13,0.684514975,0.45,2.33
215.0 ,Other benign neoplasm of connective...,Neoplasms,3888,8,1.13,0.7037681459,0.49,2.23
240.9 ,"Goiter, unspecified","Endocrine, nutritional and metabolic...",26126,54,1.13,0.3423375775,0.85,1.48
626.2 ,Excessive or frequent menstruation,Diseases of the genitourinary...,81150,167,1.13,0.1190988981,0.96,1.33
626.9 ,Unspecified disorders of menstruation...,Diseases of the genitourinary...,229442,466,1.13,0.0147442503,1.02,1.25
633.1 ,Tubal pregnancy,"Complications of pregnancy, childbirth,...",3910,8,1.12,0.7047983192,0.48,2.21
295.30 ,"Paranoid type schizophrenia, unspecified",Mental disorders,2457,5,1.12,0.8096400741,0.36,2.61
491.8 ,Other chronic bronchitis,Diseases of the respiratory system,3898,8,1.12,0.7042295222,0.48,2.22
532.30 ,Acute duodenal ulcer without mention...,Diseases of the digestive system,3436,7,1.12,0.6872010542,0.45,2.31
945.24 ,"Blisters, epidermal loss [second...",Injury and poisoning,1950,4,1.12,0.7859188475,0.31,2.89
959.7 ,"Knee, leg, ankle, and foot injury",Injury and poisoning,3437,7,1.12,0.6872708005,0.45,2.3
216.3 ,Benign neoplasm of skin of other...,Neoplasms,8347,17,1.12,0.6062046602,0.65,1.79
216.5 ,"Benign neoplasm of skin of trunk,...",Neoplasms,3437,7,1.12,0.6872708005,0.45,2.3
218 ,Uterine leiomyoma,Neoplasms,12259,25,1.12,0.5245178516,0.72,1.65
626.6 ,Metrorrhagia,Diseases of the genitourinary...,92878,189,1.12,0.1236242753,0.96,1.3
854.0 ,Intracranial injury of other and...,Injury and poisoning,2968,6,1.11,0.6678130555,0.41,2.42
531.00 ,"Acute gastric ulcer with hemorrhage,...",Diseases of the digestive system,1982,4,1.11,0.7879708728,0.3,2.84
531.70 ,Chronic gastric ulcer without...,Diseases of the digestive system,6908,14,1.11,0.6700436517,0.61,1.87
380.22 ,Other acute otitis externa,Diseases of the nervous system,26634,54,1.11,0.4258009406,0.83,1.46
610.0 ,Solitary cyst of breast,Diseases of the genitourinary...,5933,12,1.11,0.6471975965,0.57,1.94
216.7 ,Benign neoplasm of skin of lower...,Neoplasms,2472,5,1.11,0.8102206716,0.36,2.59
622.1 ,Dysplasia of cervix (uteri),Diseases of the genitourinary...,15381,31,1.11,0.5682474739,0.75,1.57
870.0 ,Laceration of skin of eyelid and...,Injury and poisoning,1994,4,1.1,0.7887782825,0.3,2.82
692.0 ,Contact dermatitis and other eczema...,Diseases of the skin and subcutaneous...,49076,98,1.1,0.3617261862,0.89,1.34
111.9 ,"Dermatomycosis, unspecified",Infectious and parasitic diseases,6954,14,1.1,0.6714633386,0.6,1.86
427 ,Cardiac dysrhythmias,Diseases of the circulatory system,6956,14,1.1,0.6715286625,0.6,1.85
240.0 ,"Goiter, specified as simple","Endocrine, nutritional and metabolic...",5470,11,1.1,0.7490587699,0.55,1.98
253.1 ,Other and unspecified anterior...,"Endocrine, nutritional and metabolic...",10438,21,1.1,0.6441917927,0.68,1.69
486 ,"Pneumonia, organism unspecified",Diseases of the respiratory system,25239,50,1.09,0.5518558866,0.8,1.44
555.9 ,Regional enteritis of unspecified...,Diseases of the digestive system,15528,31,1.09,0.5711049306,0.74,1.56
372.15 ,Parasitic conjunctivitis,Diseases of the nervous system,2508,5,1.09,0.8117197472,0.35,2.56
571.49 ,Other chronic hepatitis,Diseases of the digestive system,10050,20,1.09,0.6391705078,0.67,1.69
698.3 ,Lichenification and lichen simplex...,Diseases of the skin and subcutaneous...,31139,62,1.09,0.4615161986,0.84,1.4
381.81 ,Dysfunction of Eustachian tube,Diseases of the nervous system,24108,48,1.09,0.5426987159,0.8,1.45
455.4 ,External thrombosed hemorrhoids,Diseases of the circulatory system,2013,4,1.09,0.7900970481,0.3,2.79
472.2 ,Chronic nasopharyngitis,Diseases of the respiratory system,34350,68,1.09,0.4824384874,0.84,1.38
627.8 ,Other specified menopausal and...,Diseases of the genitourinary...,2026,4,1.08,0.7910269391,0.29,2.78
487.0 ,Influenza with pneumonia,Diseases of the respiratory system,6069,12,1.08,0.761617881,0.56,1.9
692.81 ,Dermatitis due to cosmetics,Diseases of the skin and subcutaneous...,3033,6,1.08,0.828943723,0.4,2.36
571.4 ,Chronic hepatitis,Diseases of the digestive system,45263,89,1.08,0.4681581074,0.86,1.33
693.8 ,Dermatitis due to other specified...,Diseases of the skin and subcutaneous...,9651,19,1.08,0.7187503114,0.65,1.69
695.0 ,Toxic erythema,Diseases of the skin and subcutaneous...,3550,7,1.08,0.8420252399,0.43,2.23
111.0 ,Pityriasis versicolor,Infectious and parasitic diseases,19325,38,1.08,0.6109740704,0.76,1.48
416 ,Chronic pulmonary heart disease,Diseases of the circulatory system,2031,4,1.08,0.7913903874,0.29,2.77
253.8 ,Other disorders of the pituitary...,"Endocrine, nutritional and metabolic...",3562,7,1.08,0.8422889063,0.43,2.22
629.8 ,Other specified disorders of female...,Diseases of the genitourinary...,13868,27,1.07,0.6893675951,0.7,1.56
785.6 ,Enlargement of lymph nodes,"Comorbidities, signs, and ill-defined...",6639,13,1.07,0.7719730883,0.57,1.84
704.00 ,"Alopecia, unspecified",Diseases of the skin and subcutaneous...,4096,8,1.07,0.7155743512,0.46,2.11
595.89 ,Other specified types of cystitis,Diseases of the genitourinary...,2569,5,1.07,0.8145807779,0.35,2.49
131.00 ,"Urogenital trichomoniasis, unspecified",Infectious and parasitic diseases,11265,22,1.07,0.7388429212,0.67,1.62
216.1 ,"Benign neoplasm of eyelid, including...",Neoplasms,2046,4,1.07,0.7924995625,0.29,2.75
614.7 ,"Other chronic pelvic peritonitis,...",Diseases of the genitourinary...,6135,12,1.07,0.7632659191,0.55,1.88
218.9 ,"Leiomyoma of uterus, unspecified",Neoplasms,81051,158,1.07,0.39935934,0.91,1.26
625.8 ,Other specified symptoms associated...,Diseases of the genitourinary...,2057,4,1.07,0.7933304681,0.29,2.73
635.9 ,Legally induced abortion without...,"Complications of pregnancy, childbirth,...",2061,4,1.06,0.7936362002,0.29,2.73
346 ,Migraine,Diseases of the nervous system,6731,13,1.06,0.7741754866,0.56,1.81
367 ,"Infantile, juvenile, and presenile...",Diseases of the nervous system,3634,7,1.06,0.8440831444,0.42,2.18
367.1 ,Myopia,Diseases of the nervous system,34554,67,1.06,0.6103105887,0.82,1.35
692.4 ,Contact dermatitis and other eczema...,Diseases of the skin and subcutaneous...,31555,61,1.06,0.6410298335,0.81,1.37
595 ,Cystitis,Diseases of the genitourinary...,22821,44,1.06,0.6959817156,0.77,1.42
455 ,Hemorrhoids,Diseases of the circulatory system,10830,21,1.06,0.7343575076,0.66,1.63
253.9 ,Unspecified disorder of the pituitary...,"Endocrine, nutritional and metabolic...",2069,4,1.06,0.7942532911,0.29,2.72
625 ,Pain and other symptoms associated...,Diseases of the genitourinary...,2575,5,1.06,0.8148827777,0.34,2.49
633 ,Ectopic pregnancy,"Complications of pregnancy, childbirth,...",3120,6,1.05,0.8319142795,0.39,2.3
881 ,"Open wound of elbow, forearm,...",Injury and poisoning,2080,4,1.05,0.795113807,0.29,2.7
493.9 ,"Asthma, unspecified",Diseases of the respiratory system,11527,22,1.05,0.8260824433,0.65,1.59
780.9 ,Other general symptoms,"Comorbidities, signs, and ill-defined...",16182,31,1.05,0.780832673,0.71,1.49
648.03 ,"Diabetes mellitus of mother, complicating...","Complications of pregnancy, childbirth,...",2081,4,1.05,0.795192714,0.29,2.7
791.0 ,Proteinuria,"Comorbidities, signs, and ill-defined...",4716,9,1.05,0.8631987072,0.48,1.99
111.8 ,Other specified dermatomycoses,Infectious and parasitic diseases,2089,4,1.05,0.7958279698,0.29,2.69
429.9 ,"Heart disease, unspecified",Diseases of the circulatory system,7271,14,1.05,0.7824518517,0.58,1.77
464 ,Acute laryngitis and tracheitis,Diseases of the respiratory system,55474,106,1.05,0.6133187752,0.86,1.27
266.9 ,Unspecified vitamin B deficiency,"Endocrine, nutritional and metabolic...",2093,4,1.05,0.7961482344,0.28,2.69
782.1 ,Rash and other nonspecific skin...,"Comorbidities, signs, and ill-defined...",13688,26,1.04,0.8401887422,0.68,1.53
643.9 ,Unspecified vomiting of pregnancy,"Complications of pregnancy, childbirth,...",2633,5,1.04,0.8179786677,0.34,2.43
367.5 ,Disorders of accommodation,Diseases of the nervous system,2110,4,1.04,0.7975284751,0.28,2.67
695.89 ,Other specified erythematous conditions,Diseases of the skin and subcutaneous...,3703,7,1.04,0.8461254262,0.42,2.14
632 ,Missed abortion,"Complications of pregnancy, childbirth,...",17504,33,1.03,0.7897707537,0.71,1.45
308.0 ,Predominant disturbance of emotions,Mental disorders,4769,9,1.03,0.8642074111,0.47,1.97
644.0 ,Threatened premature labor,"Complications of pregnancy, childbirth,...",6353,12,1.03,0.8821924356,0.53,1.81
533.9 ,"Peptic ulcer, site unspecified,...",Diseases of the digestive system,32940,62,1.03,0.7942088176,0.79,1.33
944.00 ,Burn of unspecified degree of...,Injury and poisoning,2125,4,1.03,0.7987712199,0.28,2.65
372.12 ,Chronic follicular conjunctivitis,Diseases of the nervous system,4250,8,1.03,0.8563635114,0.44,2.04
696.5 ,Other and unspecified pityriasis,Diseases of the skin and subcutaneous...,2655,5,1.03,0.8192323114,0.33,2.41
386 ,Vertiginous syndromes and other...,Diseases of the nervous system,10099,19,1.03,0.8153777614,0.62,1.61
716 ,Other and unspecified arthropathies,Diseases of the musculoskeletal...,4275,8,1.03,0.8570243506,0.44,2.02
414 ,Other forms of chronic ischemic...,Diseases of the circulatory system,2119,4,1.03,0.7982713884,0.28,2.65
233.1 ,Carcinoma in situ of cervix uteri,Neoplasms,7980,15,1.03,0.8948858198,0.58,1.7
780 ,General symptoms,"Comorbidities, signs, and ill-defined...",4279,8,1.02,0.8571329997,0.44,2.02
306.8 ,Other specified psychophysiological...,Mental disorders,6423,12,1.02,0.8830505081,0.53,1.79
643.13 ,Hyperemesis gravidarum with metabolic...,"Complications of pregnancy, childbirth,...",31268,58,1.02,0.8935379932,0.77,1.32
008.5 ,"Bacterial enteritis, unspecified",Infectious and parasitic diseases,5885,11,1.02,0.8778735428,0.51,1.84
070.30 ,Viral hepatitis B without mention...,Infectious and parasitic diseases,26765,50,1.02,0.8286538334,0.76,1.35
239.0 ,Neoplasm of unspecified nature...,Neoplasms,2140,4,1.02,0.8000363054,0.28,2.63
873.49 ,Open wound of other and multiple...,Injury and poisoning,2170,4,1.01,0.8026297764,0.27,2.59
532.9 ,"Duodenal ulcer, unspecified as...",Diseases of the digestive system,4356,8,1.01,0.8593750391,0.43,1.99
362.6 ,Peripheral retinal degeneration,Diseases of the nervous system,3247,6,1.01,0.837292609,0.37,2.21
256.3 ,Other ovarian failure,"Endocrine, nutritional and metabolic...",3807,7,1.01,0.8497444799,0.4,2.08
528 ,"Disease of the oral soft tissues,...",Diseases of the digestive system,2199,4,1,1,0.27,2.56
643.10 ,Hyperemesis gravidarum with metabolic...,"Complications of pregnancy, childbirth,...",2214,4,0.99,1,0.27,2.54
362.63 ,Lattice degeneration,Diseases of the nervous system,2753,5,0.99,1,0.32,2.33
097.9 ,"Syphilis, unspecified",Infectious and parasitic diseases,2206,4,0.99,1,0.27,2.55
708.8 ,Other specified urticaria,Diseases of the skin and subcutaneous...,19312,35,0.99,1,0.69,1.38
414.0 ,Coronary atherosclerosis,Diseases of the circulatory system,4985,9,0.99,1,0.45,1.88
616 ,"Inflammatory disease of cervix,...",Diseases of the genitourinary...,69281,125,0.99,0.9276811121,0.82,1.18
461 ,Acute sinusitis,Diseases of the respiratory system,37451,68,0.99,1,0.77,1.26
633.9 ,Unspecified ectopic pregnancy,"Complications of pregnancy, childbirth,...",13371,24,0.98,1,0.63,1.47
011.90 ,"Pulmonary tuberculosis, unspecified,...",Infectious and parasitic diseases,3910,7,0.98,1,0.39,2.02
041.8 ,Other specified bacterial infections,Infectious and parasitic diseases,2226,4,0.98,1,0.27,2.53
