367.1 ,Myopia,Diseases of the nervous system,196818,786,0.75,0.00000000000000283897,0.7,0.81
369.9 ,Unspecified visual loss,Diseases of the nervous system,1810,7,0.75,0.61925728,0.3,1.55
388.8 ,Other disorders of ear,Diseases of the nervous system,2083,8,0.74,0.537650503,0.32,1.47
003.9 ,"Salmonella infection, unspecified",Infectious and parasitic diseases,2345,9,0.74,0.4692332525,0.34,1.42
757.39 ,Other specified anomalies of skin,Congenital anomalies,5186,19,0.71,0.1447803007,0.43,1.11
367.31 ,Anisometropia,Diseases of the nervous system,2761,10,0.7,0.348714728,0.34,1.29
693.8 ,Dermatitis due to other specified...,Diseases of the skin and subcutaneous...,6028,21,0.67,0.0710335606,0.42,1.03
367.53 ,Spasm of accommodation,Diseases of the nervous system,10070,35,0.67,0.0172672244,0.47,0.94
367.9 ,Unspecified disorder of refraction...,Diseases of the nervous system,128312,445,0.65,2.151934e-20,0.59,0.72
372 ,Disorders of conjunctiva,Diseases of the nervous system,7483,23,0.59,0.0093708013,0.38,0.89
074.3 ,"Hand, foot, and mouth disease",Infectious and parasitic diseases,2295,7,0.59,0.1880101069,0.24,1.22
367.89 ,Other disorders of refraction...,Diseases of the nervous system,19324,59,0.59,0.0000129779,0.45,0.76
379.8 ,Other specified disorders of eye...,Diseases of the nervous system,4692,14,0.58,0.039956373,0.32,0.97
367.21 ,Regular astigmatism,Diseases of the nervous system,4698,14,0.58,0.0400517478,0.31,0.97
367.2 ,Astigmatism,Diseases of the nervous system,7390,21,0.55,0.0041573929,0.34,0.84
379.21 ,Vitreous degeneration,Diseases of the nervous system,2184,6,0.53,0.1332443771,0.19,1.16
783.4 ,Lack of expected normal physiological...,"Comorbidities, signs, and ill-defined...",6883,19,0.53,0.0039203835,0.32,0.83
253.3 ,Pituitary dwarfism,"Endocrine, nutritional and metabolic...",1886,5,0.51,0.1468332852,0.17,1.2
367.5 ,Disorders of accommodation,Diseases of the nervous system,2767,6,0.42,0.0230542285,0.15,0.91
379.91 ,Pain in or around eye,Diseases of the nervous system,6474,10,0.3,0.0000046965814,0.14,0.55
