disease_2,disease_name,category,count,co_occurrence,odds_ratio,p_value,95_ci_lower,95_ci_upper
813.81 ,Closed fracture of unspecified...,Injury and poisoning,3720,310,75,< 0.0001,65.64,85.68
813.41 ,Closed Colles' fracture,Injury and poisoning,3155,258,70.26,< 0.0001,60.81,80.69
813.42 ,Other closed fractures of distal...,Injury and poisoning,1984,138,53.57,7.44388e-177,44.4,64.34
813 ,Fracture of radius and ulna,Injury and poisoning,2080,131,47.9,4.08969e-162,39.53,57.61
718.40 ,"Contracture of joint, site unspecified",Diseases of the musculoskeletal...,3588,143,29.81,1.09806e-148,24.8,35.57
812.20 ,Closed fracture of unspecified...,Injury and poisoning,1860,55,20.52,1.176498e-50,15.31,27
718.4 ,Contracture of joint,Diseases of the musculoskeletal...,2094,45,14.68,9.607875e-36,10.62,19.82
728.2 ,"Muscular wasting and disuse atrophy,...",Diseases of the musculoskeletal...,1545,32,14.01,2.322797e-25,9.51,19.96
829.0 ,"Fracture of unspecified bone,...",Injury and poisoning,3047,51,11.42,3.674758e-35,8.44,15.13
923.21 ,Contusion of wrist,Injury and poisoning,3388,47,9.4,5.088258e-29,6.86,12.6
716.80 ,"Other specified arthropathy, site...",Diseases of the musculoskeletal...,2331,28,8.03,2.551085e-16,5.3,11.68
824.8 ,"Unspecified fracture of ankle,...",Injury and poisoning,1575,19,8.02,0.00000000001405444,4.8,12.6
719.43 ,"Pain in joint, forearm",Diseases of the musculoskeletal...,1700,18,7.02,0.0000000003772515,4.14,11.17
726.4 ,Enthesopathy of wrist and carpus,Diseases of the musculoskeletal...,2790,29,6.93,0.00000000000000295911,4.62,10.03
716.10 ,"Traumatic arthropathy, site unspecified",Diseases of the musculoskeletal...,3611,35,6.48,3.423644e-17,4.49,9.08
810.00 ,"Closed fracture of clavicle, unspecified...",Injury and poisoning,2299,21,6.06,0.0000000001917425,3.73,9.31
924.9 ,Contusion of unspecified site,Injury and poisoning,14269,118,5.81,4.059922e-48,4.76,7.02
842.00 ,"Sprain of wrist, unspecified site",Injury and poisoning,4209,35,5.55,0.000000000000003126531,3.85,7.77
816.00 ,Closed fracture of phalanx or...,Injury and poisoning,2336,19,5.38,0.0000000087432455,3.22,8.45
842.09 ,Other sprains and strains of wrist,Injury and poisoning,3463,28,5.37,0.000000000003377777,3.55,7.82
881.00 ,"Open wound of forearm, without...",Injury and poisoning,3609,29,5.34,0.000000000001621375,3.56,7.72
923.9 ,Contusion of unspecified part...,Injury and poisoning,5410,43,5.33,1.105497e-17,3.83,7.22
923.10 ,Contusion of forearm,Injury and poisoning,1366,11,5.3,0.0000124491,2.63,9.54
354.2 ,Lesion of ulnar nerve,Diseases of the nervous system,1538,12,5.14,0.0000069626397,2.64,9.03
807.00 ,"Closed fracture of rib(s), unspecified",Injury and poisoning,2721,20,4.86,0.000000018811562,2.95,7.55
733.1 ,Pathological fracture,Diseases of the musculoskeletal...,2231,16,4.73,0.00000065968758,2.69,7.72
823.00 ,Closed fracture of upper end of...,Injury and poisoning,1713,12,4.61,0.0000199837,2.37,8.09
922.8 ,Contusion of multiple sites of...,Injury and poisoning,2723,19,4.61,0.000000093431409,2.76,7.24
729.81 ,Swelling of limb,Diseases of the musculoskeletal...,2465,17,4.55,0.00000050910955,2.64,7.32
923.11 ,Contusion of elbow,Injury and poisoning,3262,22,4.46,0.000000016971486,2.78,6.79
823.80 ,Closed fracture of unspecified...,Injury and poisoning,1778,12,4.44,0.0000285891,2.28,7.79
873.40 ,"Open wound of face, unspecified...",Injury and poisoning,8303,53,4.29,1.955163e-17,3.19,5.65
805.2 ,Closed fracture of dorsal [thoracic]...,Injury and poisoning,1421,9,4.16,0.0004372148,1.89,7.93
923 ,Contusion of upper limb,Injury and poisoning,2056,13,4.16,0.0000263462,2.2,7.15
805.8 ,Closed fracture of unspecified...,Injury and poisoning,1581,10,4.15,0.0002168389,1.98,7.68
366.17 ,Total or mature cataract,Diseases of the nervous system,1459,9,4.05,0.0005271093,1.84,7.72
715.34 ,"Osteoarthrosis, localized, not...",Diseases of the musculoskeletal...,2442,15,4.04,0.0000091503106,2.25,6.7
923.8 ,Contusion of multiple sites of...,Injury and poisoning,1634,10,4.02,0.0002807953,1.92,7.43
805.4 ,Closed fracture of lumbar vertebra...,Injury and poisoning,5568,33,3.94,0.0000000001378558,2.7,5.56
825.25 ,Closed fracture of metatarsal...,Injury and poisoning,3168,18,3.74,0.0000035543305,2.21,5.95
822.0 ,Closed fracture of patella,Injury and poisoning,1962,11,3.68,0.0002978062,1.83,6.62
873.4 ,"Facial laceration, without mention...",Injury and poisoning,3248,18,3.65,0.0000049753277,2.15,5.8
841.9 ,Sprains and strains of unspecified...,Injury and poisoning,5309,29,3.62,0.000000010342031,2.41,5.22
719.44 ,"Pain in joint, hand",Diseases of the musculoskeletal...,4945,26,3.47,0.0000001209837,2.26,5.12
879.8 ,Open wound(s) (multiple) of unspecified...,Injury and poisoning,10030,52,3.47,0.0000000000001286188,2.58,4.58
924.4 ,Contusion of multiple sites of...,Injury and poisoning,2276,12,3.46,0.0002801394,1.78,6.07
733.09 ,Other osteoporosis,Diseases of the musculoskeletal...,4958,26,3.46,0.00000012714282,2.25,5.1
729.8 ,Other musculoskeletal symptoms...,Diseases of the musculoskeletal...,1954,10,3.35,0.0010923056,1.6,6.2
882.1 ,Open wound of hand except finger(s)...,Injury and poisoning,1388,7,3.3,0.0063154269,1.32,6.84
923.20 ,Contusion of hand(s),Injury and poisoning,3790,19,3.3,0.0000110946,1.98,5.18
850 ,Concussion,Injury and poisoning,3418,17,3.27,0.0000346599,1.9,5.26
354 ,Mononeuritis of upper limb and...,Diseases of the nervous system,1816,9,3.25,0.0023521575,1.48,6.19
850.0 ,Concussion with no loss of consciousness,Injury and poisoning,6243,30,3.18,0.000000092221411,2.13,4.56
296.9 ,Other and unspecified affective...,Mental disorders,1462,7,3.13,0.0082610342,1.25,6.49
716.56 ,Unspecified polyarthropathy or...,Diseases of the musculoskeletal...,1676,8,3.12,0.0050090958,1.34,6.19
998.5 ,Postoperative infection,Injury and poisoning,4244,20,3.1,0.0000158539,1.89,4.81
826.0 ,Closed fracture of one or more...,Injury and poisoning,3187,15,3.09,0.0001761847,1.72,5.12
511.0 ,Pleurisy without mention of effusion...,Diseases of the respiratory system,1501,7,3.05,0.0094479858,1.22,6.32
882.0 ,Open wound of hand except finger(s)...,Injury and poisoning,10053,46,3.05,0.0000000001855378,2.22,4.09
873.0 ,"Open wound of scalp, without mention...",Injury and poisoning,6991,32,3.03,0.00000010261231,2.06,4.3
922.2 ,Contusion of abdominal wall,Injury and poisoning,2384,11,3.02,0.0014329768,1.5,5.44
385.32 ,Cholesteatoma of middle ear,Diseases of the nervous system,3060,14,3,0.0003769422,1.63,5.06
884.0 ,Multiple and unspecified open...,Injury and poisoning,18777,83,3,6.277761e-17,2.37,3.74
403.90 ,"Hypertensive chronic kidney disease,...",Diseases of the circulatory system,2627,12,2.99,0.0009697532,1.54,5.26
854.01 ,Intracranial injury of other and...,Injury and poisoning,3517,16,2.99,0.0001593022,1.7,4.88
310.2 ,Postconcussion syndrome,Mental disorders,2854,13,2.99,0.0006245004,1.58,5.13
873.8 ,Other and unspecified open wound...,Injury and poisoning,2866,13,2.97,0.0006487295,1.58,5.11
854.00 ,Intracranial injury of other and...,Injury and poisoning,6697,30,2.96,0.00000039425911,1.99,4.25
337.9 ,Unspecified disorder of autonomic...,Diseases of the nervous system,2242,10,2.92,0.0029358783,1.4,5.4
728.8 ,"Other disorders of muscle, ligament...",Diseases of the musculoskeletal...,3385,15,2.91,0.0003304934,1.62,4.82
357.9 ,Unspecified inflammatory and toxic...,Diseases of the nervous system,1807,8,2.9,0.0077086528,1.25,5.73
890.0 ,"Open wound of hip and thigh, without...",Injury and poisoning,2272,10,2.88,0.0032212534,1.38,5.32
716.50 ,Unspecified polyarthropathy or...,Diseases of the musculoskeletal...,3894,17,2.87,0.0001632007,1.66,4.61
916 ,"Superficial injury of hip, thigh,...",Injury and poisoning,1604,7,2.85,0.01317671,1.14,5.91
914.0 ,Abrasion or friction burn of hand(s)...,Injury and poisoning,2544,11,2.83,0.0023583382,1.41,5.09
354.1 ,Other lesion of median nerve,Diseases of the nervous system,1854,8,2.82,0.0089041499,1.21,5.59
927.3 ,Crushing injury of finger(s),Injury and poisoning,1858,8,2.82,0.0090119273,1.21,5.58
440 ,Atherosclerosis,Diseases of the circulatory system,1947,8,2.69,0.011670308,1.16,5.32
842.10 ,"Sprain of hand, unspecified site",Injury and poisoning,2685,11,2.68,0.0035289184,1.33,4.82
839.8 ,"Closed dislocation, multiple and...",Injury and poisoning,3471,14,2.64,0.0012479021,1.44,4.46
922.3 ,Contusion of back,Injury and poisoning,12182,48,2.62,0.0000000084363479,1.92,3.5
726.0 ,Adhesive capsulitis of shoulder,Diseases of the musculoskeletal...,39298,146,2.58,6.734555e-22,2.16,3.07
737.30 ,"Scoliosis [and kyphoscoliosis],...",Diseases of the musculoskeletal...,2038,8,2.57,0.0149436331,1.1,5.08
715.14 ,"Osteoarthrosis, localized, primary,...",Diseases of the musculoskeletal...,2047,8,2.55,0.0153000977,1.1,5.06
850.9 ,"Concussion, unspecified",Injury and poisoning,6728,26,2.54,0.0000282547,1.66,3.75
922.9 ,Contusion of unspecified part...,Injury and poisoning,7059,27,2.52,0.0000238446,1.65,3.69
372.41 ,"Peripheral pterygium, stationary",Diseases of the nervous system,2085,8,2.51,0.0168732607,1.08,4.96
277.9 ,Unspecified disorder of metabolism,"Endocrine, nutritional and metabolic...",1576,6,2.49,0.0369657125,0.91,5.44
239.9 ,"Neoplasm of unspecified nature,...",Neoplasms,1590,6,2.46,0.0383088294,0.9,5.39
891 ,"Open wound of knee, leg (except...",Injury and poisoning,2943,11,2.45,0.0068400505,1.22,4.39
574.5 ,Calculus of bile duct without...,Diseases of the digestive system,1604,6,2.44,0.0396826269,0.89,5.34
729 ,Other disorders of soft tissues,Diseases of the musculoskeletal...,2409,9,2.44,0.0136702219,1.11,4.66
707.9 ,Chronic ulcer of unspecified site,Diseases of the skin and subcutaneous...,1908,7,2.4,0.0301415487,0.96,4.96
709.2 ,Scar conditions and fibrosis of...,Diseases of the skin and subcutaneous...,2732,10,2.39,0.0110213994,1.14,4.42
533.91 ,"Peptic ulcer of unspecified site,...",Diseases of the digestive system,2462,9,2.39,0.0155096724,1.09,4.56
381.60 ,"Obstruction of Eustachian tube,...",Diseases of the nervous system,1378,5,2.37,0.0639116281,0.77,5.55
493.11 ,Intrinsic asthma with status asthmaticus,Diseases of the respiratory system,1659,6,2.36,0.0453795982,0.86,5.16
333.1 ,Essential and other specified...,Diseases of the nervous system,1944,7,2.35,0.0328215525,0.94,4.87
919.0 ,"Abrasion or friction burn of other,...",Injury and poisoning,11269,40,2.35,0.0000023337755,1.67,3.22
478 ,Other diseases of upper respiratory...,Diseases of the respiratory system,3067,11,2.35,0.0091177143,1.17,4.22
525.9 ,Unspecified disorder of the teeth...,Diseases of the digestive system,1395,5,2.34,0.066582599,0.76,5.48
922.1 ,Contusion of chest wall,Injury and poisoning,28025,97,2.34,0.0000000000005752535,1.89,2.88
719.42 ,"Pain in joint, upper arm",Diseases of the musculoskeletal...,1704,6,2.3,0.050400301,0.84,5.02
354.9 ,"Mononeuritis of upper limb, unspecified",Diseases of the nervous system,2839,10,2.3,0.0140400149,1.1,4.25
493.0 ,Extrinsic asthma,Diseases of the respiratory system,1430,5,2.28,0.0722743616,0.74,5.35
558.2 ,Toxic gastroenteritis and colitis,Diseases of the digestive system,2293,8,2.28,0.0275916869,0.98,4.51
298.9 ,Unspecified psychosis,Mental disorders,2575,9,2.28,0.0200286539,1.04,4.35
386.50 ,"Labyrinthine dysfunction, unspecified",Diseases of the nervous system,2316,8,2.26,0.0290118211,0.97,4.46
569.9 ,Unspecified disorder of intestine,Diseases of the digestive system,4938,17,2.26,0.0026412315,1.31,3.63
226 ,Benign neoplasm of thyroid glands,Neoplasms,4661,16,2.25,0.0036864873,1.28,3.67
924.10 ,Contusion of lower leg,Injury and poisoning,4369,15,2.25,0.0050680045,1.25,3.73
733.00 ,"Osteoporosis, unspecified",Diseases of the musculoskeletal...,128192,378,2.25,3.09894e-36,1.99,2.53
842.19 ,Other sprains and strains of hand,Injury and poisoning,1465,5,2.23,0.0782235843,0.72,5.22
413.0 ,Angina decubitus,Diseases of the circulatory system,2054,7,2.22,0.0419783457,0.89,4.6
366.50 ,"After-cataract, unspecified",Diseases of the nervous system,2945,10,2.22,0.0282433161,1.06,4.1
844.2 ,Sprain of cruciate ligament of...,Injury and poisoning,2956,10,2.21,0.0284683784,1.06,4.08
307.41 ,Transient disorder of initiating...,Mental disorders,8046,27,2.21,0.0002520945,1.45,3.23
722.91 ,"Other and unspecified disc disorder,...",Diseases of the musculoskeletal...,4781,16,2.19,0.0043582009,1.25,3.58
706.8 ,Other specified diseases of sebaceous...,Diseases of the skin and subcutaneous...,2394,8,2.18,0.0342010274,0.94,4.32
719.8 ,Other specified disorders of joint,Diseases of the musculoskeletal...,1502,5,2.17,0.0847894508,0.7,5.09
842.01 ,Sprain of carpal (joint) of wrist,Injury and poisoning,1820,6,2.15,0.0648545175,0.79,4.7
599.8 ,Other specified disorders of urethra...,Diseases of the genitourinary...,1521,5,2.14,0.088270297,0.69,5.03
276.9 ,Electrolyte and fluid disorders...,"Endocrine, nutritional and metabolic...",2458,8,2.12,0.0614822783,0.91,4.21
924.5 ,Contusion of unspecified part...,Injury and poisoning,6490,21,2.12,0.0019760433,1.31,3.26
473 ,Chronic sinusitis,Diseases of the respiratory system,2474,8,2.11,0.0621706847,0.91,4.18
891.0 ,"Open wound of knee, leg [except...",Injury and poisoning,19081,60,2.09,0.00000048950695,1.59,2.71
910.0 ,"Abrasion or friction burn of face,...",Injury and poisoning,4072,13,2.09,0.0138738674,1.11,3.59
924.21 ,Contusion of ankle,Injury and poisoning,3761,12,2.09,0.0184674442,1.07,3.66
555.2 ,Regional enteritis of small intestine...,Diseases of the digestive system,3148,10,2.08,0.0339892517,0.99,3.83
719.45 ,"Pain in joint, pelvic region and...",Diseases of the musculoskeletal...,4403,14,2.08,0.0108174799,1.13,3.51
493.00 ,"Extrinsic asthma, unspecified",Diseases of the respiratory system,6657,21,2.07,0.0023911436,1.28,3.18
891.1 ,"Open wound of knee, leg [except...",Injury and poisoning,4100,13,2.07,0.0144245955,1.1,3.56
723.8 ,Other syndromes affecting cervical...,Diseases of the musculoskeletal...,2839,9,2.07,0.0466870868,0.94,3.95
727.3 ,Other bursitis,Diseases of the musculoskeletal...,1888,6,2.07,0.0743450293,0.76,4.53
345.90 ,"Epilepsy, unspecified, without...",Diseases of the nervous system,2532,8,2.06,0.0649956612,0.89,4.08
788.6 ,Other abnormality of urination,"Comorbidities, signs, and ill-defined...",1911,6,2.05,0.0777246356,0.75,4.48
711 ,Arthropathy associated with infections,Diseases of the musculoskeletal...,1598,5,2.04,0.1031192275,0.66,4.78
729.9 ,Other and unspecified disorders...,Diseases of the musculoskeletal...,7779,24,2.03,0.001859515,1.29,3.03
389.10 ,"Sensorineural hearing loss, unspecified",Diseases of the nervous system,5830,18,2.02,0.0062155854,1.19,3.21
845.10 ,"Sprain of foot, unspecified site",Injury and poisoning,3233,10,2.02,0.0374083477,0.97,3.73
924.00 ,Contusion of thigh,Injury and poisoning,2582,8,2.02,0.067841247,0.87,4
719.90 ,"Unspecified disorder of joint,...",Diseases of the musculoskeletal...,3893,12,2.01,0.0220325287,1.04,3.53
715.30 ,"Osteoarthrosis, localized, not...",Diseases of the musculoskeletal...,6894,21,2,0.0046188432,1.23,3.07
719.80 ,"Other specified disorders of joint,...",Diseases of the musculoskeletal...,1632,5,2,0.1100455353,0.65,4.68
913.0 ,"Abrasion or friction burn of elbow,...",Injury and poisoning,4254,13,2,0.0179758834,1.06,3.43
726.10 ,Disorders of bursae and tendons...,Diseases of the musculoskeletal...,12553,38,2,0.0001237913,1.41,2.76
949.0 ,"Burn of unspecified site, unspecified...",Injury and poisoning,7208,22,2,0.0034484825,1.25,3.05
715.90 ,"Osteoarthrosis, unspecified whether...",Diseases of the musculoskeletal...,92155,257,1.99,1.79163e-20,1.73,2.28
255.4 ,Corticoadrenal insufficiency,"Endocrine, nutritional and metabolic...",1649,5,1.98,0.1135912484,0.64,4.63
843.8 ,Sprains and strains of other specified...,Injury and poisoning,1646,5,1.98,0.1129615812,0.64,4.64
276.8 ,Hypopotassemia,"Endocrine, nutritional and metabolic...",1977,6,1.98,0.1353426874,0.72,4.33
599.9 ,Unspecified disorder of urethra...,Diseases of the genitourinary...,7622,23,1.98,0.0028314621,1.25,2.98
729.5 ,Pain in limb,Diseases of the musculoskeletal...,19095,57,1.98,0.0000037610797,1.49,2.58
370.40 ,"Keratoconjunctivitis, unspecified",Diseases of the nervous system,5971,18,1.97,0.007310229,1.17,3.13
531.70 ,Chronic gastric ulcer without...,Diseases of the digestive system,8998,27,1.97,0.0015575822,1.29,2.88
923.00 ,Contusion of shoulder region,Injury and poisoning,7341,22,1.97,0.0038440778,1.23,2.99
783.0 ,Anorexia,"Comorbidities, signs, and ill-defined...",1994,6,1.96,0.136845788,0.72,4.29
388.2 ,"Sudden hearing loss, unspecified",Diseases of the nervous system,1992,6,1.96,0.1366649145,0.72,4.29
389.1 ,Sensorineural hearing loss,Diseases of the nervous system,2329,7,1.96,0.0991363384,0.79,4.06
847 ,Sprains and strains of other and...,Injury and poisoning,1667,5,1.96,0.1174045137,0.63,4.58
530.9 ,Unspecified disorder of esophagus,Diseases of the digestive system,4029,12,1.95,0.0390400824,1,3.41
715.31 ,"Osteoarthrosis, localized, not...",Diseases of the musculoskeletal...,4367,13,1.95,0.0291621551,1.03,3.34
894.0 ,Multiple and unspecified open...,Injury and poisoning,26076,76,1.95,0.00000022214902,1.52,2.45
715.00 ,"Osteoarthrosis, generalized, site...",Diseases of the musculoskeletal...,12538,37,1.94,0.0003069459,1.36,2.7
424.1 ,Aortic valve disorders,Diseases of the circulatory system,3722,11,1.93,0.035180557,0.96,3.47
616.5 ,Ulceration of vulva,Diseases of the genitourinary...,2362,7,1.93,0.101981089,0.77,4
117.9 ,Other and unspecified mycoses,Infectious and parasitic diseases,4077,12,1.92,0.0401390641,0.99,3.37
386.53 ,"Hypoactive labyrinth, unilateral",Diseases of the nervous system,2035,6,1.92,0.1407872415,0.7,4.2
493.10 ,"Intrinsic asthma, unspecified",Diseases of the respiratory system,3074,9,1.91,0.0602113029,0.87,3.64
250.01 ,Diabetes mellitus without mention...,"Endocrine, nutritional and metabolic...",3418,10,1.91,0.046967323,0.91,3.53
716.16 ,"Traumatic arthropathy, lower leg",Diseases of the musculoskeletal...,1705,5,1.91,0.1978466032,0.62,4.48
958.3 ,Posttraumatic wound infection...,Injury and poisoning,9993,29,1.91,0.0017637093,1.27,2.75
844.1 ,Sprain of medial collateral ligament...,Injury and poisoning,2763,8,1.89,0.0812406318,0.81,3.74
715.3 ,"Osteoarthrosis, localized, not...",Diseases of the musculoskeletal...,8373,24,1.88,0.0044997668,1.2,2.81
427.2 ,"Paroxysmal tachycardia, unspecified",Diseases of the circulatory system,3129,9,1.88,0.0642630582,0.86,3.58
491.1 ,Mucopurulent chronic bronchitis,Diseases of the respiratory system,5901,17,1.88,0.0174167399,1.09,3.03
894 ,Multiple and unspecified open...,Injury and poisoning,2446,7,1.87,0.1101625466,0.75,3.86
726.60 ,"Enthesopathy of knee, unspecified",Diseases of the musculoskeletal...,3492,10,1.87,0.0763049311,0.89,3.45
823 ,Fracture of tibia and fibula,Injury and poisoning,1402,4,1.86,0.1721320897,0.51,4.78
370.00 ,"Corneal ulcer, unspecified",Diseases of the nervous system,2822,8,1.85,0.086630033,0.8,3.66
873 ,Other open wound of head,Injury and poisoning,2109,6,1.85,0.1489919229,0.68,4.05
458.9 ,"Hypotension, unspecified",Diseases of the circulatory system,1411,4,1.85,0.1748217075,0.5,4.75
884 ,Multiple and unspecified open...,Injury and poisoning,1768,5,1.84,0.2053934979,0.6,4.32
892.0 ,Open wound of foot except toe(s)...,Injury and poisoning,12157,34,1.84,0.0010341159,1.27,2.58
353.4 ,"Lumbosacral root lesions, not...",Diseases of the nervous system,8561,24,1.84,0.0053141063,1.17,2.75
491.20 ,Obstructive chronic bronchitis...,Diseases of the respiratory system,6431,18,1.83,0.0155876753,1.08,2.91
070.51 ,Acute hepatitis C without mention...,Infectious and parasitic diseases,11849,33,1.83,0.001335639,1.25,2.59
381.00 ,"Acute nonsuppurative otitis media,...",Diseases of the nervous system,2135,6,1.83,0.1521945116,0.67,4
724.00 ,"Spinal stenosis, unspecified region",Diseases of the musculoskeletal...,5726,16,1.83,0.025295221,1.04,2.98
944.00 ,Burn of unspecified degree of...,Injury and poisoning,1425,4,1.83,0.1790339385,0.5,4.7
571.5 ,Cirrhosis of liver without mention...,Diseases of the digestive system,10516,29,1.81,0.0035553813,1.21,2.61
719.89 ,"Other specified disorders of joint,...",Diseases of the musculoskeletal...,1438,4,1.81,0.2919710349,0.49,4.66
723.3 ,Cervicobrachial syndrome (diffuse),Diseases of the musculoskeletal...,5794,16,1.81,0.0265497236,1.03,2.94
346 ,Migraine,Diseases of the nervous system,5050,14,1.81,0.0435982526,0.99,3.05
920 ,"Contusion of face, scalp, and...",Injury and poisoning,14550,40,1.81,0.0005778353,1.29,2.48
379.90 ,"Disorder of eye, unspecified",Diseases of the nervous system,3265,9,1.8,0.1084892884,0.82,3.43
242.00 ,Toxic diffuse goiter without mention...,"Endocrine, nutritional and metabolic...",5455,15,1.8,0.0344280236,1,2.98
879.6 ,Open wound of other and unspecified...,Injury and poisoning,1449,4,1.8,0.2934944984,0.49,4.62
726.8 ,Other peripheral enthesopathies,Diseases of the musculoskeletal...,3630,10,1.8,0.0823037159,0.86,3.32
726.90 ,Enthesopathy of unspecified site,Diseases of the musculoskeletal...,53298,141,1.8,0.000000000823225,1.5,2.14
727.05 ,Other tenosynovitis of hand and...,Diseases of the musculoskeletal...,6544,18,1.8,0.0244052121,1.06,2.86
959.7 ,"Knee, leg, ankle, and foot injury",Injury and poisoning,2199,6,1.78,0.160751931,0.65,3.89
727.04 ,Radial styloid tenosynovitis,Diseases of the musculoskeletal...,4437,12,1.77,0.0537763892,0.91,3.1
365.20 ,"Primary angle-closure glaucoma,...",Diseases of the nervous system,2213,6,1.77,0.1627475276,0.65,3.86
229.8 ,Benign neoplasm of other specified...,Neoplasms,4447,12,1.76,0.0542916282,0.91,3.09
844 ,Sprains and strains of knee and...,Injury and poisoning,1851,5,1.76,0.217283904,0.57,4.12
721.91 ,"Spondylosis of unspecified site,...",Diseases of the musculoskeletal...,1850,5,1.76,0.2171282812,0.57,4.13
596.5 ,Other functional disorders of...,Diseases of the genitourinary...,9687,26,1.76,0.0083174267,1.14,2.59
882 ,Open wound of hand except finger(s)...,Injury and poisoning,1479,4,1.76,0.2979038165,0.48,4.53
491.8 ,Other chronic bronchitis,Diseases of the respiratory system,5608,15,1.75,0.0383658499,0.97,2.9
307.40 ,"Nonorganic sleep disorder, unspecified",Mental disorders,7109,19,1.75,0.0213906522,1.05,2.74
924.01 ,Contusion of hip,Injury and poisoning,3355,9,1.75,0.1137055043,0.8,3.34
945.00 ,Burn of unspecified degree of...,Injury and poisoning,2237,6,1.75,0.1662684384,0.64,3.82
727.00 ,"Synovitis and tenosynovitis, unspecified",Diseases of the musculoskeletal...,106822,264,1.74,0.00000000000001498941,1.52,2
727.9 ,"Unspecified disorder of synovium,...",Diseases of the musculoskeletal...,5622,15,1.74,0.0387847359,0.97,2.89
533.10 ,Acute peptic ulcer of unspecified...,Diseases of the digestive system,1507,4,1.73,0.3023414005,0.47,4.44
722.10 ,Displacement of lumbar intervertebral...,Diseases of the musculoskeletal...,22599,59,1.73,0.0001377434,1.31,2.24
726.32 ,Lateral epicondylitis,Diseases of the musculoskeletal...,14813,39,1.73,0.0014416612,1.23,2.38
533.70 ,Chronic peptic ulcer of unspecified...,Diseases of the digestive system,17271,45,1.72,0.0008043928,1.25,2.31
358.9 ,"Myoneural disorders, unspecified",Diseases of the nervous system,3422,9,1.72,0.1183806154,0.78,3.27
272.8 ,Other disorders of lipoid metabolism,"Endocrine, nutritional and metabolic...",1524,4,1.71,0.3051805368,0.46,4.4
780.59 ,Other sleep disturbances,"Comorbidities, signs, and ill-defined...",7719,20,1.7,0.0269216118,1.03,2.63
296 ,Disorganized type,Mental disorders,3074,8,1.7,0.1564595945,0.73,3.36
454.9 ,Asymptomatic varicose veins,Diseases of the circulatory system,7682,20,1.7,0.0264242402,1.04,2.64
916.0 ,"Abrasion or friction burn of hip,...",Injury and poisoning,11950,31,1.7,0.0063512718,1.15,2.43
728.85 ,Spasm of muscle,Diseases of the musculoskeletal...,7706,20,1.7,0.0267421702,1.03,2.63
070 ,Viral hepatitis,Infectious and parasitic diseases,2707,7,1.69,0.2079073214,0.68,3.49
716.90 ,"Arthropathy, unspecified, site...",Diseases of the musculoskeletal...,65711,163,1.69,0.0000000031886193,1.43,1.99
531.90 ,"Gastric ulcer, unspecified as...",Diseases of the digestive system,26437,67,1.68,0.0001184349,1.29,2.15
455.3 ,External hemorrhoids without mention...,Diseases of the circulatory system,1937,5,1.68,0.2317109083,0.54,3.94
845.0 ,Sprains and strains of ankle,Injury and poisoning,2344,6,1.67,0.1834271438,0.61,3.64
848.8 ,Other specified sites of sprains...,Injury and poisoning,7447,19,1.67,0.0355846014,1,2.62
009 ,Ill-defined intestinal infections,Infectious and parasitic diseases,3908,10,1.67,0.1012444772,0.8,3.08
492.8 ,Other emphysema,Diseases of the respiratory system,2751,7,1.66,0.2113899969,0.66,3.43
233.1 ,Carcinoma in situ of cervix uteri,Neoplasms,5122,13,1.66,0.0724828962,0.88,2.84
372.9 ,Unspecified disorder of conjunctiva,Diseases of the nervous system,4752,12,1.65,0.0911835728,0.85,2.89
582 ,Chronic glomerulonephritis,Diseases of the genitourinary...,2368,6,1.65,0.1875859055,0.6,3.61
278.0 ,Obesity,"Endocrine, nutritional and metabolic...",7538,19,1.65,0.0373360404,0.99,2.59
296.3 ,"Major depressive disorder, recurrent...",Mental disorders,1978,5,1.65,0.2392713344,0.53,3.86
362.10 ,"Background retinopathy, unspecified",Diseases of the nervous system,3947,10,1.65,0.1467638079,0.79,3.05
696.1 ,Other psoriasis,Diseases of the skin and subcutaneous...,3586,9,1.64,0.1325426748,0.75,3.12
721.4 ,Thoracic or lumbar spondylosis...,Diseases of the musculoskeletal...,2775,7,1.64,0.2134754368,0.66,3.4
362.60 ,"Peripheral retinal degeneration,...",Diseases of the nervous system,5187,13,1.64,0.1046500702,0.87,2.81
616.8 ,Other specified inflammatory diseases...,Diseases of the genitourinary...,6801,17,1.63,0.0591213883,0.95,2.63
715.10 ,"Osteoarthrosis, localized, primary,...",Diseases of the musculoskeletal...,6872,17,1.62,0.0607757287,0.94,2.6
