680.0 ,Carbuncle and furuncle of face,Diseases of the skin and subcutaneous...,6070,15,1.87,0.0210168622,1.04,3.09
945.24 ,"Blisters, epidermal loss [second...",Injury and poisoning,2011,5,1.87,0.2017363531,0.61,4.39
692.1 ,Contact dermatitis and other eczema...,Diseases of the skin and subcutaneous...,4032,10,1.87,0.0762275198,0.9,3.45
388.31 ,Subjective tinnitus,Diseases of the nervous system,2436,6,1.86,0.1486444581,0.68,4.05
491.8 ,Other chronic bronchitis,Diseases of the respiratory system,5277,13,1.86,0.0342435633,0.99,3.19
183.0 ,Malignant neoplasm of ovary,Neoplasms,2848,7,1.85,0.1118919083,0.74,3.83
578.1 ,Blood in stool,Diseases of the digestive system,2444,6,1.85,0.1494728146,0.68,4.04
825.25 ,Closed fracture of metatarsal...,Injury and poisoning,3273,8,1.84,0.0873561832,0.79,3.64
722.73 ,Intervertebral disc disorder with...,Diseases of the musculoskeletal...,7401,18,1.84,0.0152153213,1.09,2.91
724.0 ,"Spinal stenosis, other than cervical",Diseases of the musculoskeletal...,2051,5,1.84,0.2060876204,0.6,4.3
110.3 ,Dermatophytosis of groin and perianal...,Infectious and parasitic diseases,13210,32,1.84,0.0016076449,1.25,2.6
686 ,Other local infections of skin...,Diseases of the skin and subcutaneous...,11176,27,1.83,0.0037345689,1.2,2.67
691 ,Atopic dermatitis and related...,Diseases of the skin and subcutaneous...,2474,6,1.83,0.1526814378,0.67,3.99
530.8 ,Other specified disorders of esophagus,Diseases of the digestive system,3298,8,1.83,0.089470503,0.79,3.62
693.1 ,Dermatitis due to food taken internally,Diseases of the skin and subcutaneous...,3300,8,1.83,0.0896424492,0.79,3.61
721.42 ,"Spondylosis with myelopathy, lumbar...",Diseases of the musculoskeletal...,10420,25,1.82,0.0062300955,1.17,2.69
729.5 ,Pain in limb,Diseases of the musculoskeletal...,20861,50,1.82,0.000111054,1.35,2.41
362.50 ,"Macular degeneration (senile),...",Diseases of the nervous system,2482,6,1.82,0.1535640175,0.67,3.98
532.30 ,Acute duodenal ulcer without mention...,Diseases of the digestive system,4970,12,1.82,0.0474052061,0.94,3.19
788.2 ,Retention of urine,"Comorbidities, signs, and ill-defined...",2920,7,1.81,0.1189582113,0.73,3.74
719.45 ,"Pain in joint, pelvic region and...",Diseases of the musculoskeletal...,5001,12,1.81,0.0485215028,0.93,3.17
726.4 ,Enthesopathy of wrist and carpus,Diseases of the musculoskeletal...,3754,9,1.81,0.1076589485,0.83,3.44
727.42 ,Ganglion of tendon sheath,Diseases of the musculoskeletal...,2502,6,1.81,0.1558193405,0.66,3.95
366.1 ,Senile cataract,Diseases of the nervous system,3339,8,1.81,0.0930777921,0.78,3.57
692.8 ,"Contact dermatitis and other eczema,...",Diseases of the skin and subcutaneous...,6715,16,1.8,0.0268785113,1.03,2.93
695.89 ,Other specified erythematous conditions,Diseases of the skin and subcutaneous...,4183,10,1.8,0.0817137628,0.86,3.33
715.96 ,"Osteoarthrosis, unspecified whether...",Diseases of the musculoskeletal...,14835,35,1.79,0.0014131256,1.24,2.5
402.10 ,Benign hypertensive heart disease...,Diseases of the circulatory system,16136,38,1.79,0.0010030529,1.26,2.46
894 ,Multiple and unspecified open...,Injury and poisoning,3787,9,1.79,0.1090826953,0.82,3.41
478.4 ,Polyp of vocal cord or larynx,Diseases of the respiratory system,10122,24,1.79,0.008402902,1.15,2.68
366.10 ,"Senile cataract, unspecified",Diseases of the nervous system,9336,22,1.78,0.0140774593,1.11,2.71
372.56 ,Conjunctival deposits,Diseases of the nervous system,3408,8,1.77,0.0995353797,0.76,3.5
715.34 ,"Osteoarthrosis, localized, not...",Diseases of the musculoskeletal...,2130,5,1.77,0.215795785,0.57,4.14
718.4 ,Contracture of joint,Diseases of the musculoskeletal...,2129,5,1.77,0.2156640568,0.57,4.14
718.40 ,"Contracture of joint, site unspecified",Diseases of the musculoskeletal...,3840,9,1.77,0.1116329591,0.81,3.37
719.42 ,"Pain in joint, upper arm",Diseases of the musculoskeletal...,2560,6,1.77,0.1627454502,0.65,3.86
440.9 ,Generalized and unspecified atherosclerosis,Diseases of the circulatory system,4268,10,1.77,0.0857090619,0.85,3.26
795.0 ,Nonspecific abnormal papanicolaou...,"Comorbidities, signs, and ill-defined...",4295,10,1.76,0.0871121843,0.84,3.24
233.1 ,Carcinoma in situ of cervix uteri,Neoplasms,10750,25,1.76,0.0076343527,1.14,2.61
923 ,Contusion of upper limb,Injury and poisoning,3435,8,1.76,0.1494131886,0.76,3.47
780.52 ,"Insomnia, unspecified","Comorbidities, signs, and ill-defined...",128567,284,1.76,9.31529e-17,1.55,2
691.8 ,Other atopic dermatitis and related...,Diseases of the skin and subcutaneous...,41827,96,1.76,0.00000056400726,1.42,2.16
054.9 ,Herpes simplex without mention...,Infectious and parasitic diseases,28215,65,1.76,0.0000329901,1.35,2.25
110.2 ,Dermatophytosis of hand,Infectious and parasitic diseases,3437,8,1.76,0.1495146078,0.76,3.47
726.1 ,"Rotator cuff syndrome of shoulder,...",Diseases of the musculoskeletal...,5163,12,1.75,0.0552168504,0.9,3.07
680.9 ,Carbuncle and furuncle of unspecified...,Diseases of the skin and subcutaneous...,30104,69,1.75,0.0000208659,1.36,2.22
756.12 ,Spondylolisthesis,Congenital anomalies,5187,12,1.75,0.080199794,0.9,3.06
681.02 ,Onychia and paronychia of finger,Diseases of the skin and subcutaneous...,7808,18,1.74,0.0271844141,1.03,2.76
259.9 ,Unspecified endocrine disorder,"Endocrine, nutritional and metabolic...",6110,14,1.73,0.0499417372,0.94,2.91
307.42 ,Persistent disorder of initiating...,Mental disorders,9200,21,1.73,0.0200576578,1.07,2.65
728.89 ,"Other disorders of muscle, ligament,...",Diseases of the musculoskeletal...,18446,42,1.73,0.0010470097,1.24,2.34
959.7 ,"Knee, leg, ankle, and foot injury",Injury and poisoning,3491,8,1.73,0.1524719159,0.74,3.41
784.7 ,Epistaxis,"Comorbidities, signs, and ill-defined...",14457,33,1.73,0.0037750637,1.19,2.44
716.10 ,"Traumatic arthropathy, site unspecified",Diseases of the musculoskeletal...,4379,10,1.72,0.0918843746,0.82,3.18
785.0 ,"Tachycardia, unspecified","Comorbidities, signs, and ill-defined...",3954,9,1.72,0.1181932106,0.78,3.27
560.81 ,Intestinal or peritoneal adhesions...,Diseases of the digestive system,2205,5,1.71,0.2262832694,0.55,4
719.47 ,"Pain in joint, ankle and foot",Diseases of the musculoskeletal...,7066,16,1.71,0.0462012423,0.97,2.78
296.20 ,"Major depressive affective disorder,...",Mental disorders,5304,12,1.71,0.083576,0.88,2.99
353.4 ,"Lumbosacral root lesions, not...",Diseases of the nervous system,8380,19,1.71,0.0330027079,1.03,2.68
117.9 ,Other and unspecified mycoses,Infectious and parasitic diseases,8887,20,1.7,0.0266044878,1.04,2.63
715.09 ,"Osteoarthrosis, generalized, multiple...",Diseases of the musculoskeletal...,5313,12,1.7,0.0838775825,0.88,2.99
569.3 ,Hemorrhage of rectum and anus,Diseases of the digestive system,4915,11,1.69,0.1100247235,0.84,3.03
401.1 ,Benign essential hypertension,Diseases of the circulatory system,36138,80,1.69,0.0000199501,1.34,2.12
295 ,Schizophrenic disorders,Mental disorders,4012,9,1.69,0.1220782988,0.77,3.22
011.90 ,"Pulmonary tuberculosis, unspecified,...",Infectious and parasitic diseases,4471,10,1.69,0.0978060302,0.81,3.11
786.50 ,"Chest pain, unspecified","Comorbidities, signs, and ill-defined...",63356,138,1.68,0.000000041306836,1.41,2
372.72 ,Conjunctival hemorrhage,Diseases of the nervous system,45387,99,1.67,0.0000030781931,1.35,2.05
373.11 ,Hordeolum externum,Diseases of the nervous system,31590,69,1.67,0.0000904784,1.29,2.12
721.0 ,Cervical spondylosis without myelopathy,Diseases of the musculoskeletal...,49584,108,1.67,0.0000012334013,1.37,2.03
726.10 ,Disorders of bursae and tendons...,Diseases of the musculoskeletal...,15884,35,1.67,0.0042892666,1.16,2.33
844.0 ,Sprain of lateral collateral ligament...,Injury and poisoning,2729,6,1.66,0.1859745426,0.61,3.62
715.31 ,"Osteoarthrosis, localized, not...",Diseases of the musculoskeletal...,3638,8,1.66,0.1625883309,0.71,3.28
728.85 ,Spasm of muscle,Diseases of the musculoskeletal...,9554,21,1.66,0.0325686157,1.03,2.55
372.51 ,Pinguecula,Diseases of the nervous system,1821,4,1.65,0.3141413857,0.45,4.25
729.8 ,Other musculoskeletal symptoms...,Diseases of the musculoskeletal...,2737,6,1.65,0.1871788423,0.6,3.61
786.01 ,Hyperventilation,"Comorbidities, signs, and ill-defined...",5031,11,1.65,0.1146150206,0.82,2.96
698 ,Pruritus and related conditions,Diseases of the skin and subcutaneous...,7319,16,1.65,0.0519723374,0.94,2.69
840.9 ,Sprains and strains of unspecified...,Injury and poisoning,24089,52,1.64,0.0009168884,1.22,2.16
239.8 ,"Neoplasms of unspecified nature,...",Neoplasms,2758,6,1.64,0.1903823397,0.6,3.58
401.0 ,Malignant essential hypertension,Diseases of the circulatory system,5527,12,1.64,0.0927736757,0.84,2.87
276.5 ,Volume depletion,"Endocrine, nutritional and metabolic...",8300,18,1.64,0.0471141233,0.97,2.6
465.9 ,Acute upper respiratory infections...,Diseases of the respiratory system,1154885,1733,1.64,4.967389e-22,1.47,1.82
621.2 ,Hypertrophy of uterus,Diseases of the genitourinary...,4126,9,1.64,0.1307502301,0.75,3.13
362.10 ,"Background retinopathy, unspecified",Diseases of the nervous system,2758,6,1.64,0.1903823397,0.6,3.58
783.2 ,Abnormal loss of weight,"Comorbidities, signs, and ill-defined...",5072,11,1.64,0.1165242932,0.81,2.93
371.89 ,Other corneal disorders,Diseases of the nervous system,2756,6,1.64,0.1900746347,0.6,3.58
786.59 ,Other chest pain,"Comorbidities, signs, and ill-defined...",21259,46,1.64,0.0016759822,1.2,2.2
455.2 ,Internal hemorrhoids with other...,Diseases of the circulatory system,8319,18,1.63,0.0474775493,0.97,2.59
461.8 ,Other acute sinusitis,Diseases of the respiratory system,20466,44,1.63,0.0025807761,1.18,2.2
726.0 ,Adhesive capsulitis of shoulder,Diseases of the musculoskeletal...,37077,79,1.63,0.0000675285,1.28,2.04
726.73 ,Calcaneal spur,Diseases of the musculoskeletal...,2308,5,1.63,0.2425018618,0.53,3.82
729.4 ,"Fasciitis, unspecified",Diseases of the musculoskeletal...,122494,253,1.63,0.000000000007688628,1.42,1.86
493.90 ,"Asthma, unspecified type, unspecified",Diseases of the respiratory system,54151,115,1.63,0.000001881026,1.34,1.97
842.00 ,"Sprain of wrist, unspecified site",Injury and poisoning,6975,15,1.62,0.0678011396,0.91,2.68
842.19 ,Other sprains and strains of hand,Injury and poisoning,2332,5,1.62,0.2465571528,0.52,3.78
729.2 ,"Neuralgia, neuritis, and radiculitis,...",Diseases of the musculoskeletal...,94552,196,1.62,0.000000001874423,1.39,1.87
927.3 ,Crushing injury of finger(s),Injury and poisoning,4197,9,1.62,0.1368215086,0.74,3.08
788.0 ,Renal colic,"Comorbidities, signs, and ill-defined...",12228,26,1.61,0.0236203771,1.05,2.36
846.0 ,Sprain of lumbosacral (joint)...,Injury and poisoning,2811,6,1.61,0.2874832234,0.59,3.51
847.0 ,Sprain of neck,Injury and poisoning,35619,75,1.61,0.0001623121,1.26,2.02
429.9 ,"Heart disease, unspecified",Diseases of the circulatory system,13182,28,1.61,0.0161464705,1.06,2.33
278.0 ,Obesity,"Endocrine, nutritional and metabolic...",13626,29,1.61,0.0171920636,1.08,2.32
437.9 ,Unspecified cerebrovascular disease,Diseases of the circulatory system,7501,16,1.61,0.0767415239,0.92,2.62
461 ,Acute sinusitis,Diseases of the respiratory system,23132,49,1.61,0.0018973417,1.19,2.13
524.6 ,Temporomandibular joint disorders,Diseases of the digestive system,2809,6,1.61,0.2873349275,0.59,3.51
034.0 ,Streptococcal sore throat,Infectious and parasitic diseases,2804,6,1.61,0.2869677362,0.59,3.52
841.9 ,Sprains and strains of unspecified...,Injury and poisoning,9436,20,1.6,0.045242401,0.98,2.48
715.26 ,"Osteoarthrosis, localized, secondary,...",Diseases of the musculoskeletal...,4245,9,1.6,0.1973296371,0.73,3.04
592.1 ,Calculus of ureter,Diseases of the genitourinary...,20342,43,1.6,0.0035545086,1.16,2.17
719.41 ,"Pain in joint, shoulder region",Diseases of the musculoskeletal...,17090,36,1.6,0.0080397661,1.11,2.22
455.4 ,External thrombosed hemorrhoids,Diseases of the circulatory system,1887,4,1.6,0.3253291971,0.43,4.1
620.0 ,Follicular cyst of ovary,Diseases of the genitourinary...,5657,12,1.6,0.0997574806,0.82,2.8
727.04 ,Radial styloid tenosynovitis,Diseases of the musculoskeletal...,4243,9,1.6,0.1972392155,0.73,3.04
535.00 ,"Acute gastritis, without mention...",Diseases of the digestive system,210490,414,1.59,4.906071e-16,1.43,1.77
727.05 ,Other tenosynovitis of hand and...,Diseases of the musculoskeletal...,9494,20,1.59,0.0462524232,0.97,2.46
995.2 ,Unspecified adverse effect od...,Injury and poisoning,2369,5,1.59,0.25299851,0.52,3.72
216.6 ,Benign neoplasm of skin of upper...,Neoplasms,3824,8,1.58,0.1794199046,0.68,3.12
523.0 ,Acute gingivitis,Diseases of the digestive system,7634,16,1.58,0.0798379486,0.9,2.58
573.3 ,"Hepatitis, unspecified",Diseases of the digestive system,24124,50,1.57,0.0031109579,1.16,2.08
240.0 ,"Goiter, specified as simple","Endocrine, nutritional and metabolic...",5295,11,1.57,0.1294342226,0.78,2.81
300.81 ,Somatization disorder,Mental disorders,1913,4,1.57,0.3300043439,0.43,4.04
632 ,Missed abortion,"Complications of pregnancy, childbirth,...",1920,4,1.57,0.3312873266,0.43,4.03
698.0 ,Pruritus ani,Diseases of the skin and subcutaneous...,1918,4,1.57,0.3309197296,0.43,4.03
533.70 ,Chronic peptic ulcer of unspecified...,Diseases of the digestive system,19260,40,1.57,0.0069340328,1.12,2.15
289.9 ,Unspecified diseases of blood...,Diseases of the blood and blood-forming...,1926,4,1.56,0.3323950226,0.43,4.02
300.01 ,Panic disorder without agoraphobia,Mental disorders,5812,12,1.56,0.1432512443,0.8,2.73
357.2 ,Polyneuropathy in diabetes,Diseases of the nervous system,2415,5,1.56,0.2613108919,0.51,3.65
366 ,Cataract,Diseases of the nervous system,2411,5,1.56,0.2605752129,0.51,3.66
690 ,Erythematosquamous dermatosis,Diseases of the skin and subcutaneous...,23339,48,1.56,0.003666945,1.15,2.08
692.3 ,Contact dermatitis and other eczema...,Diseases of the skin and subcutaneous...,13063,27,1.56,0.0287255068,1.03,2.28
379.91 ,Pain in or around eye,Diseases of the nervous system,4368,9,1.55,0.2038808661,0.71,2.96
244.9 ,Unspecified acquired hypothyroidism,"Endocrine, nutritional and metabolic...",11180,23,1.55,0.0486277742,0.98,2.34
595.89 ,Other specified types of cystitis,Diseases of the genitourinary...,2432,5,1.55,0.2644639863,0.5,3.62
429.3 ,Cardiomegaly,Diseases of the circulatory system,1943,4,1.55,0.3355727971,0.42,3.98
722.70 ,Intervertebral disc disorder with...,Diseases of the musculoskeletal...,1946,4,1.55,0.3361395086,0.42,3.98
300.4 ,Dysthymic disorder,Mental disorders,51014,103,1.55,0.0000438265,1.26,1.88
726.90 ,Enthesopathy of unspecified site,Diseases of the musculoskeletal...,75233,151,1.55,0.0000010238822,1.3,1.83
524.60 ,"Temporomandibular joint disorders,...",Diseases of the digestive system,4862,10,1.55,0.1630138714,0.74,2.86
531.90 ,"Gastric ulcer, unspecified as...",Diseases of the digestive system,28994,59,1.55,0.0018893505,1.17,2
787.0 ,Nausea and vomiting,"Comorbidities, signs, and ill-defined...",56808,115,1.55,0.0000172155,1.28,1.87
555.1 ,Regional enteritis of large intestine,Diseases of the digestive system,4407,9,1.54,0.2063538644,0.7,2.93
709.4 ,Foreign body granuloma of skin...,Diseases of the skin and subcutaneous...,1951,4,1.54,0.3370879138,0.42,3.97
250.50 ,"Diabetes with ophthalmic manifestations,...","Endocrine, nutritional and metabolic...",1952,4,1.54,0.3372781742,0.42,3.96
311 ,"Depressive disorder, not elsewhere...",Mental disorders,12230,25,1.54,0.0444409317,1,2.29
477.8 ,Allergic rhinitis due to other...,Diseases of the respiratory system,11308,23,1.54,0.0501855392,0.97,2.31
629.8 ,Other specified disorders of female...,Diseases of the genitourinary...,11276,23,1.54,0.0497553646,0.97,2.32
640.03 ,"Threatened abortion, antepartum...","Complications of pregnancy, childbirth,...",4903,10,1.54,0.1659406631,0.74,2.84
070 ,Viral hepatitis,Infectious and parasitic diseases,3430,7,1.54,0.2343346642,0.62,3.18
535.40 ,"Other specified gastritis, without...",Diseases of the digestive system,36307,73,1.53,0.0007600516,1.19,1.93
558.2 ,Toxic gastroenteritis and colitis,Diseases of the digestive system,3446,7,1.53,0.2361220698,0.61,3.16
719 ,Other and unspecified disorders...,Diseases of the musculoskeletal...,2464,5,1.53,0.2705122341,0.5,3.58
414.8 ,Other specified forms of chronic...,Diseases of the circulatory system,4924,10,1.53,0.1675030048,0.73,2.82
720.0 ,Ankylosing spondylitis,Diseases of the musculoskeletal...,6428,13,1.53,0.1220820008,0.81,2.62
435.1 ,Vertebral artery syndrome,Diseases of the circulatory system,1968,4,1.53,0.3403482156,0.42,3.93
614 ,"Inflammatory disease of ovary,...",Diseases of the genitourinary...,7868,16,1.53,0.087428583,0.87,2.5
614.4 ,Chronic or unspecified parametritis...,Diseases of the genitourinary...,8380,17,1.53,0.0947483544,0.89,2.46
724 ,Other and unspecified disorders...,Diseases of the musculoskeletal...,7885,16,1.53,0.0880848676,0.87,2.49
533.00 ,Acute peptic ulcer of unspecified...,Diseases of the digestive system,9861,20,1.53,0.0690373016,0.93,2.37
704.8 ,Other specified diseases of hair...,Diseases of the skin and subcutaneous...,22397,45,1.52,0.0072774626,1.11,2.05
842.09 ,Other sprains and strains of wrist,Injury and poisoning,5462,11,1.52,0.1863185147,0.76,2.72
719.48 ,"Pain in joint, other specified...",Diseases of the musculoskeletal...,5952,12,1.52,0.1498297695,0.78,2.66
300.02 ,Generalized anxiety disorder,Mental disorders,20925,42,1.52,0.009722935,1.09,2.06
627.4 ,Symptomatic states associated...,Diseases of the genitourinary...,2969,6,1.52,0.3016361754,0.56,3.32
930.0 ,Corneal foreign body,Injury and poisoning,39034,78,1.52,0.000544409,1.2,1.91
944.00 ,Burn of unspecified degree of...,Injury and poisoning,2470,5,1.52,0.2716622339,0.49,3.57
702.8 ,Other specified dermatoses,Diseases of the skin and subcutaneous...,7506,15,1.51,0.1111186962,0.84,2.49
428.0 ,"Congestive heart failure, unspecified",Diseases of the circulatory system,7991,16,1.51,0.1196921435,0.86,2.46
721.3 ,Lumbosacral spondylosis without...,Diseases of the musculoskeletal...,82705,162,1.51,0.0000018522599,1.28,1.78
476.0 ,Chronic laryngitis,Diseases of the respiratory system,5492,11,1.51,0.1877267662,0.75,2.71
626.0 ,Absence of menstruation,Diseases of the genitourinary...,99464,194,1.51,0.00000017289377,1.3,1.76
491.0 ,Simple chronic bronchitis,Diseases of the respiratory system,12032,24,1.51,0.0575892176,0.96,2.25
844.9 ,Sprains and strains of unspecified...,Injury and poisoning,17136,34,1.5,0.0259223454,1.04,2.11
623.5 ,"Leukorrhea, not specified as infective",Diseases of the genitourinary...,73418,143,1.5,0.0000098024292,1.26,1.78
337.9 ,Unspecified disorder of autonomic...,Diseases of the nervous system,3016,6,1.5,0.306715365,0.55,3.27
131.01 ,Trichomonal vulvovaginitis,Infectious and parasitic diseases,10109,20,1.49,0.0748439901,0.91,2.31
713.8 ,Arthropathy associated with other...,Diseases of the musculoskeletal...,3041,6,1.49,0.3095670551,0.54,3.24
610.3 ,Fibrosclerosis of breast,Diseases of the genitourinary...,6052,12,1.49,0.1555116849,0.77,2.62
300.00 ,"Anxiety state, unspecified",Mental disorders,119772,229,1.49,0.000000061355272,1.29,1.71
726.12 ,Bicipital tenosynovitis,Diseases of the musculoskeletal...,5563,11,1.49,0.191409734,0.74,2.67
726.39 ,Other enthesopathy of elbow region,Diseases of the musculoskeletal...,2519,5,1.49,0.39858167,0.48,3.5
490 ,"Bronchitis, not specified as acute...",Diseases of the respiratory system,53756,105,1.49,0.0001417073,1.22,1.82
733.01 ,Senile osteoporosis,Diseases of the musculoskeletal...,14754,29,1.49,0.0401547684,0.99,2.14
686.8 ,Other specified local infections...,Diseases of the skin and subcutaneous...,43486,85,1.49,0.000637337,1.18,1.85
782.2 ,"Localized superficial swelling,...","Comorbidities, signs, and ill-defined...",2530,5,1.49,0.399570854,0.48,3.48
532.00 ,"Acute duodenal ulcer with hemorrhage,...",Diseases of the digestive system,2020,4,1.49,0.3506465839,0.41,3.83
372.2 ,Blepharoconjunctivitis,Diseases of the nervous system,4040,8,1.49,0.2708101994,0.64,2.95
386.00 ,"Minihre's disease, unspecified",Diseases of the nervous system,29768,58,1.48,0.004833875,1.12,1.92
847.2 ,Sprain of lumbar,Injury and poisoning,48909,95,1.48,0.0003966741,1.19,1.82
245.9 ,"Thyroiditis, unspecified","Endocrine, nutritional and metabolic...",2029,4,1.48,0.3524761258,0.4,3.81
716.99 ,"Arthropathy, unspecified, multiple...",Diseases of the musculoskeletal...,4584,9,1.48,0.2198296356,0.68,2.82
722.91 ,"Other and unspecified disc disorder,...",Diseases of the musculoskeletal...,7134,14,1.48,0.140604693,0.81,2.49
295.30 ,"Paranoid type schizophrenia, unspecified",Mental disorders,2033,4,1.48,0.3532935105,0.4,3.8
296.2 ,"Major depressive disorder, single...",Mental disorders,4568,9,1.48,0.2184655237,0.68,2.83
470 ,Deviated nasal septum,Diseases of the respiratory system,10689,21,1.48,0.0812315938,0.92,2.27
308.0 ,Predominant disturbance of emotions,Mental disorders,6119,12,1.48,0.1597607937,0.76,2.59
346.9 ,"Migraine, unspecified",Diseases of the nervous system,36035,70,1.48,0.0020893509,1.15,1.88
354.0 ,Carpal tunnel syndrome,Diseases of the nervous system,42238,82,1.48,0.0008904257,1.17,1.84
631 ,Other abnormal product of conception,"Complications of pregnancy, childbirth,...",2038,4,1.48,0.354318874,0.4,3.8
686.9 ,Unspecified local infection of...,Diseases of the skin and subcutaneous...,107317,204,1.48,0.0000004650017,1.27,1.7
695.3 ,Rosacea,Diseases of the skin and subcutaneous...,5077,10,1.48,0.2399066704,0.71,2.74
708.8 ,Other specified urticaria,Diseases of the skin and subcutaneous...,17534,34,1.47,0.0360223178,1.01,2.06
724.9 ,Other unspecified back disorders,Diseases of the musculoskeletal...,21572,42,1.47,0.0180746469,1.06,2
307.41 ,Transient disorder of initiating...,Mental disorders,8183,16,1.47,0.1255486466,0.84,2.4
680.8 ,Carbuncle and furuncle of other...,Diseases of the skin and subcutaneous...,2563,5,1.47,0.4026872851,0.48,3.44
681.9 ,Cellulitis and abscess of unspecified...,Diseases of the skin and subcutaneous...,12862,25,1.47,0.0665575231,0.95,2.17
571.0 ,Alcoholic fatty liver,Diseases of the digestive system,2574,5,1.46,0.4037746186,0.47,3.42
386.9 ,Unspecified vertiginous syndromes...,Diseases of the nervous system,30584,59,1.46,0.005454777,1.11,1.9
389.10 ,"Sensorineural hearing loss, unspecified",Diseases of the nervous system,5663,11,1.46,0.1974088421,0.73,2.63
682.2 ,Cellulitis and abscess of trunk,Diseases of the skin and subcutaneous...,2064,4,1.46,0.3597141263,0.4,3.75
226 ,Benign neoplasm of thyroid glands,Neoplasms,6747,13,1.45,0.1770277408,0.77,2.49
592.0 ,Calculus of kidney,Diseases of the genitourinary...,32915,63,1.45,0.0057326072,1.11,1.87
413.9 ,Other and unspecified angina pectoris,Diseases of the circulatory system,26077,50,1.45,0.0125971747,1.07,1.92
454.9 ,Asymptomatic varicose veins,Diseases of the circulatory system,8830,17,1.45,0.139429172,0.84,2.33
616.4 ,Other abscess of vulva,Diseases of the genitourinary...,3646,7,1.45,0.3532394538,0.58,2.99
464.20 ,Acute laryngotracheitis without...,Diseases of the respiratory system,75609,143,1.45,0.0000410798,1.22,1.72
300.89 ,Other somatoform disorders,Mental disorders,7285,14,1.45,0.1924544204,0.79,2.44
478.5 ,Other diseases of vocal cords,Diseases of the respiratory system,55505,105,1.45,0.0004529833,1.18,1.76
491.1 ,Mucopurulent chronic bronchitis,Diseases of the respiratory system,6228,12,1.45,0.2168060813,0.75,2.54
949.0 ,"Burn of unspecified site, unspecified...",Injury and poisoning,12007,23,1.45,0.0783604263,0.91,2.18
365.04 ,Ocular hypertension,Diseases of the nervous system,2604,5,1.45,0.4068596315,0.47,3.38
708.0 ,Allergic urticaria,Diseases of the skin and subcutaneous...,57196,108,1.44,0.0004370878,1.18,1.75
571.41 ,Chronic persistent hepatitis,Diseases of the digestive system,8913,17,1.44,0.1419038174,0.84,2.31
716.96 ,"Arthropathy, unspecified, lower...",Diseases of the musculoskeletal...,6802,13,1.44,0.1799122366,0.77,2.47
719.40 ,"Pain in joint, site unspecified",Diseases of the musculoskeletal...,70235,132,1.44,0.0001065007,1.2,1.72
611.79 ,Other signs and symptoms in breast,Diseases of the genitourinary...,3658,7,1.44,0.3540398526,0.58,2.98
466.1 ,Acute bronchiolitis,Diseases of the respiratory system,75916,142,1.44,0.0000667947,1.2,1.7
353.8 ,Other nerve root and plexus disorders,Diseases of the nervous system,2612,5,1.44,0.4077112397,0.47,3.37
729.0 ,"Rheumatism, unspecified and fibrositis",Diseases of the musculoskeletal...,13625,26,1.44,0.0747149378,0.94,2.12
733.09 ,Other osteoporosis,Diseases of the musculoskeletal...,2610,5,1.44,0.407497213,0.47,3.38
782.0 ,Disturbance of skin sensation,"Comorbidities, signs, and ill-defined...",3133,6,1.44,0.3209060274,0.53,3.15
424.1 ,Aortic valve disorders,Diseases of the circulatory system,2110,4,1.43,0.3695048194,0.39,3.66
306.0 ,Musculoskeletal malfunction arising...,Mental disorders,2626,5,1.43,0.4092302183,0.46,3.36
307.40 ,"Nonorganic sleep disorder, unspecified",Mental disorders,7932,15,1.43,0.1629263862,0.8,2.36
729.9 ,Other and unspecified disorders...,Diseases of the musculoskeletal...,10566,20,1.43,0.1080424854,0.87,2.21
780.4 ,Dizziness and giddiness,"Comorbidities, signs, and ill-defined...",309915,545,1.43,0.000000000002093978,1.3,1.58
782.3 ,Edema,"Comorbidities, signs, and ill-defined...",44045,83,1.43,0.0022122512,1.14,1.79
111.9 ,"Dermatomycosis, unspecified",Infectious and parasitic diseases,7446,14,1.42,0.198124059,0.77,2.39
706.1 ,Other acne,Diseases of the skin and subcutaneous...,73639,136,1.42,0.0001865168,1.18,1.69
558.1 ,Gastroenteritis and colitis due...,Diseases of the digestive system,2125,4,1.42,0.3727605699,0.39,3.64
596.9 ,Unspecified disorder of bladder,Diseases of the genitourinary...,2121,4,1.42,0.3718894766,0.39,3.65
597.80 ,"Urethritis, unspecified",Diseases of the genitourinary...,31531,59,1.42,0.0121713411,1.08,1.84
