840.0 ,Acromioclavicular (joint) (ligament)...,Injury and poisoning,2005,5,1.62,0.2444725317,0.53,3.81
366.8 ,Other cataract,Diseases of the nervous system,2023,5,1.61,0.2480336965,0.52,3.77
693.8 ,Dermatitis due to other specified...,Diseases of the skin and subcutaneous...,3643,9,1.61,0.1383277529,0.73,3.07
530.2 ,Ulcer of esophagus,Diseases of the digestive system,3233,8,1.61,0.1712165574,0.69,3.19
531.40 ,Chronic or unspecified gastric...,Diseases of the digestive system,1619,4,1.61,0.322888444,0.44,4.14
532.70 ,Chronic duodenal ulcer without...,Diseases of the digestive system,9768,24,1.61,0.0264763424,1.03,2.4
574.0 ,Calculus of gallbladder with acute...,Diseases of the digestive system,2428,6,1.61,0.2871855452,0.59,3.52
724.1 ,Pain in thoracic spine,Diseases of the musculoskeletal...,2431,6,1.61,0.2874445257,0.59,3.51
478.6 ,Edema of larynx,Diseases of the respiratory system,1614,4,1.61,0.3218839763,0.44,4.15
782.2 ,"Localized superficial swelling,...","Comorbidities, signs, and ill-defined...",1632,4,1.6,0.3255349676,0.43,4.1
524.62 ,"Temporomandibular joint disorders,...",Diseases of the digestive system,1628,4,1.6,0.3247153363,0.43,4.11
788.2 ,Retention of urine,"Comorbidities, signs, and ill-defined...",2443,6,1.6,0.2885047238,0.59,3.5
215.9 ,Other benign neoplasm of connective...,Neoplasms,4479,11,1.6,0.1221774956,0.8,2.88
713.8 ,Arthropathy associated with other...,Diseases of the musculoskeletal...,2443,6,1.6,0.2885047238,0.59,3.5
250.6 ,Diabetes with neurological manifestations,"Endocrine, nutritional and metabolic...",6530,16,1.6,0.0775814536,0.91,2.61
296.90 ,Unspecified episodic mood disorder,Mental disorders,3657,9,1.6,0.1398140272,0.73,3.06
721.90 ,"Spondylosis of unspecified site,...",Diseases of the musculoskeletal...,29408,71,1.6,0.0002675217,1.24,2.03
728.9 ,"Unspecified disorder of muscle,...",Diseases of the musculoskeletal...,28140,68,1.6,0.000357812,1.23,2.04
845.00 ,"Sprain of ankle, unspecified site",Injury and poisoning,9854,24,1.59,0.0276986419,1.02,2.38
306.8 ,Other specified psychophysiological...,Mental disorders,6568,16,1.59,0.0786305211,0.91,2.59
692.3 ,Contact dermatitis and other eczema...,Diseases of the skin and subcutaneous...,7049,17,1.58,0.0661226869,0.91,2.53
840.4 ,Rotator cuff (capsule) sprain,Injury and poisoning,3300,8,1.58,0.1787138942,0.68,3.13
716.59 ,Unspecified polyarthropathy or...,Diseases of the musculoskeletal...,2467,6,1.58,0.2907400727,0.58,3.46
434.0 ,Cerebral thrombosis,Diseases of the circulatory system,4535,11,1.58,0.1261112832,0.79,2.84
435.0 ,Basilar artery syndrome,Diseases of the circulatory system,2886,7,1.58,0.2247432147,0.63,3.27
733.01 ,Senile osteoporosis,Diseases of the musculoskeletal...,33128,79,1.58,0.0001906737,1.24,1.99
785.0 ,"Tachycardia, unspecified","Comorbidities, signs, and ill-defined...",3313,8,1.57,0.1802515274,0.68,3.11
693.0 ,Dermatitis due to drugs and medicines...,Diseases of the skin and subcutaneous...,4996,12,1.57,0.1416886822,0.81,2.75
533.90 ,"Peptic ulcer of unspecified site,...",Diseases of the digestive system,99866,227,1.57,0.0000000032335818,1.35,1.81
564.5 ,Functional diarrhea,Diseases of the digestive system,17967,43,1.57,0.0051608204,1.13,2.13
845 ,Sprains and strains of ankle and...,Injury and poisoning,2071,5,1.57,0.2578782575,0.51,3.68
428.9 ,"Heart failure, unspecified",Diseases of the circulatory system,7494,18,1.57,0.0726034976,0.93,2.49
560.39 ,Other impaction of intestine,Diseases of the digestive system,1665,4,1.56,0.3324712749,0.43,4.02
274 ,Gout,"Endocrine, nutritional and metabolic...",10047,24,1.56,0.0389570775,1,2.34
346.1 ,Common migraine,Diseases of the nervous system,5454,13,1.56,0.11581199,0.83,2.67
239.8 ,"Neoplasms of unspecified nature,...",Neoplasms,1682,4,1.55,0.3361610955,0.42,3.98
719.4 ,Pain in joint,Diseases of the musculoskeletal...,19927,47,1.55,0.0045266406,1.13,2.08
848.9 ,Unspecified site of sprain and...,Injury and poisoning,94525,213,1.55,0.000000023781326,1.33,1.79
722.2 ,Displacement of intervertebral...,Diseases of the musculoskeletal...,12720,30,1.55,0.0223555658,1.04,2.22
726.31 ,Medial epicondylitis,Diseases of the musculoskeletal...,2105,5,1.55,0.2651407644,0.5,3.62
472.2 ,Chronic nasopharyngitis,Diseases of the respiratory system,15259,36,1.55,0.0158803541,1.08,2.15
295 ,Schizophrenic disorders,Mental disorders,2112,5,1.54,0.2666642211,0.5,3.61
523.0 ,Acute gingivitis,Diseases of the digestive system,6848,16,1.53,0.1177124594,0.87,2.49
211.3 ,Benign neoplasm of colon,Neoplasms,4254,10,1.53,0.1671557264,0.73,2.83
714.9 ,Unspecified inflammatory polyarthropathy,Diseases of the musculoskeletal...,4269,10,1.53,0.1684790561,0.73,2.82
366.16 ,Senile nuclear sclerosis,Diseases of the nervous system,9421,22,1.53,0.0620416486,0.95,2.32
682 ,Other cellulitis and abscess,Diseases of the skin and subcutaneous...,4690,11,1.53,0.1844428511,0.76,2.75
070.9 ,Unspecified viral hepatitis without...,Infectious and parasitic diseases,8623,20,1.52,0.0710968237,0.92,2.35
705.81 ,Dyshidrosis,Diseases of the skin and subcutaneous...,12533,29,1.52,0.0374825552,1.01,2.19
535.01 ,"Acute gastritis, with hemorrhage",Diseases of the digestive system,2997,7,1.52,0.2384898802,0.61,3.15
575.1 ,Other cholecystitis,Diseases of the digestive system,2996,7,1.52,0.2383557318,0.61,3.15
722.52 ,Degeneration of lumbar or lumbosacral...,Diseases of the musculoskeletal...,2565,6,1.52,0.3013836901,0.56,3.33
447.6 ,"Arteritis, unspecified",Diseases of the circulatory system,6437,15,1.52,0.108378415,0.85,2.52
924.1 ,Contusion of knee and lower leg,Injury and poisoning,1712,4,1.52,0.3428543455,0.41,3.91
727.42 ,Ganglion of tendon sheath,Diseases of the musculoskeletal...,1712,4,1.52,0.3428543455,0.41,3.91
784.7 ,Epistaxis,"Comorbidities, signs, and ill-defined...",10860,25,1.51,0.0478985511,0.97,2.23
569.0 ,Anal and rectal polyp,Diseases of the digestive system,2156,5,1.51,0.3963385522,0.49,3.54
569.3 ,Hemorrhage of rectum and anus,Diseases of the digestive system,3025,7,1.51,0.2423185734,0.6,3.12
573.3 ,"Hepatitis, unspecified",Diseases of the digestive system,19545,45,1.51,0.0094302536,1.1,2.04
574.10 ,Calculus of gallbladder with other...,Diseases of the digestive system,5194,12,1.51,0.1527334314,0.78,2.64
629.9 ,Unspecified disorder of female...,Diseases of the genitourinary...,16080,37,1.51,0.0188722735,1.06,2.09
682.9 ,Cellulitis and abscess of unspecified...,Diseases of the skin and subcutaneous...,37074,84,1.5,0.0005448979,1.19,1.87
715.35 ,"Osteoarthrosis, localized, not...",Diseases of the musculoskeletal...,5221,12,1.5,0.1545724775,0.77,2.63
721.0 ,Cervical spondylosis without myelopathy,Diseases of the musculoskeletal...,43106,97,1.5,0.0002527471,1.21,1.84
431 ,Intracerebral hemorrhage,Diseases of the circulatory system,4358,10,1.5,0.238076747,0.72,2.76
614.6 ,"Pelvic peritoneal adhesions, female...",Diseases of the genitourinary...,2167,5,1.5,0.3974233121,0.49,3.52
726.11 ,Calcifying tendinitis of shoulder,Diseases of the musculoskeletal...,3917,9,1.5,0.2153065949,0.68,2.85
924.11 ,Contusion of knee,Injury and poisoning,13934,32,1.5,0.0285192205,1.02,2.14
780.52 ,"Insomnia, unspecified","Comorbidities, signs, and ill-defined...",108606,236,1.49,0.000000077421282,1.29,1.72
367.89 ,Other disorders of refraction...,Diseases of the nervous system,7002,16,1.49,0.1223911346,0.85,2.43
527.2 ,Sialoadenitis,Diseases of the digestive system,1749,4,1.49,0.351408228,0.4,3.83
531.30 ,Acute gastric ulcer without mention...,Diseases of the digestive system,6589,15,1.49,0.1512316833,0.83,2.46
701.4 ,Keloid scar,Diseases of the skin and subcutaneous...,3949,9,1.49,0.2183684896,0.68,2.83
533.0 ,"Peptic ulcer, site unspecified...",Diseases of the digestive system,2616,6,1.49,0.3078250305,0.55,3.26
241.1 ,Nontoxic multinodular goiter,"Endocrine, nutritional and metabolic...",4381,10,1.49,0.2392201209,0.71,2.75
242.9 ,Thyrotoxicosis w/m of goiter or...,"Endocrine, nutritional and metabolic...",6124,14,1.49,0.1380403858,0.81,2.51
250.40 ,"Diabetes with renal manifestations,...","Endocrine, nutritional and metabolic...",11008,25,1.49,0.064481977,0.96,2.2
923.3 ,Contusion of finger,Injury and poisoning,2190,5,1.49,0.3998022062,0.48,3.48
924.3 ,Contusion of toe,Injury and poisoning,1752,4,1.49,0.3521154339,0.4,3.82
629.8 ,Other specified disorders of female...,Diseases of the genitourinary...,4818,11,1.49,0.1917630175,0.74,2.67
780.2 ,Syncope and collapse,"Comorbidities, signs, and ill-defined...",10622,24,1.48,0.0613006241,0.94,2.21
493.91 ,"Asthma, unspecified type, with...",Diseases of the respiratory system,5285,12,1.48,0.1592387046,0.76,2.6
694.0 ,Dermatitis herpetiformis,Diseases of the skin and subcutaneous...,1757,4,1.48,0.3532984873,0.4,3.81
535.4 ,Other specified gastritis,Diseases of the digestive system,7927,18,1.48,0.1101932981,0.88,2.35
382.4 ,Unspecified suppurative otitis...,Diseases of the nervous system,2198,5,1.48,0.4006641001,0.48,3.47
840 ,Sprains and strains of shoulder...,Injury and poisoning,2632,6,1.48,0.3099649422,0.54,3.24
719.49 ,"Pain in joint, multiple sites",Diseases of the musculoskeletal...,12373,28,1.48,0.0482705668,0.98,2.15
715.36 ,"Osteoarthrosis, localized, not...",Diseases of the musculoskeletal...,57168,126,1.47,0.0000699327,1.22,1.77
332.0 ,Paralysis agitans,Diseases of the nervous system,2207,5,1.47,0.4016545912,0.48,3.46
618.1 ,Uterine prolapse without mention...,Diseases of the genitourinary...,2214,5,1.47,0.4024400706,0.48,3.44
493.20 ,"Chronic obstructive asthma, unspecified",Diseases of the respiratory system,4024,9,1.46,0.2261300845,0.66,2.78
110.1 ,Dermatophytosis of nail,Infectious and parasitic diseases,29791,66,1.46,0.0041564584,1.12,1.87
372.0 ,Acute conjunctivitis,Diseases of the nervous system,13880,31,1.46,0.0481252782,0.99,2.09
133.0 ,Scabies,Infectious and parasitic diseases,4474,10,1.46,0.2446652411,0.7,2.69
382.3 ,Unspecified chronic suppurative...,Diseases of the nervous system,5800,13,1.46,0.1748976594,0.78,2.51
353.2 ,"Cervical root lesions, not elsewhere...",Diseases of the nervous system,12124,27,1.46,0.0606616284,0.96,2.13
616.50 ,"Ulceration of vulva, unspecified",Diseases of the genitourinary...,2225,5,1.46,0.4037007429,0.47,3.43
464.4 ,Croup,Diseases of the respiratory system,2678,6,1.46,0.3164192451,0.53,3.19
054.9 ,Herpes simplex without mention...,Infectious and parasitic diseases,12643,28,1.45,0.0657978244,0.96,2.1
692.70 ,Unspecified dermatitis due to...,Diseases of the skin and subcutaneous...,2252,5,1.45,0.406928697,0.47,3.39
695.89 ,Other specified erythematous conditions,Diseases of the skin and subcutaneous...,2703,6,1.45,0.3201079693,0.53,3.16
311 ,"Depressive disorder, not elsewhere...",Mental disorders,9449,21,1.45,0.110570997,0.9,2.23
786.3 ,Hemoptysis,"Comorbidities, signs, and ill-defined...",7246,16,1.44,0.1715713627,0.82,2.35
530.1 ,Esophagitis,Diseases of the digestive system,30590,67,1.44,0.0047149493,1.11,1.85
216.7 ,Benign neoplasm of skin of lower...,Neoplasms,1810,4,1.44,0.366157717,0.39,3.7
250.90 ,"Diabetes with unspecified complication,...","Endocrine, nutritional and metabolic...",32933,72,1.44,0.0040522639,1.12,1.83
722.93 ,"Other and unspecified disc disorder,...",Diseases of the musculoskeletal...,8615,19,1.44,0.125815229,0.86,2.26
723.9 ,Unspecified musculoskeletal disorders...,Diseases of the musculoskeletal...,3175,7,1.44,0.3549041604,0.58,2.97
727.43 ,"Ganglion, unspecified",Diseases of the musculoskeletal...,4079,9,1.44,0.3094745408,0.66,2.74
708.1 ,Idiopathic urticaria,Diseases of the skin and subcutaneous...,4552,10,1.43,0.2502117352,0.68,2.64
533.50 ,Chronic or unspecified peptic...,Diseases of the digestive system,3177,7,1.43,0.3550672498,0.58,2.97
611.8 ,Other specified disorders of breast,Diseases of the genitourinary...,2283,5,1.43,0.4108610689,0.46,3.34
350.1 ,Trigeminal neuralgia,Diseases of the nervous system,3189,7,1.43,0.3560628531,0.57,2.96
355.0 ,Lesion of sciatic nerve,Diseases of the nervous system,4546,10,1.43,0.24975438,0.69,2.65
931 ,Foreign body in ear,Injury and poisoning,3656,8,1.43,0.2862096074,0.61,2.82
729.1 ,"Myalgia and myositis, unspecified",Diseases of the musculoskeletal...,164029,336,1.43,0.000000021517315,1.26,1.62
680 ,Carbuncle and furuncle,Diseases of the skin and subcutaneous...,2274,5,1.43,0.4096951161,0.46,3.35
530.8 ,Other specified disorders of esophagus,Diseases of the digestive system,2284,5,1.42,0.4109918262,0.46,3.34
535.5 ,Unspecified gastritis & gastroduodenitis,Diseases of the digestive system,18993,41,1.42,0.031371432,1.01,1.93
714.8 ,Other specified inflammatory polyarthropathies,Diseases of the musculoskeletal...,1378,3,1.42,0.4755663931,0.29,4.16
381.3 ,Other and unspecified chronic...,Diseases of the nervous system,1373,3,1.42,0.4744129305,0.29,4.17
716 ,Other and unspecified arthropathies,Diseases of the musculoskeletal...,8746,19,1.42,0.1301433429,0.85,2.22
724.4 ,Thoracic or lumbosacral neuritis...,Diseases of the musculoskeletal...,9669,21,1.42,0.1158330807,0.87,2.18
354.0 ,Carpal tunnel syndrome,Diseases of the nervous system,33045,71,1.42,0.0064283255,1.1,1.8
474.0 ,Chronic tonsillitis,Diseases of the respiratory system,5042,11,1.42,0.2736620803,0.71,2.55
627.0 ,Premenopausal menorrhagia,Diseases of the genitourinary...,2750,6,1.42,0.3273696973,0.52,3.1
035 ,Erysipelas,Infectious and parasitic diseases,1381,3,1.41,0.4762614559,0.29,4.15
805.6 ,Closed fracture of sacrum and...,Injury and poisoning,1388,3,1.41,0.4778918236,0.29,4.13
722 ,Intervertebral disc disorders,Diseases of the musculoskeletal...,4606,10,1.41,0.2545519099,0.68,2.61
722.90 ,"Other and unspecified disc disorder,...",Diseases of the musculoskeletal...,3691,8,1.41,0.2901238812,0.61,2.79
041.8 ,Other specified bacterial infections,Infectious and parasitic diseases,1861,4,1.4,0.3790294766,0.38,3.59
571.0 ,Alcoholic fatty liver,Diseases of the digestive system,2320,5,1.4,0.4158560258,0.45,3.29
388.70 ,"Otalgia, unspecified",Diseases of the nervous system,2331,5,1.4,0.4174016798,0.45,3.27
255.0 ,Cushing's syndrome,"Endocrine, nutritional and metabolic...",1397,3,1.4,0.4800052151,0.29,4.1
719.40 ,"Pain in joint, site unspecified",Diseases of the musculoskeletal...,64468,135,1.4,0.0003842613,1.16,1.67
847.9 ,Sprain of unspecified site of...,Injury and poisoning,6995,15,1.4,0.2162294794,0.78,2.32
296.2 ,"Major depressive disorder, single...",Mental disorders,3258,7,1.4,0.3623404931,0.56,2.89
724.0 ,"Spinal stenosis, other than cervical",Diseases of the musculoskeletal...,2793,6,1.4,0.3343673941,0.51,3.06
933 ,Foreign body in pharynx and larynx,Injury and poisoning,1398,3,1.4,0.4802412069,0.29,4.1
485 ,"Bronchopneumonia, organism unspecified",Diseases of the respiratory system,6072,13,1.4,0.2452497202,0.74,2.4
684 ,Impetigo,Diseases of the skin and subcutaneous...,2342,5,1.39,0.4189742574,0.45,3.25
070.30 ,Viral hepatitis B without mention...,Infectious and parasitic diseases,14149,30,1.39,0.0826250628,0.93,1.99
382.0 ,Acute suppurative otitis media,Diseases of the nervous system,1875,4,1.39,0.5434673287,0.38,3.57
565.0 ,Anal fissure,Diseases of the digestive system,2345,5,1.39,0.4194077504,0.45,3.25
723.5 ,"Torticollis, unspecified",Diseases of the musculoskeletal...,3286,7,1.39,0.3651471143,0.56,2.87
621.0 ,Polyp of corpus uteri,Diseases of the genitourinary...,1400,3,1.39,0.4807138826,0.29,4.09
698.9 ,Unspecified pruritic disorder,Diseases of the skin and subcutaneous...,36702,77,1.38,0.0078672219,1.09,1.74
162.9 ,Malignant neoplasm of bronchus...,Neoplasms,2821,6,1.38,0.3390955123,0.51,3.02
240.0 ,"Goiter, specified as simple","Endocrine, nutritional and metabolic...",3311,7,1.38,0.3677742499,0.55,2.85
389.9 ,Unspecified hearing loss,Diseases of the nervous system,9911,21,1.38,0.1536188274,0.85,2.12
401.0 ,Malignant essential hypertension,Diseases of the circulatory system,8530,18,1.38,0.1651628816,0.81,2.19
848.0 ,Sprain of septal cartilage of...,Injury and poisoning,2359,5,1.38,0.421456424,0.45,3.23
592.1 ,Calculus of ureter,Diseases of the genitourinary...,16147,34,1.38,0.0678632129,0.95,1.94
595.9 ,"Cystitis, unspecified",Diseases of the genitourinary...,50638,105,1.38,0.0023896462,1.12,1.68
464.11 ,Acute tracheitis with obstruction,Diseases of the respiratory system,8024,17,1.38,0.1945083034,0.8,2.22
472.1 ,Chronic pharyngitis,Diseases of the respiratory system,34887,73,1.38,0.0098142842,1.07,1.75
371.42 ,Recurrent erosion of cornea,Diseases of the nervous system,2859,6,1.37,0.4643330603,0.5,2.98
786.51 ,Precordial pain,"Comorbidities, signs, and ill-defined...",6195,13,1.37,0.2516026073,0.73,2.35
531 ,Gastric ulcer,Diseases of the digestive system,10031,21,1.37,0.1570382268,0.84,2.1
787.3 ,"Flatulence, eructation, and gas...","Comorbidities, signs, and ill-defined...",38516,80,1.37,0.0078212768,1.08,1.72
373.0 ,Blepharitis,Diseases of the nervous system,6647,14,1.37,0.210019033,0.75,2.31
216 ,Benign neoplasm of skin,Neoplasms,5688,12,1.37,0.2361380538,0.71,2.41
218.0 ,Submucous leiomyoma of uterus,Neoplasms,1905,4,1.37,0.5464869746,0.37,3.51
380.2 ,Other otitis externa,Diseases of the nervous system,3326,7,1.37,0.3694041072,0.55,2.83
715.9 ,"Osteoarthrosis, unspecified whether...",Diseases of the musculoskeletal...,26378,55,1.37,0.0254591528,1.03,1.79
570 ,Acute and subacute necrosis of...,Diseases of the digestive system,1902,4,1.37,0.5461743843,0.37,3.52
848 ,Other and ill-defined sprains...,Injury and poisoning,2848,6,1.37,0.4634962586,0.5,3
722.0 ,Displacement of cervical intervertebral...,Diseases of the musculoskeletal...,10035,21,1.37,0.1571674005,0.84,2.1
307.42 ,Persistent disorder of initiating...,Mental disorders,7620,16,1.37,0.2364286637,0.78,2.23
727.0 ,Synovitis and tenosynovitis,Diseases of the musculoskeletal...,17644,37,1.37,0.0644389156,0.96,1.9
727.09 ,Other synovitis and tenosynovitis,Diseases of the musculoskeletal...,7608,16,1.37,0.2360922386,0.78,2.24
110.5 ,Dermatophytosis of the body,Infectious and parasitic diseases,12011,25,1.36,0.1269312578,0.88,2.02
698.8 ,Other specified pruritic conditions,Diseases of the skin and subcutaneous...,8161,17,1.36,0.2001124896,0.79,2.18
531.9 ,"Gastric ulcer, unspecified as...",Diseases of the digestive system,4784,10,1.36,0.3490058381,0.65,2.51
211.1 ,Benign neoplasm of stomach,Neoplasms,1440,3,1.36,0.49035119,0.28,3.98
794.8 ,Nonspecific abnormal results of...,"Comorbidities, signs, and ill-defined...",16368,34,1.36,0.0859469968,0.94,1.91
373.2 ,Chalazion,Diseases of the nervous system,5257,11,1.36,0.2862530145,0.68,2.45
536.9 ,Unspecified functional disorder...,Diseases of the digestive system,177485,347,1.36,0.0000014216581,1.2,1.53
306.9 ,Unspecified psychophysiological...,Mental disorders,26576,55,1.36,0.0315249471,1.02,1.78
461.8 ,Other acute sinusitis,Diseases of the respiratory system,10557,22,1.36,0.1668488459,0.85,2.07
726.19 ,Other specified disorders of bursae...,Diseases of the musculoskeletal...,9611,20,1.36,0.1878403784,0.83,2.11
935.1 ,Foreign body in esophagus,Injury and poisoning,1433,3,1.36,0.4886404923,0.28,4
995.2 ,Unspecified adverse effect od...,Injury and poisoning,1434,3,1.36,0.4888842774,0.28,3.99
995.3 ,"Allergy, unspecified, not elsewhere...",Injury and poisoning,11079,23,1.36,0.1429071985,0.86,2.04
038 ,Septicemia,Infectious and parasitic diseases,1929,4,1.35,0.5490699736,0.37,3.47
111.0 ,Pityriasis versicolor,Infectious and parasitic diseases,4331,9,1.35,0.3281710632,0.62,2.58
174.0 ,Malignant neoplasm of nipple and...,Neoplasms,1443,3,1.35,0.4910873123,0.28,3.97
708 ,Urticaria,Diseases of the skin and subcutaneous...,7234,15,1.35,0.2271777232,0.75,2.24
216.6 ,Benign neoplasm of skin of upper...,Neoplasms,2408,5,1.35,0.4289478695,0.44,3.16
535.51 ,"Unspecified gastritis and gastroduodenitis,...",Diseases of the digestive system,1444,3,1.35,0.4913330761,0.28,3.97
560.9 ,Unspecified intestinal obstruction,Diseases of the digestive system,3861,8,1.35,0.403345561,0.58,2.67
386 ,Vertiginous syndromes and other...,Diseases of the nervous system,14520,30,1.35,0.1082922478,0.91,1.94
246 ,Other disorders of thyroid,"Endocrine, nutritional and metabolic...",3374,7,1.35,0.3748810778,0.54,2.79
250.4 ,Diabetes with renal manifestations,"Endocrine, nutritional and metabolic...",3848,8,1.35,0.4024644575,0.58,2.68
590 ,Infections of kidney,Diseases of the genitourinary...,1927,4,1.35,0.5488492222,0.37,3.47
883.1 ,"Open wound of finger(s), complicated",Injury and poisoning,3848,8,1.35,0.4024644575,0.58,2.68
780 ,General symptoms,"Comorbidities, signs, and ill-defined...",3396,7,1.34,0.3775202665,0.54,2.77
111.8 ,Other specified dermatomycoses,Infectious and parasitic diseases,1452,3,1.34,0.4933060888,0.28,3.94
112.9 ,Candidiasis of unspecified site,Infectious and parasitic diseases,5338,11,1.34,0.2925113633,0.67,2.41
715.0 ,"Osteoarthrosis, generalized",Diseases of the musculoskeletal...,5353,11,1.34,0.2937557251,0.67,2.4
296.30 ,"Major depressive affective disorder,...",Mental disorders,2919,6,1.34,0.4693348169,0.49,2.92
593.9 ,Unspecified disorder of kidney...,Diseases of the genitourinary...,2917,6,1.34,0.4691564927,0.49,2.92
300.89 ,Other somatoform disorders,Mental disorders,6801,14,1.34,0.2732704985,0.73,2.26
723.2 ,Cervicocranial syndrome,Diseases of the musculoskeletal...,3399,7,1.34,0.3778862576,0.54,2.77
724.8 ,Other symptoms referable to back,Diseases of the musculoskeletal...,2425,5,1.34,0.4316582666,0.43,3.14
478.9 ,Other and unspecified diseases...,Diseases of the respiratory system,9760,20,1.34,0.1926016562,0.81,2.07
009.1 ,"Colitis, enteritis, and gastroenteritis...",Infectious and parasitic diseases,14117,29,1.34,0.1280200378,0.9,1.94
780.3 ,Convulsions,"Comorbidities, signs, and ill-defined...",2452,5,1.33,0.4360743607,0.43,3.11
493.90 ,"Asthma, unspecified type, unspecified",Diseases of the respiratory system,49064,99,1.33,0.0076159022,1.08,1.64
519.9 ,Unspecified disease of respiratory...,Diseases of the respiratory system,4879,10,1.33,0.3545663904,0.64,2.46
250.60 ,"Diabetes with neurological manifestations,...","Endocrine, nutritional and metabolic...",16728,34,1.33,0.1099158472,0.92,1.87
571.9 ,Unspecified chronic liver disease...,Diseases of the digestive system,15768,32,1.33,0.1228109278,0.9,1.88
721.1 ,Cervical spondylosis with myelopathy,Diseases of the musculoskeletal...,13748,28,1.33,0.1520974112,0.88,1.93
916.1 ,"Abrasion or friction burn of hip,...",Injury and poisoning,1955,4,1.33,0.5520279671,0.36,3.42
756.12 ,Spondylolisthesis,Congenital anomalies,8885,18,1.32,0.22074912,0.78,2.1
367.5 ,Disorders of accommodation,Diseases of the nervous system,1974,4,1.32,0.5542901363,0.36,3.39
686.9 ,Unspecified local infection of...,Diseases of the skin and subcutaneous...,65152,129,1.32,0.0042937631,1.09,1.58
782.3 ,Edema,"Comorbidities, signs, and ill-defined...",39826,80,1.32,0.0184105065,1.04,1.66
784.1 ,Throat pain,"Comorbidities, signs, and ill-defined...",13897,28,1.32,0.1548251311,0.87,1.91
698 ,Pruritus and related conditions,Diseases of the skin and subcutaneous...,4444,9,1.32,0.3395767773,0.6,2.51
244.0 ,Postsurgical hypothyroidism,"Endocrine, nutritional and metabolic...",2463,5,1.32,0.4379113488,0.43,3.09
564.9 ,Unspecified functional disorder...,Diseases of the digestive system,94669,186,1.32,0.000634431,1.12,1.54
388.30 ,"Tinnitus, unspecified",Diseases of the nervous system,26750,54,1.32,0.0474394331,0.99,1.74
590.10 ,Acute pyelonephritis without lesion...,Diseases of the genitourinary...,9385,19,1.32,0.2309216549,0.79,2.07
429.2 ,"Cardiovascular disease, unspecified",Diseases of the circulatory system,3459,7,1.32,0.3855032849,0.53,2.72
351.0 ,Bell's palsy,Diseases of the nervous system,3936,8,1.32,0.4089681008,0.57,2.62
729.4 ,"Fasciitis, unspecified",Diseases of the musculoskeletal...,86951,172,1.32,0.0007636127,1.12,1.56
692.0 ,Contact dermatitis and other eczema...,Diseases of the skin and subcutaneous...,21943,44,1.31,0.0806240044,0.95,1.77
692.79 ,Other dermatitis due to solar...,Diseases of the skin and subcutaneous...,4466,9,1.31,0.4380669358,0.6,2.5
216.5 ,"Benign neoplasm of skin of trunk,...",Neoplasms,1984,4,1.31,0.555513656,0.36,3.37
710.9 ,Unspecified diffuse connective...,Diseases of the musculoskeletal...,2487,5,1.31,0.4419923654,0.42,3.06
715.91 ,"Osteoarthrosis, unspecified whether...",Diseases of the musculoskeletal...,1490,3,1.31,0.5028349937,0.27,3.84
276.5 ,Volume depletion,"Endocrine, nutritional and metabolic...",5950,12,1.31,0.3172896303,0.68,2.3
411.89 ,Other acute and subacute forms...,Diseases of the circulatory system,3983,8,1.31,0.4129421364,0.56,2.59
300.81 ,Somatization disorder,Mental disorders,1487,3,1.31,0.5020738401,0.27,3.85
307.4 ,Specific disorders of sleep of...,Mental disorders,4475,9,1.31,0.4385139024,0.6,2.49
464 ,Acute laryngitis and tracheitis,Diseases of the respiratory system,29565,59,1.31,0.0493600172,0.99,1.7
473.9 ,Unspecified sinusitis (chronic),Diseases of the respiratory system,21433,43,1.31,0.0928038417,0.95,1.78
366.9 ,Unspecified cataract,Diseases of the nervous system,12031,24,1.3,0.1964891,0.83,1.95
786.5 ,Chest pain,"Comorbidities, signs, and ill-defined...",27255,54,1.3,0.070453133,0.97,1.71
787.7 ,Abnormal feces,"Comorbidities, signs, and ill-defined...",3504,7,1.3,0.5103380001,0.52,2.69
709.9 ,Unspecified disorder of skin and...,Diseases of the skin and subcutaneous...,40433,80,1.3,0.0270760899,1.03,1.63
239.0 ,Neoplasm of unspecified nature...,Neoplasms,3001,6,1.3,0.4772968179,0.48,2.84
726.1 ,"Rotator cuff syndrome of shoulder,...",Diseases of the musculoskeletal...,4494,9,1.3,0.439496025,0.59,2.48
686.8 ,Other specified local infections...,Diseases of the skin and subcutaneous...,26851,53,1.29,0.0688987586,0.96,1.7
784 ,Symptoms involving head and neck,"Comorbidities, signs, and ill-defined...",4043,8,1.29,0.418492532,0.55,2.55
