276.5 ,Volume depletion,"Endocrine, nutritional and metabolic...",7592,74,2.13,0.0000000078464878,1.67,2.68
723.3 ,Cervicobrachial syndrome (diffuse),Diseases of the musculoskeletal...,3884,38,2.13,0.0000269322,1.5,2.93
781.9 ,Other symptoms involving nervous...,"Comorbidities, signs, and ill-defined...",5937,58,2.13,0.00000026384295,1.61,2.76
682.0 ,Cellulitis and abscess of face,Diseases of the skin and subcutaneous...,5245,51,2.12,0.0000018177392,1.57,2.79
296.20 ,"Major depressive affective disorder,...",Mental disorders,2876,28,2.12,0.0004473503,1.4,3.07
555.2 ,Regional enteritis of small intestine...,Diseases of the digestive system,4835,47,2.12,0.0000057062672,1.55,2.82
493.10 ,"Intrinsic asthma, unspecified",Diseases of the respiratory system,1957,19,2.11,0.0036745678,1.27,3.31
723.1 ,Cervicalgia,Diseases of the musculoskeletal...,25665,244,2.1,2.112349e-24,1.84,2.38
353.4 ,"Lumbosacral root lesions, not...",Diseases of the nervous system,4145,40,2.1,0.0000265562,1.5,2.87
883.1 ,"Open wound of finger(s), complicated",Injury and poisoning,11483,110,2.09,0.000000000006602423,1.72,2.53
728.8 ,"Other disorders of muscle, ligament...",Diseases of the musculoskeletal...,3118,30,2.09,0.0002762632,1.41,3
783.0 ,Anorexia,"Comorbidities, signs, and ill-defined...",1872,18,2.09,0.0051915204,1.23,3.31
786.59 ,Other chest pain,"Comorbidities, signs, and ill-defined...",14641,140,2.09,0.000000000000008868661,1.76,2.48
845.10 ,"Sprain of foot, unspecified site",Injury and poisoning,3968,38,2.08,0.0000501417,1.47,2.87
276.9 ,Electrolyte and fluid disorders...,"Endocrine, nutritional and metabolic...",2720,26,2.08,0.0008992272,1.35,3.05
718.40 ,"Contracture of joint, site unspecified",Diseases of the musculoskeletal...,3043,29,2.07,0.0003979969,1.38,2.98
298.9 ,Unspecified psychosis,Mental disorders,3154,30,2.07,0.0003122721,1.39,2.96
722.90 ,"Other and unspecified disc disorder,...",Diseases of the musculoskeletal...,2840,27,2.07,0.000701293,1.36,3.02
824.8 ,"Unspecified fracture of ankle,...",Injury and poisoning,2099,20,2.07,0.003082117,1.26,3.21
682.5 ,Cellulitis and abscess of buttock,Diseases of the skin and subcutaneous...,2001,19,2.06,0.0041594536,1.24,3.23
307.4 ,Specific disorders of sleep of...,Mental disorders,2537,24,2.06,0.0017065947,1.31,3.07
823 ,Fracture of tibia and fibula,Injury and poisoning,2114,20,2.06,0.0032452068,1.25,3.19
038 ,Septicemia,Infectious and parasitic diseases,1901,18,2.06,0.0056031917,1.22,3.26
295.30 ,"Paranoid type schizophrenia, unspecified",Mental disorders,3722,35,2.05,0.0001372757,1.42,2.85
782.1 ,Rash and other nonspecific skin...,"Comorbidities, signs, and ill-defined...",9149,86,2.05,0.0000000026559965,1.64,2.54
847 ,Sprains and strains of other and...,Injury and poisoning,2451,23,2.04,0.0023742473,1.29,3.07
910 ,"Superficial injury of face, neck,...",Injury and poisoning,2768,26,2.04,0.0010133456,1.33,3
719.45 ,"Pain in joint, pelvic region and...",Diseases of the musculoskeletal...,2776,26,2.04,0.0010369689,1.33,2.99
715.90 ,"Osteoarthrosis, unspecified whether...",Diseases of the musculoskeletal...,25655,236,2.03,6.952429e-22,1.77,2.31
883.0 ,"Open wound of finger(s), without...",Injury and poisoning,59485,535,2.02,1.080932e-45,1.85,2.21
721.3 ,Lumbosacral spondylosis without...,Diseases of the musculoskeletal...,31840,291,2.02,3.290295e-26,1.79,2.27
531.30 ,Acute gastric ulcer without mention...,Diseases of the digestive system,6163,57,2.01,0.0000019158578,1.52,2.62
892 ,Open wound of foot except toe(s)...,Injury and poisoning,3281,30,1.99,0.0006628945,1.34,2.85
716.90 ,"Arthropathy, unspecified, site...",Diseases of the musculoskeletal...,32210,290,1.99,3.920686e-25,1.76,2.24
724.02 ,"Spinal stenosis, lumbar region,...",Diseases of the musculoskeletal...,4702,43,1.99,0.0000527285,1.44,2.69
577.0 ,Acute pancreatitis,Diseases of the digestive system,9118,83,1.99,0.000000026279145,1.58,2.47
924 ,Contusion of lower limb and of...,Injury and poisoning,4149,38,1.99,0.0001241794,1.41,2.74
727.9 ,"Unspecified disorder of synovium,...",Diseases of the musculoskeletal...,4939,45,1.98,0.0000331238,1.44,2.66
491.1 ,Mucopurulent chronic bronchitis,Diseases of the respiratory system,4869,44,1.97,0.0000473529,1.43,2.65
724.3 ,Sciatica,Diseases of the musculoskeletal...,47627,422,1.97,1.03155e-34,1.78,2.18
788.3 ,Incontinence of urine,"Comorbidities, signs, and ill-defined...",2652,24,1.97,0.0023081135,1.26,2.93
959.4 ,"Hand, except finger injury",Injury and poisoning,1987,18,1.97,0.0074403661,1.16,3.12
719.46 ,"Pain in joint, lower leg",Diseases of the musculoskeletal...,10534,94,1.95,0.0000000058915871,1.57,2.39
532.00 ,"Acute duodenal ulcer with hemorrhage,...",Diseases of the digestive system,2112,19,1.95,0.0088678143,1.17,3.06
722.10 ,Displacement of lumbar intervertebral...,Diseases of the musculoskeletal...,26391,233,1.94,2.085217e-19,1.7,2.21
533.00 ,Acute peptic ulcer of unspecified...,Diseases of the digestive system,7391,66,1.94,0.0000011177748,1.5,2.48
356.9 ,Unspecified hereditary and idiopathic...,Diseases of the nervous system,6283,56,1.94,0.0000092901873,1.46,2.53
370.24 ,Photokeratitis,Diseases of the nervous system,3808,34,1.94,0.0004378834,1.34,2.72
300.4 ,Dysthymic disorder,Mental disorders,25873,227,1.93,1.19656e-18,1.68,2.2
722.2 ,Displacement of intervertebral...,Diseases of the musculoskeletal...,15731,139,1.93,0.000000000003066002,1.62,2.29
780.0 ,Alteration of consciousness,"Comorbidities, signs, and ill-defined...",2023,18,1.93,0.0122013836,1.14,3.06
719.40 ,"Pain in joint, site unspecified",Diseases of the musculoskeletal...,49277,426,1.92,7.565582e-33,1.74,2.12
723.5 ,"Torticollis, unspecified",Diseases of the musculoskeletal...,2947,26,1.92,0.0024113669,1.25,2.82
724.2 ,Lumbago,Diseases of the musculoskeletal...,182388,1476,1.92,1.046675e-98,1.82,2.04
386.00 ,"Minihre's disease, unspecified",Diseases of the nervous system,7581,67,1.92,0.0000015260091,1.49,2.45
005.9 ,"Food poisoning, unspecified",Infectious and parasitic diseases,2152,19,1.92,0.0095724602,1.15,3
823.80 ,Closed fracture of unspecified...,Injury and poisoning,2487,22,1.92,0.0044885364,1.2,2.92
437.9 ,Unspecified cerebrovascular disease,Diseases of the circulatory system,2726,24,1.91,0.0040723455,1.22,2.85
476.1 ,Chronic laryngotracheitis,Diseases of the respiratory system,2049,18,1.91,0.0127610233,1.13,3.02
715.00 ,"Osteoarthrosis, generalized, site...",Diseases of the musculoskeletal...,3974,35,1.91,0.0005798357,1.33,2.67
296.90 ,Unspecified episodic mood disorder,Mental disorders,2840,25,1.91,0.0031445789,1.23,2.83
358.9 ,"Myoneural disorders, unspecified",Diseases of the nervous system,2162,19,1.91,0.0097876138,1.15,2.99
728.9 ,"Unspecified disorder of muscle,...",Diseases of the musculoskeletal...,21961,191,1.91,0.000000000000001388159,1.64,2.2
307.42 ,Persistent disorder of initiating...,Mental disorders,5600,49,1.9,0.0000428522,1.41,2.52
848 ,Other and ill-defined sprains...,Injury and poisoning,2869,25,1.89,0.0033626477,1.22,2.8
848.9 ,Unspecified site of sprain and...,Injury and poisoning,99915,829,1.89,3.185594e-57,1.76,2.03
535.4 ,Other specified gastritis,Diseases of the digestive system,7377,64,1.89,0.0000040820208,1.45,2.42
571.5 ,Cirrhosis of liver without mention...,Diseases of the digestive system,13318,115,1.89,0.0000000008085011,1.55,2.27
447.6 ,"Arteritis, unspecified",Diseases of the circulatory system,3827,33,1.87,0.0010981613,1.29,2.64
478.4 ,Polyp of vocal cord or larynx,Diseases of the respiratory system,2785,24,1.87,0.0046123267,1.2,2.79
353.9 ,Unspecified nerve root and plexus...,Diseases of the nervous system,3483,30,1.87,0.0015754181,1.26,2.68
558.1 ,Gastroenteritis and colitis due...,Diseases of the digestive system,1977,17,1.87,0.0180662378,1.08,3
729.9 ,Other and unspecified disorders...,Diseases of the musculoskeletal...,5567,48,1.87,0.0000662266,1.38,2.49
523.0 ,Acute gingivitis,Diseases of the digestive system,5977,51,1.86,0.0000525808,1.38,2.45
355.0 ,Lesion of sciatic nerve,Diseases of the nervous system,2219,19,1.86,0.0113245272,1.12,2.91
786.51 ,Precordial pain,"Comorbidities, signs, and ill-defined...",5606,48,1.86,0.0001002404,1.37,2.47
575.0 ,Acute cholecystitis,Diseases of the digestive system,1877,16,1.85,0.024199298,1.05,3.01
786.1 ,Stridor,"Comorbidities, signs, and ill-defined...",2225,19,1.85,0.0115180104,1.11,2.9
386.19 ,Other peripheral vertigo,Diseases of the nervous system,1872,16,1.85,0.0239900142,1.06,3.02
070.51 ,Acute hepatitis C without mention...,Infectious and parasitic diseases,7568,64,1.84,0.0000084656977,1.41,2.36
843.9 ,Sprains and strains of unspecified...,Injury and poisoning,4853,41,1.84,0.0004046815,1.31,2.5
307.41 ,Transient disorder of initiating...,Mental disorders,3182,27,1.84,0.0035519154,1.21,2.69
724.5 ,"Backache, unspecified",Diseases of the musculoskeletal...,122384,979,1.84,8.105091e-61,1.71,1.96
726.9 ,Unspecified enthesopathy,Diseases of the musculoskeletal...,6014,51,1.84,0.0000794508,1.37,2.43
784 ,Symptoms involving head and neck,"Comorbidities, signs, and ill-defined...",2246,19,1.84,0.0122445645,1.1,2.88
786.01 ,Hyperventilation,"Comorbidities, signs, and ill-defined...",2001,17,1.84,0.0190071527,1.07,2.96
724.1 ,Pain in thoracic spine,Diseases of the musculoskeletal...,2014,17,1.83,0.0195827034,1.06,2.94
382.4 ,Unspecified suppurative otitis...,Diseases of the nervous system,3088,26,1.83,0.0047261429,1.19,2.69
882.2 ,Open wound of hand except finger(s)...,Injury and poisoning,2503,21,1.82,0.0110281383,1.12,2.79
716.98 ,"Arthropathy, unspecified, other...",Diseases of the musculoskeletal...,2862,24,1.82,0.0079040059,1.16,2.72
533.30 ,Acute peptic ulcer of unspecified...,Diseases of the digestive system,8115,68,1.82,0.0000077935004,1.41,2.32
959.9 ,Unspecified site injury,Injury and poisoning,2630,22,1.82,0.008899171,1.14,2.76
413.9 ,Other and unspecified angina pectoris,Diseases of the circulatory system,11160,93,1.82,0.00000017483282,1.46,2.23
427.89 ,Other specified cardiac dysrhythmias,Diseases of the circulatory system,3825,32,1.82,0.0017511043,1.24,2.57
686.8 ,Other specified local infections...,Diseases of the skin and subcutaneous...,38696,317,1.81,4.096893e-21,1.61,2.02
112.9 ,Candidiasis of unspecified site,Infectious and parasitic diseases,4559,38,1.81,0.0009130627,1.28,2.49
214.1 ,Lipoma of other skin and subcutaneous...,Neoplasms,2765,23,1.81,0.0104970911,1.14,2.72
349 ,Other and unspecified disorders...,Diseases of the nervous system,2275,19,1.81,0.0184853611,1.09,2.84
493.00 ,"Extrinsic asthma, unspecified",Diseases of the respiratory system,4585,38,1.8,0.000945289,1.27,2.48
428.0 ,"Congestive heart failure, unspecified",Diseases of the circulatory system,2668,22,1.79,0.0098114246,1.12,2.72
274.0 ,"Gouty arthropathy, unspecified","Endocrine, nutritional and metabolic...",85130,677,1.79,1.087053e-40,1.65,1.94
296 ,Disorganized type,Mental disorders,3279,27,1.79,0.0061614319,1.18,2.61
533.70 ,Chronic peptic ulcer of unspecified...,Diseases of the digestive system,13767,113,1.79,0.000000022132359,1.47,2.16
578.1 ,Blood in stool,Diseases of the digestive system,3387,28,1.79,0.0047412351,1.19,2.6
787.0 ,Nausea and vomiting,"Comorbidities, signs, and ill-defined...",34333,279,1.79,2.335942e-18,1.58,2.02
443.9 ,"Peripheral vascular disease, unspecified",Diseases of the circulatory system,3167,26,1.78,0.0056319822,1.16,2.62
137.0 ,Late effects of respiratory or...,Infectious and parasitic diseases,3811,31,1.77,0.0037172227,1.2,2.51
882 ,Open wound of hand except finger(s)...,Injury and poisoning,5539,45,1.77,0.0004593679,1.28,2.37
455.3 ,External hemorrhoids without mention...,Diseases of the circulatory system,2830,23,1.76,0.0115241573,1.12,2.65
709 ,Other disorders of skin and subcutaneous...,Diseases of the skin and subcutaneous...,2097,17,1.76,0.0335303054,1.02,2.82
530.2 ,Ulcer of esophagus,Diseases of the digestive system,6420,52,1.76,0.0001990241,1.31,2.31
566 ,Abscess of anal and rectal regions,Diseases of the digestive system,6795,55,1.76,0.0001072085,1.32,2.3
578.9 ,Hemorrhage of gastrointestinal...,Diseases of the digestive system,16316,131,1.75,0.0000000052608057,1.46,2.08
786.50 ,"Chest pain, unspecified","Comorbidities, signs, and ill-defined...",51375,407,1.75,2.795925e-24,1.58,1.94
845 ,Sprains and strains of ankle and...,Injury and poisoning,2986,24,1.74,0.0099261927,1.11,2.6
300.89 ,Other somatoform disorders,Mental disorders,2986,24,1.74,0.0099261927,1.11,2.6
531.90 ,"Gastric ulcer, unspecified as...",Diseases of the digestive system,21276,169,1.74,0.00000000008043554,1.48,2.02
311 ,"Depressive disorder, not elsewhere...",Mental disorders,5605,45,1.74,0.0005221754,1.27,2.34
780.4 ,Dizziness and giddiness,"Comorbidities, signs, and ill-defined...",119253,914,1.74,4.179293e-49,1.63,1.87
788.1 ,Dysuria,"Comorbidities, signs, and ill-defined...",4872,39,1.74,0.0013811243,1.23,2.38
680.2 ,Carbuncle and furuncle of trunk,Diseases of the skin and subcutaneous...,2128,17,1.73,0.0349751331,1.01,2.78
692.5 ,Contact dermatitis and other eczema...,Diseases of the skin and subcutaneous...,3531,28,1.72,0.008388599,1.14,2.49
715 ,Osteoarthrosis and allied disorders,Diseases of the musculoskeletal...,9230,73,1.72,0.0000204434,1.35,2.17
715.30 ,"Osteoarthrosis, localized, not...",Diseases of the musculoskeletal...,2517,20,1.72,0.0254576567,1.05,2.67
720.9 ,Unspecified inflammatory spondylopathy,Diseases of the musculoskeletal...,2146,17,1.72,0.035985558,1,2.76
570 ,Acute and subacute necrosis of...,Diseases of the digestive system,3775,30,1.72,0.0053386448,1.16,2.47
784.0 ,Headache,"Comorbidities, signs, and ill-defined...",183862,1356,1.72,3.014932e-65,1.62,1.82
386.11 ,Benign paroxysmal positional vertigo,Diseases of the nervous system,3275,26,1.72,0.0093055623,1.12,2.53
531.00 ,"Acute gastric ulcer with hemorrhage,...",Diseases of the digestive system,2537,20,1.71,0.0260985889,1.04,2.65
346.9 ,"Migraine, unspecified",Diseases of the nervous system,13372,105,1.71,0.00000050483253,1.4,2.08
846.0 ,Sprain of lumbosacral (joint)...,Injury and poisoning,2555,20,1.7,0.0267680875,1.03,2.63
708.0 ,Allergic urticaria,Diseases of the skin and subcutaneous...,39469,305,1.7,5.349087e-17,1.51,1.91
949.0 ,"Burn of unspecified site, unspecified...",Injury and poisoning,7674,60,1.7,0.0001374591,1.29,2.19
698.4 ,Dermatitis factitia [artefacta],Diseases of the skin and subcutaneous...,7703,60,1.69,0.0001907158,1.29,2.18
702.8 ,Other specified dermatoses,Diseases of the skin and subcutaneous...,4764,37,1.69,0.0035818789,1.18,2.33
491.21 ,Obstructive chronic bronchitis...,Diseases of the respiratory system,2314,18,1.69,0.0315338497,1,2.67
492.8 ,Other emphysema,Diseases of the respiratory system,2057,16,1.69,0.0480982275,0.96,2.75
716 ,Other and unspecified arthropathies,Diseases of the musculoskeletal...,3969,31,1.69,0.0065296806,1.15,2.41
519.8 ,Other diseases of respiratory...,Diseases of the respiratory system,2954,23,1.69,0.0196254289,1.07,2.54
300.00 ,"Anxiety state, unspecified",Mental disorders,50486,386,1.69,1.376376e-20,1.52,1.87
723.0 ,Spinal stenosis in cervical region,Diseases of the musculoskeletal...,3333,26,1.69,0.0141429427,1.1,2.49
364.00 ,"Acute and subacute iridocyclitis,...",Diseases of the nervous system,3986,31,1.69,0.0066827104,1.14,2.4
782.2 ,"Localized superficial swelling,...","Comorbidities, signs, and ill-defined...",2437,19,1.69,0.0341141771,1.02,2.65
389.9 ,Unspecified hearing loss,Diseases of the nervous system,7337,57,1.69,0.0002647993,1.28,2.19
682.9 ,Cellulitis and abscess of unspecified...,Diseases of the skin and subcutaneous...,59910,455,1.68,1.398538e-23,1.53,1.85
683 ,Acute lymphadenitis,Diseases of the skin and subcutaneous...,3865,30,1.68,0.0083698727,1.13,2.41
880 ,Open wound of shoulder and upper...,Injury and poisoning,2188,17,1.68,0.0388361961,0.98,2.71
250.9 ,Diabetes with unspecified complication,"Endocrine, nutritional and metabolic...",1931,15,1.68,0.0609946334,0.94,2.79
300.02 ,Generalized anxiety disorder,Mental disorders,9199,71,1.68,0.0000556434,1.31,2.12
560.9 ,Unspecified intestinal obstruction,Diseases of the digestive system,3358,26,1.68,0.0145092086,1.09,2.47
782.4 ,"Jaundice, unspecified, not of...","Comorbidities, signs, and ill-defined...",3095,24,1.68,0.0161233937,1.08,2.51
386.9 ,Unspecified vertiginous syndromes...,Diseases of the nervous system,9735,75,1.68,0.0000347296,1.32,2.1
989.5 ,Toxic effect of venom,Injury and poisoning,5680,44,1.68,0.0015767176,1.22,2.26
848.0 ,Sprain of septal cartilage of...,Injury and poisoning,1952,15,1.67,0.0626519857,0.93,2.76
295.90 ,"Unspecified schizophrenia, unspecified",Mental disorders,4814,37,1.67,0.003792615,1.17,2.3
737.30 ,"Scoliosis [and kyphoscoliosis],...",Diseases of the musculoskeletal...,1952,15,1.67,0.0626519857,0.93,2.76
571.49 ,Other chronic hepatitis,Diseases of the digestive system,15767,121,1.67,0.00000018682605,1.39,2
943.00 ,Burn of unspecified degree of...,Injury and poisoning,2333,18,1.67,0.0443706096,0.99,2.65
959.5 ,Finger injury,Injury and poisoning,2080,16,1.67,0.0499623655,0.95,2.72
389.10 ,"Sensorineural hearing loss, unspecified",Diseases of the nervous system,3629,28,1.67,0.0097605088,1.11,2.43
478.6 ,Edema of larynx,Diseases of the respiratory system,2607,20,1.66,0.0292005657,1.01,2.58
429.9 ,"Heart disease, unspecified",Diseases of the circulatory system,4877,37,1.65,0.0041815687,1.16,2.27
216.8 ,Benign neoplasm of other specified...,Neoplasms,3673,28,1.65,0.0139611048,1.1,2.4
482.9 ,"Bacterial pneumonia, unspecified",Diseases of the respiratory system,3943,30,1.65,0.0093607639,1.11,2.36
367.53 ,Spasm of accommodation,Diseases of the nervous system,3686,28,1.65,0.0141491644,1.09,2.39
558.2 ,Toxic gastroenteritis and colitis,Diseases of the digestive system,3153,24,1.65,0.0240514154,1.06,2.46
786.3 ,Hemoptysis,"Comorbidities, signs, and ill-defined...",6045,46,1.65,0.0015971876,1.21,2.21
414.9 ,"Chronic ischemic heart disease,...",Diseases of the circulatory system,15440,117,1.65,0.00000065916542,1.36,1.98
436 ,"Acute, but ill-defined, cerebrovascular...",Diseases of the circulatory system,2114,16,1.64,0.0531883115,0.94,2.67
455.0 ,Internal hemorrhoids without mention...,Diseases of the circulatory system,8989,68,1.64,0.0001665863,1.27,2.09
693.0 ,Dermatitis due to drugs and medicines...,Diseases of the skin and subcutaneous...,5691,43,1.64,0.0023068805,1.18,2.21
274.89 ,Gout with other specified manifestations,"Endocrine, nutritional and metabolic...",4133,31,1.63,0.0109539141,1.1,2.31
719.47 ,"Pain in joint, ankle and foot",Diseases of the musculoskeletal...,9334,70,1.63,0.000162628,1.27,2.06
590.10 ,Acute pyelonephritis without lesion...,Diseases of the genitourinary...,3460,26,1.63,0.016900616,1.06,2.39
597.89 ,Other urethritis,Diseases of the genitourinary...,4379,33,1.63,0.0072772514,1.12,2.3
692.8 ,"Contact dermatitis and other eczema,...",Diseases of the skin and subcutaneous...,4018,30,1.62,0.0137009764,1.09,2.32
511.0 ,Pleurisy without mention of effusion...,Diseases of the respiratory system,2269,17,1.62,0.0600510898,0.94,2.61
918.1 ,Superficial injury of cornea,Injury and poisoning,32079,237,1.62,0.00000000001073483,1.42,1.84
371.9 ,Unspecified corneal disorder,Diseases of the nervous system,1873,14,1.62,0.084414062,0.88,2.73
533.90 ,"Peptic ulcer of unspecified site,...",Diseases of the digestive system,85935,622,1.61,8.104433e-27,1.49,1.75
780.8 ,Generalized hyperhidrosis,"Comorbidities, signs, and ill-defined...",3089,23,1.61,0.0319799802,1.02,2.43
629.9 ,Unspecified disorder of female...,Diseases of the genitourinary...,2429,18,1.61,0.0505719223,0.95,2.55
715.9 ,"Osteoarthrosis, unspecified whether...",Diseases of the musculoskeletal...,7887,58,1.6,0.0008347195,1.21,2.07
571.0 ,Alcoholic fatty liver,Diseases of the digestive system,5024,37,1.6,0.0066607026,1.12,2.21
681.02 ,Onychia and paronychia of finger,Diseases of the skin and subcutaneous...,3790,28,1.6,0.0216586763,1.06,2.32
693.1 ,Dermatitis due to food taken internally,Diseases of the skin and subcutaneous...,2733,20,1.59,0.0467789188,0.97,2.46
295.32 ,"Paranoid type schizophrenia, chronic",Mental disorders,3677,27,1.59,0.0203598799,1.05,2.32
535.00 ,"Acute gastritis, without mention...",Diseases of the digestive system,151659,1058,1.59,8.305756e-40,1.49,1.69
535.40 ,"Other specified gastritis, without...",Diseases of the digestive system,25015,182,1.59,0.0000000089060077,1.36,1.84
372.72 ,Conjunctival hemorrhage,Diseases of the nervous system,23558,172,1.59,0.000000017834022,1.36,1.85
229.9 ,Benign neoplasm of unspecified...,Neoplasms,2475,18,1.58,0.0721033735,0.93,2.5
476.0 ,Chronic laryngitis,Diseases of the respiratory system,3017,22,1.58,0.0421182068,0.99,2.4
250.90 ,"Diabetes with unspecified complication,...","Endocrine, nutritional and metabolic...",8959,65,1.58,0.0005703264,1.21,2.01
716.9 ,"Arthropathy, unspecified",Diseases of the musculoskeletal...,15156,110,1.58,0.0000080477377,1.3,1.91
720.1 ,Spinal enthesopathy,Diseases of the musculoskeletal...,3013,22,1.58,0.0419380817,0.99,2.4
564.8 ,Other specified function disorder...,Diseases of the digestive system,21178,153,1.58,0.00000018551729,1.33,1.85
573.3 ,"Hepatitis, unspecified",Diseases of the digestive system,28311,205,1.58,0.0000000016287141,1.37,1.82
594.2 ,Calculus in urethra,Diseases of the genitourinary...,3025,22,1.58,0.0424933378,0.99,2.39
686.9 ,Unspecified local infection of...,Diseases of the skin and subcutaneous...,91052,640,1.57,1.562617e-24,1.44,1.7
884 ,Multiple and unspecified open...,Injury and poisoning,4972,36,1.57,0.0114212513,1.1,2.18
272.9 ,Unspecified disorder of lipoid...,"Endocrine, nutritional and metabolic...",5789,42,1.57,0.0062464497,1.13,2.13
717.7 ,Chondromalacia of patella,Diseases of the musculoskeletal...,4132,30,1.57,0.0206735673,1.06,2.25
296.30 ,"Major depressive affective disorder,...",Mental disorders,2205,16,1.57,0.0810846308,0.9,2.56
528.0 ,Stomatitis,Diseases of the digestive system,21163,152,1.57,0.00000031072627,1.32,1.84
307.81 ,Tension headache,Mental disorders,19841,143,1.57,0.00000053178662,1.32,1.85
362.41 ,Central serous retinopathy,Diseases of the nervous system,3589,26,1.57,0.026252642,1.02,2.31
372.20 ,"Blepharoconjunctivitis, unspecified",Diseases of the nervous system,8156,59,1.57,0.001337054,1.19,2.03
789.0 ,Abdominal pain,"Comorbidities, signs, and ill-defined...",243108,1635,1.57,1.680566e-54,1.49,1.66
607.84 ,Impotence of organic origin,Diseases of the genitourinary...,7038,51,1.57,0.0026072368,1.17,2.07
216.3 ,Benign neoplasm of skin of other...,Neoplasms,4990,36,1.56,0.0116110016,1.09,2.17
533.40 ,Chronic or unspecified peptic...,Diseases of the digestive system,6942,50,1.56,0.0032619822,1.16,2.07
786.9 ,Other symptoms involving respiratory...,"Comorbidities, signs, and ill-defined...",3064,22,1.56,0.0446065513,0.97,2.36
787.9 ,Other symptoms involving digestive...,"Comorbidities, signs, and ill-defined...",9054,65,1.56,0.0007976978,1.2,1.99
402.90 ,Unspecified hypertensive heart...,Diseases of the circulatory system,16837,121,1.56,0.0000046209407,1.3,1.87
349.9 ,Unspecified disorders of nervous...,Diseases of the nervous system,11188,80,1.55,0.0002600264,1.23,1.94
600 ,Hyperplasia of prostate,Diseases of the genitourinary...,7555,54,1.55,0.0027859992,1.16,2.03
250.00 ,Diabetes mellitus without mention...,"Endocrine, nutritional and metabolic...",36858,259,1.54,0.0000000001714486,1.35,1.74
529.0 ,Glossitis,Diseases of the digestive system,2527,18,1.54,0.0758527974,0.91,2.45
789.9 ,Other symptoms involving abdomen...,"Comorbidities, signs, and ill-defined...",2532,18,1.54,0.0762867757,0.91,2.44
681.9 ,Cellulitis and abscess of unspecified...,Diseases of the skin and subcutaneous...,7609,54,1.54,0.0029021714,1.15,2.01
239.8 ,"Neoplasms of unspecified nature,...",Neoplasms,2408,17,1.53,0.0949455791,0.89,2.46
300.9 ,Unspecified nonpsychotic mental...,Mental disorders,30326,212,1.53,0.000000012164454,1.33,1.75
536.8 ,Dyspepsia and other specified...,Diseases of the digestive system,84681,582,1.53,2.370731e-20,1.4,1.66
786.0 ,Dyspnea and respiratory abnormalities,"Comorbidities, signs, and ill-defined...",4250,30,1.53,0.0303289089,1.03,2.19
692.3 ,Contact dermatitis and other eczema...,Diseases of the skin and subcutaneous...,6692,47,1.52,0.0065097408,1.12,2.03
724 ,Other and unspecified disorders...,Diseases of the musculoskeletal...,4434,31,1.52,0.0260967852,1.03,2.16
367.89 ,Other disorders of refraction...,Diseases of the nervous system,4148,29,1.52,0.0294015382,1.01,2.18
401.1 ,Benign essential hypertension,Diseases of the circulatory system,13015,91,1.52,0.000206267,1.22,1.87
693.9 ,Dermatitis due to unspecified...,Diseases of the skin and subcutaneous...,11783,82,1.51,0.0004853929,1.2,1.88
274.9 ,"Gout, unspecified","Endocrine, nutritional and metabolic...",86931,592,1.51,8.626619e-20,1.39,1.64
493.90 ,"Asthma, unspecified type, unspecified",Diseases of the respiratory system,36721,253,1.51,0.0000000015274192,1.32,1.71
382.3 ,Unspecified chronic suppurative...,Diseases of the nervous system,4008,28,1.51,0.035020905,1,2.19
455.4 ,External thrombosed hemorrhoids,Diseases of the circulatory system,2160,15,1.5,0.1118081519,0.84,2.49
250 ,Diabetes mellitus,"Endocrine, nutritional and metabolic...",10002,69,1.5,0.0014563157,1.16,1.9
532.90 ,"Duodenal ulcer, unspecified as...",Diseases of the digestive system,22819,157,1.5,0.0000022654104,1.27,1.76
038.9 ,Unspecified septicemia,Infectious and parasitic diseases,4057,28,1.5,0.0474097673,0.99,2.17
682 ,Other cellulitis and abscess,Diseases of the skin and subcutaneous...,7429,51,1.49,0.0076107958,1.11,1.96
250.0 ,Diabetes Mellitus w/m of complication,"Endocrine, nutritional and metabolic...",9027,62,1.49,0.0030166155,1.14,1.91
