388.70 ,"Otalgia, unspecified",Diseases of the nervous system,2412,13,1.7,0.0668909211,0.9,2.91
842.10 ,"Sprain of hand, unspecified site",Injury and poisoning,2593,14,1.7,0.0533639915,0.93,2.86
719.45 ,"Pain in joint, pelvic region and...",Diseases of the musculoskeletal...,2776,15,1.7,0.0597837313,0.95,2.81
919.1 ,"Abrasion or friction burn of other,...",Injury and poisoning,2413,13,1.7,0.0669777913,0.9,2.91
786.1 ,Stridor,"Comorbidities, signs, and ill-defined...",2225,12,1.7,0.0846153834,0.88,2.97
682.2 ,Cellulitis and abscess of trunk,Diseases of the skin and subcutaneous...,2230,12,1.69,0.0850450698,0.87,2.97
727.03 ,Trigger finger (acquired),Diseases of the musculoskeletal...,2610,14,1.69,0.0548032664,0.92,2.84
381.00 ,"Acute nonsuppurative otitis media,...",Diseases of the nervous system,4483,24,1.69,0.0159184764,1.08,2.51
692.4 ,Contact dermatitis and other eczema...,Diseases of the skin and subcutaneous...,17330,92,1.68,0.0000049075754,1.35,2.07
715.98 ,"Osteoarthrosis, unspecified whether...",Diseases of the musculoskeletal...,1872,10,1.68,0.0989218889,0.8,3.1
355.9 ,Mononeuritis of unspecified site,Diseases of the nervous system,2246,12,1.68,0.0864902227,0.87,2.95
924.20 ,Contusion of foot,Injury and poisoning,9563,51,1.68,0.0005163978,1.25,2.22
682.7 ,"Cellulitis and abscess of foot,...",Diseases of the skin and subcutaneous...,4344,23,1.67,0.0207046466,1.05,2.51
272 ,Disorders of lipoid metabolism,"Endocrine, nutritional and metabolic...",8135,43,1.67,0.0020513276,1.2,2.25
716 ,Other and unspecified arthropathies,Diseases of the musculoskeletal...,3969,21,1.67,0.0323917312,1.03,2.55
922.3 ,Contusion of back,Injury and poisoning,14366,76,1.67,0.0000383521,1.31,2.1
923.10 ,Contusion of forearm,Injury and poisoning,2659,14,1.66,0.080385954,0.9,2.79
038 ,Septicemia,Infectious and parasitic diseases,1901,10,1.65,0.1466270281,0.79,3.05
692.8 ,"Contact dermatitis and other eczema,...",Diseases of the skin and subcutaneous...,4018,21,1.65,0.0334663095,1.02,2.52
693.8 ,Dermatitis due to other specified...,Diseases of the skin and subcutaneous...,4975,26,1.65,0.015940343,1.07,2.42
296.2 ,"Major depressive disorder, single...",Mental disorders,2292,12,1.65,0.0912344615,0.85,2.89
303.00 ,Acute alcoholic intoxication in...,Mental disorders,2501,13,1.64,0.1048704563,0.87,2.8
531.30 ,Acute gastric ulcer without mention...,Diseases of the digestive system,6163,32,1.64,0.0087323689,1.12,2.31
890.0 ,"Open wound of hip and thigh, without...",Injury and poisoning,4993,26,1.64,0.0162692569,1.07,2.41
680.0 ,Carbuncle and furuncle of face,Diseases of the skin and subcutaneous...,6960,36,1.63,0.0054353947,1.14,2.26
427 ,Cardiac dysrhythmias,Diseases of the circulatory system,4244,22,1.63,0.0280102682,1.02,2.48
840.9 ,Sprains and strains of unspecified...,Injury and poisoning,12366,64,1.63,0.0002860653,1.26,2.09
354.0 ,Carpal tunnel syndrome,Diseases of the nervous system,8712,45,1.63,0.0021625241,1.19,2.18
529.0 ,Glossitis,Diseases of the digestive system,2527,13,1.62,0.1065329861,0.86,2.78
535.4 ,Other specified gastritis,Diseases of the digestive system,7377,38,1.62,0.0049299397,1.15,2.23
386 ,Vertiginous syndromes and other...,Diseases of the nervous system,5064,26,1.62,0.0232364083,1.05,2.37
854.00 ,Intracranial injury of other and...,Injury and poisoning,12343,63,1.61,0.0003979032,1.24,2.07
472 ,Chronic pharyngitis and nasopharyngitis,Diseases of the respiratory system,7450,38,1.61,0.0069476012,1.14,2.21
728.85 ,Spasm of muscle,Diseases of the musculoskeletal...,5461,28,1.61,0.0156273303,1.07,2.34
945.00 ,Burn of unspecified degree of...,Injury and poisoning,2360,12,1.6,0.0998170447,0.82,2.8
414 ,Other forms of chronic ischemic...,Diseases of the circulatory system,2759,14,1.6,0.087794877,0.87,2.69
715.9 ,"Osteoarthrosis, unspecified whether...",Diseases of the musculoskeletal...,7887,40,1.6,0.0049054363,1.14,2.18
295.9 ,Unspecified schizophrenia,Mental disorders,1966,10,1.6,0.1537731012,0.77,2.95
298.9 ,Unspecified psychosis,Mental disorders,3154,16,1.6,0.0781605736,0.91,2.6
356.9 ,Unspecified hereditary and idiopathic...,Diseases of the nervous system,6283,32,1.6,0.0128468572,1.1,2.27
726.0 ,Adhesive capsulitis of shoulder,Diseases of the musculoskeletal...,7095,36,1.6,0.0079296382,1.12,2.22
558.2 ,Toxic gastroenteritis and colitis,Diseases of the digestive system,3153,16,1.6,0.078105579,0.91,2.6
456.4 ,Scrotal varices,Diseases of the circulatory system,5146,26,1.59,0.024668506,1.04,2.34
535.0 ,Acute gastritis,Diseases of the digestive system,35936,180,1.59,0.0000000090693638,1.37,1.85
009 ,Ill-defined intestinal infections,Infectious and parasitic diseases,4990,25,1.58,0.0310676933,1.02,2.33
276.5 ,Volume depletion,"Endocrine, nutritional and metabolic...",7592,38,1.58,0.0076983586,1.11,2.17
300.4 ,Dysthymic disorder,Mental disorders,25873,129,1.58,0.0000015735027,1.32,1.88
715.36 ,"Osteoarthrosis, localized, not...",Diseases of the musculoskeletal...,8408,42,1.57,0.0062408132,1.13,2.13
573.9 ,Unspecified disorder of liver,Diseases of the digestive system,11276,56,1.57,0.001806465,1.18,2.04
949.0 ,"Burn of unspecified site, unspecified...",Injury and poisoning,7674,38,1.56,0.0105983616,1.1,2.15
842.01 ,Sprain of carpal (joint) of wrist,Injury and poisoning,2220,11,1.56,0.1312835866,0.78,2.8
686.0 ,Pyoderma,Diseases of the skin and subcutaneous...,13564,67,1.56,0.0007160068,1.21,1.98
110.0 ,Dermatophytosis of scalp and beard,Infectious and parasitic diseases,2415,12,1.56,0.1423941029,0.81,2.74
493.91 ,"Asthma, unspecified type, with...",Diseases of the respiratory system,3235,16,1.56,0.0835723155,0.89,2.53
345.90 ,"Epilepsy, unspecified, without...",Diseases of the nervous system,5862,29,1.56,0.0261783444,1.04,2.24
724.8 ,Other symptoms referable to back,Diseases of the musculoskeletal...,2214,11,1.56,0.1302934768,0.78,2.8
629.9 ,Unspecified disorder of female...,Diseases of the genitourinary...,2429,12,1.55,0.1437584379,0.8,2.72
354.2 ,Lesion of ulnar nerve,Diseases of the nervous system,2025,10,1.55,0.1624761912,0.74,2.86
724.9 ,Other unspecified back disorders,Diseases of the musculoskeletal...,11217,55,1.55,0.0023665393,1.16,2.02
372.0 ,Acute conjunctivitis,Diseases of the nervous system,20601,101,1.55,0.0000382576,1.26,1.89
571.4 ,Chronic hepatitis,Diseases of the digestive system,72999,352,1.55,0.00000000000007633615,1.39,1.73
353.2 ,"Cervical root lesions, not elsewhere...",Diseases of the nervous system,6319,31,1.54,0.0242304498,1.05,2.2
353.9 ,Unspecified nerve root and plexus...,Diseases of the nervous system,3483,17,1.54,0.0942277465,0.89,2.46
726.32 ,Lateral epicondylitis,Diseases of the musculoskeletal...,8812,43,1.54,0.007658268,1.11,2.08
388.3 ,Tinitus,Diseases of the nervous system,7225,35,1.53,0.0159811664,1.06,2.13
681.11 ,Onychia and paronychia of toe,Diseases of the skin and subcutaneous...,8017,39,1.53,0.0124512873,1.09,2.1
428.0 ,"Congestive heart failure, unspecified",Diseases of the circulatory system,2668,13,1.53,0.1204271155,0.81,2.63
780.8 ,Generalized hyperhidrosis,"Comorbidities, signs, and ill-defined...",3089,15,1.53,0.1071911194,0.85,2.53
959.8 ,"Other specified sites, including...",Injury and poisoning,2063,10,1.52,0.1691382075,0.73,2.81
977.9 ,Poisoning by unspecified drug...,Injury and poisoning,2477,12,1.52,0.149156991,0.79,2.67
229.9 ,Benign neoplasm of unspecified...,Neoplasms,2475,12,1.52,0.1489101099,0.79,2.67
240.9 ,"Goiter, unspecified","Endocrine, nutritional and metabolic...",3519,17,1.52,0.0963873491,0.88,2.44
722.91 ,"Other and unspecified disc disorder,...",Diseases of the musculoskeletal...,3107,15,1.52,0.1088609666,0.85,2.51
726.19 ,Other specified disorders of bursae...,Diseases of the musculoskeletal...,3921,19,1.52,0.0855651047,0.92,2.39
583 ,"Nephritis and nephropathy, not...",Diseases of the genitourinary...,2278,11,1.52,0.1863014328,0.76,2.72
380.1 ,Infective otitis externa,Diseases of the nervous system,3934,19,1.52,0.086104062,0.91,2.38
588.9 ,Unspecified disorder resulting...,Diseases of the genitourinary...,3109,15,1.52,0.1090531699,0.85,2.51
034.0 ,Streptococcal sore throat,Infectious and parasitic diseases,3950,19,1.51,0.0868249375,0.91,2.37
686.9 ,Unspecified local infection of...,Diseases of the skin and subcutaneous...,91052,427,1.51,0.000000000000008622267,1.37,1.67
692.5 ,Contact dermatitis and other eczema...,Diseases of the skin and subcutaneous...,3531,17,1.51,0.0971901661,0.88,2.43
111.9 ,"Dermatomycosis, unspecified",Infectious and parasitic diseases,9158,44,1.51,0.0089573393,1.1,2.04
477 ,Allergic rhinitis,Diseases of the respiratory system,21748,104,1.51,0.0000787714,1.23,1.84
608 ,Other disorders of male genital...,Diseases of the genitourinary...,3348,16,1.5,0.1207961476,0.86,2.45
682.8 ,Cellulitis and abscess of other...,Diseases of the skin and subcutaneous...,7550,36,1.5,0.0184277793,1.05,2.08
276.9 ,Electrolyte and fluid disorders...,"Endocrine, nutritional and metabolic...",2720,13,1.5,0.1677599533,0.8,2.58
370.21 ,Punctate keratitis,Diseases of the nervous system,29323,139,1.5,0.0000082796887,1.26,1.78
373.1 ,Hordeolum and other deep inflammation...,Diseases of the nervous system,16788,80,1.5,0.0005629598,1.19,1.88
436 ,"Acute, but ill-defined, cerebrovascular...",Diseases of the circulatory system,2114,10,1.49,0.2394974094,0.71,2.74
443.9 ,"Peripheral vascular disease, unspecified",Diseases of the circulatory system,3167,15,1.49,0.1510843391,0.83,2.46
345.9 ,"Epilepsy, unspecified",Diseases of the nervous system,2529,12,1.49,0.156227755,0.77,2.61
726.2 ,"Other affections of shoulder region,...",Diseases of the musculoskeletal...,1894,9,1.49,0.2161390977,0.68,2.84
370.00 ,"Corneal ulcer, unspecified",Diseases of the nervous system,6529,31,1.49,0.0353322494,1.01,2.13
578.9 ,Hemorrhage of gastrointestinal...,Diseases of the digestive system,16316,77,1.49,0.0009956342,1.17,1.87
009.2 ,Infectious diarrhea,Infectious and parasitic diseases,27403,128,1.48,0.000037828,1.23,1.76
847.1 ,Sprain of thoracic,Injury and poisoning,4237,20,1.48,0.0984912983,0.91,2.3
250.40 ,"Diabetes with renal manifestations,...","Endocrine, nutritional and metabolic...",2338,11,1.48,0.1938409348,0.74,2.65
917.0 ,Abrasion or friction burn of foot...,Injury and poisoning,6391,30,1.48,0.0439200636,0.99,2.11
719.46 ,"Pain in joint, lower leg",Diseases of the musculoskeletal...,10534,49,1.47,0.011521786,1.08,1.94
921.3 ,Contusion of eyeball,Injury and poisoning,4073,19,1.47,0.0944583533,0.88,2.3
825.25 ,Closed fracture of metatarsal...,Injury and poisoning,3025,14,1.46,0.1468029884,0.79,2.45
842.00 ,"Sprain of wrist, unspecified site",Injury and poisoning,5379,25,1.46,0.0674266609,0.94,2.16
923.11 ,Contusion of elbow,Injury and poisoning,4538,21,1.46,0.0861287109,0.9,2.23
924.4 ,Contusion of multiple sites of...,Injury and poisoning,3223,15,1.46,0.1549195553,0.82,2.42
380.23 ,Other chronic otitis externa,Diseases of the nervous system,3455,16,1.46,0.1296253002,0.83,2.37
295 ,Schizophrenic disorders,Mental disorders,5854,27,1.45,0.0616928576,0.95,2.12
358.9 ,"Myoneural disorders, unspecified",Diseases of the nervous system,2162,10,1.45,0.2453326085,0.7,2.68
728.9 ,"Unspecified disorder of muscle,...",Diseases of the musculoskeletal...,21961,101,1.45,0.0004532848,1.18,1.77
782.3 ,Edema,"Comorbidities, signs, and ill-defined...",10019,46,1.45,0.0161252807,1.06,1.93
381.01 ,Acute serous otitis media,Diseases of the nervous system,2595,12,1.45,0.216616808,0.75,2.55
704.8 ,Other specified diseases of hair...,Diseases of the skin and subcutaneous...,31948,145,1.44,0.0000469561,1.21,1.7
239.8 ,"Neoplasms of unspecified nature,...",Neoplasms,2408,11,1.44,0.2050751579,0.72,2.58
296.90 ,Unspecified episodic mood disorder,Mental disorders,2840,13,1.44,0.1803746035,0.76,2.47
300.3 ,Obsessive-compulsive disorders,Mental disorders,1967,9,1.44,0.3095697796,0.66,2.74
533.30 ,Acute peptic ulcer of unspecified...,Diseases of the digestive system,8115,37,1.44,0.0371538387,1.01,1.98
786.9 ,Other symptoms involving respiratory...,"Comorbidities, signs, and ill-defined...",3064,14,1.44,0.1945230963,0.78,2.42
995.3 ,"Allergy, unspecified, not elsewhere...",Injury and poisoning,13702,62,1.43,0.0075812425,1.09,1.83
490 ,"Bronchitis, not specified as acute...",Diseases of the respiratory system,43082,194,1.43,0.0000034344593,1.23,1.65
715.90 ,"Osteoarthrosis, unspecified whether...",Diseases of the musculoskeletal...,25655,116,1.43,0.0002783984,1.18,1.72
585 ,Chronic renal failure,Diseases of the genitourinary...,6830,31,1.43,0.0522903635,0.97,2.03
388.8 ,Other disorders of ear,Diseases of the nervous system,2875,13,1.42,0.1852538829,0.76,2.44
372.8 ,Other disorders of conjunctiva,Diseases of the nervous system,3992,18,1.42,0.1562342505,0.84,2.25
782.2 ,"Localized superficial swelling,...","Comorbidities, signs, and ill-defined...",2437,11,1.42,0.2744452509,0.71,2.55
785.6 ,Enlargement of lymph nodes,"Comorbidities, signs, and ill-defined...",3554,16,1.42,0.1761949006,0.81,2.3
805.4 ,Closed fracture of lumbar vertebra...,Injury and poisoning,3572,16,1.41,0.1776595881,0.8,2.29
681.02 ,Onychia and paronychia of finger,Diseases of the skin and subcutaneous...,3790,17,1.41,0.1485521311,0.82,2.26
464 ,Acute laryngitis and tracheitis,Diseases of the respiratory system,43105,192,1.41,0.0000078786075,1.22,1.63
716.9 ,"Arthropathy, unspecified",Diseases of the musculoskeletal...,15156,68,1.41,0.0071882097,1.1,1.8
353.1 ,Lumbosacral plexus lesions,Diseases of the nervous system,2002,9,1.41,0.3138643852,0.64,2.69
386.1 ,Other and unspecified peripheral...,Diseases of the nervous system,3583,16,1.4,0.1786125829,0.8,2.29
854.09 ,Intracranial injury of other and...,Injury and poisoning,3595,16,1.4,0.1797018862,0.8,2.28
487 ,Influenza,Diseases of the respiratory system,16400,73,1.4,0.0064489005,1.1,1.77
493.9 ,"Asthma, unspecified",Diseases of the respiratory system,8318,37,1.4,0.0500942483,0.98,1.93
719.49 ,"Pain in joint, multiple sites",Diseases of the musculoskeletal...,8781,39,1.4,0.0452804557,0.99,1.92
362.41 ,Central serous retinopathy,Diseases of the nervous system,3589,16,1.4,0.179150779,0.8,2.28
930.1 ,Foreign body in conjunctival sac,Injury and poisoning,64441,283,1.4,0.00000015460138,1.24,1.58
607.84 ,Impotence of organic origin,Diseases of the genitourinary...,7038,31,1.39,0.0715190238,0.94,1.97
823.80 ,Closed fracture of unspecified...,Injury and poisoning,2487,11,1.39,0.2798313855,0.69,2.49
692.1 ,Contact dermatitis and other eczema...,Diseases of the skin and subcutaneous...,2256,10,1.39,0.2608542667,0.67,2.57
215.9 ,Other benign neoplasm of connective...,Neoplasms,5221,23,1.39,0.1373954846,0.88,2.08
714.0 ,Rheumatoid arthritis,Diseases of the musculoskeletal...,9027,40,1.39,0.0392961867,0.99,1.9
715.96 ,"Osteoarthrosis, unspecified whether...",Diseases of the musculoskeletal...,3169,14,1.39,0.2053741624,0.76,2.34
511.0 ,Pleurisy without mention of effusion...,Diseases of the respiratory system,2269,10,1.39,0.2633992999,0.66,2.55
530.8 ,Other specified disorders of esophagus,Diseases of the digestive system,2713,12,1.39,0.2313379483,0.72,2.43
723.5 ,"Torticollis, unspecified",Diseases of the musculoskeletal...,2947,13,1.39,0.2474406513,0.74,2.38
733.42 ,Aseptic necrosis of head and neck...,Diseases of the musculoskeletal...,4077,18,1.39,0.1623668623,0.82,2.2
011.90 ,"Pulmonary tuberculosis, unspecified,...",Infectious and parasitic diseases,4564,20,1.38,0.1472347794,0.84,2.13
110.8 ,Dermatophytosis of other specified...,Infectious and parasitic diseases,3423,15,1.38,0.2207948905,0.77,2.28
349.9 ,Unspecified disorders of nervous...,Diseases of the nervous system,11188,49,1.38,0.0285169687,1.02,1.83
414.0 ,Coronary atherosclerosis,Diseases of the circulatory system,6899,30,1.37,0.0867909087,0.92,1.96
491.8 ,Other chronic bronchitis,Diseases of the respiratory system,4126,18,1.37,0.1669098199,0.81,2.17
300.01 ,Panic disorder without agoraphobia,Mental disorders,3436,15,1.37,0.2220016164,0.77,2.27
847.0 ,Sprain of neck,Injury and poisoning,26782,115,1.36,0.0018215786,1.12,1.63
519.9 ,Unspecified disease of respiratory...,Diseases of the respiratory system,5317,23,1.36,0.1421913116,0.86,2.05
719.41 ,"Pain in joint, shoulder region",Diseases of the musculoskeletal...,7149,31,1.36,0.0913059744,0.93,1.94
533.00 ,Acute peptic ulcer of unspecified...,Diseases of the digestive system,7391,32,1.36,0.0963208697,0.93,1.93
590.10 ,Acute pyelonephritis without lesion...,Diseases of the genitourinary...,3460,15,1.36,0.2244054004,0.76,2.25
599.8 ,Other specified disorders of urethra...,Diseases of the genitourinary...,2788,12,1.35,0.3078144129,0.7,2.37
601.1 ,Chronic prostatitis,Diseases of the genitourinary...,8614,37,1.35,0.0831994905,0.95,1.87
684 ,Impetigo,Diseases of the skin and subcutaneous...,3970,17,1.35,0.2041232064,0.78,2.16
844.8 ,Sprains and strains of other specified...,Injury and poisoning,2092,9,1.35,0.3287122333,0.62,2.57
845.00 ,"Sprain of ankle, unspecified site",Injury and poisoning,13954,60,1.35,0.0233946488,1.03,1.75
847.9 ,Sprain of unspecified site of...,Injury and poisoning,9821,42,1.35,0.0590087357,0.97,1.82
464.11 ,Acute tracheitis with obstruction,Diseases of the respiratory system,11169,48,1.35,0.0427068919,1,1.8
709 ,Other disorders of skin and subcutaneous...,Diseases of the skin and subcutaneous...,2097,9,1.35,0.3296873066,0.62,2.57
719.40 ,"Pain in joint, site unspecified",Diseases of the musculoskeletal...,49277,209,1.35,0.0000578887,1.17,1.55
537.9 ,Unspecified disorder of stomach...,Diseases of the digestive system,3483,15,1.35,0.2269199412,0.76,2.24
729.5 ,Pain in limb,Diseases of the musculoskeletal...,13509,58,1.35,0.0260190834,1.02,1.75
573 ,Other disorders of liver,Diseases of the digestive system,2096,9,1.35,0.3294910919,0.62,2.57
077.1 ,Epidemic keratoconjunctivitis,Infectious and parasitic diseases,25402,108,1.34,0.0034959789,1.1,1.62
844.2 ,Sprain of cruciate ligament of...,Injury and poisoning,2574,11,1.34,0.2924909809,0.67,2.41
239.2 ,Neoplasm of unspecified nature...,Neoplasms,3984,17,1.34,0.2056364872,0.78,2.15
717.9 ,Unspecified internal derangement...,Diseases of the musculoskeletal...,3277,14,1.34,0.2734684855,0.73,2.26
533.9 ,"Peptic ulcer, site unspecified,...",Diseases of the digestive system,31975,136,1.34,0.0011075793,1.13,1.59
723.9 ,Unspecified musculoskeletal disorders...,Diseases of the musculoskeletal...,2118,9,1.34,0.3339443307,0.61,2.54
724.5 ,"Backache, unspecified",Diseases of the musculoskeletal...,122384,511,1.34,0.0000000009957382,1.22,1.47
727.89 ,"Other disorders of synovium, tendon,...",Diseases of the musculoskeletal...,2818,12,1.34,0.3109956208,0.69,2.34
569.9 ,Unspecified disorder of intestine,Diseases of the digestive system,5172,22,1.34,0.1725305397,0.84,2.03
783.0 ,Anorexia,"Comorbidities, signs, and ill-defined...",1872,8,1.34,0.4047873464,0.58,2.65
789.0 ,Abdominal pain,"Comorbidities, signs, and ill-defined...",243108,984,1.33,0.000000000000004199517,1.24,1.42
691.8 ,Other atopic dermatitis and related...,Diseases of the skin and subcutaneous...,29354,124,1.33,0.0024020212,1.11,1.59
300.02 ,Generalized anxiety disorder,Mental disorders,9199,39,1.33,0.0774118991,0.95,1.83
532.30 ,Acute duodenal ulcer without mention...,Diseases of the digestive system,5417,23,1.33,0.181555397,0.84,2.01
723.4 ,"Brachial neuritis or radiculitis,...",Diseases of the musculoskeletal...,4955,21,1.33,0.2039911372,0.82,2.04
724.3 ,Sciatica,Diseases of the musculoskeletal...,47627,200,1.33,0.0001453275,1.15,1.53
729.4 ,"Fasciitis, unspecified",Diseases of the musculoskeletal...,72066,302,1.33,0.0000030737181,1.18,1.5
780.4 ,Dizziness and giddiness,"Comorbidities, signs, and ill-defined...",119253,493,1.33,0.00000000732517,1.21,1.46
784.1 ,Throat pain,"Comorbidities, signs, and ill-defined...",21839,92,1.33,0.0092385595,1.07,1.63
959.7 ,"Knee, leg, ankle, and foot injury",Injury and poisoning,4055,17,1.32,0.2611681293,0.77,2.11
038.9 ,Unspecified septicemia,Infectious and parasitic diseases,4057,17,1.32,0.2613199996,0.77,2.11
706.2 ,Sebaceous cyst,Diseases of the skin and subcutaneous...,12681,53,1.32,0.0569523635,0.98,1.72
486 ,"Pneumonia, organism unspecified",Diseases of the respiratory system,23424,98,1.32,0.0085239744,1.07,1.61
719.48 ,"Pain in joint, other specified...",Diseases of the musculoskeletal...,4039,17,1.32,0.2600043864,0.77,2.12
721.1 ,Cervical spondylosis with myelopathy,Diseases of the musculoskeletal...,5735,24,1.32,0.194293051,0.84,1.96
591 ,Hydronephrosis,Diseases of the genitourinary...,13813,58,1.32,0.0402372912,1,1.71
786.2 ,Cough,"Comorbidities, signs, and ill-defined...",97075,402,1.32,0.0000002051429,1.19,1.47
708.0 ,Allergic urticaria,Diseases of the skin and subcutaneous...,39469,164,1.31,0.0009556448,1.12,1.54
719.99 ,"Unspecified disorder of joint,...",Diseases of the musculoskeletal...,2887,12,1.31,0.3199903188,0.67,2.29
571.41 ,Chronic persistent hepatitis,Diseases of the digestive system,11282,47,1.31,0.0774579932,0.96,1.75
780.53 ,"Hypersomnia with sleep apnea,...","Comorbidities, signs, and ill-defined...",2644,11,1.31,0.3827995472,0.65,2.34
009.0 ,"Infectious colitis, enteritis,...",Infectious and parasitic diseases,64048,262,1.3,0.0000717827,1.14,1.47
848.9 ,Unspecified site of sprain and...,Injury and poisoning,99915,408,1.3,0.00000063954275,1.18,1.44
211.5 ,Benign neoplasm of liver and biliary...,Neoplasms,3637,15,1.3,0.3001559571,0.72,2.14
250.9 ,Diabetes with unspecified complication,"Endocrine, nutritional and metabolic...",1931,8,1.3,0.4147098039,0.56,2.57
289.3 ,"Lymphadenitis, unspecified, except...",Diseases of the blood and blood-forming...,3874,16,1.3,0.3141296313,0.74,2.11
357.4 ,Polyneuropathy in other diseases...,Diseases of the nervous system,3150,13,1.3,0.3388157975,0.69,2.22
729.2 ,"Neuralgia, neuritis, and radiculitis,...",Diseases of the musculoskeletal...,51011,210,1.3,0.0002798081,1.13,1.5
692.70 ,Unspecified dermatitis due to...,Diseases of the skin and subcutaneous...,2677,11,1.29,0.3864159348,0.64,2.32
280.9 ,"Iron deficiency anemia, unspecified",Diseases of the blood and blood-forming...,2924,12,1.29,0.325727459,0.67,2.26
780.6 ,Fever,"Comorbidities, signs, and ill-defined...",86474,351,1.29,0.0000070244867,1.16,1.44
380.22 ,Other acute otitis externa,Diseases of the nervous system,20320,83,1.29,0.0281082006,1.02,1.6
845.19 ,Other sprain of foot,Injury and poisoning,2946,12,1.28,0.4088479053,0.66,2.24
493.10 ,"Intrinsic asthma, unspecified",Diseases of the respiratory system,1957,8,1.28,0.4197922343,0.55,2.54
532.70 ,Chronic duodenal ulcer without...,Diseases of the digestive system,12044,49,1.28,0.0880977471,0.95,1.7
726.10 ,Disorders of bursae and tendons...,Diseases of the musculoskeletal...,6874,28,1.28,0.1965139814,0.85,1.85
555.1 ,Regional enteritis of large intestine,Diseases of the digestive system,3446,14,1.28,0.3603105338,0.7,2.15
727.09 ,Other synovitis and tenosynovitis,Diseases of the musculoskeletal...,4928,20,1.28,0.2545167185,0.78,1.97
933.0 ,Foreign body in pharynx,Injury and poisoning,15247,62,1.28,0.0600550177,0.98,1.64
110.2 ,Dermatophytosis of hand,Infectious and parasitic diseases,4718,19,1.27,0.2985298528,0.76,1.98
692.3 ,Contact dermatitis and other eczema...,Diseases of the skin and subcutaneous...,6692,27,1.27,0.2298778865,0.83,1.85
714.9 ,Unspecified inflammatory polyarthropathy,Diseases of the musculoskeletal...,2225,9,1.27,0.4468784045,0.58,2.42
724.2 ,Lumbago,Diseases of the musculoskeletal...,182388,719,1.27,0.0000000044275793,1.18,1.38
893.0 ,"Open wound of toe(s), without...",Injury and poisoning,9373,38,1.27,0.1404756034,0.9,1.75
370.23 ,Filamentary keratitis,Diseases of the nervous system,2218,9,1.27,0.4458959874,0.58,2.43
727.9 ,"Unspecified disorder of synovium,...",Diseases of the musculoskeletal...,4939,20,1.27,0.2555201334,0.78,1.97
372.72 ,Conjunctival hemorrhage,Diseases of the nervous system,23558,95,1.27,0.0231483133,1.03,1.56
782.1 ,Rash and other nonspecific skin...,"Comorbidities, signs, and ill-defined...",9149,37,1.27,0.1615223885,0.89,1.76
596.5 ,Other functional disorders of...,Diseases of the genitourinary...,6699,27,1.27,0.2301639198,0.83,1.85
461 ,Acute sinusitis,Diseases of the respiratory system,27229,109,1.26,0.0196178756,1.03,1.53
111 ,"Dermatomycosis, other and unspecified",Infectious and parasitic diseases,1988,8,1.26,0.4263766917,0.54,2.5
693.1 ,Dermatitis due to food taken internally,Diseases of the skin and subcutaneous...,2733,11,1.26,0.3938076031,0.63,2.27
496 ,"Chronic airway obstruction, not...",Diseases of the respiratory system,10715,43,1.26,0.1426282563,0.91,1.7
300.89 ,Other somatoform disorders,Mental disorders,2986,12,1.26,0.4124634321,0.65,2.21
721.3 ,Lumbosacral spondylosis without...,Diseases of the musculoskeletal...,31840,127,1.26,0.0137971781,1.05,1.5
727.00 ,"Synovitis and tenosynovitis, unspecified",Diseases of the musculoskeletal...,81293,323,1.26,0.0000870328,1.12,1.41
729.1 ,"Myalgia and myositis, unspecified",Diseases of the musculoskeletal...,136853,540,1.26,0.00000049990618,1.15,1.38
780.2 ,Syncope and collapse,"Comorbidities, signs, and ill-defined...",6004,24,1.26,0.2506150095,0.8,1.87
786.01 ,Hyperventilation,"Comorbidities, signs, and ill-defined...",2001,8,1.26,0.429299327,0.54,2.48
592.9 ,"Urinary calculus, unspecified",Diseases of the genitourinary...,51181,204,1.26,0.0016439392,1.09,1.45
600 ,Hyperplasia of prostate,Diseases of the genitourinary...,7555,30,1.25,0.2188342281,0.84,1.79
680.9 ,Carbuncle and furuncle of unspecified...,Diseases of the skin and subcutaneous...,39800,157,1.25,0.008987276,1.06,1.46
847.2 ,Sprain of lumbar,Injury and poisoning,47972,189,1.25,0.0040009844,1.07,1.44
693.9 ,Dermatitis due to unspecified...,Diseases of the skin and subcutaneous...,11783,47,1.25,0.1192028181,0.92,1.67
