099.9 ,"Venereal disease, unspecified",Infectious and parasitic diseases,3450,13,2.23,0.0099952694,1.19,3.83
805.4 ,Closed fracture of lumbar vertebra...,Injury and poisoning,3461,13,2.23,0.0101221529,1.18,3.82
884.1 ,Multiple and unspecified open...,Injury and poisoning,2924,11,2.23,0.0197643997,1.11,4
386.9 ,Unspecified vertiginous syndromes...,Diseases of the nervous system,6138,23,2.22,0.0005161177,1.41,3.35
995.2 ,Unspecified adverse effect od...,Injury and poisoning,2135,8,2.22,0.0314183685,0.96,4.38
601.9 ,"Prostatitis, unspecified",Diseases of the genitourinary...,3756,14,2.21,0.0075926549,1.2,3.72
786.5 ,Chest pain,"Comorbidities, signs, and ill-defined...",23710,87,2.2,0.00000000009228417,1.76,2.73
790.6 ,Other abnormal blood chemistry,"Comorbidities, signs, and ill-defined...",7294,27,2.2,0.000257578,1.45,3.21
880.03 ,"Open wound of upper arm, without...",Injury and poisoning,5395,20,2.2,0.0013409019,1.34,3.41
386.10 ,"Peripheral vertigo, unspecified",Diseases of the nervous system,3764,14,2.2,0.0076749778,1.2,3.71
927.9 ,Crushing injury of unspecified...,Injury and poisoning,2166,8,2.19,0.0337404798,0.94,4.32
372.02 ,Acute follicular conjunctivitis,Diseases of the nervous system,6520,24,2.19,0.0006625635,1.4,3.26
924.1 ,Contusion of knee and lower leg,Injury and poisoning,3254,12,2.18,0.0150685832,1.13,3.83
824.0 ,"Fracture of medial malleolus,...",Injury and poisoning,2174,8,2.18,0.0343581173,0.94,4.3
533.70 ,Chronic peptic ulcer of unspecified...,Diseases of the digestive system,9015,33,2.18,0.0000825631,1.49,3.07
923.21 ,Contusion of wrist,Injury and poisoning,6560,24,2.17,0.0006929956,1.39,3.24
070.3 ,Viral hepatitis B without mention...,Infectious and parasitic diseases,6004,22,2.17,0.0012612851,1.36,3.3
360.89 ,Other disorders of globe,Diseases of the nervous system,3545,13,2.17,0.0112427751,1.15,3.73
401.1 ,Benign essential hypertension,Diseases of the circulatory system,3562,13,2.16,0.0115029594,1.15,3.71
239.2 ,Neoplasm of unspecified nature...,Neoplasms,3837,14,2.16,0.0085110519,1.18,3.64
296.2 ,"Major depressive disorder, single...",Mental disorders,1919,7,2.16,0.047699528,0.87,4.46
370.9 ,Unspecified keratitis,Diseases of the nervous system,7154,26,2.16,0.0004129989,1.41,3.17
599 ,Other disorders of urethra and...,Diseases of the genitourinary...,4397,16,2.16,0.0048423317,1.23,3.51
959.4 ,"Hand, except finger injury",Injury and poisoning,3035,11,2.15,0.0221323484,1.07,3.85
813 ,Fracture of radius and ulna,Injury and poisoning,2476,9,2.15,0.0425715915,0.98,4.1
349.9 ,Unspecified disorders of nervous...,Diseases of the nervous system,6354,23,2.15,0.0010094652,1.36,3.23
372 ,Disorders of conjunctiva,Diseases of the nervous system,4959,18,2.15,0.0028389272,1.27,3.41
923.9 ,Contusion of unspecified part...,Injury and poisoning,12526,45,2.14,0.0000052950329,1.56,2.87
491.8 ,Other chronic bronchitis,Diseases of the respiratory system,2496,9,2.13,0.0433046243,0.97,4.06
038.9 ,Unspecified septicemia,Infectious and parasitic diseases,3075,11,2.12,0.0232050313,1.06,3.8
533.90 ,"Peptic ulcer of unspecified site,...",Diseases of the digestive system,57333,198,2.11,4.721799e-20,1.82,2.44
278.0 ,Obesity,"Endocrine, nutritional and metabolic...",4211,15,2.11,0.007444524,1.18,3.49
493.91 ,"Asthma, unspecified type, with...",Diseases of the respiratory system,2816,10,2.1,0.0325285691,1.01,3.88
380.22 ,Other acute otitis externa,Diseases of the nervous system,16794,59,2.1,0.00000038680698,1.59,2.71
389.9 ,Unspecified hearing loss,Diseases of the nervous system,5395,19,2.09,0.0038756824,1.25,3.27
447.6 ,"Arteritis, unspecified",Diseases of the circulatory system,2261,8,2.09,0.0630894004,0.9,4.14
496 ,"Chronic airway obstruction, not...",Diseases of the respiratory system,4533,16,2.09,0.0061031536,1.19,3.41
571.9 ,Unspecified chronic liver disease...,Diseases of the digestive system,13134,46,2.09,0.0000088207999,1.52,2.79
786.9 ,Other symptoms involving respiratory...,"Comorbidities, signs, and ill-defined...",2840,10,2.08,0.033429504,1,3.84
555.0 ,Regional enteritis of small intestine,Diseases of the digestive system,3415,12,2.08,0.0186053757,1.07,3.64
923.3 ,Contusion of finger,Injury and poisoning,8339,29,2.07,0.0004118172,1.38,2.97
924.11 ,Contusion of knee,Injury and poisoning,21108,73,2.07,0.000000029349102,1.62,2.61
924.2 ,"Contusion of ankle and foot, excluding...",Injury and poisoning,2853,10,2.07,0.0339417421,0.99,3.83
825.25 ,Closed fracture of metatarsal...,Injury and poisoning,3143,11,2.07,0.0253018409,1.03,3.72
427.9 ,"Cardiac dysrhythmia, unspecified",Diseases of the circulatory system,14446,50,2.06,0.0000055098648,1.53,2.73
535.40 ,"Other specified gastritis, without...",Diseases of the digestive system,20043,69,2.06,0.000000089490437,1.6,2.61
569.9 ,Unspecified disorder of intestine,Diseases of the digestive system,4029,14,2.06,0.0114938762,1.12,3.46
346.9 ,"Migraine, unspecified",Diseases of the nervous system,11843,41,2.06,0.0000403165,1.47,2.8
367.9 ,Unspecified disorder of refraction...,Diseases of the nervous system,15333,53,2.06,0.0000024933553,1.54,2.71
427 ,Cardiac dysrhythmias,Diseases of the circulatory system,3171,11,2.05,0.0262668349,1.02,3.68
719.47 ,"Pain in joint, ankle and foot",Diseases of the musculoskeletal...,6642,23,2.05,0.0015103579,1.3,3.09
110.2 ,Dermatophytosis of hand,Infectious and parasitic diseases,3174,11,2.05,0.0263737834,1.02,3.68
345 ,Epilepsy,Diseases of the nervous system,2019,7,2.05,0.0917025667,0.82,4.24
873.9 ,Other and unspecified open wound...,Injury and poisoning,2027,7,2.04,0.0922559932,0.82,4.22
372.54 ,Conjunctival concretions,Diseases of the nervous system,9589,33,2.04,0.0002354081,1.4,2.88
491.1 ,Mucopurulent chronic bronchitis,Diseases of the respiratory system,3501,12,2.03,0.0210944369,1.05,3.55
528.9 ,Other and unspecified diseases...,Diseases of the digestive system,31395,106,2.03,0.0000000001058321,1.66,2.47
682.6 ,"Cellulitis and abscess of leg,...",Diseases of the skin and subcutaneous...,9060,31,2.03,0.0004296776,1.38,2.89
924.01 ,Contusion of hip,Injury and poisoning,4392,15,2.02,0.0143896512,1.13,3.35
070.31 ,Viral hepatitis B without mention...,Infectious and parasitic diseases,2045,7,2.02,0.0935597201,0.81,4.18
794.8 ,Nonspecific abnormal results of...,"Comorbidities, signs, and ill-defined...",11780,40,2.02,0.0000639008,1.44,2.76
922.2 ,Contusion of abdominal wall,Injury and poisoning,5575,19,2.02,0.0047792689,1.21,3.16
455 ,Hemorrhoids,Diseases of the circulatory system,6782,23,2.01,0.0025409866,1.27,3.03
719 ,Other and unspecified disorders...,Diseases of the musculoskeletal...,4726,16,2.01,0.011149994,1.14,3.27
540 ,Acute appendicitis,Diseases of the digestive system,2354,8,2.01,0.0686961652,0.87,3.97
464.11 ,Acute tracheitis with obstruction,Diseases of the respiratory system,9212,31,2,0.0004880995,1.35,2.85
802.0 ,Closed fracture of nasal bones,Injury and poisoning,2668,9,2,0.0518568389,0.91,3.8
535.4 ,Other specified gastritis,Diseases of the digestive system,5921,20,2,0.0039854788,1.22,3.1
535.50 ,"Unspecified gastritis and gastroduodenitis,...",Diseases of the digestive system,109432,349,2,8.422542e-29,1.78,2.24
571.5 ,Cirrhosis of liver without mention...,Diseases of the digestive system,3840,13,2,0.0174888395,1.07,3.44
799.9 ,Other unknown and unspecified...,"Comorbidities, signs, and ill-defined...",2384,8,1.99,0.0708414677,0.86,3.92
536 ,Disorders of function of stomach,Diseases of the digestive system,13796,46,1.99,0.0000257439,1.45,2.66
372.13 ,Vernal conjunctivitis,Diseases of the nervous system,2381,8,1.99,0.0706196314,0.86,3.93
680.0 ,Carbuncle and furuncle of face,Diseases of the skin and subcutaneous...,6853,23,1.99,0.0027069244,1.26,3
424.0 ,Mitral valve disorders,Diseases of the circulatory system,13844,46,1.98,0.0000272466,1.44,2.65
791.0 ,Proteinuria,"Comorbidities, signs, and ill-defined...",5078,17,1.98,0.0090318053,1.15,3.18
485 ,"Bronchopneumonia, organism unspecified",Diseases of the respiratory system,7232,24,1.97,0.0022830257,1.26,2.94
493.90 ,"Asthma, unspecified type, unspecified",Diseases of the respiratory system,32030,105,1.97,0.000000000650127,1.61,2.4
823.82 ,Closed fracture of unspecified...,Injury and poisoning,2100,7,1.97,0.0980378431,0.79,4.07
588.9 ,Unspecified disorder resulting...,Diseases of the genitourinary...,2104,7,1.97,0.0983921718,0.79,4.07
919.9 ,Other and unspecified superficial...,Injury and poisoning,3308,11,1.97,0.0318666743,0.98,3.53
786.09 ,Other respiratory abnormalities,"Comorbidities, signs, and ill-defined...",7569,25,1.96,0.0018787926,1.27,2.9
787.7 ,Abnormal feces,"Comorbidities, signs, and ill-defined...",3323,11,1.96,0.0325702639,0.98,3.52
787.9 ,Other symptoms involving digestive...,"Comorbidities, signs, and ill-defined...",7281,24,1.96,0.0024220356,1.25,2.92
788.0 ,Renal colic,"Comorbidities, signs, and ill-defined...",10589,35,1.96,0.0003056865,1.36,2.74
111.9 ,"Dermatomycosis, unspecified",Infectious and parasitic diseases,7564,25,1.96,0.0018665622,1.27,2.9
532.90 ,"Duodenal ulcer, unspecified as...",Diseases of the digestive system,12417,41,1.96,0.0001002566,1.41,2.67
606.9 ,"Male infertility, unspecified",Diseases of the genitourinary...,5432,18,1.96,0.0075241768,1.16,3.11
682 ,Other cellulitis and abscess,Diseases of the skin and subcutaneous...,8193,27,1.96,0.001631579,1.29,2.85
789 ,Other symptoms involving abdomen...,"Comorbidities, signs, and ill-defined...",3638,12,1.95,0.0388068367,1.01,3.42
536.9 ,Unspecified functional disorder...,Diseases of the digestive system,137750,424,1.95,4.491809e-32,1.76,2.17
300.3 ,Obsessive-compulsive disorders,Mental disorders,2427,8,1.95,0.0741982618,0.84,3.85
307.40 ,"Nonorganic sleep disorder, unspecified",Mental disorders,2127,7,1.95,0.100503762,0.78,4.02
573.3 ,"Hepatitis, unspecified",Diseases of the digestive system,19917,65,1.95,0.0000013902155,1.5,2.49
891.2 ,"Open wound of knee, leg [except...",Injury and poisoning,2123,7,1.95,0.1001274888,0.78,4.03
683 ,Acute lymphadenitis,Diseases of the skin and subcutaneous...,4244,14,1.95,0.0217021669,1.07,3.29
564.1 ,Irritable bowel syndrome,Diseases of the digestive system,46378,149,1.94,0.0000000000007286878,1.64,2.29
780.9 ,Other general symptoms,"Comorbidities, signs, and ill-defined...",11394,37,1.93,0.0003251131,1.36,2.67
493 ,Asthma,Diseases of the respiratory system,8591,28,1.93,0.0013783628,1.28,2.8
823 ,Fracture of tibia and fibula,Injury and poisoning,2752,9,1.93,0.0574913709,0.88,3.68
894.1 ,Multiple and unspecified open...,Injury and poisoning,3072,10,1.93,0.0451675527,0.92,3.55
372.8 ,Other disorders of conjunctiva,Diseases of the nervous system,3068,10,1.93,0.0449180109,0.92,3.56
787.0 ,Nausea and vomiting,"Comorbidities, signs, and ill-defined...",37074,118,1.92,0.0000000002661509,1.58,2.3
229.8 ,Benign neoplasm of other specified...,Neoplasms,5253,17,1.92,0.0112671005,1.11,3.08
272.2 ,Mixed hyperlipidemia,"Endocrine, nutritional and metabolic...",10813,35,1.92,0.0003848192,1.34,2.68
845.10 ,"Sprain of foot, unspecified site",Injury and poisoning,4944,16,1.92,0.0142323665,1.09,3.12
311 ,"Depressive disorder, not elsewhere...",Mental disorders,3999,13,1.92,0.0301642205,1.02,3.3
571.49 ,Other chronic hepatitis,Diseases of the digestive system,10198,33,1.92,0.0006130313,1.32,2.71
487.0 ,Influenza with pneumonia,Diseases of the respiratory system,3716,12,1.91,0.0407686652,0.99,3.35
848 ,Other and ill-defined sprains...,Injury and poisoning,2171,7,1.91,0.1048906858,0.77,3.94
578.1 ,Blood in stool,Diseases of the digestive system,2474,8,1.91,0.0782426118,0.82,3.78
681.9 ,Cellulitis and abscess of unspecified...,Diseases of the skin and subcutaneous...,9652,31,1.91,0.001063617,1.29,2.71
532 ,Duodenal ulcer,Diseases of the digestive system,4983,16,1.9,0.0149432311,1.08,3.1
591 ,Hydronephrosis,Diseases of the genitourinary...,6544,21,1.9,0.0061019431,1.17,2.92
910 ,"Superficial injury of face, neck,...",Injury and poisoning,4042,13,1.9,0.0312897879,1.01,3.26
530.1 ,Esophagitis,Diseases of the digestive system,19615,62,1.89,0.0000066826188,1.44,2.43
530.9 ,Unspecified disorder of esophagus,Diseases of the digestive system,2815,9,1.89,0.0623417324,0.86,3.6
571.0 ,Alcoholic fatty liver,Diseases of the digestive system,2190,7,1.89,0.1069236672,0.76,3.91
884.2 ,Multiple and unspecified open...,Injury and poisoning,2192,7,1.89,0.1071424649,0.76,3.9
379.99 ,Other ill-defined disorders of...,Diseases of the nervous system,2824,9,1.89,0.0630781817,0.86,3.59
110.3 ,Dermatophytosis of groin and perianal...,Infectious and parasitic diseases,33151,104,1.88,0.000000007080786,1.53,2.29
705.81 ,Dyshidrosis,Diseases of the skin and subcutaneous...,30056,94,1.87,0.000000039080718,1.51,2.3
945.00 ,Burn of unspecified degree of...,Injury and poisoning,2536,8,1.87,0.0841678175,0.8,3.69
709.0 ,Dyschromia,Diseases of the skin and subcutaneous...,6325,20,1.87,0.0085360311,1.14,2.9
229.9 ,Benign neoplasm of unspecified...,Neoplasms,2530,8,1.87,0.083565401,0.81,3.7
850 ,Concussion,Injury and poisoning,8267,26,1.87,0.0030162309,1.22,2.74
850.0 ,Concussion with no loss of consciousness,Injury and poisoning,14020,44,1.87,0.0001722649,1.35,2.51
370 ,Keratitis,Diseases of the nervous system,3167,10,1.87,0.0764498104,0.89,3.45
370.40 ,"Keratoconjunctivitis, unspecified",Diseases of the nervous system,5395,17,1.87,0.0180676622,1.08,3
372.20 ,"Blepharoconjunctivitis, unspecified",Diseases of the nervous system,6980,22,1.87,0.0076310063,1.17,2.84
924.4 ,Contusion of multiple sites of...,Injury and poisoning,5095,16,1.86,0.023811313,1.06,3.03
382.9 ,Unspecified otitis media,Diseases of the nervous system,27607,86,1.86,0.00000018582347,1.49,2.31
477.0 ,Allergic rhinitis due to pollen,Diseases of the respiratory system,2553,8,1.85,0.0859081188,0.8,3.66
215.0 ,Other benign neoplasm of connective...,Neoplasms,3838,12,1.85,0.0449240556,0.95,3.24
533 ,"Peptic ulcer, site unspecified",Diseases of the digestive system,15119,47,1.85,0.0001345593,1.36,2.47
566 ,Abscess of anal and rectal regions,Diseases of the digestive system,3833,12,1.85,0.0447276651,0.96,3.24
597 ,"Urethritis, not sexually transmitted,...",Diseases of the genitourinary...,1918,6,1.85,0.1496361088,0.68,4.04
599.0 ,"Urinary tract infection, site...",Diseases of the genitourinary...,57435,175,1.85,0.0000000000004686106,1.58,2.16
891.1 ,"Open wound of knee, leg [except...",Injury and poisoning,8639,27,1.85,0.0034256121,1.22,2.7
455.0 ,Internal hemorrhoids without mention...,Diseases of the circulatory system,5480,17,1.84,0.019305127,1.07,2.95
785.6 ,Enlargement of lymph nodes,"Comorbidities, signs, and ill-defined...",4500,14,1.84,0.0283009577,1,3.1
533.30 ,Acute peptic ulcer of unspecified...,Diseases of the digestive system,6113,19,1.84,0.0120016521,1.11,2.88
881.0 ,"Open wound of elbow, forearm,...",Injury and poisoning,3849,12,1.84,0.0453639726,0.95,3.23
372.11 ,Simple chronic conjunctivitis,Diseases of the nervous system,25047,77,1.84,0.0000012988275,1.45,2.3
386.00 ,"Minihre's disease, unspecified",Diseases of the nervous system,4507,14,1.84,0.0285316263,1,3.09
784.2 ,"Swelling, mass, or lump in head...","Comorbidities, signs, and ill-defined...",4856,15,1.83,0.0326331991,1.02,3.02
368.13 ,Visual discomfort,Diseases of the nervous system,29437,90,1.83,0.00000021047585,1.47,2.26
371.89 ,Other corneal disorders,Diseases of the nervous system,5493,17,1.83,0.0195177995,1.07,2.94
381.01 ,Acute serous otitis media,Diseases of the nervous system,2256,7,1.83,0.1146181562,0.74,3.79
729.81 ,Swelling of limb,Diseases of the musculoskeletal...,3259,10,1.82,0.080598808,0.87,3.35
477.8 ,Allergic rhinitis due to other...,Diseases of the respiratory system,9445,29,1.82,0.0034663465,1.22,2.62
531.70 ,Chronic gastric ulcer without...,Diseases of the digestive system,3580,11,1.82,0.0614552917,0.91,3.26
556 ,Idiopathic proctocolitis,Diseases of the digestive system,2927,9,1.82,0.1068239634,0.83,3.46
367.1 ,Myopia,Diseases of the nervous system,29236,89,1.82,0.00000028687438,1.46,2.25
686.0 ,Pyoderma,Diseases of the skin and subcutaneous...,15366,47,1.82,0.0001619258,1.33,2.43
786.50 ,"Chest pain, unspecified","Comorbidities, signs, and ill-defined...",45967,138,1.81,0.0000000003907818,1.51,2.15
216.9 ,"Benign neoplasm of skin, site...",Neoplasms,28130,85,1.81,0.00000078164722,1.44,2.24
924.20 ,Contusion of foot,Injury and poisoning,12546,38,1.8,0.0009490147,1.27,2.48
924.21 ,Contusion of ankle,Injury and poisoning,9531,29,1.8,0.0036232459,1.21,2.6
998.5 ,Postoperative infection,Injury and poisoning,4940,15,1.8,0.034402033,1,2.97
008.6 ,"Virus Enteritis, specified",Infectious and parasitic diseases,2297,7,1.8,0.1198794234,0.72,3.72
306.8 ,Other specified psychophysiological...,Mental disorders,1971,6,1.8,0.1571062603,0.66,3.93
595.9 ,"Cystitis, unspecified",Diseases of the genitourinary...,11226,34,1.8,0.0016716835,1.24,2.52
916 ,"Superficial injury of hip, thigh,...",Injury and poisoning,5908,18,1.8,0.0169477243,1.07,2.86
920 ,"Contusion of face, scalp, and...",Injury and poisoning,34065,102,1.8,0.000000083470457,1.46,2.19
519.8 ,Other diseases of respiratory...,Diseases of the respiratory system,2967,9,1.79,0.1089478353,0.82,3.41
823.80 ,Closed fracture of unspecified...,Injury and poisoning,3305,10,1.79,0.083142542,0.86,3.3
564 ,"Functional digestive disorders,...",Diseases of the digestive system,19599,59,1.79,0.0000498292,1.36,2.32
989.5 ,Toxic effect of venom,Injury and poisoning,6642,20,1.78,0.015450639,1.09,2.76
216.3 ,Benign neoplasm of skin of other...,Neoplasms,5310,16,1.78,0.0279474711,1.02,2.9
531.9 ,"Gastric ulcer, unspecified as...",Diseases of the digestive system,1995,6,1.78,0.1607479953,0.65,3.88
535.5 ,Unspecified gastritis & gastroduodenitis,Diseases of the digestive system,16690,50,1.78,0.0001955748,1.32,2.36
370.21 ,Punctate keratitis,Diseases of the nervous system,31246,93,1.78,0.00000046735423,1.43,2.19
890.0 ,"Open wound of hip and thigh, without...",Injury and poisoning,6313,19,1.78,0.0195913981,1.07,2.79
686.8 ,Other specified local infections...,Diseases of the skin and subcutaneous...,39851,118,1.78,0.000000016028136,1.47,2.14
455.8 ,Unspecified hemorrhoids with other...,Diseases of the circulatory system,9055,27,1.77,0.0064608738,1.16,2.58
476.0 ,Chronic laryngitis,Diseases of the respiratory system,2009,6,1.77,0.1629445465,0.65,3.85
216.7 ,Benign neoplasm of skin of lower...,Neoplasms,2680,8,1.77,0.1004454005,0.76,3.49
821.01 ,Closed fracture of shaft of femur,Injury and poisoning,2669,8,1.77,0.0990809176,0.76,3.5
854.00 ,Intracranial injury of other and...,Injury and poisoning,17512,52,1.77,0.0001922173,1.32,2.32
608.4 ,Other inflammatory disorders of...,Diseases of the genitourinary...,2000,6,1.77,0.1615264339,0.65,3.87
373.13 ,Abscess of eyelid,Diseases of the nervous system,10729,32,1.77,0.0029219134,1.21,2.51
692.70 ,Unspecified dermatitis due to...,Diseases of the skin and subcutaneous...,3025,9,1.76,0.112562421,0.8,3.35
959.5 ,Finger injury,Injury and poisoning,2694,8,1.76,0.1494488722,0.76,3.47
799.8 ,Other ill-defined conditions,"Comorbidities, signs, and ill-defined...",3700,11,1.76,0.0681965916,0.88,3.15
493.9 ,"Asthma, unspecified",Diseases of the respiratory system,7423,22,1.76,0.0148261589,1.1,2.67
570 ,Acute and subacute necrosis of...,Diseases of the digestive system,3032,9,1.76,0.1130408039,0.8,3.34
873.44 ,"Open wound of jaw, without mention...",Injury and poisoning,3017,9,1.76,0.1120267251,0.81,3.36
881.01 ,"Open wound of elbow, without mention...",Injury and poisoning,5706,17,1.76,0.0333075605,1.03,2.83
373.00 ,"Blepharitis, unspecified",Diseases of the nervous system,15496,46,1.76,0.0003743345,1.29,2.36
919.0 ,"Abrasion or friction burn of other,...",Injury and poisoning,30253,89,1.76,0.0000013395117,1.41,2.17
826.0 ,Closed fracture of one or more...,Injury and poisoning,3381,10,1.75,0.0880166352,0.84,3.23
578.9 ,Hemorrhage of gastrointestinal...,Diseases of the digestive system,11192,33,1.75,0.002602155,1.2,2.46
780.2 ,Syncope and collapse,"Comorbidities, signs, and ill-defined...",6139,18,1.74,0.0275339886,1.03,2.75
070 ,Viral hepatitis,Infectious and parasitic diseases,4755,14,1.74,0.0486772854,0.95,2.93
478.8 ,Upper respiratory tract hypersensitivity...,Diseases of the respiratory system,3051,9,1.74,0.1143844252,0.8,3.32
847 ,Sprains and strains of other and...,Injury and poisoning,2036,6,1.74,0.1673274928,0.64,3.8
582.9 ,Chronic glomerulonephritis with...,Diseases of the genitourinary...,5098,15,1.74,0.0388828833,0.97,2.88
919.4 ,"Insect bite, nonvenomous, of other,...",Injury and poisoning,18470,54,1.74,0.0001991725,1.3,2.28
380.15 ,Chronic mycotic otitis externa,Diseases of the nervous system,6464,19,1.74,0.0218221349,1.05,2.73
009 ,Ill-defined intestinal infections,Infectious and parasitic diseases,4440,13,1.73,0.0629856365,0.92,2.97
110.1 ,Dermatophytosis of nail,Infectious and parasitic diseases,22447,65,1.73,0.0000552369,1.33,2.21
850.1 ,Concussion with brief loss of...,Injury and poisoning,2390,7,1.73,0.1331196288,0.69,3.58
379.21 ,Vitreous degeneration,Diseases of the nervous system,3767,11,1.73,0.0726664536,0.86,3.1
786.00 ,"Respiratory abnormality, unspecified","Comorbidities, signs, and ill-defined...",2749,8,1.72,0.1533506966,0.74,3.4
491.9 ,Unspecified chronic bronchitis,Diseases of the respiratory system,20726,60,1.72,0.0001158335,1.31,2.23
246.9 ,Unspecified disorder of thyroid,"Endocrine, nutritional and metabolic...",3432,10,1.72,0.0917483973,0.82,3.18
535 ,Gastritis and duodenitis,Diseases of the digestive system,24235,70,1.72,0.0000279139,1.34,2.18
371.42 ,Recurrent erosion of cornea,Diseases of the nervous system,3435,10,1.72,0.0919792894,0.82,3.17
923.11 ,Contusion of elbow,Injury and poisoning,6910,20,1.71,0.0259015443,1.04,2.65
455.2 ,Internal hemorrhoids with other...,Diseases of the circulatory system,6566,19,1.71,0.0237646229,1.03,2.68
041.8 ,Other specified bacterial infections,Infectious and parasitic diseases,2071,6,1.71,0.1732887077,0.63,3.74
117.9 ,Other and unspecified mycoses,Infectious and parasitic diseases,4507,13,1.71,0.0656829486,0.91,2.93
493.10 ,"Intrinsic asthma, unspecified",Diseases of the respiratory system,2072,6,1.71,0.1734635566,0.63,3.74
289.3 ,"Lymphadenitis, unspecified, except...",Diseases of the blood and blood-forming...,4509,13,1.71,0.0657700304,0.91,2.92
854 ,Intracranial injury of other and...,Injury and poisoning,3450,10,1.71,0.0931525725,0.82,3.16
870.0 ,Laceration of skin of eyelid and...,Injury and poisoning,6926,20,1.71,0.0260985939,1.04,2.65
879.8 ,Open wound(s) (multiple) of unspecified...,Injury and poisoning,26521,76,1.71,0.0000219435,1.34,2.15
708 ,Urticaria,Diseases of the skin and subcutaneous...,9393,27,1.7,0.0109664751,1.12,2.49
465.9 ,Acute upper respiratory infections...,Diseases of the respiratory system,1144064,2269,1.7,1.60483e-38,1.56,1.85
110.4 ,Dermatophytosis of foot,Infectious and parasitic diseases,71483,200,1.7,0.00000000001745322,1.46,1.96
564.5 ,Functional diarrhea,Diseases of the digestive system,22835,65,1.7,0.0000905517,1.3,2.17
693.9 ,Dermatitis due to unspecified...,Diseases of the skin and subcutaneous...,12288,35,1.69,0.0039005944,1.17,2.36
456.4 ,Scrotal varices,Diseases of the circulatory system,6294,18,1.69,0.0309265644,1,2.68
705.1 ,Prickly heat,Diseases of the skin and subcutaneous...,6306,18,1.69,0.0312320482,1,2.68
473.9 ,Unspecified sinusitis (chronic),Diseases of the respiratory system,26763,76,1.69,0.0000243366,1.33,2.13
054.9 ,Herpes simplex without mention...,Infectious and parasitic diseases,16867,48,1.69,0.0009017521,1.24,2.25
070.9 ,Unspecified viral hepatitis without...,Infectious and parasitic diseases,8408,24,1.69,0.0156880449,1.08,2.52
137.0 ,Late effects of respiratory or...,Infectious and parasitic diseases,2104,6,1.69,0.179188067,0.62,3.68
555.2 ,Regional enteritis of small intestine...,Diseases of the digestive system,4196,12,1.69,0.0852578005,0.87,2.96
608.9 ,Unspecified disorder of male genital...,Diseases of the genitourinary...,8065,23,1.69,0.0196056874,1.07,2.54
455.6 ,Unspecified hemorrhoids without...,Diseases of the circulatory system,25958,73,1.68,0.0000498655,1.31,2.12
464.1 ,Acute tracheitis,Diseases of the respiratory system,13772,39,1.68,0.0024128945,1.19,2.3
780.7 ,Malaise and fatigue,"Comorbidities, signs, and ill-defined...",44598,125,1.68,0.00000012796707,1.4,2.01
216.8 ,Benign neoplasm of other specified...,Neoplasms,3876,11,1.68,0.1110630438,0.84,3.01
240.9 ,"Goiter, unspecified","Endocrine, nutritional and metabolic...",2822,8,1.68,0.1595966385,0.72,3.31
577.0 ,Acute pancreatitis,Diseases of the digestive system,3876,11,1.68,0.1110630438,0.84,3.01
388.30 ,"Tinnitus, unspecified",Diseases of the nervous system,12762,36,1.67,0.0045974985,1.17,2.32
472.0 ,Chronic rhinitis,Diseases of the respiratory system,67447,186,1.67,0.0000000003175647,1.43,1.94
345.9 ,"Epilepsy, unspecified",Diseases of the nervous system,2478,7,1.67,0.2099402665,0.67,3.45
599.9 ,Unspecified disorder of urethra...,Diseases of the genitourinary...,7432,21,1.67,0.0232599855,1.03,2.56
692.3 ,Contact dermatitis and other eczema...,Diseases of the skin and subcutaneous...,6367,18,1.67,0.0443660365,0.99,2.65
696.1 ,Other psoriasis,Diseases of the skin and subcutaneous...,5717,16,1.66,0.0512568857,0.94,2.7
698.2 ,Prurigo,Diseases of the skin and subcutaneous...,48826,135,1.66,0.000000072981577,1.39,1.98
472.1 ,Chronic pharyngitis,Diseases of the respiratory system,19347,54,1.66,0.0005602679,1.24,2.17
787.3 ,"Flatulence, eructation, and gas...","Comorbidities, signs, and ill-defined...",28348,79,1.66,0.0000303994,1.31,2.08
884.0 ,Multiple and unspecified open...,Injury and poisoning,69152,189,1.66,0.0000000003897217,1.42,1.92
372.14 ,Other chronic allergic conjunctivitis,Diseases of the nervous system,74155,203,1.66,0.0000000000740843,1.43,1.92
