726.32 ,Lateral epicondylitis,Diseases of the musculoskeletal...,16186,162,1.62,0.00000001555607,1.38,1.9
786.0 ,Dyspnea and respiratory abnormalities,"Comorbidities, signs, and ill-defined...",5414,54,1.61,0.0012650062,1.21,2.11
280.9 ,"Iron deficiency anemia, unspecified",Diseases of the blood and blood-forming...,3615,36,1.61,0.0076844743,1.12,2.23
845 ,Sprains and strains of ankle and...,Injury and poisoning,2500,25,1.61,0.0215712704,1.04,2.39
530.8 ,Other specified disorders of esophagus,Diseases of the digestive system,2998,30,1.61,0.0138733231,1.09,2.31
531 ,Gastric ulcer,Diseases of the digestive system,10943,109,1.61,0.0000042520304,1.32,1.95
564.5 ,Functional diarrhea,Diseases of the digestive system,22078,219,1.61,0.00000000008440095,1.4,1.84
402.00 ,Malignant hypertensive heart disease...,Diseases of the circulatory system,3506,35,1.61,0.0093051852,1.12,2.25
847.2 ,Sprain of lumbar,Injury and poisoning,52665,512,1.6,6.56657e-22,1.46,1.75
715 ,Osteoarthrosis and allied disorders,Diseases of the musculoskeletal...,13643,135,1.6,0.00000043157266,1.34,1.9
372.40 ,"Pterygium, unspecified",Diseases of the nervous system,10204,101,1.6,0.000011918,1.3,1.95
316 ,Psychic factors associated with...,Mental disorders,2942,29,1.59,0.0181380325,1.06,2.29
485 ,"Bronchopneumonia, organism unspecified",Diseases of the respiratory system,6196,61,1.59,0.0008437434,1.21,2.05
870.0 ,Laceration of skin of eyelid and...,Injury and poisoning,4254,42,1.59,0.0044415857,1.15,2.16
370.00 ,"Corneal ulcer, unspecified",Diseases of the nervous system,5476,54,1.59,0.0013707208,1.19,2.08
531.30 ,Acute gastric ulcer without mention...,Diseases of the digestive system,8147,80,1.59,0.0001262275,1.26,1.98
558 ,Other and unspecified noninfectious...,Diseases of the digestive system,11083,109,1.59,0.0000066770142,1.3,1.92
041.8 ,Other specified bacterial infections,Infectious and parasitic diseases,3241,32,1.59,0.0132410576,1.09,2.26
726.31 ,Medial epicondylitis,Diseases of the musculoskeletal...,2643,26,1.59,0.0249439573,1.03,2.33
402.91 ,Unspecified hypertensive heart...,Diseases of the circulatory system,2229,22,1.59,0.0411904318,1,2.42
729.0 ,"Rheumatism, unspecified and fibrositis",Diseases of the musculoskeletal...,7541,74,1.59,0.0002255424,1.24,2
682.0 ,Cellulitis and abscess of face,Diseases of the skin and subcutaneous...,5100,50,1.58,0.0023097845,1.17,2.09
692.3 ,Contact dermatitis and other eczema...,Diseases of the skin and subcutaneous...,7268,71,1.58,0.0003164771,1.23,2
719.4 ,Pain in joint,Diseases of the musculoskeletal...,18293,178,1.58,0.000000020908938,1.35,1.83
008.5 ,"Bacterial enteritis, unspecified",Infectious and parasitic diseases,4712,46,1.58,0.0038283077,1.15,2.11
571.41 ,Chronic persistent hepatitis,Diseases of the digestive system,12399,121,1.58,0.0000031122717,1.31,1.89
389.10 ,"Sensorineural hearing loss, unspecified",Diseases of the nervous system,5605,55,1.58,0.0015388109,1.19,2.07
738.4 ,Acquired spondylolisthesis,Diseases of the musculoskeletal...,3912,38,1.57,0.0104004609,1.11,2.16
597.89 ,Other urethritis,Diseases of the genitourinary...,4111,40,1.57,0.0070485982,1.12,2.14
464 ,Acute laryngitis and tracheitis,Diseases of the respiratory system,36164,348,1.57,0.00000000000001274496,1.41,1.75
296.30 ,"Major depressive affective disorder,...",Mental disorders,2362,23,1.57,0.0357171981,0.99,2.36
465.8 ,Acute upper respiratory infections...,Diseases of the respiratory system,117159,1096,1.57,5.337956e-40,1.47,1.67
477.8 ,Allergic rhinitis due to other...,Diseases of the respiratory system,9386,91,1.57,0.0000721533,1.26,1.93
308.0 ,Predominant disturbance of emotions,Mental disorders,2988,29,1.57,0.0257729977,1.05,2.25
729.2 ,"Neuralgia, neuritis, and radiculitis,...",Diseases of the musculoskeletal...,70040,667,1.57,4.579664e-26,1.45,1.7
274.11 ,Uric acid nephrolithiasis,"Endocrine, nutritional and metabolic...",1960,19,1.56,0.0599343016,0.94,2.45
839.8 ,"Closed dislocation, multiple and...",Injury and poisoning,4643,45,1.56,0.0048181678,1.14,2.1
840.0 ,Acromioclavicular (joint) (ligament)...,Injury and poisoning,2166,21,1.56,0.0533487842,0.97,2.4
373.13 ,Abscess of eyelid,Diseases of the nervous system,6123,59,1.56,0.0014287608,1.18,2.01
788.9 ,Other symptoms involving urinary...,"Comorbidities, signs, and ill-defined...",2604,25,1.55,0.0337176899,1,2.29
692.1 ,Contact dermatitis and other eczema...,Diseases of the skin and subcutaneous...,2292,22,1.55,0.0456787877,0.97,2.35
813.81 ,Closed fracture of unspecified...,Injury and poisoning,2397,23,1.55,0.0492085398,0.98,2.33
345.9 ,"Epilepsy, unspecified",Diseases of the nervous system,2394,23,1.55,0.0490454352,0.98,2.33
919.8 ,Other and unspecified superficial...,Injury and poisoning,2499,24,1.55,0.0403502714,0.99,2.31
719.49 ,"Pain in joint, multiple sites",Diseases of the musculoskeletal...,11467,110,1.55,0.0000168014,1.27,1.87
536.8 ,Dyspepsia and other specified...,Diseases of the digestive system,90672,844,1.55,5.829748e-30,1.44,1.66
726.4 ,Enthesopathy of wrist and carpus,Diseases of the musculoskeletal...,2080,20,1.55,0.0670213181,0.94,2.4
726.5 ,Enthesopathy of hip region,Diseases of the musculoskeletal...,1973,19,1.55,0.0613704276,0.93,2.43
728.89 ,"Other disorders of muscle, ligament,...",Diseases of the musculoskeletal...,12746,122,1.55,0.000007264841,1.28,1.85
303 ,Alcohol dependence syndrome,Mental disorders,2205,21,1.54,0.0565391558,0.95,2.35
715.38 ,"Osteoarthrosis, localized, not...",Diseases of the musculoskeletal...,2618,25,1.54,0.0448051458,0.99,2.28
578 ,Gastrointestinal hemorrhage,Diseases of the digestive system,1781,17,1.54,0.0937205203,0.89,2.47
692.89 ,Contact dermatitis and other eczema...,Diseases of the skin and subcutaneous...,18457,174,1.53,0.0000002043275,1.31,1.78
528 ,"Disease of the oral soft tissues,...",Diseases of the digestive system,2109,20,1.53,0.069352233,0.93,2.37
370.21 ,Punctate keratitis,Diseases of the nervous system,25398,239,1.53,0.0000000014069977,1.34,1.74
719.99 ,"Unspecified disorder of joint,...",Diseases of the musculoskeletal...,4115,39,1.53,0.0125699113,1.08,2.1
727.9 ,"Unspecified disorder of synovium,...",Diseases of the musculoskeletal...,6021,57,1.53,0.0029689895,1.15,1.98
346.1 ,Common migraine,Diseases of the nervous system,3282,31,1.52,0.0254849721,1.03,2.17
844 ,Sprains and strains of knee and...,Injury and poisoning,1804,17,1.52,0.0964381315,0.88,2.44
959.7 ,"Knee, leg, ankle, and foot injury",Injury and poisoning,3596,34,1.52,0.0189684464,1.05,2.14
570 ,Acute and subacute necrosis of...,Diseases of the digestive system,3603,34,1.52,0.0191636476,1.05,2.13
727.00 ,"Synovitis and tenosynovitis, unspecified",Diseases of the musculoskeletal...,101703,928,1.52,3.57079e-30,1.42,1.63
780.52 ,"Insomnia, unspecified","Comorbidities, signs, and ill-defined...",67469,619,1.51,1.024089e-20,1.39,1.64
680.8 ,Carbuncle and furuncle of other...,Diseases of the skin and subcutaneous...,2672,25,1.51,0.0476766618,0.97,2.23
702.8 ,Other specified dermatoses,Diseases of the skin and subcutaneous...,5465,51,1.51,0.0056451192,1.12,1.98
491.0 ,Simple chronic bronchitis,Diseases of the respiratory system,12029,112,1.51,0.0000556002,1.24,1.82
354.0 ,Carpal tunnel syndrome,Diseases of the nervous system,14426,135,1.51,0.0000073356813,1.27,1.8
845.0 ,Sprains and strains of ankle,Injury and poisoning,2880,27,1.51,0.0423105037,0.99,2.21
362.5 ,Degeneration of macula and posterior...,Diseases of the nervous system,2241,21,1.51,0.0779512584,0.93,2.32
719.9 ,Unspecified disorder of joint,Diseases of the musculoskeletal...,2027,19,1.51,0.0870279917,0.91,2.37
216.4 ,Benign neoplasm of scalp and skin...,Neoplasms,2882,27,1.51,0.0424019973,0.99,2.2
475 ,Peritonsillar abscess,Diseases of the respiratory system,9812,91,1.5,0.0002965598,1.2,1.84
478.9 ,Other and unspecified diseases...,Diseases of the respiratory system,12293,114,1.5,0.0000526286,1.23,1.8
715.0 ,"Osteoarthrosis, generalized",Diseases of the musculoskeletal...,2145,20,1.5,0.0731775909,0.92,2.33
528.2 ,Oral aphthae,Diseases of the digestive system,18872,175,1.5,0.00000057602277,1.29,1.75
535.0 ,Acute gastritis,Diseases of the digestive system,34623,318,1.5,0.00000000003609599,1.33,1.67
721.42 ,"Spondylosis with myelopathy, lumbar...",Diseases of the musculoskeletal...,7086,66,1.5,0.001831621,1.16,1.92
573 ,Other disorders of liver,Diseases of the digestive system,2260,21,1.5,0.0793161038,0.92,2.3
781.9 ,Other symptoms involving nervous...,"Comorbidities, signs, and ill-defined...",7603,70,1.49,0.0016408481,1.16,1.88
787.7 ,Abnormal feces,"Comorbidities, signs, and ill-defined...",4749,44,1.49,0.0121430063,1.08,2.01
822.0 ,Closed fracture of patella,Injury and poisoning,2057,19,1.49,0.090363133,0.89,2.33
844.2 ,Sprain of cruciate ligament of...,Injury and poisoning,2380,22,1.49,0.066930348,0.93,2.26
873.43 ,"Open wound of lip, without mention...",Injury and poisoning,2376,22,1.49,0.0665284591,0.93,2.27
372.12 ,Chronic follicular conjunctivitis,Diseases of the nervous system,2821,26,1.49,0.0536924809,0.97,2.18
009.1 ,"Colitis, enteritis, and gastroenteritis...",Infectious and parasitic diseases,18813,173,1.49,0.0000011396543,1.27,1.73
723.8 ,Other syndromes affecting cervical...,Diseases of the musculoskeletal...,2591,24,1.49,0.0591598006,0.95,2.23
724.02 ,"Spinal stenosis, lumbar region,...",Diseases of the musculoskeletal...,8554,79,1.49,0.0008928866,1.18,1.86
250.6 ,Diabetes with neurological manifestations,"Endocrine, nutritional and metabolic...",3818,35,1.48,0.0295363525,1.03,2.06
346.9 ,"Migraine, unspecified",Diseases of the nervous system,14113,129,1.48,0.0000328765,1.23,1.76
844.0 ,Sprain of lateral collateral ligament...,Injury and poisoning,2069,19,1.48,0.0919312928,0.89,2.32
708.0 ,Allergic urticaria,Diseases of the skin and subcutaneous...,38428,349,1.48,0.00000000001472902,1.33,1.65
493.2 ,Chronic obstructive asthma with...,Diseases of the respiratory system,1848,17,1.48,0.10324307,0.86,2.38
386.11 ,Benign paroxysmal positional vertigo,Diseases of the nervous system,5234,48,1.48,0.0103353846,1.09,1.97
388.40 ,"Abnormal auditory perception,...",Diseases of the nervous system,1856,17,1.48,0.1360752861,0.86,2.37
574.50 ,Calculus of bile duct without...,Diseases of the digestive system,1848,17,1.48,0.10324307,0.86,2.38
575.1 ,Other cholecystitis,Diseases of the digestive system,2617,24,1.48,0.0612449206,0.94,2.21
698.8 ,Other specified pruritic conditions,Diseases of the skin and subcutaneous...,9887,90,1.47,0.0006444292,1.18,1.81
701.4 ,Keloid scar,Diseases of the skin and subcutaneous...,4725,43,1.47,0.0157533914,1.06,1.98
842.00 ,"Sprain of wrist, unspecified site",Injury and poisoning,4837,44,1.47,0.0167344399,1.06,1.97
846.0 ,Sprain of lumbosacral (joint)...,Injury and poisoning,2860,26,1.47,0.0563992508,0.95,2.15
531.00 ,"Acute gastric ulcer with hemorrhage,...",Diseases of the digestive system,3624,33,1.47,0.033767653,1.01,2.07
719.41 ,"Pain in joint, shoulder region",Diseases of the musculoskeletal...,11461,104,1.47,0.000263735,1.2,1.78
722.93 ,"Other and unspecified disc disorder,...",Diseases of the musculoskeletal...,9337,85,1.47,0.0009259837,1.17,1.82
727.89 ,"Other disorders of synovium, tendon,...",Diseases of the musculoskeletal...,3188,29,1.47,0.0537689353,0.98,2.11
698.4 ,Dermatitis factitia [artefacta],Diseases of the skin and subcutaneous...,7187,65,1.46,0.0041344564,1.12,1.86
386.10 ,"Peripheral vertigo, unspecified",Diseases of the nervous system,8487,77,1.46,0.0017718015,1.15,1.83
733.0 ,Osteoporosis,Diseases of the musculoskeletal...,3524,32,1.46,0.0404805962,1,2.07
437.0 ,Cerebral atherosclerosis,Diseases of the circulatory system,3439,31,1.45,0.0493651539,0.98,2.07
786.2 ,Cough,"Comorbidities, signs, and ill-defined...",96080,840,1.45,3.870023e-22,1.34,1.55
353.8 ,Other nerve root and plexus disorders,Diseases of the nervous system,1886,17,1.45,0.1394131905,0.84,2.33
511.0 ,Pleurisy without mention of effusion...,Diseases of the respiratory system,2222,20,1.45,0.1034047788,0.88,2.25
715.30 ,"Osteoarthrosis, localized, not...",Diseases of the musculoskeletal...,3567,32,1.45,0.0424059399,0.99,2.05
532.30 ,Acute duodenal ulcer without mention...,Diseases of the digestive system,6916,62,1.45,0.0056776699,1.11,1.86
716.98 ,"Arthropathy, unspecified, other...",Diseases of the musculoskeletal...,3995,36,1.45,0.0334915731,1.02,2.02
374.05 ,Trichiasis of eyelid without entropion,Diseases of the nervous system,10469,94,1.45,0.0007299929,1.17,1.78
726.6 ,Enthesopathy of knee,Diseases of the musculoskeletal...,2113,19,1.45,0.1246947598,0.87,2.27
728.85 ,Spasm of muscle,Diseases of the musculoskeletal...,6004,54,1.45,0.010478986,1.09,1.9
250.70 ,Diabetes with peripheral circulatory...,"Endocrine, nutritional and metabolic...",3696,33,1.44,0.0455796691,0.99,2.03
289.3 ,"Lymphadenitis, unspecified, except...",Diseases of the blood and blood-forming...,3142,28,1.44,0.0676397874,0.95,2.08
786.9 ,Other symptoms involving respiratory...,"Comorbidities, signs, and ill-defined...",2901,26,1.44,0.074452576,0.94,2.12
789.9 ,Other symptoms involving abdomen...,"Comorbidities, signs, and ill-defined...",2467,22,1.44,0.0945238633,0.9,2.18
700 ,Corns and callosities,Diseases of the skin and subcutaneous...,6823,61,1.44,0.0067409474,1.1,1.86
715.36 ,"Osteoarthrosis, localized, not...",Diseases of the musculoskeletal...,17717,158,1.44,0.0000147476,1.22,1.69
723.3 ,Cervicobrachial syndrome (diffuse),Diseases of the musculoskeletal...,5164,46,1.44,0.0206329161,1.05,1.92
386.00 ,"Minihre's disease, unspecified",Diseases of the nervous system,12944,115,1.44,0.000255863,1.18,1.73
780.4 ,Dizziness and giddiness,"Comorbidities, signs, and ill-defined...",158604,1355,1.43,5.201927e-32,1.35,1.52
782.1 ,Rash and other nonspecific skin...,"Comorbidities, signs, and ill-defined...",9148,81,1.43,0.0026116047,1.13,1.78
349 ,Other and unspecified disorders...,Diseases of the nervous system,3151,28,1.43,0.0681590707,0.95,2.07
493.20 ,"Chronic obstructive asthma, unspecified",Diseases of the respiratory system,3499,31,1.43,0.0523552192,0.97,2.03
715.00 ,"Osteoarthrosis, generalized, site...",Diseases of the musculoskeletal...,6557,58,1.43,0.009321802,1.08,1.85
715.15 ,"Osteoarthrosis, localized, primary,...",Diseases of the musculoskeletal...,2246,20,1.43,0.1066137145,0.87,2.22
715.16 ,"Osteoarthrosis, localized, primary,...",Diseases of the musculoskeletal...,10479,93,1.43,0.0011503725,1.15,1.76
873 ,Other open wound of head,Injury and poisoning,5514,49,1.43,0.0159973509,1.06,1.9
716.50 ,Unspecified polyarthropathy or...,Diseases of the musculoskeletal...,2475,22,1.43,0.0954457475,0.9,2.17
719.47 ,"Pain in joint, ankle and foot",Diseases of the musculoskeletal...,11329,100,1.43,0.0007701265,1.16,1.74
372.56 ,Conjunctival deposits,Diseases of the nervous system,2479,22,1.43,0.0959256866,0.89,2.17
605 ,Redundant prepuce and phimosis,Diseases of the genitourinary...,4202,37,1.42,0.0387240542,1,1.96
715.3 ,"Osteoarthrosis, localized, not...",Diseases of the musculoskeletal...,3184,28,1.42,0.0704339189,0.94,2.05
723.1 ,Cervicalgia,Diseases of the musculoskeletal...,32950,289,1.42,0.000000020827016,1.26,1.6
571.49 ,Other chronic hepatitis,Diseases of the digestive system,17844,157,1.42,0.0000302939,1.21,1.67
573.3 ,"Hepatitis, unspecified",Diseases of the digestive system,28478,250,1.42,0.00000017866899,1.25,1.62
727.05 ,Other tenosynovitis of hand and...,Diseases of the musculoskeletal...,5101,45,1.42,0.0251715056,1.04,1.91
215.0 ,Other benign neoplasm of connective...,Neoplasms,4212,37,1.42,0.0391484239,0.99,1.96
583 ,"Nephritis and nephropathy, not...",Diseases of the genitourinary...,3056,27,1.42,0.0822803525,0.94,2.08
595.0 ,Acute cystitis,Diseases of the genitourinary...,26072,229,1.42,0.00000053847109,1.24,1.62
601.0 ,Acute prostatitis,Diseases of the genitourinary...,2279,20,1.41,0.1396294298,0.86,2.19
789.0 ,Abdominal pain,"Comorbidities, signs, and ill-defined...",231347,1917,1.41,4.442109e-39,1.34,1.49
713.8 ,Arthropathy associated with other...,Diseases of the musculoskeletal...,2278,20,1.41,0.1395316583,0.86,2.19
537.89 ,Other specified disorders of stomach...,Diseases of the digestive system,2289,20,1.41,0.1406648354,0.86,2.18
009.2 ,Infectious diarrhea,Infectious and parasitic diseases,23156,202,1.41,0.0000042569102,1.22,1.63
564 ,"Functional digestive disorders,...",Diseases of the digestive system,27686,241,1.41,0.00000051826354,1.24,1.6
724.3 ,Sciatica,Diseases of the musculoskeletal...,62098,535,1.41,0.0000000000002351071,1.29,1.54
726 ,Peripheral enthesopathies and...,Diseases of the musculoskeletal...,3426,30,1.41,0.0640508383,0.95,2.02
386.12 ,Vestibular neuronitis,Diseases of the nervous system,7642,67,1.41,0.006841798,1.09,1.8
242.9 ,Thyrotoxicosis w/m of goiter or...,"Endocrine, nutritional and metabolic...",3329,29,1.4,0.0763445724,0.94,2.02
785.0 ,"Tachycardia, unspecified","Comorbidities, signs, and ill-defined...",2412,21,1.4,0.1195915316,0.87,2.15
786.1 ,Stridor,"Comorbidities, signs, and ill-defined...",2761,24,1.4,0.1131793576,0.9,2.09
788.0 ,Renal colic,"Comorbidities, signs, and ill-defined...",20769,180,1.4,0.0000194045,1.2,1.63
790.4 ,Nonspecific elevation of levels...,"Comorbidities, signs, and ill-defined...",1951,17,1.4,0.1504623468,0.82,2.25
303.90 ,Other and unspecified alcohol...,Mental disorders,5527,48,1.4,0.0254526938,1.03,1.86
307.81 ,Tension headache,Mental disorders,22666,196,1.4,0.0000093415197,1.21,1.61
487.8 ,Influenza with other manifestations,Diseases of the respiratory system,24321,210,1.4,0.0000049069089,1.21,1.6
706.8 ,Other specified diseases of sebaceous...,Diseases of the skin and subcutaneous...,3002,26,1.4,0.1020186937,0.91,2.05
910 ,"Superficial injury of face, neck,...",Injury and poisoning,2416,21,1.4,0.1201699675,0.86,2.15
922.9 ,Contusion of unspecified part...,Injury and poisoning,8188,71,1.4,0.0072583924,1.09,1.77
531.70 ,Chronic gastric ulcer without...,Diseases of the digestive system,9460,82,1.4,0.003834234,1.11,1.74
532.00 ,"Acute duodenal ulcer with hemorrhage,...",Diseases of the digestive system,2983,26,1.4,0.1007344132,0.92,2.06
924.5 ,Contusion of unspecified part...,Injury and poisoning,7513,65,1.4,0.0099408271,1.07,1.78
721.9 ,Spondylosis of unspecified site,Diseases of the musculoskeletal...,2531,22,1.4,0.1266967941,0.88,2.13
558.2 ,Toxic gastroenteritis and colitis,Diseases of the digestive system,2642,23,1.4,0.106774482,0.89,2.11
722.90 ,"Other and unspecified disc disorder,...",Diseases of the musculoskeletal...,3456,30,1.4,0.0815474551,0.94,2
571.1 ,Acute alcoholic hepatitis,Diseases of the digestive system,4245,37,1.4,0.0495849114,0.99,1.94
726.2 ,"Other affections of shoulder region,...",Diseases of the musculoskeletal...,2870,25,1.4,0.0952568901,0.91,2.08
389.1 ,Sensorineural hearing loss,Diseases of the nervous system,2414,21,1.4,0.1198789663,0.87,2.15
216.8 ,Benign neoplasm of other specified...,Neoplasms,3810,33,1.4,0.0625796832,0.96,1.96
780.50 ,"Sleep disturbance, unspecified","Comorbidities, signs, and ill-defined...",23334,201,1.39,0.0000102231,1.21,1.6
706.0 ,Acne varioliformis,Diseases of the skin and subcutaneous...,4281,37,1.39,0.0509321373,0.98,1.92
491.21 ,Obstructive chronic bronchitis...,Diseases of the respiratory system,4743,41,1.39,0.0412334937,1,1.89
715.98 ,"Osteoarthrosis, unspecified whether...",Diseases of the musculoskeletal...,3018,26,1.39,0.1032950789,0.9,2.04
535.00 ,"Acute gastritis, without mention...",Diseases of the digestive system,153468,1276,1.39,1.385503e-25,1.31,1.47
388.2 ,"Sudden hearing loss, unspecified",Diseases of the nervous system,2426,21,1.39,0.1524587369,0.86,2.14
729.4 ,"Fasciitis, unspecified",Diseases of the musculoskeletal...,84043,712,1.39,6.288619e-16,1.29,1.5
229.9 ,Benign neoplasm of unspecified...,Neoplasms,2772,24,1.39,0.1141205934,0.89,2.08
680.9 ,Carbuncle and furuncle of unspecified...,Diseases of the skin and subcutaneous...,32514,277,1.38,0.00000048264807,1.22,1.56
300.0 ,Anxiety states,Mental disorders,27746,237,1.38,0.0000025310621,1.21,1.58
706.2 ,Sebaceous cyst,Diseases of the skin and subcutaneous...,10030,86,1.38,0.0040853905,1.1,1.71
523.0 ,Acute gingivitis,Diseases of the digestive system,7705,66,1.38,0.0132670847,1.07,1.76
716.60 ,"Unspecified monoarthritis, site...",Diseases of the musculoskeletal...,2451,21,1.38,0.1547103693,0.85,2.11
680.0 ,Carbuncle and furuncle of face,Diseases of the skin and subcutaneous...,5536,47,1.37,0.0392910505,1,1.82
464.2 ,Acute larygotracheitis,Diseases of the respiratory system,7902,67,1.37,0.0145164976,1.06,1.74
842.01 ,Sprain of carpal (joint) of wrist,Injury and poisoning,2108,18,1.37,0.165825271,0.81,2.18
555.9 ,Regional enteritis of unspecified...,Diseases of the digestive system,12129,103,1.37,0.0025203351,1.12,1.67
571.0 ,Alcoholic fatty liver,Diseases of the digestive system,6332,54,1.37,0.024613146,1.03,1.8
724.9 ,Other unspecified back disorders,Diseases of the musculoskeletal...,14041,119,1.37,0.0011927541,1.13,1.64
386.19 ,Other peripheral vertigo,Diseases of the nervous system,2704,23,1.37,0.1399490173,0.87,2.06
216.3 ,Benign neoplasm of skin of other...,Neoplasms,4949,42,1.37,0.046388844,0.98,1.85
250.4 ,Diabetes with renal manifestations,"Endocrine, nutritional and metabolic...",2370,20,1.36,0.1882119269,0.83,2.1
780.7 ,Malaise and fatigue,"Comorbidities, signs, and ill-defined...",60040,501,1.36,0.0000000001440645,1.24,1.49
464.1 ,Acute tracheitis,Diseases of the respiratory system,15470,130,1.36,0.0009867432,1.13,1.61
683 ,Acute lymphadenitis,Diseases of the skin and subcutaneous...,3200,27,1.36,0.1143475085,0.89,1.98
490 ,"Bronchitis, not specified as acute...",Diseases of the respiratory system,46346,388,1.36,0.000000013932973,1.23,1.51
355.0 ,Lesion of sciatic nerve,Diseases of the nervous system,3198,27,1.36,0.1141559163,0.89,1.98
916 ,"Superficial injury of hip, thigh,...",Injury and poisoning,2614,22,1.36,0.1684056875,0.85,2.06
921.3 ,Contusion of eyeball,Injury and poisoning,3669,31,1.36,0.0918365651,0.92,1.94
372.30 ,"Conjunctivitis, unspecified",Diseases of the nervous system,131806,1080,1.36,1.027831e-19,1.27,1.45
571.3 ,"Alcoholic liver damage, unspecified",Diseases of the digestive system,8785,74,1.36,0.0116628282,1.06,1.71
729.9 ,Other and unspecified disorders...,Diseases of the musculoskeletal...,6411,54,1.36,0.0312089522,1.02,1.77
429.3 ,Cardiomegaly,Diseases of the circulatory system,2385,20,1.35,0.1898951872,0.82,2.09
784.0 ,Headache,"Comorbidities, signs, and ill-defined...",193570,1559,1.35,8.176568e-26,1.28,1.43
464.30 ,Acute epiglottitis without mention...,Diseases of the respiratory system,4782,40,1.35,0.0650236802,0.96,1.84
847.0 ,Sprain of neck,Injury and poisoning,24872,208,1.35,0.0000393752,1.17,1.55
530 ,Diseases of esophagus,Diseases of the digestive system,1914,16,1.35,0.241290394,0.77,2.19
370.40 ,"Keratoconjunctivitis, unspecified",Diseases of the nervous system,5149,43,1.35,0.0614823102,0.97,1.82
533.30 ,Acute peptic ulcer of unspecified...,Diseases of the digestive system,10036,84,1.35,0.0088835828,1.07,1.67
533.50 ,Chronic or unspecified peptic...,Diseases of the digestive system,3339,28,1.35,0.1214681609,0.9,1.96
719.88 ,"Other specified disorders of joint,...",Diseases of the musculoskeletal...,2627,22,1.35,0.169768111,0.84,2.05
550.90 ,"Inguinal hernia, without mention...",Diseases of the digestive system,5853,49,1.35,0.044996266,1,1.79
722.71 ,Intervertebral disc disorder with...,Diseases of the musculoskeletal...,2738,23,1.35,0.1440037946,0.86,2.03
723.0 ,Spinal stenosis in cervical region,Diseases of the musculoskeletal...,5476,46,1.35,0.0471664275,0.99,1.81
386.1 ,Other and unspecified peripheral...,Diseases of the nervous system,5366,45,1.35,0.0548999793,0.98,1.81
785.1 ,Palpitations,"Comorbidities, signs, and ill-defined...",26886,223,1.34,0.0000330086,1.17,1.53
786.5 ,Chest pain,"Comorbidities, signs, and ill-defined...",31767,262,1.34,0.0000091545578,1.18,1.51
691.8 ,Other atopic dermatitis and related...,Diseases of the skin and subcutaneous...,29763,247,1.34,0.0000110971,1.18,1.53
721.90 ,"Spondylosis of unspecified site,...",Diseases of the musculoskeletal...,15698,130,1.34,0.001549458,1.11,1.59
724.2 ,Lumbago,Diseases of the musculoskeletal...,220095,1748,1.34,1.765741e-26,1.27,1.41
099.9 ,"Venereal disease, unspecified",Infectious and parasitic diseases,1929,16,1.34,0.2438821874,0.76,2.17
573.8 ,Other specified disorders of liver,Diseases of the digestive system,5395,45,1.34,0.0557218846,0.98,1.8
577.0 ,Acute pancreatitis,Diseases of the digestive system,8522,71,1.34,0.0185616319,1.05,1.7
215 ,Other benign neoplasm of connective...,Neoplasms,2161,18,1.34,0.2154561844,0.79,2.13
250.9 ,Diabetes with unspecified complication,"Endocrine, nutritional and metabolic...",5444,45,1.33,0.0689351997,0.97,1.79
443.9 ,"Peripheral vascular disease, unspecified",Diseases of the circulatory system,6420,53,1.33,0.0462191915,0.99,1.74
680 ,Carbuncle and furuncle,Diseases of the skin and subcutaneous...,3510,29,1.33,0.1312104131,0.89,1.92
455.5 ,External hemorrhoids with other...,Diseases of the circulatory system,3386,28,1.33,0.1258966038,0.88,1.93
786.00 ,"Respiratory abnormality, unspecified","Comorbidities, signs, and ill-defined...",3874,32,1.33,0.1233442389,0.91,1.88
692.8 ,"Contact dermatitis and other eczema,...",Diseases of the skin and subcutaneous...,3996,33,1.33,0.1063289653,0.91,1.87
310.2 ,Postconcussion syndrome,Mental disorders,2787,23,1.33,0.1826218534,0.84,2
478.4 ,Polyp of vocal cord or larynx,Diseases of the respiratory system,3864,32,1.33,0.1228622754,0.91,1.89
840.9 ,Sprains and strains of unspecified...,Injury and poisoning,16639,137,1.33,0.0014944166,1.11,1.57
362.6 ,Peripheral retinal degeneration,Diseases of the nervous system,1942,16,1.33,0.2463855314,0.76,2.16
