038.9 ,Unspecified septicemia,Infectious and parasitic diseases,4057,48,2.14,0.000002492264,1.57,2.84
840.9 ,Sprains and strains of unspecified...,Injury and poisoning,12366,146,2.14,4.559843e-16,1.81,2.53
578.1 ,Blood in stool,Diseases of the digestive system,3387,40,2.13,0.0000226656,1.52,2.91
989.5 ,Toxic effect of venom,Injury and poisoning,5680,67,2.13,0.000000033500341,1.65,2.71
823 ,Fracture of tibia and fibula,Injury and poisoning,2114,25,2.13,0.0006191062,1.38,3.16
682.8 ,Cellulitis and abscess of other...,Diseases of the skin and subcutaneous...,7550,89,2.13,0.0000000002086646,1.71,2.63
715.00 ,"Osteoarthrosis, generalized, site...",Diseases of the musculoskeletal...,3974,47,2.13,0.0000032504012,1.56,2.85
716.99 ,"Arthropathy, unspecified, multiple...",Diseases of the musculoskeletal...,2450,29,2.13,0.00031614,1.43,3.07
307.81 ,Tension headache,Mental disorders,19841,232,2.13,3.096525e-24,1.86,2.43
555.0 ,Regional enteritis of small intestine,Diseases of the digestive system,3392,40,2.13,0.0000229867,1.52,2.91
733.42 ,Aseptic necrosis of head and neck...,Diseases of the musculoskeletal...,4077,48,2.12,0.000004106705,1.56,2.83
786.50 ,"Chest pain, unspecified","Comorbidities, signs, and ill-defined...",51375,584,2.11,1.076997e-55,1.94,2.3
729.5 ,Pain in limb,Diseases of the musculoskeletal...,13509,157,2.11,1.1831e-16,1.79,2.47
276.5 ,Volume depletion,"Endocrine, nutritional and metabolic...",7592,88,2.1,0.0000000006223952,1.68,2.59
533.30 ,Acute peptic ulcer of unspecified...,Diseases of the digestive system,8115,94,2.1,0.0000000001902146,1.69,2.57
533.50 ,Chronic or unspecified peptic...,Diseases of the digestive system,2667,31,2.1,0.0002083308,1.42,2.98
780.8 ,Generalized hyperhidrosis,"Comorbidities, signs, and ill-defined...",3089,36,2.1,0.0000816132,1.47,2.92
005.9 ,"Food poisoning, unspecified",Infectious and parasitic diseases,2152,25,2.09,0.0007519402,1.35,3.1
353.2 ,"Cervical root lesions, not elsewhere...",Diseases of the nervous system,6319,73,2.09,0.000000023280051,1.63,2.63
353.4 ,"Lumbosacral root lesions, not...",Diseases of the nervous system,4145,48,2.09,0.0000050213931,1.54,2.78
702.8 ,Other specified dermatoses,Diseases of the skin and subcutaneous...,4764,55,2.08,0.0000012282089,1.57,2.72
716.98 ,"Arthropathy, unspecified, other...",Diseases of the musculoskeletal...,2862,33,2.08,0.0001379103,1.43,2.93
883.1 ,"Open wound of finger(s), complicated",Injury and poisoning,11483,132,2.08,0.00000000000008711732,1.74,2.48
927.20 ,Crushing injury of hand(s),Injury and poisoning,3226,37,2.07,0.0000717089,1.45,2.86
842.09 ,Other sprains and strains of wrist,Injury and poisoning,4088,47,2.07,0.0000073116325,1.52,2.77
719.41 ,"Pain in joint, shoulder region",Diseases of the musculoskeletal...,7149,82,2.07,0.0000000038744993,1.65,2.58
386.1 ,Other and unspecified peripheral...,Diseases of the nervous system,3583,41,2.06,0.0000398805,1.48,2.81
945.00 ,Burn of unspecified degree of...,Injury and poisoning,2360,27,2.06,0.0007162966,1.35,3.01
349.9 ,Unspecified disorders of nervous...,Diseases of the nervous system,11188,127,2.06,0.0000000000004985546,1.71,2.45
535.10 ,"Atrophic gastritis, without mention...",Diseases of the digestive system,2450,28,2.06,0.0005519219,1.36,2.99
845.10 ,"Sprain of foot, unspecified site",Injury and poisoning,3968,45,2.05,0.0000151707,1.49,2.74
848.8 ,Other specified sites of sprains...,Injury and poisoning,7777,88,2.05,0.0000000025805044,1.64,2.53
300.01 ,Panic disorder without agoraphobia,Mental disorders,3436,39,2.05,0.0000503255,1.45,2.81
719.48 ,"Pain in joint, other specified...",Diseases of the musculoskeletal...,4039,46,2.05,0.0000110202,1.5,2.75
354.2 ,Lesion of ulnar nerve,Diseases of the nervous system,2025,23,2.05,0.0023404056,1.29,3.08
780 ,General symptoms,"Comorbidities, signs, and ill-defined...",3788,43,2.05,0.0000248918,1.48,2.77
780.5 ,Sleep disturbance,"Comorbidities, signs, and ill-defined...",18004,203,2.05,1.235862e-19,1.77,2.36
788.1 ,Dysuria,"Comorbidities, signs, and ill-defined...",4872,55,2.04,0.0000026993162,1.53,2.66
216.4 ,Benign neoplasm of scalp and skin...,Neoplasms,2650,30,2.04,0.0003690013,1.37,2.92
893.1 ,"Open wound of toe(s), complicated",Injury and poisoning,2204,25,2.04,0.001325782,1.32,3.03
785.1 ,Palpitations,"Comorbidities, signs, and ill-defined...",19584,218,2.03,2.717746e-20,1.76,2.32
715.35 ,"Osteoarthrosis, localized, not...",Diseases of the musculoskeletal...,2392,27,2.03,0.0008067471,1.34,2.97
300.9 ,Unspecified nonpsychotic mental...,Mental disorders,30326,336,2.03,2.374606e-30,1.81,2.26
724.02 ,"Spinal stenosis, lumbar region,...",Diseases of the musculoskeletal...,4702,53,2.03,0.0000031620893,1.52,2.67
011.90 ,"Pulmonary tuberculosis, unspecified,...",Infectious and parasitic diseases,4564,51,2.02,0.0000060444916,1.5,2.66
840.8 ,Sprains and strains of other specified...,Injury and poisoning,2675,30,2.02,0.0005895523,1.36,2.89
728.9 ,"Unspecified disorder of muscle,...",Diseases of the musculoskeletal...,21961,243,2.02,3.427221e-22,1.77,2.29
843.9 ,Sprains and strains of unspecified...,Injury and poisoning,4853,54,2.01,0.0000042439454,1.5,2.63
723.8 ,Other syndromes affecting cervical...,Diseases of the musculoskeletal...,2074,23,2,0.0026535692,1.26,3.01
351.0 ,Bell's palsy,Diseases of the nervous system,4328,48,2,0.0000140938,1.47,2.66
726.2 ,"Other affections of shoulder region,...",Diseases of the musculoskeletal...,1894,21,2,0.0046264931,1.23,3.06
558.2 ,Toxic gastroenteritis and colitis,Diseases of the digestive system,3153,35,2,0.0001819527,1.39,2.79
738.4 ,Acquired spondylolisthesis,Diseases of the musculoskeletal...,2159,24,2,0.0020015995,1.28,2.99
959.5 ,Finger injury,Injury and poisoning,2080,23,1.99,0.002703788,1.26,3
389.9 ,Unspecified hearing loss,Diseases of the nervous system,7337,81,1.99,0.00000002593892,1.58,2.48
038 ,Septicemia,Infectious and parasitic diseases,1901,21,1.99,0.0046992397,1.23,3.05
386.11 ,Benign paroxysmal positional vertigo,Diseases of the nervous system,3275,36,1.98,0.000218997,1.38,2.75
413.9 ,Other and unspecified angina pectoris,Diseases of the circulatory system,11160,122,1.98,0.00000000001382626,1.64,2.37
715.16 ,"Osteoarthrosis, localized, primary,...",Diseases of the musculoskeletal...,4637,51,1.98,0.0000106944,1.47,2.61
719.49 ,"Pain in joint, multiple sites",Diseases of the musculoskeletal...,8781,96,1.98,0.0000000025082652,1.6,2.42
728.85 ,Spasm of muscle,Diseases of the musculoskeletal...,5461,60,1.98,0.0000017140725,1.51,2.56
588.9 ,Unspecified disorder resulting...,Diseases of the genitourinary...,3109,34,1.97,0.0003865796,1.36,2.76
935.1 ,Foreign body in esophagus,Injury and poisoning,2102,23,1.97,0.0029113576,1.25,2.97
280.9 ,"Iron deficiency anemia, unspecified",Diseases of the blood and blood-forming...,2924,32,1.97,0.0004409974,1.35,2.79
719.46 ,"Pain in joint, lower leg",Diseases of the musculoskeletal...,10534,115,1.97,0.00000000007789293,1.63,2.38
532.30 ,Acute duodenal ulcer without mention...,Diseases of the digestive system,5417,59,1.96,0.0000025914788,1.49,2.54
726.4 ,Enthesopathy of wrist and carpus,Diseases of the musculoskeletal...,2297,25,1.96,0.0018808577,1.26,2.9
556 ,Idiopathic proctocolitis,Diseases of the digestive system,3485,38,1.96,0.0001471866,1.39,2.7
571.9 ,Unspecified chronic liver disease...,Diseases of the digestive system,21303,229,1.96,1.784819e-19,1.71,2.23
840.4 ,Rotator cuff (capsule) sprain,Injury and poisoning,2214,24,1.95,0.0024666457,1.25,2.91
719.45 ,"Pain in joint, pelvic region and...",Diseases of the musculoskeletal...,2776,30,1.95,0.0008110641,1.31,2.79
729.2 ,"Neuralgia, neuritis, and radiculitis,...",Diseases of the musculoskeletal...,51011,539,1.95,1.320506e-42,1.79,2.13
571.0 ,Alcoholic fatty liver,Diseases of the digestive system,5024,54,1.94,0.0000103626,1.45,2.54
786.09 ,Other respiratory abnormalities,"Comorbidities, signs, and ill-defined...",8057,86,1.93,0.000000048176731,1.54,2.39
782.2 ,"Localized superficial swelling,...","Comorbidities, signs, and ill-defined...",2437,26,1.92,0.002375233,1.25,2.82
721.0 ,Cervical spondylosis without myelopathy,Diseases of the musculoskeletal...,16755,177,1.92,0.00000000000001020635,1.64,2.23
295 ,Schizophrenic disorders,Mental disorders,5854,62,1.91,0.0000038788369,1.46,2.45
558.1 ,Gastroenteritis and colitis due...,Diseases of the digestive system,1977,21,1.91,0.0059013038,1.18,2.93
570 ,Acute and subacute necrosis of...,Diseases of the digestive system,3775,40,1.91,0.0001779948,1.36,2.61
353.1 ,Lumbosacral plexus lesions,Diseases of the nervous system,2002,21,1.89,0.0064735344,1.17,2.9
354.0 ,Carpal tunnel syndrome,Diseases of the nervous system,8712,91,1.89,0.000000047160745,1.52,2.32
573.9 ,Unspecified disorder of liver,Diseases of the digestive system,11276,118,1.89,0.0000000005217512,1.56,2.27
599.9 ,Unspecified disorder of urethra...,Diseases of the genitourinary...,9523,99,1.88,0.00000001676074,1.52,2.29
133.0 ,Scabies,Infectious and parasitic diseases,7565,79,1.88,0.0000003772654,1.49,2.35
590.10 ,Acute pyelonephritis without lesion...,Diseases of the genitourinary...,3460,36,1.87,0.0005395671,1.31,2.6
723.9 ,Unspecified musculoskeletal disorders...,Diseases of the musculoskeletal...,2118,22,1.87,0.0076124423,1.17,2.84
682.0 ,Cellulitis and abscess of face,Diseases of the skin and subcutaneous...,5245,54,1.86,0.0000367057,1.39,2.43
250.9 ,Diabetes with unspecified complication,"Endocrine, nutritional and metabolic...",1931,20,1.86,0.0088933361,1.14,2.89
727.9 ,"Unspecified disorder of synovium,...",Diseases of the musculoskeletal...,4939,51,1.86,0.0000505506,1.38,2.45
882 ,Open wound of hand except finger(s)...,Injury and poisoning,5539,57,1.85,0.0000268281,1.4,2.41
893.0 ,"Open wound of toe(s), without...",Injury and poisoning,9373,96,1.85,0.000000045761257,1.49,2.26
372.9 ,Unspecified disorder of conjunctiva,Diseases of the nervous system,3011,31,1.85,0.0019316556,1.26,2.64
848.0 ,Sprain of septal cartilage of...,Injury and poisoning,1952,20,1.84,0.0135090986,1.12,2.86
720.9 ,Unspecified inflammatory spondylopathy,Diseases of the musculoskeletal...,2146,22,1.84,0.0081208892,1.15,2.8
723.1 ,Cervicalgia,Diseases of the musculoskeletal...,25665,260,1.84,8.671984e-19,1.62,2.09
356.9 ,Unspecified hereditary and idiopathic...,Diseases of the nervous system,6283,64,1.84,0.0000088071742,1.41,2.35
726.10 ,Disorders of bursae and tendons...,Diseases of the musculoskeletal...,6874,70,1.84,0.0000045068185,1.43,2.33
681.00 ,"Cellulitis and abscess of finger,...",Diseases of the skin and subcutaneous...,2958,30,1.83,0.0026796763,1.23,2.61
455.5 ,External hemorrhoids with other...,Diseases of the circulatory system,3341,34,1.83,0.0010596319,1.27,2.57
715.36 ,"Osteoarthrosis, localized, not...",Diseases of the musculoskeletal...,8408,85,1.82,0.00000048211564,1.45,2.26
371.9 ,Unspecified corneal disorder,Diseases of the nervous system,1873,19,1.82,0.0181259653,1.1,2.86
845.0 ,Sprains and strains of ankle,Injury and poisoning,3601,36,1.8,0.0010783388,1.26,2.5
949.0 ,"Burn of unspecified site, unspecified...",Injury and poisoning,7674,76,1.79,0.0000035685081,1.4,2.24
250.90 ,"Diabetes with unspecified complication,...","Endocrine, nutritional and metabolic...",8959,89,1.79,0.00000052829518,1.44,2.21
724.8 ,Other symptoms referable to back,Diseases of the musculoskeletal...,2214,22,1.79,0.0099185935,1.12,2.71
727.05 ,Other tenosynovitis of hand and...,Diseases of the musculoskeletal...,4435,44,1.79,0.0003762669,1.29,2.4
401.0 ,Malignant essential hypertension,Diseases of the circulatory system,2024,20,1.78,0.0157696075,1.08,2.75
482.9 ,"Bacterial pneumonia, unspecified",Diseases of the respiratory system,3943,39,1.78,0.0008387664,1.26,2.44
493.91 ,"Asthma, unspecified type, with...",Diseases of the respiratory system,3235,32,1.78,0.0028225286,1.21,2.52
786.51 ,Precordial pain,"Comorbidities, signs, and ill-defined...",5606,55,1.77,0.0001010204,1.33,2.31
943.00 ,Burn of unspecified degree of...,Injury and poisoning,2333,23,1.77,0.0112388894,1.12,2.67
680.2 ,Carbuncle and furuncle of trunk,Diseases of the skin and subcutaneous...,2128,21,1.77,0.0128009203,1.1,2.72
041.8 ,Other specified bacterial infections,Infectious and parasitic diseases,2850,28,1.77,0.0051669143,1.17,2.56
718.40 ,"Contracture of joint, site unspecified",Diseases of the musculoskeletal...,3043,30,1.77,0.0033005346,1.19,2.54
530.2 ,Ulcer of esophagus,Diseases of the digestive system,6420,63,1.77,0.0000340037,1.36,2.27
357.4 ,Polyneuropathy in other diseases...,Diseases of the nervous system,3150,31,1.77,0.0036674881,1.2,2.52
682.9 ,Cellulitis and abscess of unspecified...,Diseases of the skin and subcutaneous...,59910,573,1.76,9.886347e-34,1.62,1.92
715.96 ,"Osteoarthrosis, unspecified whether...",Diseases of the musculoskeletal...,3169,31,1.76,0.0037882442,1.19,2.5
532.90 ,"Duodenal ulcer, unspecified as...",Diseases of the digestive system,22819,221,1.76,0.00000000000002888944,1.53,2.01
428.0 ,"Congestive heart failure, unspecified",Diseases of the circulatory system,2668,26,1.75,0.0084940848,1.14,2.58
455.0 ,Internal hemorrhoids without mention...,Diseases of the circulatory system,8989,87,1.75,0.000002362894,1.4,2.16
721.90 ,"Spondylosis of unspecified site,...",Diseases of the musculoskeletal...,8982,87,1.75,0.0000017397915,1.4,2.16
491.20 ,Obstructive chronic bronchitis...,Diseases of the respiratory system,4025,39,1.74,0.0013478893,1.24,2.39
300.02 ,Generalized anxiety disorder,Mental disorders,9199,89,1.74,0.0000015498743,1.4,2.15
300.3 ,Obsessive-compulsive disorders,Mental disorders,1967,19,1.74,0.022117585,1.04,2.72
724.4 ,Thoracic or lumbosacral neuritis...,Diseases of the musculoskeletal...,6411,62,1.74,0.0000690603,1.33,2.24
729.1 ,"Myalgia and myositis, unspecified",Diseases of the musculoskeletal...,136853,1255,1.74,2.146905e-65,1.64,1.85
927.3 ,Crushing injury of finger(s),Injury and poisoning,10615,102,1.73,0.00000040359975,1.41,2.11
250.60 ,"Diabetes with neurological manifestations,...","Endocrine, nutritional and metabolic...",2490,24,1.73,0.0142434814,1.11,2.59
496 ,"Chronic airway obstruction, not...",Diseases of the respiratory system,10715,103,1.73,0.00000032602597,1.41,2.11
531.9 ,"Gastric ulcer, unspecified as...",Diseases of the digestive system,3978,38,1.72,0.0018703643,1.21,2.36
382.3 ,Unspecified chronic suppurative...,Diseases of the nervous system,4008,38,1.71,0.0020103529,1.2,2.35
681.02 ,Onychia and paronychia of finger,Diseases of the skin and subcutaneous...,3790,36,1.71,0.0029486486,1.19,2.37
842.00 ,"Sprain of wrist, unspecified site",Injury and poisoning,5379,51,1.71,0.0004471048,1.27,2.25
723.2 ,Cervicocranial syndrome,Diseases of the musculoskeletal...,2425,23,1.71,0.0189964478,1.08,2.57
729.9 ,Other and unspecified disorders...,Diseases of the musculoskeletal...,5567,53,1.71,0.0002856542,1.28,2.25
923.2 ,"Contusion of wrist and hand(s),...",Injury and poisoning,1897,18,1.71,0.0298603852,1.01,2.7
427.9 ,"Cardiac dysrhythmia, unspecified",Diseases of the circulatory system,19414,182,1.7,0.00000000006914558,1.46,1.97
845.09 ,Other sprains and strains of ankle,Injury and poisoning,8468,80,1.7,0.0000140099,1.35,2.12
847.2 ,Sprain of lumbar,Injury and poisoning,47972,445,1.7,8.242296e-24,1.54,1.87
715.90 ,"Osteoarthrosis, unspecified whether...",Diseases of the musculoskeletal...,25655,240,1.7,0.00000000000008197226,1.49,1.93
519.8 ,Other diseases of respiratory...,Diseases of the respiratory system,2954,28,1.7,0.0087638749,1.13,2.47
729.4 ,"Fasciitis, unspecified",Diseases of the musculoskeletal...,72066,663,1.7,3.280281e-34,1.57,1.84
533.40 ,Chronic or unspecified peptic...,Diseases of the digestive system,6942,65,1.69,0.0000974635,1.3,2.15
571.41 ,Chronic persistent hepatitis,Diseases of the digestive system,11282,106,1.69,0.00000065000034,1.38,2.05
799.9 ,Other unknown and unspecified...,"Comorbidities, signs, and ill-defined...",2347,22,1.68,0.0248645676,1.05,2.56
845.00 ,"Sprain of ankle, unspecified site",Injury and poisoning,13954,130,1.68,0.00000005130886,1.4,2
716.90 ,"Arthropathy, unspecified, site...",Diseases of the musculoskeletal...,32210,298,1.68,3.407291e-16,1.49,1.89
569.3 ,Hemorrhage of rectum and anus,Diseases of the digestive system,6548,61,1.68,0.0001727521,1.28,2.16
573.3 ,"Hepatitis, unspecified",Diseases of the digestive system,28311,262,1.68,0.00000000000002151097,1.48,1.9
788.4 ,Frequency of urination and polyuria,"Comorbidities, signs, and ill-defined...",14340,133,1.67,0.000000055057281,1.4,1.99
306.9 ,Unspecified psychophysiological...,Mental disorders,13627,126,1.67,0.00000012865532,1.39,1.99
414.9 ,"Chronic ischemic heart disease,...",Diseases of the circulatory system,15440,142,1.66,0.000000026982659,1.4,1.96
533.70 ,Chronic peptic ulcer of unspecified...,Diseases of the digestive system,13767,127,1.66,0.00000014739944,1.39,1.99
571.49 ,Other chronic hepatitis,Diseases of the digestive system,15767,145,1.66,0.00000001998085,1.4,1.96
786.0 ,Dyspnea and respiratory abnormalities,"Comorbidities, signs, and ill-defined...",4250,39,1.65,0.0036394383,1.17,2.26
680.6 ,"Carbuncle and furuncle of leg,...",Diseases of the skin and subcutaneous...,2178,20,1.65,0.0304305811,1.01,2.56
455.9 ,Residual hemorrhoidal skin tags,Diseases of the circulatory system,3164,29,1.65,0.0115074901,1.1,2.37
724.3 ,Sciatica,Diseases of the musculoskeletal...,47627,431,1.65,3.061057e-21,1.5,1.82
099.9 ,"Venereal disease, unspecified",Infectious and parasitic diseases,3169,29,1.64,0.0116090333,1.1,2.37
719.4 ,Pain in joint,Diseases of the musculoskeletal...,13342,121,1.64,0.00000062462195,1.35,1.96
529.0 ,Glossitis,Diseases of the digestive system,2527,23,1.64,0.0229096752,1.03,2.46
533.90 ,"Peptic ulcer of unspecified site,...",Diseases of the digestive system,85935,761,1.64,3.315061e-34,1.52,1.77
537.89 ,Other specified disorders of stomach...,Diseases of the digestive system,1966,18,1.64,0.0464461836,0.97,2.61
555.2 ,Regional enteritis of small intestine...,Diseases of the digestive system,4835,44,1.64,0.002541826,1.19,2.2
995.3 ,"Allergy, unspecified, not elsewhere...",Injury and poisoning,13702,124,1.63,0.00000048496465,1.36,1.95
402.10 ,Benign hypertensive heart disease...,Diseases of the circulatory system,5298,48,1.63,0.0015889978,1.2,2.17
629.9 ,Unspecified disorder of female...,Diseases of the genitourinary...,2429,22,1.63,0.0284132847,1.02,2.47
684 ,Impetigo,Diseases of the skin and subcutaneous...,3970,36,1.63,0.0054345861,1.14,2.26
523.0 ,Acute gingivitis,Diseases of the digestive system,5977,54,1.63,0.0008891407,1.22,2.13
682.5 ,Cellulitis and abscess of buttock,Diseases of the skin and subcutaneous...,2001,18,1.62,0.0494154705,0.96,2.56
214.1 ,Lipoma of other skin and subcutaneous...,Neoplasms,2765,25,1.62,0.0207546616,1.05,2.41
519.9 ,Unspecified disease of respiratory...,Diseases of the respiratory system,5317,48,1.62,0.0016405277,1.19,2.16
719.40 ,"Pain in joint, site unspecified",Diseases of the musculoskeletal...,49277,438,1.62,3.280295e-20,1.47,1.79
355.0 ,Lesion of sciatic nerve,Diseases of the nervous system,2219,20,1.62,0.043656358,0.99,2.51
786.1 ,Stridor,"Comorbidities, signs, and ill-defined...",2225,20,1.61,0.0440049415,0.98,2.5
596.5 ,Other functional disorders of...,Diseases of the genitourinary...,6699,60,1.61,0.0005344839,1.23,2.08
692.70 ,Unspecified dermatitis due to...,Diseases of the skin and subcutaneous...,2677,24,1.61,0.0262755453,1.03,2.4
216.8 ,Benign neoplasm of other specified...,Neoplasms,3673,33,1.61,0.0101879109,1.11,2.27
491.0 ,Simple chronic bronchitis,Diseases of the respiratory system,9178,82,1.61,0.0000590055,1.28,2
722.10 ,Displacement of lumbar intervertebral...,Diseases of the musculoskeletal...,26391,235,1.61,0.00000000001702921,1.41,1.84
564.8 ,Other specified function disorder...,Diseases of the digestive system,21178,189,1.61,0.0000000013897221,1.39,1.87
848.9 ,Unspecified site of sprain and...,Injury and poisoning,99915,861,1.6,7.43675e-35,1.49,1.72
719.47 ,"Pain in joint, ankle and foot",Diseases of the musculoskeletal...,9334,83,1.6,0.0000666536,1.27,1.99
883.2 ,"Open wound of finger(s), with...",Injury and poisoning,4606,41,1.6,0.0052400107,1.15,2.18
788.9 ,Other symptoms involving urinary...,"Comorbidities, signs, and ill-defined...",2711,24,1.59,0.0279764916,1.02,2.37
443.9 ,"Peripheral vascular disease, unspecified",Diseases of the circulatory system,3167,28,1.59,0.0222148224,1.05,2.3
717.9 ,Unspecified internal derangement...,Diseases of the musculoskeletal...,3277,29,1.59,0.0181503407,1.06,2.29
533.0 ,"Peptic ulcer, site unspecified...",Diseases of the digestive system,1915,17,1.59,0.0633874274,0.93,2.56
590.9 ,"Infection of kidney, unspecified",Diseases of the genitourinary...,2394,21,1.58,0.0523332002,0.97,2.42
789.0 ,Abdominal pain,"Comorbidities, signs, and ill-defined...",243108,1982,1.58,4.025371e-67,1.5,1.66
388.30 ,"Tinnitus, unspecified",Diseases of the nervous system,19605,172,1.58,0.000000025988815,1.35,1.84
401.1 ,Benign essential hypertension,Diseases of the circulatory system,13015,114,1.58,0.0000065477176,1.3,1.9
289.3 ,"Lymphadenitis, unspecified, except...",Diseases of the blood and blood-forming...,3874,34,1.58,0.0124568677,1.09,2.21
300.0 ,Anxiety states,Mental disorders,22134,193,1.58,0.0000000054377406,1.36,1.82
535.40 ,"Other specified gastritis, without...",Diseases of the digestive system,25015,218,1.58,0.0000000006443644,1.37,1.8
358.9 ,"Myoneural disorders, unspecified",Diseases of the nervous system,2162,19,1.58,0.0580998574,0.95,2.47
535.01 ,"Acute gastritis, with hemorrhage",Diseases of the digestive system,3433,30,1.57,0.0208573146,1.06,2.25
110.0 ,Dermatophytosis of scalp and beard,Infectious and parasitic diseases,2415,21,1.56,0.0535285428,0.96,2.39
719.99 ,"Unspecified disorder of joint,...",Diseases of the musculoskeletal...,2887,25,1.56,0.0329579025,1,2.3
722.2 ,Displacement of intervertebral...,Diseases of the musculoskeletal...,15731,136,1.56,0.000001568279,1.31,1.85
535.00 ,"Acute gastritis, without mention...",Diseases of the digestive system,151659,1260,1.56,2.892528e-44,1.47,1.66
726.19 ,Other specified disorders of bursae...,Diseases of the musculoskeletal...,3921,34,1.56,0.0133500536,1.08,2.18
367.89 ,Other disorders of refraction...,Diseases of the nervous system,4148,36,1.56,0.0118051496,1.09,2.16
009.3 ,Diarrhea of presumed infectious...,Infectious and parasitic diseases,13241,114,1.55,0.000013611,1.28,1.87
724.2 ,Lumbago,Diseases of the musculoskeletal...,182388,1489,1.55,6.567446e-49,1.46,1.64
362.41 ,Central serous retinopathy,Diseases of the nervous system,3589,31,1.55,0.0183793898,1.05,2.21
367.9 ,Unspecified disorder of refraction...,Diseases of the nervous system,14986,129,1.55,0.0000034627277,1.29,1.85
564.0 ,Constipation,Diseases of the digestive system,46251,393,1.55,0.000000000000002181912,1.39,1.71
379.99 ,Other ill-defined disorders of...,Diseases of the nervous system,2909,25,1.54,0.0446040764,1,2.28
787.3 ,"Flatulence, eructation, and gas...","Comorbidities, signs, and ill-defined...",38293,324,1.54,0.000000000001269819,1.37,1.72
008.5 ,"Bacterial enteritis, unspecified",Infectious and parasitic diseases,5026,43,1.54,0.0076638984,1.11,2.08
455.1 ,Internal thrombosed hemorrhoids,Diseases of the circulatory system,2093,18,1.54,0.0757444487,0.91,2.45
250.00 ,Diabetes mellitus without mention...,"Endocrine, nutritional and metabolic...",36858,313,1.54,0.000000000001775545,1.37,1.73
250.40 ,"Diabetes with renal manifestations,...","Endocrine, nutritional and metabolic...",2338,20,1.54,0.0685089617,0.94,2.38
721.3 ,Lumbosacral spondylosis without...,Diseases of the musculoskeletal...,31840,271,1.54,0.00000000004525883,1.36,1.74
532.70 ,Chronic duodenal ulcer without...,Diseases of the digestive system,12044,103,1.54,0.0000476708,1.25,1.87
727.01 ,Synovitis and tenosynovitis in...,Diseases of the musculoskeletal...,2448,21,1.54,0.0558896996,0.95,2.36
783.2 ,Abnormal loss of weight,"Comorbidities, signs, and ill-defined...",4449,38,1.53,0.0115730364,1.08,2.11
591 ,Hydronephrosis,Diseases of the genitourinary...,13813,117,1.53,0.0000206617,1.26,1.83
478.9 ,Other and unspecified diseases...,Diseases of the respiratory system,14125,120,1.53,0.0000152144,1.27,1.83
715.98 ,"Osteoarthrosis, unspecified whether...",Diseases of the musculoskeletal...,1872,16,1.53,0.0874325376,0.87,2.5
493.00 ,"Extrinsic asthma, unspecified",Diseases of the respiratory system,4585,39,1.53,0.012599839,1.08,2.09
719.90 ,"Unspecified disorder of joint,...",Diseases of the musculoskeletal...,2236,19,1.53,0.0853607006,0.92,2.39
785.6 ,Enlargement of lymph nodes,"Comorbidities, signs, and ill-defined...",3554,30,1.52,0.0311734248,1.02,2.17
388.3 ,Tinitus,Diseases of the nervous system,7225,61,1.52,0.0019906747,1.16,1.95
346 ,Migraine,Diseases of the nervous system,2836,24,1.52,0.0565520955,0.97,2.27
536.8 ,Dyspepsia and other specified...,Diseases of the digestive system,84681,698,1.52,2.308895e-23,1.4,1.64
692.1 ,Contact dermatitis and other eczema...,Diseases of the skin and subcutaneous...,2256,19,1.51,0.0869154899,0.91,2.37
486 ,"Pneumonia, organism unspecified",Diseases of the respiratory system,23424,196,1.51,0.000000083827555,1.3,1.74
491.1 ,Mucopurulent chronic bronchitis,Diseases of the respiratory system,4869,41,1.51,0.0119003072,1.08,2.06
285.9 ,"Anemia, unspecified",Diseases of the blood and blood-forming...,12185,102,1.51,0.0001143946,1.23,1.83
530.1 ,Esophagitis,Diseases of the digestive system,33123,277,1.51,0.0000000001709958,1.34,1.71
555.1 ,Regional enteritis of large intestine,Diseases of the digestive system,3446,29,1.51,0.0380745524,1.01,2.18
574.20 ,Calculus of gallbladder without...,Diseases of the digestive system,10509,88,1.51,0.0002939304,1.21,1.86
