535.40 ,"Other specified gastritis, without...",Diseases of the digestive system,27329,194,1.85,0.00000000000001316059,1.6,2.14
723.2 ,Cervicocranial syndrome,Diseases of the musculoskeletal...,2930,21,1.85,0.0103757483,1.14,2.83
295.32 ,"Paranoid type schizophrenia, chronic",Mental disorders,2232,16,1.85,0.0244032795,1.05,3.01
533.30 ,Acute peptic ulcer of unspecified...,Diseases of the digestive system,10036,71,1.83,0.0000037762184,1.42,2.31
493.21 ,Chronic obstructive asthma with...,Diseases of the respiratory system,2124,15,1.82,0.0332045118,1.01,3.01
721.42 ,"Spondylosis with myelopathy, lumbar...",Diseases of the musculoskeletal...,7086,50,1.82,0.0001125996,1.35,2.41
727.05 ,Other tenosynovitis of hand and...,Diseases of the musculoskeletal...,5101,36,1.82,0.0009706066,1.27,2.52
360.89 ,Other disorders of globe,Diseases of the nervous system,3292,23,1.8,0.0106201025,1.14,2.71
715.30 ,"Osteoarthrosis, localized, not...",Diseases of the musculoskeletal...,3567,25,1.8,0.00642942,1.17,2.67
386.00 ,"Minihre's disease, unspecified",Diseases of the nervous system,12944,90,1.8,0.00000039862133,1.44,2.22
727.09 ,Other synovitis and tenosynovitis,Diseases of the musculoskeletal...,6882,48,1.8,0.0001987335,1.32,2.39
692.1 ,Contact dermatitis and other eczema...,Diseases of the skin and subcutaneous...,2292,16,1.8,0.0270841345,1.02,2.93
722.73 ,Intervertebral disc disorder with...,Diseases of the musculoskeletal...,6353,44,1.79,0.0003765753,1.29,2.4
719.47 ,"Pain in joint, ankle and foot",Diseases of the musculoskeletal...,11329,78,1.78,0.0000032968573,1.4,2.23
366.1 ,Senile cataract,Diseases of the nervous system,2761,19,1.77,0.0201124407,1.06,2.77
786.1 ,Stridor,"Comorbidities, signs, and ill-defined...",2761,19,1.77,0.0201124407,1.06,2.77
840.4 ,Rotator cuff (capsule) sprain,Injury and poisoning,3053,21,1.77,0.0129697983,1.09,2.71
491.2 ,Obstructive chronic bronchitis,Diseases of the respiratory system,3213,22,1.76,0.0146103589,1.1,2.68
354.2 ,Lesion of ulnar nerve,Diseases of the nervous system,2638,18,1.76,0.026345063,1.04,2.78
491.8 ,Other chronic bronchitis,Diseases of the respiratory system,5262,36,1.76,0.0017239603,1.23,2.45
716.68 ,"Unspecified monoarthritis, other...",Diseases of the musculoskeletal...,2043,14,1.76,0.0468699864,0.96,2.97
721.1 ,Cervical spondylosis with myelopathy,Diseases of the musculoskeletal...,10691,73,1.76,0.0000109464,1.38,2.22
434 ,Occlusion of cerebral arteries,Diseases of the circulatory system,2052,14,1.76,0.0475205882,0.96,2.95
436 ,"Acute, but ill-defined, cerebrovascular...",Diseases of the circulatory system,6886,47,1.76,0.0004281185,1.29,2.35
995.3 ,"Allergy, unspecified, not elsewhere...",Injury and poisoning,13315,90,1.75,0.0000012272375,1.4,2.15
555.1 ,Regional enteritis of large intestine,Diseases of the digestive system,3550,24,1.74,0.010070397,1.11,2.6
780.6 ,Fever,"Comorbidities, signs, and ill-defined...",67112,440,1.74,5.644419e-25,1.57,1.92
353.1 ,Lumbosacral plexus lesions,Diseases of the nervous system,2386,16,1.73,0.0451712189,0.98,2.81
844.2 ,Sprain of cruciate ligament of...,Injury and poisoning,2380,16,1.73,0.044909205,0.99,2.82
578 ,Gastrointestinal hemorrhage,Diseases of the digestive system,1781,12,1.73,0.0811573461,0.89,3.04
785.1 ,Palpitations,"Comorbidities, signs, and ill-defined...",26886,179,1.73,0.00000000002762246,1.48,2.01
349.9 ,Unspecified disorders of nervous...,Diseases of the nervous system,16111,107,1.72,0.00000030807801,1.41,2.08
842.01 ,Sprain of carpal (joint) of wrist,Injury and poisoning,2108,14,1.71,0.0523040975,0.93,2.87
571.49 ,Other chronic hepatitis,Diseases of the digestive system,17844,118,1.71,0.000000088515037,1.41,2.06
786.59 ,Other chest pain,"Comorbidities, signs, and ill-defined...",17465,115,1.71,0.00000017476553,1.4,2.05
844.8 ,Sprains and strains of other specified...,Injury and poisoning,2441,16,1.69,0.0481519791,0.96,2.75
443.9 ,"Peripheral vascular disease, unspecified",Diseases of the circulatory system,6420,42,1.69,0.0017138458,1.21,2.28
362.9 ,Unspecified retinal disorder,Diseases of the nervous system,1842,12,1.68,0.0872636305,0.86,2.94
786.9 ,Other symptoms involving respiratory...,"Comorbidities, signs, and ill-defined...",2901,19,1.68,0.034467966,1.01,2.64
493.91 ,"Asthma, unspecified type, with...",Diseases of the respiratory system,3844,25,1.67,0.0184238875,1.08,2.48
715.38 ,"Osteoarthrosis, localized, not...",Diseases of the musculoskeletal...,2618,17,1.67,0.0403325126,0.97,2.68
372.40 ,"Pterygium, unspecified",Diseases of the nervous system,10204,66,1.67,0.0001186086,1.29,2.13
727.06 ,Tenosynovitis of foot and ankle,Diseases of the musculoskeletal...,3864,25,1.67,0.0187133035,1.08,2.46
307.81 ,Tension headache,Mental disorders,22666,146,1.67,0.000000014333376,1.41,1.97
698.8 ,Other specified pruritic conditions,Diseases of the skin and subcutaneous...,9887,64,1.67,0.0001337028,1.28,2.14
786.00 ,"Respiratory abnormality, unspecified","Comorbidities, signs, and ill-defined...",3874,25,1.66,0.0188759645,1.07,2.46
307.40 ,"Nonorganic sleep disorder, unspecified",Mental disorders,4664,30,1.66,0.0091719997,1.11,2.37
478.9 ,Other and unspecified diseases...,Diseases of the respiratory system,12293,79,1.66,0.0000312939,1.31,2.07
491.1 ,Mucopurulent chronic bronchitis,Diseases of the respiratory system,6546,42,1.65,0.0026518054,1.19,2.24
959.7 ,"Knee, leg, ankle, and foot injury",Injury and poisoning,3596,23,1.65,0.022115825,1.04,2.48
573.9 ,Unspecified disorder of liver,Diseases of the digestive system,14122,90,1.65,0.0000126951,1.32,2.03
691.8 ,Other atopic dermatitis and related...,Diseases of the skin and subcutaneous...,29763,189,1.65,0.0000000003411718,1.42,1.91
349.89 ,Other specified disorders of nervous...,Diseases of the nervous system,3899,25,1.65,0.0193352735,1.07,2.44
919.1 ,"Abrasion or friction burn of other,...",Injury and poisoning,2356,15,1.64,0.0658954872,0.91,2.71
989.5 ,Toxic effect of venom,Injury and poisoning,5195,33,1.64,0.0072651945,1.12,2.3
379.99 ,Other ill-defined disorders of...,Diseases of the nervous system,3614,23,1.64,0.0227440191,1.04,2.46
564.8 ,Other specified function disorder...,Diseases of the digestive system,22328,141,1.64,0.000000074581286,1.37,1.94
726.1 ,"Rotator cuff syndrome of shoulder,...",Diseases of the musculoskeletal...,3141,20,1.64,0.042443359,1,2.54
476.0 ,Chronic laryngitis,Diseases of the respiratory system,3445,22,1.64,0.0271880992,1.03,2.49
842.09 ,Other sprains and strains of wrist,Injury and poisoning,3636,23,1.63,0.0312752032,1.03,2.45
358.9 ,"Myoneural disorders, unspecified",Diseases of the nervous system,2991,19,1.63,0.0387009357,0.98,2.56
530.2 ,Ulcer of esophagus,Diseases of the digestive system,7126,45,1.63,0.0021856077,1.18,2.18
531.00 ,"Acute gastric ulcer with hemorrhage,...",Diseases of the digestive system,3624,23,1.63,0.031025165,1.03,2.46
555.2 ,Regional enteritis of small intestine...,Diseases of the digestive system,3954,25,1.63,0.0206133838,1.05,2.41
038 ,Septicemia,Infectious and parasitic diseases,2214,14,1.63,0.0836823083,0.89,2.74
786.51 ,Precordial pain,"Comorbidities, signs, and ill-defined...",6494,41,1.63,0.003587305,1.16,2.21
787.7 ,Abnormal feces,"Comorbidities, signs, and ill-defined...",4749,30,1.63,0.0134841063,1.09,2.33
571.41 ,Chronic persistent hepatitis,Diseases of the digestive system,12399,78,1.62,0.0000850324,1.28,2.03
588.9 ,Unspecified disorder resulting...,Diseases of the genitourinary...,4122,26,1.62,0.022973803,1.06,2.38
729.2 ,"Neuralgia, neuritis, and radiculitis,...",Diseases of the musculoskeletal...,70040,431,1.62,1.239069e-19,1.47,1.79
787.9 ,Other symptoms involving digestive...,"Comorbidities, signs, and ill-defined...",9540,60,1.62,0.0004995184,1.23,2.09
841.9 ,Sprains and strains of unspecified...,Injury and poisoning,6094,38,1.61,0.0069771423,1.13,2.21
531.30 ,Acute gastric ulcer without mention...,Diseases of the digestive system,8147,51,1.61,0.0016883239,1.2,2.13
716.98 ,"Arthropathy, unspecified, other...",Diseases of the musculoskeletal...,3995,25,1.61,0.0218095579,1.04,2.38
571 ,Chronic liver disease and cirrhosis,Diseases of the digestive system,13505,84,1.61,0.0000537157,1.28,1.99
239.9 ,"Neoplasm of unspecified nature,...",Neoplasms,1913,12,1.61,0.0972696816,0.83,2.83
680.2 ,Carbuncle and furuncle of trunk,Diseases of the skin and subcutaneous...,1913,12,1.61,0.0972696816,0.83,2.83
786.09 ,Other respiratory abnormalities,"Comorbidities, signs, and ill-defined...",9749,61,1.61,0.000570096,1.23,2.08
682.9 ,Cellulitis and abscess of unspecified...,Diseases of the skin and subcutaneous...,57464,352,1.61,6.422622e-16,1.44,1.79
684 ,Impetigo,Diseases of the skin and subcutaneous...,3673,23,1.61,0.0322102156,1.02,2.42
353.2 ,"Cervical root lesions, not elsewhere...",Diseases of the nervous system,10620,66,1.6,0.0004051256,1.24,2.04
370.00 ,"Corneal ulcer, unspecified",Diseases of the nervous system,5476,34,1.6,0.011820566,1.1,2.24
401.0 ,Malignant essential hypertension,Diseases of the circulatory system,5790,36,1.6,0.0078729049,1.12,2.22
478 ,Other diseases of upper respiratory...,Diseases of the respiratory system,3694,23,1.6,0.032851419,1.01,2.41
478.4 ,Polyp of vocal cord or larynx,Diseases of the respiratory system,3864,24,1.6,0.0273062951,1.02,2.38
780.4 ,Dizziness and giddiness,"Comorbidities, signs, and ill-defined...",158604,929,1.59,3.709587e-35,1.48,1.71
682.2 ,Cellulitis and abscess of trunk,Diseases of the skin and subcutaneous...,2423,15,1.59,0.0727766676,0.89,2.63
300.4 ,Dysthymic disorder,Mental disorders,29326,180,1.59,0.0000000090548306,1.37,1.85
715.36 ,"Osteoarthrosis, localized, not...",Diseases of the musculoskeletal...,17717,108,1.58,0.0000116804,1.29,1.91
715.96 ,"Osteoarthrosis, unspecified whether...",Diseases of the musculoskeletal...,7481,46,1.58,0.0037142393,1.16,2.12
370.49 ,Other keratoconjunctivitis,Diseases of the nervous system,4724,29,1.58,0.0187785901,1.06,2.27
536.8 ,Dyspepsia and other specified...,Diseases of the digestive system,90672,540,1.58,1.515281e-21,1.44,1.73
427.89 ,Other specified cardiac dysrhythmias,Diseases of the circulatory system,6014,37,1.58,0.0090483246,1.11,2.19
784.0 ,Headache,"Comorbidities, signs, and ill-defined...",193570,1115,1.58,7.194904e-40,1.48,1.69
788.9 ,Other symptoms involving urinary...,"Comorbidities, signs, and ill-defined...",2604,16,1.58,0.0801158922,0.9,2.57
523.0 ,Acute gingivitis,Diseases of the digestive system,7705,47,1.57,0.0042599122,1.15,2.09
715.37 ,"Osteoarthrosis, localized, not...",Diseases of the musculoskeletal...,1959,12,1.57,0.1407784889,0.81,2.76
537.89 ,Other specified disorders of stomach...,Diseases of the digestive system,2289,14,1.57,0.0919690969,0.86,2.65
564.5 ,Functional diarrhea,Diseases of the digestive system,22078,134,1.57,0.0000012030813,1.31,1.87
780.7 ,Malaise and fatigue,"Comorbidities, signs, and ill-defined...",60040,360,1.57,0.000000000000005736151,1.41,1.75
883 ,Open wound of finger(s),Injury and poisoning,7533,46,1.57,0.0038819224,1.15,2.1
532.70 ,Chronic duodenal ulcer without...,Diseases of the digestive system,15389,93,1.56,0.0000679983,1.26,1.92
558.2 ,Toxic gastroenteritis and colitis,Diseases of the digestive system,2642,16,1.56,0.0834461311,0.89,2.53
722.90 ,"Other and unspecified disc disorder,...",Diseases of the musculoskeletal...,3456,21,1.56,0.0534757072,0.97,2.39
564.0 ,Constipation,Diseases of the digestive system,57894,344,1.56,0.00000000000008084395,1.39,1.74
569.9 ,Unspecified disorder of intestine,Diseases of the digestive system,5429,33,1.56,0.0156655704,1.07,2.2
724.4 ,Thoracic or lumbosacral neuritis...,Diseases of the musculoskeletal...,8078,49,1.56,0.0030670667,1.15,2.07
726.5 ,Enthesopathy of hip region,Diseases of the musculoskeletal...,1973,12,1.56,0.142320724,0.81,2.74
145.9 ,"Malignant neoplasm of mouth, unspecified",Neoplasms,2300,14,1.56,0.0934225688,0.85,2.63
428.9 ,"Heart failure, unspecified",Diseases of the circulatory system,3962,24,1.56,0.039518519,1,2.32
843.9 ,Sprains and strains of unspecified...,Injury and poisoning,6124,37,1.55,0.010097318,1.09,2.15
533.40 ,Chronic or unspecified peptic...,Diseases of the digestive system,8331,50,1.55,0.0035271048,1.14,2.04
719.4 ,Pain in joint,Diseases of the musculoskeletal...,18293,110,1.55,0.0000163034,1.27,1.88
930.0 ,Corneal foreign body,Injury and poisoning,102178,597,1.55,5.514451e-22,1.43,1.69
726.60 ,"Enthesopathy of knee, unspecified",Diseases of the musculoskeletal...,2326,14,1.55,0.1292160796,0.84,2.6
274.10 ,"Gouty nephropathy, unspecified","Endocrine, nutritional and metabolic...",2155,13,1.55,0.1167255745,0.82,2.66
840.9 ,Sprains and strains of unspecified...,Injury and poisoning,16639,99,1.54,0.000075954,1.25,1.88
719 ,Other and unspecified disorders...,Diseases of the musculoskeletal...,2168,13,1.54,0.1186079076,0.82,2.64
533.50 ,Chronic or unspecified peptic...,Diseases of the digestive system,3339,20,1.54,0.0681087192,0.94,2.38
533.70 ,Chronic peptic ulcer of unspecified...,Diseases of the digestive system,17479,104,1.54,0.0000412656,1.25,1.87
560.9 ,Unspecified intestinal obstruction,Diseases of the digestive system,4184,25,1.54,0.0450842955,0.99,2.27
723.3 ,Cervicobrachial syndrome (diffuse),Diseases of the musculoskeletal...,5164,31,1.54,0.0242370795,1.05,2.2
411.89 ,Other acute and subacute forms...,Diseases of the circulatory system,3002,18,1.54,0.076149501,0.91,2.44
847.0 ,Sprain of neck,Injury and poisoning,24872,147,1.53,0.0000017007447,1.29,1.8
715.3 ,"Osteoarthrosis, localized, not...",Diseases of the musculoskeletal...,3184,19,1.53,0.0642761452,0.92,2.4
009.3 ,Diarrhea of presumed infectious...,Infectious and parasitic diseases,10803,64,1.53,0.0014345467,1.17,1.95
070.31 ,Viral hepatitis B without mention...,Infectious and parasitic diseases,2186,13,1.53,0.1213786195,0.81,2.62
574.50 ,Calculus of bile duct without...,Diseases of the digestive system,1848,11,1.53,0.1845467577,0.76,2.75
214.1 ,Lipoma of other skin and subcutaneous...,Neoplasms,3016,18,1.53,0.0772118635,0.91,2.43
715.11 ,"Osteoarthrosis, localized, primary,...",Diseases of the musculoskeletal...,1858,11,1.52,0.1858131798,0.76,2.73
716.99 ,"Arthropathy, unspecified, multiple...",Diseases of the musculoskeletal...,3385,20,1.52,0.07069835,0.93,2.35
216.4 ,Benign neoplasm of scalp and skin...,Neoplasms,2882,17,1.52,0.0969161085,0.88,2.43
728.89 ,"Other disorders of muscle, ligament,...",Diseases of the musculoskeletal...,12746,75,1.52,0.000755126,1.19,1.91
300.02 ,Generalized anxiety disorder,Mental disorders,11511,68,1.52,0.001185852,1.18,1.93
847 ,Sprains and strains of other and...,Injury and poisoning,2379,14,1.51,0.1341700339,0.83,2.54
918.1 ,Superficial injury of cornea,Injury and poisoning,30016,175,1.51,0.00000040562707,1.29,1.76
531 ,Gastric ulcer,Diseases of the digestive system,10943,64,1.51,0.0019983441,1.16,1.93
784.7 ,Epistaxis,"Comorbidities, signs, and ill-defined...",15587,91,1.51,0.0002816282,1.21,1.85
698 ,Pruritus and related conditions,Diseases of the skin and subcutaneous...,4078,24,1.51,0.0571035599,0.97,2.26
353.8 ,Other nerve root and plexus disorders,Diseases of the nervous system,1886,11,1.5,0.1898128932,0.75,2.69
716.10 ,"Traumatic arthropathy, site unspecified",Diseases of the musculoskeletal...,4106,24,1.5,0.0580893622,0.96,2.24
719.99 ,"Unspecified disorder of joint,...",Diseases of the musculoskeletal...,4115,24,1.5,0.0584452853,0.96,2.24
722.0 ,Displacement of cervical intervertebral...,Diseases of the musculoskeletal...,11180,65,1.5,0.0022203267,1.15,1.91
574.00 ,Calculus of gallbladder with acute...,Diseases of the digestive system,2737,16,1.5,0.1208766345,0.86,2.45
402.91 ,Unspecified hypertensive heart...,Diseases of the circulatory system,2229,13,1.5,0.1683442803,0.8,2.57
216.7 ,Benign neoplasm of skin of lower...,Neoplasms,2394,14,1.5,0.1358793182,0.82,2.53
733.00 ,"Osteoporosis, unspecified",Diseases of the musculoskeletal...,8053,47,1.5,0.0089650503,1.1,2
780.9 ,Other general symptoms,"Comorbidities, signs, and ill-defined...",11478,67,1.5,0.0015535039,1.16,1.91
840 ,Sprains and strains of shoulder...,Injury and poisoning,2740,16,1.5,0.1211198968,0.86,2.44
531.9 ,"Gastric ulcer, unspecified as...",Diseases of the digestive system,5707,33,1.49,0.0322412419,1.02,2.09
532.30 ,Acute duodenal ulcer without mention...,Diseases of the digestive system,6916,40,1.49,0.0154626368,1.06,2.03
719.00 ,"Effusion of joint, site unspecified",Diseases of the musculoskeletal...,2590,15,1.49,0.1511944852,0.83,2.46
385.32 ,Cholesteatoma of middle ear,Diseases of the nervous system,2587,15,1.49,0.1509806532,0.83,2.46
726.19 ,Other specified disorders of bursae...,Diseases of the musculoskeletal...,6900,40,1.49,0.015241619,1.06,2.04
783.2 ,Abnormal loss of weight,"Comorbidities, signs, and ill-defined...",5689,33,1.49,0.0319673377,1.03,2.1
295 ,Schizophrenic disorders,Mental disorders,3980,23,1.49,0.0723689379,0.94,2.23
296 ,Disorganized type,Mental disorders,3107,18,1.49,0.1095952035,0.88,2.36
354.0 ,Carpal tunnel syndrome,Diseases of the nervous system,14426,83,1.48,0.0007569994,1.18,1.84
719.41 ,"Pain in joint, shoulder region",Diseases of the musculoskeletal...,11461,66,1.48,0.0025261204,1.15,1.89
724.3 ,Sciatica,Diseases of the musculoskeletal...,62098,352,1.48,0.00000000001167077,1.33,1.65
573 ,Other disorders of liver,Diseases of the digestive system,2260,13,1.48,0.1717801919,0.79,2.53
726.4 ,Enthesopathy of wrist and carpus,Diseases of the musculoskeletal...,2080,12,1.48,0.1587606989,0.76,2.6
401.1 ,Benign essential hypertension,Diseases of the circulatory system,37485,214,1.48,0.000000092381612,1.29,1.7
729.9 ,Other and unspecified disorders...,Diseases of the musculoskeletal...,6411,37,1.48,0.0205950203,1.04,2.05
437.9 ,Unspecified cerebrovascular disease,Diseases of the circulatory system,6613,38,1.48,0.0222683629,1.04,2.03
799.3 ,"Debility, unspecified","Comorbidities, signs, and ill-defined...",1903,11,1.48,0.1925604909,0.74,2.67
844.9 ,Sprains and strains of unspecified...,Injury and poisoning,13538,77,1.47,0.0017582718,1.15,1.84
523.9 ,Unspecified gingival and periodontal...,Diseases of the digestive system,7355,42,1.47,0.0184677654,1.06,1.99
720.1 ,Spinal enthesopathy,Diseases of the musculoskeletal...,3843,22,1.47,0.0895142914,0.92,2.23
723.4 ,"Brachial neuritis or radiculitis,...",Diseases of the musculoskeletal...,8076,46,1.47,0.0151541914,1.07,1.96
574.10 ,Calculus of gallbladder with other...,Diseases of the digestive system,4194,24,1.47,0.0623819393,0.94,2.19
575.1 ,Other cholecystitis,Diseases of the digestive system,2617,15,1.47,0.1533590786,0.82,2.44
250.60 ,"Diabetes with neurological manifestations,...","Endocrine, nutritional and metabolic...",9489,54,1.47,0.0079453714,1.1,1.92
714.0 ,Rheumatoid arthritis,Diseases of the musculoskeletal...,13278,75,1.46,0.002042312,1.14,1.83
005.9 ,"Food poisoning, unspecified",Infectious and parasitic diseases,1936,11,1.46,0.1985605592,0.73,2.62
041.9 ,"Bacterial infection, unspecified,...",Infectious and parasitic diseases,10942,62,1.46,0.0053965133,1.12,1.87
099.9 ,"Venereal disease, unspecified",Infectious and parasitic diseases,1929,11,1.46,0.1972156597,0.73,2.63
573.3 ,"Hepatitis, unspecified",Diseases of the digestive system,28478,161,1.46,0.0000061829191,1.24,1.71
250.70 ,Diabetes with peripheral circulatory...,"Endocrine, nutritional and metabolic...",3696,21,1.46,0.0851982659,0.9,2.24
353.4 ,"Lumbosacral root lesions, not...",Diseases of the nervous system,5665,32,1.45,0.0416323026,0.99,2.06
715 ,Osteoarthrosis and allied disorders,Diseases of the musculoskeletal...,13643,77,1.45,0.001852437,1.15,1.82
535.00 ,"Acute gastritis, without mention...",Diseases of the digestive system,153468,830,1.45,2.45009e-21,1.34,1.56
949.0 ,"Burn of unspecified site, unspecified...",Injury and poisoning,7075,40,1.45,0.0216427293,1.04,1.98
537.9 ,Unspecified disorder of stomach...,Diseases of the digestive system,3906,22,1.45,0.0926832349,0.91,2.2
560.1 ,Paralytic ileus,Diseases of the digestive system,3197,18,1.45,0.1170749552,0.86,2.29
723.1 ,Cervicalgia,Diseases of the musculoskeletal...,32950,184,1.45,0.0000031892282,1.24,1.68
566 ,Abscess of anal and rectal regions,Diseases of the digestive system,6903,39,1.45,0.0254283183,1.03,1.99
724 ,Other and unspecified disorders...,Diseases of the musculoskeletal...,5866,33,1.45,0.0449167966,0.99,2.04
845.10 ,"Sprain of foot, unspecified site",Injury and poisoning,4091,23,1.44,0.0786391075,0.91,2.17
370.21 ,Punctate keratitis,Diseases of the nervous system,25398,141,1.44,0.0000582414,1.21,1.7
719.42 ,"Pain in joint, upper arm",Diseases of the musculoskeletal...,1783,10,1.44,0.2481853962,0.69,2.66
414.8 ,Other specified forms of chronic...,Diseases of the circulatory system,5347,30,1.44,0.0601628335,0.97,2.06
465.8 ,Acute upper respiratory infections...,Diseases of the respiratory system,117159,638,1.44,6.74059e-17,1.33,1.57
346.9 ,"Migraine, unspecified",Diseases of the nervous system,14113,79,1.44,0.0021888595,1.14,1.8
842.10 ,"Sprain of hand, unspecified site",Injury and poisoning,2883,16,1.43,0.1742798261,0.81,2.32
718.40 ,"Contracture of joint, site unspecified",Diseases of the musculoskeletal...,3418,19,1.43,0.1282575021,0.86,2.24
535.4 ,Other specified gastritis,Diseases of the digestive system,8478,47,1.43,0.0225210835,1.05,1.9
726.11 ,Calcifying tendinitis of shoulder,Diseases of the musculoskeletal...,2695,15,1.43,0.1619782027,0.8,2.36
411.1 ,Intermediate coronary syndrome,Diseases of the circulatory system,2337,13,1.43,0.1831316424,0.76,2.45
434.9 ,"Cerebral artery occlusion, unspecified",Diseases of the circulatory system,7536,42,1.43,0.0256061592,1.03,1.94
528.5 ,Diseases of lips,Diseases of the digestive system,2538,14,1.42,0.1982948802,0.77,2.38
716.90 ,"Arthropathy, unspecified, site...",Diseases of the musculoskeletal...,47744,261,1.42,0.00000013705707,1.25,1.61
726.8 ,Other peripheral enthesopathies,Diseases of the musculoskeletal...,3067,17,1.42,0.1451223272,0.83,2.29
594.1 ,Other calculus in bladder,Diseases of the genitourinary...,2350,13,1.42,0.1854286458,0.75,2.44
595.0 ,Acute cystitis,Diseases of the genitourinary...,26072,143,1.42,0.0000895086,1.19,1.67
840.8 ,Sprains and strains of other specified...,Injury and poisoning,3442,19,1.42,0.1303378607,0.85,2.22
487.8 ,Influenza with other manifestations,Diseases of the respiratory system,24321,133,1.41,0.0001824411,1.18,1.68
531.90 ,"Gastric ulcer, unspecified as...",Diseases of the digestive system,28463,155,1.41,0.0000653485,1.19,1.65
717.9 ,Unspecified internal derangement...,Diseases of the musculoskeletal...,3290,18,1.41,0.1584360543,0.83,2.23
535.01 ,"Acute gastritis, with hemorrhage",Diseases of the digestive system,3653,20,1.41,0.1409126466,0.86,2.18
565.0 ,Anal fissure,Diseases of the digestive system,5844,32,1.41,0.0579485631,0.96,1.99
724.5 ,"Backache, unspecified",Diseases of the musculoskeletal...,151376,801,1.41,2.966318e-18,1.31,1.52
110.2 ,Dermatophytosis of hand,Infectious and parasitic diseases,5637,31,1.41,0.0672621545,0.96,2.01
726.10 ,Disorders of bursae and tendons...,Diseases of the musculoskeletal...,10384,57,1.41,0.0139681901,1.07,1.83
274.0 ,"Gouty arthropathy, unspecified","Endocrine, nutritional and metabolic...",109118,583,1.41,0.00000000000005602164,1.29,1.54
788.1 ,Dysuria,"Comorbidities, signs, and ill-defined...",6578,36,1.41,0.0467717346,0.98,1.95
691 ,Atopic dermatitis and related...,Diseases of the skin and subcutaneous...,1821,10,1.41,0.2558009856,0.67,2.6
346.1 ,Common migraine,Diseases of the nervous system,3282,18,1.41,0.1577646529,0.83,2.23
535.0 ,Acute gastritis,Diseases of the digestive system,34623,187,1.4,0.0000185072,1.2,1.62
681.11 ,Onychia and paronychia of toe,Diseases of the skin and subcutaneous...,6239,34,1.4,0.0530164967,0.97,1.96
799.9 ,Other unknown and unspecified...,"Comorbidities, signs, and ill-defined...",2759,15,1.4,0.2170021781,0.78,2.31
346 ,Migraine,Diseases of the nervous system,3112,17,1.4,0.1504936465,0.82,2.25
494 ,Bronchiectasis,Diseases of the respiratory system,7566,41,1.39,0.0412032656,1,1.89
722.52 ,Degeneration of lumbar or lumbosacral...,Diseases of the musculoskeletal...,2039,11,1.39,0.2808485098,0.69,2.49
402.00 ,Malignant hypertensive heart disease...,Diseases of the circulatory system,3506,19,1.39,0.171659102,0.84,2.18
229.9 ,Benign neoplasm of unspecified...,Neoplasms,2772,15,1.39,0.2181964431,0.78,2.3
681.02 ,Onychia and paronychia of finger,Diseases of the skin and subcutaneous...,3888,21,1.39,0.1535591471,0.86,2.13
789.0 ,Abdominal pain,"Comorbidities, signs, and ill-defined...",231347,1183,1.39,2.198707e-22,1.3,1.48
692.5 ,Contact dermatitis and other eczema...,Diseases of the skin and subcutaneous...,3872,21,1.39,0.1527358689,0.86,2.13
708.0 ,Allergic urticaria,Diseases of the skin and subcutaneous...,38428,205,1.38,0.0000132395,1.2,1.59
365.11 ,Primary open angle glaucoma,Diseases of the nervous system,2423,13,1.38,0.2493406936,0.73,2.36
250.90 ,"Diabetes with unspecified complication,...","Endocrine, nutritional and metabolic...",23124,124,1.38,0.0006507901,1.15,1.65
362.50 ,"Macular degeneration (senile),...",Diseases of the nervous system,3179,17,1.37,0.1967638692,0.8,2.2
848.0 ,Sprain of septal cartilage of...,Injury and poisoning,2253,12,1.37,0.3049805009,0.71,2.4
038.9 ,Unspecified septicemia,Infectious and parasitic diseases,5458,29,1.37,0.1014033073,0.91,1.97
723.9 ,Unspecified musculoskeletal disorders...,Diseases of the musculoskeletal...,3005,16,1.37,0.2373026163,0.78,2.23
386.0 ,Meniere's disease,Diseases of the nervous system,3010,16,1.37,0.237672235,0.78,2.22
386.11 ,Benign paroxysmal positional vertigo,Diseases of the nervous system,5234,28,1.37,0.095068616,0.91,1.99
727.89 ,"Other disorders of synovium, tendon,...",Diseases of the musculoskeletal...,3188,17,1.37,0.1976607085,0.8,2.2
