370.24 ,Photokeratitis,Diseases of the nervous system,4499,108,1.62,0.0000048926747,1.32,1.96
717 ,Internal derangement of knee,Diseases of the musculoskeletal...,2711,65,1.61,0.0003470551,1.24,2.06
721.0 ,Cervical spondylosis without myelopathy,Diseases of the musculoskeletal...,6202,148,1.61,0.0000001086846,1.36,1.89
726.9 ,Unspecified enthesopathy,Diseases of the musculoskeletal...,6120,146,1.61,0.00000012219847,1.35,1.9
300.3 ,Obsessive-compulsive disorders,Mental disorders,2427,58,1.61,0.0007770289,1.22,2.09
823 ,Fracture of tibia and fibula,Injury and poisoning,2752,66,1.61,0.0002902628,1.24,2.06
727 ,"Other disorders of synovium tendon,...",Diseases of the musculoskeletal...,4798,114,1.6,0.0000041608157,1.32,1.93
738.4 ,Acquired spondylolisthesis,Diseases of the musculoskeletal...,1888,45,1.6,0.0031391353,1.17,2.16
680.2 ,Carbuncle and furuncle of trunk,Diseases of the skin and subcutaneous...,2272,54,1.6,0.0013163774,1.2,2.09
680.6 ,"Carbuncle and furuncle of leg,...",Diseases of the skin and subcutaneous...,2657,63,1.6,0.000558826,1.22,2.05
706.8 ,Other specified diseases of sebaceous...,Diseases of the skin and subcutaneous...,2192,52,1.6,0.0019525993,1.19,2.1
708.1 ,Idiopathic urticaria,Diseases of the skin and subcutaneous...,5605,133,1.6,0.00000064323084,1.33,1.9
716.90 ,"Arthropathy, unspecified, site...",Diseases of the musculoskeletal...,19316,455,1.59,1.019462e-19,1.45,1.75
356.9 ,Unspecified hereditary and idiopathic...,Diseases of the nervous system,3520,83,1.59,0.0000944206,1.26,1.97
599.9 ,Unspecified disorder of urethra...,Diseases of the genitourinary...,7432,175,1.59,0.000000019049569,1.36,1.84
038.9 ,Unspecified septicemia,Infectious and parasitic diseases,3075,72,1.58,0.0003415381,1.23,1.99
719.44 ,"Pain in joint, hand",Diseases of the musculoskeletal...,2428,57,1.58,0.001405196,1.19,2.05
780.52 ,"Insomnia, unspecified","Comorbidities, signs, and ill-defined...",28198,657,1.58,9.050787e-27,1.46,1.71
311 ,"Depressive disorder, not elsewhere...",Mental disorders,3999,94,1.58,0.0000376064,1.27,1.94
681.11 ,Onychia and paronychia of toe,Diseases of the skin and subcutaneous...,13053,305,1.58,0.0000000000002990457,1.4,1.77
447.6 ,"Arteritis, unspecified",Diseases of the circulatory system,2261,53,1.58,0.0022987906,1.18,2.07
709.0 ,Dyschromia,Diseases of the skin and subcutaneous...,6325,148,1.58,0.00000033726636,1.33,1.86
727.06 ,Tenosynovitis of foot and ankle,Diseases of the musculoskeletal...,3380,79,1.57,0.000213385,1.24,1.97
550.90 ,"Inguinal hernia, without mention...",Diseases of the digestive system,3975,93,1.57,0.0000477063,1.27,1.93
704.9 ,Unspecified disease of hair and...,Diseases of the skin and subcutaneous...,2992,70,1.57,0.0003868182,1.22,2
722.73 ,Intervertebral disc disorder with...,Diseases of the musculoskeletal...,4994,116,1.56,0.0000085680761,1.29,1.88
780.50 ,"Sleep disturbance, unspecified","Comorbidities, signs, and ill-defined...",9613,222,1.56,0.0000000011870459,1.36,1.78
540.9 ,Acute appendicitis without mention...,Diseases of the digestive system,8126,188,1.56,0.000000020959213,1.34,1.8
608.9 ,Unspecified disorder of male genital...,Diseases of the genitourinary...,8065,187,1.56,0.00000001857865,1.34,1.81
530.9 ,Unspecified disorder of esophagus,Diseases of the digestive system,2815,65,1.55,0.0010501729,1.19,1.99
728.9 ,"Unspecified disorder of muscle,...",Diseases of the musculoskeletal...,17959,411,1.55,4.909419e-16,1.4,1.71
307.42 ,Persistent disorder of initiating...,Mental disorders,3550,82,1.55,0.0002319729,1.23,1.93
578.1 ,Blood in stool,Diseases of the digestive system,2474,57,1.55,0.0020818571,1.17,2.01
370 ,Keratitis,Diseases of the nervous system,3167,73,1.55,0.000547282,1.21,1.96
380.1 ,Infective otitis externa,Diseases of the nervous system,3217,74,1.55,0.0004660328,1.21,1.95
924.21 ,Contusion of ankle,Injury and poisoning,9531,219,1.55,0.0000000022415562,1.35,1.77
533.40 ,Chronic or unspecified peptic...,Diseases of the digestive system,4162,95,1.54,0.0000939562,1.24,1.88
533.50 ,Chronic or unspecified peptic...,Diseases of the digestive system,1970,45,1.54,0.0068830801,1.12,2.06
571.5 ,Cirrhosis of liver without mention...,Diseases of the digestive system,3840,88,1.54,0.0001457127,1.23,1.9
831.00 ,"Closed dislocation of shoulder,...",Injury and poisoning,2274,52,1.54,0.0041737516,1.14,2.02
372.72 ,Conjunctival hemorrhage,Diseases of the nervous system,15567,356,1.54,0.00000000000004534212,1.38,1.72
845.0 ,Sprains and strains of ankle,Injury and poisoning,6485,148,1.54,0.000001364144,1.3,1.81
386.1 ,Other and unspecified peripheral...,Diseases of the nervous system,2276,52,1.54,0.0041902106,1.14,2.02
726.4 ,Enthesopathy of wrist and carpus,Diseases of the musculoskeletal...,2375,54,1.53,0.0038817095,1.14,2
296.90 ,Unspecified episodic mood disorder,Mental disorders,1887,43,1.53,0.0078569727,1.1,2.07
569.3 ,Hemorrhage of rectum and anus,Diseases of the digestive system,4612,105,1.53,0.0000457428,1.25,1.86
372.8 ,Other disorders of conjunctiva,Diseases of the nervous system,3068,70,1.53,0.0007897118,1.19,1.94
719.40 ,"Pain in joint, site unspecified",Diseases of the musculoskeletal...,28135,632,1.52,3.903826e-22,1.4,1.65
728.8 ,"Other disorders of muscle, ligament...",Diseases of the musculoskeletal...,2564,58,1.52,0.0025699017,1.15,1.97
607.84 ,Impotence of organic origin,Diseases of the genitourinary...,2779,63,1.52,0.0017126047,1.17,1.96
429.9 ,"Heart disease, unspecified",Diseases of the circulatory system,2972,67,1.52,0.0014479955,1.17,1.93
719.41 ,"Pain in joint, shoulder region",Diseases of the musculoskeletal...,4135,93,1.51,0.0001932992,1.22,1.86
729.2 ,"Neuralgia, neuritis, and radiculitis,...",Diseases of the musculoskeletal...,30152,671,1.51,1.744855e-22,1.39,1.63
535.50 ,"Unspecified gastritis and gastroduodenitis,...",Diseases of the digestive system,109432,2394,1.51,1.064981e-73,1.45,1.58
805.4 ,Closed fracture of lumbar vertebra...,Injury and poisoning,3461,78,1.51,0.0005801456,1.19,1.9
910.9 ,Other and unspecified superficial...,Injury and poisoning,2183,49,1.51,0.0062253187,1.11,2
944.00 ,Burn of unspecified degree of...,Injury and poisoning,2320,52,1.51,0.0059771247,1.12,1.98
717.9 ,Unspecified internal derangement...,Diseases of the musculoskeletal...,7139,159,1.5,0.0000020621362,1.27,1.75
478.22 ,Parapharyngeal abscess,Diseases of the respiratory system,2064,46,1.5,0.0107559926,1.09,2
780.9 ,Other general symptoms,"Comorbidities, signs, and ill-defined...",11394,254,1.5,0.0000000018437608,1.32,1.7
370.9 ,Unspecified keratitis,Diseases of the nervous system,7154,160,1.5,0.000001641017,1.28,1.76
919.4 ,"Insect bite, nonvenomous, of other,...",Injury and poisoning,18470,411,1.5,0.00000000000002385051,1.36,1.66
721.90 ,"Spondylosis of unspecified site,...",Diseases of the musculoskeletal...,5331,118,1.49,0.0000580256,1.23,1.79
295.90 ,"Unspecified schizophrenia, unspecified",Mental disorders,3743,83,1.49,0.0007262402,1.18,1.85
799.9 ,Other unknown and unspecified...,"Comorbidities, signs, and ill-defined...",2384,53,1.49,0.0067001527,1.11,1.96
372.05 ,Acute atopic conjunctivitis,Diseases of the nervous system,2157,48,1.49,0.0097745925,1.1,1.99
607.1 ,Balanoposthitis,Diseases of the genitourinary...,30581,673,1.49,1.745126e-21,1.38,1.61
531.9 ,"Gastric ulcer, unspecified as...",Diseases of the digestive system,1995,44,1.48,0.0126896296,1.07,2
276.9 ,Electrolyte and fluid disorders...,"Endocrine, nutritional and metabolic...",2815,62,1.48,0.0039309946,1.13,1.9
560.9 ,Unspecified intestinal obstruction,Diseases of the digestive system,2856,63,1.48,0.0033022627,1.13,1.9
691.8 ,Other atopic dermatitis and related...,Diseases of the skin and subcutaneous...,30239,663,1.48,8.263107e-21,1.37,1.6
719.4 ,Pain in joint,Diseases of the musculoskeletal...,9409,205,1.47,0.00000031432306,1.27,1.68
078.1 ,Viral warts,Infectious and parasitic diseases,59426,1281,1.47,2.710503e-36,1.39,1.55
215.2 ,Other benign neoplasm of connective...,Neoplasms,1919,42,1.47,0.0182970521,1.06,1.99
276.5 ,Volume depletion,"Endocrine, nutritional and metabolic...",8549,187,1.47,0.0000008636951,1.27,1.7
307.41 ,Transient disorder of initiating...,Mental disorders,1969,43,1.47,0.0197657744,1.06,1.98
370.00 ,"Corneal ulcer, unspecified",Diseases of the nervous system,8375,183,1.47,0.0000013236012,1.26,1.7
844.9 ,Sprains and strains of unspecified...,Injury and poisoning,14131,309,1.47,0.0000000002845733,1.31,1.65
719.49 ,"Pain in joint, multiple sites",Diseases of the musculoskeletal...,5015,109,1.46,0.0002356486,1.2,1.77
781.9 ,Other symptoms involving nervous...,"Comorbidities, signs, and ill-defined...",3967,86,1.46,0.0010414361,1.16,1.8
605 ,Redundant prepuce and phimosis,Diseases of the genitourinary...,22463,486,1.46,0.00000000000001100969,1.33,1.6
722 ,Intervertebral disc disorders,Diseases of the musculoskeletal...,3926,85,1.45,0.0012291368,1.16,1.8
727.00 ,"Synovitis and tenosynovitis, unspecified",Diseases of the musculoskeletal...,69529,1481,1.45,1.77252e-39,1.38,1.53
296 ,Disorganized type,Mental disorders,2685,58,1.45,0.0068415116,1.1,1.88
566 ,Abscess of anal and rectal regions,Diseases of the digestive system,3833,83,1.45,0.0013571809,1.16,1.81
585 ,Chronic renal failure,Diseases of the genitourinary...,3388,73,1.45,0.002883258,1.13,1.82
842.09 ,Other sprains and strains of wrist,Injury and poisoning,5064,109,1.45,0.0003173521,1.18,1.75
372.9 ,Unspecified disorder of conjunctiva,Diseases of the nervous system,2553,55,1.45,0.0090019533,1.09,1.89
709.9 ,Unspecified disorder of skin and...,Diseases of the skin and subcutaneous...,57408,1221,1.45,2.314955e-32,1.36,1.53
097.9 ,"Syphilis, unspecified",Infectious and parasitic diseases,2562,55,1.44,0.0113416633,1.08,1.88
720.1 ,Spinal enthesopathy,Diseases of the musculoskeletal...,2001,43,1.44,0.0211545112,1.04,1.95
721.1 ,Cervical spondylosis with myelopathy,Diseases of the musculoskeletal...,2336,50,1.44,0.0166089914,1.06,1.9
722.2 ,Displacement of intervertebral...,Diseases of the musculoskeletal...,12075,259,1.44,0.000000038250703,1.27,1.63
512.8 ,Other pneumothorax and air leak,Diseases of the respiratory system,2652,57,1.44,0.008229404,1.09,1.88
532.9 ,"Duodenal ulcer, unspecified as...",Diseases of the digestive system,2975,64,1.44,0.005138155,1.11,1.85
298.9 ,Unspecified psychosis,Mental disorders,3030,65,1.44,0.0054913433,1.11,1.84
789 ,Other symptoms involving abdomen...,"Comorbidities, signs, and ill-defined...",3638,78,1.44,0.0025722089,1.13,1.8
683 ,Acute lymphadenitis,Diseases of the skin and subcutaneous...,4244,91,1.44,0.0009905679,1.16,1.77
995.3 ,"Allergy, unspecified, not elsewhere...",Injury and poisoning,14658,314,1.44,0.0000000014235253,1.28,1.61
008.8 ,Intestinal infection due to other...,Infectious and parasitic diseases,2332,50,1.44,0.0165204697,1.06,1.9
729.5 ,Pain in limb,Diseases of the musculoskeletal...,10660,227,1.43,0.0000004458641,1.25,1.63
296.2 ,"Major depressive disorder, single...",Mental disorders,1919,41,1.43,0.0299011094,1.03,1.95
300.0 ,Anxiety states,Mental disorders,14492,307,1.43,0.0000000062314412,1.27,1.6
365.9 ,Unspecified glaucoma,Diseases of the nervous system,3801,81,1.43,0.0025596782,1.13,1.78
597.89 ,Other urethritis,Diseases of the genitourinary...,3561,76,1.43,0.0029426197,1.13,1.8
844.0 ,Sprain of lateral collateral ligament...,Injury and poisoning,2118,45,1.43,0.024723088,1.04,1.91
845 ,Sprains and strains of ankle and...,Injury and poisoning,5622,120,1.43,0.00022184,1.19,1.72
845.19 ,Other sprain of foot,Injury and poisoning,3909,83,1.43,0.0023703007,1.13,1.77
706.2 ,Sebaceous cyst,Diseases of the skin and subcutaneous...,18196,387,1.43,0.00000000004846727,1.29,1.59
464.21 ,Acute laryngotracheitis with obstruction,Diseases of the respiratory system,4875,104,1.43,0.0005977168,1.17,1.74
009 ,Ill-defined intestinal infections,Infectious and parasitic diseases,4440,94,1.42,0.0012733596,1.15,1.74
239.2 ,Neoplasm of unspecified nature...,Neoplasms,3837,81,1.42,0.003336876,1.12,1.77
727.0 ,Synovitis and tenosynovitis,Diseases of the musculoskeletal...,9157,193,1.42,0.0000057381125,1.22,1.63
728 ,"Disorders of muscle, ligament,...",Diseases of the musculoskeletal...,9132,193,1.42,0.0000045804694,1.22,1.64
680 ,Carbuncle and furuncle,Diseases of the skin and subcutaneous...,4441,94,1.42,0.0012760731,1.15,1.74
693.9 ,Dermatitis due to unspecified...,Diseases of the skin and subcutaneous...,12288,259,1.42,0.00000014308408,1.25,1.6
473.8 ,Other chronic sinusitis,Diseases of the respiratory system,2376,50,1.41,0.02204926,1.04,1.87
530.2 ,Ulcer of esophagus,Diseases of the digestive system,4237,89,1.41,0.0023165842,1.13,1.74
729.1 ,"Myalgia and myositis, unspecified",Diseases of the musculoskeletal...,100400,2061,1.41,4.381921e-45,1.34,1.47
289.3 ,"Lymphadenitis, unspecified, except...",Diseases of the blood and blood-forming...,4509,95,1.41,0.0013894546,1.14,1.73
844.1 ,Sprain of medial collateral ligament...,Injury and poisoning,2001,42,1.41,0.0337329722,1.01,1.91
700 ,Corns and callosities,Diseases of the skin and subcutaneous...,11427,240,1.41,0.00000059765607,1.24,1.61
722.10 ,Displacement of lumbar intervertebral...,Diseases of the musculoskeletal...,20698,429,1.4,0.0000000001083771,1.26,1.54
490 ,"Bronchitis, not specified as acute...",Diseases of the respiratory system,34844,723,1.4,3.45964e-17,1.3,1.51
300.4 ,Dysthymic disorder,Mental disorders,17149,358,1.4,0.0000000018540244,1.26,1.56
783.2 ,Abnormal loss of weight,"Comorbidities, signs, and ill-defined...",3121,65,1.4,0.0097906237,1.08,1.79
372.02 ,Acute follicular conjunctivitis,Diseases of the nervous system,6520,136,1.4,0.0002293876,1.17,1.66
372.12 ,Chronic follicular conjunctivitis,Diseases of the nervous system,2535,53,1.4,0.0176286827,1.05,1.84
604.90 ,"Orchitis and epididymitis, unspecified",Diseases of the genitourinary...,4788,100,1.4,0.0015552141,1.14,1.71
840.8 ,Sprains and strains of other specified...,Injury and poisoning,2774,58,1.4,0.0150225453,1.06,1.82
844 ,Sprains and strains of knee and...,Injury and poisoning,2341,49,1.4,0.0263591055,1.04,1.86
845.09 ,Other sprains and strains of ankle,Injury and poisoning,15561,323,1.4,0.000000020320545,1.25,1.56
930.0 ,Corneal foreign body,Injury and poisoning,93404,1910,1.4,8.92367e-41,1.33,1.47
054.9 ,Herpes simplex without mention...,Infectious and parasitic diseases,16867,349,1.39,0.0000000078306888,1.25,1.55
478 ,Other diseases of upper respiratory...,Diseases of the respiratory system,3225,67,1.39,0.0108955378,1.08,1.78
722.1 ,Displacement of thoracic or lumbar...,Diseases of the musculoskeletal...,3185,66,1.39,0.0105194655,1.07,1.77
722.93 ,"Other and unspecified disc disorder,...",Diseases of the musculoskeletal...,6708,139,1.39,0.0002332132,1.17,1.65
780 ,General symptoms,"Comorbidities, signs, and ill-defined...",5318,110,1.39,0.0012436872,1.14,1.68
788.4 ,Frequency of urination and polyuria,"Comorbidities, signs, and ill-defined...",9270,192,1.39,0.0000176077,1.2,1.61
578.9 ,Hemorrhage of gastrointestinal...,Diseases of the digestive system,11192,232,1.39,0.0000022443152,1.22,1.59
595.9 ,"Cystitis, unspecified",Diseases of the genitourinary...,11226,233,1.39,0.0000019176519,1.22,1.59
842.00 ,"Sprain of wrist, unspecified site",Injury and poisoning,6473,134,1.39,0.000326309,1.16,1.65
843.9 ,Sprains and strains of unspecified...,Injury and poisoning,4301,89,1.39,0.0031268764,1.11,1.71
698.2 ,Prurigo,Diseases of the skin and subcutaneous...,48826,999,1.39,1.293604e-21,1.3,1.48
704.8 ,Other specified diseases of hair...,Diseases of the skin and subcutaneous...,41679,855,1.39,6.349317e-19,1.29,1.49
528.9 ,Other and unspecified diseases...,Diseases of the digestive system,31395,644,1.38,0.00000000000001409239,1.28,1.5
295.30 ,"Paranoid type schizophrenia, unspecified",Mental disorders,3022,62,1.38,0.0162996947,1.05,1.77
353.4 ,"Lumbosacral root lesions, not...",Diseases of the nervous system,2475,51,1.38,0.0253627146,1.03,1.82
379.99 ,Other ill-defined disorders of...,Diseases of the nervous system,2824,58,1.38,0.0198025027,1.04,1.79
692.4 ,Contact dermatitis and other eczema...,Diseases of the skin and subcutaneous...,15935,326,1.38,0.000000062981991,1.23,1.54
389.10 ,"Sensorineural hearing loss, unspecified",Diseases of the nervous system,3158,65,1.38,0.0126090285,1.06,1.76
695.89 ,Other specified erythematous conditions,Diseases of the skin and subcutaneous...,3013,62,1.38,0.0160636964,1.05,1.77
455.8 ,Unspecified hemorrhoids with other...,Diseases of the circulatory system,9055,186,1.38,0.0000369311,1.19,1.6
716.9 ,"Arthropathy, unspecified",Diseases of the musculoskeletal...,9238,189,1.37,0.0000369478,1.18,1.59
214.9 ,"Lipoma, unspecified site",Neoplasms,2201,45,1.37,0.0429133562,1,1.84
295.34 ,"Paranoid type schizophrenia, chronic...",Mental disorders,2203,45,1.37,0.0430518394,1,1.84
786.0 ,Dyspnea and respiratory abnormalities,"Comorbidities, signs, and ill-defined...",4006,82,1.37,0.0061848289,1.09,1.71
786.50 ,"Chest pain, unspecified","Comorbidities, signs, and ill-defined...",45967,932,1.37,3.329237e-19,1.28,1.47
708.9 ,"Urticaria, unspecified",Diseases of the skin and subcutaneous...,104191,2091,1.37,6.348838e-40,1.31,1.44
716.80 ,"Other specified arthropathy, site...",Diseases of the musculoskeletal...,2119,43,1.36,0.0489827665,0.98,1.84
530.1 ,Esophagitis,Diseases of the digestive system,19615,396,1.36,0.000000011312668,1.23,1.5
531.90 ,"Gastric ulcer, unspecified as...",Diseases of the digestive system,12167,246,1.36,0.0000057820724,1.19,1.54
533.90 ,"Peptic ulcer of unspecified site,...",Diseases of the digestive system,57333,1147,1.36,1.300324e-21,1.28,1.44
300.00 ,"Anxiety state, unspecified",Mental disorders,31635,638,1.36,0.000000000000429048,1.25,1.47
370.20 ,"Superficial keratitis, unspecified",Diseases of the nervous system,11565,234,1.36,0.0000098274795,1.19,1.55
382.4 ,Unspecified suppurative otitis...,Diseases of the nervous system,2318,47,1.36,0.040120984,1,1.81
693.8 ,Dermatitis due to other specified...,Diseases of the skin and subcutaneous...,5480,111,1.36,0.0021634686,1.11,1.64
696.1 ,Other psoriasis,Diseases of the skin and subcutaneous...,5717,116,1.36,0.0015533465,1.12,1.64
719.46 ,"Pain in joint, lower leg",Diseases of the musculoskeletal...,7131,144,1.35,0.0005220244,1.14,1.6
528.2 ,Oral aphthae,Diseases of the digestive system,13814,277,1.35,0.0000028725074,1.19,1.52
531.70 ,Chronic gastric ulcer without...,Diseases of the digestive system,3580,72,1.35,0.0157497432,1.05,1.7
560.1 ,Paralytic ileus,Diseases of the digestive system,2486,50,1.35,0.0467919171,1,1.78
307.40 ,"Nonorganic sleep disorder, unspecified",Mental disorders,2127,43,1.35,0.0599159353,0.98,1.83
786.59 ,Other chest pain,"Comorbidities, signs, and ill-defined...",11289,227,1.35,0.0000188348,1.18,1.54
842 ,Sprains and strains of wrist and...,Injury and poisoning,2036,41,1.35,0.0670754668,0.97,1.84
372.39 ,Other conjunctivitis,Diseases of the nervous system,4856,98,1.35,0.0044615981,1.1,1.65
918.1 ,Superficial injury of cornea,Injury and poisoning,27639,555,1.35,0.00000000002590127,1.24,1.47
692.3 ,Contact dermatitis and other eczema...,Diseases of the skin and subcutaneous...,6367,128,1.35,0.0013366657,1.12,1.61
386.12 ,Vestibular neuronitis,Diseases of the nervous system,2679,54,1.35,0.0316595494,1.01,1.77
692.9 ,"Contact dermatitis and other eczema,...",Diseases of the skin and subcutaneous...,255571,4903,1.35,1.48874e-73,1.31,1.39
698.9 ,Unspecified pruritic disorder,Diseases of the skin and subcutaneous...,33676,673,1.35,0.0000000000004818961,1.25,1.46
715.00 ,"Osteoarthrosis, generalized, site...",Diseases of the musculoskeletal...,2330,47,1.35,0.0490533813,0.99,1.8
079.9 ,Unspecified viral and chlamydial...,Infectious and parasitic diseases,4812,96,1.34,0.0062542443,1.08,1.64
478.5 ,Other diseases of vocal cords,Diseases of the respiratory system,14842,297,1.34,0.0000014332819,1.19,1.51
724.3 ,Sciatica,Diseases of the musculoskeletal...,29066,577,1.34,0.00000000005679963,1.23,1.45
215 ,Other benign neoplasm of connective...,Neoplasms,1957,39,1.34,0.0767227125,0.95,1.83
532.90 ,"Duodenal ulcer, unspecified as...",Diseases of the digestive system,12417,247,1.34,0.0000168509,1.17,1.52
535.5 ,Unspecified gastritis & gastroduodenitis,Diseases of the digestive system,16690,334,1.34,0.00000034925153,1.2,1.5
780.5 ,Sleep disturbance,"Comorbidities, signs, and ill-defined...",9368,187,1.34,0.0001464963,1.15,1.55
786.5 ,Chest pain,"Comorbidities, signs, and ill-defined...",23710,471,1.34,0.0000000031383096,1.22,1.47
362.6 ,Peripheral retinal degeneration,Diseases of the nervous system,2392,48,1.34,0.0520733506,0.99,1.79
581.9 ,Nephrotic syndrome with unspecified...,Diseases of the genitourinary...,2199,44,1.34,0.0643276492,0.97,1.81
599.0 ,"Urinary tract infection, site...",Diseases of the genitourinary...,57435,1139,1.34,2.401995e-20,1.26,1.43
608.4 ,Other inflammatory disorders of...,Diseases of the genitourinary...,2000,40,1.34,0.0791879269,0.95,1.83
382.9 ,Unspecified otitis media,Diseases of the nervous system,27607,551,1.34,0.00000000008177625,1.23,1.46
715.36 ,"Osteoarthrosis, localized, not...",Diseases of the musculoskeletal...,5272,105,1.34,0.0045157031,1.09,1.62
041.8 ,Other specified bacterial infections,Infectious and parasitic diseases,2071,41,1.33,0.0845962984,0.95,1.81
216.8 ,Benign neoplasm of other specified...,Neoplasms,3876,77,1.33,0.0169849073,1.05,1.67
840.9 ,Sprains and strains of unspecified...,Injury and poisoning,9937,197,1.33,0.0001386376,1.15,1.53
381.4 ,"Nonsuppurative otitis media, not...",Diseases of the nervous system,2821,56,1.33,0.0432425231,1,1.73
709.8 ,Other specified disorders of skin,Diseases of the skin and subcutaneous...,12982,258,1.33,0.0000113616,1.17,1.51
486 ,"Pneumonia, organism unspecified",Diseases of the respiratory system,19995,393,1.32,0.00000018560809,1.19,1.46
496 ,"Chronic airway obstruction, not...",Diseases of the respiratory system,4533,89,1.32,0.0141910904,1.05,1.62
726.64 ,Patellar tendinitis,Diseases of the musculoskeletal...,2583,51,1.32,0.0516323343,0.98,1.75
729.4 ,"Fasciitis, unspecified",Diseases of the musculoskeletal...,54459,1060,1.32,7.774687e-17,1.24,1.4
780.4 ,Dizziness and giddiness,"Comorbidities, signs, and ill-defined...",91992,1788,1.32,1.26157e-27,1.26,1.39
782.1 ,Rash and other nonspecific skin...,"Comorbidities, signs, and ill-defined...",8390,165,1.32,0.0007224089,1.12,1.54
784.0 ,Headache,"Comorbidities, signs, and ill-defined...",170778,3275,1.32,8.513036e-47,1.27,1.37
682.0 ,Cellulitis and abscess of face,Diseases of the skin and subcutaneous...,5690,112,1.32,0.005258235,1.08,1.59
847.9 ,Sprain of unspecified site of...,Injury and poisoning,7041,139,1.32,0.0016419064,1.11,1.57
692.0 ,Contact dermatitis and other eczema...,Diseases of the skin and subcutaneous...,27644,543,1.32,0.0000000009550956,1.21,1.44
930.1 ,Foreign body in conjunctival sac,Injury and poisoning,52524,1027,1.32,7.653627e-17,1.24,1.41
110.4 ,Dermatophytosis of foot,Infectious and parasitic diseases,71483,1380,1.31,2.023346e-20,1.24,1.38
724.2 ,Lumbago,Diseases of the musculoskeletal...,122030,2340,1.31,6.600534e-33,1.26,1.37
569.9 ,Unspecified disorder of intestine,Diseases of the digestive system,4029,79,1.31,0.0193582073,1.04,1.64
353.2 ,"Cervical root lesions, not elsewhere...",Diseases of the nervous system,2755,54,1.31,0.0498813534,0.98,1.72
367.89 ,Other disorders of refraction...,Diseases of the nervous system,4859,95,1.31,0.0110148962,1.06,1.61
680.0 ,Carbuncle and furuncle of face,Diseases of the skin and subcutaneous...,6853,134,1.31,0.0027792423,1.1,1.56
680.8 ,Carbuncle and furuncle of other...,Diseases of the skin and subcutaneous...,3632,71,1.31,0.0285231056,1.02,1.66
844.8 ,Sprains and strains of other specified...,Injury and poisoning,3786,74,1.31,0.0268635849,1.03,1.65
523.0 ,Acute gingivitis,Diseases of the digestive system,4522,88,1.3,0.0167493396,1.04,1.61
274.9 ,"Gout, unspecified","Endocrine, nutritional and metabolic...",47010,906,1.3,0.000000000000126317,1.21,1.39
346 ,Migraine,Diseases of the nervous system,2468,48,1.3,0.0809215453,0.96,1.73
570 ,Acute and subacute necrosis of...,Diseases of the digestive system,3032,59,1.3,0.051312542,0.99,1.69
702.8 ,Other specified dermatoses,Diseases of the skin and subcutaneous...,4992,97,1.3,0.0121210771,1.05,1.59
455.5 ,External hemorrhoids with other...,Diseases of the circulatory system,1956,38,1.3,0.1127914457,0.92,1.79
724.5 ,"Backache, unspecified",Diseases of the musculoskeletal...,78972,1507,1.29,1.718373e-20,1.23,1.36
300.9 ,Unspecified nonpsychotic mental...,Mental disorders,17786,341,1.29,0.0000104829,1.15,1.43
845.00 ,"Sprain of ankle, unspecified site",Injury and poisoning,23029,443,1.29,0.00000032667467,1.17,1.42
845.10 ,"Sprain of foot, unspecified site",Injury and poisoning,4944,95,1.29,0.0188934774,1.04,1.58
692 ,Contact dermatitis and other eczema,Diseases of the skin and subcutaneous...,20053,384,1.29,0.0000028990343,1.16,1.42
692.79 ,Other dermatitis due to solar...,Diseases of the skin and subcutaneous...,5784,111,1.29,0.0108130879,1.06,1.55
704.01 ,Alopecia areata,Diseases of the skin and subcutaneous...,5256,101,1.29,0.0144506009,1.05,1.57
535.4 ,Other specified gastritis,Diseases of the digestive system,5921,113,1.28,0.0117810934,1.05,1.54
295 ,Schizophrenic disorders,Mental disorders,4444,85,1.28,0.0302642111,1.02,1.59
354.0 ,Carpal tunnel syndrome,Diseases of the nervous system,3407,65,1.28,0.0563920249,0.98,1.63
596.5 ,Other functional disorders of...,Diseases of the genitourinary...,4077,78,1.28,0.0332101449,1.01,1.6
830 ,Dislocation of jaw,Injury and poisoning,3860,74,1.28,0.039505074,1.01,1.62
386.9 ,Unspecified vertiginous syndromes...,Diseases of the nervous system,6138,117,1.28,0.0114615564,1.05,1.53
