916.1 ,"Abrasion or friction burn of hip,...",Injury and poisoning,2947,9,1.91,0.0606530479,0.87,3.63
786.0 ,Dyspnea and respiratory abnormalities,"Comorbidities, signs, and ill-defined...",4250,13,1.91,0.0309345044,1.01,3.28
531.70 ,Chronic gastric ulcer without...,Diseases of the digestive system,6873,21,1.91,0.0059131682,1.18,2.93
726.19 ,Other specified disorders of bursae...,Diseases of the musculoskeletal...,3921,12,1.91,0.0407987493,0.99,3.35
386.00 ,"Minihre's disease, unspecified",Diseases of the nervous system,7581,23,1.9,0.0054923198,1.2,2.86
717.9 ,Unspecified internal derangement...,Diseases of the musculoskeletal...,3277,10,1.9,0.0474009527,0.91,3.51
345 ,Epilepsy,Diseases of the nervous system,2303,7,1.9,0.1062012649,0.76,3.92
684 ,Impetigo,Diseases of the skin and subcutaneous...,3970,12,1.89,0.0422295665,0.97,3.31
883.0 ,"Open wound of finger(s), without...",Injury and poisoning,59485,175,1.89,0.00000000000008359715,1.61,2.2
915.0 ,"Abrasion or friction burn of finger(s),...",Injury and poisoning,3988,12,1.88,0.0428034626,0.97,3.29
380.2 ,Other otitis externa,Diseases of the nervous system,2989,9,1.88,0.0638804704,0.86,3.58
531.9 ,"Gastric ulcer, unspecified as...",Diseases of the digestive system,3978,12,1.88,0.0424814271,0.97,3.3
916 ,"Superficial injury of hip, thigh,...",Injury and poisoning,3004,9,1.87,0.0650846358,0.85,3.56
382.3 ,Unspecified chronic suppurative...,Diseases of the nervous system,4008,12,1.87,0.0434715728,0.96,3.27
533.70 ,Chronic peptic ulcer of unspecified...,Diseases of the digestive system,13767,41,1.87,0.0002451617,1.34,2.54
726.90 ,Enthesopathy of unspecified site,Diseases of the musculoskeletal...,39550,116,1.86,0.0000000017405347,1.53,2.24
354.2 ,Lesion of ulnar nerve,Diseases of the nervous system,2025,6,1.85,0.1498758409,0.68,4.03
879.8 ,Open wound(s) (multiple) of unspecified...,Injury and poisoning,20870,61,1.84,0.0000166285,1.4,2.37
693.1 ,Dermatitis due to food taken internally,Diseases of the skin and subcutaneous...,2733,8,1.83,0.089972977,0.79,3.61
276.9 ,Electrolyte and fluid disorders...,"Endocrine, nutritional and metabolic...",2720,8,1.83,0.0886270604,0.79,3.63
110.8 ,Dermatophytosis of other specified...,Infectious and parasitic diseases,3423,10,1.82,0.0798870728,0.87,3.36
388.70 ,"Otalgia, unspecified",Diseases of the nervous system,2412,7,1.81,0.1185196535,0.73,3.74
681.9 ,Cellulitis and abscess of unspecified...,Diseases of the skin and subcutaneous...,7609,22,1.81,0.0091575724,1.13,2.74
353.4 ,"Lumbosacral root lesions, not...",Diseases of the nervous system,4145,12,1.81,0.0489111537,0.93,3.16
728.89 ,"Other disorders of muscle, ligament,...",Diseases of the musculoskeletal...,11852,34,1.8,0.0016796354,1.24,2.52
721.3 ,Lumbosacral spondylosis without...,Diseases of the musculoskeletal...,31840,90,1.79,0.00000062020131,1.43,2.2
873.8 ,Other and unspecified open wound...,Injury and poisoning,8028,23,1.79,0.0107784188,1.13,2.7
353.9 ,Unspecified nerve root and plexus...,Diseases of the nervous system,3483,10,1.79,0.0829620738,0.86,3.3
726.8 ,Other peripheral enthesopathies,Diseases of the musculoskeletal...,2436,7,1.79,0.1215442012,0.72,3.7
727.01 ,Synovitis and tenosynovitis in...,Diseases of the musculoskeletal...,2448,7,1.78,0.1230974262,0.72,3.68
728.9 ,"Unspecified disorder of muscle,...",Diseases of the musculoskeletal...,21961,62,1.78,0.0000399104,1.36,2.28
533.00 ,Acute peptic ulcer of unspecified...,Diseases of the digestive system,7391,21,1.78,0.0127300855,1.1,2.72
780.2 ,Syncope and collapse,"Comorbidities, signs, and ill-defined...",6004,17,1.77,0.0331078779,1.03,2.84
923.3 ,Contusion of finger,Injury and poisoning,5650,16,1.77,0.0291201629,1.01,2.88
455.9 ,Residual hemorrhoidal skin tags,Diseases of the circulatory system,3164,9,1.77,0.1108967479,0.81,3.38
715.96 ,"Osteoarthrosis, unspecified whether...",Diseases of the musculoskeletal...,3169,9,1.77,0.1111974539,0.81,3.37
289.3 ,"Lymphadenitis, unspecified, except...",Diseases of the blood and blood-forming...,3874,11,1.77,0.0665127483,0.88,3.18
719.40 ,"Pain in joint, site unspecified",Diseases of the musculoskeletal...,49277,137,1.77,0.0000000016506905,1.48,2.1
881 ,"Open wound of elbow, forearm,...",Injury and poisoning,3520,10,1.77,0.0850932952,0.85,3.27
566 ,Abscess of anal and rectal regions,Diseases of the digestive system,6795,19,1.75,0.0214374071,1.05,2.74
041.8 ,Other specified bacterial infections,Infectious and parasitic diseases,2850,8,1.75,0.1499624932,0.75,3.46
848.9 ,Unspecified site of sprain and...,Injury and poisoning,99915,269,1.75,5.137781e-16,1.54,1.98
729.4 ,"Fasciitis, unspecified",Diseases of the musculoskeletal...,72066,195,1.74,0.000000000005661321,1.49,2.01
581.9 ,Nephrotic syndrome with unspecified...,Diseases of the genitourinary...,2876,8,1.73,0.1516694904,0.75,3.43
296.20 ,"Major depressive affective disorder,...",Mental disorders,2876,8,1.73,0.1516694904,0.75,3.43
477.0 ,Allergic rhinitis due to pollen,Diseases of the respiratory system,2543,7,1.72,0.1363289172,0.69,3.55
307.4 ,Specific disorders of sleep of...,Mental disorders,2537,7,1.72,0.1354452861,0.69,3.55
727 ,"Other disorders of synovium tendon,...",Diseases of the musculoskeletal...,5816,16,1.72,0.0456641821,0.98,2.8
919.9 ,Other and unspecified superficial...,Injury and poisoning,2192,6,1.71,0.1745369865,0.63,3.73
597.89 ,Other urethritis,Diseases of the genitourinary...,4379,12,1.71,0.0832875225,0.88,2.99
698.4 ,Dermatitis factitia [artefacta],Diseases of the skin and subcutaneous...,7703,21,1.7,0.0212103822,1.05,2.61
216.8 ,Benign neoplasm of other specified...,Neoplasms,3673,10,1.7,0.095765069,0.81,3.13
722.1 ,Displacement of thoracic or lumbar...,Diseases of the musculoskeletal...,4044,11,1.7,0.1092061511,0.85,3.04
345.90 ,"Epilepsy, unspecified, without...",Diseases of the nervous system,5862,16,1.7,0.0466345705,0.97,2.77
367.4 ,Presbyopia,Diseases of the nervous system,2928,8,1.7,0.1555054884,0.73,3.37
848.8 ,Other specified sites of sprains...,Injury and poisoning,7777,21,1.69,0.0222526139,1.04,2.59
535.4 ,Other specified gastritis,Diseases of the digestive system,7377,20,1.69,0.0270203882,1.03,2.62
842.01 ,Sprain of carpal (joint) of wrist,Injury and poisoning,2220,6,1.68,0.179307387,0.62,3.68
531.90 ,"Gastric ulcer, unspecified as...",Diseases of the digestive system,21276,57,1.68,0.0002745708,1.27,2.19
346.1 ,Common migraine,Diseases of the nervous system,2961,8,1.68,0.1582249412,0.73,3.33
729.1 ,"Myalgia and myositis, unspecified",Diseases of the musculoskeletal...,136853,348,1.67,5.447615e-17,1.49,1.87
780.5 ,Sleep disturbance,"Comorbidities, signs, and ill-defined...",18004,48,1.67,0.0009752603,1.23,2.22
575.0 ,Acute cholecystitis,Diseases of the digestive system,1877,5,1.66,0.2361116321,0.54,3.89
578.1 ,Blood in stool,Diseases of the digestive system,3387,9,1.66,0.1282333428,0.76,3.15
386.19 ,Other peripheral vertigo,Diseases of the nervous system,1872,5,1.66,0.2351486701,0.54,3.9
720.1 ,Spinal enthesopathy,Diseases of the musculoskeletal...,3013,8,1.66,0.1629460514,0.71,3.27
724.4 ,Thoracic or lumbosacral neuritis...,Diseases of the musculoskeletal...,6411,17,1.66,0.0420231082,0.96,2.66
594.2 ,Calculus in urethra,Diseases of the genitourinary...,3025,8,1.65,0.1641096333,0.71,3.26
682.8 ,Cellulitis and abscess of other...,Diseases of the skin and subcutaneous...,7550,20,1.65,0.0299880198,1.01,2.56
133.0 ,Scabies,Infectious and parasitic diseases,7565,20,1.65,0.0302925371,1.01,2.56
923.2 ,"Contusion of wrist and hand(s),...",Injury and poisoning,1897,5,1.64,0.240030263,0.53,3.85
011.90 ,"Pulmonary tuberculosis, unspecified,...",Infectious and parasitic diseases,4564,12,1.64,0.0923467396,0.85,2.87
728 ,"Disorders of muscle, ligament,...",Diseases of the musculoskeletal...,10745,28,1.63,0.0148865334,1.08,2.36
729.2 ,"Neuralgia, neuritis, and radiculitis,...",Diseases of the musculoskeletal...,51011,131,1.63,0.00000038166085,1.36,1.94
840.8 ,Sprains and strains of other specified...,Injury and poisoning,2675,7,1.63,0.2154698992,0.65,3.37
721.1 ,Cervical spondylosis with myelopathy,Diseases of the musculoskeletal...,5735,15,1.63,0.0665163337,0.91,2.7
726.10 ,Disorders of bursae and tendons...,Diseases of the musculoskeletal...,6874,18,1.63,0.0473784916,0.97,2.59
434.9 ,"Cerebral artery occlusion, unspecified",Diseases of the circulatory system,1925,5,1.62,0.2456907017,0.52,3.79
944.00 ,Burn of unspecified degree of...,Injury and poisoning,1931,5,1.61,0.2469293258,0.52,3.78
881.01 ,"Open wound of elbow, without mention...",Injury and poisoning,3480,9,1.61,0.1377200359,0.74,3.07
728.8 ,"Other disorders of muscle, ligament...",Diseases of the musculoskeletal...,3118,8,1.6,0.1740352832,0.69,3.16
382.00 ,Acute suppurative otitis media...,Diseases of the nervous system,6230,16,1.6,0.0774622061,0.91,2.61
682 ,Other cellulitis and abscess,Diseases of the skin and subcutaneous...,7429,19,1.6,0.0563212997,0.96,2.5
455.0 ,Internal hemorrhoids without mention...,Diseases of the circulatory system,8989,23,1.6,0.0330879027,1.01,2.4
110.2 ,Dermatophytosis of hand,Infectious and parasitic diseases,4718,12,1.59,0.1393780863,0.82,2.78
300.0 ,Anxiety states,Mental disorders,22134,56,1.59,0.0012546548,1.2,2.07
372.40 ,"Pterygium, unspecified",Diseases of the nervous system,5123,13,1.58,0.1111215128,0.84,2.71
583.9 ,"Nephritis and nephropathy, not...",Diseases of the genitourinary...,4746,12,1.58,0.1404999089,0.81,2.76
214.1 ,Lipoma of other skin and subcutaneous...,Neoplasms,2765,7,1.58,0.2252124986,0.63,3.26
216.7 ,Benign neoplasm of skin of lower...,Neoplasms,2360,6,1.58,0.2907808157,0.58,3.46
307.81 ,Tension headache,Mental disorders,19841,50,1.58,0.0023470083,1.17,2.09
354.0 ,Carpal tunnel syndrome,Diseases of the nervous system,8712,22,1.58,0.0424290102,0.99,2.39
370.21 ,Punctate keratitis,Diseases of the nervous system,29323,73,1.57,0.0003887262,1.22,1.98
600 ,Hyperplasia of prostate,Diseases of the genitourinary...,7555,19,1.57,0.0590697906,0.94,2.46
708 ,Urticaria,Diseases of the skin and subcutaneous...,9140,23,1.57,0.0355508411,0.99,2.36
478.4 ,Polyp of vocal cord or larynx,Diseases of the respiratory system,2785,7,1.57,0.2276236605,0.63,3.24
716 ,Other and unspecified arthropathies,Diseases of the musculoskeletal...,3969,10,1.57,0.1588230636,0.75,2.9
532.90 ,"Duodenal ulcer, unspecified as...",Diseases of the digestive system,22819,57,1.57,0.0014948328,1.18,2.04
786.51 ,Precordial pain,"Comorbidities, signs, and ill-defined...",5606,14,1.56,0.0947439304,0.85,2.62
530.2 ,Ulcer of esophagus,Diseases of the digestive system,6420,16,1.56,0.0837122553,0.89,2.53
532.70 ,Chronic duodenal ulcer without...,Diseases of the digestive system,12044,30,1.56,0.0215447344,1.05,2.23
353.1 ,Lumbosacral plexus lesions,Diseases of the nervous system,2002,5,1.56,0.2622337834,0.5,3.64
727.05 ,Other tenosynovitis of hand and...,Diseases of the musculoskeletal...,4435,11,1.55,0.1823320188,0.77,2.77
371.89 ,Other corneal disorders,Diseases of the nervous system,6448,16,1.55,0.0848551056,0.88,2.52
919.1 ,"Abrasion or friction burn of other,...",Injury and poisoning,2413,6,1.55,0.296466798,0.57,3.38
780.9 ,Other general symptoms,"Comorbidities, signs, and ill-defined...",11672,29,1.55,0.0263792799,1.04,2.24
930.0 ,Corneal foreign body,Injury and poisoning,117346,281,1.55,0.00000000005649908,1.36,1.75
949.0 ,"Burn of unspecified site, unspecified...",Injury and poisoning,7674,19,1.55,0.062422535,0.93,2.42
455.2 ,Internal hemorrhoids with other...,Diseases of the circulatory system,10495,26,1.55,0.0361438929,1.01,2.27
370.9 ,Unspecified keratitis,Diseases of the nervous system,7305,18,1.54,0.0766621287,0.91,2.44
788.1 ,Dysuria,"Comorbidities, signs, and ill-defined...",4872,12,1.54,0.1467707768,0.79,2.69
386.9 ,Unspecified vertiginous syndromes...,Diseases of the nervous system,9735,24,1.54,0.0412732825,0.98,2.3
629.9 ,Unspecified disorder of female...,Diseases of the genitourinary...,2429,6,1.54,0.2983331616,0.56,3.36
493.91 ,"Asthma, unspecified type, with...",Diseases of the respiratory system,3235,8,1.54,0.1886835474,0.66,3.05
723.2 ,Cervicocranial syndrome,Diseases of the musculoskeletal...,2425,6,1.54,0.2978602214,0.56,3.37
879.6 ,Open wound of other and unspecified...,Injury and poisoning,3246,8,1.54,0.2637680378,0.66,3.03
921.3 ,Contusion of eyeball,Injury and poisoning,4073,10,1.53,0.1675224485,0.73,2.82
300.00 ,"Anxiety state, unspecified",Mental disorders,50486,122,1.53,0.0000168088,1.26,1.83
300.9 ,Unspecified nonpsychotic mental...,Mental disorders,30326,74,1.53,0.0006363436,1.2,1.93
530.9 ,Unspecified disorder of esophagus,Diseases of the digestive system,4491,11,1.53,0.1849510023,0.76,2.74
533.40 ,Chronic or unspecified peptic...,Diseases of the digestive system,6942,17,1.53,0.0951643774,0.89,2.45
535.10 ,"Atrophic gastritis, without mention...",Diseases of the digestive system,2450,6,1.53,0.3008845134,0.56,3.33
371.42 ,Recurrent erosion of cornea,Diseases of the nervous system,3291,8,1.52,0.2668452798,0.65,2.99
371.8 ,Other corneal disorders,Diseases of the nervous system,2052,5,1.52,0.2736747864,0.49,3.55
215.0 ,Other benign neoplasm of connective...,Neoplasms,4098,10,1.52,0.1698429928,0.73,2.8
848 ,Other and ill-defined sprains...,Injury and poisoning,2869,7,1.52,0.2386674993,0.61,3.14
721 ,Spondylosis and allied disorders,Diseases of the musculoskeletal...,3280,8,1.52,0.2660530644,0.66,3
272.9 ,Unspecified disorder of lipoid...,"Endocrine, nutritional and metabolic...",5789,14,1.51,0.1348615193,0.82,2.54
531 ,Gastric ulcer,Diseases of the digestive system,7828,19,1.51,0.0865947553,0.91,2.37
723.0 ,Spinal stenosis in cervical region,Diseases of the musculoskeletal...,3333,8,1.5,0.2701029338,0.64,2.96
780.4 ,Dizziness and giddiness,"Comorbidities, signs, and ill-defined...",119253,276,1.49,0.0000000023242664,1.31,1.69
923 ,Contusion of upper limb,Injury and poisoning,3337,8,1.49,0.2704321461,0.64,2.95
455.5 ,External hemorrhoids with other...,Diseases of the circulatory system,3341,8,1.49,0.2707646119,0.64,2.95
280.9 ,"Iron deficiency anemia, unspecified",Diseases of the blood and blood-forming...,2924,7,1.49,0.2466577017,0.6,3.08
873 ,Other open wound of head,Injury and poisoning,6297,15,1.49,0.151526998,0.83,2.46
722.73 ,Intervertebral disc disorder with...,Diseases of the musculoskeletal...,5879,14,1.49,0.1394392019,0.81,2.5
787.0 ,Nausea and vomiting,"Comorbidities, signs, and ill-defined...",34333,81,1.48,0.0008347358,1.17,1.85
519.8 ,Other diseases of respiratory...,Diseases of the respiratory system,2954,7,1.48,0.2512538762,0.59,3.05
529.0 ,Glossitis,Diseases of the digestive system,2527,6,1.48,0.3111822235,0.54,3.23
370 ,Keratitis,Diseases of the nervous system,2964,7,1.47,0.2528219031,0.59,3.04
447.6 ,"Arteritis, unspecified",Diseases of the circulatory system,3827,9,1.47,0.2236049904,0.67,2.79
274.0 ,"Gouty arthropathy, unspecified","Endocrine, nutritional and metabolic...",85130,197,1.47,0.00000065618178,1.27,1.7
372.02 ,Acute follicular conjunctivitis,Diseases of the nervous system,7698,18,1.46,0.1145191997,0.86,2.31
009.3 ,Diarrhea of presumed infectious...,Infectious and parasitic diseases,13241,31,1.46,0.0384024084,0.99,2.08
005.9 ,"Food poisoning, unspecified",Infectious and parasitic diseases,2152,5,1.45,0.4065868953,0.47,3.39
683 ,Acute lymphadenitis,Diseases of the skin and subcutaneous...,3865,9,1.45,0.2278790966,0.66,2.76
840 ,Sprains and strains of shoulder...,Injury and poisoning,2150,5,1.45,0.4063331305,0.47,3.39
282.4 ,Thalassemias,Diseases of the blood and blood-forming...,3012,7,1.45,0.3529479549,0.58,2.99
726.9 ,Unspecified enthesopathy,Diseases of the musculoskeletal...,6014,14,1.45,0.1921683148,0.79,2.44
786.50 ,"Chest pain, unspecified","Comorbidities, signs, and ill-defined...",51375,117,1.44,0.0002673646,1.18,1.73
455.4 ,External thrombosed hemorrhoids,Diseases of the circulatory system,2160,5,1.44,0.4076129776,0.47,3.37
727.03 ,Trigger finger (acquired),Diseases of the musculoskeletal...,2610,6,1.43,0.3238156797,0.52,3.13
682.0 ,Cellulitis and abscess of face,Diseases of the skin and subcutaneous...,5245,12,1.43,0.221988279,0.74,2.5
959.9 ,Unspecified site injury,Injury and poisoning,2630,6,1.42,0.3270785489,0.52,3.1
686.9 ,Unspecified local infection of...,Diseases of the skin and subcutaneous...,91052,203,1.42,0.0000051297313,1.22,1.64
473.8 ,Other chronic sinusitis,Diseases of the respiratory system,3065,7,1.42,0.3574253501,0.57,2.94
242.90 ,Thyrotoxicosis without mention...,"Endocrine, nutritional and metabolic...",7034,16,1.42,0.175558048,0.81,2.31
478.9 ,Other and unspecified diseases...,Diseases of the respiratory system,14125,32,1.42,0.0567321471,0.97,2
555.2 ,Regional enteritis of small intestine...,Diseases of the digestive system,4835,11,1.42,0.2745853355,0.71,2.54
893.1 ,"Open wound of toe(s), complicated",Injury and poisoning,2204,5,1.41,0.4135628009,0.46,3.31
573.8 ,Other specified disorders of liver,Diseases of the digestive system,4432,10,1.41,0.2569680705,0.67,2.59
995.3 ,"Allergy, unspecified, not elsewhere...",Injury and poisoning,13702,31,1.41,0.0671764517,0.96,2.01
216.4 ,Benign neoplasm of scalp and skin...,Neoplasms,2650,6,1.41,0.3304213137,0.52,3.08
487.0 ,Influenza with pneumonia,Diseases of the respiratory system,3967,9,1.41,0.3137379015,0.65,2.69
840.4 ,Rotator cuff (capsule) sprain,Injury and poisoning,2214,5,1.41,0.4149849498,0.46,3.29
840.9 ,Sprains and strains of unspecified...,Injury and poisoning,12366,28,1.41,0.0709423994,0.94,2.05
519.9 ,Unspecified disease of respiratory...,Diseases of the respiratory system,5317,12,1.41,0.2266837575,0.73,2.46
883.1 ,"Open wound of finger(s), complicated",Injury and poisoning,11483,26,1.41,0.0793947155,0.92,2.08
783.2 ,Abnormal loss of weight,"Comorbidities, signs, and ill-defined...",4449,10,1.4,0.2585333343,0.67,2.58
786.1 ,Stridor,"Comorbidities, signs, and ill-defined...",2225,5,1.4,0.4165781574,0.45,3.28
428.0 ,"Congestive heart failure, unspecified",Diseases of the circulatory system,2668,6,1.4,0.3334961111,0.51,3.06
431 ,Intracerebral hemorrhage,Diseases of the circulatory system,3118,7,1.4,0.3625118671,0.56,2.89
276.5 ,Volume depletion,"Endocrine, nutritional and metabolic...",7592,17,1.4,0.1923983103,0.81,2.24
716.9 ,"Arthropathy, unspecified",Diseases of the musculoskeletal...,15156,34,1.4,0.0528658813,0.97,1.96
722.10 ,Displacement of lumbar intervertebral...,Diseases of the musculoskeletal...,26391,59,1.4,0.0130686781,1.06,1.81
573.3 ,"Hepatitis, unspecified",Diseases of the digestive system,28311,63,1.39,0.0132333906,1.07,1.79
786.09 ,Other respiratory abnormalities,"Comorbidities, signs, and ill-defined...",8057,18,1.39,0.1610360864,0.82,2.21
491.20 ,Obstructive chronic bronchitis...,Diseases of the respiratory system,4025,9,1.39,0.3179415159,0.64,2.65
721.90 ,"Spondylosis of unspecified site,...",Diseases of the musculoskeletal...,8982,20,1.39,0.1444168225,0.85,2.15
722.93 ,"Other and unspecified disc disorder,...",Diseases of the musculoskeletal...,8983,20,1.39,0.1444525223,0.85,2.15
724.5 ,"Backache, unspecified",Diseases of the musculoskeletal...,122384,266,1.39,0.00000097863352,1.22,1.58
356.9 ,Unspecified hereditary and idiopathic...,Diseases of the nervous system,6283,14,1.39,0.2052259254,0.76,2.34
787.3 ,"Flatulence, eructation, and gas...","Comorbidities, signs, and ill-defined...",38293,84,1.38,0.0054352628,1.09,1.71
599.9 ,Unspecified disorder of urethra...,Diseases of the genitourinary...,9523,21,1.38,0.1555418497,0.85,2.11
692.1 ,Contact dermatitis and other eczema...,Diseases of the skin and subcutaneous...,2256,5,1.38,0.4212259296,0.45,3.23
478 ,Other diseases of upper respiratory...,Diseases of the respiratory system,4054,9,1.38,0.3202589302,0.63,2.63
709.8 ,Other specified disorders of skin,Diseases of the skin and subcutaneous...,11800,26,1.38,0.105822799,0.9,2.02
523.9 ,Unspecified gingival and periodontal...,Diseases of the digestive system,5429,12,1.38,0.2352558578,0.71,2.41
533.90 ,"Peptic ulcer of unspecified site,...",Diseases of the digestive system,85935,187,1.38,0.0000468151,1.18,1.6
918.1 ,Superficial injury of cornea,Injury and poisoning,32079,70,1.37,0.0135134074,1.06,1.73
380.13 ,Other acute infections of external...,Diseases of the nervous system,2272,5,1.37,0.4237128974,0.44,3.21
437.9 ,Unspecified cerebrovascular disease,Diseases of the circulatory system,2726,6,1.37,0.4637008028,0.5,2.99
692.79 ,Other dermatitis due to solar...,Diseases of the skin and subcutaneous...,6382,14,1.37,0.2685444764,0.75,2.3
696.3 ,Pityriasis rosea,Diseases of the skin and subcutaneous...,5442,12,1.37,0.2363472734,0.71,2.41
698.9 ,Unspecified pruritic disorder,Diseases of the skin and subcutaneous...,37534,82,1.37,0.007391652,1.09,1.71
842.09 ,Other sprains and strains of wrist,Injury and poisoning,4088,9,1.37,0.3231533464,0.63,2.61
571 ,Chronic liver disease and cirrhosis,Diseases of the digestive system,9643,21,1.36,0.1593996543,0.84,2.08
367.53 ,Spasm of accommodation,Diseases of the nervous system,3686,8,1.35,0.40298119,0.58,2.67
783.0 ,Anorexia,"Comorbidities, signs, and ill-defined...",1872,4,1.33,0.5521819093,0.36,3.42
787.7 ,Abnormal feces,"Comorbidities, signs, and ill-defined...",4690,10,1.33,0.3563701843,0.64,2.45
427.0 ,Paroxysmal supraventricular tachycardia,Diseases of the circulatory system,2340,5,1.33,0.4349068178,0.43,3.11
077.1 ,Epidemic keratoconjunctivitis,Infectious and parasitic diseases,25402,54,1.33,0.0478246801,1,1.74
486 ,"Pneumonia, organism unspecified",Diseases of the respiratory system,23424,50,1.33,0.0482190602,0.99,1.77
285.9 ,"Anemia, unspecified",Diseases of the blood and blood-forming...,12185,26,1.33,0.1399835003,0.87,1.96
844.0 ,Sprain of lateral collateral ligament...,Injury and poisoning,1872,4,1.33,0.5521819093,0.36,3.42
306.9 ,Unspecified psychophysiological...,Mental disorders,13627,29,1.33,0.1315818781,0.89,1.91
726.11 ,Calcifying tendinitis of shoulder,Diseases of the musculoskeletal...,1866,4,1.33,0.551454835,0.36,3.43
989.5 ,Toxic effect of venom,Injury and poisoning,5680,12,1.32,0.316744371,0.68,2.31
464.21 ,Acute laryngotracheitis with obstruction,Diseases of the respiratory system,5191,11,1.32,0.3803358991,0.66,2.37
306.8 ,Other specified psychophysiological...,Mental disorders,3315,7,1.32,0.3862112198,0.53,2.72
535.51 ,"Unspecified gastritis and gastroduodenitis,...",Diseases of the digestive system,1890,4,1.32,0.5544177648,0.36,3.38
729.6 ,Residual foreign body in soft...,Diseases of the musculoskeletal...,1906,4,1.31,0.5564721286,0.36,3.36
215.9 ,Other benign neoplasm of connective...,Neoplasms,5221,11,1.31,0.3817079715,0.65,2.35
714.0 ,Rheumatoid arthritis,Diseases of the musculoskeletal...,9027,19,1.31,0.2335242867,0.79,2.05
274.9 ,"Gout, unspecified","Endocrine, nutritional and metabolic...",86931,180,1.31,0.0006968757,1.12,1.52
719.41 ,"Pain in joint, shoulder region",Diseases of the musculoskeletal...,7149,15,1.31,0.2969218356,0.73,2.16
560.9 ,Unspecified intestinal obstruction,Diseases of the digestive system,3358,7,1.3,0.5108481829,0.52,2.68
564.0 ,Constipation,Diseases of the digestive system,46251,96,1.3,0.0133464426,1.05,1.6
372.20 ,"Blepharoconjunctivitis, unspecified",Diseases of the nervous system,8156,17,1.3,0.265938349,0.76,2.09
692.89 ,Contact dermatitis and other eczema...,Diseases of the skin and subcutaneous...,18724,39,1.3,0.1175545222,0.92,1.78
708.0 ,Allergic urticaria,Diseases of the skin and subcutaneous...,39469,82,1.3,0.0219137067,1.03,1.62
847.2 ,Sprain of lumbar,Injury and poisoning,47972,99,1.3,0.0150017847,1.05,1.58
724.3 ,Sciatica,Diseases of the musculoskeletal...,47627,99,1.3,0.0124471359,1.06,1.6
913 ,"Superficial ilnjury of elbow,...",Injury and poisoning,1929,4,1.29,0.5595313251,0.35,3.31
571.9 ,Unspecified chronic liver disease...,Diseases of the digestive system,21303,44,1.29,0.1010683384,0.93,1.74
586 ,"Renal failure, unspecified",Diseases of the genitourinary...,2407,5,1.29,0.4468334767,0.42,3.03
110.0 ,Dermatophytosis of scalp and beard,Infectious and parasitic diseases,2415,5,1.29,0.4483114874,0.42,3.02
491.0 ,Simple chronic bronchitis,Diseases of the respiratory system,9178,19,1.29,0.2402849981,0.78,2.02
300.02 ,Generalized anxiety disorder,Mental disorders,9199,19,1.29,0.2933654429,0.77,2.02
719.99 ,"Unspecified disorder of joint,...",Diseases of the musculoskeletal...,2887,6,1.29,0.4790504582,0.47,2.82
535.50 ,"Unspecified gastritis and gastroduodenitis,...",Diseases of the digestive system,133130,270,1.29,0.0001180207,1.13,1.46
737.30 ,"Scoliosis [and kyphoscoliosis],...",Diseases of the musculoskeletal...,1952,4,1.28,0.562710138,0.35,3.28
785.1 ,Palpitations,"Comorbidities, signs, and ill-defined...",19584,40,1.28,0.1267535589,0.91,1.74
429.9 ,"Heart disease, unspecified",Diseases of the circulatory system,4877,10,1.28,0.3719855239,0.61,2.35
070.9 ,Unspecified viral hepatitis without...,Infectious and parasitic diseases,11667,24,1.28,0.2437292836,0.82,1.91
708.8 ,Other specified urticaria,Diseases of the skin and subcutaneous...,12141,25,1.28,0.2096269694,0.83,1.9
843.9 ,Sprains and strains of unspecified...,Injury and poisoning,4853,10,1.28,0.3697212701,0.61,2.37
844.1 ,Sprain of medial collateral ligament...,Injury and poisoning,1953,4,1.28,0.5628509678,0.35,3.27
530.1 ,Esophagitis,Diseases of the digestive system,33123,68,1.28,0.0444213891,0.99,1.63
723.3 ,Cervicobrachial syndrome (diffuse),Diseases of the musculoskeletal...,3884,8,1.28,0.4201797321,0.55,2.53
709.2 ,Scar conditions and fibrosis of...,Diseases of the skin and subcutaneous...,3432,7,1.27,0.5157369446,0.51,2.62
847.9 ,Sprain of unspecified site of...,Injury and poisoning,9821,20,1.27,0.3093444303,0.77,1.97
720.0 ,Ankylosing spondylitis,Diseases of the musculoskeletal...,10290,21,1.27,0.2647146057,0.79,1.95
