922.3 ,Contusion of back,Injury and poisoning,14366,35,2.04,0.0001453393,1.41,2.84
702.1 ,Seborrheic keratosis,Diseases of the skin and subcutaneous...,2045,5,2.03,0.1046331536,0.66,4.75
842.09 ,Other sprains and strains of wrist,Injury and poisoning,4088,10,2.03,0.0364899078,0.97,3.75
717.9 ,Unspecified internal derangement...,Diseases of the musculoskeletal...,3277,8,2.03,0.0673974715,0.87,4.01
873.1 ,"Open wound of scalp, complicated",Injury and poisoning,2470,6,2.02,0.082002341,0.74,4.4
882.0 ,Open wound of hand except finger(s)...,Injury and poisoning,33493,80,2.02,0.000000026952682,1.59,2.53
727.9 ,"Unspecified disorder of synovium,...",Diseases of the musculoskeletal...,4939,12,2.02,0.0216448946,1.04,3.54
719.99 ,"Unspecified disorder of joint,...",Diseases of the musculoskeletal...,2887,7,2.01,0.0944651679,0.81,4.16
873.42 ,"Open wound of forehead, without...",Injury and poisoning,6609,16,2.01,0.0109412012,1.15,3.28
923.11 ,Contusion of elbow,Injury and poisoning,4538,11,2.01,0.028604721,1,3.62
723.8 ,Other syndromes affecting cervical...,Diseases of the musculoskeletal...,2074,5,2,0.1092771586,0.65,4.68
870.0 ,Laceration of skin of eyelid and...,Injury and poisoning,5039,12,1.98,0.0241165328,1.02,3.47
873 ,Other open wound of head,Injury and poisoning,6297,15,1.98,0.0155470657,1.11,3.28
386.00 ,"Minihre's disease, unspecified",Diseases of the nervous system,7581,18,1.98,0.0071999184,1.17,3.13
681.02 ,Onychia and paronychia of finger,Diseases of the skin and subcutaneous...,3790,9,1.97,0.053891087,0.9,3.76
242.00 ,Toxic diffuse goiter without mention...,"Endocrine, nutritional and metabolic...",2946,7,1.97,0.0979421972,0.79,4.08
680.2 ,Carbuncle and furuncle of trunk,Diseases of the skin and subcutaneous...,2128,5,1.95,0.1181856685,0.63,4.56
070 ,Viral hepatitis,Infectious and parasitic diseases,4258,10,1.95,0.0428245909,0.93,3.6
496 ,"Chronic airway obstruction, not...",Diseases of the respiratory system,10715,25,1.95,0.0028753201,1.26,2.88
110.2 ,Dermatophytosis of hand,Infectious and parasitic diseases,4718,11,1.94,0.0344306869,0.96,3.48
721.42 ,"Spondylosis with myelopathy, lumbar...",Diseases of the musculoskeletal...,3418,8,1.94,0.0748657495,0.84,3.84
873.43 ,"Open wound of lip, without mention...",Injury and poisoning,2567,6,1.94,0.1389650555,0.71,4.24
389.9 ,Unspecified hearing loss,Diseases of the nervous system,7337,17,1.93,0.0108616616,1.12,3.1
682.3 ,Cellulitis and abscess of upper...,Diseases of the skin and subcutaneous...,2146,5,1.93,0.12122915,0.63,4.53
840 ,Sprains and strains of shoulder...,Injury and poisoning,2150,5,1.93,0.1219104221,0.63,4.52
720.9 ,Unspecified inflammatory spondylopathy,Diseases of the musculoskeletal...,2146,5,1.93,0.12122915,0.63,4.53
923.21 ,Contusion of wrist,Injury and poisoning,4329,10,1.92,0.0459205834,0.92,3.54
380.23 ,Other chronic otitis externa,Diseases of the nervous system,3455,8,1.92,0.077123714,0.83,3.8
840.9 ,Sprains and strains of unspecified...,Injury and poisoning,12366,28,1.89,0.0024105085,1.25,2.74
880.03 ,"Open wound of upper arm, without...",Injury and poisoning,3956,9,1.89,0.062608864,0.86,3.6
692.5 ,Contact dermatitis and other eczema...,Diseases of the skin and subcutaneous...,3531,8,1.88,0.0821433751,0.81,3.72
216.4 ,Benign neoplasm of scalp and skin...,Neoplasms,2650,6,1.88,0.1457817413,0.69,4.1
296.30 ,"Major depressive affective disorder,...",Mental disorders,2205,5,1.88,0.2009354099,0.61,4.4
303 ,Alcohol dependence syndrome,Mental disorders,2209,5,1.88,0.2013070326,0.61,4.4
531.9 ,"Gastric ulcer, unspecified as...",Diseases of the digestive system,3978,9,1.88,0.0639054155,0.86,3.58
782.4 ,"Jaundice, unspecified, not of...","Comorbidities, signs, and ill-defined...",3095,7,1.88,0.1085919245,0.75,3.88
428.0 ,"Congestive heart failure, unspecified",Diseases of the circulatory system,2668,6,1.87,0.1474014317,0.68,4.07
716.9 ,"Arthropathy, unspecified",Diseases of the musculoskeletal...,15156,34,1.87,0.0008596265,1.29,2.63
355.0 ,Lesion of sciatic nerve,Diseases of the nervous system,2219,5,1.87,0.2022506431,0.61,4.38
724.8 ,Other symptoms referable to back,Diseases of the musculoskeletal...,2214,5,1.87,0.2017762465,0.61,4.39
910.0 ,"Abrasion or friction burn of face,...",Injury and poisoning,10266,23,1.87,0.0059711729,1.18,2.81
692.8 ,"Contact dermatitis and other eczema,...",Diseases of the skin and subcutaneous...,4018,9,1.86,0.0663470705,0.85,3.54
727.0 ,Synovitis and tenosynovitis,Diseases of the musculoskeletal...,12111,27,1.86,0.0033766252,1.22,2.71
300.00 ,"Anxiety state, unspecified",Mental disorders,50486,110,1.85,0.0000000077156266,1.51,2.24
355.9 ,Mononeuritis of unspecified site,Diseases of the nervous system,2246,5,1.85,0.2049008621,0.6,4.32
788.9 ,Other symptoms involving urinary...,"Comorbidities, signs, and ill-defined...",2711,6,1.84,0.1514679804,0.67,4.01
692.1 ,Contact dermatitis and other eczema...,Diseases of the skin and subcutaneous...,2256,5,1.84,0.2059197921,0.6,4.3
723.4 ,"Brachial neuritis or radiculitis,...",Diseases of the musculoskeletal...,4955,11,1.84,0.0590998004,0.92,3.31
949.0 ,"Burn of unspecified site, unspecified...",Injury and poisoning,7674,17,1.84,0.0190572319,1.07,2.96
698.1 ,Pruritus of genital organs,Diseases of the skin and subcutaneous...,2280,5,1.82,0.2084459688,0.59,4.26
300.4 ,Dysthymic disorder,Mental disorders,25873,56,1.82,0.0000609826,1.37,2.37
533.70 ,Chronic peptic ulcer of unspecified...,Diseases of the digestive system,13767,30,1.82,0.0027453873,1.22,2.6
914.0 ,Abrasion or friction burn of hand(s)...,Injury and poisoning,6384,14,1.82,0.0430901949,0.99,3.07
571.0 ,Alcoholic fatty liver,Diseases of the digestive system,5024,11,1.82,0.0613833933,0.91,3.26
464.30 ,Acute epiglottitis without mention...,Diseases of the respiratory system,5500,12,1.81,0.0483507008,0.93,3.18
229.8 ,Benign neoplasm of other specified...,Neoplasms,5494,12,1.81,0.0481520174,0.94,3.18
726.10 ,Disorders of bursae and tendons...,Diseases of the musculoskeletal...,6874,15,1.81,0.0333947343,1.01,3
721.3 ,Lumbosacral spondylosis without...,Diseases of the musculoskeletal...,31840,68,1.8,0.0000131352,1.39,2.29
927.20 ,Crushing injury of hand(s),Injury and poisoning,3226,7,1.8,0.1200608494,0.72,3.72
578.9 ,Hemorrhage of gastrointestinal...,Diseases of the digestive system,16316,35,1.79,0.0013989817,1.24,2.5
726.11 ,Calcifying tendinitis of shoulder,Diseases of the musculoskeletal...,1866,4,1.78,0.2959013367,0.48,4.57
379.90 ,"Disorder of eye, unspecified",Diseases of the nervous system,2789,6,1.78,0.1595312099,0.65,3.9
924.3 ,Contusion of toe,Injury and poisoning,2790,6,1.78,0.1596401625,0.65,3.9
216.7 ,Benign neoplasm of skin of lower...,Neoplasms,2360,5,1.76,0.2176584185,0.57,4.11
721.90 ,"Spondylosis of unspecified site,...",Diseases of the musculoskeletal...,8982,19,1.76,0.0207087494,1.06,2.76
722.93 ,"Other and unspecified disc disorder,...",Diseases of the musculoskeletal...,8983,19,1.76,0.0207195074,1.06,2.76
215.9 ,Other benign neoplasm of connective...,Neoplasms,5221,11,1.75,0.069416061,0.87,3.14
272.1 ,Pure hyperglyceridemia,"Endocrine, nutritional and metabolic...",10480,22,1.75,0.0151304488,1.09,2.65
582.9 ,Chronic glomerulonephritis with...,Diseases of the genitourinary...,8073,17,1.75,0.033912268,1.02,2.81
608 ,Other disorders of male genital...,Diseases of the genitourinary...,3348,7,1.73,0.1324050718,0.7,3.59
879.9 ,Open wound(s) (multiple) of unspecified...,Injury and poisoning,1918,4,1.73,0.3022366734,0.47,4.44
581.9 ,Nephrotic syndrome with unspecified...,Diseases of the genitourinary...,2876,6,1.73,0.1695165904,0.63,3.78
434.9 ,"Cerebral artery occlusion, unspecified",Diseases of the circulatory system,1925,4,1.72,0.3031385391,0.47,4.43
780.5 ,Sleep disturbance,"Comorbidities, signs, and ill-defined...",18004,37,1.72,0.002327119,1.2,2.37
586 ,"Renal failure, unspecified",Diseases of the genitourinary...,2407,5,1.72,0.2236093285,0.56,4.03
927.3 ,Crushing injury of finger(s),Injury and poisoning,10615,22,1.72,0.0161004078,1.08,2.62
844.1 ,Sprain of medial collateral ligament...,Injury and poisoning,1953,4,1.7,0.3068574496,0.46,4.36
531 ,Gastric ulcer,Diseases of the digestive system,7828,16,1.7,0.047039553,0.97,2.77
367.4 ,Presbyopia,Diseases of the nervous system,2928,6,1.7,0.1759566167,0.62,3.71
295.9 ,Unspecified schizophrenia,Mental disorders,1966,4,1.69,0.3086432533,0.46,4.33
535.4 ,Other specified gastritis,Diseases of the digestive system,7377,15,1.69,0.0605692918,0.94,2.8
573.3 ,"Hepatitis, unspecified",Diseases of the digestive system,28311,57,1.69,0.0002671798,1.27,2.2
386.10 ,"Peripheral vertigo, unspecified",Diseases of the nervous system,5895,12,1.69,0.0853693917,0.87,2.96
215 ,Other benign neoplasm of connective...,Neoplasms,1980,4,1.68,0.3106072229,0.46,4.3
558.1 ,Gastroenteritis and colitis due...,Diseases of the digestive system,1977,4,1.68,0.3101828547,0.46,4.31
560.1 ,Paralytic ileus,Diseases of the digestive system,2970,6,1.68,0.1814032914,0.61,3.66
727.09 ,Other synovitis and tenosynovitis,Diseases of the musculoskeletal...,4928,10,1.68,0.0981994425,0.81,3.11
781.9 ,Other symptoms involving nervous...,"Comorbidities, signs, and ill-defined...",5937,12,1.68,0.0868303607,0.87,2.94
959.4 ,"Hand, except finger injury",Injury and poisoning,1987,4,1.67,0.3116047958,0.45,4.29
402.9 ,Hypertensive heart disease unspecified,Diseases of the circulatory system,3479,7,1.67,0.2099782684,0.67,3.45
239.2 ,Neoplasm of unspecified nature...,Neoplasms,3984,8,1.67,0.1611351195,0.72,3.29
716 ,Other and unspecified arthropathies,Diseases of the musculoskeletal...,3969,8,1.67,0.1601086328,0.72,3.31
153.9 ,"Malignant neoplasm of colon, unspecified...",Neoplasms,2503,5,1.66,0.2369047568,0.54,3.88
882.2 ,Open wound of hand except finger(s)...,Injury and poisoning,2503,5,1.66,0.2369047568,0.54,3.88
600 ,Hyperplasia of prostate,Diseases of the genitourinary...,7555,15,1.65,0.064396786,0.92,2.73
607.84 ,Impotence of organic origin,Diseases of the genitourinary...,7038,14,1.65,0.0807756309,0.9,2.78
873.4 ,"Facial laceration, without mention...",Injury and poisoning,13153,26,1.65,0.0159643424,1.07,2.42
569.3 ,Hemorrhage of rectum and anus,Diseases of the digestive system,6548,13,1.65,0.0736585285,0.88,2.83
995.3 ,"Allergy, unspecified, not elsewhere...",Injury and poisoning,13702,27,1.64,0.017799394,1.08,2.4
464.11 ,Acute tracheitis with obstruction,Diseases of the respiratory system,11169,22,1.64,0.0275064088,1.02,2.49
706.3 ,Seborrhea,Diseases of the skin and subcutaneous...,11657,23,1.64,0.022429029,1.04,2.47
478 ,Other diseases of upper respiratory...,Diseases of the respiratory system,4054,8,1.64,0.1662478442,0.71,3.24
722.2 ,Displacement of intervertebral...,Diseases of the musculoskeletal...,15731,31,1.64,0.0104551078,1.11,2.34
533.30 ,Acute peptic ulcer of unspecified...,Diseases of the digestive system,8115,16,1.64,0.0534966745,0.93,2.67
729.1 ,"Myalgia and myositis, unspecified",Diseases of the musculoskeletal...,136853,258,1.64,0.000000000002381413,1.43,1.87
070.3 ,Viral hepatitis B without mention...,Infectious and parasitic diseases,6637,13,1.63,0.1056695353,0.86,2.79
386.9 ,Unspecified vertiginous syndromes...,Diseases of the nervous system,9735,19,1.62,0.0399672777,0.97,2.54
307.40 ,"Nonorganic sleep disorder, unspecified",Mental disorders,3593,7,1.62,0.2179896387,0.65,3.34
371.8 ,Other corneal disorders,Diseases of the nervous system,2052,4,1.62,0.3213422978,0.44,4.15
571.41 ,Chronic persistent hepatitis,Diseases of the digestive system,11282,22,1.62,0.028880368,1.01,2.46
785.1 ,Palpitations,"Comorbidities, signs, and ill-defined...",19584,38,1.62,0.0050511322,1.14,2.23
719.49 ,"Pain in joint, multiple sites",Diseases of the musculoskeletal...,8781,17,1.61,0.0616290331,0.93,2.58
780.8 ,Generalized hyperhidrosis,"Comorbidities, signs, and ill-defined...",3089,6,1.61,0.2871352116,0.59,3.52
931 ,Foreign body in ear,Injury and poisoning,7223,14,1.61,0.0857950051,0.88,2.71
596.5 ,Other functional disorders of...,Diseases of the genitourinary...,6699,13,1.61,0.1072963832,0.86,2.76
693.0 ,Dermatitis due to drugs and medicines...,Diseases of the skin and subcutaneous...,5691,11,1.6,0.1216712887,0.8,2.88
842.10 ,"Sprain of hand, unspecified site",Injury and poisoning,2593,5,1.6,0.2506377328,0.52,3.74
300.9 ,Unspecified nonpsychotic mental...,Mental disorders,30326,58,1.6,0.0008134143,1.21,2.08
728.8 ,"Other disorders of muscle, ligament...",Diseases of the musculoskeletal...,3118,6,1.6,0.2891373862,0.58,3.48
565.1 ,Anal fistula,Diseases of the digestive system,7268,14,1.6,0.0872708728,0.87,2.69
959.5 ,Finger injury,Injury and poisoning,2080,4,1.59,0.3257869038,0.43,4.09
438 ,Late effects of cerebrovascular...,Diseases of the circulatory system,2082,4,1.59,0.3261098363,0.43,4.09
700 ,Corns and callosities,Diseases of the skin and subcutaneous...,7328,14,1.59,0.089391793,0.87,2.67
881.02 ,"Open wound of wrist, without mention...",Injury and poisoning,3134,6,1.59,0.2903011736,0.58,3.47
566 ,Abscess of anal and rectal regions,Diseases of the digestive system,6795,13,1.59,0.1102723331,0.84,2.72
686.8 ,Other specified local infections...,Diseases of the skin and subcutaneous...,38696,73,1.58,0.000270455,1.24,2
524.60 ,"Temporomandibular joint disorders,...",Diseases of the digestive system,2625,5,1.58,0.2557903911,0.51,3.7
372.12 ,Chronic follicular conjunctivitis,Diseases of the nervous system,2625,5,1.58,0.2557903911,0.51,3.7
401 ,Essential hypertension,Diseases of the circulatory system,9006,17,1.57,0.0671709665,0.91,2.52
702.8 ,Other specified dermatoses,Diseases of the skin and subcutaneous...,4764,9,1.57,0.2015295281,0.72,2.98
533.90 ,"Peptic ulcer of unspecified site,...",Diseases of the digestive system,85935,158,1.57,0.00000032339906,1.32,1.84
882.1 ,Open wound of hand except finger(s)...,Injury and poisoning,4760,9,1.57,0.2013269305,0.72,2.99
928.3 ,Crushing injury of toe(s),Injury and poisoning,2107,4,1.57,0.3302060133,0.43,4.04
692.79 ,Other dermatitis due to solar...,Diseases of the skin and subcutaneous...,6382,12,1.56,0.1426654686,0.8,2.73
698.8 ,Other specified pruritic conditions,Diseases of the skin and subcutaneous...,9056,17,1.56,0.0686367825,0.91,2.5
250.0 ,Diabetes Mellitus w/m of complication,"Endocrine, nutritional and metabolic...",9027,17,1.56,0.0677762751,0.91,2.51
692.70 ,Unspecified dermatitis due to...,Diseases of the skin and subcutaneous...,2677,5,1.55,0.2644427164,0.5,3.62
473.0 ,Chronic maxillary sinusitis,Diseases of the respiratory system,3756,7,1.55,0.232377665,0.62,3.19
709.8 ,Other specified disorders of skin,Diseases of the skin and subcutaneous...,11800,22,1.55,0.0453361021,0.97,2.35
724.3 ,Sciatica,Diseases of the musculoskeletal...,47627,88,1.55,0.0001294029,1.24,1.92
728 ,"Disorders of muscle, ligament,...",Diseases of the musculoskeletal...,10745,20,1.55,0.0673149398,0.94,2.4
729.4 ,"Fasciitis, unspecified",Diseases of the musculoskeletal...,72066,132,1.55,0.0000038580713,1.29,1.85
573.9 ,Unspecified disorder of liver,Diseases of the digestive system,11276,21,1.55,0.0549181778,0.96,2.37
682.4 ,"Cellulitis and abscess of hand,...",Diseases of the skin and subcutaneous...,2690,5,1.54,0.2666574254,0.5,3.61
692.4 ,Contact dermatitis and other eczema...,Diseases of the skin and subcutaneous...,17330,32,1.54,0.0203571129,1.05,2.18
721.0 ,Cervical spondylosis without myelopathy,Diseases of the musculoskeletal...,16755,31,1.54,0.0243123904,1.04,2.19
681.9 ,Cellulitis and abscess of unspecified...,Diseases of the skin and subcutaneous...,7609,14,1.53,0.1317121482,0.83,2.57
780 ,General symptoms,"Comorbidities, signs, and ill-defined...",3788,7,1.53,0.2355785337,0.61,3.17
680.8 ,Carbuncle and furuncle of other...,Diseases of the skin and subcutaneous...,3271,6,1.52,0.3019017594,0.56,3.32
427.89 ,Other specified cardiac dysrhythmias,Diseases of the circulatory system,3825,7,1.52,0.2394245014,0.61,3.14
211.3 ,Benign neoplasm of colon,Neoplasms,3275,6,1.52,0.3022824798,0.56,3.32
722.10 ,Displacement of lumbar intervertebral...,Diseases of the musculoskeletal...,26391,48,1.52,0.0070495577,1.12,2.02
880 ,Open wound of shoulder and upper...,Injury and poisoning,2188,4,1.52,0.3441882039,0.41,3.89
274 ,Gout,"Endocrine, nutritional and metabolic...",20390,37,1.51,0.018882909,1.06,2.09
009 ,Ill-defined intestinal infections,Infectious and parasitic diseases,4990,9,1.5,0.2155859402,0.68,2.85
110.1 ,Dermatophytosis of nail,Infectious and parasitic diseases,36238,65,1.5,0.0021482066,1.15,1.92
214.1 ,Lipoma of other skin and subcutaneous...,Neoplasms,2765,5,1.5,0.3979597403,0.49,3.51
884 ,Multiple and unspecified open...,Injury and poisoning,4972,9,1.5,0.214285032,0.69,2.86
372.3 ,Other and unspecified conjunctivitis,Diseases of the nervous system,7178,13,1.5,0.1676488391,0.8,2.58
008.5 ,"Bacterial enteritis, unspecified",Infectious and parasitic diseases,5026,9,1.49,0.2182776404,0.68,2.83
413.9 ,Other and unspecified angina pectoris,Diseases of the circulatory system,11160,20,1.49,0.0978728494,0.91,2.31
723.0 ,Spinal stenosis in cervical region,Diseases of the musculoskeletal...,3333,6,1.49,0.308054775,0.55,3.26
723.3 ,Cervicobrachial syndrome (diffuse),Diseases of the musculoskeletal...,3884,7,1.49,0.2458679184,0.6,3.09
346.9 ,"Migraine, unspecified",Diseases of the nervous system,13372,24,1.49,0.0592041395,0.95,2.23
370.23 ,Filamentary keratitis,Diseases of the nervous system,2218,4,1.49,0.3496202357,0.41,3.84
693.9 ,Dermatitis due to unspecified...,Diseases of the skin and subcutaneous...,11783,21,1.48,0.0815290135,0.91,2.27
381.00 ,"Acute nonsuppurative otitis media,...",Diseases of the nervous system,4483,8,1.48,0.2731383052,0.64,2.92
698 ,Pruritus and related conditions,Diseases of the skin and subcutaneous...,3380,6,1.47,0.3130659701,0.54,3.21
722.0 ,Displacement of cervical intervertebral...,Diseases of the musculoskeletal...,8498,15,1.47,0.1545008587,0.82,2.42
571.40 ,"Chronic hepatitis, unspecified",Diseases of the digestive system,134186,230,1.47,0.0000001490242,1.28,1.69
786.50 ,"Chest pain, unspecified","Comorbidities, signs, and ill-defined...",51375,90,1.47,0.0006133945,1.18,1.82
787.9 ,Other symptoms involving digestive...,"Comorbidities, signs, and ill-defined...",9054,16,1.47,0.1270980084,0.84,2.39
989.5 ,Toxic effect of venom,Injury and poisoning,5680,10,1.46,0.2440409807,0.7,2.69
684 ,Impetigo,Diseases of the skin and subcutaneous...,3970,7,1.46,0.3507698041,0.59,3.02
722.90 ,"Other and unspecified disc disorder,...",Diseases of the musculoskeletal...,2840,5,1.46,0.404381243,0.47,3.42
349 ,Other and unspecified disorders...,Diseases of the nervous system,2275,4,1.46,0.3602792696,0.4,3.74
380.13 ,Other acute infections of external...,Diseases of the nervous system,2272,4,1.46,0.3597078407,0.4,3.75
011.90 ,"Pulmonary tuberculosis, unspecified,...",Infectious and parasitic diseases,4564,8,1.45,0.2789249921,0.63,2.87
686.9 ,Unspecified local infection of...,Diseases of the skin and subcutaneous...,91052,156,1.45,0.0000189976,1.23,1.71
729.2 ,"Neuralgia, neuritis, and radiculitis,...",Diseases of the musculoskeletal...,51011,88,1.45,0.0011761523,1.16,1.79
382.3 ,Unspecified chronic suppurative...,Diseases of the nervous system,4008,7,1.45,0.3529185342,0.58,2.99
601.9 ,"Prostatitis, unspecified",Diseases of the genitourinary...,7496,13,1.44,0.1803196901,0.76,2.47
401.9 ,Unspecified essential hypertension,Diseases of the circulatory system,62345,107,1.44,0.0004099865,1.18,1.76
009.3 ,Diarrhea of presumed infectious...,Infectious and parasitic diseases,13241,23,1.44,0.1000016476,0.91,2.17
414.0 ,Coronary atherosclerosis,Diseases of the circulatory system,6899,12,1.44,0.2184449014,0.74,2.53
555.1 ,Regional enteritis of large intestine,Diseases of the digestive system,3446,6,1.44,0.3205789713,0.53,3.15
402.90 ,Unspecified hypertensive heart...,Diseases of the circulatory system,16837,29,1.43,0.0576370084,0.96,2.06
133.0 ,Scabies,Infectious and parasitic diseases,7565,13,1.43,0.1839196935,0.76,2.45
285.9 ,"Anemia, unspecified",Diseases of the blood and blood-forming...,12185,21,1.43,0.113605106,0.88,2.2
307.81 ,Tension headache,Mental disorders,19841,34,1.43,0.0495639841,0.98,2
354.0 ,Carpal tunnel syndrome,Diseases of the nervous system,8712,15,1.43,0.1620971517,0.8,2.36
372.39 ,Other conjunctivitis,Diseases of the nervous system,5219,9,1.43,0.3108196195,0.65,2.72
373.0 ,Blepharitis,Diseases of the nervous system,4628,8,1.43,0.2839915486,0.62,2.83
682.0 ,Cellulitis and abscess of face,Diseases of the skin and subcutaneous...,5245,9,1.42,0.3120138476,0.65,2.71
530.2 ,Ulcer of esophagus,Diseases of the digestive system,6420,11,1.42,0.2739926042,0.71,2.55
250.00 ,Diabetes mellitus without mention...,"Endocrine, nutritional and metabolic...",36858,62,1.41,0.0120501391,1.07,1.81
723.5 ,"Torticollis, unspecified",Diseases of the musculoskeletal...,2947,5,1.41,0.4150865869,0.46,3.29
349.9 ,Unspecified disorders of nervous...,Diseases of the nervous system,11188,19,1.41,0.13209384,0.85,2.21
681.00 ,"Cellulitis and abscess of finger,...",Diseases of the skin and subcutaneous...,2958,5,1.4,0.4162824014,0.45,3.28
841.9 ,Sprains and strains of unspecified...,Injury and poisoning,4137,7,1.4,0.3615725726,0.56,2.9
346.1 ,Common migraine,Diseases of the nervous system,2961,5,1.4,0.4166114621,0.45,3.27
370 ,Keratitis,Diseases of the nervous system,2964,5,1.4,0.4169417693,0.45,3.27
370.00 ,"Corneal ulcer, unspecified",Diseases of the nervous system,6529,11,1.4,0.2782334737,0.7,2.51
704.9 ,Unspecified disease of hair and...,Diseases of the skin and subcutaneous...,2382,4,1.39,0.3813332807,0.38,3.57
486 ,"Pneumonia, organism unspecified",Diseases of the respiratory system,23424,39,1.39,0.0464887051,0.98,1.9
729.0 ,"Rheumatism, unspecified and fibrositis",Diseases of the musculoskeletal...,5968,10,1.39,0.2619035195,0.67,2.56
372.05 ,Acute atopic conjunctivitis,Diseases of the nervous system,2385,4,1.39,0.3819408748,0.38,3.57
388.3 ,Tinitus,Diseases of the nervous system,7225,12,1.38,0.2351931676,0.71,2.41
110.5 ,Dermatophytosis of the body,Infectious and parasitic diseases,27695,46,1.38,0.0356632709,1.01,1.85
372.9 ,Unspecified disorder of conjunctiva,Diseases of the nervous system,3011,5,1.38,0.4222756116,0.45,3.22
388.70 ,"Otalgia, unspecified",Diseases of the nervous system,2412,4,1.37,0.5454225536,0.37,3.53
919.1 ,"Abrasion or friction burn of other,...",Injury and poisoning,2413,4,1.37,0.545502187,0.37,3.53
597.80 ,"Urethritis, unspecified",Diseases of the genitourinary...,18768,31,1.37,0.089371196,0.93,1.96
111.9 ,"Dermatomycosis, unspecified",Infectious and parasitic diseases,9158,15,1.36,0.2252463949,0.76,2.25
799.8 ,Other ill-defined conditions,"Comorbidities, signs, and ill-defined...",4303,7,1.35,0.3755466372,0.54,2.79
414.9 ,"Chronic ischemic heart disease,...",Diseases of the circulatory system,15440,25,1.35,0.1601261912,0.87,1.99
686.0 ,Pyoderma,Diseases of the skin and subcutaneous...,13564,22,1.35,0.1699438588,0.84,2.05
300 ,Neurotic disorders,Mental disorders,16025,26,1.35,0.1357403345,0.88,1.98
535.10 ,"Atrophic gastritis, without mention...",Diseases of the digestive system,2450,4,1.35,0.5485602252,0.37,3.47
923.8 ,Contusion of multiple sites of...,Injury and poisoning,3059,5,1.35,0.4280183989,0.44,3.17
794.8 ,Nonspecific abnormal results of...,"Comorbidities, signs, and ill-defined...",18023,29,1.34,0.1294891775,0.89,1.93
306.9 ,Unspecified psychophysiological...,Mental disorders,13627,22,1.34,0.1714123701,0.84,2.04
540.9 ,Acute appendicitis without mention...,Diseases of the digestive system,6784,11,1.34,0.2918633784,0.67,2.41
427.9 ,"Cardiac dysrhythmia, unspecified",Diseases of the circulatory system,19414,31,1.33,0.118343172,0.9,1.89
110.3 ,Dermatophytosis of groin and perianal...,Infectious and parasitic diseases,41539,66,1.33,0.0265885547,1.02,1.69
724.2 ,Lumbago,Diseases of the musculoskeletal...,182388,284,1.33,0.0000114329,1.17,1.51
535.5 ,Unspecified gastritis & gastroduodenitis,Diseases of the digestive system,18741,30,1.33,0.1368740551,0.9,1.91
535.50 ,"Unspecified gastritis and gastroduodenitis,...",Diseases of the digestive system,133130,209,1.33,0.0001317972,1.15,1.54
370.40 ,"Keratoconjunctivitis, unspecified",Diseases of the nervous system,5615,9,1.33,0.3360133571,0.61,2.53
588.9 ,Unspecified disorder resulting...,Diseases of the genitourinary...,3109,5,1.33,0.4342973834,0.43,3.12
386.19 ,Other peripheral vertigo,Diseases of the nervous system,1872,3,1.33,0.4976830628,0.27,3.89
464.1 ,Acute tracheitis,Diseases of the respiratory system,17688,28,1.32,0.1555491546,0.87,1.91
695.89 ,Other specified erythematous conditions,Diseases of the skin and subcutaneous...,4400,7,1.32,0.3850348466,0.53,2.72
883.0 ,"Open wound of finger(s), without...",Injury and poisoning,59485,94,1.32,0.0097252212,1.06,1.63
564.0 ,Constipation,Diseases of the digestive system,46251,73,1.32,0.0248189674,1.03,1.67
372.20 ,"Blepharoconjunctivitis, unspecified",Diseases of the nervous system,8156,13,1.32,0.3330281382,0.7,2.27
597.89 ,Other urethritis,Diseases of the genitourinary...,4379,7,1.32,0.3829039548,0.53,2.74
388.30 ,"Tinnitus, unspecified",Diseases of the nervous system,19605,31,1.31,0.1458652622,0.89,1.87
686 ,Other local infections of skin...,Diseases of the skin and subcutaneous...,9521,15,1.31,0.2969939687,0.73,2.16
455.9 ,Residual hemorrhoidal skin tags,Diseases of the circulatory system,3164,5,1.31,0.4415291487,0.42,3.06
708.0 ,Allergic urticaria,Diseases of the skin and subcutaneous...,39469,62,1.31,0.0398558573,1,1.69
272.4 ,Other and unspecified hyperlipidemia,"Endocrine, nutritional and metabolic...",62785,98,1.31,0.0117466392,1.06,1.6
300.0 ,Anxiety states,Mental disorders,22134,35,1.31,0.1177686416,0.91,1.84
529.0 ,Glossitis,Diseases of the digestive system,2527,4,1.31,0.5555834085,0.36,3.37
