disease_2,disease_name,category,count,co_occurrence,odds_ratio,p_value,95_ci_lower,95_ci_upper
924.00 ,Contusion of thigh,Injury and poisoning,3203,250,18.75,3.21539e-212,16.38,21.4
923.11 ,Contusion of elbow,Injury and poisoning,4538,297,15.59,6.40297e-230,13.79,17.58
912.0 ,Abrasion or friction burn of shoulder...,Injury and poisoning,2989,196,15.44,4.09807e-152,13.27,17.88
810.00 ,"Closed fracture of clavicle, unspecified...",Injury and poisoning,4583,288,14.91,4.68768e-218,13.16,16.84
924.01 ,Contusion of hip,Injury and poisoning,3099,141,10.41,1.192554e-88,8.72,12.35
923.10 ,Contusion of forearm,Injury and poisoning,2659,118,10.12,2.913442e-73,8.33,12.19
924.11 ,Contusion of knee,Injury and poisoning,12810,538,10.03,< 0.0001,9.15,10.97
923.21 ,Contusion of wrist,Injury and poisoning,4329,183,9.69,2.85104e-109,8.29,11.25
726.10 ,Disorders of bursae and tendons...,Diseases of the musculoskeletal...,6874,275,9.24,9.69027e-158,8.14,10.45
880.00 ,"Open wound of shoulder region,...",Injury and poisoning,3072,118,8.7,1.60477e-66,7.17,10.47
726.11 ,Calcifying tendinitis of shoulder,Diseases of the musculoskeletal...,1866,71,8.57,2.033058e-40,6.66,10.88
924.10 ,Contusion of lower leg,Injury and poisoning,5181,190,8.36,8.69151e-103,7.18,9.68
726.0 ,Adhesive capsulitis of shoulder,Diseases of the musculoskeletal...,7095,258,8.35,2.24065e-138,7.33,9.47
726.19 ,Other specified disorders of bursae...,Diseases of the musculoskeletal...,3921,139,8.02,9.597819e-74,6.71,9.52
913.0 ,"Abrasion or friction burn of elbow,...",Injury and poisoning,10612,365,7.97,7.36277e-188,7.15,8.87
840.8 ,Sprains and strains of other specified...,Injury and poisoning,2675,91,7.65,2.18136e-47,6.13,9.44
719.41 ,"Pain in joint, shoulder region",Diseases of the musculoskeletal...,7149,238,7.6,1.33452e-119,6.64,8.66
840 ,Sprains and strains of shoulder...,Injury and poisoning,2150,72,7.51,2.08761e-37,5.84,9.51
922.3 ,Contusion of back,Injury and poisoning,14366,449,7.29,6.33487e-215,6.6,8.03
726.2 ,"Other affections of shoulder region,...",Diseases of the musculoskeletal...,1894,61,7.2,4.883906e-31,5.48,9.3
840.4 ,Rotator cuff (capsule) sprain,Injury and poisoning,2214,71,7.18,9.7529e-36,5.58,9.1
922.1 ,Contusion of chest wall,Injury and poisoning,41593,1168,7.1,< 0.0001,6.66,7.56
916.0 ,"Abrasion or friction burn of hip,...",Injury and poisoning,18629,550,6.95,4.52273e-252,6.35,7.58
920 ,"Contusion of face, scalp, and...",Injury and poisoning,25172,715,6.8,< 0.0001,6.28,7.35
922.8 ,Contusion of multiple sites of...,Injury and poisoning,3794,114,6.74,1.401507e-53,5.54,8.14
924.21 ,Contusion of ankle,Injury and poisoning,5709,170,6.72,1.408763e-78,5.72,7.84
840.9 ,Sprains and strains of unspecified...,Injury and poisoning,12366,357,6.64,5.60012e-160,5.95,7.4
923.20 ,Contusion of hand(s),Injury and poisoning,7965,227,6.46,8.48076e-101,5.63,7.39
850.0 ,Concussion with no loss of consciousness,Injury and poisoning,9309,262,6.4,5.48845e-115,5.63,7.25
910.0 ,"Abrasion or friction burn of face,...",Injury and poisoning,10266,283,6.28,5.58415e-122,5.55,7.08
881.01 ,"Open wound of elbow, without mention...",Injury and poisoning,3480,95,6.09,1.558984e-41,4.91,7.48
854.09 ,Intracranial injury of other and...,Injury and poisoning,3595,97,6.02,5.881033e-42,4.86,7.38
924.20 ,Contusion of foot,Injury and poisoning,9563,243,5.75,1.369698e-97,5.03,6.54
924.4 ,Contusion of multiple sites of...,Injury and poisoning,3223,82,5.66,5.757274e-34,4.48,7.06
303.00 ,Acute alcoholic intoxication in...,Mental disorders,2501,63,5.59,2.981722e-26,4.28,7.19
854.01 ,Intracranial injury of other and...,Injury and poisoning,6409,159,5.56,6.57058e-63,4.71,6.52
914.0 ,Abrasion or friction burn of hand(s)...,Injury and poisoning,6384,154,5.4,1.999681e-59,4.56,6.34
923.9 ,Contusion of unspecified part...,Injury and poisoning,8299,199,5.39,5.841005e-76,4.65,6.22
923.8 ,Contusion of multiple sites of...,Injury and poisoning,3059,74,5.37,1.808192e-29,4.2,6.77
911.0 ,"Abrasion or friction burn of trunk,...",Injury and poisoning,4743,114,5.36,3.014793e-44,4.4,6.46
924.5 ,Contusion of unspecified part...,Injury and poisoning,7414,176,5.32,1.06057e-66,4.55,6.19
807.00 ,"Closed fracture of rib(s), unspecified",Injury and poisoning,3537,83,5.21,5.957601e-32,4.13,6.48
850.9 ,"Concussion, unspecified",Injury and poisoning,9714,222,5.14,8.286104e-81,4.47,5.89
305.00 ,"Alcohol abuse, unspecified",Mental disorders,2124,48,4.99,1.576556e-18,3.67,6.65
922.2 ,Contusion of abdominal wall,Injury and poisoning,4435,99,4.96,4.789208e-36,4.01,6.06
873.42 ,"Open wound of forehead, without...",Injury and poisoning,6609,146,4.93,7.206348e-52,4.15,5.82
959.8 ,"Other specified sites, including...",Injury and poisoning,2063,46,4.93,1.318191e-17,3.59,6.6
854.00 ,Intracranial injury of other and...,Injury and poisoning,12343,267,4.88,7.680716e-92,4.3,5.52
842.01 ,Sprain of carpal (joint) of wrist,Injury and poisoning,2220,47,4.67,4.193564e-17,3.42,6.24
682.3 ,Cellulitis and abscess of upper...,Diseases of the skin and subcutaneous...,2146,45,4.62,2.700938e-16,3.36,6.22
916.1 ,"Abrasion or friction burn of hip,...",Injury and poisoning,2947,61,4.57,3.057173e-21,3.48,5.9
723.9 ,Unspecified musculoskeletal disorders...,Diseases of the musculoskeletal...,2118,43,4.47,0.000000000000003659026,3.22,6.05
922.9 ,Contusion of unspecified part...,Injury and poisoning,8747,172,4.38,5.997043e-54,3.74,5.11
829.0 ,"Fracture of unspecified bone,...",Injury and poisoning,3956,78,4.36,2.074755e-25,3.43,5.46
841.9 ,Sprains and strains of unspecified...,Injury and poisoning,4137,81,4.33,3.932586e-26,3.42,5.4
924.1 ,Contusion of knee and lower leg,Injury and poisoning,1946,38,4.3,0.0000000000004437418,3.03,5.93
923.3 ,Contusion of finger,Injury and poisoning,5650,106,4.15,3.579678e-32,3.39,5.04
894.1 ,Multiple and unspecified open...,Injury and poisoning,2344,44,4.13,0.00000000000002603924,2.99,5.57
815.00 ,Closed fracture of metacarpal...,Injury and poisoning,3349,61,4.01,1.308998e-18,3.06,5.17
873.41 ,"Open wound of cheek, without mention...",Injury and poisoning,3080,56,4,3.490044e-17,3.01,5.22
873.40 ,"Open wound of face, unspecified...",Injury and poisoning,29879,517,3.98,5.87788e-139,3.63,4.35
873.49 ,Open wound of other and multiple...,Injury and poisoning,4336,78,3.97,5.075404e-23,3.13,4.97
891.1 ,"Open wound of knee, leg [except...",Injury and poisoning,6528,117,3.97,1.419174e-33,3.27,4.77
891.0 ,"Open wound of knee, leg [except...",Injury and poisoning,31330,533,3.91,2.24778e-140,3.58,4.28
880.03 ,"Open wound of upper arm, without...",Injury and poisoning,3956,70,3.9,1.895111e-20,3.03,4.94
919.0 ,"Abrasion or friction burn of other,...",Injury and poisoning,21642,373,3.9,1.574363e-99,3.51,4.34
873.43 ,"Open wound of lip, without mention...",Injury and poisoning,2567,45,3.85,0.0000000000001394201,2.8,5.17
303.90 ,Other and unspecified alcohol...,Mental disorders,5521,96,3.84,6.857576e-27,3.1,4.7
873.1 ,"Open wound of scalp, complicated",Injury and poisoning,2470,43,3.82,0.0000000000005961942,2.76,5.17
928.20 ,Crushing injury of foot,Injury and poisoning,2025,35,3.79,0.00000000009500834,2.63,5.3
881.00 ,"Open wound of forearm, without...",Injury and poisoning,13309,224,3.76,2.379759e-58,3.27,4.3
294.9 ,Unspecified persistent mental...,Mental disorders,2246,38,3.71,0.0000000000283177,2.62,5.12
919.8 ,Other and unspecified superficial...,Injury and poisoning,3141,53,3.71,0.000000000000004663084,2.77,4.87
723.2 ,Cervicocranial syndrome,Diseases of the musculoskeletal...,2425,41,3.71,0.000000000004942862,2.65,5.05
842.00 ,"Sprain of wrist, unspecified site",Injury and poisoning,5379,90,3.69,3.40218e-24,2.96,4.55
842.10 ,"Sprain of hand, unspecified site",Injury and poisoning,2593,43,3.64,0.000000000002825377,2.63,4.92
813.81 ,Closed fracture of unspecified...,Injury and poisoning,2168,36,3.64,0.0000000001518352,2.54,5.06
870.0 ,Laceration of skin of eyelid and...,Injury and poisoning,5039,83,3.63,5.03518e-22,2.88,4.51
917.0 ,Abrasion or friction burn of foot...,Injury and poisoning,6391,105,3.63,2.408436e-27,2.96,4.4
726.8 ,Other peripheral enthesopathies,Diseases of the musculoskeletal...,2436,40,3.6,0.0000000000211292,2.56,4.92
873.0 ,"Open wound of scalp, without mention...",Injury and poisoning,25807,407,3.57,4.824931e-97,3.23,3.95
303 ,Alcohol dependence syndrome,Mental disorders,2209,36,3.57,0.000000000249611,2.49,4.97
850 ,Concussion,Injury and poisoning,5331,85,3.51,1.216438e-21,2.8,4.35
854.0 ,Intracranial injury of other and...,Injury and poisoning,3324,53,3.5,0.00000000000004215327,2.61,4.59
780.3 ,Convulsions,"Comorbidities, signs, and ill-defined...",2820,45,3.5,0.000000000003187948,2.54,4.7
881.10 ,"Open wound of forearm, complicated",Injury and poisoning,2134,34,3.49,0.0000000013503907,2.41,4.9
879.6 ,Open wound of other and unspecified...,Injury and poisoning,3246,51,3.45,0.0000000000002152559,2.56,4.55
729.81 ,Swelling of limb,Diseases of the musculoskeletal...,3260,51,3.43,0.000000000000252157,2.55,4.53
913 ,"Superficial ilnjury of elbow,...",Injury and poisoning,1929,30,3.41,0.000000020430841,2.29,4.88
571.2 ,Alcoholic cirrhosis of liver,Diseases of the digestive system,3823,59,3.39,0.000000000000006476546,2.57,4.38
715.09 ,"Osteoarthrosis, generalized, multiple...",Diseases of the musculoskeletal...,2078,32,3.37,0.0000000088767355,2.3,4.78
727.06 ,Tenosynovitis of foot and ankle,Diseases of the musculoskeletal...,3368,51,3.32,0.0000000000008281673,2.46,4.38
884.1 ,Multiple and unspecified open...,Injury and poisoning,2009,30,3.27,0.000000048969199,2.2,4.68
723.8 ,Other syndromes affecting cervical...,Diseases of the musculoskeletal...,2074,31,3.27,0.000000029025516,2.21,4.66
881.0 ,"Open wound of elbow, forearm,...",Injury and poisoning,2621,39,3.26,0.0000000005964217,2.31,4.47
726 ,Peripheral enthesopathies and...,Diseases of the musculoskeletal...,2895,43,3.25,0.00000000008647452,2.35,4.4
310.2 ,Postconcussion syndrome,Mental disorders,3044,45,3.24,0.00000000003736367,2.35,4.35
721.1 ,Cervical spondylosis with myelopathy,Diseases of the musculoskeletal...,5735,84,3.22,3.329605e-19,2.56,4
726.32 ,Lateral epicondylitis,Diseases of the musculoskeletal...,8812,127,3.18,1.373127e-27,2.64,3.79
719.00 ,"Effusion of joint, site unspecified",Diseases of the musculoskeletal...,1936,28,3.16,0.00000025214546,2.09,4.59
727.05 ,Other tenosynovitis of hand and...,Diseases of the musculoskeletal...,4435,64,3.16,0.000000000000009971232,2.43,4.05
919.9 ,Other and unspecified superficial...,Injury and poisoning,2192,31,3.09,0.000000096866579,2.09,4.41
922 ,Contusion of trunk,Injury and poisoning,3913,55,3.08,0.000000000001907838,2.31,4.02
881.02 ,"Open wound of wrist, without mention...",Injury and poisoning,3134,44,3.07,0.0000000002967453,2.23,4.14
571.1 ,Acute alcoholic hepatitis,Diseases of the digestive system,3836,53,3.03,0.000000000008834242,2.26,3.97
923 ,Contusion of upper limb,Injury and poisoning,3337,46,3.02,0.0000000002124156,2.2,4.04
716.10 ,"Traumatic arthropathy, site unspecified",Diseases of the musculoskeletal...,3795,52,3,0.00000000001846514,2.23,3.95
844.2 ,Sprain of cruciate ligament of...,Injury and poisoning,2574,35,2.97,0.000000038965226,2.06,4.15
822.0 ,Closed fracture of patella,Injury and poisoning,1983,27,2.97,0.0000012629871,1.95,4.34
915.0 ,"Abrasion or friction burn of finger(s),...",Injury and poisoning,3988,54,2.96,0.00000000001186322,2.22,3.88
844.9 ,Sprains and strains of unspecified...,Injury and poisoning,11453,153,2.95,1.732587e-29,2.49,3.46
847.0 ,Sprain of neck,Injury and poisoning,26782,352,2.95,1.495662e-64,2.64,3.28
875.0 ,"Open wound of chest (wall), without...",Injury and poisoning,2003,27,2.94,0.0000015193842,1.93,4.3
716.99 ,"Arthropathy, unspecified, multiple...",Diseases of the musculoskeletal...,2450,33,2.94,0.00000011537826,2.02,4.15
727.09 ,Other synovitis and tenosynovitis,Diseases of the musculoskeletal...,4928,66,2.93,0.0000000000001115992,2.26,3.74
924.9 ,Contusion of unspecified site,Injury and poisoning,18439,243,2.93,4.844535e-45,2.57,3.33
682.4 ,"Cellulitis and abscess of hand,...",Diseases of the skin and subcutaneous...,2690,36,2.92,0.000000037121743,2.04,4.06
881 ,"Open wound of elbow, forearm,...",Injury and poisoning,3520,47,2.92,0.0000000003757913,2.14,3.9
715.98 ,"Osteoarthrosis, unspecified whether...",Diseases of the musculoskeletal...,1872,25,2.92,0.0000042460431,1.88,4.32
924.3 ,Contusion of toe,Injury and poisoning,2790,37,2.9,0.000000030428151,2.03,4.01
854 ,Intracranial injury of other and...,Injury and poisoning,2642,35,2.89,0.000000072187095,2.01,4.04
825.0 ,"Fracture of calcaneus, closed",Injury and poisoning,2793,37,2.89,0.000000031250706,2.03,4
715.16 ,"Osteoarthrosis, localized, primary,...",Diseases of the musculoskeletal...,4637,61,2.88,0.000000000001906175,2.2,3.71
873.8 ,Other and unspecified open wound...,Injury and poisoning,8028,105,2.87,4.282747e-20,2.34,3.49
893.1 ,"Open wound of toe(s), complicated",Injury and poisoning,2204,29,2.87,0.0000010251739,1.92,4.14
945.00 ,Burn of unspecified degree of...,Injury and poisoning,2360,31,2.87,0.00000046168526,1.94,4.09
921.3 ,Contusion of eyeball,Injury and poisoning,4073,53,2.85,0.00000000007456996,2.13,3.73
727.01 ,Synovitis and tenosynovitis in...,Diseases of the musculoskeletal...,2448,32,2.85,0.00000033838215,1.95,4.04
728.85 ,Spasm of muscle,Diseases of the musculoskeletal...,5461,71,2.85,0.0000000000000549529,2.22,3.6
879.9 ,Open wound(s) (multiple) of unspecified...,Injury and poisoning,1918,25,2.84,0.0000063944931,1.84,4.22
733.00 ,"Osteoporosis, unspecified",Diseases of the musculoskeletal...,2845,37,2.84,0.000000049285629,1.99,3.93
728.89 ,"Other disorders of muscle, ligament,...",Diseases of the musculoskeletal...,11852,152,2.83,1.579598e-27,2.39,3.32
816.00 ,Closed fracture of phalanx or...,Injury and poisoning,6596,85,2.83,3.256708e-16,2.25,3.5
977.9 ,Poisoning by unspecified drug...,Injury and poisoning,2477,32,2.82,0.00000043490445,1.92,4
892.0 ,Open wound of foot except toe(s)...,Injury and poisoning,24041,301,2.79,3.824283e-51,2.48,3.14
873.4 ,"Facial laceration, without mention...",Injury and poisoning,13153,166,2.78,3.596588e-29,2.37,3.25
826.0 ,Closed fracture of one or more...,Injury and poisoning,3317,42,2.77,0.00000001358163,1.99,3.75
715.96 ,"Osteoarthrosis, unspecified whether...",Diseases of the musculoskeletal...,3169,40,2.76,0.000000032038732,1.96,3.77
345.9 ,"Epilepsy, unspecified",Diseases of the nervous system,2529,32,2.76,0.00000067460301,1.88,3.91
923.2 ,"Contusion of wrist and hand(s),...",Injury and poisoning,1897,24,2.76,0.0000155737,1.76,4.12
891 ,"Open wound of knee, leg (except...",Injury and poisoning,5328,67,2.75,0.000000000001180068,2.13,3.51
959.7 ,"Knee, leg, ankle, and foot injury",Injury and poisoning,4055,51,2.75,0.0000000005217698,2.04,3.63
682.2 ,Cellulitis and abscess of trunk,Diseases of the skin and subcutaneous...,2230,28,2.74,0.0000037158717,1.81,3.97
307.40 ,"Nonorganic sleep disorder, unspecified",Mental disorders,3593,45,2.74,0.00000000585094,1.99,3.67
723.4 ,"Brachial neuritis or radiculitis,...",Diseases of the musculoskeletal...,4955,62,2.74,0.000000000009663363,2.09,3.52
892.1 ,Open wound of foot except toe(s)...,Injury and poisoning,4090,51,2.73,0.0000000006931094,2.02,3.59
844.8 ,Sprains and strains of other specified...,Injury and poisoning,2092,26,2.71,0.0000096040197,1.77,3.99
873 ,Other open wound of head,Injury and poisoning,6297,78,2.71,0.00000000000003841381,2.14,3.39
919.1 ,"Abrasion or friction burn of other,...",Injury and poisoning,2413,30,2.71,0.0000020812561,1.82,3.89
680.6 ,"Carbuncle and furuncle of leg,...",Diseases of the skin and subcutaneous...,2178,27,2.7,0.0000068596345,1.78,3.95
354.2 ,Lesion of ulnar nerve,Diseases of the nervous system,2025,25,2.69,0.0000156913,1.74,3.99
847.1 ,Sprain of thoracic,Injury and poisoning,4237,52,2.68,0.0000000008094712,2,3.53
722.91 ,"Other and unspecified disc disorder,...",Diseases of the musculoskeletal...,3107,38,2.67,0.00000015086803,1.88,3.68
839.8 ,"Closed dislocation, multiple and...",Injury and poisoning,4703,57,2.65,0.0000000002047926,2,3.44
882.0 ,Open wound of hand except finger(s)...,Injury and poisoning,33493,396,2.65,1.021855e-60,2.39,2.94
916 ,"Superficial injury of hip, thigh,...",Injury and poisoning,3004,36,2.61,0.00000050207736,1.83,3.63
727.00 ,"Synovitis and tenosynovitis, unspecified",Diseases of the musculoskeletal...,81293,909,2.61,4.67747e-128,2.44,2.8
782.3 ,Edema,"Comorbidities, signs, and ill-defined...",10019,119,2.61,2.370399e-19,2.16,3.13
354.0 ,Carpal tunnel syndrome,Diseases of the nervous system,8712,103,2.59,7.862156e-17,2.11,3.15
890.0 ,"Open wound of hip and thigh, without...",Injury and poisoning,4993,59,2.58,0.0000000003404387,1.96,3.34
681.00 ,"Cellulitis and abscess of finger,...",Diseases of the skin and subcutaneous...,2958,35,2.58,0.00000094948614,1.79,3.6
884.0 ,Multiple and unspecified open...,Injury and poisoning,50259,569,2.57,1.158354e-80,2.36,2.8
345.90 ,"Epilepsy, unspecified, without...",Diseases of the nervous system,5862,69,2.57,0.00000000001144541,2,3.27
844.0 ,Sprain of lateral collateral ligament...,Injury and poisoning,1872,22,2.56,0.0000985567,1.6,3.89
726.4 ,Enthesopathy of wrist and carpus,Diseases of the musculoskeletal...,2297,27,2.56,0.0000172658,1.68,3.74
823.00 ,Closed fracture of upper end of...,Injury and poisoning,1956,23,2.56,0.0000689474,1.62,3.86
715.36 ,"Osteoarthrosis, localized, not...",Diseases of the musculoskeletal...,8408,98,2.55,0.000000000000001408344,2.07,3.12
897.0 ,Traumatic amputation of leg(s)...,Injury and poisoning,1880,22,2.55,0.0001046187,1.59,3.87
577.1 ,Chronic pancreatitis,Diseases of the digestive system,3784,44,2.54,0.000000091481038,1.84,3.42
388.70 ,"Otalgia, unspecified",Diseases of the nervous system,2412,28,2.53,0.0000152263,1.68,3.67
842.09 ,Other sprains and strains of wrist,Injury and poisoning,4088,47,2.51,0.000000040524063,1.84,3.35
727.03 ,Trigger finger (acquired),Diseases of the musculoskeletal...,2610,30,2.51,0.0000147704,1.69,3.59
722.0 ,Displacement of cervical intervertebral...,Diseases of the musculoskeletal...,8498,97,2.5,0.000000000000005076007,2.02,3.06
726.71 ,Achilles bursitis or tendinitis,Diseases of the musculoskeletal...,2527,29,2.5,0.0000213733,1.67,3.6
682.6 ,"Cellulitis and abscess of leg,...",Diseases of the skin and subcutaneous...,8628,98,2.49,0.000000000000004830167,2.01,3.04
721.42 ,"Spondylosis with myelopathy, lumbar...",Diseases of the musculoskeletal...,3418,39,2.49,0.00000070148493,1.77,3.41
727.89 ,"Other disorders of synovium, tendon,...",Diseases of the musculoskeletal...,2818,32,2.48,0.000008195598,1.69,3.51
894.0 ,Multiple and unspecified open...,Injury and poisoning,44602,488,2.47,8.61238e-65,2.25,2.71
682.7 ,"Cellulitis and abscess of foot,...",Diseases of the skin and subcutaneous...,4344,49,2.46,0.000000033904077,1.82,3.26
349.89 ,Other specified disorders of nervous...,Diseases of the nervous system,2662,30,2.46,0.0000177321,1.65,3.52
729.5 ,Pain in limb,Diseases of the musculoskeletal...,13509,151,2.46,1.372907e-21,2.08,2.89
844.1 ,Sprain of medial collateral ligament...,Injury and poisoning,1953,22,2.45,0.0001771559,1.53,3.73
847.9 ,Sprain of unspecified site of...,Injury and poisoning,9821,110,2.45,2.817173e-16,2.01,2.97
845.19 ,Other sprain of foot,Injury and poisoning,2946,33,2.44,0.0000069916465,1.68,3.44
805.4 ,Closed fracture of lumbar vertebra...,Injury and poisoning,3572,40,2.44,0.00000071991882,1.74,3.33
306.8 ,Other specified psychophysiological...,Mental disorders,3315,37,2.43,0.0000020143328,1.71,3.36
721.0 ,Cervical spondylosis without myelopathy,Diseases of the musculoskeletal...,16755,184,2.42,3.231845e-25,2.08,2.8
295.34 ,"Paranoid type schizophrenia, chronic...",Mental disorders,3076,34,2.41,0.0000062529416,1.66,3.38
716.96 ,"Arthropathy, unspecified, lower...",Diseases of the musculoskeletal...,2083,23,2.4,0.0002331847,1.52,3.62
919 ,"Superficial injury of other, multiple,...",Injury and poisoning,2176,24,2.4,0.0001676881,1.53,3.59
845.00 ,"Sprain of ankle, unspecified site",Injury and poisoning,13954,152,2.39,8.50967e-21,2.02,2.81
729.4 ,"Fasciitis, unspecified",Diseases of the musculoskeletal...,72066,751,2.39,4.801758e-91,2.22,2.58
216.6 ,Benign neoplasm of skin of upper...,Neoplasms,3121,34,2.37,0.0000080868093,1.64,3.33
876.0 ,"Open wound of back, without mention...",Injury and poisoning,1925,21,2.37,0.0005023184,1.47,3.64
715.35 ,"Osteoarthrosis, localized, not...",Diseases of the musculoskeletal...,2392,26,2.37,0.0001010243,1.54,3.48
780.50 ,"Sleep disturbance, unspecified","Comorbidities, signs, and ill-defined...",18206,196,2.37,8.831914e-26,2.05,2.74
571.3 ,"Alcoholic liver damage, unspecified",Diseases of the digestive system,7678,83,2.36,0.000000000008847397,1.88,2.94
882.1 ,Open wound of hand except finger(s)...,Injury and poisoning,4760,51,2.34,0.000000088123719,1.74,3.08
726.90 ,Enthesopathy of unspecified site,Diseases of the musculoskeletal...,39550,412,2.33,1.435234e-49,2.1,2.58
780.2 ,Syncope and collapse,"Comorbidities, signs, and ill-defined...",6004,64,2.33,0.0000000028193878,1.79,2.98
845.09 ,Other sprains and strains of ankle,Injury and poisoning,8468,90,2.32,0.000000000002923731,1.86,2.86
719.48 ,"Pain in joint, other specified...",Diseases of the musculoskeletal...,4039,43,2.32,0.0000010858989,1.68,3.13
300.09 ,Other anxiety states,Mental disorders,5735,61,2.32,0.0000000072802955,1.77,2.99
738.4 ,Acquired spondylolisthesis,Diseases of the musculoskeletal...,2159,23,2.32,0.0003246841,1.47,3.49
431 ,Intracerebral hemorrhage,Diseases of the circulatory system,3118,33,2.3,0.0000259605,1.58,3.25
438 ,Late effects of cerebrovascular...,Diseases of the circulatory system,2082,22,2.3,0.0004807027,1.44,3.49
848.8 ,Other specified sites of sprains...,Injury and poisoning,7777,82,2.3,0.00000000004325114,1.83,2.87
532.30 ,Acute duodenal ulcer without mention...,Diseases of the digestive system,5417,57,2.3,0.000000031342714,1.73,2.98
722.73 ,Intervertebral disc disorder with...,Diseases of the musculoskeletal...,5879,62,2.3,0.0000000069885682,1.76,2.96
727.0 ,Synovitis and tenosynovitis,Diseases of the musculoskeletal...,12111,127,2.3,2.083998e-16,1.91,2.74
729.2 ,"Neuralgia, neuritis, and radiculitis,...",Diseases of the musculoskeletal...,51011,521,2.3,4.775508e-60,2.1,2.52
998.5 ,Postoperative infection,Injury and poisoning,5034,53,2.3,0.00000010090189,1.72,3.01
825.25 ,Closed fracture of metatarsal...,Injury and poisoning,3025,32,2.3,0.000035997,1.57,3.26
893.0 ,"Open wound of toe(s), without...",Injury and poisoning,9373,98,2.29,0.0000000000007331084,1.85,2.79
531.70 ,Chronic gastric ulcer without...,Diseases of the digestive system,6873,72,2.29,0.0000000006302522,1.79,2.89
847.2 ,Sprain of lumbar,Injury and poisoning,47972,486,2.28,6.320967e-55,2.07,2.5
709.2 ,Scar conditions and fibrosis of...,Diseases of the skin and subcutaneous...,3432,36,2.28,0.0000113824,1.6,3.17
346.1 ,Common migraine,Diseases of the nervous system,2961,31,2.28,0.0000542669,1.54,3.25
958.3 ,Posttraumatic wound infection...,Injury and poisoning,15876,165,2.28,1.726598e-20,1.94,2.67
729.1 ,"Myalgia and myositis, unspecified",Diseases of the musculoskeletal...,136853,1304,2.27,3.24704e-134,2.14,2.41
590.9 ,"Infection of kidney, unspecified",Diseases of the genitourinary...,2394,25,2.27,0.0002260346,1.47,3.37
682.8 ,Cellulitis and abscess of other...,Diseases of the skin and subcutaneous...,7550,78,2.26,0.0000000002436952,1.78,2.82
821.00 ,Closed fracture of unspecified...,Injury and poisoning,2407,25,2.26,0.0002426554,1.46,3.35
714.9 ,Unspecified inflammatory polyarthropathy,Diseases of the musculoskeletal...,2225,23,2.25,0.0004553578,1.42,3.39
724.4 ,Thoracic or lumbosacral neuritis...,Diseases of the musculoskeletal...,6411,66,2.25,0.0000000059214938,1.73,2.87
719.44 ,"Pain in joint, hand",Diseases of the musculoskeletal...,3201,33,2.24,0.0000353889,1.54,3.16
355.9 ,Mononeuritis of unspecified site,Diseases of the nervous system,2246,23,2.23,0.000509271,1.41,3.35
535.01 ,"Acute gastritis, with hemorrhage",Diseases of the digestive system,3433,35,2.22,0.0000239355,1.54,3.1
719.49 ,"Pain in joint, multiple sites",Diseases of the musculoskeletal...,8781,89,2.21,0.00000000004382089,1.77,2.73
894 ,Multiple and unspecified open...,Injury and poisoning,4775,48,2.19,0.0000016097395,1.61,2.91
535.51 ,"Unspecified gastritis and gastroduodenitis,...",Diseases of the digestive system,1890,19,2.19,0.0018860825,1.31,3.43
733.42 ,Aseptic necrosis of head and neck...,Diseases of the musculoskeletal...,4077,41,2.19,0.0000075706263,1.57,2.98
879.8 ,Open wound(s) (multiple) of unspecified...,Injury and poisoning,20870,207,2.18,6.151557e-23,1.89,2.51
728 ,"Disorders of muscle, ligament,...",Diseases of the musculoskeletal...,10745,107,2.18,0.000000000001164081,1.78,2.64
886.0 ,Traumatic amputation of other...,Injury and poisoning,2204,22,2.17,0.001273113,1.36,3.3
928.3 ,Crushing injury of toe(s),Injury and poisoning,2107,21,2.17,0.0017508428,1.34,3.32
530.8 ,Other specified disorders of esophagus,Diseases of the digestive system,2713,27,2.16,0.0003029032,1.42,3.16
780.52 ,"Insomnia, unspecified","Comorbidities, signs, and ill-defined...",52283,502,2.16,2.410603e-50,1.97,2.36
719.4 ,Pain in joint,Diseases of the musculoskeletal...,13342,131,2.15,0.000000000000009732993,1.79,2.56
353.2 ,"Cervical root lesions, not elsewhere...",Diseases of the nervous system,6319,62,2.14,0.00000011867815,1.64,2.75
041.8 ,Other specified bacterial infections,Infectious and parasitic diseases,2850,28,2.14,0.0002708571,1.42,3.1
714.0 ,Rheumatoid arthritis,Diseases of the musculoskeletal...,9027,88,2.13,0.0000000002848735,1.7,2.63
