977.9 ,Poisoning by unspecified drug...,Injury and poisoning,2860,4,0.99,1,0.27,2.54
487 ,Influenza,Diseases of the respiratory system,13637,19,0.99,1,0.59,1.55
388.3 ,Tinitus,Diseases of the nervous system,4347,6,0.98,1,0.36,2.13
927.9 ,Crushing injury of unspecified...,Injury and poisoning,2166,3,0.98,1,0.2,2.88
473 ,Chronic sinusitis,Diseases of the respiratory system,2884,4,0.98,1,0.27,2.52
816 ,Fracture of one or more phalangs...,Injury and poisoning,2176,3,0.98,1,0.2,2.86
370.21 ,Punctate keratitis,Diseases of the nervous system,31246,43,0.98,0.9393959472,0.7,1.32
214.9 ,"Lipoma, unspecified site",Neoplasms,2201,3,0.97,1,0.2,2.83
295.34 ,"Paranoid type schizophrenia, chronic...",Mental disorders,2203,3,0.97,1,0.2,2.83
362.63 ,Lattice degeneration,Diseases of the nervous system,2183,3,0.97,1,0.2,2.85
799.8 ,Other ill-defined conditions,"Comorbidities, signs, and ill-defined...",3700,5,0.96,1,0.31,2.24
519.9 ,Unspecified disease of respiratory...,Diseases of the respiratory system,4452,6,0.96,1,0.35,2.08
532.70 ,Chronic duodenal ulcer without...,Diseases of the digestive system,7379,10,0.96,1,0.46,1.77
608.89 ,Other specified disorders of male...,Diseases of the genitourinary...,2231,3,0.95,1,0.2,2.79
692.70 ,Unspecified dermatitis due to...,Diseases of the skin and subcutaneous...,3025,4,0.94,1,0.25,2.4
386.2 ,Vertigo of central origin,Diseases of the nervous system,2265,3,0.94,1,0.19,2.75
695.89 ,Other specified erythematous conditions,Diseases of the skin and subcutaneous...,3013,4,0.94,1,0.26,2.41
111.9 ,"Dermatomycosis, unspecified",Infectious and parasitic diseases,7564,10,0.94,1,0.45,1.73
823.00 ,Closed fracture of upper end of...,Injury and poisoning,2268,3,0.94,1,0.19,2.75
289.3 ,"Lymphadenitis, unspecified, except...",Diseases of the blood and blood-forming...,4509,6,0.94,1,0.35,2.06
372.8 ,Other disorders of conjunctiva,Diseases of the nervous system,3068,4,0.92,1,0.25,2.37
382.4 ,Unspecified suppurative otitis...,Diseases of the nervous system,2318,3,0.92,1,0.19,2.69
414.9 ,"Chronic ischemic heart disease,...",Diseases of the circulatory system,5386,7,0.92,1,0.37,1.9
427.89 ,Other specified cardiac dysrhythmias,Diseases of the circulatory system,2303,3,0.92,1,0.19,2.7
523.9 ,Unspecified gingival and periodontal...,Diseases of the digestive system,3847,5,0.92,1,0.3,2.15
571.5 ,Cirrhosis of liver without mention...,Diseases of the digestive system,3840,5,0.92,1,0.3,2.16
920 ,"Contusion of face, scalp, and...",Injury and poisoning,34065,44,0.91,0.6098822797,0.66,1.23
959.7 ,"Knee, leg, ankle, and foot injury",Injury and poisoning,6212,8,0.91,1,0.39,1.8
475 ,Peritonsillar abscess,Diseases of the respiratory system,17034,22,0.91,0.7585033611,0.57,1.39
883.2 ,"Open wound of finger(s), with...",Injury and poisoning,5461,7,0.91,1,0.36,1.88
379.8 ,Other specified disorders of eye...,Diseases of the nervous system,3921,5,0.9,1,0.29,2.11
876.0 ,"Open wound of back, without mention...",Injury and poisoning,2374,3,0.9,1,0.18,2.62
533 ,"Peptic ulcer, site unspecified",Diseases of the digestive system,15119,19,0.89,0.7432853784,0.53,1.39
370 ,Keratitis,Diseases of the nervous system,3167,4,0.89,1,0.24,2.3
784.2 ,"Swelling, mass, or lump in head...","Comorbidities, signs, and ill-defined...",4856,6,0.88,1,0.32,1.91
786.0 ,Dyspnea and respiratory abnormalities,"Comorbidities, signs, and ill-defined...",4006,5,0.88,1,0.29,2.07
698.4 ,Dermatitis factitia [artefacta],Diseases of the skin and subcutaneous...,7323,9,0.87,0.875226179,0.4,1.66
883 ,Open wound of finger(s),Injury and poisoning,13002,16,0.87,0.7239434113,0.5,1.42
380.2 ,Other otitis externa,Diseases of the nervous system,2475,3,0.86,1,0.18,2.52
242.90 ,Thyrotoxicosis without mention...,"Endocrine, nutritional and metabolic...",5773,7,0.86,0.860272336,0.34,1.77
880 ,Open wound of shoulder and upper...,Injury and poisoning,3294,4,0.86,1,0.23,2.21
491.8 ,Other chronic bronchitis,Diseases of the respiratory system,2496,3,0.85,1,0.18,2.49
696.3 ,Pityriasis rosea,Diseases of the skin and subcutaneous...,7563,9,0.84,0.758112078,0.38,1.6
555.1 ,Regional enteritis of large intestine,Diseases of the digestive system,3354,4,0.84,1,0.23,2.17
873.0 ,"Open wound of scalp, without mention...",Injury and poisoning,30953,37,0.84,0.3585040659,0.59,1.17
690 ,Erythematosquamous dermatosis,Diseases of the skin and subcutaneous...,22928,27,0.83,0.4242104086,0.55,1.21
709.8 ,Other specified disorders of skin,Diseases of the skin and subcutaneous...,12982,15,0.82,0.5556931861,0.46,1.35
052.9 ,Varicella without mention of complication,Infectious and parasitic diseases,11162,13,0.82,0.6114641647,0.44,1.41
280.9 ,"Iron deficiency anemia, unspecified",Diseases of the blood and blood-forming...,2632,3,0.81,1,0.17,2.37
883.1 ,"Open wound of finger(s), complicated",Injury and poisoning,13912,16,0.81,0.4953228971,0.46,1.32
873.43 ,"Open wound of lip, without mention...",Injury and poisoning,3539,4,0.8,1,0.22,2.05
882.1 ,Open wound of hand except finger(s)...,Injury and poisoning,6188,7,0.8,0.7328994553,0.32,1.65
931 ,Foreign body in ear,Injury and poisoning,6289,7,0.79,0.7342295263,0.32,1.63
682 ,Other cellulitis and abscess,Diseases of the skin and subcutaneous...,8193,9,0.78,0.5547290007,0.36,1.48
789 ,Other symptoms involving abdomen...,"Comorbidities, signs, and ill-defined...",3638,4,0.78,0.8245384988,0.21,2
536 ,Disorders of function of stomach,Diseases of the digestive system,13796,15,0.77,0.3620197765,0.43,1.27
922.2 ,Contusion of abdominal wall,Injury and poisoning,5575,6,0.76,0.7181715964,0.28,1.66
487.0 ,Influenza with pneumonia,Diseases of the respiratory system,3716,4,0.76,0.8252383999,0.21,1.96
370.00 ,"Corneal ulcer, unspecified",Diseases of the nervous system,8375,9,0.76,0.5568478806,0.35,1.45
693.1 ,Dermatitis due to food taken internally,Diseases of the skin and subcutaneous...,2815,3,0.75,1,0.16,2.21
780.9 ,Other general symptoms,"Comorbidities, signs, and ill-defined...",11394,12,0.75,0.3793727458,0.38,1.3
879.6 ,Open wound of other and unspecified...,Injury and poisoning,3798,4,0.75,0.8263852235,0.2,1.91
729.6 ,Residual foreign body in soft...,Diseases of the musculoskeletal...,1911,2,0.74,1,0.09,2.68
361.30 ,"Retinal defect, unspecified",Diseases of the nervous system,1906,2,0.74,1,0.09,2.69
830 ,Dislocation of jaw,Injury and poisoning,3860,4,0.73,0.8275163227,0.2,1.88
695.0 ,Toxic erythema,Diseases of the skin and subcutaneous...,1965,2,0.72,1,0.09,2.61
427.0 ,Paroxysmal supraventricular tachycardia,Diseases of the circulatory system,1972,2,0.72,1,0.09,2.6
476.0 ,Chronic laryngitis,Diseases of the respiratory system,2009,2,0.71,1,0.09,2.55
873.8 ,Other and unspecified open wound...,Injury and poisoning,10003,10,0.71,0.3475678783,0.34,1.3
959.4 ,"Hand, except finger injury",Injury and poisoning,3035,3,0.7,0.8061968571,0.14,2.05
959.8 ,"Other specified sites, including...",Injury and poisoning,3036,3,0.7,0.8062149768,0.14,2.05
570 ,Acute and subacute necrosis of...,Diseases of the digestive system,3032,3,0.7,0.8061429945,0.14,2.05
693.9 ,Dermatitis due to unspecified...,Diseases of the skin and subcutaneous...,12288,12,0.69,0.2275053461,0.36,1.21
923 ,Contusion of upper limb,Injury and poisoning,5181,5,0.68,0.5741991166,0.22,1.6
388.70 ,"Otalgia, unspecified",Diseases of the nervous system,2088,2,0.68,1,0.08,2.46
427 ,Cardiac dysrhythmias,Diseases of the circulatory system,3171,3,0.67,0.6387897343,0.14,1.96
704.01 ,Alopecia areata,Diseases of the skin and subcutaneous...,5256,5,0.67,0.4638261709,0.22,1.57
788.1 ,Dysuria,"Comorbidities, signs, and ill-defined...",3164,3,0.67,0.8091886103,0.14,1.97
555.9 ,Regional enteritis of unspecified...,Diseases of the digestive system,12703,12,0.67,0.1903991112,0.34,1.17
873 ,Other open wound of head,Injury and poisoning,8451,8,0.67,0.3087029838,0.29,1.32
681.02 ,Onychia and paronychia of finger,Diseases of the skin and subcutaneous...,4309,4,0.66,0.5408166569,0.18,1.69
682.5 ,Cellulitis and abscess of buttock,Diseases of the skin and subcutaneous...,2155,2,0.66,0.775726929,0.08,2.38
880.03 ,"Open wound of upper arm, without...",Injury and poisoning,5395,5,0.66,0.4649740501,0.21,1.53
884.2 ,Multiple and unspecified open...,Injury and poisoning,2192,2,0.65,0.7759826781,0.08,2.34
629.9 ,Unspecified disorder of female...,Diseases of the genitourinary...,2190,2,0.65,0.7759638959,0.08,2.34
706.8 ,Other specified diseases of sebaceous...,Diseases of the skin and subcutaneous...,2192,2,0.65,0.7759826781,0.08,2.34
780.8 ,Generalized hyperhidrosis,"Comorbidities, signs, and ill-defined...",6497,6,0.65,0.4042920462,0.24,1.43
216 ,Benign neoplasm of skin,Neoplasms,7574,7,0.65,0.3537987321,0.26,1.35
009 ,Ill-defined intestinal infections,Infectious and parasitic diseases,4440,4,0.64,0.543610042,0.17,1.64
388.8 ,Other disorders of ear,Diseases of the nervous system,2264,2,0.63,0.7770220685,0.08,2.26
491.0 ,Simple chronic bronchitis,Diseases of the respiratory system,5614,5,0.63,0.3738300686,0.2,1.47
870 ,Open wound of ocular adnexa,Injury and poisoning,2251,2,0.63,0.7767832614,0.08,2.28
915.0 ,"Abrasion or friction burn of finger(s),...",Injury and poisoning,5710,5,0.62,0.374771722,0.2,1.45
008.6 ,"Virus Enteritis, specified",Infectious and parasitic diseases,2297,2,0.62,0.7777255356,0.07,2.23
914 ,Superficial injury of hand(s)...,Injury and poisoning,2310,2,0.61,0.778040096,0.07,2.22
008.8 ,Intestinal infection due to other...,Infectious and parasitic diseases,2332,2,0.61,0.778619325,0.07,2.2
894 ,Multiple and unspecified open...,Injury and poisoning,6487,5,0.55,0.2411686247,0.18,1.27
910 ,"Superficial injury of face, neck,...",Injury and poisoning,4042,3,0.53,0.3951297607,0.11,1.54
512.8 ,Other pneumothorax and air leak,Diseases of the respiratory system,2652,2,0.53,0.5987817718,0.06,1.93
881 ,"Open wound of elbow, forearm,...",Injury and poisoning,5366,4,0.53,0.2698447165,0.14,1.35
873.1 ,"Open wound of scalp, complicated",Injury and poisoning,2732,2,0.52,0.6024820969,0.06,1.88
011.90 ,"Pulmonary tuberculosis, unspecified,...",Infectious and parasitic diseases,2974,2,0.48,0.4563032194,0.06,1.72
698 ,Pruritus and related conditions,Diseases of the skin and subcutaneous...,2994,2,0.47,0.4572112161,0.06,1.71
478.8 ,Upper respiratory tract hypersensitivity...,Diseases of the respiratory system,3051,2,0.46,0.4602277981,0.06,1.68
854.0 ,Intracranial injury of other and...,Injury and poisoning,4756,3,0.45,0.1765238256,0.09,1.31
884 ,Multiple and unspecified open...,Injury and poisoning,6605,4,0.43,0.0969854853,0.12,1.1
370.0 ,Corneal ulcer,Diseases of the nervous system,1904,1,0.37,0.5335668119,0.01,2.08
921.1 ,Contusion of eyelids and periocular...,Injury and poisoning,1969,0,0.36,0.1249063121,,1.33
875.0 ,"Open wound of chest (wall), without...",Injury and poisoning,2075,1,0.34,0.3823274024,0.01,1.9
380.23 ,Other chronic otitis externa,Diseases of the nervous system,2159,1,0.33,0.3842962885,0.01,1.83
910.9 ,Other and unspecified superficial...,Injury and poisoning,2183,0,0.32,0.0832625452,,1.2
523.0 ,Acute gingivitis,Diseases of the digestive system,4522,2,0.31,0.1066839982,0.04,1.13
242.00 ,Toxic diffuse goiter without mention...,"Endocrine, nutritional and metabolic...",2303,1,0.31,0.3925096769,0.01,1.71
303.90 ,Other and unspecified alcohol...,Mental disorders,2310,1,0.31,0.3930522291,0.01,1.71
810.00 ,"Closed fracture of clavicle, unspecified...",Injury and poisoning,4768,2,0.3,0.0777237077,0.04,1.07
345.9 ,"Epilepsy, unspecified",Diseases of the nervous system,2478,1,0.29,0.2775130388,0.01,1.59
242.9 ,Thyrotoxicosis w/m of goiter or...,"Endocrine, nutritional and metabolic...",2520,1,0.28,0.2792847118,0.01,1.57
904.9 ,Injury to blood vessels of unspecified...,Injury and poisoning,2670,0,0.26,0.0380535836,,0.98
959.5 ,Finger injury,Injury and poisoning,2694,1,0.26,0.1976250269,0.01,1.47
692.5 ,Contact dermatitis and other eczema...,Diseases of the skin and subcutaneous...,2964,1,0.24,0.1412237235,0.01,1.33
532.9 ,"Duodenal ulcer, unspecified as...",Diseases of the digestive system,2975,1,0.24,0.1412945281,0.01,1.33
