009.0 ,"Infectious colitis, enteritis,...",Infectious and parasitic diseases,64048,67,0.87,0.2941383048,0.67,1.11
009.1 ,"Colitis, enteritis, and gastroenteritis...",Infectious and parasitic diseases,23861,25,0.87,0.5715173166,0.56,1.29
844.9 ,Sprains and strains of unspecified...,Injury and poisoning,11453,12,0.87,0.7856233322,0.45,1.53
876.0 ,"Open wound of back, without mention...",Injury and poisoning,1925,2,0.87,1,0.1,3.14
272.9 ,Unspecified disorder of lipoid...,"Endocrine, nutritional and metabolic...",5789,6,0.87,1,0.32,1.89
296.20 ,"Major depressive affective disorder,...",Mental disorders,2876,3,0.87,1,0.18,2.55
300.4 ,Dysthymic disorder,Mental disorders,25873,27,0.87,0.5263165001,0.57,1.27
719.99 ,"Unspecified disorder of joint,...",Diseases of the musculoskeletal...,2887,3,0.87,1,0.18,2.54
571.2 ,Alcoholic cirrhosis of liver,Diseases of the digestive system,3823,4,0.87,1,0.24,2.24
380.22 ,Other acute otitis externa,Diseases of the nervous system,20320,21,0.86,0.6087993791,0.53,1.32
599 ,Other disorders of urethra and...,Diseases of the genitourinary...,5834,6,0.86,1,0.31,1.87
466.1 ,Acute bronchiolitis,Diseases of the respiratory system,77375,80,0.86,0.2013737476,0.68,1.07
922.9 ,Contusion of unspecified part...,Injury and poisoning,8747,9,0.86,0.8758610595,0.39,1.63
564 ,"Functional digestive disorders,...",Diseases of the digestive system,24350,25,0.86,0.5128934591,0.55,1.27
823.00 ,Closed fracture of upper end of...,Injury and poisoning,1956,2,0.85,1,0.1,3.09
692.89 ,Contact dermatitis and other eczema...,Diseases of the skin and subcutaneous...,18724,19,0.85,0.5938682455,0.51,1.33
519.8 ,Other diseases of respiratory...,Diseases of the respiratory system,2954,3,0.85,1,0.17,2.48
916.1 ,"Abrasion or friction burn of hip,...",Injury and poisoning,2947,3,0.85,1,0.18,2.49
300.3 ,Obsessive-compulsive disorders,Mental disorders,1967,2,0.85,1,0.1,3.08
727.09 ,Other synovitis and tenosynovitis,Diseases of the musculoskeletal...,4928,5,0.85,1,0.27,1.98
575.6 ,Cholesterolosis of gallbladder,Diseases of the digestive system,1981,2,0.84,1,0.1,3.05
680.0 ,Carbuncle and furuncle of face,Diseases of the skin and subcutaneous...,6960,7,0.84,0.8609977477,0.34,1.73
684 ,Impetigo,Diseases of the skin and subcutaneous...,3970,4,0.84,1,0.23,2.16
364.00 ,"Acute and subacute iridocyclitis,...",Diseases of the nervous system,3986,4,0.84,1,0.23,2.15
401.0 ,Malignant essential hypertension,Diseases of the circulatory system,2024,2,0.83,1,0.1,2.99
692.8 ,"Contact dermatitis and other eczema,...",Diseases of the skin and subcutaneous...,4018,4,0.83,1,0.23,2.13
532.70 ,Chronic duodenal ulcer without...,Diseases of the digestive system,12044,12,0.83,0.6899473577,0.43,1.46
362.6 ,Peripheral retinal degeneration,Diseases of the nervous system,2001,2,0.83,1,0.1,3.02
933 ,Foreign body in pharynx and larynx,Injury and poisoning,2013,2,0.83,1,0.1,3
386 ,Vertiginous syndromes and other...,Diseases of the nervous system,5064,5,0.82,0.8390998769,0.27,1.93
588.9 ,Unspecified disorder resulting...,Diseases of the genitourinary...,3109,3,0.81,1,0.17,2.36
606 ,Azoospermia,Diseases of the genitourinary...,2058,2,0.81,1,0.1,2.94
110.9 ,Dermatophytosis of unspecified...,Infectious and parasitic diseases,49132,48,0.81,0.1643240313,0.6,1.08
492.8 ,Other emphysema,Diseases of the respiratory system,2057,2,0.81,1,0.1,2.94
531.30 ,Acute gastric ulcer without mention...,Diseases of the digestive system,6163,6,0.81,0.8521240723,0.3,1.77
564.5 ,Functional diarrhea,Diseases of the digestive system,24609,24,0.81,0.3529801145,0.52,1.21
844.8 ,Sprains and strains of other specified...,Injury and poisoning,2092,2,0.8,1,0.1,2.89
715.09 ,"Osteoarthrosis, generalized, multiple...",Diseases of the musculoskeletal...,2078,2,0.8,1,0.1,2.91
372.39 ,Other conjunctivitis,Diseases of the nervous system,5219,5,0.8,0.8398500229,0.26,1.87
573 ,Other disorders of liver,Diseases of the digestive system,2096,2,0.8,1,0.1,2.89
823 ,Fracture of tibia and fibula,Injury and poisoning,2114,2,0.79,1,0.1,2.86
705.81 ,Dyshidrosis,Diseases of the skin and subcutaneous...,32815,31,0.79,0.1971863832,0.53,1.12
595.0 ,Acute cystitis,Diseases of the genitourinary...,23418,22,0.78,0.2943651044,0.49,1.19
005.9 ,"Food poisoning, unspecified",Infectious and parasitic diseases,2152,2,0.78,1,0.09,2.81
070 ,Viral hepatitis,Infectious and parasitic diseases,4258,4,0.78,0.8243809808,0.21,2.01
710.2 ,Sicca syndrome,Diseases of the musculoskeletal...,2149,2,0.78,1,0.09,2.81
362.60 ,"Peripheral retinal degeneration,...",Diseases of the nervous system,3210,3,0.78,1,0.16,2.29
933.1 ,Foreign body in larynx,Injury and poisoning,11745,11,0.78,0.5026083156,0.39,1.4
680.6 ,"Carbuncle and furuncle of leg,...",Diseases of the skin and subcutaneous...,2178,2,0.77,1,0.09,2.78
682.7 ,"Cellulitis and abscess of foot,...",Diseases of the skin and subcutaneous...,4344,4,0.77,0.8249039248,0.21,1.97
523.9 ,Unspecified gingival and periodontal...,Diseases of the digestive system,5429,5,0.77,0.6956509128,0.25,1.8
597.89 ,Other urethritis,Diseases of the genitourinary...,4379,4,0.76,0.8252155282,0.21,1.96
461.0 ,Acute maxillary sinusitis,Diseases of the respiratory system,19849,18,0.76,0.3000181154,0.45,1.2
216.5 ,"Benign neoplasm of skin of trunk,...",Neoplasms,3279,3,0.76,1,0.16,2.24
296.30 ,"Major depressive affective disorder,...",Mental disorders,2205,2,0.76,1,0.09,2.74
728.9 ,"Unspecified disorder of muscle,...",Diseases of the musculoskeletal...,21961,20,0.76,0.2389112302,0.46,1.17
569.3 ,Hemorrhage of rectum and anus,Diseases of the digestive system,6548,6,0.76,0.7177705597,0.28,1.67
788.0 ,Renal colic,"Comorbidities, signs, and ill-defined...",19925,18,0.75,0.2569684347,0.44,1.19
682.2 ,Cellulitis and abscess of trunk,Diseases of the skin and subcutaneous...,2230,2,0.75,1,0.09,2.71
464.1 ,Acute tracheitis,Diseases of the respiratory system,17688,16,0.75,0.3234679764,0.43,1.23
464.11 ,Acute tracheitis with obstruction,Diseases of the respiratory system,11169,10,0.75,0.4896708645,0.36,1.38
471.9 ,Unspecified nasal polyp,Diseases of the respiratory system,2228,2,0.75,1,0.09,2.71
719.90 ,"Unspecified disorder of joint,...",Diseases of the musculoskeletal...,2236,2,0.75,1,0.09,2.7
355.0 ,Lesion of sciatic nerve,Diseases of the nervous system,2219,2,0.75,1,0.09,2.73
727.05 ,Other tenosynovitis of hand and...,Diseases of the musculoskeletal...,4435,4,0.75,0.8258287452,0.2,1.93
370.23 ,Filamentary keratitis,Diseases of the nervous system,2218,2,0.75,1,0.09,2.73
787.9 ,Other symptoms involving digestive...,"Comorbidities, signs, and ill-defined...",9054,8,0.74,0.5391442884,0.32,1.46
692.1 ,Contact dermatitis and other eczema...,Diseases of the skin and subcutaneous...,2256,2,0.74,1,0.09,2.68
494 ,Bronchiectasis,Diseases of the respiratory system,4541,4,0.74,0.8273594157,0.2,1.89
531.90 ,"Gastric ulcer, unspecified as...",Diseases of the digestive system,21276,19,0.74,0.2302408513,0.45,1.16
555.0 ,Regional enteritis of small intestine,Diseases of the digestive system,3392,3,0.74,0.8044175041,0.15,2.16
110.8 ,Dermatophytosis of other specified...,Infectious and parasitic diseases,3423,3,0.73,0.8045589032,0.15,2.14
493.00 ,"Extrinsic asthma, unspecified",Diseases of the respiratory system,4585,4,0.73,0.6708693055,0.2,1.87
345 ,Epilepsy,Diseases of the nervous system,2303,2,0.73,1,0.09,2.63
726.10 ,Disorders of bursae and tendons...,Diseases of the musculoskeletal...,6874,6,0.73,0.5974485234,0.27,1.59
555.1 ,Regional enteritis of large intestine,Diseases of the digestive system,3446,3,0.73,0.8047053394,0.15,2.13
402.9 ,Hypertensive heart disease unspecified,Diseases of the circulatory system,3479,3,0.72,0.8049760234,0.15,2.11
692.4 ,Contact dermatitis and other eczema...,Diseases of the skin and subcutaneous...,17330,15,0.72,0.2673587406,0.4,1.19
272 ,Disorders of lipoid metabolism,"Endocrine, nutritional and metabolic...",8135,7,0.72,0.5173993119,0.29,1.48
943.00 ,Burn of unspecified degree of...,Injury and poisoning,2333,2,0.72,1,0.09,2.59
386.12 ,Vestibular neuronitis,Diseases of the nervous system,4717,4,0.71,0.6716743576,0.19,1.82
250.40 ,"Diabetes with renal manifestations,...","Endocrine, nutritional and metabolic...",2338,2,0.71,1,0.09,2.59
485 ,"Bronchopneumonia, organism unspecified",Diseases of the respiratory system,8219,7,0.71,0.5189412237,0.29,1.47
719.46 ,"Pain in joint, lower leg",Diseases of the musculoskeletal...,10534,9,0.71,0.3944170897,0.33,1.36
706.0 ,Acne varioliformis,Diseases of the skin and subcutaneous...,8308,7,0.7,0.4270888656,0.28,1.45
362.41 ,Central serous retinopathy,Diseases of the nervous system,3589,3,0.7,0.8063737672,0.14,2.04
372.05 ,Acute atopic conjunctivitis,Diseases of the nervous system,2385,2,0.7,1,0.08,2.53
788.1 ,Dysuria,"Comorbidities, signs, and ill-defined...",4872,4,0.69,0.6743274714,0.19,1.76
629.9 ,Unspecified disorder of female...,Diseases of the genitourinary...,2429,2,0.69,1,0.08,2.49
009.3 ,Diarrhea of presumed infectious...,Infectious and parasitic diseases,13241,11,0.69,0.2561069934,0.34,1.24
110.0 ,Dermatophytosis of scalp and beard,Infectious and parasitic diseases,2415,2,0.69,1,0.08,2.5
111.8 ,Other specified dermatomycoses,Infectious and parasitic diseases,2468,2,0.68,1,0.08,2.45
477.8 ,Allergic rhinitis due to other...,Diseases of the respiratory system,9773,8,0.68,0.3756032534,0.29,1.35
706.8 ,Other specified diseases of sebaceous...,Diseases of the skin and subcutaneous...,2449,2,0.68,1,0.08,2.47
535.10 ,"Atrophic gastritis, without mention...",Diseases of the digestive system,2450,2,0.68,1,0.08,2.47
367.53 ,Spasm of accommodation,Diseases of the nervous system,3686,3,0.68,0.8082004446,0.14,1.99
823.80 ,Closed fracture of unspecified...,Injury and poisoning,2487,2,0.67,1,0.08,2.43
890.0 ,"Open wound of hip and thigh, without...",Injury and poisoning,4993,4,0.67,0.5401757696,0.18,1.71
303.00 ,Acute alcoholic intoxication in...,Mental disorders,2501,2,0.67,1,0.08,2.42
723.4 ,"Brachial neuritis or radiculitis,...",Diseases of the musculoskeletal...,4955,4,0.67,0.6764557212,0.18,1.73
008.5 ,"Bacterial enteritis, unspecified",Infectious and parasitic diseases,5026,4,0.66,0.540318486,0.18,1.7
137.0 ,Late effects of respiratory or...,Infectious and parasitic diseases,3811,3,0.66,0.6390712542,0.14,1.92
715.30 ,"Osteoarthrosis, localized, not...",Diseases of the musculoskeletal...,2517,2,0.66,0.775668846,0.08,2.4
276.5 ,Volume depletion,"Endocrine, nutritional and metabolic...",7592,6,0.66,0.4031988399,0.24,1.44
531.00 ,"Acute gastric ulcer with hemorrhage,...",Diseases of the digestive system,2537,2,0.66,0.7757139333,0.08,2.38
307.4 ,Specific disorders of sleep of...,Mental disorders,2537,2,0.66,0.7757139333,0.08,2.38
922.8 ,Contusion of multiple sites of...,Injury and poisoning,3794,3,0.66,0.638949128,0.14,1.93
414.9 ,"Chronic ischemic heart disease,...",Diseases of the circulatory system,15440,12,0.65,0.1586080024,0.33,1.13
844.2 ,Sprain of cruciate ligament of...,Injury and poisoning,2574,2,0.65,0.7759072566,0.08,2.35
696.1 ,Other psoriasis,Diseases of the skin and subcutaneous...,7647,6,0.65,0.4039996608,0.24,1.43
381.01 ,Acute serous otitis media,Diseases of the nervous system,2595,2,0.64,0.7760790654,0.08,2.33
604.90 ,"Orchitis and epididymitis, unspecified",Diseases of the genitourinary...,5201,4,0.64,0.5428008961,0.17,1.65
524.60 ,"Temporomandibular joint disorders,...",Diseases of the digestive system,2625,2,0.64,0.7764004998,0.08,2.3
372.12 ,Chronic follicular conjunctivitis,Diseases of the nervous system,2625,2,0.64,0.7764004998,0.08,2.3
402.10 ,Benign hypertensive heart disease...,Diseases of the circulatory system,5298,4,0.63,0.5453692637,0.17,1.62
428.0 ,"Congestive heart failure, unspecified",Diseases of the circulatory system,2668,2,0.63,0.7770127119,0.08,2.27
845.10 ,"Sprain of foot, unspecified site",Injury and poisoning,3968,3,0.63,0.6415962096,0.13,1.85
519.9 ,Unspecified disease of respiratory...,Diseases of the respiratory system,5317,4,0.63,0.5459670471,0.17,1.61
349.89 ,Other specified disorders of nervous...,Diseases of the nervous system,2662,2,0.63,0.7769167974,0.08,2.27
705.1 ,Prickly heat,Diseases of the skin and subcutaneous...,6773,5,0.62,0.3753170888,0.2,1.44
719.48 ,"Pain in joint, other specified...",Diseases of the musculoskeletal...,4039,3,0.62,0.6435234497,0.13,1.81
530.8 ,Other specified disorders of esophagus,Diseases of the digestive system,2713,2,0.62,0.777837447,0.07,2.23
215.0 ,Other benign neoplasm of connective...,Neoplasms,4098,3,0.61,0.6454726309,0.13,1.79
367.9 ,Unspecified disorder of refraction...,Diseases of the nervous system,14986,11,0.61,0.1208550355,0.3,1.1
379.90 ,"Disorder of eye, unspecified",Diseases of the nervous system,2789,2,0.6,0.7796347569,0.07,2.17
381.4 ,"Nonsuppurative otitis media, not...",Diseases of the nervous system,4173,3,0.6,0.5020439753,0.12,1.76
455.3 ,External hemorrhoids without mention...,Diseases of the circulatory system,2830,2,0.59,0.7808034406,0.07,2.13
693.0 ,Dermatitis due to drugs and medicines...,Diseases of the skin and subcutaneous...,5691,4,0.59,0.4366312982,0.16,1.5
300.09 ,Other anxiety states,Mental disorders,5735,4,0.58,0.3406579165,0.16,1.49
722 ,Intervertebral disc disorders,Diseases of the musculoskeletal...,5790,4,0.58,0.3408627645,0.16,1.48
845.19 ,Other sprain of foot,Injury and poisoning,2946,2,0.57,0.5950059096,0.07,2.05
242.00 ,Toxic diffuse goiter without mention...,"Endocrine, nutritional and metabolic...",2946,2,0.57,0.5950059096,0.07,2.05
280.9 ,"Iron deficiency anemia, unspecified",Diseases of the blood and blood-forming...,2924,2,0.57,0.5948659971,0.07,2.07
367.4 ,Presbyopia,Diseases of the nervous system,2928,2,0.57,0.5948859687,0.07,2.06
565.1 ,Anal fistula,Diseases of the digestive system,7268,5,0.57,0.3027947962,0.19,1.34
724 ,Other and unspecified disorders...,Diseases of the musculoskeletal...,4434,3,0.56,0.5077631432,0.12,1.65
476.0 ,Chronic laryngitis,Diseases of the respiratory system,3017,2,0.55,0.5959482653,0.07,2
708.1 ,Idiopathic urticaria,Diseases of the skin and subcutaneous...,6057,4,0.55,0.3460487174,0.15,1.41
282.4 ,Thalassemias,Diseases of the blood and blood-forming...,3012,2,0.55,0.5958578997,0.07,2.01
780.8 ,Generalized hyperhidrosis,"Comorbidities, signs, and ill-defined...",3089,2,0.54,0.5976381034,0.07,1.96
704.09 ,Other alopecia,Diseases of the skin and subcutaneous...,3063,2,0.54,0.5969451988,0.07,1.97
372.02 ,Acute follicular conjunctivitis,Diseases of the nervous system,7698,5,0.54,0.1872031742,0.18,1.27
455.9 ,Residual hemorrhoidal skin tags,Diseases of the circulatory system,3164,2,0.53,0.6001394875,0.06,1.91
298.9 ,Unspecified psychosis,Mental disorders,3154,2,0.53,0.5997639696,0.06,1.91
558.2 ,Toxic gastroenteritis and colitis,Diseases of the digestive system,3153,2,0.53,0.5997271151,0.06,1.92
727.43 ,"Ganglion, unspecified",Diseases of the musculoskeletal...,3155,2,0.53,0.5998009512,0.06,1.91
493.91 ,"Asthma, unspecified type, with...",Diseases of the respiratory system,3235,2,0.52,0.6031611199,0.06,1.87
535.01 ,"Acute gastritis, with hemorrhage",Diseases of the digestive system,3433,2,0.49,0.4540058403,0.06,1.76
370.49 ,Other keratoconjunctivitis,Diseases of the nervous system,5071,3,0.49,0.3041724096,0.1,1.44
590.10 ,Acute pyelonephritis without lesion...,Diseases of the genitourinary...,3460,2,0.48,0.4547658072,0.06,1.75
709.0 ,Dyschromia,Diseases of the skin and subcutaneous...,5201,3,0.48,0.3081347381,0.1,1.41
556 ,Idiopathic proctocolitis,Diseases of the digestive system,3485,2,0.48,0.4555667064,0.06,1.73
240.9 ,"Goiter, unspecified","Endocrine, nutritional and metabolic...",3519,2,0.47,0.4568029407,0.06,1.72
491.0 ,Simple chronic bronchitis,Diseases of the respiratory system,9178,5,0.45,0.0687985905,0.15,1.06
726.11 ,Calcifying tendinitis of shoulder,Diseases of the musculoskeletal...,1866,1,0.45,0.7324700311,0.01,2.5
370.40 ,"Keratoconjunctivitis, unspecified",Diseases of the nervous system,5615,3,0.45,0.1764667009,0.09,1.3
575.0 ,Acute cholecystitis,Diseases of the digestive system,1877,0,0.44,0.1828961944,,1.64
371.9 ,Unspecified corneal disorder,Diseases of the nervous system,1873,0,0.44,0.1828672064,,1.64
434.9 ,"Cerebral artery occlusion, unspecified",Diseases of the circulatory system,1925,1,0.43,0.7347075369,0.01,2.42
695.0 ,Toxic erythema,Diseases of the skin and subcutaneous...,1959,0,0.43,0.1844488041,,1.57
250.9 ,Diabetes with unspecified complication,"Endocrine, nutritional and metabolic...",1931,1,0.43,0.7349624993,0.01,2.41
493.10 ,"Intrinsic asthma, unspecified",Diseases of the respiratory system,1957,1,0.43,0.7361230968,0.01,2.38
726.19 ,Other specified disorders of bursae...,Diseases of the musculoskeletal...,3921,2,0.43,0.3466830093,0.05,1.54
737.30 ,"Scoliosis [and kyphoscoliosis],...",Diseases of the musculoskeletal...,1952,1,0.43,0.7358929691,0.01,2.39
682.5 ,Cellulitis and abscess of buttock,Diseases of the skin and subcutaneous...,2001,0,0.42,0.1859280811,,1.54
875.0 ,"Open wound of chest (wall), without...",Injury and poisoning,2003,1,0.42,0.7383892787,0.01,2.33
487.0 ,Influenza with pneumonia,Diseases of the respiratory system,3967,2,0.42,0.3487658316,0.05,1.52
533.70 ,Chronic peptic ulcer of unspecified...,Diseases of the digestive system,13767,7,0.42,0.0130700882,0.17,0.87
353.1 ,Lumbosacral plexus lesions,Diseases of the nervous system,2002,0,0.42,0.1859687601,,1.54
702.1 ,Seborrheic keratosis,Diseases of the skin and subcutaneous...,2045,1,0.41,0.5290014089,0.01,2.28
003.0 ,Salmonella gastroenteritis,Infectious and parasitic diseases,2097,1,0.4,0.5293189042,0.01,2.22
438 ,Late effects of cerebrovascular...,Diseases of the circulatory system,2082,1,0.4,0.5291602865,0.01,2.24
455.1 ,Internal thrombosed hemorrhoids,Diseases of the circulatory system,2093,1,0.4,0.5292713735,0.01,2.23
274.89 ,Gout with other specified manifestations,"Endocrine, nutritional and metabolic...",4133,2,0.4,0.2562501817,0.05,1.46
723.8 ,Other syndromes affecting cervical...,Diseases of the musculoskeletal...,2074,1,0.4,0.5290977078,0.01,2.25
540 ,Acute appendicitis,Diseases of the digestive system,2086,1,0.4,0.52919734,0.01,2.23
935.1 ,Foreign body in esophagus,Injury and poisoning,2102,1,0.4,0.5293836343,0.01,2.22
436 ,"Acute, but ill-defined, cerebrovascular...",Diseases of the circulatory system,2114,1,0.39,0.529562923,0.01,2.2
532.00 ,"Acute duodenal ulcer with hemorrhage,...",Diseases of the digestive system,2112,1,0.39,0.5295307065,0.01,2.21
723.9 ,Unspecified musculoskeletal disorders...,Diseases of the musculoskeletal...,2118,1,0.39,0.5296301431,0.01,2.2
358.9 ,"Myoneural disorders, unspecified",Diseases of the nervous system,2162,1,0.39,0.5306107262,0.01,2.15
738.4 ,Acquired spondylolisthesis,Diseases of the musculoskeletal...,2159,1,0.39,0.5305300388,0.01,2.16
695.89 ,Other specified erythematous conditions,Diseases of the skin and subcutaneous...,4400,2,0.38,0.1899916542,0.05,1.37
316 ,Psychic factors associated with...,Mental disorders,2220,1,0.38,0.5325544152,0.01,2.1
381.00 ,"Acute nonsuppurative otitis media,...",Diseases of the nervous system,4483,2,0.37,0.1908157659,0.04,1.35
714.9 ,Unspecified inflammatory polyarthropathy,Diseases of the musculoskeletal...,2225,0,0.37,0.1230907312,,1.38
519 ,Other diseases of respiratory...,Diseases of the respiratory system,2340,0,0.36,0.1254842019,,1.32
372.40 ,"Pterygium, unspecified",Diseases of the nervous system,5123,2,0.33,0.1039374653,0.04,1.18
788.9 ,Other symptoms involving urinary...,"Comorbidities, signs, and ill-defined...",2711,1,0.31,0.3922879986,0.01,1.72
216.4 ,Benign neoplasm of scalp and skin...,Neoplasms,2650,0,0.31,0.0844481278,,1.16
464.4 ,Croup,Diseases of the respiratory system,2751,1,0.3,0.3950098693,0.01,1.69
372.71 ,Hyperemia of conjunctiva,Diseases of the nervous system,2741,0,0.3,0.0868898729,,1.12
041.8 ,Other specified bacterial infections,Infectious and parasitic diseases,2850,1,0.29,0.2757839428,0.01,1.63
912.0 ,Abrasion or friction burn of shoulder...,Injury and poisoning,2989,0,0.28,0.0574393889,,1.03
720.1 ,Spinal enthesopathy,Diseases of the musculoskeletal...,3013,1,0.28,0.2811717743,0.01,1.54
054.2 ,Herpetic gingivostomatitis,Infectious and parasitic diseases,3045,1,0.27,0.2828033952,0.01,1.53
431 ,Intracerebral hemorrhage,Diseases of the circulatory system,3118,1,0.27,0.1972936866,0.01,1.49
873.41 ,"Open wound of cheek, without mention...",Injury and poisoning,3080,1,0.27,0.2847919408,0.01,1.51
722.91 ,"Other and unspecified disc disorder,...",Diseases of the musculoskeletal...,3107,0,0.27,0.0600249454,,0.99
306.8 ,Other specified psychophysiological...,Mental disorders,3315,1,0.25,0.2006471105,0.01,1.4
565.0 ,Anal fissure,Diseases of the digestive system,6552,2,0.25,0.0298902942,0.03,0.92
360.89 ,Other disorders of globe,Diseases of the nervous system,3744,1,0.22,0.1464606417,0.01,1.24
482.9 ,"Bacterial pneumonia, unspecified",Diseases of the respiratory system,3943,1,0.21,0.1017477311,0.01,1.18
715.16 ,"Osteoarthrosis, localized, primary,...",Diseases of the musculoskeletal...,4637,0,0.18,0.0085485741,,0.66
