436 ,"Acute, but ill-defined, cerebrovascular...",Diseases of the circulatory system,6886,58,1.97,0.0000029441964,1.5,2.56
440.9 ,Generalized and unspecified atherosclerosis,Diseases of the circulatory system,4163,35,1.97,0.0003001675,1.37,2.74
702.8 ,Other specified dermatoses,Diseases of the skin and subcutaneous...,5465,46,1.97,0.0000284439,1.44,2.64
722.71 ,Intervertebral disc disorder with...,Diseases of the musculoskeletal...,2738,23,1.96,0.0029709864,1.24,2.96
724.2 ,Lumbago,Diseases of the musculoskeletal...,220095,1634,1.96,6.25694e-110,1.86,2.08
724.5 ,"Backache, unspecified",Diseases of the musculoskeletal...,151376,1163,1.96,8.993368e-83,1.83,2.08
729.2 ,"Neuralgia, neuritis, and radiculitis,...",Diseases of the musculoskeletal...,70040,565,1.96,2.157532e-44,1.8,2.14
302.70 ,"Psychosexual dysfunction, unspecified",Mental disorders,2385,20,1.96,0.0066136316,1.19,3.04
353.1 ,Lumbosacral plexus lesions,Diseases of the nervous system,2386,20,1.96,0.0066255978,1.19,3.04
959.7 ,"Knee, leg, ankle, and foot injury",Injury and poisoning,3596,30,1.95,0.000785628,1.31,2.79
300.09 ,Other anxiety states,Mental disorders,6837,57,1.95,0.0000045136734,1.48,2.54
008.5 ,"Bacterial enteritis, unspecified",Infectious and parasitic diseases,4712,39,1.94,0.0001888329,1.37,2.66
881.00 ,"Open wound of forearm, without...",Injury and poisoning,10800,89,1.94,0.000000021403884,1.55,2.39
354.0 ,Carpal tunnel syndrome,Diseases of the nervous system,14426,119,1.94,0.00000000009981968,1.61,2.33
714.0 ,Rheumatoid arthritis,Diseases of the musculoskeletal...,13278,109,1.93,0.0000000006118059,1.58,2.34
581.9 ,Nephrotic syndrome with unspecified...,Diseases of the genitourinary...,3881,32,1.93,0.0007578931,1.32,2.73
733.42 ,Aseptic necrosis of head and neck...,Diseases of the musculoskeletal...,5214,43,1.93,0.0001088423,1.39,2.61
478.9 ,Other and unspecified diseases...,Diseases of the respiratory system,12293,101,1.93,0.0000000027103524,1.57,2.35
894.0 ,Multiple and unspecified open...,Injury and poisoning,42375,340,1.92,1.864893e-26,1.71,2.14
959.8 ,"Other specified sites, including...",Injury and poisoning,1948,16,1.92,0.0141448247,1.09,3.13
722.2 ,Displacement of intervertebral...,Diseases of the musculoskeletal...,16668,136,1.92,0.000000000007345268,1.61,2.28
573.9 ,Unspecified disorder of liver,Diseases of the digestive system,14122,115,1.92,0.0000000003643678,1.58,2.31
215.2 ,Other benign neoplasm of connective...,Neoplasms,1946,16,1.92,0.0140565045,1.1,3.13
780.9 ,Other general symptoms,"Comorbidities, signs, and ill-defined...",11478,94,1.92,0.000000010804181,1.55,2.36
680.8 ,Carbuncle and furuncle of other...,Diseases of the skin and subcutaneous...,2672,22,1.92,0.0044201222,1.2,2.92
691 ,Atopic dermatitis and related...,Diseases of the skin and subcutaneous...,1821,15,1.92,0.0177867677,1.07,3.19
346.1 ,Common migraine,Diseases of the nervous system,3282,27,1.92,0.0018330187,1.27,2.81
370.20 ,"Superficial keratitis, unspecified",Diseases of the nervous system,8586,70,1.91,0.00000085123035,1.49,2.42
923.9 ,Contusion of unspecified part...,Injury and poisoning,7625,62,1.91,0.0000040255153,1.46,2.45
110.2 ,Dermatophytosis of hand,Infectious and parasitic diseases,5637,46,1.91,0.0000598469,1.4,2.56
608.4 ,Other inflammatory disorders of...,Diseases of the genitourinary...,1957,16,1.91,0.0145527396,1.09,3.11
715.35 ,"Osteoarthrosis, localized, not...",Diseases of the musculoskeletal...,4192,34,1.9,0.0007901804,1.31,2.66
721.0 ,Cervical spondylosis without myelopathy,Diseases of the musculoskeletal...,31770,254,1.9,9.030536e-20,1.67,2.15
464.21 ,Acute laryngotracheitis with obstruction,Diseases of the respiratory system,4312,35,1.9,0.000607109,1.32,2.65
723.5 ,"Torticollis, unspecified",Diseases of the musculoskeletal...,3332,27,1.89,0.0020938538,1.25,2.76
823.00 ,Closed fracture of upper end of...,Injury and poisoning,1987,16,1.88,0.0230405091,1.07,3.07
402.00 ,Malignant hypertensive heart disease...,Diseases of the circulatory system,3506,28,1.87,0.0025661577,1.24,2.71
847 ,Sprains and strains of other and...,Injury and poisoning,2379,19,1.87,0.0110445304,1.12,2.92
848.0 ,Sprain of septal cartilage of...,Injury and poisoning,2253,18,1.87,0.0140221981,1.1,2.96
788.3 ,Incontinence of urine,"Comorbidities, signs, and ill-defined...",3259,26,1.87,0.0030187738,1.22,2.74
477.8 ,Allergic rhinitis due to other...,Diseases of the respiratory system,9386,75,1.87,0.00000075127531,1.47,2.36
533.40 ,Chronic or unspecified peptic...,Diseases of the digestive system,8331,66,1.86,0.0000047155444,1.43,2.37
535.01 ,"Acute gastritis, with hemorrhage",Diseases of the digestive system,3653,29,1.86,0.0021151221,1.24,2.67
722.93 ,"Other and unspecified disc disorder,...",Diseases of the musculoskeletal...,9337,74,1.86,0.0000015018641,1.46,2.34
214.1 ,Lipoma of other skin and subcutaneous...,Neoplasms,3016,24,1.86,0.0048073015,1.19,2.78
593.2 ,"Cyst of kidney, acquired",Diseases of the genitourinary...,2134,17,1.86,0.018265604,1.08,2.99
296.20 ,"Major depressive affective disorder,...",Mental disorders,2891,23,1.86,0.0060931592,1.18,2.8
701.1 ,"Keratoderma, acquired",Diseases of the skin and subcutaneous...,6683,53,1.86,0.0000459066,1.39,2.44
009.3 ,Diarrhea of presumed infectious...,Infectious and parasitic diseases,10803,85,1.85,0.00000027949914,1.47,2.29
726.12 ,Bicipital tenosynovitis,Diseases of the musculoskeletal...,3164,25,1.85,0.0040790374,1.19,2.73
413.0 ,Angina decubitus,Diseases of the circulatory system,1889,15,1.85,0.0314795695,1.04,3.07
307.42 ,Persistent disorder of initiating...,Mental disorders,6077,48,1.85,0.0001066356,1.36,2.46
372.05 ,Acute atopic conjunctivitis,Diseases of the nervous system,2156,17,1.84,0.0190861281,1.07,2.96
601.9 ,"Prostatitis, unspecified",Diseases of the genitourinary...,8265,65,1.84,0.000006681923,1.42,2.35
786.51 ,Precordial pain,"Comorbidities, signs, and ill-defined...",6494,51,1.84,0.0000812168,1.37,2.42
923 ,Contusion of upper limb,Injury and poisoning,2806,22,1.83,0.0084246429,1.15,2.78
720.9 ,Unspecified inflammatory spondylopathy,Diseases of the musculoskeletal...,2294,18,1.83,0.0154459259,1.08,2.91
723.2 ,Cervicocranial syndrome,Diseases of the musculoskeletal...,2930,23,1.83,0.0066454301,1.16,2.76
683 ,Acute lymphadenitis,Diseases of the skin and subcutaneous...,3200,25,1.83,0.0060661146,1.18,2.7
692.1 ,Contact dermatitis and other eczema...,Diseases of the skin and subcutaneous...,2292,18,1.83,0.0153691238,1.08,2.91
949.0 ,"Burn of unspecified site, unspecified...",Injury and poisoning,7075,55,1.82,0.0000515405,1.37,2.38
571.41 ,Chronic persistent hepatitis,Diseases of the digestive system,12399,96,1.82,0.0000001251255,1.47,2.23
850.9 ,"Concussion, unspecified",Injury and poisoning,8640,67,1.82,0.0000101976,1.41,2.31
346.9 ,"Migraine, unspecified",Diseases of the nervous system,14113,109,1.82,0.000000014957253,1.49,2.19
493.10 ,"Intrinsic asthma, unspecified",Diseases of the respiratory system,2582,20,1.81,0.014453949,1.1,2.8
386.00 ,"Minihre's disease, unspecified",Diseases of the nervous system,12944,100,1.81,0.000000075399584,1.47,2.21
583.9 ,"Nephritis and nephropathy, not...",Diseases of the genitourinary...,6472,50,1.81,0.0001215839,1.34,2.39
780.3 ,Convulsions,"Comorbidities, signs, and ill-defined...",3357,26,1.81,0.0050235819,1.18,2.66
307.40 ,"Nonorganic sleep disorder, unspecified",Mental disorders,4664,36,1.81,0.0010428683,1.26,2.51
722.0 ,Displacement of cervical intervertebral...,Diseases of the musculoskeletal...,11180,86,1.8,0.00000064550316,1.44,2.23
380.13 ,Other acute infections of external...,Diseases of the nervous system,2336,18,1.8,0.0244612802,1.06,2.85
382.0 ,Acute suppurative otitis media,Diseases of the nervous system,2332,18,1.8,0.0170524306,1.07,2.86
606.9 ,"Male infertility, unspecified",Diseases of the genitourinary...,2339,18,1.8,0.0245372346,1.06,2.85
682.8 ,Cellulitis and abscess of other...,Diseases of the skin and subcutaneous...,7155,55,1.8,0.000060275,1.35,2.35
789.9 ,Other symptoms involving abdomen...,"Comorbidities, signs, and ill-defined...",2467,19,1.8,0.0189331887,1.08,2.82
958.3 ,Posttraumatic wound infection...,Injury and poisoning,16019,122,1.79,0.0000000060734057,1.48,2.14
723.1 ,Cervicalgia,Diseases of the musculoskeletal...,32950,249,1.79,1.277995e-16,1.57,2.03
427.89 ,Other specified cardiac dysrhythmias,Diseases of the circulatory system,6014,46,1.79,0.000327431,1.31,2.39
738.4 ,Acquired spondylolisthesis,Diseases of the musculoskeletal...,3912,30,1.79,0.0030188952,1.21,2.57
782.3 ,Edema,"Comorbidities, signs, and ill-defined...",16961,129,1.79,0.0000000019283356,1.49,2.13
693.0 ,Dermatitis due to drugs and medicines...,Diseases of the skin and subcutaneous...,5878,45,1.79,0.0002967879,1.3,2.4
402.91 ,Unspecified hypertensive heart...,Diseases of the circulatory system,2229,17,1.78,0.0226430515,1.04,2.86
216.4 ,Benign neoplasm of scalp and skin...,Neoplasms,2882,22,1.78,0.0140608549,1.12,2.71
692.70 ,Unspecified dermatitis due to...,Diseases of the skin and subcutaneous...,2493,19,1.78,0.019697108,1.07,2.79
715.15 ,"Osteoarthrosis, localized, primary,...",Diseases of the musculoskeletal...,2246,17,1.77,0.0331269551,1.03,2.84
110.5 ,Dermatophytosis of the body,Infectious and parasitic diseases,28826,216,1.77,0.00000000000003045337,1.54,2.03
437.0 ,Cerebral atherosclerosis,Diseases of the circulatory system,3439,26,1.77,0.0082287537,1.15,2.6
886.0 ,Traumatic amputation of other...,Injury and poisoning,2376,18,1.77,0.0256689601,1.05,2.8
708 ,Urticaria,Diseases of the skin and subcutaneous...,8642,65,1.76,0.0000319174,1.36,2.25
710.9 ,Unspecified diffuse connective...,Diseases of the musculoskeletal...,1995,15,1.76,0.0376086305,0.98,2.9
370.24 ,Photokeratitis,Diseases of the nervous system,2389,18,1.76,0.0261526574,1.04,2.79
719.99 ,"Unspecified disorder of joint,...",Diseases of the musculoskeletal...,4115,31,1.76,0.0037769469,1.19,2.51
722.90 ,"Other and unspecified disc disorder,...",Diseases of the musculoskeletal...,3456,26,1.76,0.0083902803,1.15,2.58
402.10 ,Benign hypertensive heart disease...,Diseases of the circulatory system,16698,125,1.76,0.0000000088754845,1.46,2.1
756.12 ,Spondylolisthesis,Congenital anomalies,2391,18,1.76,0.026231067,1.04,2.79
782.0 ,Disturbance of skin sensation,"Comorbidities, signs, and ill-defined...",1986,15,1.76,0.0369187135,0.98,2.92
680.9 ,Carbuncle and furuncle of unspecified...,Diseases of the skin and subcutaneous...,32514,242,1.76,0.000000000000002047302,1.54,2.01
784.7 ,Epistaxis,"Comorbidities, signs, and ill-defined...",15587,117,1.76,0.00000002397655,1.46,2.12
692.89 ,Contact dermatitis and other eczema...,Diseases of the skin and subcutaneous...,18457,138,1.76,0.000000001540846,1.47,2.08
704.00 ,"Alopecia, unspecified",Diseases of the skin and subcutaneous...,3983,30,1.76,0.0047774722,1.19,2.52
533.50 ,Chronic or unspecified peptic...,Diseases of the digestive system,3339,25,1.75,0.0108627835,1.13,2.59
278.0 ,Obesity,"Endocrine, nutritional and metabolic...",5076,38,1.75,0.001639669,1.24,2.41
786.00 ,"Respiratory abnormality, unspecified","Comorbidities, signs, and ill-defined...",3874,29,1.75,0.006225319,1.17,2.52
910 ,"Superficial injury of face, neck,...",Injury and poisoning,2416,18,1.74,0.0273015095,1.03,2.76
367.89 ,Other disorders of refraction...,Diseases of the nervous system,5518,41,1.74,0.0012517219,1.24,2.36
386.2 ,Vertigo of central origin,Diseases of the nervous system,6059,45,1.74,0.0007334272,1.26,2.33
681.02 ,Onychia and paronychia of finger,Diseases of the skin and subcutaneous...,3888,29,1.74,0.0063100025,1.16,2.51
519.8 ,Other diseases of respiratory...,Diseases of the respiratory system,2020,15,1.73,0.0396921011,0.97,2.87
531.40 ,Chronic or unspecified gastric...,Diseases of the digestive system,1889,14,1.73,0.049899541,0.94,2.91
923.8 ,Contusion of multiple sites of...,Injury and poisoning,2703,20,1.73,0.0252850984,1.05,2.68
537.9 ,Unspecified disorder of stomach...,Diseases of the digestive system,3906,29,1.73,0.0064358312,1.16,2.5
555.0 ,Regional enteritis of small intestine,Diseases of the digestive system,3104,23,1.73,0.0127974967,1.09,2.6
401.1 ,Benign essential hypertension,Diseases of the circulatory system,37485,274,1.73,2.29627e-16,1.53,1.96
216.6 ,Benign neoplasm of skin of upper...,Neoplasms,3239,24,1.73,0.0143114904,1.11,2.58
608 ,Other disorders of male genital...,Diseases of the genitourinary...,2569,19,1.73,0.0227557208,1.04,2.7
353.8 ,Other nerve root and plexus disorders,Diseases of the nervous system,1886,14,1.73,0.0496166007,0.94,2.92
708.0 ,Allergic urticaria,Diseases of the skin and subcutaneous...,38428,279,1.72,2.736075e-16,1.52,1.94
893.0 ,"Open wound of toe(s), without...",Injury and poisoning,8711,64,1.72,0.0000706731,1.32,2.2
904.9 ,Injury to blood vessels of unspecified...,Injury and poisoning,1905,14,1.72,0.0514831636,0.94,2.89
528.2 ,Oral aphthae,Diseases of the digestive system,18872,138,1.72,0.0000000064544015,1.44,2.04
945.00 ,Burn of unspecified degree of...,Injury and poisoning,2578,19,1.72,0.0232013169,1.03,2.7
565.0 ,Anal fissure,Diseases of the digestive system,5844,43,1.72,0.0008952394,1.24,2.32
401.9 ,Unspecified essential hypertension,Diseases of the circulatory system,172053,1176,1.72,1.382053e-56,1.61,1.83
597.80 ,"Urethritis, unspecified",Diseases of the genitourinary...,16237,119,1.72,0.000000065099388,1.42,2.07
682.1 ,Cellulitis and abscess of neck,Diseases of the skin and subcutaneous...,2032,15,1.72,0.0407798319,0.96,2.85
788.0 ,Renal colic,"Comorbidities, signs, and ill-defined...",20769,152,1.72,0.0000000009253225,1.46,2.02
989.5 ,Toxic effect of venom,Injury and poisoning,5195,38,1.71,0.0019589998,1.21,2.35
722.91 ,"Other and unspecified disc disorder,...",Diseases of the musculoskeletal...,4781,35,1.71,0.0036474246,1.19,2.39
728 ,"Disorders of muscle, ligament,...",Diseases of the musculoskeletal...,12728,93,1.71,0.0000022687691,1.38,2.1
272.9 ,Unspecified disorder of lipoid...,"Endocrine, nutritional and metabolic...",10125,74,1.71,0.000024021,1.34,2.15
682.9 ,Cellulitis and abscess of unspecified...,Diseases of the skin and subcutaneous...,57464,411,1.71,1.547154e-22,1.54,1.89
788.4 ,Frequency of urination and polyuria,"Comorbidities, signs, and ill-defined...",16065,117,1.71,0.00000011051757,1.41,2.06
706.8 ,Other specified diseases of sebaceous...,Diseases of the skin and subcutaneous...,3002,22,1.71,0.016788714,1.07,2.6
919.0 ,"Abrasion or friction burn of other,...",Injury and poisoning,20209,146,1.7,0.0000000056078083,1.43,2
372.40 ,"Pterygium, unspecified",Diseases of the nervous system,10204,74,1.7,0.0000264415,1.33,2.14
375.15 ,"Tear film insufficiency, unspecified",Diseases of the nervous system,14947,108,1.7,0.00000044050759,1.39,2.05
401.0 ,Malignant essential hypertension,Diseases of the circulatory system,5790,42,1.7,0.0016455502,1.22,2.3
272.0 ,Pure hypercholesterolemia,"Endocrine, nutritional and metabolic...",25248,182,1.7,0.00000000008573096,1.46,1.97
465.9 ,Acute upper respiratory infections...,Diseases of the respiratory system,985333,5013,1.7,6.697574e-89,1.61,1.8
487.8 ,Influenza with other manifestations,Diseases of the respiratory system,24321,175,1.7,0.0000000001996575,1.45,1.97
491.8 ,Other chronic bronchitis,Diseases of the respiratory system,5262,38,1.69,0.0028643896,1.19,2.32
724.9 ,Other unspecified back disorders,Diseases of the musculoskeletal...,14041,101,1.69,0.0000013968244,1.37,2.06
110.9 ,Dermatophytosis of unspecified...,Infectious and parasitic diseases,48693,345,1.69,2.309003e-18,1.51,1.88
438 ,Late effects of cerebrovascular...,Diseases of the circulatory system,7480,54,1.69,0.0003599924,1.27,2.21
781.9 ,Other symptoms involving nervous...,"Comorbidities, signs, and ill-defined...",7603,55,1.69,0.000290241,1.27,2.21
285.9 ,"Anemia, unspecified",Diseases of the blood and blood-forming...,14166,102,1.69,0.0000011329363,1.37,2.06
682.5 ,Cellulitis and abscess of buttock,Diseases of the skin and subcutaneous...,1796,13,1.69,0.0677895528,0.9,2.9
787.3 ,"Flatulence, eructation, and gas...","Comorbidities, signs, and ill-defined...",41598,296,1.69,3.082086e-16,1.5,1.9
353.4 ,"Lumbosacral root lesions, not...",Diseases of the nervous system,5665,41,1.69,0.00207583,1.21,2.3
355.0 ,Lesion of sciatic nerve,Diseases of the nervous system,3198,23,1.68,0.0200660586,1.06,2.53
894.1 ,Multiple and unspecified open...,Injury and poisoning,2359,17,1.68,0.0390948244,0.98,2.7
780.50 ,"Sleep disturbance, unspecified","Comorbidities, signs, and ill-defined...",23334,166,1.68,0.0000000011883823,1.43,1.96
535.40 ,"Other specified gastritis, without...",Diseases of the digestive system,27329,194,1.67,0.00000000005334614,1.44,1.93
995.3 ,"Allergy, unspecified, not elsewhere...",Injury and poisoning,13315,95,1.67,0.0000038857711,1.35,2.05
722.1 ,Displacement of thoracic or lumbar...,Diseases of the musculoskeletal...,4059,29,1.67,0.0108325892,1.12,2.4
723.3 ,Cervicobrachial syndrome (diffuse),Diseases of the musculoskeletal...,5164,37,1.67,0.0037073217,1.18,2.31
133.0 ,Scabies,Infectious and parasitic diseases,7718,55,1.67,0.0004440132,1.25,2.17
582.9 ,Chronic glomerulonephritis with...,Diseases of the genitourinary...,11937,85,1.67,0.0000122754,1.33,2.07
413.9 ,Other and unspecified angina pectoris,Diseases of the circulatory system,27042,191,1.67,0.0000000001428991,1.43,1.92
456.4 ,Scrotal varices,Diseases of the circulatory system,2662,19,1.67,0.0357746151,1,2.61
295.32 ,"Paranoid type schizophrenia, chronic",Mental disorders,2232,16,1.67,0.0494032061,0.95,2.73
873.40 ,"Open wound of face, unspecified...",Injury and poisoning,26866,190,1.67,0.0000000001256691,1.44,1.93
873.43 ,"Open wound of lip, without mention...",Injury and poisoning,2376,17,1.67,0.040366486,0.97,2.68
882.2 ,Open wound of hand except finger(s)...,Injury and poisoning,1820,13,1.67,0.0708945063,0.89,2.86
894 ,Multiple and unspecified open...,Injury and poisoning,4490,32,1.66,0.0079958484,1.14,2.36
721.1 ,Cervical spondylosis with myelopathy,Diseases of the musculoskeletal...,10691,76,1.66,0.0000404906,1.31,2.09
110.4 ,Dermatophytosis of foot,Infectious and parasitic diseases,95795,656,1.66,1.297628e-30,1.53,1.8
574.2 ,Calculus of gallbladder without...,Diseases of the digestive system,5214,37,1.66,0.0039520791,1.17,2.29
726.6 ,Enthesopathy of knee,Diseases of the musculoskeletal...,2113,15,1.66,0.0636173771,0.93,2.74
414.8 ,Other specified forms of chronic...,Diseases of the circulatory system,5347,38,1.66,0.0032327412,1.17,2.28
244.9 ,Unspecified acquired hypothyroidism,"Endocrine, nutritional and metabolic...",1831,13,1.66,0.0724338113,0.88,2.84
780.53 ,"Hypersomnia with sleep apnea,...","Comorbidities, signs, and ill-defined...",3233,23,1.66,0.0210824834,1.05,2.5
272.2 ,Mixed hyperlipidemia,"Endocrine, nutritional and metabolic...",58182,405,1.66,3.070133e-20,1.5,1.84
813.81 ,Closed fracture of unspecified...,Injury and poisoning,2397,17,1.66,0.0575976059,0.96,2.66
705.1 ,Prickly heat,Diseases of the skin and subcutaneous...,5912,42,1.66,0.0025923736,1.19,2.25
110.3 ,Dermatophytosis of groin and perianal...,Infectious and parasitic diseases,44091,307,1.65,0.000000000000001470017,1.47,1.85
573 ,Other disorders of liver,Diseases of the digestive system,2260,16,1.65,0.0517355814,0.94,2.69
216.8 ,Benign neoplasm of other specified...,Neoplasms,3810,27,1.65,0.0127330148,1.09,2.41
854.00 ,Intracranial injury of other and...,Injury and poisoning,10798,76,1.65,0.0000603011,1.3,2.07
367.20 ,"Astigmatism, unspecified",Diseases of the nervous system,2138,15,1.64,0.0659058117,0.91,2.71
009.1 ,"Colitis, enteritis, and gastroenteritis...",Infectious and parasitic diseases,18813,131,1.64,0.00000021745822,1.36,1.95
455.4 ,External thrombosed hemorrhoids,Diseases of the circulatory system,2139,15,1.64,0.0660040154,0.91,2.71
527.2 ,Sialoadenitis,Diseases of the digestive system,2575,18,1.63,0.047728401,0.96,2.59
920 ,"Contusion of face, scalp, and...",Injury and poisoning,22565,156,1.63,0.000000026328714,1.38,1.91
528.9 ,Other and unspecified diseases...,Diseases of the digestive system,45235,310,1.63,0.000000000000007956899,1.45,1.82
927.20 ,Crushing injury of hand(s),Injury and poisoning,2583,18,1.63,0.0482535129,0.96,2.58
780.59 ,Other sleep disturbances,"Comorbidities, signs, and ill-defined...",6031,42,1.63,0.0029610055,1.17,2.2
447.6 ,"Arteritis, unspecified",Diseases of the circulatory system,5162,36,1.63,0.0054599969,1.14,2.26
272.4 ,Other and unspecified hyperlipidemia,"Endocrine, nutritional and metabolic...",109926,737,1.63,7.563281e-32,1.51,1.76
289.3 ,"Lymphadenitis, unspecified, except...",Diseases of the blood and blood-forming...,3142,22,1.63,0.0278220302,1.02,2.48
295.30 ,"Paranoid type schizophrenia, unspecified",Mental disorders,2152,15,1.63,0.0673271804,0.91,2.69
555.9 ,Regional enteritis of unspecified...,Diseases of the digestive system,12129,84,1.62,0.0000368658,1.29,2.01
570 ,Acute and subacute necrosis of...,Diseases of the digestive system,3603,25,1.62,0.0210791733,1.05,2.4
307.41 ,Transient disorder of initiating...,Mental disorders,4481,31,1.62,0.0113997016,1.1,2.3
531.90 ,"Gastric ulcer, unspecified as...",Diseases of the digestive system,28463,194,1.61,0.0000000013497947,1.38,1.85
386.1 ,Other and unspecified peripheral...,Diseases of the nervous system,5366,37,1.61,0.0062740893,1.13,2.23
111 ,"Dermatomycosis, other and unspecified",Infectious and parasitic diseases,2316,16,1.61,0.0765721842,0.92,2.63
112.9 ,Candidiasis of unspecified site,Infectious and parasitic diseases,4350,30,1.61,0.0140582531,1.08,2.3
574.10 ,Calculus of gallbladder with other...,Diseases of the digestive system,4194,29,1.61,0.0170813256,1.08,2.32
788.9 ,Other symptoms involving urinary...,"Comorbidities, signs, and ill-defined...",2604,18,1.61,0.0497412223,0.95,2.56
698.1 ,Pruritus of genital organs,Diseases of the skin and subcutaneous...,2462,17,1.61,0.061377736,0.94,2.59
839.8 ,"Closed dislocation, multiple and...",Injury and poisoning,4643,32,1.61,0.0126869474,1.1,2.28
531.9 ,"Gastric ulcer, unspecified as...",Diseases of the digestive system,5707,39,1.6,0.0059198597,1.13,2.19
721.90 ,"Spondylosis of unspecified site,...",Diseases of the musculoskeletal...,15698,107,1.6,0.0000069329013,1.31,1.94
583 ,"Nephritis and nephropathy, not...",Diseases of the genitourinary...,3056,21,1.6,0.0368530946,0.99,2.46
592.0 ,Calculus of kidney,Diseases of the genitourinary...,55233,372,1.6,1.618323e-16,1.44,1.78
599.9 ,Unspecified disorder of urethra...,Diseases of the genitourinary...,8917,61,1.6,0.0006106385,1.22,2.06
600 ,Hyperplasia of prostate,Diseases of the genitourinary...,44949,304,1.6,0.00000000000006618301,1.42,1.8
854.09 ,Intracranial injury of other and...,Injury and poisoning,3348,23,1.6,0.0327119891,1.01,2.41
933.1 ,Foreign body in larynx,Injury and poisoning,12646,86,1.59,0.0000689667,1.27,1.97
009.2 ,Infectious diarrhea,Infectious and parasitic diseases,23156,157,1.59,0.000000071554748,1.35,1.87
577.1 ,Chronic pancreatitis,Diseases of the digestive system,3818,26,1.59,0.0247490371,1.04,2.33
410.90 ,Acute myocardial infarction of...,Diseases of the circulatory system,2055,14,1.59,0.0889695837,0.87,2.67
594.1 ,Other calculus in bladder,Diseases of the genitourinary...,2350,16,1.59,0.079021336,0.91,2.59
784.0 ,Headache,"Comorbidities, signs, and ill-defined...",193570,1233,1.59,1.402518e-44,1.49,1.69
691.8 ,Other atopic dermatitis and related...,Diseases of the skin and subcutaneous...,29763,201,1.59,0.0000000013447297,1.38,1.83
822.0 ,Closed fracture of patella,Injury and poisoning,2057,14,1.59,0.0892295682,0.87,2.67
883.0 ,"Open wound of finger(s), without...",Injury and poisoning,48320,324,1.59,0.00000000000002483218,1.42,1.78
705.81 ,Dyshidrosis,Diseases of the skin and subcutaneous...,23801,161,1.59,0.000000060674651,1.35,1.86
959.9 ,Unspecified site injury,Injury and poisoning,2363,16,1.58,0.0801189749,0.9,2.57
555.1 ,Regional enteritis of large intestine,Diseases of the digestive system,3550,24,1.58,0.0380739251,1.01,2.35
564 ,"Functional digestive disorders,...",Diseases of the digestive system,27686,186,1.58,0.0000000080247607,1.36,1.83
571.49 ,Other chronic hepatitis,Diseases of the digestive system,17844,120,1.58,0.0000037597858,1.31,1.89
296.30 ,"Major depressive affective disorder,...",Mental disorders,2362,16,1.58,0.0800313936,0.9,2.57
300.5 ,Neurasthenia,Mental disorders,2061,14,1.58,0.0897568749,0.86,2.67
692.9 ,"Contact dermatitis and other eczema,...",Diseases of the skin and subcutaneous...,265685,1639,1.58,2.856817e-53,1.49,1.67
351.0 ,Bell's palsy,Diseases of the nervous system,4587,31,1.58,0.0168082687,1.07,2.25
708.1 ,Idiopathic urticaria,Diseases of the skin and subcutaneous...,5654,38,1.57,0.007969008,1.11,2.16
356.9 ,Unspecified hereditary and idiopathic...,Diseases of the nervous system,10552,71,1.57,0.0004184848,1.23,1.99
511.0 ,Pleurisy without mention of effusion...,Diseases of the respiratory system,2222,15,1.57,0.1003095703,0.88,2.61
372.12 ,Chronic follicular conjunctivitis,Diseases of the nervous system,2821,19,1.57,0.0588979624,0.94,2.46
564.5 ,Functional diarrhea,Diseases of the digestive system,22078,148,1.57,0.00000034084832,1.33,1.85
070.9 ,Unspecified viral hepatitis without...,Infectious and parasitic diseases,12077,81,1.57,0.0001526129,1.24,1.96
099.9 ,"Venereal disease, unspecified",Infectious and parasitic diseases,1929,13,1.57,0.1128615546,0.83,2.7
573.3 ,"Hepatitis, unspecified",Diseases of the digestive system,28478,190,1.57,0.0000000096684291,1.35,1.82
780.52 ,"Insomnia, unspecified","Comorbidities, signs, and ill-defined...",67469,445,1.57,4.445932e-18,1.43,1.73
435.9 ,Unspecified transient cerebral...,Diseases of the circulatory system,3130,21,1.57,0.0531955202,0.97,2.4
