698.8 ,Other specified pruritic conditions,Diseases of the skin and subcutaneous...,7871,16,1.2,0.4106090492,0.68,1.95
709.9 ,Unspecified disorder of skin and...,Diseases of the skin and subcutaneous...,57408,116,1.2,0.0562991552,0.99,1.45
780.6 ,Fever,"Comorbidities, signs, and ill-defined...",114710,230,1.2,0.0103836505,1.04,1.37
782.2 ,"Localized superficial swelling,...","Comorbidities, signs, and ill-defined...",2469,5,1.2,0.6191441268,0.39,2.8
077.1 ,Epidemic keratoconjunctivitis,Infectious and parasitic diseases,18755,38,1.2,0.2828689445,0.85,1.65
786.3 ,Hemoptysis,"Comorbidities, signs, and ill-defined...",4914,10,1.2,0.4871693629,0.58,2.21
296.20 ,"Major depressive affective disorder,...",Mental disorders,2956,6,1.2,0.6490027778,0.44,2.61
307.41 ,Transient disorder of initiating...,Mental disorders,1969,4,1.2,0.5818090201,0.33,3.08
873.49 ,Open wound of other and multiple...,Injury and poisoning,5919,12,1.2,0.5233315805,0.62,2.1
595 ,Cystitis,Diseases of the genitourinary...,3431,7,1.2,0.5320617884,0.48,2.49
597.80 ,"Urethritis, unspecified",Diseases of the genitourinary...,16235,33,1.2,0.2905658217,0.83,1.69
693.8 ,Dermatitis due to other specified...,Diseases of the skin and subcutaneous...,5480,11,1.19,0.5096924636,0.59,2.13
930.0 ,Corneal foreign body,Injury and poisoning,93404,186,1.19,0.0272154728,1.02,1.38
011.90 ,"Pulmonary tuberculosis, unspecified,...",Infectious and parasitic diseases,2974,6,1.19,0.6501254367,0.44,2.6
478.9 ,Other and unspecified diseases...,Diseases of the respiratory system,14955,30,1.19,0.3673086815,0.8,1.7
854.09 ,Intracranial injury of other and...,Injury and poisoning,4975,10,1.19,0.6009999227,0.57,2.19
873 ,Other open wound of head,Injury and poisoning,8451,17,1.19,0.4267047963,0.69,1.91
873.41 ,"Open wound of cheek, without mention...",Injury and poisoning,3957,8,1.19,0.5585929606,0.51,2.36
346.1 ,Common migraine,Diseases of the nervous system,2484,5,1.19,0.6207300794,0.39,2.78
883.2 ,"Open wound of finger(s), with...",Injury and poisoning,5461,11,1.19,0.5084347327,0.59,2.13
599.8 ,Other specified disorders of urethra...,Diseases of the genitourinary...,1981,4,1.19,0.583895861,0.32,3.06
893.0 ,"Open wound of toe(s), without...",Injury and poisoning,10434,21,1.19,0.4023828521,0.73,1.82
702.8 ,Other specified dermatoses,Diseases of the skin and subcutaneous...,4992,10,1.18,0.6016175428,0.57,2.18
704.9 ,Unspecified disease of hair and...,Diseases of the skin and subcutaneous...,2992,6,1.18,0.6512989854,0.43,2.58
757.39 ,Other specified anomalies of skin,Congenital anomalies,2001,4,1.18,0.5874274694,0.32,3.03
475 ,Peritonsillar abscess,Diseases of the respiratory system,17034,34,1.18,0.3478724938,0.82,1.65
110.9 ,Dermatophytosis of unspecified...,Infectious and parasitic diseases,42071,84,1.18,0.1333238223,0.94,1.47
493.00 ,"Extrinsic asthma, unspecified",Diseases of the respiratory system,5488,11,1.18,0.5102340869,0.59,2.12
537.9 ,Unspecified disorder of stomach...,Diseases of the digestive system,2499,5,1.18,0.6223544835,0.38,2.76
873.4 ,"Facial laceration, without mention...",Injury and poisoning,18106,36,1.18,0.3175617775,0.82,1.63
592 ,Calculus of kidney and ureter,Diseases of the genitourinary...,5998,12,1.18,0.5270395252,0.61,2.07
487 ,Influenza,Diseases of the respiratory system,13637,27,1.17,0.4020044831,0.77,1.71
523.0 ,Acute gingivitis,Diseases of the digestive system,4522,9,1.17,0.5840528301,0.54,2.24
704.09 ,Other alopecia,Diseases of the skin and subcutaneous...,4073,8,1.16,0.5684026308,0.5,2.29
919.8 ,Other and unspecified superficial...,Injury and poisoning,5604,11,1.16,0.6225693185,0.58,2.08
924.10 ,Contusion of lower leg,Injury and poisoning,7712,15,1.15,0.576762064,0.64,1.9
959.0 ,Injury to face and neck,Injury and poisoning,2055,4,1.15,0.7834816341,0.31,2.95
285.9 ,"Anemia, unspecified",Diseases of the blood and blood-forming...,12825,25,1.15,0.4502545148,0.74,1.7
916.9 ,Other and unspecified superficial...,Injury and poisoning,2060,4,1.15,0.7837394599,0.31,2.94
695.3 ,Rosacea,Diseases of the skin and subcutaneous...,2591,5,1.14,0.6330959574,0.37,2.66
875.0 ,"Open wound of chest (wall), without...",Injury and poisoning,2075,4,1.14,0.784533926,0.31,2.92
782.1 ,Rash and other nonspecific skin...,"Comorbidities, signs, and ill-defined...",8390,16,1.13,0.5934769831,0.64,1.83
919 ,"Superficial injury of other, multiple,...",Injury and poisoning,3120,6,1.13,0.6610094958,0.42,2.48
692.79 ,Other dermatitis due to solar...,Diseases of the skin and subcutaneous...,5784,11,1.12,0.6301855308,0.56,2.01
054.2 ,Herpetic gingivostomatitis,Infectious and parasitic diseases,2114,4,1.12,0.7867416082,0.3,2.87
112.9 ,Candidiasis of unspecified site,Infectious and parasitic diseases,4215,8,1.12,0.7049889617,0.48,2.21
682.2 ,Cellulitis and abscess of trunk,Diseases of the skin and subcutaneous...,2101,4,1.12,0.785983498,0.31,2.88
921.3 ,Contusion of eyeball,Injury and poisoning,4745,9,1.12,0.7211060177,0.51,2.13
009.1 ,"Colitis, enteritis, and gastroenteritis...",Infectious and parasitic diseases,22437,42,1.11,0.5127276633,0.8,1.5
372.71 ,Hyperemia of conjunctiva,Diseases of the nervous system,2661,5,1.11,0.810183035,0.36,2.59
680.6 ,"Carbuncle and furuncle of leg,...",Diseases of the skin and subcutaneous...,2657,5,1.11,0.8100372566,0.36,2.6
373.1 ,Hordeolum and other deep inflammation...,Diseases of the nervous system,18162,34,1.11,0.5254945219,0.76,1.55
472 ,Chronic pharyngitis and nasopharyngitis,Diseases of the respiratory system,6419,12,1.1,0.6485550648,0.57,1.93
681.02 ,Onychia and paronychia of finger,Diseases of the skin and subcutaneous...,4309,8,1.1,0.7096427947,0.47,2.16
780.8 ,Generalized hyperhidrosis,"Comorbidities, signs, and ill-defined...",6497,12,1.09,0.760824605,0.56,1.91
041.9 ,"Bacterial infection, unspecified,...",Infectious and parasitic diseases,12990,24,1.09,0.6674110184,0.7,1.63
682.4 ,"Cellulitis and abscess of hand,...",Diseases of the skin and subcutaneous...,2710,5,1.09,0.8120965024,0.35,2.55
706.8 ,Other specified diseases of sebaceous...,Diseases of the skin and subcutaneous...,2192,4,1.08,0.7917222599,0.29,2.76
816 ,Fracture of one or more phalangs...,Injury and poisoning,2176,4,1.08,0.7906432689,0.3,2.78
214.9 ,"Lipoma, unspecified site",Neoplasms,2201,4,1.07,0.7923414006,0.29,2.75
565.1 ,Anal fistula,Diseases of the digestive system,3870,7,1.07,0.8430324565,0.43,2.2
918.1 ,Superficial injury of cornea,Injury and poisoning,27639,50,1.07,0.6060626607,0.79,1.41
053.9 ,Herpes zoster without mention...,Infectious and parasitic diseases,13393,24,1.06,0.751221471,0.68,1.58
519.9 ,Unspecified disease of respiratory...,Diseases of the respiratory system,4452,8,1.06,0.8537292653,0.46,2.09
381.4 ,"Nonsuppurative otitis media, not...",Diseases of the nervous system,2821,5,1.05,0.8172356748,0.34,2.45
242.90 ,Thyrotoxicosis without mention...,"Endocrine, nutritional and metabolic...",5773,10,1.02,0.8721934017,0.49,1.88
370.20 ,"Superficial keratitis, unspecified",Diseases of the nervous system,11565,20,1.02,0.9093829001,0.62,1.58
608 ,Other disorders of male genital...,Diseases of the genitourinary...,2899,5,1.02,0.8214330541,0.33,2.38
693.0 ,Dermatitis due to drugs and medicines...,Diseases of the skin and subcutaneous...,5319,9,1,1,0.46,1.9
815.00 ,Closed fracture of metacarpal...,Injury and poisoning,5290,9,1,0.867544699,0.46,1.91
362.6 ,Peripheral retinal degeneration,Diseases of the nervous system,2392,4,0.99,1,0.27,2.53
692.8 ,"Contact dermatitis and other eczema,...",Diseases of the skin and subcutaneous...,3602,6,0.98,1,0.36,2.14
005.9 ,"Food poisoning, unspecified",Infectious and parasitic diseases,2400,4,0.98,1,0.27,2.52
959.8 ,"Other specified sites, including...",Injury and poisoning,3036,5,0.97,1,0.31,2.27
282.4 ,Thalassemias,Diseases of the blood and blood-forming...,5453,9,0.97,1,0.44,1.85
008.5 ,"Bacterial enteritis, unspecified",Infectious and parasitic diseases,4896,8,0.96,1,0.42,1.9
882 ,Open wound of hand except finger(s)...,Injury and poisoning,8022,13,0.96,1,0.51,1.64
580 ,Acute glomerulonephritis,Diseases of the genitourinary...,3108,5,0.95,1,0.31,2.22
931 ,Foreign body in ear,Injury and poisoning,6289,10,0.94,1,0.45,1.73
389.10 ,"Sensorineural hearing loss, unspecified",Diseases of the nervous system,3158,5,0.93,1,0.3,2.18
704.0 ,Alopecia,Diseases of the skin and subcutaneous...,2537,4,0.93,1,0.25,2.39
464.2 ,Acute larygotracheitis,Diseases of the respiratory system,8859,14,0.93,0.8972209846,0.51,1.57
680 ,Carbuncle and furuncle,Diseases of the skin and subcutaneous...,4441,7,0.93,1,0.37,1.92
380.1 ,Infective otitis externa,Diseases of the nervous system,3217,5,0.92,1,0.3,2.14
455.5 ,External hemorrhoids with other...,Diseases of the circulatory system,1956,3,0.9,1,0.19,2.65
276.5 ,Volume depletion,"Endocrine, nutritional and metabolic...",8549,13,0.9,0.7926986741,0.48,1.54
892 ,Open wound of foot except toe(s)...,Injury and poisoning,3966,6,0.89,1,0.33,1.95
696.3 ,Pityriasis rosea,Diseases of the skin and subcutaneous...,7563,11,0.86,0.7782394109,0.43,1.54
487.8 ,Influenza with other manifestations,Diseases of the respiratory system,25391,37,0.86,0.3976727194,0.6,1.19
296.30 ,"Major depressive affective disorder,...",Mental disorders,2063,3,0.86,1,0.18,2.51
533.40 ,Chronic or unspecified peptic...,Diseases of the digestive system,4162,6,0.85,0.8507308166,0.31,1.85
873.50 ,"Open wound of face, unspecified...",Injury and poisoning,2121,3,0.83,1,0.17,2.44
977.9 ,Poisoning by unspecified drug...,Injury and poisoning,2860,4,0.82,1,0.22,2.12
629.9 ,Unspecified disorder of female...,Diseases of the genitourinary...,2190,3,0.81,1,0.17,2.37
709 ,Other disorders of skin and subcutaneous...,Diseases of the skin and subcutaneous...,2201,3,0.8,1,0.17,2.35
786.01 ,Hyperventilation,"Comorbidities, signs, and ill-defined...",2947,4,0.8,1,0.22,2.05
295.34 ,"Paranoid type schizophrenia, chronic...",Mental disorders,2203,3,0.8,1,0.17,2.35
540.9 ,Acute appendicitis without mention...,Diseases of the digestive system,8126,11,0.8,0.5869152357,0.4,1.43
892.1 ,Open wound of foot except toe(s)...,Injury and poisoning,4465,6,0.79,0.715745586,0.29,1.73
608.89 ,Other specified disorders of male...,Diseases of the genitourinary...,2231,3,0.79,1,0.16,2.32
295.32 ,"Paranoid type schizophrenia, chronic",Mental disorders,2253,3,0.78,1,0.16,2.3
298.9 ,Unspecified psychosis,Mental disorders,3030,4,0.78,0.8245656406,0.21,2
464.4 ,Croup,Diseases of the respiratory system,2282,3,0.77,1,0.16,2.27
242.00 ,Toxic diffuse goiter without mention...,"Endocrine, nutritional and metabolic...",2303,3,0.77,1,0.16,2.25
893.1 ,"Open wound of toe(s), complicated",Injury and poisoning,2368,3,0.75,0.8043425757,0.15,2.19
362.60 ,"Peripheral retinal degeneration,...",Diseases of the nervous system,4752,6,0.74,0.5961295048,0.27,1.62
928.20 ,Crushing injury of foot,Injury and poisoning,2438,3,0.73,0.8047681826,0.15,2.12
698.4 ,Dermatitis factitia [artefacta],Diseases of the skin and subcutaneous...,7323,9,0.72,0.3937730809,0.33,1.38
928.3 ,Crushing injury of toe(s),Injury and poisoning,2548,3,0.69,0.80671738,0.14,2.03
927.20 ,Crushing injury of hand(s),Injury and poisoning,4463,5,0.66,0.4645641334,0.21,1.54
780 ,General symptoms,"Comorbidities, signs, and ill-defined...",5318,6,0.66,0.4027748959,0.24,1.45
904.9 ,Injury to blood vessels of unspecified...,Injury and poisoning,2670,3,0.66,0.6389082894,0.14,1.94
110 ,Dermatophytosis,Infectious and parasitic diseases,3699,4,0.64,0.5437954143,0.17,1.63
370.0 ,Corneal ulcer,Diseases of the nervous system,1904,2,0.62,0.7775167677,0.07,2.24
915.0 ,"Abrasion or friction burn of finger(s),...",Injury and poisoning,5710,6,0.62,0.3296241125,0.23,1.35
478 ,Other diseases of upper respiratory...,Diseases of the respiratory system,3225,3,0.55,0.391100097,0.11,1.6
680.2 ,Carbuncle and furuncle of trunk,Diseases of the skin and subcutaneous...,2272,2,0.52,0.6023938252,0.06,1.88
524.60 ,"Temporomandibular joint disorders,...",Diseases of the digestive system,2343,2,0.5,0.4520610375,0.06,1.82
873.43 ,"Open wound of lip, without mention...",Injury and poisoning,3539,3,0.5,0.3030876575,0.1,1.46
360.21 ,Progressive high (degenerative)...,Diseases of the nervous system,3714,3,0.48,0.2316000186,0.1,1.39
494 ,Bronchiectasis,Diseases of the respiratory system,2540,2,0.46,0.4603156403,0.06,1.68
098.0 ,Gonococcal infection (acute) of...,Infectious and parasitic diseases,1909,0,0.31,0.0857568456,,1.14
921.1 ,Contusion of eyelids and periocular...,Injury and poisoning,1969,1,0.3,0.2750966565,0.01,1.67
914 ,Superficial injury of hand(s)...,Injury and poisoning,2310,1,0.25,0.1993892139,0.01,1.42
473 ,Chronic sinusitis,Diseases of the respiratory system,2884,1,0.2,0.1048838688,0.01,1.14
