724 ,Other and unspecified disorders...,Diseases of the musculoskeletal...,4904,20,2.23,0.0011918394,1.36,3.46
681.11 ,Onychia and paronychia of toe,Diseases of the skin and subcutaneous...,3423,14,2.23,0.007254883,1.22,3.76
721.90 ,"Spondylosis of unspecified site,...",Diseases of the musculoskeletal...,15212,61,2.22,0.000000051198323,1.69,2.87
726.32 ,Lateral epicondylitis,Diseases of the musculoskeletal...,9145,37,2.22,0.0000203943,1.56,3.08
593.2 ,"Cyst of kidney, acquired",Diseases of the genitourinary...,2449,10,2.22,0.0173402761,1.06,4.11
487 ,Influenza,Diseases of the respiratory system,9169,37,2.22,0.0000208927,1.55,3.07
723.8 ,Other syndromes affecting cervical...,Diseases of the musculoskeletal...,1720,7,2.21,0.0428089744,0.89,4.58
307.41 ,Transient disorder of initiating...,Mental disorders,3947,16,2.21,0.0040838917,1.26,3.61
374.00 ,"Entropion, unspecified",Diseases of the nervous system,1735,7,2.2,0.0444699768,0.88,4.54
386.19 ,Other peripheral vertigo,Diseases of the nervous system,2474,10,2.2,0.0287265958,1.05,4.07
915.0 ,"Abrasion or friction burn of finger(s),...",Injury and poisoning,1981,8,2.2,0.0329715906,0.95,4.35
716.90 ,"Arthropathy, unspecified, site...",Diseases of the musculoskeletal...,40128,154,2.19,6.503851e-17,1.85,2.59
825.25 ,Closed fracture of metatarsal...,Injury and poisoning,1742,7,2.19,0.0452590853,0.88,4.52
478 ,Other diseases of upper respiratory...,Diseases of the respiratory system,2487,10,2.19,0.0290774296,1.05,4.04
682.7 ,"Cellulitis and abscess of foot,...",Diseases of the skin and subcutaneous...,4004,16,2.18,0.0045091343,1.24,3.56
493.9 ,"Asthma, unspecified",Diseases of the respiratory system,8543,34,2.18,0.0000592454,1.51,3.07
782.2 ,"Localized superficial swelling,...","Comorbidities, signs, and ill-defined...",1506,6,2.17,0.0630525612,0.79,4.74
310.2 ,Postconcussion syndrome,Mental disorders,2011,8,2.17,0.0355026081,0.93,4.28
724.02 ,"Spinal stenosis, lumbar region,...",Diseases of the musculoskeletal...,10430,41,2.16,0.0000147822,1.55,2.95
727.9 ,"Unspecified disorder of synovium,...",Diseases of the musculoskeletal...,3784,15,2.16,0.0063723329,1.21,3.58
680.0 ,Carbuncle and furuncle of face,Diseases of the skin and subcutaneous...,3282,13,2.16,0.0116123027,1.15,3.71
848.9 ,Unspecified site of sprain and...,Injury and poisoning,72431,264,2.16,8.292123e-26,1.89,2.47
924.21 ,Contusion of ankle,Injury and poisoning,2788,11,2.15,0.0220504165,1.07,3.86
532.70 ,Chronic duodenal ulcer without...,Diseases of the digestive system,10486,41,2.15,0.0000155134,1.54,2.93
564.5 ,Functional diarrhea,Diseases of the digestive system,14125,55,2.15,0.00000049520261,1.61,2.82
389.1 ,Sensorineural hearing loss,Diseases of the nervous system,2535,10,2.15,0.0305445243,1.03,3.97
850.0 ,Concussion with no loss of consciousness,Injury and poisoning,5082,20,2.15,0.0024799573,1.31,3.34
726.9 ,Unspecified enthesopathy,Diseases of the musculoskeletal...,5106,20,2.14,0.0025363744,1.3,3.32
850 ,Concussion,Injury and poisoning,3049,12,2.14,0.0162564666,1.1,3.76
493.21 ,Chronic obstructive asthma with...,Diseases of the respiratory system,2547,10,2.14,0.0309536748,1.02,3.95
372.4 ,Pterygium,Diseases of the nervous system,3095,12,2.11,0.0173793532,1.09,3.71
726.12 ,Bicipital tenosynovitis,Diseases of the musculoskeletal...,2581,10,2.11,0.0322054533,1.01,3.9
682.0 ,Cellulitis and abscess of face,Diseases of the skin and subcutaneous...,3362,13,2.11,0.0131625164,1.12,3.62
300.09 ,Other anxiety states,Mental disorders,5181,20,2.11,0.0027485626,1.28,3.27
693.0 ,Dermatitis due to drugs and medicines...,Diseases of the skin and subcutaneous...,4136,16,2.11,0.005744657,1.2,3.44
894.0 ,Multiple and unspecified open...,Injury and poisoning,29623,111,2.11,0.000000000007323636,1.72,2.56
716.60 ,"Unspecified monoarthritis, site...",Diseases of the musculoskeletal...,2061,8,2.11,0.062098498,0.91,4.18
595.0 ,Acute cystitis,Diseases of the genitourinary...,19824,75,2.1,0.000000012884299,1.64,2.65
722.93 ,"Other and unspecified disc disorder,...",Diseases of the musculoskeletal...,5754,22,2.09,0.0016827433,1.3,3.18
708.0 ,Allergic urticaria,Diseases of the skin and subcutaneous...,23806,89,2.09,0.0000000013449137,1.67,2.59
162.9 ,Malignant neoplasm of bronchus...,Neoplasms,3934,15,2.08,0.0083324023,1.16,3.44
428.0 ,"Congestive heart failure, unspecified",Diseases of the circulatory system,11359,43,2.08,0.0000207668,1.5,2.82
274.9 ,"Gout, unspecified","Endocrine, nutritional and metabolic...",85481,297,2.08,6.167324e-26,1.83,2.36
455.3 ,External hemorrhoids without mention...,Diseases of the circulatory system,2088,8,2.08,0.0636042501,0.9,4.13
307.81 ,Tension headache,Mental disorders,15651,59,2.08,0.00000067781344,1.58,2.7
354.0 ,Carpal tunnel syndrome,Diseases of the nervous system,10309,39,2.08,0.0000410448,1.47,2.86
922.9 ,Contusion of unspecified part...,Injury and poisoning,5259,20,2.08,0.0030297507,1.26,3.22
716.98 ,"Arthropathy, unspecified, other...",Diseases of the musculoskeletal...,3154,12,2.07,0.0190248844,1.07,3.64
531.70 ,Chronic gastric ulcer without...,Diseases of the digestive system,7933,30,2.07,0.0003121251,1.39,2.97
009.3 ,Diarrhea of presumed infectious...,Infectious and parasitic diseases,6347,24,2.07,0.0016609397,1.32,3.09
727.00 ,"Synovitis and tenosynovitis, unspecified",Diseases of the musculoskeletal...,69081,244,2.07,5.666176e-22,1.8,2.38
850.9 ,"Concussion, unspecified",Injury and poisoning,5545,21,2.07,0.0023830442,1.28,3.18
357.2 ,Polyneuropathy in diabetes,Diseases of the nervous system,4751,18,2.07,0.0054631486,1.22,3.28
919.8 ,Other and unspecified superficial...,Injury and poisoning,1574,6,2.07,0.0743482512,0.76,4.53
531.30 ,Acute gastric ulcer without mention...,Diseases of the digestive system,6364,24,2.06,0.0016807364,1.32,3.08
722.91 ,"Other and unspecified disc disorder,...",Diseases of the musculoskeletal...,3170,12,2.06,0.0195118088,1.06,3.62
854.00 ,Intracranial injury of other and...,Injury and poisoning,6634,25,2.06,0.0012589276,1.33,3.06
346.9 ,"Migraine, unspecified",Diseases of the nervous system,9585,36,2.06,0.0000985057,1.44,2.87
274.10 ,"Gouty nephropathy, unspecified","Endocrine, nutritional and metabolic...",1861,7,2.05,0.0920502623,0.82,4.23
810.00 ,"Closed fracture of clavicle, unspecified...",Injury and poisoning,2923,11,2.05,0.0265730864,1.02,3.68
474.0 ,Chronic tonsillitis,Diseases of the respiratory system,2918,11,2.05,0.0263764614,1.02,3.69
924.20 ,Contusion of foot,Injury and poisoning,5081,19,2.04,0.0044730588,1.22,3.2
533.9 ,"Peptic ulcer, site unspecified,...",Diseases of the digestive system,27209,99,2.04,0.0000000004340129,1.64,2.5
840 ,Sprains and strains of shoulder...,Injury and poisoning,1864,7,2.04,0.0922801378,0.82,4.23
519.9 ,Unspecified disease of respiratory...,Diseases of the respiratory system,4015,15,2.04,0.01407541,1.14,3.37
724.2 ,Lumbago,Diseases of the musculoskeletal...,156121,496,2.03,6.560631e-36,1.83,2.26
388.3 ,Tinitus,Diseases of the nervous system,8899,33,2.03,0.0002497579,1.39,2.87
722.52 ,Degeneration of lumbar or lumbosacral...,Diseases of the musculoskeletal...,1615,6,2.02,0.0816795032,0.74,4.42
569.9 ,Unspecified disorder of intestine,Diseases of the digestive system,3775,14,2.02,0.019502236,1.1,3.41
784.2 ,"Swelling, mass, or lump in head...","Comorbidities, signs, and ill-defined...",3786,14,2.02,0.0196504741,1.1,3.4
478.9 ,Other and unspecified diseases...,Diseases of the respiratory system,7857,29,2.02,0.0007802983,1.35,2.92
362.0 ,Diabetic retinopathy,Diseases of the nervous system,4048,15,2.02,0.0144566292,1.13,3.35
367.4 ,Presbyopia,Diseases of the nervous system,13924,51,2.02,0.0000087197964,1.5,2.67
719.40 ,"Pain in joint, site unspecified",Diseases of the musculoskeletal...,50476,177,2.01,8.663707e-16,1.71,2.35
533.70 ,Chronic peptic ulcer of unspecified...,Diseases of the digestive system,13519,49,2,0.0000166852,1.47,2.65
719.90 ,"Unspecified disorder of joint,...",Diseases of the musculoskeletal...,2452,9,2,0.0518263891,0.91,3.81
216.4 ,Benign neoplasm of scalp and skin...,Neoplasms,1901,7,2,0.095333343,0.8,4.14
296.2 ,"Major depressive disorder, single...",Mental disorders,1635,6,2,0.1340137038,0.73,4.36
815.00 ,Closed fracture of metacarpal...,Injury and poisoning,1361,5,2,0.110151623,0.65,4.68
595 ,Cystitis,Diseases of the genitourinary...,4385,16,1.99,0.0116130148,1.13,3.24
437.8 ,Other ill-defined cerebrovascular...,Diseases of the circulatory system,1641,6,1.99,0.1346097695,0.73,4.35
455.4 ,External thrombosed hemorrhoids,Diseases of the circulatory system,1366,5,1.99,0.1113970388,0.64,4.66
848 ,Other and ill-defined sprains...,Injury and poisoning,2192,8,1.99,0.0708912518,0.85,3.93
692.8 ,"Contact dermatitis and other eczema,...",Diseases of the skin and subcutaneous...,2732,10,1.99,0.0394368894,0.95,3.68
380.2 ,Other otitis externa,Diseases of the nervous system,2200,8,1.98,0.071548208,0.85,3.91
893.0 ,"Open wound of toe(s), without...",Injury and poisoning,6060,22,1.98,0.0036271717,1.24,3.02
715.31 ,"Osteoarthrosis, localized, not...",Diseases of the musculoskeletal...,2474,9,1.98,0.0533397656,0.9,3.77
949.0 ,"Burn of unspecified site, unspecified...",Injury and poisoning,4150,15,1.97,0.0159474975,1.1,3.26
362.50 ,"Macular degeneration (senile),...",Diseases of the nervous system,4426,16,1.97,0.0121867156,1.12,3.21
532.9 ,"Duodenal ulcer, unspecified as...",Diseases of the digestive system,5296,19,1.96,0.0087948712,1.17,3.07
295.90 ,"Unspecified schizophrenia, unspecified",Mental disorders,1386,5,1.96,0.1164463055,0.63,4.6
923.11 ,Contusion of elbow,Injury and poisoning,2501,9,1.96,0.0553031602,0.89,3.73
382.3 ,Unspecified chronic suppurative...,Diseases of the nervous system,4463,16,1.95,0.0127567834,1.11,3.19
726.19 ,Other specified disorders of bursae...,Diseases of the musculoskeletal...,5869,21,1.95,0.0051508598,1.21,3
787.9 ,Other symptoms involving digestive...,"Comorbidities, signs, and ill-defined...",6713,24,1.95,0.0024635653,1.25,2.92
307.42 ,Persistent disorder of initiating...,Mental disorders,4464,16,1.95,0.01277289,1.11,3.19
693.9 ,Dermatitis due to unspecified...,Diseases of the skin and subcutaneous...,7278,26,1.95,0.0021426094,1.27,2.88
370.00 ,"Corneal ulcer, unspecified",Diseases of the nervous system,3081,11,1.94,0.033984624,0.97,3.49
038.9 ,Unspecified septicemia,Infectious and parasitic diseases,5638,20,1.94,0.0070242276,1.18,3
405.99 ,Other unspecified secondary hypertension,Diseases of the circulatory system,3654,13,1.94,0.0295195566,1.03,3.33
349.9 ,Unspecified disorders of nervous...,Diseases of the nervous system,13621,48,1.94,0.0000455005,1.42,2.59
353.4 ,"Lumbosacral root lesions, not...",Diseases of the nervous system,5074,18,1.94,0.01212654,1.14,3.07
535.10 ,"Atrophic gastritis, without mention...",Diseases of the digestive system,1969,7,1.93,0.1019737405,0.77,4
386.12 ,Vestibular neuronitis,Diseases of the nervous system,7066,25,1.93,0.0029514603,1.25,2.87
573.8 ,Other specified disorders of liver,Diseases of the digestive system,3660,13,1.93,0.0296727265,1.03,3.32
214.9 ,"Lipoma, unspecified site",Neoplasms,2540,9,1.93,0.0583452004,0.88,3.67
560.1 ,Paralytic ileus,Diseases of the digestive system,2555,9,1.92,0.0595799384,0.87,3.65
879.8 ,Open wound(s) (multiple) of unspecified...,Injury and poisoning,11442,40,1.92,0.0001704583,1.37,2.63
722.90 ,"Other and unspecified disc disorder,...",Diseases of the musculoskeletal...,2557,9,1.91,0.0597472834,0.87,3.65
296 ,Disorganized type,Mental disorders,1705,6,1.91,0.1418326229,0.7,4.18
362.10 ,"Background retinopathy, unspecified",Diseases of the nervous system,2854,10,1.91,0.0473109483,0.91,3.52
528.5 ,Diseases of lips,Diseases of the digestive system,1425,5,1.91,0.1983093177,0.62,4.47
009.0 ,"Infectious colitis, enteritis,...",Infectious and parasitic diseases,27339,93,1.9,0.000000039230012,1.52,2.34
783.0 ,Anorexia,"Comorbidities, signs, and ill-defined...",1713,6,1.9,0.1428438226,0.7,4.16
278.0 ,Obesity,"Endocrine, nutritional and metabolic...",2863,10,1.9,0.0479649214,0.91,3.51
682.8 ,Cellulitis and abscess of other...,Diseases of the skin and subcutaneous...,4600,16,1.9,0.0153181385,1.08,3.09
354.2 ,Lesion of ulnar nerve,Diseases of the nervous system,2006,7,1.9,0.1061303373,0.76,3.92
709.0 ,Dyschromia,Diseases of the skin and subcutaneous...,2860,10,1.9,0.0477458068,0.91,3.51
375.15 ,"Tear film insufficiency, unspecified",Diseases of the nervous system,12779,44,1.89,0.0001535344,1.37,2.55
854 ,Intracranial injury of other and...,Injury and poisoning,1437,5,1.89,0.1999368294,0.61,4.43
533.40 ,Chronic or unspecified peptic...,Diseases of the digestive system,6099,21,1.88,0.0067306925,1.16,2.89
054.9 ,Herpes simplex without mention...,Infectious and parasitic diseases,10226,35,1.88,0.0006770887,1.3,2.62
724.5 ,"Backache, unspecified",Diseases of the musculoskeletal...,107575,337,1.88,4.10532e-22,1.66,2.12
242.00 ,Toxic diffuse goiter without mention...,"Endocrine, nutritional and metabolic...",1443,5,1.88,0.2007772864,0.61,4.41
714.9 ,Unspecified inflammatory polyarthropathy,Diseases of the musculoskeletal...,2599,9,1.88,0.0634087672,0.86,3.59
532.40 ,Chronic or unspecified duodenal...,Diseases of the digestive system,1744,6,1.87,0.1469817526,0.68,4.09
571.4 ,Chronic hepatitis,Diseases of the digestive system,51878,170,1.87,0.000000000001053064,1.58,2.19
786.9 ,Other symptoms involving respiratory...,"Comorbidities, signs, and ill-defined...",2037,7,1.87,0.1098990907,0.75,3.86
799.3 ,"Debility, unspecified","Comorbidities, signs, and ill-defined...",1744,6,1.87,0.1469817526,0.68,4.09
491.21 ,Obstructive chronic bronchitis...,Diseases of the respiratory system,6725,23,1.87,0.00595379,1.18,2.81
574.2 ,Calculus of gallbladder without...,Diseases of the digestive system,4114,14,1.85,0.0274818537,1.01,3.12
353.8 ,Other nerve root and plexus disorders,Diseases of the nervous system,1471,5,1.85,0.2049294917,0.6,4.33
884.0 ,Multiple and unspecified open...,Injury and poisoning,24018,80,1.85,0.00000084630814,1.46,2.32
923.9 ,Contusion of unspecified part...,Injury and poisoning,4449,15,1.84,0.03221958,1.02,3.04
533.0 ,"Peptic ulcer, site unspecified...",Diseases of the digestive system,2362,8,1.84,0.0877285294,0.79,3.64
722.0 ,Displacement of cervical intervertebral...,Diseases of the musculoskeletal...,7118,24,1.84,0.0052218749,1.18,2.75
381.81 ,Dysfunction of Eustachian tube,Diseases of the nervous system,7714,26,1.84,0.0045363138,1.2,2.71
571.8 ,Other chronic nonalcoholic liver...,Diseases of the digestive system,11898,40,1.84,0.0004958259,1.31,2.52
780.0 ,Alteration of consciousness,"Comorbidities, signs, and ill-defined...",2360,8,1.84,0.0874959957,0.79,3.65
366.14 ,Posterior subcapsular polar senile...,Diseases of the nervous system,1771,6,1.84,0.1508635861,0.67,4.02
300.4 ,Dysthymic disorder,Mental disorders,21200,70,1.83,0.0000068561863,1.42,2.32
367.0 ,Hypermetropia,Diseases of the nervous system,3569,12,1.83,0.0467316486,0.94,3.21
594.2 ,Calculus in urethra,Diseases of the genitourinary...,2087,7,1.82,0.1165129066,0.73,3.77
785.6 ,Enlargement of lymph nodes,"Comorbidities, signs, and ill-defined...",1788,6,1.82,0.1534368706,0.67,3.99
881.00 ,"Open wound of forearm, without...",Injury and poisoning,6028,20,1.81,0.0144528628,1.1,2.81
715.11 ,"Osteoarthrosis, localized, primary,...",Diseases of the musculoskeletal...,2101,7,1.81,0.1184805267,0.73,3.75
592 ,Calculus of kidney and ureter,Diseases of the genitourinary...,9723,32,1.8,0.0026443363,1.23,2.55
465.8 ,Acute upper respiratory infections...,Diseases of the respiratory system,70237,218,1.79,0.0000000000001084251,1.54,2.06
883.0 ,"Open wound of finger(s), without...",Injury and poisoning,25373,82,1.79,0.000001762553,1.42,2.24
995.3 ,"Allergy, unspecified, not elsewhere...",Injury and poisoning,8906,29,1.78,0.003971217,1.19,2.57
571.0 ,Alcoholic fatty liver,Diseases of the digestive system,3671,12,1.78,0.0521368664,0.92,3.12
578.1 ,Blood in stool,Diseases of the digestive system,2748,9,1.78,0.1101903595,0.81,3.39
786.50 ,"Chest pain, unspecified","Comorbidities, signs, and ill-defined...",40371,128,1.78,0.0000000065922328,1.47,2.13
805.4 ,Closed fracture of lumbar vertebra...,Injury and poisoning,3353,11,1.78,0.0650219423,0.89,3.21
870.0 ,Laceration of skin of eyelid and...,Injury and poisoning,2448,8,1.78,0.0984782017,0.76,3.51
380.1 ,Infective otitis externa,Diseases of the nervous system,2463,8,1.77,0.1484228807,0.76,3.49
726.0 ,Adhesive capsulitis of shoulder,Diseases of the musculoskeletal...,24414,78,1.77,0.000004951113,1.39,2.22
355.9 ,Mononeuritis of unspecified site,Diseases of the nervous system,2459,8,1.77,0.099957516,0.76,3.5
588.9 ,Unspecified disorder resulting...,Diseases of the genitourinary...,4339,14,1.76,0.0474134717,0.96,2.96
427.0 ,Paroxysmal supraventricular tachycardia,Diseases of the circulatory system,3083,10,1.76,0.0861461151,0.84,3.26
595.9 ,"Cystitis, unspecified",Diseases of the genitourinary...,13742,44,1.76,0.0005960056,1.27,2.37
691.8 ,Other atopic dermatitis and related...,Diseases of the skin and subcutaneous...,19376,62,1.76,0.0000439967,1.35,2.27
535.4 ,Other specified gastritis,Diseases of the digestive system,5910,19,1.75,0.0211402966,1.05,2.75
575.0 ,Acute cholecystitis,Diseases of the digestive system,2175,7,1.75,0.129693582,0.7,3.62
476.1 ,Chronic laryngotracheitis,Diseases of the respiratory system,1866,6,1.75,0.166466351,0.64,3.82
372.40 ,"Pterygium, unspecified",Diseases of the nervous system,11955,38,1.74,0.0016861875,1.23,2.4
573.3 ,"Hepatitis, unspecified",Diseases of the digestive system,18316,58,1.74,0.0001141065,1.32,2.27
487.1 ,Influenza with other respiratory...,Diseases of the respiratory system,96617,287,1.74,0.000000000000001009712,1.53,1.98
555.0 ,Regional enteritis of small intestine,Diseases of the digestive system,1879,6,1.73,0.1688250877,0.63,3.79
564.8 ,Other specified function disorder...,Diseases of the digestive system,15880,50,1.73,0.0003605661,1.28,2.29
381.4 ,"Nonsuppurative otitis media, not...",Diseases of the nervous system,2507,8,1.73,0.1516447298,0.75,3.43
788.4 ,Frequency of urination and polyuria,"Comorbidities, signs, and ill-defined...",12642,40,1.73,0.0015677684,1.23,2.37
350.1 ,Trigeminal neuralgia,Diseases of the nervous system,1885,6,1.73,0.1699310759,0.63,3.78
053.19 ,Herpes zoster with other nervous...,Infectious and parasitic diseases,1581,5,1.72,0.2246504048,0.56,4.02
366.10 ,"Senile cataract, unspecified",Diseases of the nervous system,28695,89,1.72,0.0000034496921,1.37,2.13
529.0 ,Glossitis,Diseases of the digestive system,2216,7,1.72,0.136475026,0.69,3.55
367.9 ,Unspecified disorder of refraction...,Diseases of the nervous system,11479,36,1.72,0.0028524782,1.2,2.39
372.11 ,Simple chronic conjunctivitis,Diseases of the nervous system,21965,68,1.71,0.0000606571,1.32,2.18
533.3 ,"Peptic ulcer, site unspecified,...",Diseases of the digestive system,1904,6,1.71,0.1735044907,0.63,3.74
537.9 ,Unspecified disorder of stomach...,Diseases of the digestive system,2862,9,1.71,0.1192446928,0.78,3.26
413.0 ,Angina decubitus,Diseases of the circulatory system,2229,7,1.71,0.1387069705,0.68,3.53
787.7 ,Abnormal feces,"Comorbidities, signs, and ill-defined...",3179,10,1.71,0.0938267892,0.82,3.16
789.0 ,Abdominal pain,"Comorbidities, signs, and ill-defined...",144827,410,1.71,2.660384e-19,1.53,1.91
473.9 ,Unspecified sinusitis (chronic),Diseases of the respiratory system,16397,51,1.71,0.0004397355,1.27,2.26
535.00 ,"Acute gastritis, without mention...",Diseases of the digestive system,96526,281,1.7,0.00000000000002453334,1.49,1.93
721.1 ,Cervical spondylosis with myelopathy,Diseases of the musculoskeletal...,9321,29,1.7,0.0072607599,1.13,2.45
723.0 ,Spinal stenosis in cervical region,Diseases of the musculoskeletal...,4158,13,1.7,0.0663119309,0.9,2.92
382.00 ,Acute suppurative otitis media...,Diseases of the nervous system,3192,10,1.7,0.0949843585,0.81,3.15
780.4 ,Dizziness and giddiness,"Comorbidities, signs, and ill-defined...",141649,400,1.7,1.48877e-18,1.52,1.9
784.0 ,Headache,"Comorbidities, signs, and ill-defined...",135280,383,1.7,7.238707e-18,1.51,1.9
708 ,Urticaria,Diseases of the skin and subcutaneous...,5433,17,1.7,0.0370772715,0.99,2.74
372.1 ,Chronic conjunctivitis,Diseases of the nervous system,33658,102,1.69,0.0000019711459,1.37,2.06
110.9 ,Dermatophytosis of unspecified...,Infectious and parasitic diseases,25891,79,1.69,0.0000246833,1.33,2.12
427.89 ,Other specified cardiac dysrhythmias,Diseases of the circulatory system,5786,18,1.69,0.0308392648,1,2.69
464.11 ,Acute tracheitis with obstruction,Diseases of the respiratory system,6134,19,1.69,0.034237336,1.01,2.65
465.9 ,Acute upper respiratory infections...,Diseases of the respiratory system,559835,1221,1.69,2.089928e-22,1.51,1.89
353.2 ,"Cervical root lesions, not elsewhere...",Diseases of the nervous system,8411,26,1.69,0.014206831,1.1,2.48
370.49 ,Other keratoconjunctivitis,Diseases of the nervous system,2911,9,1.68,0.1239790878,0.77,3.2
401.1 ,Benign essential hypertension,Diseases of the circulatory system,44423,133,1.68,0.000000083949963,1.39,2.01
427.31 ,Atrial fibrillation,Diseases of the circulatory system,4544,14,1.68,0.0565002877,0.91,2.82
466.1 ,Acute bronchiolitis,Diseases of the respiratory system,36215,109,1.68,0.0000012737705,1.37,2.04
478.8 ,Upper respiratory tract hypersensitivity...,Diseases of the respiratory system,1937,6,1.68,0.1799616333,0.62,3.68
919.0 ,"Abrasion or friction burn of other,...",Injury and poisoning,13040,40,1.68,0.0026385043,1.2,2.3
216.9 ,"Benign neoplasm of skin, site...",Neoplasms,17400,53,1.67,0.0006353035,1.25,2.2
786.51 ,Precordial pain,"Comorbidities, signs, and ill-defined...",4562,14,1.67,0.0791497887,0.91,2.81
682.9 ,Cellulitis and abscess of unspecified...,Diseases of the skin and subcutaneous...,38752,116,1.67,0.00000061123922,1.37,2.02
300.5 ,Neurasthenia,Mental disorders,1623,5,1.67,0.2334799117,0.54,3.92
530.1 ,Esophagitis,Diseases of the digestive system,24473,74,1.67,0.0000564853,1.3,2.11
558.2 ,Toxic gastroenteritis and colitis,Diseases of the digestive system,1632,5,1.66,0.2354569805,0.54,3.9
564.1 ,Irritable bowel syndrome,Diseases of the digestive system,47282,140,1.66,0.000000078101838,1.39,1.98
250.0 ,Diabetes Mellitus w/m of complication,"Endocrine, nutritional and metabolic...",33152,99,1.66,0.0000059713606,1.34,2.03
786.5 ,Chest pain,"Comorbidities, signs, and ill-defined...",21618,65,1.66,0.0002030173,1.27,2.12
455.2 ,Internal hemorrhoids with other...,Diseases of the circulatory system,6585,20,1.66,0.0299978061,1.01,2.57
296.20 ,"Major depressive affective disorder,...",Mental disorders,1962,6,1.66,0.1850582418,0.61,3.63
686.0 ,Pyoderma,Diseases of the skin and subcutaneous...,8204,25,1.66,0.0187230568,1.07,2.47
686.9 ,Unspecified local infection of...,Diseases of the skin and subcutaneous...,57557,169,1.66,0.0000000047876246,1.41,1.95
356.9 ,Unspecified hereditary and idiopathic...,Diseases of the nervous system,9881,30,1.66,0.0090942218,1.11,2.38
923.3 ,Contusion of finger,Injury and poisoning,2298,7,1.65,0.2118755926,0.66,3.42
041.9 ,"Bacterial infection, unspecified,...",Infectious and parasitic diseases,6919,21,1.65,0.0328448828,1.02,2.54
782.0 ,Disturbance of skin sensation,"Comorbidities, signs, and ill-defined...",1645,5,1.65,0.2383636902,0.53,3.87
787.0 ,Nausea and vomiting,"Comorbidities, signs, and ill-defined...",21382,64,1.65,0.0002585092,1.26,2.12
873.4 ,"Facial laceration, without mention...",Injury and poisoning,6258,19,1.65,0.0367690667,0.99,2.59
386.00 ,"Minihre's disease, unspecified",Diseases of the nervous system,13330,40,1.64,0.004105157,1.17,2.25
211.5 ,Benign neoplasm of liver and biliary...,Neoplasms,3319,10,1.64,0.1484263627,0.78,3.02
607.84 ,Impotence of organic origin,Diseases of the genitourinary...,13681,41,1.64,0.0033560311,1.17,2.24
706.3 ,Seborrhea,Diseases of the skin and subcutaneous...,7318,22,1.64,0.0274969734,1.02,2.49
364.00 ,"Acute and subacute iridocyclitis,...",Diseases of the nervous system,2653,8,1.64,0.1660650874,0.71,3.24
382.9 ,Unspecified otitis media,Diseases of the nervous system,20581,61,1.63,0.0005129748,1.24,2.11
780.50 ,"Sleep disturbance, unspecified","Comorbidities, signs, and ill-defined...",18483,55,1.63,0.0007012039,1.23,2.14
306 ,Physiological malfunction arising...,Mental disorders,1662,5,1.63,0.2422534248,0.53,3.83
345.9 ,"Epilepsy, unspecified",Diseases of the nervous system,1668,5,1.63,0.2436497167,0.53,3.81
721 ,Spondylosis and allied disorders,Diseases of the musculoskeletal...,6066,18,1.62,0.0494232506,0.95,2.56
111.0 ,Pityriasis versicolor,Infectious and parasitic diseases,11116,33,1.62,0.0099126411,1.11,2.29
729 ,Other disorders of soft tissues,Diseases of the musculoskeletal...,1342,4,1.62,0.3210256471,0.44,4.16
427.9 ,"Cardiac dysrhythmia, unspecified",Diseases of the circulatory system,30772,90,1.62,0.0000336835,1.29,2
435.0 ,Basilar artery syndrome,Diseases of the circulatory system,2008,6,1.62,0.1948761485,0.59,3.55
787.3 ,"Flatulence, eructation, and gas...","Comorbidities, signs, and ill-defined...",29073,85,1.62,0.0000511807,1.28,2.01
927.3 ,Crushing injury of finger(s),Injury and poisoning,3708,11,1.61,0.120197428,0.8,2.9
931 ,Foreign body in ear,Injury and poisoning,3042,9,1.61,0.1389900308,0.73,3.06
535.5 ,Unspecified gastritis & gastroduodenitis,Diseases of the digestive system,12932,38,1.61,0.0068535963,1.13,2.22
555.9 ,Regional enteritis of unspecified...,Diseases of the digestive system,7426,22,1.61,0.0296081725,1.01,2.46
379.90 ,"Disorder of eye, unspecified",Diseases of the nervous system,2021,6,1.61,0.2868737264,0.59,3.52
386.9 ,Unspecified vertiginous syndromes...,Diseases of the nervous system,14626,43,1.61,0.0034266428,1.16,2.18
