009.1 ,"Colitis, enteritis, and gastroenteritis...",Infectious and parasitic diseases,23861,61,1.14,0.3022900933,0.87,1.47
110.3 ,Dermatophytosis of groin and perianal...,Infectious and parasitic diseases,41539,106,1.14,0.1901058725,0.93,1.38
460 ,Acute nasopharyngitis [common...,Diseases of the respiratory system,522566,1285,1.14,0.0001750457,1.06,1.22
478.9 ,Other and unspecified diseases...,Diseases of the respiratory system,14125,36,1.13,0.4225161771,0.79,1.57
285.9 ,"Anemia, unspecified",Diseases of the blood and blood-forming...,12185,31,1.13,0.5006841569,0.77,1.61
372.14 ,Other chronic allergic conjunctivitis,Diseases of the nervous system,59286,150,1.13,0.145649327,0.95,1.33
785.6 ,Enlargement of lymph nodes,"Comorbidities, signs, and ill-defined...",3554,9,1.13,0.720352787,0.51,2.14
930.1 ,Foreign body in conjunctival sac,Injury and poisoning,64441,163,1.13,0.1380211026,0.96,1.32
692.4 ,Contact dermatitis and other eczema...,Diseases of the skin and subcutaneous...,17330,44,1.13,0.4196915723,0.82,1.52
111.0 ,Pityriasis versicolor,Infectious and parasitic diseases,35125,89,1.13,0.2551881515,0.9,1.39
705.1 ,Prickly heat,Diseases of the skin and subcutaneous...,6773,17,1.12,0.6064998417,0.65,1.79
372.10 ,"Chronic conjunctivitis, unspecified",Diseases of the nervous system,129414,324,1.12,0.0509953696,1,1.26
373.12 ,Hordeolum internum,Diseases of the nervous system,61099,153,1.12,0.1779864659,0.94,1.31
380.22 ,Other acute otitis externa,Diseases of the nervous system,20320,51,1.12,0.4127371862,0.83,1.47
443.9 ,"Peripheral vascular disease, unspecified",Diseases of the circulatory system,3167,8,1.12,0.7046066592,0.48,2.22
466.0 ,Acute bronchitis,Diseases of the respiratory system,527780,1280,1.11,0.0015381023,1.04,1.19
215.9 ,Other benign neoplasm of connective...,Neoplasms,5221,13,1.11,0.65977974,0.59,1.9
708.9 ,"Urticaria, unspecified",Diseases of the skin and subcutaneous...,106510,264,1.11,0.1092135891,0.97,1.26
362.41 ,Central serous retinopathy,Diseases of the nervous system,3589,9,1.11,0.7218399881,0.51,2.12
370.40 ,"Keratoconjunctivitis, unspecified",Diseases of the nervous system,5615,14,1.11,0.6705992751,0.6,1.86
373.00 ,"Blepharitis, unspecified",Diseases of the nervous system,16886,42,1.11,0.5131310012,0.8,1.5
373.2 ,Chalazion,Diseases of the nervous system,16393,41,1.11,0.5068306648,0.8,1.51
931 ,Foreign body in ear,Injury and poisoning,7223,18,1.11,0.6180331331,0.66,1.75
388.70 ,"Otalgia, unspecified",Diseases of the nervous system,2412,6,1.11,0.6684985333,0.4,2.41
604.90 ,"Orchitis and epididymitis, unspecified",Diseases of the genitourinary...,5201,13,1.11,0.6588321658,0.59,1.9
009.3 ,Diarrhea of presumed infectious...,Infectious and parasitic diseases,13241,33,1.11,0.5193567603,0.76,1.56
681.11 ,Onychia and paronychia of toe,Diseases of the skin and subcutaneous...,8017,20,1.11,0.6351854637,0.68,1.72
464.11 ,Acute tracheitis with obstruction,Diseases of the respiratory system,11169,28,1.11,0.5469727548,0.74,1.61
472.0 ,Chronic rhinitis,Diseases of the respiratory system,73694,181,1.1,0.2333537812,0.94,1.27
478.1 ,Other diseases of nasal cavity...,Diseases of the respiratory system,35642,88,1.1,0.3663564369,0.88,1.36
535.50 ,"Unspecified gastritis and gastroduodenitis,...",Diseases of the digestive system,133130,326,1.1,0.1176129168,0.98,1.23
372.0 ,Acute conjunctivitis,Diseases of the nervous system,20601,51,1.1,0.460053348,0.82,1.45
786.00 ,"Respiratory abnormality, unspecified","Comorbidities, signs, and ill-defined...",3231,8,1.1,0.7087131788,0.47,2.17
455.3 ,External hemorrhoids without mention...,Diseases of the circulatory system,2830,7,1.1,0.6911659536,0.44,2.27
110.0 ,Dermatophytosis of scalp and beard,Infectious and parasitic diseases,2415,6,1.1,0.6688764694,0.4,2.41
137 ,Late effects of TB,Infectious and parasitic diseases,2423,6,1.1,0.6698928499,0.4,2.4
155.0 ,"Malignant neoplasm of liver, primary",Neoplasms,4056,10,1.1,0.7381513454,0.52,2.02
216.9 ,"Benign neoplasm of skin, site...",Neoplasms,27663,68,1.09,0.4429394262,0.85,1.39
473.9 ,Unspecified sinusitis (chronic),Diseases of the respiratory system,33514,82,1.09,0.4489173549,0.86,1.36
477.9 ,"Allergic rhinitis, cause unspecified",Diseases of the respiratory system,149539,365,1.09,0.109980875,0.98,1.22
709.9 ,Unspecified disorder of skin and...,Diseases of the skin and subcutaneous...,55027,135,1.09,0.3144072964,0.91,1.3
296.90 ,Unspecified episodic mood disorder,Mental disorders,2840,7,1.09,0.6921147826,0.44,2.26
009.0 ,"Infectious colitis, enteritis,...",Infectious and parasitic diseases,64048,156,1.09,0.3080753934,0.92,1.27
680.0 ,Carbuncle and furuncle of face,Diseases of the skin and subcutaneous...,6960,17,1.09,0.7027320464,0.63,1.74
680.8 ,Carbuncle and furuncle of other...,Diseases of the skin and subcutaneous...,3271,8,1.09,0.7116137543,0.47,2.15
429.9 ,"Heart disease, unspecified",Diseases of the circulatory system,4877,12,1.09,0.760499941,0.56,1.91
720.0 ,Ankylosing spondylitis,Diseases of the musculoskeletal...,10290,25,1.08,0.6757195056,0.7,1.6
388.8 ,Other disorders of ear,Diseases of the nervous system,2875,7,1.08,0.6955689999,0.43,2.23
690 ,Erythematosquamous dermatosis,Diseases of the skin and subcutaneous...,22273,54,1.08,0.5688317684,0.81,1.41
472 ,Chronic pharyngitis and nasopharyngitis,Diseases of the respiratory system,7450,18,1.07,0.7126876216,0.64,1.7
706.0 ,Acne varioliformis,Diseases of the skin and subcutaneous...,8308,20,1.07,0.7270411838,0.65,1.66
478.8 ,Upper respiratory tract hypersensitivity...,Diseases of the respiratory system,3738,9,1.07,0.7301400137,0.49,2.03
274.89 ,Gout with other specified manifestations,"Endocrine, nutritional and metabolic...",4133,10,1.07,0.7416624243,0.51,1.98
532.70 ,Chronic duodenal ulcer without...,Diseases of the digestive system,12044,29,1.07,0.6988855232,0.72,1.54
367.9 ,Unspecified disorder of refraction...,Diseases of the nervous system,14986,36,1.07,0.6648362753,0.75,1.48
571.40 ,"Chronic hepatitis, unspecified",Diseases of the digestive system,134186,322,1.07,0.2305301158,0.95,1.2
373.11 ,Hordeolum externum,Diseases of the nervous system,54222,130,1.07,0.4612829391,0.89,1.27
380.10 ,"Infective otitis externa, unspecified",Diseases of the nervous system,76009,183,1.07,0.3476451173,0.92,1.24
070.30 ,Viral hepatitis B without mention...,Infectious and parasitic diseases,42231,102,1.07,0.4666182374,0.87,1.31
708.8 ,Other specified urticaria,Diseases of the skin and subcutaneous...,12141,29,1.06,0.7006341784,0.71,1.53
008.5 ,"Bacterial enteritis, unspecified",Infectious and parasitic diseases,5026,12,1.06,0.7651378992,0.55,1.86
464.1 ,Acute tracheitis,Diseases of the respiratory system,17688,42,1.06,0.6900833801,0.76,1.43
465.0 ,Acute laryngopharyngitis,Diseases of the respiratory system,319220,755,1.06,0.1367713947,0.98,1.15
726.71 ,Achilles bursitis or tendinitis,Diseases of the musculoskeletal...,2527,6,1.05,0.8317837589,0.39,2.3
566 ,Abscess of anal and rectal regions,Diseases of the digestive system,6795,16,1.05,0.7971910878,0.6,1.7
386.00 ,"Minihre's disease, unspecified",Diseases of the nervous system,7581,18,1.05,0.8072645686,0.62,1.67
472.2 ,Chronic nasopharyngitis,Diseases of the respiratory system,25686,60,1.04,0.7401930803,0.79,1.34
250.90 ,"Diabetes with unspecified complication,...","Endocrine, nutritional and metabolic...",8959,21,1.04,0.8226159146,0.64,1.59
372.00 ,"Acute conjunctivitis, unspecified",Diseases of the nervous system,159255,370,1.04,0.5235168793,0.93,1.15
692.79 ,Other dermatitis due to solar...,Diseases of the skin and subcutaneous...,6382,15,1.04,0.7912283724,0.58,1.73
528.9 ,Other and unspecified diseases...,Diseases of the digestive system,42777,99,1.03,0.7566580617,0.83,1.26
535.40 ,"Other specified gastritis, without...",Diseases of the digestive system,25015,58,1.03,0.7880913392,0.78,1.34
601.1 ,Chronic prostatitis,Diseases of the genitourinary...,8614,20,1.03,0.819770886,0.63,1.6
556 ,Idiopathic proctocolitis,Diseases of the digestive system,3485,8,1.02,0.8576684955,0.44,2.01
580 ,Acute glomerulonephritis,Diseases of the genitourinary...,4350,10,1.02,0.8722877479,0.49,1.88
716.90 ,"Arthropathy, unspecified, site...",Diseases of the musculoskeletal...,32210,73,1.01,0.9526416507,0.79,1.27
571.49 ,Other chronic hepatitis,Diseases of the digestive system,15767,36,1.01,0.9325945108,0.71,1.41
571.8 ,Other chronic nonalcoholic liver...,Diseases of the digestive system,15372,35,1.01,0.9317550922,0.7,1.41
592.1 ,Calculus of ureter,Diseases of the genitourinary...,47754,109,1.01,0.8831765028,0.83,1.23
592.9 ,"Urinary calculus, unspecified",Diseases of the genitourinary...,51181,116,1.01,0.9245649703,0.83,1.21
845.10 ,"Sprain of foot, unspecified site",Injury and poisoning,3968,9,1.01,0.867079218,0.46,1.92
465.9 ,Acute upper respiratory infections...,Diseases of the respiratory system,1140868,2569,1,1,0.94,1.07
533.50 ,Chronic or unspecified peptic...,Diseases of the digestive system,2667,6,1,1,0.37,2.18
573.8 ,Other specified disorders of liver,Diseases of the digestive system,4432,10,1,0.8743989665,0.48,1.85
054.9 ,Herpes simplex without mention...,Infectious and parasitic diseases,21692,49,1,0.9425291946,0.74,1.33
462 ,Acute pharyngitis,Diseases of the respiratory system,379397,855,1,0.9845454826,0.93,1.08
463 ,Acute tonsillitis,Diseases of the respiratory system,523552,1181,1,0.9443846015,0.94,1.07
466.1 ,Acute bronchiolitis,Diseases of the respiratory system,77375,172,0.99,0.9073226963,0.84,1.15
472.1 ,Chronic pharyngitis,Diseases of the respiratory system,30638,68,0.99,0.9515478111,0.76,1.25
478 ,Other diseases of upper respiratory...,Diseases of the respiratory system,4054,9,0.99,1,0.45,1.88
461.8 ,Other acute sinusitis,Diseases of the respiratory system,23318,52,0.99,1,0.74,1.3
464.0 ,Acute laryngitis,Diseases of the respiratory system,216542,483,0.99,0.8463101941,0.9,1.09
216.3 ,Benign neoplasm of skin of other...,Neoplasms,4990,11,0.98,1,0.49,1.75
389.10 ,"Sensorineural hearing loss, unspecified",Diseases of the nervous system,3629,8,0.98,1,0.42,1.93
493.00 ,"Extrinsic asthma, unspecified",Diseases of the respiratory system,4585,10,0.97,1,0.46,1.78
728.89 ,"Other disorders of muscle, ligament,...",Diseases of the musculoskeletal...,11852,26,0.97,1,0.64,1.43
372.71 ,Hyperemia of conjunctiva,Diseases of the nervous system,2741,6,0.97,1,0.36,2.12
574.20 ,Calculus of gallbladder without...,Diseases of the digestive system,10509,23,0.97,1,0.61,1.46
595.0 ,Acute cystitis,Diseases of the genitourinary...,23418,51,0.97,0.8895095013,0.72,1.27
595.9 ,"Cystitis, unspecified",Diseases of the genitourinary...,15596,34,0.97,0.9323618207,0.67,1.36
461.9 ,"Acute sinusitis, unspecified",Diseases of the respiratory system,398276,873,0.97,0.3709194779,0.89,1.04
592.0 ,Calculus of kidney,Diseases of the genitourinary...,44339,96,0.96,0.7605993058,0.78,1.18
927.20 ,Crushing injury of hand(s),Injury and poisoning,3226,7,0.96,1,0.39,1.99
110.9 ,Dermatophytosis of unspecified...,Infectious and parasitic diseases,49132,106,0.96,0.6992707086,0.78,1.16
464.20 ,Acute laryngotracheitis without...,Diseases of the respiratory system,78668,170,0.96,0.6167424387,0.82,1.12
214.1 ,Lipoma of other skin and subcutaneous...,Neoplasms,2765,6,0.96,1,0.35,2.1
216.5 ,"Benign neoplasm of skin of trunk,...",Neoplasms,3279,7,0.95,1,0.38,1.96
360.89 ,Other disorders of globe,Diseases of the nervous system,3744,8,0.95,1,0.41,1.87
216.7 ,Benign neoplasm of skin of lower...,Neoplasms,2360,5,0.94,1,0.3,2.2
583.9 ,"Nephritis and nephropathy, not...",Diseases of the genitourinary...,4746,10,0.94,1,0.45,1.72
698.3 ,Lichenification and lichen simplex...,Diseases of the skin and subcutaneous...,26402,56,0.94,0.7432689734,0.71,1.22
698.8 ,Other specified pruritic conditions,Diseases of the skin and subcutaneous...,9056,19,0.93,0.911178896,0.56,1.46
879.9 ,Open wound(s) (multiple) of unspecified...,Injury and poisoning,1918,4,0.93,1,0.25,2.38
372.05 ,Acute atopic conjunctivitis,Diseases of the nervous system,2385,5,0.93,1,0.3,2.18
590.9 ,"Infection of kidney, unspecified",Diseases of the genitourinary...,2394,5,0.93,1,0.3,2.17
933.0 ,Foreign body in pharynx,Injury and poisoning,15247,32,0.93,0.7964531367,0.64,1.32
799.8 ,Other ill-defined conditions,"Comorbidities, signs, and ill-defined...",4303,9,0.93,1,0.42,1.77
052.9 ,Varicella without mention of complication,Infectious and parasitic diseases,7626,16,0.93,0.9034820966,0.53,1.52
704.01 ,Alopecia areata,Diseases of the skin and subcutaneous...,4834,10,0.92,1,0.44,1.69
719.99 ,"Unspecified disorder of joint,...",Diseases of the musculoskeletal...,2887,6,0.92,1,0.34,2.01
373.13 ,Abscess of eyelid,Diseases of the nervous system,9627,20,0.92,0.8290289325,0.56,1.43
586 ,"Renal failure, unspecified",Diseases of the genitourinary...,2407,5,0.92,1,0.3,2.16
280.9 ,"Iron deficiency anemia, unspecified",Diseases of the blood and blood-forming...,2924,6,0.91,1,0.33,1.99
727.01 ,Synovitis and tenosynovitis in...,Diseases of the musculoskeletal...,2448,5,0.91,1,0.29,2.12
933.1 ,Foreign body in larynx,Injury and poisoning,11745,24,0.91,0.7688371822,0.58,1.35
695.89 ,Other specified erythematous conditions,Diseases of the skin and subcutaneous...,4400,9,0.91,1,0.41,1.73
698.2 ,Prurigo,Diseases of the skin and subcutaneous...,51862,107,0.91,0.3969527373,0.75,1.11
523.9 ,Unspecified gingival and periodontal...,Diseases of the digestive system,5429,11,0.9,0.8855695839,0.45,1.61
537.89 ,Other specified disorders of stomach...,Diseases of the digestive system,1966,4,0.9,1,0.25,2.32
727.05 ,Other tenosynovitis of hand and...,Diseases of the musculoskeletal...,4435,9,0.9,1,0.41,1.71
530.9 ,Unspecified disorder of esophagus,Diseases of the digestive system,4491,9,0.89,0.8746697427,0.41,1.69
532.9 ,"Duodenal ulcer, unspecified as...",Diseases of the digestive system,5483,11,0.89,0.8858957517,0.44,1.6
353.1 ,Lumbosacral plexus lesions,Diseases of the nervous system,2002,4,0.89,1,0.24,2.28
362.6 ,Peripheral retinal degeneration,Diseases of the nervous system,2001,4,0.89,1,0.24,2.28
788.0 ,Renal colic,"Comorbidities, signs, and ill-defined...",19925,40,0.89,0.5469079459,0.63,1.21
608.4 ,Other inflammatory disorders of...,Diseases of the genitourinary...,2501,5,0.89,1,0.29,2.08
693.8 ,Dermatitis due to other specified...,Diseases of the skin and subcutaneous...,4975,10,0.89,0.8805432332,0.43,1.64
569.3 ,Hemorrhage of rectum and anus,Diseases of the digestive system,6548,13,0.88,0.7932099384,0.47,1.51
789.9 ,Other symptoms involving abdomen...,"Comorbidities, signs, and ill-defined...",2532,5,0.88,1,0.28,2.05
473.8 ,Other chronic sinusitis,Diseases of the respiratory system,3065,6,0.87,1,0.32,1.9
904.9 ,Injury to blood vessels of unspecified...,Injury and poisoning,2039,4,0.87,1,0.24,2.23
533.70 ,Chronic peptic ulcer of unspecified...,Diseases of the digestive system,13767,27,0.87,0.5275782479,0.57,1.27
608.9 ,Unspecified disorder of male genital...,Diseases of the genitourinary...,9744,19,0.87,0.6669895597,0.52,1.35
698.4 ,Dermatitis factitia [artefacta],Diseases of the skin and subcutaneous...,7703,15,0.86,0.7166609879,0.48,1.43
492.8 ,Other emphysema,Diseases of the respiratory system,2057,4,0.86,1,0.23,2.22
569.9 ,Unspecified disorder of intestine,Diseases of the digestive system,5172,10,0.86,0.7684393345,0.41,1.58
571.41 ,Chronic persistent hepatitis,Diseases of the digestive system,11282,22,0.86,0.6172095067,0.54,1.31
374.05 ,Trichiasis of eyelid without entropion,Diseases of the nervous system,7722,15,0.86,0.7169227263,0.48,1.42
842.10 ,"Sprain of hand, unspecified site",Injury and poisoning,2593,5,0.86,1,0.28,2
693.0 ,Dermatitis due to drugs and medicines...,Diseases of the skin and subcutaneous...,5691,11,0.86,0.7782468372,0.43,1.54
214.9 ,"Lipoma, unspecified site",Neoplasms,3635,7,0.85,0.8604132147,0.34,1.76
532.00 ,"Acute duodenal ulcer with hemorrhage,...",Diseases of the digestive system,2112,4,0.84,1,0.23,2.16
935.1 ,Foreign body in esophagus,Injury and poisoning,2102,4,0.84,1,0.23,2.17
710.2 ,Sicca syndrome,Diseases of the musculoskeletal...,2149,4,0.83,1,0.22,2.12
533.40 ,Chronic or unspecified peptic...,Diseases of the digestive system,6942,13,0.83,0.6111131454,0.44,1.42
477.8 ,Allergic rhinitis due to other...,Diseases of the respiratory system,9773,18,0.82,0.4536347497,0.48,1.29
370.20 ,"Superficial keratitis, unspecified",Diseases of the nervous system,10388,19,0.81,0.4068858849,0.49,1.27
574.10 ,Calculus of gallbladder with other...,Diseases of the digestive system,2746,5,0.81,0.839521125,0.26,1.89
693.1 ,Dermatitis due to food taken internally,Diseases of the skin and subcutaneous...,2733,5,0.81,0.8393911892,0.26,1.9
464.4 ,Croup,Diseases of the respiratory system,2751,5,0.81,0.8395768477,0.26,1.89
714.9 ,Unspecified inflammatory polyarthropathy,Diseases of the musculoskeletal...,2225,4,0.8,0.8242246816,0.22,2.05
461.0 ,Acute maxillary sinusitis,Diseases of the respiratory system,19849,36,0.8,0.2272263386,0.56,1.11
355.9 ,Mononeuritis of unspecified site,Diseases of the nervous system,2246,4,0.79,0.8242826601,0.22,2.03
599.9 ,Unspecified disorder of urethra...,Diseases of the genitourinary...,9523,17,0.79,0.385877217,0.46,1.27
278.0 ,Obesity,"Endocrine, nutritional and metabolic...",5142,9,0.78,0.5549842502,0.35,1.48
716.98 ,"Arthropathy, unspecified, other...",Diseases of the musculoskeletal...,2862,5,0.78,0.8416019696,0.25,1.81
535.01 ,"Acute gastritis, with hemorrhage",Diseases of the digestive system,3433,6,0.78,0.7167198646,0.28,1.69
053.9 ,Herpes zoster without mention...,Infectious and parasitic diseases,14773,26,0.78,0.2226027093,0.51,1.14
531.70 ,Chronic gastric ulcer without...,Diseases of the digestive system,6873,12,0.77,0.4443341333,0.4,1.35
380.23 ,Other chronic otitis externa,Diseases of the nervous system,3455,6,0.77,0.7171990387,0.28,1.68
008.6 ,"Virus Enteritis, specified",Infectious and parasitic diseases,2892,5,0.77,0.6957267793,0.25,1.79
692.8 ,"Contact dermatitis and other eczema,...",Diseases of the skin and subcutaneous...,4018,7,0.77,0.6172210565,0.31,1.6
701.1 ,"Keratoderma, acquired",Diseases of the skin and subcutaneous...,5813,10,0.76,0.4872338578,0.37,1.41
242.00 ,Toxic diffuse goiter without mention...,"Endocrine, nutritional and metabolic...",2946,5,0.75,0.6962324606,0.24,1.76
372.02 ,Acute follicular conjunctivitis,Diseases of the nervous system,7698,13,0.75,0.3964925168,0.4,1.28
077.1 ,Epidemic keratoconjunctivitis,Infectious and parasitic diseases,25402,43,0.75,0.0614408609,0.54,1.01
550.90 ,"Inguinal hernia, without mention...",Diseases of the digestive system,4187,7,0.74,0.6212404575,0.3,1.53
381.4 ,"Nonsuppurative otitis media, not...",Diseases of the nervous system,4173,7,0.74,0.620706868,0.3,1.54
455.0 ,Internal hemorrhoids without mention...,Diseases of the circulatory system,8989,15,0.74,0.3132044979,0.41,1.22
111.8 ,Other specified dermatomycoses,Infectious and parasitic diseases,2468,4,0.72,0.6710819071,0.2,1.84
473.0 ,Chronic maxillary sinusitis,Diseases of the respiratory system,3756,6,0.71,0.4917409234,0.26,1.54
117.9 ,Other and unspecified mycoses,Infectious and parasitic diseases,5623,9,0.71,0.3953439915,0.32,1.35
535.51 ,"Unspecified gastritis and gastroduodenitis,...",Diseases of the digestive system,1890,3,0.7,0.805861781,0.15,2.06
382.0 ,Acute suppurative otitis media,Diseases of the nervous system,2517,4,0.7,0.6719251049,0.19,1.81
099.9 ,"Venereal disease, unspecified",Infectious and parasitic diseases,3169,5,0.7,0.5717122252,0.23,1.64
455.8 ,Unspecified hemorrhoids with other...,Diseases of the circulatory system,14066,22,0.69,0.0891099623,0.43,1.05
379.8 ,Other specified disorders of eye...,Diseases of the nervous system,3890,6,0.68,0.4945462392,0.25,1.49
464.21 ,Acute laryngotracheitis with obstruction,Diseases of the respiratory system,5191,8,0.68,0.3758542024,0.29,1.35
349.89 ,Other specified disorders of nervous...,Diseases of the nervous system,2662,4,0.67,0.5402872006,0.18,1.71
692.89 ,Contact dermatitis and other eczema...,Diseases of the skin and subcutaneous...,18724,28,0.66,0.0294157384,0.44,0.96
540.9 ,Acute appendicitis without mention...,Diseases of the digestive system,6784,10,0.65,0.199314067,0.31,1.2
788.9 ,Other symptoms involving urinary...,"Comorbidities, signs, and ill-defined...",2711,4,0.65,0.5410842299,0.18,1.68
272.9 ,Unspecified disorder of lipoid...,"Endocrine, nutritional and metabolic...",5789,8,0.61,0.2083949639,0.26,1.21
211.5 ,Benign neoplasm of liver and biliary...,Neoplasms,3637,5,0.61,0.3768523246,0.2,1.42
709.0 ,Dyschromia,Diseases of the skin and subcutaneous...,5201,7,0.6,0.1881059074,0.24,1.23
519.8 ,Other diseases of respiratory...,Diseases of the respiratory system,2954,4,0.6,0.4330788222,0.16,1.54
380.13 ,Other acute infections of external...,Diseases of the nervous system,2272,3,0.59,0.5033475382,0.12,1.71
011.90 ,"Pulmonary tuberculosis, unspecified,...",Infectious and parasitic diseases,4564,6,0.58,0.2111925275,0.21,1.27
482.9 ,"Bacterial pneumonia, unspecified",Diseases of the respiratory system,3943,5,0.56,0.2377831403,0.18,1.31
558.2 ,Toxic gastroenteritis and colitis,Diseases of the digestive system,3153,4,0.56,0.3428952241,0.15,1.44
455.9 ,Residual hemorrhoidal skin tags,Diseases of the circulatory system,3164,4,0.56,0.3433363257,0.15,1.44
491.20 ,Obstructive chronic bronchitis...,Diseases of the respiratory system,4025,5,0.55,0.2397377264,0.18,1.29
555.2 ,Regional enteritis of small intestine...,Diseases of the digestive system,4835,6,0.55,0.1690197081,0.2,1.2
367.89 ,Other disorders of refraction...,Diseases of the nervous system,4148,5,0.53,0.1878174756,0.17,1.25
606.9 ,"Male infertility, unspecified",Diseases of the genitourinary...,11949,14,0.52,0.0087395431,0.28,0.87
008.8 ,Intestinal infection due to other...,Infectious and parasitic diseases,2570,3,0.52,0.3976884437,0.11,1.52
597.89 ,Other urethritis,Diseases of the genitourinary...,4379,5,0.51,0.1479925581,0.16,1.18
455.1 ,Internal thrombosed hemorrhoids,Diseases of the circulatory system,2093,2,0.42,0.3473965903,0.05,1.53
110.8 ,Dermatophytosis of other specified...,Infectious and parasitic diseases,3423,3,0.39,0.1015853163,0.08,1.14
372.12 ,Chronic follicular conjunctivitis,Diseases of the nervous system,2625,2,0.34,0.143262667,0.04,1.22
528.5 ,Diseases of lips,Diseases of the digestive system,2651,2,0.33,0.1444554967,0.04,1.21
476.1 ,Chronic laryngotracheitis,Diseases of the respiratory system,2049,1,0.22,0.100844922,0.01,1.21
074.0 ,Herpangina,Infectious and parasitic diseases,1974,1,0.22,0.145386096,0.01,1.25
535.10 ,"Atrophic gastritis, without mention...",Diseases of the digestive system,2450,1,0.18,0.0515035206,0,1.01
